"1807.00764","Keith Hayton","Keith Hayton and Dimitrios Moirogiannis and Marcelo Magnasco","A Nonhyperbolic Toy Model of Cochlear Dynamics",,,,,"physics.bio-ph q-bio.NC","http://arxiv.org/licenses/nonexclusive-distrib/1.0/","  Cochlea displays complex and highly nonlinear behavior in response to
wide-ranging auditory stimuli. While there have been many recent advancements
in the modeling of cochlear dynamics, it remains unclear what mathematical
structures underlie the essential features of the extended cochlea. We
construct a dynamical system consisting of a series of strongly coupled
critical oscillators to show that high-dimensional nonhyperbolic dynamics can
account for high-order compressive nonlinearities, amplification of weak input,
frequency selectivity, and traveling waves of activity. As a single Hopf
bifurcation generically gives rise to features of cochlea at a local level, the
nonhyperbolicity mechanism proposed in this paper can be seen as a
higher-dimensional analogue for the entire extended cochlea.
","[{""version"":""v1"",""created"":""Mon, 2 Jul 2018 16:02:54 GMT""},{""version"":""v2"",""created"":""Mon, 6 Aug 2018 10:32:14 GMT""}]","2018-08-07"
"1807.00765","Peter Horvathy","P.-M. Zhang, M. Cariglia, C. Duval, M. Elbistan, G. W. Gibbons, P.A.
  Horvathy","Ion Traps and the Memory Effect for Periodic Gravitational Waves","Final version: 32 pages. An error in sec. 6 (Lagrange points) pointed
  out for us by Matt Kalinski (to whom we are grateful) is corrected and the
  stability problem clarified. See also our Erratum: Phys. Rev. D 98, 089901(E)
  (2018). Our paper is dedicated to the memory of our friend and collaborator
  Christian Duval, who deceased shortly after our paper was published","Phys. Rev. D 98, 044037 (2018)","10.1103/PhysRevD.98.044037",,"gr-qc astro-ph.CO hep-th physics.class-ph","http://arxiv.org/licenses/nonexclusive-distrib/1.0/","  The Eisenhart lift of a Paul Trap used to store ions in molecular physics is
a linearly polarized periodic gravitational wave. A modified version of
Dehmelt's Penning Trap is in turn related to circularly polarized periodic
gravitational waves, sought for in inflationary models. Similar equations rule
also the Lagrange points in Celestial Mechanics. The explanation is provided by
anisotropic oscillators.
","[{""version"":""v1"",""created"":""Mon, 2 Jul 2018 16:04:11 GMT""},{""version"":""v2"",""created"":""Tue, 10 Jul 2018 00:48:12 GMT""},{""version"":""v3"",""created"":""Thu, 9 Aug 2018 06:44:13 GMT""},{""version"":""v4"",""created"":""Mon, 1 Oct 2018 11:59:22 GMT""},{""version"":""v5"",""created"":""Sun, 14 Oct 2018 08:36:22 GMT""},{""version"":""v6"",""created"":""Thu, 11 Apr 2019 11:31:30 GMT""}]","2019-04-12"
"1807.00766","Abel Lacabanne","Abel Lacabanne","Slightly degenerate categories and $\mathbb{Z}$-modular data","24 pages, added some examples, a theorem of Vafa and removed a mild
  hypothesis in section 3",,"10.1093/imrn/rnz105",,"math.QA math.CT","http://arxiv.org/licenses/nonexclusive-distrib/1.0/","  Given a slightly degenerate fusion category $\mathcal{C}$, we explain how it
naturally gives rise to a Z-modular data. We do not restrict to spherical
categories and work with pivotal categories instead. Finally, we give an
interpretation in this framework of the Bonnaf\'e-Rouquier categorification of
the $\mathbb{Z}$-modular datum associated to non trivial family of the cyclic
complex reflection group.
","[{""version"":""v1"",""created"":""Mon, 2 Jul 2018 16:05:46 GMT""},{""version"":""v2"",""created"":""Tue, 14 Aug 2018 14:19:42 GMT""},{""version"":""v3"",""created"":""Wed, 8 May 2019 20:04:52 GMT""}]","2019-09-13"
"1807.00767","S\'andor Rokob","Tam\'as F. M\'ori, S\'andor Rokob","Moments of general time dependent branching processes with applications","12 pages",,,,"math.PR","http://arxiv.org/licenses/nonexclusive-distrib/1.0/","  In this paper, we give sufficient conditions for a Crump-Mode-Jagers process
to be bounded in $L_k$ for a given $k>1$. This result is then applied to a
recent random graph process motivated by pairwise collaborations and driven by
time-dependent branching dynamics. We show that the maximal degree has the same
rate of increase as the degree process of a fixed vertex.
","[{""version"":""v1"",""created"":""Mon, 2 Jul 2018 16:05:50 GMT""},{""version"":""v2"",""created"":""Wed, 8 May 2019 05:33:51 GMT""}]","2019-05-09"
"1807.00768","Bob Osano","Bob Osano and Timothy Oreta","Multi-fluid Theory and Cosmology: A Convective Variational Approach to
  Interacting Dark-Sector","10 pages. This article builds on the foundational work presented by
  the authors of arXiv:gr-qc/0605010",,"10.1142/S0218271819500780",,"gr-qc","http://arxiv.org/licenses/nonexclusive-distrib/1.0/","  This article examines the foundation of the recently developed relativistic
variational formalism[1]. Our work is heavily based on [2, 27] which extends
this approach to the multi-fluid theory and examines its utility in
astrophysics and cosmology. Unlike the extension to the formalism mentioned
above, that looks at the general interaction between different types of matter,
we use the formalism to examine the interaction involving, ordinary matter,
dark matter (DM) and dark energy (DE). We focus on entrainment phenomena
involving the dark-sector constituents.
","[{""version"":""v1"",""created"":""Mon, 2 Jul 2018 16:06:18 GMT""},{""version"":""v2"",""created"":""Tue, 31 Jul 2018 20:44:58 GMT""}]","2019-05-22"
"1807.00769","Ralf-Peter Mundani","Jovana Kne\v{z}evi\'c (1), Ralf-Peter Mundani (1), Ernst Rank (1) ((1)
  Technische Universit\""at M\""unchen, Munich, Germany)","A high-performance interactive computing framework for engineering
  applications","23 pages, 9 figures","Advanced Computing, Lecture Notes in Computational Science and
  Engineering 93 (2013) 177-199","10.1007/978-3-642-38762-3_9",,"cs.DC","http://arxiv.org/licenses/nonexclusive-distrib/1.0/","  To harness the potential of advanced computing technologies, efficient (real
time) analysis of large amounts of data is as essential as are front-line
simulations. In order to optimise this process, experts need to be supported by
appropriate tools that allow to interactively guide both the computation and
data exploration of the underlying simulation code. The main challenge is to
seamlessly feed the user requirements back into the simulation.
State-of-the-art attempts to achieve this, have resulted in the insertion of
so-called check- and break-points at fixed places in the code. Depending on the
size of the problem, this can still compromise the benefits of such an attempt,
thus, preventing the experience of real interactive computing. To leverage the
concept for a broader scope of applications, it is essential that a user
receives an immediate response from the simulation to his or her changes. Our
generic integration framework, targeted to the needs of the computational
engineering domain, supports distributed computations as well as on-the-fly
visualisation in order to reduce latency and enable a high degree of
interactivity with only minor code modifications. Namely, the regular course of
the simulation coupled to our framework is interrupted in small, cyclic
intervals followed by a check for updates. When new data is received, the
simulation restarts automatically with the updated settings (boundary
conditions, simulation parameters, etc.). To obtain rapid, albeit approximate
feedback from the simulation in case of perpetual user interaction, a
multi-hierarchical approach is advantageous. Within several different
engineering test cases, we will demonstrate the flexibility and the
effectiveness of our approach.
","[{""version"":""v1"",""created"":""Mon, 2 Jul 2018 16:08:03 GMT""}]","2018-07-03"
"1807.00770","Abel Lacabanne","Abel Lacabanne","Drinfeld double of quantum groups, tilting modules and
  $\mathbb{Z}$-modular data associated to complex reflection groups","42 pages, some comments added on a conjecture of Cuntz",,,,"math.QA math.RT","http://arxiv.org/licenses/nonexclusive-distrib/1.0/","  Generalizing Lusztig's work, Malle has associated to some imprimitive complex
reflection group $W$ a set of ""unipotent characters"", which are in bijection of
the usual unipotent characters of the associated finite reductive group if $W$
is a Weyl group. He also obtained a partition of these characters into families
and associated to each family a $\mathbb{Z}$-modular datum. We construct a
categorification of some of these data, by studying the category of tilting
modules of the Drinfeld double of the quantum enveloping algebra of the Borel
of a simple complex Lie algebra.
","[{""version"":""v1"",""created"":""Mon, 2 Jul 2018 16:08:25 GMT""},{""version"":""v2"",""created"":""Thu, 11 Oct 2018 15:40:21 GMT""}]","2018-10-12"
"1807.00771","Anton Andreychuk","Anton Andreychuk and Konstantin Yakovlev","Path Finding for the Coalition of Co-operative Agents Acting in the
  Environment with Destructible Obstacles","10 pages, 7 figures, conference paper, ICR 2018",,,,"cs.AI cs.MA","http://arxiv.org/licenses/nonexclusive-distrib/1.0/","  The problem of planning a set of paths for the coalition of robots (agents)
with different capabilities is considered in the paper. Some agents can modify
the environment by destructing the obstacles thus allowing the other ones to
shorten their paths to the goal. As a result the mutual solution of lower cost,
e.g. time to completion, may be acquired. We suggest an original procedure to
identify the obstacles for further removal that can be embedded into almost any
heuristic search planner (we use Theta*) and evaluate it empirically. Results
of the evaluation show that time-to-complete the mission can be decreased up to
9-12 % by utilizing the proposed technique.
","[{""version"":""v1"",""created"":""Mon, 2 Jul 2018 16:15:35 GMT""}]","2018-07-03"
"1807.00772","Dani Atkinson","Dani Atkinson","HgCdTe APD Arrays for Astronomy: Natural Guide Star Wavefront Sensing
  and Space Astronomy","PhD thesis Successfully defended 9 May 2018. 126 pages. Committee
  members were Donald Hall, Christoph Baranec, Jessica Lu, Jeffrey Kuhn, and
  John Learned",,,,"astro-ph.IM","http://arxiv.org/licenses/nonexclusive-distrib/1.0/","  This dissertation describes work I have conducted over five academic years
2013/14 through 2017/18 as a NASA Space Technology Research Fellow at the
University of Hawai'i Institute for Astronomy. The focus has been the
characterization and improvement of the Selex Avalanche Photodiode HgCdTe
InfraRed Array (SAPHIRA), a 320 x 256@24um pitch metal organic vapor phase
epitaxy mercury cadmium telluride array that provides new capabilities and
performance for near infrared (NIR) astronomy. This has involved more than a
dozen arrays, working closely with the manufacturer so as to provide feedback
for improvement of the next generation.
","[{""version"":""v1"",""created"":""Mon, 2 Jul 2018 16:15:58 GMT""}]","2018-07-03"
"1807.00773","Jorge Lillo-Box","J. Lillo-Box, A. Leleu, H. Parviainen, P. Figueira, M. Mallonn, A.C.M.
  Correia, N.C. Santos, P. Robutel, M. Lendl, H.M.J. Boffin, J.P. Faria, D.
  Barrado, J. Neal","The TROY project: II. Multi-technique constraints on exotrojans in nine
  planetary systems","Accepted for publication in A&A, 18 pages, 13 figures, 12 tables.
  TROY project website: http://www.sc.eso.org/~jlillobo/troy/","A&A 618, A42 (2018)","10.1051/0004-6361/201833312",,"astro-ph.EP","http://arxiv.org/licenses/nonexclusive-distrib/1.0/","  Co-orbital bodies are the byproduct of planet formation and evolution, as we
know from the Solar System. Although planet-size co-orbitals do not exists in
our planetary system, dynamical studies show that they can remain stable for
long periods of time in the gravitational well of massive planets. Should they
exist, their detection is feasible with the current instrumentation. In this
paper, we present new ground-based observations searching for these bodies
co-orbiting with nine close-in (P<5 days) planets, using different observing
techniques. The combination of all of them allows us to restrict the parameter
space of any possible trojan in the system. We use multi-technique observations
(radial velocity, precision photometry and transit timing variations), both
newly acquired in the context of the TROY project and publicly available, to
constrain the presence of planet-size trojans in the Lagrangian points of nine
known exoplanets. We find no clear evidence of trojans in these nine systems
through any of the techniques used down to the precision of the observations.
However, this allows us to constrain the presence of any potential trojan in
the system, specially in the trojan mass/radius versus libration amplitude
plane. In particular, we can set upper mass limits in the super-Earth mass
regime for six of the studied systems.
","[{""version"":""v1"",""created"":""Mon, 2 Jul 2018 16:18:27 GMT""}]","2018-10-17"
"1807.00774","Clemens Kieninger","Clemens Kieninger, Yasar Kutuvantavida, Hiroki Miura, Juned N. Kemal,
  Heiner Zwickel, Feng Qiu, Matthias Lauermann, Wolfgang Freude, Sebastian
  Randel, Shiyoshi Yokoyama, and Christian Koos","Demonstration of long-term thermally stable Silicon-Organic Hybrid
  Modulators at 85 {\deg}C",,"Opt. Express 26 (2018) 27955-27964","10.1364/OE.26.027955",,"physics.app-ph","http://arxiv.org/licenses/nonexclusive-distrib/1.0/","  We report on the first demonstration of long-term thermally stable
silicon-organic hybrid (SOH) modulators in accordance with Telcordia standards
of high-temperature storage. The devices rely on an organic electro-optic
sidechain polymer with a high glass transition temperature of 172 {\deg}C. In
our high-temperature storage experiments at 85 {\deg}C, we find that the
electro-optic activity converges to a constant long-term stable level after an
initial decay. If we consider a burn-in time of 300 h, the {\pi}-voltage of the
modulators increases on average by less than 15 % if we store the devices for
additional 2400 h. The performance of the devices is demonstrated by generating
high-quality 40 Gbit/s OOK signals both after the burn-in period and after
extended high-temperature storage.
","[{""version"":""v1"",""created"":""Mon, 2 Jul 2018 16:28:42 GMT""}]","2019-01-14"
"1807.00775","Sven Buechel","Sven Buechel and Udo Hahn","Representation Mapping: A Novel Approach to Generate High-Quality
  Multi-Lingual Emotion Lexicons","Published in LREC 2018",,,,"cs.CL","http://arxiv.org/licenses/nonexclusive-distrib/1.0/","  In the past years, sentiment analysis has increasingly shifted attention to
representational frameworks more expressive than semantic polarity (being
positive, negative or neutral). However, these richer formats (like Basic
Emotions or Valence-Arousal-Dominance, and variants therefrom), rooted in
psychological research, tend to proliferate the number of representation
schemes for emotion encoding. Thus, a large amount of representationally
incompatible emotion lexicons has been developed by various research groups
adopting one or the other emotion representation format. As a consequence, the
reusability of these resources decreases as does the comparability of systems
using them. In this paper, we propose to solve this dilemma by methods and
tools which map different representation formats onto each other for the sake
of mutual compatibility and interoperability of language resources. We present
the first large-scale investigation of such representation mappings for four
typologically diverse languages and find evidence that our approach produces
(near-)gold quality emotion lexicons, even in cross-lingual settings. Finally,
we use our models to create new lexicons for eight typologically diverse
languages.
","[{""version"":""v1"",""created"":""Mon, 2 Jul 2018 16:29:34 GMT""}]","2018-07-03"
"1807.00776","Suzana Blesic M","Darko Sarvan, Djordje Stratimirovic, Suzana Blesic, Vladimir
  Djurdjevic, Vladimir Miljkovic, Jelena Ajtic","Dynamics of beryllium-7 specific activity in relation to meteorological
  variables, tropopause height, teleconnection indices and sunspot number","27 pages, 7 figures, 1table","Physica A: Statistical Mechanics and its Applications, Volume 469,
  2017, Pages 813-823, ISSN 0378-4371","10.1016/j.physa.2016.11.040",,"physics.data-an physics.ao-ph","http://creativecommons.org/licenses/by-nc-sa/4.0/","  The dynamics of the beryllium-7 specific activity in surface air over
1987--2011 is analyzed using wavelet transform (WT) analysis and time-dependent
detrended moving average (tdDMA) method. WT analysis gives four periodicities
in the beryllium-7 specific activity: one month, three months, one year, and
three years. These intervals are further used in tdDMA to calculate local
autocorrelation exponents for precipitation, tropopause height and
teleconnection indices. Our results show that these parameters share common
periods with the beryllium-7 surface concentration. tdDMA method indicates that
on the characteristic intervals of one year and shorter, the beryllium-7
specific activity is strongly autocorrelated. On the three-year interval, the
beryllium-7 specific activity shows periods of anticorrelation, implying slow
changes in its dynamics that become evident only over a prolonged period of
time. A comparison of the Hurst exponents of all the variables on the one- and
three-year intervals suggest some similarities in their dynamics. Overall, a
good agreement in the behavior of the teleconnection indices and specific
activity of beryllium-7 in surface air is noted.
","[{""version"":""v1"",""created"":""Mon, 2 Jul 2018 16:32:42 GMT""}]","2018-07-03"
"1807.00777","Veronica L. Vildosola","Diego Rubi, Ana Mar\'ia Llois, Ver\'onica Vildosola","Comment on ""Evidence for absence of metallic surface states in
  BiO2-terminated BaBiO3 thin films""",,,,,"cond-mat.mtrl-sci cond-mat.mes-hall","http://arxiv.org/licenses/nonexclusive-distrib/1.0/","  In a recent work by Ji Seop Oh et al., BaBiO3(001) thin films were grown on
SrTiO3 by Pulsed Laser Deposition. It was argued that the films are
BiO2-terminated from the modelling of angle-resolved photoemission spectroscopy
experiments. The authors claim, in opposition to previous theoretical
predictions, that there are no metallic surface states on their films. In this
short comment we question that the authors have enough evidence to make such a
claim, as we consider that the large mismatch between SrTiO3 and BaBiO3 and the
lack of control of their fabrication process with reflection high energy
electron difraction could unlikely give high quality films with a single BiO2-
termination, which is one of the requisites for the stabilization of these
surface metallic states.
","[{""version"":""v1"",""created"":""Mon, 2 Jul 2018 16:34:45 GMT""}]","2018-07-03"
"1807.00778","Amy Lloyd-Stubbs","Amy Lloyd-Stubbs and John McDonald","The KSVZ Axion Model with Quasi-Degenerate Minima: A Unified Model for
  Dark Matter and Dark Energy","13 pages, 6 figures. Additional discussion. Version published in
  Physical Review D","Phys. Rev. D 99, 023510 (2019)","10.1103/PhysRevD.99.023510",,"hep-ph astro-ph.CO","http://arxiv.org/licenses/nonexclusive-distrib/1.0/","  We consider the possibility that dark matter and dark energy can be explained
by the minimal KSVZ axion model. This is possible if the lowest energy
metastable minimum of the scalar potential has zero energy density, which is
possible in theoretical models of vacuum energy cancellation based on spacetime
averaging and in models based on energy parity. Dark energy is then understood
as being due to the energy density of the metastable electroweak vacuum
relative to a second quasi-degenerate metastable minimum. The requirement of
quasi-degenerate minima is a non-trivial condition which completely determines
the form of the potential for a given value of the axion decay constant,
$f_{a}$, and the PQ scalar self-coupling, $\lambda_{\phi}$. The existence of
the second quasi-degenerate minimum imposes a new lower bound on the axion
decay constant, $f_{a} \geq 2.39 \times 10^{10} \, \lambda_{\phi}^{-1/4}$ GeV.
If the PQ symmetry is broken after inflation then the lower bound on $f_{a}$
implies a lower bound on the amount of axion dark matter,
$\Omega_{a}/\Omega_{dm} \geq (0.28-0.46)\,\lambda_{\phi}^{-0.291}$, where the
range is due to the uncertainty in the amount of axion dark matter produced by
vacuum realignment, cosmic strings and domain walls, therefore at least 30$\%$
of dark matter must be due to axions if $\lambda_{\phi} \lesssim 1$. When
axions constitute all of the dark matter and the PQ symmetry is broken after
inflation, $f_{a}$, and so the form of the scalar potential, is completely
fixed for a given value of $\lambda_{\phi}$, with only a weak dependence on
$\lambda_{\phi}$. This will allow the inflation and post-inflation evolution of
the model to be quantitatively studied for a given inflation model and
dimensionally natural values of $\lambda_{\phi}$.
","[{""version"":""v1"",""created"":""Mon, 2 Jul 2018 16:42:26 GMT""},{""version"":""v2"",""created"":""Thu, 19 Jul 2018 13:20:49 GMT""},{""version"":""v3"",""created"":""Mon, 14 Jan 2019 19:52:13 GMT""}]","2019-01-16"
"1807.00779","Lun Yue","Lun Yue, Philipp Wustelt, A. Max Sayler, Gerhard G. Paulus, Stefanie
  Gr\""afe","Strong-Field Polarizability-Enhanced Dissociative Ionization","7 pages","Phys. Rev. A 98, 043418 (2018)","10.1103/PhysRevA.98.043418",,"physics.atom-ph","http://arxiv.org/licenses/nonexclusive-distrib/1.0/","  We investigate dissociative single and double ionization of HeH+ induced by
intense femtosecond laser pulses. By employing a semi-classical model with
nuclear trajectories moving on field-dressed surfaces and ionization events
treated as stochastical jumps, we identify a strong-field mechanism wherein the
molecules dynamically align along the laser polarization axis and stretch
towards a critical internuclear distance before getting dissociative ionized.
As the tunnel-ionization rate is greater for larger internuclear distance and
for aligned samples, ionization is enhanced. The strong dynamical rotation is
traced back to a maximum in the parallel component of the
internuclear-distance-dependent polarizability tensor. Qualitative agreement
with our experimental observations is found. Finally the criteria for observing
the isotope effect for the ion angular distribution is discussed.
","[{""version"":""v1"",""created"":""Mon, 2 Jul 2018 16:43:38 GMT""}]","2018-10-24"
"1807.00780","Pengqian Yu","Xinhan Di, Pengqian Yu, Meng Tian","Ambient Hidden Space of Generative Adversarial Networks","Accepted for publication in Uncertainty in Deep Learning Workshop at
  Uncertainty in Artificial Intelligence (UAI) 2018","Uncertainty in Deep Learning Workshop at Uncertainty in Artificial
  Intelligence (UAI) 2018",,,"cs.LG cs.AI cs.CV stat.ML","http://arxiv.org/licenses/nonexclusive-distrib/1.0/","  Generative adversarial models are powerful tools to model structure in
complex distributions for a variety of tasks. Current techniques for learning
generative models require an access to samples which have high quality, and
advanced generative models are applied to generate samples from noisy training
data through ambient modules. However, the modules are only practical for the
output space of the generator, and their application in the hidden space is not
well studied. In this paper, we extend the ambient module to the hidden space
of the generator, and provide the uniqueness condition and the corresponding
strategy for the ambient hidden generator in the adversarial training process.
We report the practicality of the proposed method on the benchmark dataset.
","[{""version"":""v1"",""created"":""Mon, 2 Jul 2018 16:51:27 GMT""}]","2018-07-03"
"1807.00781","Harvey B. Meyer","Harvey B. Meyer","Euclidean correlators at imaginary spatial momentum and their relation
  to the thermal photon emission rate","16 pages, 1 figure",,"10.1140/epja/i2018-12633-0","MITP/18-054","hep-lat hep-ph","http://arxiv.org/licenses/nonexclusive-distrib/1.0/","  The photon emission rate of a thermally equilibrated system is determined by
the imaginary part of the in-medium retarded correlator of the electromagnetic
current transverse to the spatial momentum of the photon. In a
Lorentz-covariant theory, this correlator can be parametrized by a scalar
function ${\cal G}_R(u\cdot {\cal K},{\cal K}^2)$, where $u$ is the fluid
four-velocity and ${\cal K}$ corresponds to the momentum of the photon. We
propose to compute the analytic continuation of ${\cal G}_R(u\cdot {\cal
K},{\cal K}^2)$ at fixed, vanishing virtuality ${\cal K}^2$, to imaginary
values of the first argument, $u\cdot {\cal K}= i\omega_n$. At these
kinematics, the retarded correlator is equal to the Euclidean correlator
$G_E(\omega_n, k=i\omega_n)$, whose first argument is the Matsubara frequency
and the second is the spatial momentum. The Euclidean correlator, which is
directly accessible in lattice QCD simulations, must be given an imaginary
spatial momentum in order to realize the photon on-shell condition. Via a
once-subtracted dispersion relation that we derive in a standard way at fixed
${\cal K}^2=0$, the Euclidean correlator with imaginary spatial momentum is
related to the photon emission rate. The relation allows for a more direct
probing of the real-photon emission rate of the quark-gluon plasma in lattice
QCD than the dispersion relations which have been used so far, the latter being
at fixed spatial photon momentum $k$ and thus involving all possible
virtualities of the photon.
","[{""version"":""v1"",""created"":""Mon, 2 Jul 2018 16:52:09 GMT""}]","2018-12-05"
