"1807.01019","Martin Zaefferer","Martin Zaefferer, J\""org Stork, Oliver Flasch, Thomas Bartz-Beielstein","Linear Combination of Distance Measures for Surrogate Models in Genetic
  Programming","The final authenticated version of this publication will appear in
  the proceedings of the 15th International Conference on Parallel Problem
  Solving from Nature 2018 (PPSN XV), published in the LNCS by Springer",,,,"cs.NE","http://arxiv.org/licenses/nonexclusive-distrib/1.0/","  Surrogate models are a well established approach to reduce the number of
expensive function evaluations in continuous optimization. In the context of
genetic programming, surrogate modeling still poses a challenge, due to the
complex genotype-phenotype relationships. We investigate how different
genotypic and phenotypic distance measures can be used to learn Kriging models
as surrogates. We compare the measures and suggest to use their linear
combination in a kernel.
  We test the resulting model in an optimization framework, using symbolic
regression problem instances as a benchmark. Our experiments show that the
model provides valuable information. Firstly, the model enables an improved
optimization performance compared to a model-free algorithm. Furthermore, the
model provides information on the contribution of different distance measures.
The data indicates that a phenotypic distance measure is important during the
early stages of an optimization run when less data is available. In contrast,
genotypic measures, such as the tree edit distance, contribute more during the
later stages.
","[{""version"":""v1"",""created"":""Tue, 3 Jul 2018 08:32:52 GMT""}]","2018-07-04"
"1807.01020","Maarten Bieshaar","Stephan Deist, Maarten Bieshaar, Jens Schreiber, Andre Gensler,
  Bernhard Sick","Coopetitive Soft Gating Ensemble","8 pages, 10 figures, 4 tables, submitted (accepted for publication) -
  SISSY 2018 - Workshop on Self-Improving System Integration at IEEE ICAC/ SASO
  2018",,,,"cs.LG stat.ML","http://arxiv.org/licenses/nonexclusive-distrib/1.0/","  In this article, we propose the Coopetititve Soft Gating Ensemble or CSGE for
general machine learning tasks and interwoven systems. The goal of machine
learning is to create models that generalize well for unknown datasets. Often,
however, the problems are too complex to be solved with a single model, so
several models are combined. Similar, Autonomic Computing requires the
integration of different systems. Here, especially, the local, temporal online
evaluation and the resulting (re-)weighting scheme of the CSGE makes the
approach highly applicable for self-improving system integrations. To achieve
the best potential performance the CSGE can be optimized according to arbitrary
loss functions making it accessible for a broader range of problems. We
introduce a novel training procedure including a hyper-parameter initialisation
at its heart. We show that the CSGE approach reaches state-of-the-art
performance for both classification and regression tasks. Further on, the CSGE
provides a human-readable quantification on the influence of all base
estimators employing the three weighting aspects. Moreover, we provide a
scikit-learn compatible implementation.
","[{""version"":""v1"",""created"":""Tue, 3 Jul 2018 08:33:01 GMT""},{""version"":""v2"",""created"":""Thu, 16 Aug 2018 10:50:05 GMT""}]","2018-08-17"
"1807.01021","Xueliang Li","Xuqing Bai, Hong Chang, Xueliang Li","More on limited packings in graphs","22 pages",,,,"math.CO","http://arxiv.org/licenses/nonexclusive-distrib/1.0/","  A set $B$ of vertices in a graph $G$ is called a \emph{$k$-limited packing}
if for each vertex $v$ of $G$, its closed neighbourhood has at most $k$
vertices in $B$. The \emph{$k$-limited packing number} of a graph $G$, denoted
by $L_k(G)$, is the largest number of vertices in a $k$-limited packing in $G$.
The concept of the $k$-limited packing of a graph was introduced by Gallant et
al., which is a generalization of the well-known packing of a graph. In this
paper, we present some tight bounds for the $k$-limited packing number of a
graph in terms of its order, diameter, girth, and maximum degree, respectively.
As a result, we obtain the tight Nordhaus-Gaddum-type result of this parameter
for general $k$. At last, we investigate the relationship among the open
packing number, the packing number and $2$-limited packing number of trees.
","[{""version"":""v1"",""created"":""Tue, 3 Jul 2018 08:34:05 GMT""}]","2018-07-04"
"1807.01022","Guillaume Chapuy","Guillaume Chapuy, Guillem Perarnau","On the number of coloured triangulations of $d$-manifolds","15 pages. New version, proof of the lower bound corrected","Discrete Comput Geom 65, 601-617 (2021)","10.1007/s00454-020-00189-w",,"math.CO math-ph math.MP math.PR","http://arxiv.org/licenses/nonexclusive-distrib/1.0/","  We give superexponential lower and upper bounds on the number of coloured
$d$-dimensional triangulations whose underlying space is an oriented manifold,
when the number of simplices goes to infinity and $d\geq 3$ is fixed. In the
special case of dimension $3$, the lower and upper bounds match up to
exponential factors, and we show that there are $2^{O(n)} n^{\frac{n}{6}}$
coloured triangulations of $3$-manifolds with $n$ tetrahedra. Our results also
imply that random coloured triangulations of $3$-manifolds have a sublinear
number of vertices. Our upper bounds apply in particular to coloured
$d$-spheres for which they seem to be the best known bounds in any dimension
$d\geq 3$, even though it is often conjectured that exponential bounds hold in
this case.
  We also ask a related question on regular edge-coloured graphs having the
property that each $3$-coloured component is planar, which is of independent
interest.
","[{""version"":""v1"",""created"":""Tue, 3 Jul 2018 08:34:10 GMT""},{""version"":""v2"",""created"":""Thu, 13 Feb 2020 12:54:26 GMT""}]","2021-09-06"
"1807.01023","Daehee Jang","Daehee Jang, Jonghwan Kim, Minjoon Park, Yunjong Jung, Hojoon Lee,
  Brent Byunghoon Kang","Rethinking Misalignment to Raise the Bar for Heap Pointer Corruption","15 pages",,,,"cs.CR","http://arxiv.org/licenses/nonexclusive-distrib/1.0/","  Heap layout randomization renders a good portion of heap vulnerabilities
unexploitable. However, some remnants of the vulnerabilities are still
exploitable even under the randomized layout. According to our analysis, such
heap exploits often abuse pointer-width allocation granularity to spray crafted
pointers. To address this problem, we explore the efficacy of byte-granularity
(the most fine-grained) heap randomization. Heap randomization, in general, has
been a well-trodden area; however, the efficacy of byte-granularity
randomization has never been fully explored as \emph{misalignment} raises
various concerns. This paper unravels the pros and cons of byte-granularity
heap randomization by conducting comprehensive analysis in three folds: (i)
security effectiveness, (ii) performance impact, and (iii) compatibility
analysis to measure deployment cost. Security discussion based on 20 CVE case
studies suggests that byte-granularity heap randomization raises the bar
against heap exploits more than we initially expected; as pointer spraying
approach is becoming prevalent in modern heap exploits. Afterward, to demystify
the skeptical concerns regarding misalignment, we conduct cycle-level
microbenchmarks and report that the performance cost is highly concentrated to
edge cases depending on L1-cache line. Based on such observations, we design
and implement an allocator suited to optimize the performance cost of
byte-granularity heap randomization; then evaluate the performance with the
memory-intensive benchmark (SPEC2006). Finally, we discuss compatibility issues
using Coreutils, Nginx, and ChakraCore.
","[{""version"":""v1"",""created"":""Tue, 3 Jul 2018 08:34:50 GMT""},{""version"":""v2"",""created"":""Mon, 6 Aug 2018 13:18:05 GMT""},{""version"":""v3"",""created"":""Wed, 8 Aug 2018 07:09:44 GMT""}]","2018-08-09"
"1807.01024","Lorenzo De Angelis","L. De Angelis, F. Alpeggiani, A. Di Falco, and L. Kuipers","Spatial Distribution of Phase Singularities in Optical Random Vector
  Waves","5 pages, 5 figures","Phys. Rev. Lett. 117, 093901 (2016)","10.1103/PhysRevLett.117.093901",,"physics.optics","http://arxiv.org/licenses/nonexclusive-distrib/1.0/","  Phase singularities are dislocations widely studied in optical fields as well
as in other areas of physics. With experiment and theory we show that the
vectorial nature of light affects the spatial distribution of phase
singularities in random light fields. While in scalar random waves phase
singularities exhibit spatial distributions reminiscent of particles in
isotropic liquids, in vector fields their distribution for the different vector
components becomes anisotropic due to the direct relation between propagation
and field direction. By incorporating this relation in the theory for scalar
fields by Berry and Dennis [Proc. R. Soc. A 456, 2059 (2000)], we
quantitatively describe our experiments.
","[{""version"":""v1"",""created"":""Tue, 3 Jul 2018 08:36:17 GMT""}]","2018-07-04"
"1807.01025","Dang Minh Nguyen Mr","Dang Minh Nguyen, Liangxing Hu, Jianmin Miao, Claus-Dieter Ohl","Oscillate Boiling from Electrical Microheaters",,"Phys. Rev. Applied 10, 044064 (2018)","10.1103/PhysRevApplied.10.044064",,"physics.app-ph","http://arxiv.org/licenses/nonexclusive-distrib/1.0/","  Oscillate boiling offers excellent heat transfer at temperatures above the
Leidenfrost temperature. Here we realize an electrical microheater with an
integrated thermal probe and resolve the thermal cycle during the
high-frequency bubble oscillations. Thermal rates of $10^8\,$K/s were found
indicating its applicability for compact and rapid heat transfer from micro
electrical devices.
","[{""version"":""v1"",""created"":""Tue, 3 Jul 2018 08:46:53 GMT""}]","2018-10-31"
"1807.01026","Mikel Bober-Irizar","Eng-Jon Ong, Sameed Husain, Mikel Bober-Irizar, Miroslaw Bober","Deep Architectures and Ensembles for Semantic Video Classification",,,,,"cs.CV","http://arxiv.org/licenses/nonexclusive-distrib/1.0/","  This work addresses the problem of accurate semantic labelling of short
videos. To this end, a multitude of different deep nets, ranging from
traditional recurrent neural networks (LSTM, GRU), temporal agnostic networks
(FV,VLAD,BoW), fully connected neural networks mid-stage AV fusion and others.
Additionally, we also propose a residual architecture-based DNN for video
classification, with state-of-the art classification performance at
significantly reduced complexity. Furthermore, we propose four new approaches
to diversity-driven multi-net ensembling, one based on fast correlation measure
and three incorporating a DNN-based combiner. We show that significant
performance gains can be achieved by ensembling diverse nets and we investigate
factors contributing to high diversity. Based on the extensive YouTube8M
dataset, we provide an in-depth evaluation and analysis of their behaviour. We
show that the performance of the ensemble is state-of-the-art achieving the
highest accuracy on the YouTube-8M Kaggle test data. The performance of the
ensemble of classifiers was also evaluated on the HMDB51 and UCF101 datasets,
and show that the resulting method achieves comparable accuracy with
state-of-the-art methods using similar input features.
","[{""version"":""v1"",""created"":""Tue, 3 Jul 2018 08:49:47 GMT""},{""version"":""v2"",""created"":""Wed, 11 Jul 2018 08:22:05 GMT""},{""version"":""v3"",""created"":""Sun, 7 Oct 2018 14:51:29 GMT""}]","2018-10-09"
"1807.01027","Lorenzo De Angelis","L. De Angelis, F. Alpeggiani, A. Di Falco, and L. Kuipers","Persistence and Lifelong Fidelity of Phase Singularities in Optical
  Random Waves","5 pages, 5 figures","Phys. Rev. Lett. 119, 203903 (2017)","10.1103/PhysRevLett.119.203903",,"physics.optics","http://arxiv.org/licenses/nonexclusive-distrib/1.0/","  Phase singularities are locations where light is twisted like a corkscrew,
with positive or negative topological charge depending on the twisting
direction. Among the multitude of singularities arising in random wave fields,
some can be found at the same location, but only when they exhibit opposite
topological charge, which results in their mutual annihilation. New pairs can
be created as well. With near-field experiments supported by theory and
numerical simulations, we study the persistence and pairing statistics of phase
singularities in random optical fields as a function of the excitation
wavelength. We demonstrate how such entities can encrypt fundamental properties
of the random fields in which they arise.
","[{""version"":""v1"",""created"":""Tue, 3 Jul 2018 08:52:42 GMT""}]","2018-07-04"
"1807.01028","Massimiliano Mancini","Massimiliano Mancini, Hakan Karaoguz, Elisa Ricci, Patric Jensfelt and
  Barbara Caputo","Kitting in the Wild through Online Domain Adaptation","Accepted to IROS 2018",,,,"cs.RO cs.CV","http://arxiv.org/licenses/nonexclusive-distrib/1.0/","  Technological developments call for increasing perception and action
capabilities of robots. Among other skills, vision systems that can adapt to
any possible change in the working conditions are needed. Since these
conditions are unpredictable, we need benchmarks which allow to assess the
generalization and robustness capabilities of our visual recognition
algorithms. In this work we focus on robotic kitting in unconstrained
scenarios. As a first contribution, we present a new visual dataset for the
kitting task. Differently from standard object recognition datasets, we provide
images of the same objects acquired under various conditions where camera,
illumination and background are changed. This novel dataset allows for testing
the robustness of robot visual recognition algorithms to a series of different
domain shifts both in isolation and unified. Our second contribution is a novel
online adaptation algorithm for deep models, based on batch-normalization
layers, which allows to continuously adapt a model to the current working
conditions. Differently from standard domain adaptation algorithms, it does not
require any image from the target domain at training time. We benchmark the
performance of the algorithm on the proposed dataset, showing its capability to
fill the gap between the performances of a standard architecture and its
counterpart adapted offline to the given target domain.
","[{""version"":""v1"",""created"":""Tue, 3 Jul 2018 08:53:27 GMT""}]","2018-07-04"
"1807.01029","Yasumasa Hasegawa","Yasumasa Hasegawa, Hiroki Nakano, and Toru Sakai","Metamagnetic jump in the spin-1/2 antiferromagnetic Heisenberg model on
  the square-kagome lattice","10 pages, 10 figures","Phys. Rev. B 98, 014404 (2018)","10.1103/PhysRevB.98.014404",,"cond-mat.str-el cond-mat.stat-mech","http://arxiv.org/licenses/nonexclusive-distrib/1.0/","  The magnetization process of the spin-1/2 antiferromagnetic Heisenberg model
on two-dimensional square-kagome lattice is studied theoretically. The
metamagnetic jumps exist in the magnetization process at the higher edge of the
1/3 and 2/3 plateaus. The parameter-dependencies of the critical field and the
magnitude of the magnetization jump at the higher edge of the 1/3 plateau are
obtained by using the approximated state in the unit cell and compared with the
nu- merical results of the exact diagonalization of 42 sites.
","[{""version"":""v1"",""created"":""Tue, 3 Jul 2018 08:54:14 GMT""}]","2018-07-06"
"1807.01030","Wasiu Yahya Mr","W. A. Yahya, B. I. S. van der Ventel, R. A. Bark, and B. C. Kimene
  Kaya","Calculation of a complete set of spin observables for proton elastic
  scattering from stable and unstable nuclei",,,"10.1103/PhysRevC.98.014620",,"nucl-th","http://arxiv.org/licenses/nonexclusive-distrib/1.0/","  A microscopic study of proton elastic scattering from unstable nuclei at
intermediate energies using a relativistic formalism is presented. We have
employed both the original relativistic impulse approximation (IA1) and the
generalised impulse approximation (IA2) formalisms to calculate the
relativistic optical potentials, with target densities derived from
relativistic mean field (RMF) theory using the NL3 and FSUGold parameter sets.
Comparisons between the optical potentials computed using both IA1 and IA2
formalisms, and the different RMF Lagrangians are presented for both stable and
unstable targets. The comparisons are required to study the effect of using IA1
versus IA2 optical potentials, with different RMF parameter sets, on elastic
scattering observables for unstable targets at intermediate energies. We also
study the effect of full-folding versus the factorized form of the optical
potentials on elastic scattering observables. As with the case for stable
nuclei, we found that the use of the full-folding optical potential improves
the scattering observables (especially spin observables) at low intermediate
energy (e.g. 200MeV). No discernible difference is found at a projectile
incident energy of 500 MeV. To check the validity of using localized optical
potential, we calculate the scattering observables using non-local potentials
by solving the momentum space Dirac equation. The Dirac equation is transformed
to two coupled Lippmann-Schwinger equations, which are then numerically solved
to obtain elastic scattering observables. The results are discussed and
compared to calculations involving local coordinate-space optical potentials.
","[{""version"":""v1"",""created"":""Tue, 3 Jul 2018 08:55:03 GMT""}]","2018-08-15"
"1807.01031","Michael Foskett","Michael S. Foskett, Darryl D. Holm, Cesare Tronci","Geometry of nonadiabatic quantum hydrodynamics","41 pages, no figures",,"10.1007/s10440-019-00257-1",,"math-ph math.MP nlin.CD physics.chem-ph quant-ph","http://arxiv.org/licenses/nonexclusive-distrib/1.0/","  The Hamiltonian action of a Lie group on a symplectic manifold induces a
momentum map generalizing Noether's conserved quantity occurring in the case of
a symmetry group. Then, when a Hamiltonian function can be written in terms of
this momentum map, the Hamiltonian is called `collective'. Here, we derive
collective Hamiltonians for a series of models in quantum molecular dynamics
for which the Lie group is the composition of smooth invertible maps and
unitary transformations. In this process, different fluid descriptions emerge
from different factorization schemes for either the wavefunction or the density
operator. After deriving this series of quantum fluid models, we regularize
their Hamiltonians for finite $\hbar$ by introducing local spatial smoothing.
In the case of standard quantum hydrodynamics, the $\hbar\ne0$ dynamics of the
Lagrangian path can be derived as a finite-dimensional canonical Hamiltonian
system for the evolution of singular solutions called `Bohmions', which follow
Bohmian trajectories in configuration space. For molecular dynamics models,
application of the smoothing process to a new factorization of the density
operator leads to a finite-dimensional Hamiltonian system for the interaction
of multiple (nuclear) Bohmions and a sequence of electronic quantum states.
","[{""version"":""v1"",""created"":""Tue, 3 Jul 2018 09:04:03 GMT""},{""version"":""v2"",""created"":""Fri, 21 Dec 2018 12:26:28 GMT""},{""version"":""v3"",""created"":""Wed, 27 Mar 2019 10:08:15 GMT""}]","2021-08-19"
"1807.01032","Lorenzo De Angelis","L. De Angelis and L. Kuipers","Screening and fluctuation of the topological charge in random wave
  fields",,"Opt. Lett. 43, 2740-2743 (2018)","10.1364/OL.43.002740",,"physics.optics","http://arxiv.org/licenses/nonexclusive-distrib/1.0/","  Vortices, phase singularities, and topological defects of any kind often
reflect information that is crucial for understanding physical systems in which
such entities arise. With near-field experiments supported by numerical
calculations, we determine the fluctuations of the topological charge for phase
singularities in isotropic random waves as a function of the size R of the
observation window. We demonstrate that for two-dimensional fields such
fluctuations increase with a superlinear scaling law, consistent with a R log R
behavior. Additionally, we show that such scaling remains valid in the presence
of anisotropy.
","[{""version"":""v1"",""created"":""Tue, 3 Jul 2018 09:05:41 GMT""}]","2018-07-04"
"1807.01033","Christa Fl\""uhmann","Christa Fl\""uhmann, Thanh Long Nguyen, Matteo Marinelli, Vlad
  Negnevitsky, Karan Mehta, Jonathan Home","Encoding a qubit in a trapped-ion mechanical oscillator","11 pages, 4 figures",,"10.1038/s41586-019-0960-6",,"quant-ph physics.atom-ph","http://arxiv.org/licenses/nonexclusive-distrib/1.0/","  The stable operation of quantum computers will rely on error-correction, in
which single quantum bits of information are stored redundantly in the Hilbert
space of a larger system. Such encoded qubits are commonly based on arrays of
many physical qubits, but can also be realized using a single
higher-dimensional quantum system, such as a harmonic oscillator. A powerful
encoding is formed from a periodically spaced superposition of position
eigenstates. Various proposals have been made for realizing approximations to
such states, but these have thus far remained out of reach. Here, we
demonstrate such an encoded qubit using a superposition of displaced squeezed
states of the harmonic motion of a single trapped Calcium ion, controlling and
measuring the oscillator through coupling to an ancilliary internal-state
qubit. We prepare and reconstruct logical states with an average square
fidelity of $87.3 \pm 0.7 \%$, and demonstrate a universal logical single qubit
gate set which we analyze using process tomography. For Pauli gates we reach
process fidelities of $\approx 97\%$, while for continuous rotations we use
gate teleportation achieving fidelities of $\approx 89 \%$. The control
demonstrated opens a route for exploring continuous variable error-correction
as well as hybrid quantum information schemes using both discrete and
continuous variables. The code states also have direct applications in quantum
sensing, allowing simultaneous measurement of small displacements in both
position and momentum.
","[{""version"":""v1"",""created"":""Tue, 3 Jul 2018 09:10:27 GMT""}]","2019-04-25"
"1807.01034","Evangelos Thomas Karamatskos","Evangelos T. Karamatskos, Sebastian Raabe, Terry Mullins, Andrea
  Trabattoni, Philipp Stammer, Gildas Goldsztejn, Rasmus R. Johansen, Karol
  D{\l}ugo{\l}\k{e}cki, Henrik Stapelfeldt, Marc. J. J. Vrakking, Sebastian
  Trippel, Arnaud Rouz\'ee and Jochen K\""upper","Molecular movie of ultrafast coherent rotational dynamics","9 Figures","Nat Commun 10, 3364 (2019)","10.1038/s41467-019-11122-y",,"physics.chem-ph physics.atom-ph quant-ph","http://arxiv.org/licenses/nonexclusive-distrib/1.0/","  Recording molecular movies on ultrafast timescales has been a longstanding
goal for unravelling detailed information about molecular dynamics. We present
the direct experimental recording of very-high-resolution and -fidelity
molecular movies over more than one-and-a-half periods of the laser-induced
rotational dynamics of carbonylsulfide (OCS) molecules. Utilising the
combination of single-quantum-state selection and an optimised two-pulse
sequence to create a tailored rotational wavepacket, an unprecedented degree of
field-free alignment, $\langle \cos^{2}{\theta_{2D}}\rangle=0.96$ ($\langle
\cos^{2}{\theta}\rangle=0.94$) was achieved, exceeding the theoretical limit
for single-pulse alignment. The very rich experimentally observed quantum
dynamics is fully recovered by the angular probability distribution obtained
from solutions of the time-dependent Schr\""odinger equation with parameters
refined against the experiment. The populations and phases of rotational states
in the retrieved time-dependent three-dimensional wavepacket rationalised the
observed very high degree of alignment.
","[{""version"":""v1"",""created"":""Tue, 3 Jul 2018 09:11:19 GMT""},{""version"":""v2"",""created"":""Thu, 9 May 2019 12:01:21 GMT""}]","2020-05-19"
"1807.01035","Manfred Eppe","Manfred Eppe and Matthias Kerzel and Erik Strahl and Stefan Wermter","Deep Neural Object Analysis by Interactive Auditory Exploration with a
  Humanoid Robot",,,,,"cs.RO cs.AI cs.NE","http://arxiv.org/licenses/nonexclusive-distrib/1.0/","  We present a novel approach for interactive auditory object analysis with a
humanoid robot. The robot elicits sensory information by physically shaking
visually indistinguishable plastic capsules. It gathers the resulting audio
signals from microphones that are embedded into the robotic ears. A neural
network architecture learns from these signals to analyze properties of the
contents of the containers. Specifically, we evaluate the material
classification and weight prediction accuracy and demonstrate that the
framework is fairly robust to acoustic real-world noise.
","[{""version"":""v1"",""created"":""Tue, 3 Jul 2018 09:11:36 GMT""},{""version"":""v2"",""created"":""Tue, 10 Jul 2018 07:53:06 GMT""}]","2018-07-11"
