"1807.00891","Alexander Wein","Amelia Perry and Alexander S. Wein and Afonso S. Bandeira and Ankur
  Moitra","Optimality and Sub-optimality of PCA I: Spiked Random Matrix Models","67 pages, 3 figures. This is the journal version of part I of
  arXiv:1609.05573, accepted to the Annals of Statistics. This version includes
  the supplementary material as appendices","Ann. Statist., Volume 46, Number 5 (2018), 2416-2451","10.1214/17-AOS1625",,"math.ST cs.DS cs.IT math.IT math.PR stat.ML stat.TH","http://arxiv.org/licenses/nonexclusive-distrib/1.0/","  A central problem of random matrix theory is to understand the eigenvalues of
spiked random matrix models, introduced by Johnstone, in which a prominent
eigenvector (or ""spike"") is planted into a random matrix. These distributions
form natural statistical models for principal component analysis (PCA) problems
throughout the sciences. Baik, Ben Arous and Peche showed that the spiked
Wishart ensemble exhibits a sharp phase transition asymptotically: when the
spike strength is above a critical threshold, it is possible to detect the
presence of a spike based on the top eigenvalue, and below the threshold the
top eigenvalue provides no information. Such results form the basis of our
understanding of when PCA can detect a low-rank signal in the presence of
noise. However, under structural assumptions on the spike, not all information
is necessarily contained in the spectrum. We study the statistical limits of
tests for the presence of a spike, including non-spectral tests. Our results
leverage Le Cam's notion of contiguity, and include:
  i) For the Gaussian Wigner ensemble, we show that PCA achieves the optimal
detection threshold for certain natural priors for the spike.
  ii) For any non-Gaussian Wigner ensemble, PCA is sub-optimal for detection.
However, an efficient variant of PCA achieves the optimal threshold (for
natural priors) by pre-transforming the matrix entries.
  iii) For the Gaussian Wishart ensemble, the PCA threshold is optimal for
positive spikes (for natural priors) but this is not always the case for
negative spikes.
","[{""version"":""v1"",""created"":""Mon, 2 Jul 2018 21:11:57 GMT""},{""version"":""v2"",""created"":""Fri, 13 Jul 2018 03:30:03 GMT""}]","2018-08-29"
"1807.00892","Christine McMeekin","Christine McMeekin","On the Asymptotics of a Prime Spin Relation","Erratum plus Original version",,"10.1016/j.jnt.2018.11.027",,"math.NT","http://creativecommons.org/licenses/by/4.0/","  For cyclic totally real number fields $K$ with odd prime degree $n$, odd
class number, $2$ inert, and the property that every totally positive unit is a
square, the density of rational primes $p$ that satisfy the spin relation
spin$(\mathfrak{p},\sigma)$spin$(\mathfrak{p},\sigma^{-1})=1$ for all
$\sigma\neq 1 \in$ Gal$(K/\mathbb{Q})$ where $\mathfrak{p}$ is a prime of $K$
above $p$ is given by the formula \[ D_K=\frac{m_Kn+1}{n2^n} \] where $m_K$ is
a computable and bounded invariant of the number field $K$. This formula is
modified in the erratum from the original version due to an error in the inert
case. As the inert case is insubstantial, the strength of the results is not
significantly changed.
","[{""version"":""v1"",""created"":""Mon, 2 Jul 2018 21:15:12 GMT""},{""version"":""v2"",""created"":""Sun, 23 Sep 2018 10:36:14 GMT""},{""version"":""v3"",""created"":""Sun, 18 Nov 2018 11:09:40 GMT""},{""version"":""v4"",""created"":""Tue, 5 Jan 2021 18:49:41 GMT""}]","2021-01-06"
"1807.00893","Blaise Genest","Nathalie Bertrand and Miheer Dewaskar and Blaise Genest and Hugo
  Gimbert and Adwait Amit Godbole","Controlling a population","This is a journal version of the extended abstract arXiv:1707.02058
  which appeared in Concur 2017, together with proofs","Logical Methods in Computer Science, Volume 15, Issue 3 (July 29,
  2019) lmcs:5647","10.23638/LMCS-15(3:6)2019",,"cs.FL cs.SY eess.SY","http://creativecommons.org/licenses/by/4.0/","  We introduce a new setting where a population of agents, each modelled by a
finite-state system, are controlled uniformly: the controller applies the same
action to every agent. The framework is largely inspired by the control of a
biological system, namely a population of yeasts, where the controller may only
change the environment common to all cells. We study a synchronisation problem
for such populations: no matter how individual agents react to the actions of
the controller, the controller aims at driving all agents synchronously to a
target state. The agents are naturally represented by a non-deterministic
finite state automaton (NFA), the same for every agent, and the whole system is
encoded as a 2-player game. The first player (Controller) chooses actions, and
the second player (Agents) resolves non-determinism for each agent. The game
with m agents is called the m -population game. This gives rise to a
parameterized control problem (where control refers to 2 player games), namely
the population control problem: can Controller control the m-population game
for all m in N whatever Agents does?
","[{""version"":""v1"",""created"":""Mon, 2 Jul 2018 21:15:17 GMT""},{""version"":""v2"",""created"":""Thu, 7 Mar 2019 16:59:29 GMT""},{""version"":""v3"",""created"":""Fri, 26 Jul 2019 13:40:58 GMT""}]","2019-10-23"
"1807.00894","Javier Llorente","Javier Llorente and Benjamin Nachman","Limits on new coloured fermions using precision jet data from the Large
  Hadron Collider","16 pages, 8 figures. v3 matches the published version","Nuclear Physics B 936 (2018) 106-117","10.1016/j.nuclphysb.2018.09.008",,"hep-ph hep-ex","http://arxiv.org/licenses/nonexclusive-distrib/1.0/","  This work presents an interpretation of high precision jet data from the
ATLAS experiment in terms of exclusion limits for new coloured matter. To this
end, the effect of a new coloured fermion with a mass $m_X$ on the solution of
the renormalization group equation QCD is studied. Theoretical predictions for
the transverse energy-energy correlation function and its asymmetry are
obtained with such a modified solution and, from the comparison to data, 95\%
CL exclusion limits are set on such models.
","[{""version"":""v1"",""created"":""Mon, 2 Jul 2018 21:19:43 GMT""},{""version"":""v2"",""created"":""Wed, 4 Jul 2018 18:13:42 GMT""},{""version"":""v3"",""created"":""Thu, 27 Sep 2018 15:27:26 GMT""}]","2018-09-28"
"1807.00895","Go\""ery Genty","Tommi Mikkonen, Caroline Amiot, Antti Aalto, Kim Patokoski, Go\""ery
  Genty, and Juha Toivonen","Broadband cantilever-enhanced photoacoustic spectroscopy in the mid-IR
  using supercontinuum",,,"10.1364/OL.43.005094",,"physics.ins-det physics.optics","http://arxiv.org/licenses/nonexclusive-distrib/1.0/","  We demonstrate cantilever-enhanced photoacoustic spectroscopy in the
mid-infrared using a supercontinuum source. The approach is broadband, compact,
and allows for higher photoacoustic signal intensity and enhanced
signal-to-noise ratio as compared to systems employing conventional back body
radiation sources. Using this technique, we perform spectroscopic measurements
of the full ro-vibrational band structure of water vapor at 1900 nm and methane
at 3300 nm with relative signal enhancement factors of 70 and 19, respectively,
when compared to measurements that use a black body radiation source. Our
results offer novel perspective for photoacoustic detection opening the door to
compact and sensitive broadband analyzers in the mid-infrared spectral region.
","[{""version"":""v1"",""created"":""Mon, 2 Jul 2018 21:22:03 GMT""}]","2018-11-14"
"1807.00896","Alexander Khanikaev","Xiang Ni, Matthew Weiner, Andrea Al\`u, Alexander B. Khanikaev","Observation of Bulk Polarization Transitions and Higher-Order Embedded
  Topological Eigenstates for Sound",,,,,"cond-mat.mtrl-sci cond-mat.dis-nn physics.app-ph","http://arxiv.org/licenses/nonexclusive-distrib/1.0/","  Topological systems are inherently robust to disorder and continuous
perturbations, resulting in dissipation-free edge transport of electrons in
quantum solids, or reflectionless guiding of photons and phonons in classical
wave systems characterized by Chern or spin-Chern topological invariants. These
established examples of topological physics, however, do not exhaust all
possible topological phases, and recently a new class of topological
metamaterials characterized by bulk polarization has been introduced. In
addition to edge conduction, these systems have been shown to host higher-order
topological modes. Here, we introduce and measure topological bulk polarization
in 3D printed two-dimensional acoustic meta-structures, and observe topological
transitions as the design parameters are tuned. We also demonstrate that our
topological meta-structure hosts both 1D edge and higher-order 0D corner states
with unique acoustic properties. The edge states have spin polarization that
reverses for opposite propagation direction, thus supporting directional
excitation. Corner states are pinned to the meta-structure corners, and rapidly
decay both along the edges and into the bulk. Interestingly, these 0D states
can spectrally overlap with the continuum of bulk states, but are not
compatible with radiation, thus enabling embedded topological eigenstates
within the continuum of bulk modes. Their confinement and inherent topological
robustness is experimentally confirmed by deliberately introducing disorder.
Our findings open new directions in acoustics for advanced sound propagation
and manipulation.
","[{""version"":""v1"",""created"":""Mon, 2 Jul 2018 21:22:58 GMT""}]","2018-07-04"
"1807.00897","Sebastian Wintz","V. Sluka, T. Schneider, R. A. Gallardo, A. Kakay, M. Weigand, T.
  Warnatz, R. Mattheis, A. Roldan-Molina, P. Landeros, V. Tiberkevich, A.
  Slavin, G. Sch\""utz, A. Erbe, A. Deac, J. Lindner, J. Raabe, J. Fassbender
  and S. Wintz","Emission and Propagation of Multi-Dimensional Spin Waves with nanoscale
  wavelengths in Anisotropic Spin Textures",,,"10.1038/s41565-019-0383-4",,"cond-mat.mes-hall","http://arxiv.org/licenses/nonexclusive-distrib/1.0/","  Spin waves offer intriguing novel perspectives for computing and signal
processing, since their damping can be lower than the Ohmic losses in
conventional CMOS circuits. For controlling the spatial extent and propagation
of spin waves on the actual chip, magnetic domain walls show considerable
potential as magnonic waveguides. However, low-loss guidance of spin waves with
nanoscale wavelengths, in particular around angled tracks, remains to be shown.
Here we experimentally demonstrate that such advanced control of propagating
spin waves can be obtained using natural features of magnetic order in an
interlayer exchange-coupled, anisotropic ferromagnetic bilayer. Using Scanning
Transmission X-Ray Microscopy, we image generation of spin waves and their
propagation across distances exceeding multiple times the wavelength, in
extended planar geometries as well as along one-dimensional domain walls, which
can be straight and curved. The observed range of wavelengths is between 1
{\mu}m and 150 nm, at corresponding excitation frequencies from 250 MHz to 3
GHz. Our results show routes towards practical implementation of magnonic
waveguides employing domain walls in future spin wave logic and computational
circuits.
","[{""version"":""v1"",""created"":""Mon, 2 Jul 2018 21:24:02 GMT""},{""version"":""v2"",""created"":""Tue, 27 Nov 2018 22:42:15 GMT""}]","2019-05-01"
"1807.00898","Shile Li","Jan W\""ohlke, Shile Li and Dongheui Lee","Model-based Hand Pose Estimation for Generalized Hand Shape with
  Appearance Normalization",,,,,"cs.CV","http://arxiv.org/licenses/nonexclusive-distrib/1.0/","  Since the emergence of large annotated datasets, state-of-the-art hand pose
estimation methods have been mostly based on discriminative learning. Recently,
a hybrid approach has embedded a kinematic layer into the deep learning
structure in such a way that the pose estimates obey the physical constraints
of human hand kinematics. However, the existing approach relies on a single
person's hand shape parameters, which are fixed constants. Therefore, the
existing hybrid method has problems to generalize to new, unseen hands. In this
work, we extend the kinematic layer to make the hand shape parameters
learnable. In this way, the learnt network can generalize towards arbitrary
hand shapes. Furthermore, inspired by the idea of Spatial Transformer Networks,
we apply a cascade of appearance normalization networks to decrease the
variance in the input data. The input images are shifted, rotated, and globally
scaled to a similar appearance. The effectiveness and limitations of our
proposed approach are extensively evaluated on the Hands 2017 challenge dataset
and the NYU dataset.
","[{""version"":""v1"",""created"":""Mon, 2 Jul 2018 21:27:08 GMT""}]","2018-07-04"
"1807.00899","Shmuel Rubinstein","Omer Gottesman, Jovana Andrejevic, Chris H. Rycroft, Shmuel M.
  Rubinstein","A state variable for crumpled thin sheets",,,,,"cond-mat.soft","http://arxiv.org/licenses/nonexclusive-distrib/1.0/","  Despite the apparent ease with which a sheet of paper is crumpled and tossed
away, crumpling dynamics are often considered a paradigm of complexity. This
complexity arises from the infinite number of configurations a disordered
crumpled sheet can take. Here we experimentally show that key aspects of
crumpling have a very simple description; the evolution of the damage in
crumpling dynamics can largely be described by a single global quantity, the
total length of all creases. We follow the evolution of the damage network in
repetitively crumpled elastoplastic sheets, and show that the dynamics of this
quantity are deterministic, and depend only on the instantaneous state of the
crease network and not at all on the crumpling history. We also show that this
global quantity captures the crumpling dynamics of a sheet crumpled for the
first time. This leads to a remarkable reduction in complexity, allowing a
description of a highly disordered system by a single state parameter. Similar
strategies may also be useful in analyzing other systems that evolve under
geometric and mechanical constraints, from faulting of tectonic plates to the
evolution of proteins.
","[{""version"":""v1"",""created"":""Mon, 2 Jul 2018 21:32:17 GMT""}]","2018-07-04"
"1807.00900","Eneldo Loza Menc\'ia","Patryk Hopner, Eneldo Loza Menc\'ia","Analysis and Optimization of Deep Counterfactual Value Networks","Long version of publication appearing at KI 2018: The 41st German
  Conference on Artificial Intelligence
  (http://dx.doi.org/10.1007/978-3-030-00111-7_26). Corrected typo in title",,"10.1007/978-3-030-00111-7_26",,"cs.AI","http://arxiv.org/licenses/nonexclusive-distrib/1.0/","  Recently a strong poker-playing algorithm called DeepStack was published,
which is able to find an approximate Nash equilibrium during gameplay by using
heuristic values of future states predicted by deep neural networks. This paper
analyzes new ways of encoding the inputs and outputs of DeepStack's deep
counterfactual value networks based on traditional abstraction techniques, as
well as an unabstracted encoding, which was able to increase the network's
accuracy.
","[{""version"":""v1"",""created"":""Mon, 2 Jul 2018 21:36:23 GMT""},{""version"":""v2"",""created"":""Fri, 12 Oct 2018 16:48:29 GMT""}]","2018-10-15"
"1807.00901","Abdelmoubine Amar Henni","Abdelmoubine Amar Henni","On the fixed locus of framed instanton sheaves on $\mathbb{P}^{3}$","27 pages; corrections in section 4 and non primitive case added for
  c=3","Pacific J. Math. 308 (2020) 41-72","10.2140/pjm.2020.308.41",,"math.AG","http://arxiv.org/licenses/nonexclusive-distrib/1.0/","  Let $\mathbb{T}$ be the three dimensional torus acting on $\mathbb{P}^{3}$
and $\mathcal{M}^{\mathbb{T}}_{\mathbb{P}^{3}}(c)$ be the fixed locus of the
corresponding action on the moduli space of rank $2$ framed instanton sheaves
on $\mathbb{P}^{3}.$ In this work, we prove that
$\mathcal{M}^{\mathbb{T}}_{\mathbb{P}^{3}}(c)$ consist only of non locally-free
instanton sheaves whose double dual is the trivial bundle
$\mathcal{O}_{\mathbb{P}^{3}}^{\oplus 2}$. Moreover, We relate these instantons
to Pandharipande-Thomas stable pairs and give a classification of their
support. This allows to compute a lower bound on the number of components of
$\mathcal{M}^{\mathbb{T}}_{\mathbb{P}^{3}}(c).$
","[{""version"":""v1"",""created"":""Mon, 2 Jul 2018 21:39:44 GMT""},{""version"":""v2"",""created"":""Wed, 4 Jul 2018 17:29:00 GMT""},{""version"":""v3"",""created"":""Fri, 17 Aug 2018 19:13:10 GMT""},{""version"":""v4"",""created"":""Thu, 21 Nov 2019 13:24:05 GMT""}]","2020-12-09"
"1807.00902","Christian Marciniak","Harrison Ball, Christian D. Marciniak, Robert N. Wolf, Alex T.-H.
  Hung, Karsten Pyka, and Michael J. Biercuk","Site-resolved imaging of beryllium ion crystals in a high-optical-access
  Penning trap with inbore optomechanics","31 pages, 19 figures",,"10.1063/1.5049506",,"physics.atom-ph physics.ins-det quant-ph","http://arxiv.org/licenses/nonexclusive-distrib/1.0/","  We present the design, construction and characterization of an experimental
system capable of supporting a broad class of quantum simulation experiments
with hundreds of spin qubits using Be-9 ions in a Penning trap. This article
provides a detailed overview of the core optical and trapping subsystems, and
their integration. We begin with a description of a dual-trap design separating
loading and experimental zones and associated vacuum infrastructure design. The
experimental-zone trap electrodes are designed for wide-angle optical access
(e.g. for lasers used to engineer spin-motional coupling across large ion
crystals) while simultaneously providing a harmonic trapping potential. We
describe a near-zero-loss liquid-cryogen-based superconducting magnet, employed
in both trapping and establishing a quantization field for ion spin-states, and
equipped with a dual-stage remote-motor LN2LHe recondenser. Experimental
measurements using a nuclear magnetic resonance (NMR) probe demonstrate
part-per-million homogeneity over 7 mm-diameter cylindrical volume, with no
discernible effect on the measured NMR linewidth from pulse-tube operation.
Next we describe a custom-engineered inbore optomechanical system which
delivers ultraviolet (UV) laser light to the trap, and supports multiple
aligned optical objectives for top- and sideview imaging in the experimental
trap region. We describe design choices including the use of non-magnetic
goniometers and translation stages for precision alignment. Further, the
optomechanical system integrates UV-compatible fiber optics which decouple the
system's alignment from remote light sources. Using this system we present
site-resolved images of ion crystals and demonstrate the ability to realize
both planar and three-dimensional ion arrays via control of rotating wall
electrodes and radial laser beams. Looking to future work, we include
interferometric..
","[{""version"":""v1"",""created"":""Mon, 2 Jul 2018 21:39:55 GMT""},{""version"":""v2"",""created"":""Thu, 15 Nov 2018 07:28:17 GMT""},{""version"":""v3"",""created"":""Mon, 18 Feb 2019 01:14:30 GMT""},{""version"":""v4"",""created"":""Tue, 7 May 2019 00:50:21 GMT""}]","2019-05-08"
"1807.00903","Tuhtasin Ergashev","Tuhtasin Ergashev","Third Double-layer Potential for generalized bi-axially symmetric
  Helmholtz equation","13 pages, in Russian",,,,"math.AP","http://arxiv.org/licenses/nonexclusive-distrib/1.0/","  The double-layer potential plays an important role in solving boundary value
problems for elliptic equations, and in the study of which for a certain
equation, the properties of the fundamental solutions of the given equation are
used. All the fundamental solutions of the generalized bi-axially symmetric
Helmholtz equation were known, and only for the first one was constructed the
theory of potential. Here, in this paper, we aim at constructing theory of
double-layer potentials corresponding to the third fundamental solution. By
using some properties of one of Appell's hypergeometric functions in two
variables, we prove limiting theorems and derive integral equations concerning
a denseness of double-layer potentials.
","[{""version"":""v1"",""created"":""Mon, 2 Jul 2018 21:42:39 GMT""}]","2018-07-04"
"1807.00904","Luiz Brito","J. C. C. Felipe, H. G. Fargnoli, A. P. Baeta Scarpelli, L. C. T. Brito","Consistency of an alternative CPT-odd and Lorentz-violating extension of
  QED","16 pages, 4 figures",,"10.1142/S0217751X19501392",,"hep-th hep-ex hep-ph","http://arxiv.org/licenses/nonexclusive-distrib/1.0/","  We investigate an alternative CPT-odd Lorentz-breaking QED which includes the
Carroll-Field-Jackiw (CFJ) term of the Standard Model Extension (SME), writing
the gauge sector in the action in a Palatini-like form, in which the vectorial
field and the field-strength tensor are treated as independent entities.
Interestingly, this naturally induces a Lorentz-violating mass term in the
classical action. We study physical consistency aspects of the model both at
classical and quantum levels.
","[{""version"":""v1"",""created"":""Mon, 2 Jul 2018 21:43:04 GMT""},{""version"":""v2"",""created"":""Thu, 12 Jul 2018 12:15:19 GMT""},{""version"":""v3"",""created"":""Thu, 29 Aug 2019 18:52:59 GMT""}]","2019-09-12"
"1807.00905","Maria De-Arteaga","Maria De-Arteaga, Artur Dubrawski, Alexandra Chouldechova","Learning under selective labels in the presence of expert consistency","Presented at the 2018 Workshop on Fairness, Accountability, and
  Transparency in Machine Learning (FAT/ML 2018)",,,,"cs.LG stat.ML","http://arxiv.org/licenses/nonexclusive-distrib/1.0/","  We explore the problem of learning under selective labels in the context of
algorithm-assisted decision making. Selective labels is a pervasive selection
bias problem that arises when historical decision making blinds us to the true
outcome for certain instances. Examples of this are common in many
applications, ranging from predicting recidivism using pre-trial release data
to diagnosing patients. In this paper we discuss why selective labels often
cannot be effectively tackled by standard methods for adjusting for sample
selection bias, even if there are no unobservables. We propose a data
augmentation approach that can be used to either leverage expert consistency to
mitigate the partial blindness that results from selective labels, or to
empirically validate whether learning under such framework may lead to
unreliable models prone to systemic discrimination.
","[{""version"":""v1"",""created"":""Mon, 2 Jul 2018 21:48:59 GMT""},{""version"":""v2"",""created"":""Wed, 4 Jul 2018 22:55:26 GMT""}]","2018-07-06"
"1807.00906","Alexander Alemi","Alexander A. Alemi and Ian Fischer and Joshua V. Dillon","Uncertainty in the Variational Information Bottleneck","10 pages, 7 figures. Accepted to UAI 2018 - Uncertainty in Deep
  Learning Workshop",,,,"cs.LG stat.ML","http://arxiv.org/licenses/nonexclusive-distrib/1.0/","  We present a simple case study, demonstrating that Variational Information
Bottleneck (VIB) can improve a network's classification calibration as well as
its ability to detect out-of-distribution data. Without explicitly being
designed to do so, VIB gives two natural metrics for handling and quantifying
uncertainty.
","[{""version"":""v1"",""created"":""Mon, 2 Jul 2018 21:49:32 GMT""}]","2018-07-04"
"1807.00907","Ronald Mennickent Dr.","Ronald E. Mennickent, Thomas Rivinius, Lydia Cidale, Igor Soszy\'nski,
  J. G. Fern\'andez-Trincado","A peculiar interacting Be star binary in the Small Magellanic Cloud","7 tables, 9 figures. To be published in journal Publication of the
  Astronomical Society of the Pacific",,"10.1088/1538-3873/aaca88",,"astro-ph.SR","http://arxiv.org/licenses/nonexclusive-distrib/1.0/","  We find that the emission line object OGLEJ005039.05-725751.4, a member of
the cluster OGLE-CL SMC 64, exhibits a peculiar light curve pattern repeating
with a recurrence time of 141.45 days. The light curve resembles periodic
outbursts with a duty cycle of 20%. A second long-cycle of 2500 days is also
detected in the photometric dataset. Two X-SHOOTER spectra obtained at minimum
and maximum reveal a Be star dominating at minimum light resembling the
Classical Be star 48 Lib. The larger H$\alpha$ emission, the stronger NaD
absorption and the appearance of emission in the infrared Ca II triplet at
maximum, might indicate periodic mass transfer in a complex binary system.
","[{""version"":""v1"",""created"":""Mon, 2 Jul 2018 21:55:12 GMT""}]","2018-08-08"
"1807.00908","David Barina","David Barina","$7x\pm1$: Close Relative of Collatz Problem","7 pages; the problem is now verified up to 10^15",,,,"math.NT","http://arxiv.org/licenses/nonexclusive-distrib/1.0/","  We show an iterated function of which iterates oscillate wildly and grow at a
dizzying pace. We conjecture that the orbit of arbitrary positive integer
always returns to 1, as in the case of Collatz function. The conjecture is
supported by a heuristic argument and computational results.
","[{""version"":""v1"",""created"":""Mon, 2 Jul 2018 21:55:46 GMT""},{""version"":""v2"",""created"":""Wed, 4 Jul 2018 21:45:23 GMT""},{""version"":""v3"",""created"":""Mon, 9 Jul 2018 12:31:54 GMT""},{""version"":""v4"",""created"":""Mon, 23 Jul 2018 07:32:47 GMT""},{""version"":""v5"",""created"":""Wed, 25 Jul 2018 19:50:03 GMT""},{""version"":""v6"",""created"":""Wed, 10 Oct 2018 06:44:22 GMT""}]","2018-10-11"
