"1807.01129","Maiia Popel","Maiia Popel","The Methodical Aspects of the Algebra and the Mathematical Analysis
  Study Using the Sagemath Cloud","16 pages, Informational Technologies in Education, 19, pp. 93-100.
  (2014)",,"10.14308/ite000488",,"cs.CY","http://creativecommons.org/licenses/by-nc-sa/4.0/","  The quality of mathematics education depends largely on the quality of
education in general. The main idea may be summarized as follows: in order to
educate the younger generation of people to be able to meet adequately the
demands of the time, it is necessary to create conditions for the high-quality
mathematics education. Improving the quality of mathematics education of pupils
in secondary school is one of the most pressing problems. Contents of the
school course of mathematics and its teaching method has always been the
subject of undammed and sometimes stormy scientific debates. There are
especially true methods of teaching algebra and the analisis in the high
secondary school. Still in the study process the algebraic concepts and
principles of analysis are given in such an abstract and generalized form that
the student may has considerable difficulties to map these general abstract
concepts to the certain concrete images, they are generalizations of. Improving
education quality indicators can be achieved by using the appropriate computer
technology. The article deals with the use of the cloud-oriented systems of
computer mathematics (SCM). The prospects of development of the Web-SCM in
terms of cloud-based learning environment are considered. The pedagogical
features of the SageMath Cloud use as a tool for mathematics learning are
revealed. The methodological aspects of algebra and elementary analysis
teaching in a high profile school using the cloud-oriented the SCM SageMath
Cloud are revealed.
","[{""version"":""v1"",""created"":""Tue, 3 Jul 2018 12:51:25 GMT""}]","2018-07-04"
"1807.01130","Zhong-Yuan Zhang","Xin Liu, Hui-Min Cheng, Zhong-Yuan Zhang","Evaluation of Community Detection Methods",,,,,"cs.SI physics.soc-ph","http://arxiv.org/licenses/nonexclusive-distrib/1.0/","  Community structures are critical towards understanding not only the network
topology but also how the network functions. However, how to evaluate the
quality of detected community structures is still challenging and remains
unsolved. The most widely used metric, normalized mutual information (NMI), was
proved to have finite size effect, and its improved form relative normalized
mutual information (rNMI) has reverse finite size effect. Corrected normalized
mutual information (cNMI) was thus proposed and has neither finite size effect
nor reverse finite size effect. However, in this paper we show that cNMI
violates the so-called proportionality assumption. In addition, NMI-type
metrics have the problem of ignoring importance of small communities. Finally,
they cannot be used to evaluate a single community of interest. In this paper,
we map the computed community labels to the ground-truth ones through integer
linear programming, then use kappa index and F-score to evaluate the detected
community structures. Experimental results demonstrate the advantages of our
method.
","[{""version"":""v1"",""created"":""Tue, 3 Jul 2018 12:54:46 GMT""},{""version"":""v2"",""created"":""Tue, 19 Feb 2019 02:34:24 GMT""}]","2019-02-20"
"1807.01131","Tomas Andrade","Tomas Andrade, Roberto Emparan, David Licht","Rotating black holes and black bars at large D","37 pages, 5 figures. v2: 39 pages, 5 figures. Improved discussion on
  black bars, and matching with previous numerics on bar-mode instabilities in
  D=6,7","JHEP 09 (2018) 107","10.1007/JHEP09(2018)107",,"hep-th gr-qc","http://arxiv.org/licenses/nonexclusive-distrib/1.0/","  We propose and demonstrate a new and efficient approach to investigate black
hole dynamics in the limit of large number of dimensions $D$. The basic idea is
that an asymptotically flat black brane evolving under the Gregory-Laflamme
instability forms lumps that closely resemble a localized black hole. In this
manner, the large-$D$ effective equations for extended black branes can be used
to study localized black holes. We show that these equations have exact
solutions for black-hole-like lumps on the brane, which correctly capture the
main properties of Schwarzschild and Myers-Perry black holes at large $D$,
including their slow quasinormal modes and the ultraspinning instabilities
(axisymmetric or not) at large angular momenta. Furthermore, we obtain a novel
class of rotating `black bar' solutions, which are stationary when
$D\to\infty$, and are long-lived when $D$ is finite but large, since their
gravitational wave emission is strongly suppressed. The leading large $D$
approximation reproduces to per-cent level accuracy previous numerical
calculations of the bar-mode growth rate in $D=6,7$.
","[{""version"":""v1"",""created"":""Tue, 3 Jul 2018 12:56:45 GMT""},{""version"":""v2"",""created"":""Wed, 19 Sep 2018 06:04:02 GMT""}]","2018-09-20"
"1807.01132","Ori Gurel-Gurevich","Ohad N. Feldheim, Ori Gurel-Gurevich","The power of thinning in balanced allocation","8 pages",,,,"math.PR cs.DM","http://arxiv.org/licenses/nonexclusive-distrib/1.0/","  Balls are sequentially allocated into $n$ bins as follows: for each ball, an
independent, uniformly random bin is generated. An overseer may then choose to
either allocate the ball to this bin, or else the ball is allocated to a new
independent uniformly random bin. The goal of the overseer is to reduce the
load of the most heavily loaded bin after $\Theta(n)$ balls have been
allocated. We provide an asymptotically optimal strategy yielding a maximum
load of $(1+o(1))\sqrt{\frac{8\log n}{\log\log n}}$ balls.
","[{""version"":""v1"",""created"":""Tue, 3 Jul 2018 12:57:38 GMT""}]","2018-07-04"
"1807.01133","Jonas Krampe","Jonas Krampe","Time Series Modeling on Dynamic Networks",,,,,"stat.ME","http://arxiv.org/licenses/nonexclusive-distrib/1.0/","  This paper focuses on modeling the dynamic attributes of a dynamic network
with a fixed number of vertices. These attributes are considered as time series
which dependency structure is influenced by the underlying network. They are
modeled by a multivariate doubly stochastic time series framework, that is we
assume linear processes for which the coefficient matrices are stochastic
processes themselves. We explicitly allow for dependence in the dynamics of the
coefficient matrices as well as between these two stochastic processes. This
framework allows for a separate modeling of the attributes and the underlying
network. In this setting, we define network autoregressive models and discuss
their stationarity conditions. Furthermore, an estimation approach is discussed
in a low- and high-dimensional setting and how this can be applied to
forecasting. The finite sample behavior of the forecast approach is
investigated. This approach is applied to real data whereby the goal is to
forecast the GDP of 33 economies.
","[{""version"":""v1"",""created"":""Tue, 3 Jul 2018 12:57:56 GMT""},{""version"":""v2"",""created"":""Thu, 7 Nov 2019 08:18:11 GMT""}]","2019-11-11"
"1807.01134","Lily Hu","Lily Hu and Yiling Chen","Welfare and Distributional Impacts of Fair Classification","5 pages, FATML 2018",,,,"cs.LG stat.ML","http://arxiv.org/licenses/nonexclusive-distrib/1.0/","  Current methodologies in machine learning analyze the effects of various
statistical parity notions of fairness primarily in light of their impacts on
predictive accuracy and vendor utility loss. In this paper, we propose a new
framework for interpreting the effects of fairness criteria by converting the
constrained loss minimization problem into a social welfare maximization
problem. This translation moves a classifier and its output into utility space
where individuals, groups, and society at-large experience different welfare
changes due to classification assignments. Under this characterization,
predictions and fairness constraints are seen as shaping societal welfare and
distribution and revealing individuals' implied welfare weights in
society--weights that may then be interpreted through a fairness lens. The
social welfare formulation of the fairness problem brings to the fore concerns
of distributive justice that have always had a central albeit more implicit
role in standard algorithmic fairness approaches.
","[{""version"":""v1"",""created"":""Tue, 3 Jul 2018 12:57:59 GMT""}]","2018-07-04"
"1807.01135","Kanti Aggarwal Dr.","K. M. Aggarwal, R. Owada and A. Igarashi","Effective Collision Strengths for Allowed Transitions Among the $n \le$
  5 Degenerate Levels of Atomic Hydrogen","15pp of Text including 3 Tables and 6 Figures will appear in the
  journal ATOMS 6 (2018)",,,,"physics.atom-ph","http://arxiv.org/licenses/nonexclusive-distrib/1.0/","  We report calculations of collision strengths and effective collision
strengths for 26 allowed transitions among the $n \le$ 5 degenerate levels of
atomic hydrogen for which the close-coupling (CC) and Born approximations have
been used. Results are listed over a wide range of energies (up to 50~Ryd) and
temperatures (up to 10$^7$~K), sufficient for applications over a variety of
plasmas, including fusion. Similar results have also been calculated for
deuterium, but they negligibly differ with those of hydrogen.
","[{""version"":""v1"",""created"":""Tue, 3 Jul 2018 12:59:17 GMT""}]","2018-07-04"
"1807.01136","Masanari Kimura","Masanari Kimura, Takashi Yanagihara","Anomaly Detection Using GANs for Visual Inspection in Noisy Training
  Data",,,,,"cs.CV","http://arxiv.org/licenses/nonexclusive-distrib/1.0/","  The detection and the quantification of anomalies in image data are critical
tasks in industrial scenes such as detecting micro scratches on product. In
recent years, due to the difficulty of defining anomalies and the limit of
correcting their labels, research on unsupervised anomaly detection using
generative models has attracted attention. Generally, in those studies, only
normal images are used for training to model the distribution of normal images.
The model measures the anomalies in the target images by reproducing the most
similar images and scoring image patches indicating their fit to the learned
distribution. This approach is based on a strong presumption; the trained model
should not be able to generate abnormal images. However, in reality, the model
can generate abnormal images mainly due to noisy normal data which include
small abnormal pixels, and such noise severely affects the accuracy of the
model. Therefore, we propose a novel anomaly detection method to distort the
distribution of the model with existing abnormal images. The proposed method
detects pixel-level micro anomalies with a high accuracy from 1024x1024 high
resolution images which are actually used in an industrial scene. In this
paper, we share experimental results on open datasets, due to the
confidentiality of the data.
","[{""version"":""v1"",""created"":""Tue, 3 Jul 2018 13:03:11 GMT""},{""version"":""v2"",""created"":""Wed, 7 Nov 2018 15:44:07 GMT""}]","2018-11-08"
"1807.01137","Debasis Kundu Professor","Nandini Kannan and Debasis Kundu","Simple Step-Stress Models with a Cure Fraction",,,,,"stat.AP","http://arxiv.org/licenses/nonexclusive-distrib/1.0/","  In this article, we consider models for time-to-event data obtained from
experiments in which stress levels are altered at intermediate stages during
the observation period. These experiments, known as step-stress tests, belong
to the larger class of accelerated tests used extensively in the reliability
literature. The analysis of data from step-stress tests largely relies on the
popular cumulative exposure model. However, despite its simple form, the
utility of the model is limited, as it is assumed that the hazard function of
the underlying distribution is discontinuous at the points at which the stress
levels are changed, which may not be very reasonable. Due to this deficiency,
Kannan et al. \cite{KKNT:2010} introduced the cumulative risk model, where the
hazard function is continuous. In this paper we propose a class of parametric
models based on the cumulative risk model assuming the underlying population
contains long-term survivors or `cured' fraction. An EM algorithm to compute
the maximum likelihood estimators of the unknown parameters is proposed. This
research is motivated by a study on altitude decompression sickness. The
performance of different parametric models will be evaluated using data from
this study.
","[{""version"":""v1"",""created"":""Tue, 3 Jul 2018 13:06:38 GMT""}]","2018-07-04"
"1807.01138","Debasis Kundu Professor","Swagata Nandi and Debasis Kundu","Estimation of Parameters of Multiple Chirp Signal in presence of Heavy
  Tailed Errors",,,,,"eess.SP","http://arxiv.org/licenses/nonexclusive-distrib/1.0/","  In this paper, we consider the estimation of the unknown parameters of the
multiple chirp signal model in presence of additive error. The chirp signals
are quite common in many areas of science and engineering, specially sonar,
radar, audio signals etc. The observed signals are usually corrupted by noise.
In different signal processing applications it is observed that the errors may
be heavy tailed. In this paper it is assumed that the additive errors have mean
zero but may not have finite variance and are independent and identically
distributed. We consider the least squares estimators and the approximate least
squares estimators which maximize a periodogram like function. It has been
observed that both the estimators are strongly consistent. The asymptotic
distribution of the least squares estimators is obtained under the assumption
that the additive errors are from a symmetric stable distribution. The
approximate least squares estimators have the same asymptotic distribution as
the least squares estimators. We perform some numerical simulations to see how
the proposed estimators work. It is observed that the least squares estimators
perform slightly better than the approximately least squares estimators in
terms of the biases and mean absolute deviation.
","[{""version"":""v1"",""created"":""Tue, 3 Jul 2018 13:11:33 GMT""}]","2018-07-04"
"1807.01139","Seyed Akbar Jafari","Zahra Faraei, Tohid Farajollahpour, S. A. Jafari","Greens function of semi-infinite Weyl semimetals","please compile with .bbl file","Phys. Rev. B 98, 195402 (2018)","10.1103/PhysRevB.98.195402",,"cond-mat.str-el cond-mat.mtrl-sci hep-th","http://arxiv.org/licenses/nonexclusive-distrib/1.0/","  We classify all possible boundary conditions (BCs) for a Weyl material into
two classes: (i) BC that mixes the spin projection but does not change the
chirality attribute, and (ii) BC that mixes the chiralities. All BCs are
parameterized with angular variables that can be regarded as mixing angles
between spins or chiralities. Using the Greens function method, we show that
these two BCs faithfully reproduce the Fermi arcs. The parameters are
ultimately fixed by the orientation of Fermi arcs. We build on our
classification and show that in the presence of a background magnetic field,
only the second type BC gives rise to non-trivial Landau orbitals.
","[{""version"":""v1"",""created"":""Tue, 3 Jul 2018 13:12:08 GMT""}]","2018-11-08"
"1807.01141","Daniel Kral","Andrzej Grzesik, Daniel Kr\'al', L\'aszl\'o Mikl\'os Lov\'asz","Elusive extremal graphs",,,"10.1112/plms.12382",,"math.CO cs.DM","http://arxiv.org/licenses/nonexclusive-distrib/1.0/","  We study the uniqueness of optimal solutions to extremal graph theory
problems. Lovasz conjectured that every finite feasible set of subgraph density
constraints can be extended further by a finite set of density constraints so
that the resulting set is satisfied by an asymptotically unique graph. This
statement is often referred to as saying that `every extremal graph theory
problem has a finitely forcible optimum'. We present a counterexample to the
conjecture. Our techniques also extend to a more general setting involving
other types of constraints.
","[{""version"":""v1"",""created"":""Tue, 3 Jul 2018 13:15:09 GMT""},{""version"":""v2"",""created"":""Sun, 9 Aug 2020 09:28:21 GMT""}]","2020-08-26"
"1807.01143","Guixin Li Dr","Xuan Liu, Junhong Deng, King Fai Li, Yutao Tang, Mingke Jin, Jing
  Zhou, Xing Cheng, Wei Liu and Guixin Li","Planar Cassegrain-type Schwarzschild Objective with Optical Metasurfaces",,,,,"physics.optics","http://arxiv.org/licenses/nonexclusive-distrib/1.0/","  Curved reflective mirrors play an indispensable role in widely-employed
Cassegrain-type optics, which consequently are inevitably bulky, and thus
neither integratable nor well extendable. Through substituting geometric phase
based reflective metasurfaces for curved mirrors, here a planar Cassegrain-type
Schwarzschild objective is obtained, with both the focusing and imaging
functionalities experimentally verified. The planar reflective objective
achieved is intrinsically free of residual light and thus imposes less
stringent restrictions on illuminating light and nanofabrications compared to
its refractive counterpart. Our planar Cassegrain-type designs can potentially
reshape and simplify the core components of the microscope and telescope
systems working at a broadband spectral range, and thus opens new avenues for
designing compact imaging systems.
","[{""version"":""v1"",""created"":""Tue, 3 Jul 2018 13:15:36 GMT""}]","2018-07-04"
"1807.01145","Miriam Brosi","Miriam Brosi, Johannes L. Steinmann, Edmund Blomley, Erik
  Br\""undermann, Julian Gethmann, Benjamin Kehrer, Yves-Laurent Mathis,
  Alexander Papash, Manuel Schedler, Patrik Sch\""onfeldt, Marcel Schuh, Markus
  Schwarz, Michele Caselle, Lorenzo Rota, Marc Weber, Peter Kuske, Anke-Susanne
  M\""uller","Systematic Studies of the Micro-Bunching Instability at Very Low Bunch
  Charges","6 pages, 5 figures, to be submitted","Phys. Rev. Accel. Beams 22, 020701 (2019)","10.1103/PhysRevAccelBeams.22.020701",,"physics.acc-ph","http://arxiv.org/licenses/nonexclusive-distrib/1.0/","  At KARA, the KArlsruhe Research Accelerator of the KIT synchrotron, the so
called short bunch operation mode allows the reduction of the bunch length down
to a few picoseconds. The micro- bunching instability resulting from the high
degree of longitudinal compression leads to fluctuations in the emitted THz
radiation, referred to as bursting. For extremely compressed bunches at KARA,
bursting occurs not only in one but in two different bunch-current ranges that
are separated by a stable region. This work presents measurements of the
bursting behavior in both regimes. Good agreement is found between data and
numerical solutions of the Vlasov-Fokker-Planck equation.
","[{""version"":""v1"",""created"":""Tue, 3 Jul 2018 13:18:15 GMT""}]","2019-02-15"
"1807.01150","Zach Meisel","Zach Meisel, Alex Deibel, Laurens Keek, Peter Shternin, Justin Elfritz","Nuclear Physics of the Outer Layers of Accreting Neutron Stars","Invited review to appear in Journal of Physics G (70 pages)","Journal of Physics G, 45, 093001 (2018","10.1088/1361-6471/aad171",,"astro-ph.HE","http://arxiv.org/licenses/nonexclusive-distrib/1.0/","  Now 50 years since the existence of the neutron star crust was proposed, we
review the current understanding of the nuclear physics of the outer layers of
accreting neutron stars. Nuclei produced during nuclear burning replace the
nascent composition of the neutron star ocean and crust. Non-equilibrium
nuclear reactions driven by compression alter the outer thermal structure and
chemical composition, leaving observable imprints on astronomical phenomena. As
observations of bursting neutron stars and cooling neutron stars have
increased, the recent volume of astronomical data allows new insights into the
microphysics of the neutron star interior and the possibility to test nuclear
physics input in model calculations. Despite numerous advances in our
understanding of neutron star interiors and observed neutron star phenomena,
many challenges remain in the astrophysics theory of accreting neutron stars,
the nuclear theory of neutron-rich nuclei, and the reach and precision of
terrestrial nuclear physics experiments.
","[{""version"":""v1"",""created"":""Tue, 3 Jul 2018 13:20:49 GMT""}]","2018-08-09"
"1807.01152","Claudia Tarantola Dr","Ioannis Ntzoufras, Claudia Tarantola and Monia Lupparelli","Probability Based Independence Sampler for Bayesian Quantitative
  Learning in Graphical Log-Linear Marginal Models",,,,,"stat.ME","http://arxiv.org/licenses/nonexclusive-distrib/1.0/","  Bayesian methods for graphical log-linear marginal models have not been
developed in the same extent as traditional frequentist approaches. In this
work, we introduce a novel Bayesian approach for quantitative learning for such
models. These models belong to curved exponential families that are difficult
to handle from a Bayesian perspective. Furthermore, the likelihood cannot be
analytically expressed as a function of the marginal log-linear interactions,
but only in terms of cell counts or probabilities.
  Posterior distributions cannot be directly obtained, and MCMC methods are
needed. Finally, a well-defined model requires parameter values that lead to
compatible marginal probabilities. Hence, any MCMC should account for this
important restriction. We construct a fully automatic and efficient MCMC
strategy for quantitative learning for graphical log-linear marginal models
that handles these problems. While the prior is expressed in terms of the
marginal log-linear interactions, we build an MCMC algorithm that employs a
proposal on the probability parameter space. The corresponding proposal on the
marginal log-linear interactions is obtained via parameter transformation.
  By this strategy, we achieve to move within the desired target space. At each
step, we directly work with well-defined probability distributions.
  Moreover, we can exploit a conditional conjugate setup to build an efficient
proposal on probability parameters. The proposed methodology is illustrated by
a simulation study and a real dataset.
","[{""version"":""v1"",""created"":""Tue, 3 Jul 2018 13:21:05 GMT""}]","2018-07-04"
"1807.01153","Davide Franco","Vincenzo Di Gennaro and Davide Franco","On a resolution of singularities with two strata","19 pages, no figures",,,,"math.AG","http://arxiv.org/licenses/nonexclusive-distrib/1.0/","  Let $X$ be a complex, irreducible, quasi-projective variety, and
$\pi:\widetilde X\to X$ a resolution of singularities of $X$. Assume that the
singular locus ${\text{Sing}}(X)$ of $X$ is smooth, that the induced map
$\pi^{-1}({\text{Sing}}(X))\to {\text{Sing}}(X)$ is a smooth fibration
admitting a cohomology extension of the fiber, and that
$\pi^{-1}({\text{Sing}}(X))$ has a negative normal bundle in $\widetilde X$. We
present a very short and explicit proof of the Decomposition Theorem for $\pi$,
providing a way to compute the intersection cohomology of $X$ by means of the
cohomology of $\widetilde X$ and of $\pi^{-1}({\text{Sing}}(X))$. Our result
applies to special Schubert varieties with two strata, even if $\pi$ is
non-small. And to certain hypersurfaces of $\mathbb P^5$ with one-dimensional
singular locus.
","[{""version"":""v1"",""created"":""Tue, 3 Jul 2018 13:21:19 GMT""}]","2018-07-04"
"1807.01158","el Houcein el Abdalaoui","el Houcein el Abdalaoui and Xiangdong Ye","On the pointwise convergence of the cubic average with multiplicative or
  von Mangoldt weights","16 pages. In this paper we gives a positive answer to the question
  asked in arXiv:1606.05630 by applying the uniform version of Gowers inverse
  theorem due to T. Tao. arXiv admin note: text overlap with arXiv:1606.05630,
  arXiv:1504.00950",,,,"math.DS math.NT","http://arxiv.org/licenses/nonexclusive-distrib/1.0/","  It is shown that the cubic nonconventional ergodic averages of any order with
a bounded aperiodic multiplicative function or von Mangoldt weights converge
almost surely.
","[{""version"":""v1"",""created"":""Mon, 2 Jul 2018 16:03:19 GMT""}]","2018-07-04"
