"1807.02580","Justyna Rych{\l}y","J. Rych{\l}y, V. S. Tkachenko, J. W. K{\l}os, A. Kuchko, M. Krawczyk","Spin wave modes in a cylindrical nanowire in crossover dipolar-exchange
  regime","21 pages, 5 figures","J. Phys. D: Appl. Phys., 52, 075003 (2019)","10.1088/1361-6463/aaf2fc",,"cond-mat.mes-hall","http://arxiv.org/licenses/nonexclusive-distrib/1.0/","  Nanoscale magnetic systems have been studied extensively in various
geometries, such as wires of different cross-sections, arrays of wires, dots,
rings, etc. Such systems have interesting physical properties and promising
applications in advanced magnetic devices. Uniform magnetic nanowires are the
basic structures which were broadly investigated. However, some of their
dynamical properties, like: (anti)crossing between the spin wave modes and
impact of the magnetic field on spin wave spectrum, still need to be exploited.
We continue this research by investigation of the spin wave dynamics in solid
Ni nanowire of the circular cross-section. We use two approaches:
semi-analytical calculations and numerical computations based on finite element
method. We solve coupled Landau-Lifshitz and Maxwell equations and consider
both magnetostatic and exchange interactions. We identify the dispersion
brunches and its (anti)crossing by plotting the spatial profiles of spin wave
amplitudes and magnetostatic potential. We also check how we can tune the
spectrum of the modes by application of the external magnetic field and how it
affects the modes and their dominating type of interaction.
","[{""version"":""v1"",""created"":""Fri, 6 Jul 2018 22:30:36 GMT""},{""version"":""v2"",""created"":""Tue, 10 Jul 2018 17:24:01 GMT""},{""version"":""v3"",""created"":""Mon, 23 Jul 2018 22:56:59 GMT""}]","2019-04-16"
"1807.02581","Stanislav Fort","Stanislav Fort, Adam Scherlis","The Goldilocks zone: Towards better understanding of neural network loss
  landscapes","8 pages, 15 figures. Accepted for publication at the Thirty-Third
  AAAI Conference on Artificial Intelligence (AAAI-19). A subset of the paper
  accepted at Modern Trends in Nonconvex Optimization for Machine Learning
  workshop at the 35th International Conference on Machine Learning (ICML
  2018), and BayLearn 2018",,,,"cs.LG cs.NE stat.ML","http://arxiv.org/licenses/nonexclusive-distrib/1.0/","  We explore the loss landscape of fully-connected and convolutional neural
networks using random, low-dimensional hyperplanes and hyperspheres. Evaluating
the Hessian, $H$, of the loss function on these hypersurfaces, we observe 1) an
unusual excess of the number of positive eigenvalues of $H$, and 2) a large
value of $\mathrm{Tr}(H) / ||H||$ at a well defined range of configuration
space radii, corresponding to a thick, hollow, spherical shell we refer to as
the \textit{Goldilocks zone}. We observe this effect for fully-connected neural
networks over a range of network widths and depths on MNIST and CIFAR-10
datasets with the $\mathrm{ReLU}$ and $\tanh$ non-linearities, and a similar
effect for convolutional networks. Using our observations, we demonstrate a
close connection between the Goldilocks zone, measures of local
convexity/prevalence of positive curvature, and the suitability of a network
initialization. We show that the high and stable accuracy reached when
optimizing on random, low-dimensional hypersurfaces is directly related to the
overlap between the hypersurface and the Goldilocks zone, and as a corollary
demonstrate that the notion of intrinsic dimension is initialization-dependent.
We note that common initialization techniques initialize neural networks in
this particular region of unusually high convexity/prevalence of positive
curvature, and offer a geometric intuition for their success. Furthermore, we
demonstrate that initializing a neural network at a number of points and
selecting for high measures of local convexity such as $\mathrm{Tr}(H) /
||H||$, number of positive eigenvalues of $H$, or low initial loss, leads to
statistically significantly faster training on MNIST. Based on our
observations, we hypothesize that the Goldilocks zone contains an unusually
high density of suitable initialization configurations.
","[{""version"":""v1"",""created"":""Fri, 6 Jul 2018 22:31:53 GMT""},{""version"":""v2"",""created"":""Mon, 12 Nov 2018 10:29:42 GMT""}]","2018-11-13"
"1807.02582","Motonobu Kanagawa","Motonobu Kanagawa, Philipp Hennig, Dino Sejdinovic, Bharath K
  Sriperumbudur","Gaussian Processes and Kernel Methods: A Review on Connections and
  Equivalences","64 pages",,,,"stat.ML cs.LG","http://arxiv.org/licenses/nonexclusive-distrib/1.0/","  This paper is an attempt to bridge the conceptual gaps between researchers
working on the two widely used approaches based on positive definite kernels:
Bayesian learning or inference using Gaussian processes on the one side, and
frequentist kernel methods based on reproducing kernel Hilbert spaces on the
other. It is widely known in machine learning that these two formalisms are
closely related; for instance, the estimator of kernel ridge regression is
identical to the posterior mean of Gaussian process regression. However, they
have been studied and developed almost independently by two essentially
separate communities, and this makes it difficult to seamlessly transfer
results between them. Our aim is to overcome this potential difficulty. To this
end, we review several old and new results and concepts from either side, and
juxtapose algorithmic quantities from each framework to highlight close
similarities. We also provide discussions on subtle philosophical and
theoretical differences between the two approaches.
","[{""version"":""v1"",""created"":""Fri, 6 Jul 2018 22:44:10 GMT""}]","2018-07-10"
"1807.02583","Christine Cartwright Miss","Christine Cartwright, Gabriele De Chiara, Matteo Rizzi","The Rhombi-Chain Bose-Hubbard Model: geometric frustration and
  interactions","12 pages, 11 figures","Phys. Rev. B 98, 184508 (2018)","10.1103/PhysRevB.98.184508",,"cond-mat.quant-gas cond-mat.str-el quant-ph","http://arxiv.org/licenses/nonexclusive-distrib/1.0/","  We explore the effects of geometric frustration within a one-dimensional
Bose-Hubbard model using a chain of rhombi subject to a magnetic flux. The
competition of tunnelling, self-interaction and magnetic flux gives rise to the
emergence of a pair-superfluid (pair-Luttinger liquid) phase besides the more
conventional Mott-insulator and superfluid (Luttinger liquid) phases. We
compute the complete phase diagram of the model by identifying characteristic
properties of the pair-Luttinger liquid phase such as pair correlation
functions and structure factors and find that the pair-Luttinger liquid phase
is very sensitive to changes away from perfect frustration (half-flux). We
provide some proposals to make the model more resilient to variants away from
perfect frustration. We also study the bipartite entanglement properties of the
chain. We discover that, while the scaling of the block entropy pair-superfluid
and of the single-particle superfluid leads to the same central charge, the
properties of the low-lying entanglement spectrum levels reveal their
fundamental difference.
","[{""version"":""v1"",""created"":""Fri, 6 Jul 2018 22:47:54 GMT""},{""version"":""v2"",""created"":""Tue, 10 Jul 2018 09:19:13 GMT""},{""version"":""v3"",""created"":""Tue, 20 Nov 2018 14:36:31 GMT""}]","2018-11-21"
"1807.02584","Masamune Oguri","Masamune Oguri","Effect of gravitational lensing on the distribution of gravitational
  waves from distant binary black hole mergers","15 pages, 13 figures, accepted for publication in MNRAS","Mon.Not.Roy.Astron.Soc.480:3842-3855,2018","10.1093/mnras/sty2145",,"astro-ph.CO","http://arxiv.org/licenses/nonexclusive-distrib/1.0/","  The detailed observation of the distribution of redshifts and chirp masses of
binary black hole mergers is expected to provide a clue to their origin. In
this paper, we develop a hybrid model of the probability distribution function
of gravitational lensing magnification taking account of both strong and weak
gravitational lensing, and use it to study the effect of gravitational lensing
magnification on the distribution of gravitational waves from distant binary
black hole mergers detected in ongoing and future gravitational wave
observations. We find that the effect of gravitational lensing magnification is
significant at high ends of observed chirp mass and redshift distributions.
While a high mass tail in the observed chirp mass distribution is produced by
highly magnified gravitational lensing events, we find that highly demagnified
images of strong lensing events produce a high redshift ($z_{\rm obs}> 15$)
tail in the observed redshift distribution, which can easily be observed in the
third-generation gravitational wave observatories. Such a demagnified,
apparently high redshift event is expected to be accompanied by a magnified
image that is observed typically $10-100$ days before the demagnified image.
For highly magnified events that produce apparently very high chirp masses, we
expect pairs of events with similar magnifications with time delays typically
less than a day. This work suggests the critical importance of gravitational
lensing (de-)magnification on the interpretation of apparently very high mass
or redshift gravitational wave events.
","[{""version"":""v1"",""created"":""Fri, 6 Jul 2018 22:49:47 GMT""},{""version"":""v2"",""created"":""Mon, 6 Aug 2018 12:13:13 GMT""}]","2019-06-11"
"1807.02585","Steve Lawford","Marius Agasse-Duval, Steve Lawford","Subgraphs and motifs in a dynamic airline network","41 pages, 17 figures",,,,"cs.SI physics.soc-ph","http://arxiv.org/licenses/nonexclusive-distrib/1.0/","  How does the small-scale topological structure of an airline network behave
as the network evolves? To address this question, we study the dynamic
properties of small undirected subgraphs using 15 years of data on Southwest
Airlines' domestic route service. We use exact enumeration formulae to identify
statistically over- and under-represented subgraphs, known as motifs and
anti-motifs. We discover substantial topology transitions in Southwest's
network and provide evidence for time-varying power-law scaling between
subgraph counts and the number of edges in the network. We also suggest a
node-ranking measure that can identify important nodes relative to specific
local topologies. Our results extend the toolkit of subgraph-based methods and
provide new insight into transportation networks and the strategic behaviour of
firms.
","[{""version"":""v1"",""created"":""Fri, 6 Jul 2018 23:36:03 GMT""},{""version"":""v2"",""created"":""Tue, 27 Oct 2020 17:16:09 GMT""}]","2020-10-28"
"1807.02586","Satadal Datta","Satadal Datta","Lagrangian Description in the context of Emergent spacetime","The paper has been withdrawn since the author has recently found a
  major mistake in section 5.4. The entire work has now been redone (following
  a new direction) and expanded, and the modified/corrected/expanded manuscript
  (written with a co-author) will soon be submitted in the arxive as a
  fresh/new submission",,,,"gr-qc","http://arxiv.org/licenses/nonexclusive-distrib/1.0/","  We make use of the Lagrangian description of fluid motion to highlight
certain features in the context of spacetime geometry as emergent phenomena in
fluid systems. We find by using Lagrangian Perturbation Theory (LPT), that not
all kind of perturbations on a steady state flow can produce analogue spacetime
effect. We also explore the manifold structure of emergent spacetime by using
the Lagrangian description of fluid motion. We restrict ourselves to
nonrelativistic flows.
","[{""version"":""v1"",""created"":""Fri, 6 Jul 2018 23:39:48 GMT""},{""version"":""v2"",""created"":""Fri, 27 Sep 2019 22:29:33 GMT""}]","2019-10-01"
"1807.02587","Kihwan Kim","Ben Eckart and Kihwan Kim and Jan Kautz","Fast and Accurate Point Cloud Registration using Trees of Gaussian
  Mixtures","ECCV 2018",,,,"cs.CV","http://arxiv.org/licenses/nonexclusive-distrib/1.0/","  Point cloud registration sits at the core of many important and challenging
3D perception problems including autonomous navigation, SLAM, object/scene
recognition, and augmented reality. In this paper, we present a new
registration algorithm that is able to achieve state-of-the-art speed and
accuracy through its use of a hierarchical Gaussian Mixture Model (GMM)
representation. Our method constructs a top-down multi-scale representation of
point cloud data by recursively running many small-scale data likelihood
segmentations in parallel on a GPU. We leverage the resulting representation
using a novel PCA-based optimization criterion that adaptively finds the best
scale to perform data association between spatial subsets of point cloud data.
Compared to previous Iterative Closest Point and GMM-based techniques, our
tree-based point association algorithm performs data association in
logarithmic-time while dynamically adjusting the level of detail to best match
the complexity and spatial distribution characteristics of local scene
geometry. In addition, unlike other GMM methods that restrict covariances to be
isotropic, our new PCA-based optimization criterion well-approximates the true
MLE solution even when fully anisotropic Gaussian covariances are used.
Efficient data association, multi-scale adaptability, and a robust MLE
approximation produce an algorithm that is up to an order of magnitude both
faster and more accurate than current state-of-the-art on a wide variety of 3D
datasets captured from LiDAR to structured light.
","[{""version"":""v1"",""created"":""Fri, 6 Jul 2018 23:44:51 GMT""}]","2018-07-10"
"1807.02588","Stanislav Pidhorskyi","Stanislav Pidhorskyi, Ranya Almohsen, Donald A Adjeroh, Gianfranco
  Doretto","Generative Probabilistic Novelty Detection with Adversarial Autoencoders",,,,,"cs.CV cs.LG","http://arxiv.org/licenses/nonexclusive-distrib/1.0/","  Novelty detection is the problem of identifying whether a new data point is
considered to be an inlier or an outlier. We assume that training data is
available to describe only the inlier distribution. Recent approaches primarily
leverage deep encoder-decoder network architectures to compute a reconstruction
error that is used to either compute a novelty score or to train a one-class
classifier. While we too leverage a novel network of that kind, we take a
probabilistic approach and effectively compute how likely is that a sample was
generated by the inlier distribution. We achieve this with two main
contributions. First, we make the computation of the novelty probability
feasible because we linearize the parameterized manifold capturing the
underlying structure of the inlier distribution, and show how the probability
factorizes and can be computed with respect to local coordinates of the
manifold tangent space. Second, we improved the training of the autoencoder
network. An extensive set of results show that the approach achieves
state-of-the-art results on several benchmark datasets.
","[{""version"":""v1"",""created"":""Fri, 6 Jul 2018 23:46:30 GMT""},{""version"":""v2"",""created"":""Sat, 10 Nov 2018 01:39:29 GMT""}]","2021-02-23"
"1807.02589","Stephane Chretien","Stephane Chretien","A note on computing the Smallest Conic Singular Value",,,,,"math.NA","http://arxiv.org/licenses/nonexclusive-distrib/1.0/","  The goal of this note is to study the smallest conic singular value of a
matrix from a Lagrangian duality viewpoint and provide an efficient method for
its computation.
","[{""version"":""v1"",""created"":""Fri, 6 Jul 2018 23:47:17 GMT""}]","2018-07-10"
"1807.02590","Ottmar Cronie","M. Mehdi Moradi, Ottmar Cronie, Ege Rubak, Raphael Lachieze-Rey, Jorge
  Mateu, Adrian Baddeley","Resample-smoothing of Voronoi intensity estimators",,,,,"stat.ME","http://arxiv.org/licenses/nonexclusive-distrib/1.0/","  Voronoi intensity estimators, which are non-parametric estimators for
intensity functions of point processes, are both parameter-free and adaptive;
the intensity estimate at a given location is given by the reciprocal size of
the Voronoi/Dirichlet cell containing that location. Their major drawback,
however, is that they tend to under-smooth the data in regions where the point
density of the observed point pattern is high and over-smooth in regions where
the point density is low. To remedy this problem, i.e. to find some
middle-ground between over- and under-smoothing, we propose an additional
smoothing technique for Voronoi intensity estimators for point processes in
arbitrary metric spaces, which is based on repeated independent thinnings of
the point process/pattern. Through a simulation study we show that our
resample-smoothing technique improves the estimation significantly. In
addition, we study statistical properties such as unbiasedness and variance,
and propose a rule-of-thumb and a data-driven cross-validation approach to
choose the amount of thinning/smoothing to apply. We finally apply our proposed
intensity estimation scheme to two datasets: locations of pine saplings (planar
point pattern) and motor vehicle traffic accidents (linear network point
pattern).
","[{""version"":""v1"",""created"":""Fri, 6 Jul 2018 23:49:26 GMT""}]","2018-07-10"
"1807.02591","Benjamin Filippenko","Benjamin Filippenko, Zhengyi Zhou, Katrin Wehrheim","Counterexamples in Scale Calculus","published in PNAS, final version","Proceedings of the National Academy of Sciences, Vol. 116, no. 18,
  year 2019, pages 8787--8797","10.1073/pnas.1811701116",,"math.SG math.CA","http://arxiv.org/licenses/nonexclusive-distrib/1.0/","  We construct counterexamples to classical calculus facts such as the Inverse
and Implicit Function Theorems in Scale Calculus -- a generalization of
Multivariable Calculus to infinite dimensional vector spaces in which the
reparameterization maps relevant to Symplectic Geometry are smooth. Scale
Calculus is a cornerstone of Polyfold Theory, which was introduced by
Hofer-Wysocki-Zehnder as a broadly applicable tool for regularizing moduli
spaces of pseudoholomorphic curves. We show how the novel nonlinear
scale-Fredholm notion in Polyfold Theory overcomes the lack of Implicit
Function Theorems, by formally establishing an often implicitly used fact: The
differentials of basic germs -- the local models for scale-Fredholm maps --
vary continuously in the space of bounded operators when the base point
changes. We moreover demonstrate that this continuity holds only in specific
coordinates, by constructing an example of a scale-diffeomorphism and
scale-Fredholm map with discontinuous differentials. This justifies the high
technical complexity in the foundations of Polyfold Theory.
","[{""version"":""v1"",""created"":""Sat, 7 Jul 2018 00:01:08 GMT""},{""version"":""v2"",""created"":""Sat, 26 Jan 2019 20:02:53 GMT""},{""version"":""v3"",""created"":""Thu, 27 Jun 2019 13:01:33 GMT""}]","2022-07-06"
"1807.02592","Marissa Walker","Marissa Walker, Alfonso F. Agnew, Jeffrey Bidler, Andrew Lundgren,
  Alexandra Macedo, Duncan Macleod, T.J. Massinger, Oliver Patane, and Joshua
  R. Smith","Identifying correlations between LIGO's astronomical range and auxiliary
  sensors using lasso regression",,,"10.1088/1361-6382/aae593",,"astro-ph.IM","http://arxiv.org/licenses/nonexclusive-distrib/1.0/","  The range to which the Laser Interferometer Gravitational-Wave Observatory
(LIGO) can observe astrophysical systems varies over time, limited by noise in
the instruments and their environments. Identifying and removing the sources of
noise that limit LIGO's range enables higher signal-to-noise observations and
increases the number of observations. The LIGO observatories are continuously
monitored by hundreds of thousands of auxiliary channels that may contain
information about these noise sources. This paper describes an algorithm that
uses linear regression, namely lasso (least absolute shrinkage and selection
operator) regression, to analyze all of these channels and identify a small
subset of them that can be used to reconstruct variations in LIGO's
astrophysical range. Exemplary results of the application of this method to
three different periods of LIGO Livingston data are presented, along with
computational performance and current limitations.
","[{""version"":""v1"",""created"":""Sat, 7 Jul 2018 00:17:43 GMT""},{""version"":""v2"",""created"":""Tue, 23 Oct 2018 23:52:36 GMT""}]","2018-10-25"
"1807.02593","Arash Shaghaghi","Arash Shaghaghi, Salil S. Kanhere, Mohamed Ali Kaafar, Elisa Bertino,
  Sanjay Jha","Gargoyle: A Network-based Insider Attack Resilient Framework for
  Organizations","Accepted to IEEE LCN 2018 as full paper, Pre-final version - slightly
  different than the final version published by the conference",,,,"cs.CR cs.NI","http://arxiv.org/licenses/nonexclusive-distrib/1.0/","  `Anytime, Anywhere' data access model has become a widespread IT policy in
organizations making insider attacks even more complicated to model, predict
and deter. Here, we propose Gargoyle, a network-based insider attack resilient
framework against the most complex insider threats within a pervasive computing
context. Compared to existing solutions, Gargoyle evaluates the trustworthiness
of an access request context through a new set of contextual attributes called
Network Context Attribute (NCA). NCAs are extracted from the network traffic
and include information such as the user's device capabilities, security-level,
current and prior interactions with other devices, network connection status,
and suspicious online activities. Retrieving such information from the user's
device and its integrated sensors are challenging in terms of device
performance overheads, sensor costs, availability, reliability and
trustworthiness. To address these issues, Gargoyle leverages the capabilities
of Software-Defined Network (SDN) for both policy enforcement and
implementation. In fact, Gargoyle's SDN App can interact with the network
controller to create a `defence-in-depth' protection system. For instance,
Gargoyle can automatically quarantine a suspicious data requestor in the
enterprise network for further investigation or filter out an access request
before engaging a data provider. Finally, instead of employing simplistic
binary rules in access authorizations, Gargoyle incorporates Function-based
Access Control (FBAC) and supports the customization of access policies into a
set of functions (e.g., disabling copy, allowing print) depending on the
perceived trustworthiness of the context.
","[{""version"":""v1"",""created"":""Sat, 7 Jul 2018 00:18:10 GMT""}]","2018-07-10"
"1807.02594","Massimo Tinto","Massimo Tinto and Olaf Hartwig","Time-Delay Interferometry and Clock-Noise Calibration","This article is 17 pages long and contains 2 figures","Phys. Rev. D 98, 042003 (2018)","10.1103/PhysRevD.98.042003",,"gr-qc","http://arxiv.org/licenses/nonexclusive-distrib/1.0/","  The Laser Interferometer Space Antenna is a joint ESA-NASA space-mission to
detect and study mHz cosmic gravitational waves. The trajectories followed by
its three spacecraft result in unequal- and time-varying arms, requiring use of
the Time-Delay Interferometry (TDI) post- processing technique to cancel the
laser phase noises affecting the heterodyne one-way Doppler measurements.
Although the second-generation formulation of TDI cancels the laser phase
noises when the array is both rotating and ""flexing"", second-generation TDI
combinations for which the phase fluctuations of the onboard ultra stable
oscillators (USOs) can be calibrated out have not appeared yet in the
literature. In this article we present the solution of this problem by
generalizing to the realistic LISA trajectory the USO calibration algorithm
derived by Armstrong, Estabrook and Tinto for a static configuration.
","[{""version"":""v1"",""created"":""Sat, 7 Jul 2018 00:19:54 GMT""}]","2018-08-29"
"1807.02595","Eleonora Catsigeras","Eleonora Catsigeras","Ergodic Theorems for the Transfer Operators of Noisy Dynamical Systems",,,,,"math.DS","http://arxiv.org/licenses/nonexclusive-distrib/1.0/","  We consider stationary stochastic dynamical systems evolving on a compact
metric space, by perturbing a deterministic dynamics with a random noise, added
according to an arbitrary probabilistic distribution. We prove the maximal and
pointwise ergodic theorems for the transfer operators associated to such
systems. The results are extensions to noisy systems of some of the fundamental
ergodic theorems for deterministic systems.
","[{""version"":""v1"",""created"":""Sat, 7 Jul 2018 00:24:24 GMT""}]","2018-07-10"
