"1807.02634","Fu-Chen Hsiao","Fu-Chen Hsiao, Ching-Tarng Liang, Yia-Chung Chang, John M. Dallesasse","Effective bond-orbital model of III-nitride wurtzite structures based on
  modified interaction parameters of zinc-blende structures",,,,,"cond-mat.mtrl-sci","http://arxiv.org/licenses/nonexclusive-distrib/1.0/","  A simple theoretical method for deducing the effective bond-orbital model
(EBOM) of III-nitride wurtzite (WZ) semiconductors is presented. In this model,
the interaction parameters for zinc-blende (ZB) structures are used as an
initial guess for WZ structure based on the two-center approximation. The
electronic band structure of III-nitride WZ semiconductors can hence be
produced by utilizing this set of parameters modified to include effects due to
three-center integrals and fitting with first-principles calculations. Details
of the semi-empirical fitting procedure for constructing the EBOM Hamiltonian
for bulk III-nitride WZ semiconductors are presented. The electronic band
structure of bulk AlN, GaN, and InN with WZ structure calculated by EBOM with
modified interaction parameters are shown and compared to the results obtained
from density functional (DFT) theory with meta-generalized gradient
approximation (mGGA). The set of parameters are further optimized by using a
genetic algorithm. In the end, electronic band structures and electron (hole)
effective masses near the zone center calculated by the proposed model with
best fitting parameters are analyzed and compared with the $\mathbf{k}\cdot
\mathbf{p}$ model.
","[{""version"":""v1"",""created"":""Sat, 7 Jul 2018 08:53:18 GMT""},{""version"":""v2"",""created"":""Mon, 4 Nov 2019 03:48:49 GMT""}]","2019-11-05"
"1807.02635","Yunseok Jang","Yunseok Jang, Gunhee Kim, Yale Song","Video Prediction with Appearance and Motion Conditions","Accepted paper at ICML 2018. Project page:
  http://vision.snu.ac.kr/projects/amc-gan",,,,"cs.CV","http://arxiv.org/licenses/nonexclusive-distrib/1.0/","  Video prediction aims to generate realistic future frames by learning dynamic
visual patterns. One fundamental challenge is to deal with future uncertainty:
How should a model behave when there are multiple correct, equally probable
future? We propose an Appearance-Motion Conditional GAN to address this
challenge. We provide appearance and motion information as conditions that
specify how the future may look like, reducing the level of uncertainty. Our
model consists of a generator, two discriminators taking charge of appearance
and motion pathways, and a perceptual ranking module that encourages videos of
similar conditions to look similar. To train our model, we develop a novel
conditioning scheme that consists of different combinations of appearance and
motion conditions. We evaluate our model using facial expression and human
action datasets and report favorable results compared to existing methods.
","[{""version"":""v1"",""created"":""Sat, 7 Jul 2018 08:55:10 GMT""}]","2018-07-10"
"1807.02636","Vladimir Maisheev","Yu. A. Chesnokov and V.A. Maisheev","High energy neutrino beam generation based on crystal optics","16 pages, 6 figures, Latex",,"10.1016/j.nima.2018.08.116",,"physics.acc-ph hep-ex","http://arxiv.org/licenses/nonexclusive-distrib/1.0/","  The problem of creation of high energy neutrino beams on the basis of modern
and future circular proton accelerators with the help of traditional technology
seems to be expensive and difficult. Because of this, we propose the solution
of this problem based on the usage of focusing bend single crystals. In the
paper we demonstrate the possibilities of acceptance and focusing of a pion
beam with the help of a crystal optical lens system. As an illustration of
these features the calculated neutrino fluxes for energy of circulating proton
beam equal to 6.5 TeV are presented.
","[{""version"":""v1"",""created"":""Sat, 7 Jul 2018 09:09:19 GMT""}]","2018-10-17"
"1807.02637","Dejan Lavbi\v{c}","Dejan Lavbi\v{c}, Tadej Matek and Alja\v{z} Zrnec","Recommender system for learning SQL using hints","18 pages, 8 figures, 2 tables","Interactive learning environments 25 (2017) 1048 - 1064","10.1080/10494820.2016.1244084",,"cs.AI","http://arxiv.org/licenses/nonexclusive-distrib/1.0/","  Today's software industry requires individuals who are proficient in as many
programming languages as possible. Structured query language (SQL), as an
adopted standard, is no exception, as it is the most widely used query language
to retrieve and manipulate data. However, the process of learning SQL turns out
to be challenging. The need for a computer-aided solution to help users learn
SQL and improve their proficiency is vital. In this study, we present a new
approach to help users conceptualize basic building blocks of the language
faster and more efficiently. The adaptive design of the proposed approach aids
users in learning SQL by supporting their own path to the solution and
employing successful previous attempts, while not enforcing the ideal solution
provided by the instructor. Furthermore, we perform an empirical evaluation
with 93 participants and demonstrate that the employment of hints is
successful, being especially beneficial for users with lower prior knowledge.
","[{""version"":""v1"",""created"":""Sat, 7 Jul 2018 09:13:34 GMT""}]","2018-07-10"
"1807.02638","Joanna Drazkowska","Joanna Drazkowska and Judit Szul\'agyi","Dust evolution and satellitesimal formation in circumplanetary disks","Accepted for publication in ApJ. Revised version addressing comments
  from referee and community",,"10.3847/1538-4357/aae0fd",,"astro-ph.EP","http://arxiv.org/licenses/nonexclusive-distrib/1.0/","  It is believed that satellites of giant planets form in circumplanetary
disks. Many of the previous contributions assumed that their formation process
proceeds similarly to rocky planet formation, via accretion of the satellite
seeds, called satellitesimals. However, the satellitesimal formation itself
poses a nontrivial problem as the dust evolution in the circumplanetary disk is
heavily impacted by fast radial drift and thus dust growth to satellitesimals
is hindered. To address this problem, we connected state-of-the-art
hydrodynamical simulations of a circumplanetary disk around a Jupiter-mass
planet with dust growth and drift model in a post-processing step. We found
that there is an efficient pathway to satellitesimal formation if there is a
dust trap forming within the disk. Thanks to the natural existence of an
outward gas flow region in the hydrodynamical simulation, a significant dust
trap arises at the radial distance of 85~R$_{\rm J}$ from the planet, where the
dust-to-gas ratio becomes high enough to trigger streaming instability. The
streaming instability leads to the efficient formation of the satellite seeds.
Because of the constant infall of material from the circumstellar disk and the
very short timescale of dust evolution, the circumplanetary disk acts as a
satellitesimal factory, constantly processing the infalling dust to pebbles
that gather in the dust trap and undergo the streaming instability.
","[{""version"":""v1"",""created"":""Sat, 7 Jul 2018 09:30:05 GMT""},{""version"":""v2"",""created"":""Tue, 11 Sep 2018 14:03:09 GMT""}]","2018-12-05"
"1807.02639","Sebastian De Haro","Sebastian De Haro and Henk W. de Regt","A Precipice Below Which Lies Absurdity? Theories without a Spacetime and
  Scientific Understanding","28 pages, forthcoming in Synthese",,,,"physics.hist-ph","http://arxiv.org/licenses/nonexclusive-distrib/1.0/","  While the relation between visualization and scientific understanding has
been a topic of long-standing discussion, recent developments in physics have
pushed the boundaries of this debate to new and still unexplored realms. For it
is claimed that, in certain theories of quantum gravity, spacetime
'disappears': and this suggests that one may have sensible physical theories in
which spacetime is completely absent. This makes the philosophical question
whether such theories are intelligible, even more pressing. And if such
theories are intelligible, the question then is how they manage to do so. In
this paper, we adapt the contextual theory of scientific understanding,
developed by one of us, to fit the novel challenges posed by physical theories
without spacetime. We construe understanding as a matter of skill rather than
just knowledge. The appeal is thus to understanding, rather than explanation,
because we will be concerned with the tools that scientists have at their
disposal for understanding these theories. Our central thesis is that such
physical theories can provide scientific understanding, and that such
understanding does not require spacetimes of any sort. Our argument consists of
four consecutive steps: (a) We argue, from the general theory of scientific
understanding, that although visualization is an oft-used tool for
understanding, it is not a necessary condition for it; (b) we criticise certain
metaphysical preconceptions which can stand in the way of recognising how
intelligibility without spacetime can be had; (c) we catalogue tools for
rendering theories without a spacetime intelligible; and (d) we give examples
of cases in which understanding is attained without a spacetime, and explain
what kind of understanding these examples provide.
","[{""version"":""v1"",""created"":""Sat, 7 Jul 2018 09:44:40 GMT""}]","2018-07-10"
"1807.02640","Agnieszka Hejna","Jacek Dziuba\'nski, Agnieszka Hejna","H\""ormander's multiplier theorem for the Dunkl transform",,,,,"math.FA","http://arxiv.org/licenses/nonexclusive-distrib/1.0/","  For a normalized root system $R$ in $\mathbb R^N$ and a multiplicity function
$k\geq 0$ let $\mathbf N=N+\sum_{\alpha \in R} k(\alpha)$. Denote by
$dw(\mathbf x)=\prod_{\alpha\in R}|\langle \mathbf
x,\alpha\rangle|^{k(\alpha)}\, d\mathbf x $ the associated measure in $\mathbb
R^N$. Let $\mathcal F$ stands for the Dunkl transform. Given a bounded function
$m$ on $\mathbb R^N$, we prove that if there is $s>\mathbf N$ such that $m$
satisfies the classical H\""ormander condition with the smoothness $s$, then the
multiplier operator $\mathcal T_mf=\mathcal F^{-1}(m\mathcal Ff)$ is of weak
type $(1,1)$, strong type $(p,p)$ for $1<p<\infty$, and bounded on a relevant
Hardy space $H^1$. To this end we study the Dunkl translations and the Dunkl
convolution operators and prove that if $F$ is sufficiently regular, for
example its certain Schwartz class seminorm is finite, then the Dunkl
convolution operator with the function $F$ is bounded on $L^p(dw)$ for $1\leq
p\leq \infty$. We also consider boundedness of maximal operators associated
with the Dunkl convolutions with Schwartz class functions.
","[{""version"":""v1"",""created"":""Sat, 7 Jul 2018 09:59:10 GMT""}]","2018-07-10"
"1807.02641","Ya Li","Ya Li, Ai-Jun Ma, Zhou Rui, Wen-Fei Wang and Zhen-Jun Xiao","Quasi-two-body decays $B_{(s)}\to P f_2(1270)\to P\pi\pi$ in the
  perturbative QCD approach","15 pages,3 figures","Phys. Rev. D 98, 056019 (2018)","10.1103/PhysRevD.98.056019",,"hep-ph hep-ex","http://arxiv.org/licenses/nonexclusive-distrib/1.0/","  In this work, we calculate the $CP$-averaged branching ratios and direct
$CP$-violating asymmetries of the quasi-two-body decays $B_{(s)}\to P
f_2(1270)\to P\pi\pi$ with the two-pion distribution amplitude
$\Phi_{\pi\pi}^{\rm D}$ by using the perturbative QCD factorization approach,
where $P$ represents a light pseudoscalar meson $K, \pi, \eta$ and
$\eta^{\prime}$. The relativistic Breit-Wigner formula for the $D$-wave
resonance $f_2(1270)$ is adopted to parameterize the timelike form factor
$F_{\pi}$, which contains the final state interactions between the pions in the
resonant regions. The consistency of theoretical results with data can be
achieved by determining the Gegenbauer moments of the $D$-wave two-pion
distribution amplitudes. The decay rates for the considered decay modes are
generally in the order of $10^{-9}$ to $ 10^{-6}$. The integrated direct $CP$
asymmetries for the charged modes agree with the {\it BABAR} and Belle
measurements. As a by-product, we extract the branching ratios of $B_{(s)}\to
Pf_2(1270)$ from the corresponding quasi-two-body decay modes, which still need
experimental tests at the ongoing and forthcoming experiments.
","[{""version"":""v1"",""created"":""Sat, 7 Jul 2018 10:07:21 GMT""},{""version"":""v2"",""created"":""Mon, 24 Sep 2018 14:19:20 GMT""}]","2018-09-25"
"1807.02642","Alexey Ukhalov","Mikhail Nevskii, Alexey Ukhalov","Properties of 0/1-Matrices of Order n Having Maximum Determinant","11 pages, 2 figures","Mathematical notes of NEFU, 2019, vol. 26, no 2, pp. 109-115","10.25587/SVFU.2019.102.31516",,"math.MG math.CO","http://arxiv.org/licenses/nonexclusive-distrib/1.0/","  We give some necessary conditions for maximality of $0/1$-determinant. Let
${\bf M}$ be a nondegenerate $0/1$-matrix of order $n$. Denote by $\bf A$ the
matrix of order $n+1$ which appears from ${\bf M}$ after adding the $(n+1)$th
row $(0,0,\ldots,0,1)$ and the $(n+1)$th column consisting of $1$'s. Suppose
${\bf A}^{-1}=(l_{ij}),$ then for all $i=1,\ldots,n$ we have $\sum_{j=1}^{n+1}
|l_{ij}|\geq 2.$ Moreover, if $|\det({\bf M})|$ is equal to the maximum value
of a $0/1$-determinant of order $n$, then $\sum_{j=1}^{n+1} |l_{ij}|= 2$ for
all $i=1,\ldots,n$.
  Keywords: maximum 0/1-deteminant, simplex, cube, axial diameter
","[{""version"":""v1"",""created"":""Sat, 7 Jul 2018 10:17:47 GMT""}]","2019-07-16"
"1807.02643","Gianluca Col\`o","G. Col\`o","Density Functional Theory (DFT) for atomic nuclei: a simple introduction","Lecture notes of the International School of Physics ""Enrico Fermi""
  Course 201 - Nuclear Physics with Stable and Radioactive Ion Beams (Varenna,
  Como, 14-19 July, 2017)",,,,"nucl-th cond-mat.other nucl-ex","http://arxiv.org/licenses/nonexclusive-distrib/1.0/","  The present contribution does not aim at replacing the huge and often
excellent literature on DFT for atomic nuclei, but tries to provide an updated
introduction to this topic. The goal would be, ideally, to help a fresh M.Sc.
or Ph.D. student (or a researcher from other fields) to become acquainted with
some basic concepts, and then move to the specialized textbooks or papers with
some ability for orienteering. We first introduce the basics of DFT, and show
the difference with the ""naive"" mean-field theory, that is doomed to fail as a
model even in the simple case of uniform nuclear matter. We introduce the
Energy Density Functionals (EDFs) that are used in nuclear structure, with few
examples of their applications. The concepts of symmetry breaking and
restoration are briefly discussed. We also include an introduction to the
time-dependent extension of DFT that, so far, has been implemented essentially
only in the adiabatic approximation and has been applied mainly to the study of
nuclear vibrations. With this material, we hope that any reader is able to deal
with the texts that go deeper into each of the topics, having understood that
DFT is probably the best compromise in nuclear structure theory between
simplicity, accuracy, and broad range of applicability.
","[{""version"":""v1"",""created"":""Sat, 7 Jul 2018 10:22:40 GMT""}]","2019-08-09"
"1807.02644","Wen Yang","Yi-Nan Fang, Xing Xiao, Chang-Pu Sun, Wen Yang, and Nan Zhao","Quantum sensing enhanced by adaptive periodic quantum control","11 pages, 4 figures",,,,"quant-ph","http://arxiv.org/licenses/nonexclusive-distrib/1.0/","  Using a single quantum probe to sense other quantum objects offers distinct
advantages but suffers from some limitations that may degrade the sensing
precision severely, especially when the probe-target coupling is weak. Here we
propose a strategy to improve the sensing precision by using the quantum probe
to engineer the evolution of the target. We consider an exactly solvable model,
in which a qubit is used as the probe to sense the frequency of a harmonic
oscillator. We show that by applying adaptive periodic quantum control on the
qubit, the sensing precision can be enhanced from 1/T scaling with the total
time cost T to 1/T^{2} scaling, thus improving the precision by several orders
of magnitudes. Such improvement can be achieved without any direct access to
the oscillator and the improvement increases with decreasing probe-target
coupling. This provides a useful routine to ultrasensitive quantum sensing of
weakly coupled quantum objects.
","[{""version"":""v1"",""created"":""Sat, 7 Jul 2018 10:30:29 GMT""}]","2018-07-10"
"1807.02645","Alexandre Sukhov","Alexandre Sukhov","Discs and boundary uniqueness for psh functions on almost complex
  manifolds",,,,,"math.CV","http://arxiv.org/licenses/nonexclusive-distrib/1.0/","  We prove that a totally real manifold (of maximal dimension) is a boundary
uniqueness set for a psh function on an almost complex manifold.
","[{""version"":""v1"",""created"":""Sat, 7 Jul 2018 10:53:22 GMT""}]","2018-07-10"
"1807.02646","Yongnam Lee","Yongnam Lee and Gian Pietro Pirola","Vanishing cohomology on a double cover","11 pages, final version to appear in BLMS",,"10.1112/blms.12425",,"math.AG","http://arxiv.org/licenses/nonexclusive-distrib/1.0/","  In this paper, we prove the irreducibility of the monodromy action on the
anti-invariant part of the vanishing cohomology on a double cover of a very
general element in an ample hypersurface of a complex smooth projective variety
branched at an ample divisor. As an application, we study dominant rational
maps from a double cover of a very general surface $S$ of degree$\geq 7$ in
${\mathbb P}^3$ branched at a very general quadric surface to smooth projective
surfaces $Z$. Our method combines the classification theory of algebraic
surfaces, deformation theory, and Hodge theory.
","[{""version"":""v1"",""created"":""Sat, 7 Jul 2018 11:05:25 GMT""},{""version"":""v2"",""created"":""Sat, 5 Sep 2020 05:53:15 GMT""}]","2020-10-21"
"1807.02647","Osama Alkishriwo","Osama A. S. Alkishriwo","An Image Encryption Algorithm Based on Chaotic Maps and Discrete Linear
  Chirp Transform",,"Almadar Journal for Communications, Information Technology, and
  Applications, Vol. 05, No. 01, June 2018",,,"eess.IV cs.CR","http://creativecommons.org/publicdomain/zero/1.0/","  In this paper, a novel image encryption algorithm, which involves a chaotic
block image scrambling followed by a two-dimensional (2-D) discrete linear
chirp transform, is proposed. The definition of the 2-D discrete linear chirp
transform is introduced and then it is used to construct the basis of the novel
encryption algorithm. Finally, security analysis are performed to show the
quality of the encryption process using different metrics.
","[{""version"":""v1"",""created"":""Sat, 7 Jul 2018 11:09:47 GMT""}]","2018-07-10"
"1807.02648","Chairi Kiourt","Chairi Kiourt, Dimitris Kalles and Panagiotis Kanellopoulos","How game complexity affects the playing behavior of synthetic agents","15th European Conference on Multi-Agent Systems, Evry, France, 14-15
  December 2017","Multi-Agent Systems and Agreement Technologies. EUMAS 2017, AT
  2017. Lecture Notes in Computer Science","10.1007/978-3-030-01713-2_22",,"cs.AI cs.CC cs.MA","http://arxiv.org/licenses/nonexclusive-distrib/1.0/","  Agent based simulation of social organizations, via the investigation of
agents' training and learning tactics and strategies, has been inspired by the
ability of humans to learn from social environments which are rich in agents,
interactions and partial or hidden information. Such richness is a source of
complexity that an effective learner has to be able to navigate. This paper
focuses on the investigation of the impact of the environmental complexity on
the game playing-and-learning behavior of synthetic agents. We demonstrate our
approach using two independent turn-based zero-sum games as the basis of
forming social events which are characterized both by competition and
cooperation. The paper's key highlight is that as the complexity of a social
environment changes, an effective player has to adapt its learning and playing
profile to maintain a given performance profile
","[{""version"":""v1"",""created"":""Sat, 7 Jul 2018 11:57:21 GMT""}]","2020-04-09"
"1807.02649","Ewan S Douglas","Gregory Allan, Ewan S. Douglas, Derek Barnes, Mark Egan, Gabor Furesz,
  Warren Grunwald, Jennifer Gubner, Christian Haughwout, Bobby G. Holden, Paula
  do Vale Pereira, Abigail J. Stein, and Kerri L. Cahoy","The Deformable Mirror Demonstration Mission (DeMi) CubeSat:
  optomechanical design validation and laboratory calibration","15 pages, 10 figues. Presented at SPIE Astronomical Telescopes +
  Instrumentation, Austin, Texas, USA",,,,"astro-ph.IM","http://arxiv.org/licenses/nonexclusive-distrib/1.0/","  Coronagraphs on future space telescopes will require precise wavefront
correction to detect Earth-like exoplanets near their host stars. High-actuator
count microelectromechanical system (MEMS) deformable mirrors provide wavefront
control with low size, weight, and power. The Deformable Mirror Demonstration
Mission (DeMi) payload will demonstrate a 140 actuator MEMS deformable mirror
(DM) with \SI{5.5}{\micro\meter} maximum stroke. We present the flight
optomechanical design, lab tests of the flight wavefront sensor and wavefront
reconstructor, and simulations of closed-loop control of wavefront aberrations.
We also present the compact flight DM controller, capable of driving up to 192
actuator channels at 0-250V with 14-bit resolution. Two embedded Raspberry Pi 3
compute modules are used for task management and wavefront reconstruction. The
spacecraft is a 6U CubeSat (30 cm x 20 cm x 10 cm) and launch is planned for
2019.
","[{""version"":""v1"",""created"":""Sat, 7 Jul 2018 11:59:36 GMT""},{""version"":""v2"",""created"":""Tue, 10 Jul 2018 15:03:12 GMT""}]","2018-07-11"
"1807.02650","Simon Henry","Simon Henry","Weak model categories in classical and constructive mathematics","80 pages ; Change to v2 : typos corrected and minor improvement. Some
  numbering have changed",,,,"math.CT math.AT","http://arxiv.org/licenses/nonexclusive-distrib/1.0/","  We introduce a notion of ""weak model category"" which is a weakening of the
notion of Quillen model category, still sufficient to define a homotopy
category, Quillen adjunctions, Quillen equivalences and most of the usual
construction of categorical homotopy theory. Both left and right semi-model
categories are weak model categories, and the opposite of a weak model category
is again a weak model category. The main advantages of weak model categories is
that they are easier to construct than Quillen model categories. In particular
we give some simple criteria on two weak factorization systems for them to form
a weak model category. The theory is developed in a very weak constructive
framework and we use it to produce, completely constructively (even
predicatively), weak versions of various standard model categories, including
the Kan-Quillen model structure, the variant of the Joyal model structure on
marked simplicial sets, and the Verity model structure for weak complicial
sets. We also construct semi-simplicial versions of all these.
","[{""version"":""v1"",""created"":""Sat, 7 Jul 2018 12:00:50 GMT""},{""version"":""v2"",""created"":""Wed, 15 May 2019 12:48:01 GMT""},{""version"":""v3"",""created"":""Sat, 9 May 2020 20:43:10 GMT""}]","2020-05-12"
"1807.02651","Florian Bahlke","Florian Bahlke and Marius Pesavento","Energy Consumption Optimization in Mobile Communication Networks","This work has been submitted to the IEEE for possible publication.
  Copyright may be transferred without notice, after which this version may no
  longer be accessible",,,,"eess.SP","http://arxiv.org/licenses/nonexclusive-distrib/1.0/","  This work addresses the challenge of minimizing the energy consumption of a
wireless communication network by joint optimization of the base station
transmit power and the cell activity. A mixed-integer nonlinear optimization
problem is formulated, for which a computationally tractable linear inner
approximation algorithm is provided. The proposed method offers great
flexibility in optimizing the network operation by considering multiple system
parameters jointly, which mitigates a major drawback of existing
state-of-the-art schemes that are mostly based on heuristics. Simulation
results show that the proposed method exhibits high performance in decreasing
the energy consumption, and provides implicit load balancing in difficult high
demand scenarios.
","[{""version"":""v1"",""created"":""Sat, 7 Jul 2018 12:08:47 GMT""}]","2018-07-10"
"1807.02652","Guo Wang Dr.","Guo Wang, Xinyu Wang and Yi Liao","Theoretical investigation on the ferromagnetic two-dimensional scandium
  monochloride sheet that has a high Curie temperature and could be exfoliated
  from a known material",,,"10.1016/j.apsusc.2018.12.109",,"cond-mat.mtrl-sci","http://arxiv.org/licenses/nonexclusive-distrib/1.0/","  A two-dimensional scandium monochloride sheet was investigated by using
density functional theory. It could be exfoliated from a known bulk material
with a cleavage energy slightly lower than that of graphene. The sheet has a
ferromagnetic ground state with a Curie temperature of 100 K. Moreover, the
sheet becomes a half-metal under hole doping. The Curie temperature increases
to 250 K with the doping amount of 0.4 per primitive cell, which is close to
the ice point. The two-dimensional scandium monochloride sheet should be a good
candidate for two-dimensional spintronics.
","[{""version"":""v1"",""created"":""Sat, 7 Jul 2018 12:11:47 GMT""}]","2018-12-26"
