"1807.02522","Marco Meineri","Edoardo Lauria, Marco Meineri, Emilio Trevisani","Spinning operators and defects in conformal field theory","44+24 pages",,"10.1007/JHEP08(2019)066",,"hep-th","http://arxiv.org/licenses/nonexclusive-distrib/1.0/","  We study the kinematics of correlation functions of local and extended
operators in a conformal field theory. We present a new method for constructing
the tensor structures associated to primary operators in an arbitrary bosonic
representation of the Lorentz group. The recipe yields the explicit structures
in embedding space, and can be applied to any correlator of local operators,
with or without a defect. We then focus on the two-point function of traceless
symmetric primaries in the presence of a conformal defect, and explain how to
compute the conformal blocks. In particular, we illustrate various techniques
to generate the bulk channel blocks either from a radial expansion or by acting
with differential operators on simpler seed blocks. For the defect channel, we
detail a method to compute the blocks in closed form, in terms of projectors
into mixed symmetry representations of the orthogonal group.
","[{""version"":""v1"",""created"":""Fri, 6 Jul 2018 18:00:02 GMT""}]","2019-09-04"
"1807.02523","Corentin Schreiber","C. Schreiber, K. Glazebrook, T. Nanayakkara, G.G. Kacprzak, I. Labbe,
  P. Oesch, T. Yuan, K.-V. Tran, C. Papovich, L. Spitler, C. Straatman","Near infrared spectroscopy and star-formation histories of 3<z<4
  quiescent galaxies","30 pages (+ appendix), 18 figures, accepted for publication in A&A","A&A 618, A85 (2018)","10.1051/0004-6361/201833070",,"astro-ph.GA","http://arxiv.org/licenses/nonexclusive-distrib/1.0/","  We present Keck-MOSFIRE H and K spectra for a sample of 24 candidate
quiescent galaxies (QGs) at 3<z<4, identified from UVJ colors and photometric
redshifts in the ZFOURGE and 3DHST surveys. We obtain spectroscopic redshifts
for half of the sample, using absorption or emission lines, and confirm the
high accuracy of the photometric redshifts with a median error of 1.2%. Two
galaxies turn out to be dusty objects at lower redshifts (z<2.5), and are the
only two detected in the sub-mm with ALMA. High equivalent-width [OIII] was
observed in two galaxies, contributing up to 30% of the K-band flux and
mimicking the colors of an old stellar population. This implies a failure rate
of only 20% for the UVJ selection at these redshifts. Balmer absorption was
identified in 4 of the brighest galaxies, confirming the absence of OB stars.
Modeling all QGs with a wide range of star-formation histories, we find sSFR a
factor of 10 below the main sequence (MS) for all but one galaxy, and less than
0.01 Gyr$^{-1}$ for half of the sample. This is consistent with the H$\beta$
and [OII] luminosities, and the ALMA non-detections. We then find that these
QGs have quenched on average 300 Myr before observation, between z=3.5 and 5,
and that they formed at z~5.5 with a mean SFR~300 Msun/yr. Considering an
alternative selection of QGs based solely on the sSFR from SED modeling, we
find that galaxies a factor 10 below the MS are 40% more numerous than
UVJ-quiescent galaxies, implying that the UVJ selection is pure but incomplete.
Current models fail at reproducing our observations and underestimate either
the number density of QGs by more than an order of magnitude or the duration of
their quiescence by a factor two. Overall, these results confirm the existence
of an unexpected population of QGs at z>3, and offer the first insights on
their formation history. [abridged]
","[{""version"":""v1"",""created"":""Fri, 6 Jul 2018 18:00:02 GMT""}]","2018-10-24"
"1807.02524","Jan Krieg","Jan Krieg and Peter Kopietz","Exact renormalization group for quantum spin systems","6 pages, 1 figure, 1 table; revised main text and added Supplemental
  Material","Phys. Rev. B 99, 060403 (2019)","10.1103/PhysRevB.99.060403",,"cond-mat.str-el cond-mat.stat-mech","http://arxiv.org/licenses/nonexclusive-distrib/1.0/","  We show that the diagrammatic approach to quantum spin systems developed in a
seminal work by Vaks, Larkin, and Pikin [Sov. Phys. JETP 26, 188 (1968)] can be
embedded in the framework of the functional renormalization group. The crucial
insight is that the generating functional of the time-ordered connected spin
correlation functions of an arbitrary quantum spin system satisfies an exact
renormalization group flow equation which resembles the corresponding flow
equation of a system of interacting bosons. The $SU (2)$ spin algebra is
implemented via a non-trivial initial condition for the renormalization group
flow. Our method is rather general and offers a new non-perturbative approach
to quantum spin systems.
","[{""version"":""v1"",""created"":""Fri, 6 Jul 2018 18:00:02 GMT""},{""version"":""v2"",""created"":""Wed, 19 Dec 2018 15:55:14 GMT""}]","2019-02-13"
"1807.02525","Tatsuhiko N. Ikeda","Tatsuhiko N. Ikeda, Koki Chinzei, Hirokazu Tsunetsugu","Floquet-Theoretical Formulation and Analysis of High-Harmonic Generation
  in Solids","14 pages, 6 figures","Phys. Rev. A 98, 063426 (2018)","10.1103/PhysRevA.98.063426",,"cond-mat.other physics.optics quant-ph","http://arxiv.org/licenses/nonexclusive-distrib/1.0/","  By using the Floquet eigenstates, we derive a formula to calculate the
high-harmonic components of the electric current (HHC) in the setup where a
monochromatic laser field is turned on at some time. On the basis of this
formulation, we study the HHC spectrum of electrons on a one-dimensional chain
with the staggered potential to study the effect of multiple sites in the unit
cell such as the systems with charge density wave (CDW) order. With the help of
the solution for the Floquet eigenstates, we analytically show that two
plateaus of different origins emerge in the HHC spectrum. The widths of these
plateaus are both proportional to the field amplitude, but inversely
proportional to the laser frequency and its square, respectively. We also show
numerically that multi-step plateaus appear when both the field amplitude and
the staggered potential are strong.
","[{""version"":""v1"",""created"":""Fri, 6 Jul 2018 18:00:02 GMT""},{""version"":""v2"",""created"":""Mon, 12 Nov 2018 12:57:47 GMT""}]","2018-12-27"
"1807.02526","Jeremy Webb J","Jeremy J. Webb and Enrico Vesperini","The Structural and Kinematic Evolution of Central Star Clusters in Dwarf
  Galaxies and Their Dependence on Dark Matter Halo Profiles","8 pages, 7 figures, Accepted for publication in MNRAS",,"10.1093/mnras/sty1723",,"astro-ph.GA","http://arxiv.org/licenses/nonexclusive-distrib/1.0/","  Through a suite of direct N-body simulations, we explore how the structural
and kinematic evolution of a star cluster located at the center of a dwarf
galaxy is affected by the shape of its host's dark matter density profile. The
stronger central tidal fields of cuspier halos minimize the cluster's ability
to expand in response to mass loss due to stellar evolution during its early
evolutionary stages and during its subsequent long-term evolution driven by
two-body relaxation. Hence clusters evolving in cuspier dark matter halos are
characterized by more compact sizes, higher velocity dispersions and remain
approximately isotropic at all clustercentric distances. Conversely, clusters
in cored halos can expand more and develop a velocity distribution profile that
becomes increasingly radially anisotropic at larger clustercentric distances.
Finally, the larger velocity dispersion of clusters evolving in cuspier dark
matter profiles results in them having longer relaxation times. Hence clusters
in cuspy galaxies relax at a slower rate and, consequently, they are both less
mass segregated and farther from complete energy equipartition than cluster's
in cored galaxies. Application of this work to observations allows for star
clusters to be used as tools to measure the distribution of dark matter in
dwarf galaxies and to distinguish isolated star clusters from ultra-faint dwarf
galaxies.
","[{""version"":""v1"",""created"":""Fri, 6 Jul 2018 18:00:06 GMT""}]","2018-08-01"
"1807.02527","Toby Opferkuch","Joachim Kopp (JGU Mainz & CERN), Ranjan Laha (JGU Mainz), Toby
  Opferkuch (JGU Mainz), William Shepherd (JGU Mainz)","Cuckoo's Eggs in Neutron Stars: Can LIGO Hear Chirps from the Dark
  Sector?","18 pages, 6 figures; matches published version",,"10.1007/JHEP11(2018)096","MITP/18-058","hep-ph astro-ph.CO gr-qc hep-ex","http://arxiv.org/licenses/nonexclusive-distrib/1.0/","  We explore in detail the possibility that gravitational wave signals from
binary inspirals are affected by a new force that couples only to dark matter
particles. We discuss the impact of both the new force acting between the
binary partners as well as radiation of the force carrier. We identify numerous
constraints on any such scenario, ultimately concluding that observable effects
on the dynamics of binary inspirals due to such a force are not possible if the
dark matter is accrued during ordinary stellar evolution. Constraints arise
from the requirement that the astronomical body be able to collect and bind at
small enough radius an adequate number of dark matter particles, from the
requirement that the particles thus collected remain bound to neutron stars in
the presence of another neutron star, and from the requirement that the theory
allows old neutron stars to exist and retain their charge. Thus, we show that
any deviation from the predictions of general relativity observed in binary
inspirals must be due either to the material properties of the inspiraling
objects themselves, such as a tidal deformability, to a true fifth force
coupled to baryons, or to a non-standard production mechanism for the dark
matter cores of neutron stars. Viable scenarios of the latter type include
production of dark matter in exotic neutron decays, or the formation of compact
dark matter objects in the early Universe that later seed star formation or are
captured by stars.
","[{""version"":""v1"",""created"":""Fri, 6 Jul 2018 18:00:08 GMT""},{""version"":""v2"",""created"":""Fri, 7 Dec 2018 08:22:42 GMT""}]","2018-12-10"
"1807.02528","Allen Scheie","A. Scheie, K. Ross, P. Peter Stavropoulos, E. Seibel, J. A.
  Rodriguez-Rivera, J. A. Tang, Yi Li, Hae-Young Kee, R. J. Cava, and C.
  Broholm","Counterroating incommensurate magnetic order and strong quantum
  fluctuations in the honeycomb layers of $\rm NaNi_2BiO_6$","12 pages, 11 figures, 8 pages of appendices","Phys. Rev. B 100, 214421 (2019)","10.1103/PhysRevB.100.214421",,"cond-mat.str-el","http://arxiv.org/licenses/nonexclusive-distrib/1.0/","  We report the magnetic structure and electronic properties of the honeycomb
antiferromagnet $\rm NaNi_2BiO_{5.66}$. We find magnetic order with moments
along the $c$ axis for temperatures below $T_{c1}=6.3(1)\>{\rm K}$ and then in
the honeycomb plane for $T < T_{c2}=4.8(1)\>{\rm K}$ with a counterrotating
pattern and an ordering wave vector ${\bf q}=(\frac{1}{3},\> \frac{1}{3},\>
0.15(1))$. Density functional theory and electron spin resonance indicate this
is high-spin Ni$^{3+}$ magnetism near a high to low spin transition. The
ordering wave vector, in-plane magnetic correlations, missing entropy, spin
state, and superexchange pathways are all consistent with bond-dependent
Kitaev-$\Gamma$-Heisenberg exchange interactions in $\rm NaNi_2BiO_{6-\delta}$.
","[{""version"":""v1"",""created"":""Fri, 6 Jul 2018 18:00:12 GMT""},{""version"":""v2"",""created"":""Thu, 24 Oct 2019 21:24:36 GMT""}]","2019-12-25"
"1807.02529","Duncan Walker","J. Niehues, D. M. Walker","NNLO QCD Corrections to Jet Production in Charged Current Deep Inelastic
  Scattering","9 pages, 4 figures",,"10.1016/j.physletb.2018.11.025","IPPP/18/52","hep-ph","http://arxiv.org/licenses/nonexclusive-distrib/1.0/","  The production of jets in charged current deep inelastic scattering (CC DIS)
constitutes a class of observables that can be used to simultaneously test
perturbative predictions for the strong and the electroweak sectors of the
Standard Model. We compute both single jet and di-jet production in CC DIS for
the first time at next-to-next-to-leading order (NNLO) in the strong coupling.
Our computation is fully differential in the jet and lepton kinematics, and we
observe a substantial reduction of scale variation uncertainties in the NNLO
predictions compared to next-to-leading order (NLO). Our calculation will prove
essential for full exploitation of data at a possible future LHeC collider.
","[{""version"":""v1"",""created"":""Fri, 6 Jul 2018 18:00:12 GMT""}]","2018-11-21"
"1807.02530","Stefano Colucci","Stefano Colucci, Herbi K. Dreiner, Lorenzo Ubaldi","The Supersymmetric R-Parity Violating Dine-Fischler-Srednicki-Zhitnitsky
  Axion Model","31 pages, 10 figures, 2 tables and 2 appendices","Phys. Rev. D 99, 015003 (2019)","10.1103/PhysRevD.99.015003",,"hep-ph","http://arxiv.org/licenses/nonexclusive-distrib/1.0/","  We propose a complete R-parity violating supersymmetric model with baryon
triality that contains a Dine-Fischler-Srednicki-Zhitnitsky axion chiral
superfield. We parametrize supersymmetry breaking with soft terms, and
determine under which conditions the model is cosmologically viable. As
expected we always find a region of parameter space in which the axion is a
cold dark matter candidate. The mass of the axino, the fermionic partner of the
axion, is controlled by a Yukawa coupling. When heavy [${\mathcal O}$(TeV)],
the axino decays early and poses no cosmological problems. When light
[$\mathcal{O}$(keV)] it can be long lived and a warm dark matter candidate. We
concentrate on the latter case and study in detail the decay modes of the
axino. We find that constraints from astrophysical X- and gamma rays on the
decay into photon and neutrino can set new bounds on some trilinear
supersymmetric R-parity violating Yukawa couplings. In some corners of the
parameter space the decays of a relic axino can also explain a putative 3.5 keV
line.
","[{""version"":""v1"",""created"":""Fri, 6 Jul 2018 18:00:15 GMT""}]","2019-01-09"
"1807.02531","Eduardo Ba\~nados","Eduardo Banados, Chris Carilli, Fabian Walter, Emmanuel Momjian,
  Roberto Decarli, Emanuele P. Farina, Chiara Mazzucchelli, Bram P. Venemans","A powerful radio-loud quasar at the end of cosmic reionization","ApJL accepted on May 8, 2018. See the companion paper by Momjian et
  al",,"10.3847/2041-8213/aac511",,"astro-ph.GA","http://arxiv.org/licenses/nonexclusive-distrib/1.0/","  We present the discovery of the radio-loud quasar PSO J352.4034-15.3373 at
z=5.84 pm 0.02. This quasar is the radio brightest source known, by an order of
magnitude, at z~6 with a flux density in the range of 8-100 mJy from 3GHz to
230MHz and a radio loudness parameter R>~1000. This source provides an
unprecedented opportunity to study powerful jets and radio-mode feedback at the
highest redshifts, and presents the first real chance to probe deep into the
neutral intergalactic medium by detecting 21 cm absorption at the end of cosmic
reionization.
","[{""version"":""v1"",""created"":""Fri, 6 Jul 2018 18:01:12 GMT""}]","2018-07-25"
"1807.02532","Sarah Rees","Sarah Rees and Derek Holt","Biautomatic structures in systolic Artin groups",,,,,"math.GR","http://arxiv.org/licenses/nonexclusive-distrib/1.0/","  We examine the construction of Huang and Osajda that was used in their proof
of the biautomaticity of Artin groups of almost large type. We describe a
slightly simpler variant of that biautomatic structure, with explicit
descriptions of a few small examples, and we examine some of the properties of
the structure. We explain how the construction can be programmed within the GAP
system.
","[{""version"":""v1"",""created"":""Fri, 6 Jul 2018 18:03:47 GMT""}]","2018-07-10"
"1807.02533","Arthur Parzygnat","Arthur J. Parzygnat","Stinespring's construction as an adjunction","33 pages + appendices","Compositionality 1, 2 (2019)","10.32408/compositionality-1-2",,"math.OA math-ph math.CT math.MP","http://creativecommons.org/licenses/by/4.0/","  Given a representation of a unital $C^*$-algebra $\mathcal{A}$ on a Hilbert
space $\mathcal{H}$, together with a bounded linear map
$V:\mathcal{K}\to\mathcal{H}$ from some other Hilbert space, one obtains a
completely positive map on $\mathcal{A}$ via restriction using the adjoint
action associated to $V$. We show this restriction forms a natural
transformation from a functor of $C^*$-algebra representations to a functor of
completely positive maps. We exhibit Stinespring's construction as a left
adjoint of this restriction. Our Stinespring adjunction provides a universal
property associated to minimal Stinespring dilations and morphisms of
Stinespring dilations. We use these results to prove the purification postulate
for all finite-dimensional $C^*$-algebras.
","[{""version"":""v1"",""created"":""Fri, 6 Jul 2018 18:04:34 GMT""},{""version"":""v2"",""created"":""Thu, 19 Dec 2019 10:14:15 GMT""}]","2019-12-20"
"1807.02534","Fernando Buitrago","F. Buitrago, I. Ferreras, L. S. Kelvin, I. K. Baldry, L. Davies, J.
  Angthopo, S. Khochfar, A. M. Hopkins, S. P. Driver, S. Brough, J. Sabater, C.
  J. Conselice, J. Liske, B. W. Holwerda, M. N. Bremer, S. Phillipps, A. R.
  Lopez-Sanchez, A. W. Graham","Galaxy and Mass Assembly (GAMA): Accurate number densities &
  environments of massive ultracompact galaxies at 0.02 < z < 0.3","22 pages, 16 figures, 6 tables. Accepted in A&A. Minor revisions in
  text and figures. Key plots: Environment->Fig. 13, Number densities->Fig. 14","A&A 619, A137 (2018)","10.1051/0004-6361/201833785",,"astro-ph.GA","http://arxiv.org/licenses/nonexclusive-distrib/1.0/","  Massive Ultracompact Galaxies (MUGs) are common at z=2-3, but very rare in
the nearby Universe. Simulations predict that the few surviving MUGs should
reside in galaxy clusters, whose large relative velocities prevent them from
merging, thus maintaining their original properties (namely stellar
populations, masses, sizes and dynamical state). We take advantage of the
high-completeness, large-area spectroscopic GAMA survey, complementing it with
deeper imaging from the KiDS and VIKING surveys. We find a set of 22 bona-fide
MUGs, defined as having high stellar mass (>8x10^10 M_Sun) and compact size
(R_e<2 Kpc) at 0.02 < z < 0.3. An additional set of 7 lower-mass objects
(6x10^10 < M_star/M_Sun < 8x10^10) are also potential candidates according to
typical mass uncertainties. The comoving number density of MUGs at low redshift
(z < 0.3) is constrained at $(1.0\pm 0.4)x 10^-6 Mpc^-3, consistent with galaxy
evolution models. However, we find a mixed distribution of old and young
galaxies, with a quarter of the sample representing (old) relics. MUGs have a
predominantly early/swollen disk morphology (Sersic index 1<n<2.5) with high
stellar surface densities (<Sigma_e> ~ 10^10 M_Sun Kpc^-2). Interestingly, a
large fraction feature close companions -- at least in projection -- suggesting
that many (but not all) reside in the central regions of groups. Halo masses
show these galaxies inhabit average-mass groups. As MUGs are found to be almost
equally distributed among environments of different masses, their relative
fraction is higher in more massive overdensities, matching the expectations
that some of these galaxies fell in these regions at early times. However,
there must be another channel leading some of these galaxies to an abnormally
low merger history because our sample shows a number of objects that do not
inhabit particularly dense environments. (abridged)
","[{""version"":""v1"",""created"":""Fri, 6 Jul 2018 18:08:09 GMT""},{""version"":""v2"",""created"":""Wed, 5 Sep 2018 16:23:45 GMT""}]","2018-11-21"
"1807.02535","Soumyasundar Pal","Yunpeng Li, Soumyasundar Pal and Mark Coates","Invertible Particle Flow-based Sequential MCMC with extension to
  Gaussian Mixture noise models",,,"10.1109/TSP.2019.2905816",,"stat.ME","http://arxiv.org/licenses/nonexclusive-distrib/1.0/","  Sequential state estimation in non-linear and non-Gaussian state spaces has a
wide range of applications in statistics and signal processing. One of the most
effective non-linear filtering approaches, particle filtering, suffers from
weight degeneracy in high-dimensional filtering scenarios. Several avenues have
been pursued to address high-dimensionality. Among these, particle flow
particle filters construct effective proposal distributions by using invertible
flow to migrate particles continuously from the prior distribution to the
posterior, and sequential Markov chain Monte Carlo (SMCMC) methods use a
Metropolis-Hastings (MH) accept-reject approach to improve filtering
performance. In this paper, we propose to combine the strengths of invertible
particle flow and SMCMC by constructing a composite Metropolis-Hastings (MH)
kernel within the SMCMC framework using invertible particle flow. In addition,
we propose a Gaussian mixture model (GMM)-based particle flow algorithm to
construct effective MH kernels for multi-modal distributions. Simulation
results show that for high-dimensional state estimation example problems the
proposed kernels significantly increase the acceptance rate with minimal
additional computational overhead and improve estimation accuracy compared with
state-of-the-art filtering algorithms.
","[{""version"":""v1"",""created"":""Fri, 6 Jul 2018 18:08:46 GMT""},{""version"":""v2"",""created"":""Tue, 29 Jan 2019 19:18:55 GMT""},{""version"":""v3"",""created"":""Mon, 11 Mar 2019 19:00:54 GMT""}]","2019-05-01"
"1807.02536","Xin Yu","Xin Yu, Sagar Chaturvedi, Chen Feng, Yuichi Taguchi, Teng-Yok Lee,
  Clinton Fernandes, Srikumar Ramalingam","VLASE: Vehicle Localization by Aggregating Semantic Edges",,,,,"cs.CV cs.RO","http://arxiv.org/licenses/nonexclusive-distrib/1.0/","  In this paper, we propose VLASE, a framework to use semantic edge features
from images to achieve on-road localization. Semantic edge features denote edge
contours that separate pairs of distinct objects such as building-sky, road-
sidewalk, and building-ground. While prior work has shown promising results by
utilizing the boundary between prominent classes such as sky and building using
skylines, we generalize this approach to consider semantic edge features that
arise from 19 different classes. Our localization algorithm is simple, yet very
powerful. We extract semantic edge features using a recently introduced CASENet
architecture and utilize VLAD framework to perform image retrieval. Our
experiments show that we achieve improvement over some of the state-of-the-art
localization algorithms such as SIFT-VLAD and its deep variant NetVLAD. We use
ablation study to study the importance of different semantic classes and show
that our unified approach achieves better performance compared to individual
prominent features such as skylines.
","[{""version"":""v1"",""created"":""Fri, 6 Jul 2018 18:15:06 GMT""}]","2018-07-10"
"1807.02537","Aristeidis Panos","Aristeidis Panos, Petros Dellaportas, Michalis K. Titsias","Fully Scalable Gaussian Processes using Subspace Inducing Inputs",,,,,"stat.ML cs.LG","http://arxiv.org/licenses/nonexclusive-distrib/1.0/","  We introduce fully scalable Gaussian processes, an implementation scheme that
tackles the problem of treating a high number of training instances together
with high dimensional input data. Our key idea is a representation trick over
the inducing variables called subspace inducing inputs. This is combined with
certain matrix-preconditioning based parametrizations of the variational
distributions that lead to simplified and numerically stable variational lower
bounds. Our illustrative applications are based on challenging extreme
multi-label classification problems with the extra burden of the very large
number of class labels. We demonstrate the usefulness of our approach by
presenting predictive performances together with low computational times in
datasets with extremely large number of instances and input dimensions.
","[{""version"":""v1"",""created"":""Fri, 6 Jul 2018 18:18:36 GMT""},{""version"":""v2"",""created"":""Thu, 12 Jul 2018 19:14:56 GMT""}]","2018-07-16"
"1807.02538","Lee Lindblom","Lee Lindblom","Inverse Structure Problem for Neutron-Star Binaries","6 pages, 4 figures; v2 updated to version accepted for publication in
  Phys. Rev. D","Phys. Rev. D 98, 043012 (2018)","10.1103/PhysRevD.98.043012",,"astro-ph.HE gr-qc","http://arxiv.org/licenses/nonexclusive-distrib/1.0/","  Gravitational wave detectors in the LIGO/Virgo frequency band are able to
measure the individual masses and the composite tidal deformabilities of
neutron-star binary systems. This paper demonstrates that high accuracy
measurements of these quantities from an ensemble of binary systems can in
principle be used to determine the high density neutron-star equation of state
exactly. This analysis assumes that all neutron stars have the same
thermodynamically stable equation of state, but does not use simplifying
approximations for the composite tidal deformability or make additional
assumptions about the high density equation of state.
","[{""version"":""v1"",""created"":""Fri, 6 Jul 2018 18:27:57 GMT""},{""version"":""v2"",""created"":""Thu, 9 Aug 2018 17:44:42 GMT""}]","2018-08-22"
