"1807.06883","Guohua Wang","G. H. Wang (1), C. Y. Xu (1), H. B. Cao (2), T. Hong (2), Q. Huang
  (3), Q. Y. Ren (1), J. Q. Xu (1), H. D. Zhou (1 and 3), W. D. Luo (1, 4 and
  5), D. Qian (1 and 4), and J. Ma (1 and 4) ((1) Key laboratory of Artificial
  Structures and Quantum Control, School of Physics and Astronomy, Shanghai
  JiaoTong University,(2) Quantum Condensed Matter Division, Oak Ridge National
  Laboratory,(3) Department of Physics and Astronomy, University of
  Tennessee,(4) Collaborative Innovation Center of Advanced Microstructures,
  (5) Institute of Natural Sciences, Shanghai Jiao Tong University)","Magnetic Properties of the low dimensional BaM$_2$Si$_2$O$_7$(M= Cu, Co,
  Mn) system",,"Phys. Rev. B 100, 035131 (2019)","10.1103/PhysRevB.100.035131",,"cond-mat.str-el","http://arxiv.org/licenses/nonexclusive-distrib/1.0/","  We performed susceptibility, magnetization, specific heat, and single crystal
neutron diffraction measurements on single crystalline BaMn$_2$Si$_2$O$_7$.
Based on the results, we revisited its spin structure with a more accurate
solution and constructed a magnetic phase diagram with applied field along the
$b$-axis, which contains a spin flop transition around 6 T. We also used
susceptibility, magnetization, and specific heat results confirmed the
ferrimagnetic-like magnetism in polycrystalline BaCo$_2$Si$_2$O$_7$.
Furthermore, we performed LSDA + U calculations for the BaM$_2$Si$_2$O$_7$ (M =
Cu, Co, and Mn) system. Our discussions based on the comparison among the
obtained magnetic exchange interactions suggest the different structures and
electronic configurations are the reasons for the different magnetic properties
among the system members.
","[{""version"":""v1"",""created"":""Wed, 18 Jul 2018 11:59:16 GMT""}]","2019-07-31"
"1807.06884","Pierre Roy","P. E. Roy, Ruben M. Otxoa, C. Moutafis","Controlled anisotropic dynamics of tightly bound skyrmions in a
  synthetic ferrimagnet due to skyrmion-deformation mediated by induced
  uniaxial in-plane anisotropy",,"Phys. Rev. B 99, 094405 (2019)","10.1103/PhysRevB.99.094405",,"cond-mat.mes-hall","http://arxiv.org/licenses/nonexclusive-distrib/1.0/","  We study speed and skew deflection-angle dependence on skyrmion deformations
of a tightly bound two-skyrmion state in a synthetic ferrimagnet. We condsider
here, an in-plane uniaxial magnetocrystalline anisotropy-term in order to
induce lateral shape distortions and an overall size modulation of the
skyrmions due to a reduction of the effective out-of-plane anisotropy, thus
affecting the skyrmion speed, skew-deflection and inducing anisotropy in these
quantities with respect to the driving current-angle. Because of frustrated
dipolar interactions in a synthetic ferrimagnet, sizeable skyrmion deformations
can be induced with relatively small induced anisotropy constants and thus a
wide range of tuneability can be achieved. We also show analytically, that a
consequence of the skyrmion deformation can, under certain conditions cause a
skyrmion deflection with respect to driving-current angles, unrelated to the
topological charge. Results are analyzed by a combination of micromagnetic
simulations and a compound particle description within the Thiele-formalism
from which an over-all mobility tensor is constructed. This work offers an
additional path towards in-situ tuning of skyrmion dynamics.
","[{""version"":""v1"",""created"":""Wed, 18 Jul 2018 12:02:13 GMT""},{""version"":""v2"",""created"":""Thu, 19 Jul 2018 14:05:30 GMT""}]","2019-03-13"
"1807.06885","Jozsef Kolumban","J\'ozsef Kolumb\'an (CEREMADE)","Control at a distance of the motion of a rigid body immersed in a
  two-dimensional viscous incompressible fluid",,,,,"math.AP","http://arxiv.org/licenses/nonexclusive-distrib/1.0/","  We consider the motion of a rigid body immersed in a two-dimensional viscous
incompressible fluid with Navierslip-with-friction conditions at the solid
boundary. The fluid-solid system occupies the whole plane. We provethe
small-time exact controllability of the position and velocity of the solid when
the control takes the form of adistributed force supported in a compact subset
(with nonvoid interior) of the fluid domain, away from the body.The strategy
relies on the introduction of a small parameter: we consider fast and strong
amplitude controls forwhich the ``Navier-Stokes+rigid body'' system behaves
like a perturbation of the ``Euler+rigid body'' system. Bythe means of a
multi-scale asymptotic expansion we construct a controlled solution to the
``Navier-Stokes+rigidbody'' system thanks to some controlled solutions to
``Euler+rigid body''-type systems and to a detailed analysis ofthe influence of
the boundary layer on the solid motion.
","[{""version"":""v1"",""created"":""Wed, 18 Jul 2018 12:04:47 GMT""}]","2018-07-19"
"1807.06886","Fang Fei","Fei Fang","The energy identity of Sacks-Uhlenbeck operator and infinitely many
  solutions for Brezis-Nirenberg problem",,,,,"math.AP","http://arxiv.org/licenses/nonexclusive-distrib/1.0/","  Let $\Omega$ be a bounded smooth domain in $\mathbb{R}^N$ with $N\geq 3$,
$1<\alpha$, $2^{\ast}=\frac{2N}{N-2}$ and $\{u_\alpha\}\subset
H_{0}^{1,2\alpha}(\Omega)$ be a critical point of the functional
\begin{equation*} I_{\alpha,\lambda}(u)=\frac{1}{2\alpha}\int\limits_{\Omega}
[(1+|\nabla u|^2)^{\alpha}-1
]dx-\frac{\lambda}{2}\int\limits_{\Omega}u^2dx-\frac{1}{2^{\ast}}\int\limits_{\Omega}|u|^{2^{\ast}}dx.
\end{equation*} In this paper, we obtain the limit behaviour of $u_\alpha$ (
$\alpha\rightarrow 1$), energy identity, Pohozaev identity, some integral
estimates, etc. And using these results, we prove infinitely many solutions for
the following Brezis-Nirenberg problem for $N\geq 7$: \begin{equation*} \left\{
\begin{aligned}
  &-\Delta u=|u|^{2^{\ast}-2}u+\lambda u\ \ \ \mbox{in}\ \Omega,\\ &u=0,\ \
\mbox{on}\ \partial\Omega. \end{aligned} \right. \end{equation*}
","[{""version"":""v1"",""created"":""Wed, 18 Jul 2018 12:11:34 GMT""}]","2018-07-19"
"1807.06887","Amit Priyadarshi","Abhilash Sahu and Amit Priyadarshi","Existence of multiple solutions of a p-Laplacian equation on the
  Sierpinski Gasket","18 pages. arXiv admin note: text overlap with arXiv:1807.06881",,,,"math.AP","http://arxiv.org/licenses/nonexclusive-distrib/1.0/","  In this paper we study the following boundary value problem involving the
weak p-Laplacian. \begin{equation*} \quad -M(\|u\|_{\mathcal{E}_p}^p)\Delta_p u
= h(x,u) \; \text{in}\; \mathcal{S}\setminus\mathcal{S}_0; \quad u = 0 \;
\mbox{on}\; \mathcal{S}_0, \end{equation*} where $\mathcal{S}$ is the
Sierpi\'nski gasket in $\mathbb{R}^2$, $\mathcal{S}_0$ is its boundary. $M :
\mathbb{R} \to \mathbb{R}$ defined by $M(t) = at^k +b$ and $a,b,k >0$ and $h :
\mathcal{S} \times \mathbb{R} \to \mathbb{R}.$ We will show the existence of
two nontrivial weak solutions to the above problem.
","[{""version"":""v1"",""created"":""Wed, 18 Jul 2018 12:14:28 GMT""}]","2018-07-19"
"1807.06888","Max Tschaikowski","Luca Cardelli, Mirco Tribastone, Max Tschaikowski, and Andrea Vandin","Guaranteed Error Bounds on Approximate Model Abstractions through
  Reachability Analysis","Accepted for publication at QEST 2018",,,,"cs.SY","http://arxiv.org/licenses/nonexclusive-distrib/1.0/","  It is well known that exact notions of model abstraction and reduction for
dynamical systems may not be robust enough in practice because they are highly
sensitive to the specific choice of parameters. In this paper we consider this
problem for nonlinear ordinary differential equations (ODEs) with polynomial
derivatives. We introduce approximate differential equivalence as a more
permissive variant of a recently developed exact counterpart, allowing ODE
variables to be related even when they are governed by nearby derivatives. We
develop algorithms to (i) compute the largest approximate differential
equivalence; (ii) construct an approximate quotient model from the original one
via an appropriate parameter perturbation; and (iii) provide a formal
certificate on the quality of the approximation as an error bound, computed as
an over-approximation of the reachable set of the perturbed model. Finally, we
apply approximate differential equivalences to study the effect of parametric
tolerances in models of symmetric electric circuits.
","[{""version"":""v1"",""created"":""Wed, 18 Jul 2018 12:15:08 GMT""}]","2018-07-19"
"1807.06889","Giacomo Gigante","Leonardo Colzani, Bianca Gariboldi, Giacomo Gigante","Variance of Lattice Point Counting in Thin Annuli",,,,,"math.CA","http://arxiv.org/licenses/nonexclusive-distrib/1.0/","  We give asymptotic estimates of the variance of the number of integer points
in translated thin annuli in any dimension.
","[{""version"":""v1"",""created"":""Wed, 18 Jul 2018 12:16:25 GMT""}]","2018-07-19"
"1807.06890","Eran Bouchbinder","Efim A. Brener, Michael Aldam, Fabian Barras, Jean-Fran\c{c}ois
  Molinari, and Eran Bouchbinder","Unstable slip pulses and earthquake nucleation as a non-equilibrium
  first-order phase transition","Updated Figs. 3, 5 and S3, added scaling theory for $L^*$, added
  references","Phys. Rev. Lett. 121, 234302 (2018)","10.1103/PhysRevLett.121.234302",,"physics.geo-ph cond-mat.mtrl-sci cond-mat.soft","http://arxiv.org/licenses/nonexclusive-distrib/1.0/","  The onset of rapid slip along initially quiescent frictional interfaces, the
process of `earthquake nucleation', and dissipative spatiotemporal slippage
dynamics play important roles in a broad range of physical systems. Here we
first show that interfaces described by generic friction laws feature
stress-dependent steady-state slip pulse solutions, which are unstable in the
quasi-1D approximation of thin elastic bodies. We propose that such unstable
slip pulses of linear size $L^*$ and characteristic amplitude are `critical
nuclei' for rapid slip in a non-equilibrium analogy to equilibrium first-order
phase transitions, and quantitatively support this idea by dynamical
calculations. We then perform 2D numerical calculations that indicate that the
nucleation length $L^*$ exists also in 2D, and that the existence of a fracture
mechanics Griffith-like length $L_G\!<\!L^*$ gives rise to a richer
phase-diagram that features also sustained slip pulses.
","[{""version"":""v1"",""created"":""Wed, 18 Jul 2018 12:17:36 GMT""},{""version"":""v2"",""created"":""Thu, 15 Nov 2018 16:36:41 GMT""}]","2018-12-12"
"1807.06891","Jiawei Li","Jiawei Li and Zhongmin Qian","Large deviation principle for fractional Brownian motion with respect to
  capacity",,,,,"math.PR","http://arxiv.org/licenses/nonexclusive-distrib/1.0/","  We show that fractional Brownian motion(fBM) defined via Volterra integral
representation with Hurst parameter $H\geq\frac{1}{2}$ is a quasi-surely
defined Wiener functional on classical Wiener space,and we establish the large
deviation principle(LDP) for such fBM with respect to $(p,r)$-capacity on
classical Wiener space in Malliavin's sense.
","[{""version"":""v1"",""created"":""Wed, 18 Jul 2018 12:20:17 GMT""},{""version"":""v2"",""created"":""Tue, 23 Apr 2019 21:58:34 GMT""}]","2019-04-25"
"1807.06892","Chuancun Yin","Yuxia Huang, Chuancun Yin","A unifying approach to constrained and unconstrained optimal reinsurance",,,,,"q-fin.RM","http://arxiv.org/licenses/nonexclusive-distrib/1.0/","  In this paper, we study two classes of optimal reinsurance models from
perspectives of both insurers and reinsurers by minimizing their convex
combination where the risk is measured by a distortion risk measure and the
premium is given by a distortion premium principle. Firstly, we show that how
optimal reinsurance models for the unconstrained optimization problem and
constrained optimization problems can be formulated in a unified way. Secondly,
we propose a geometric approach to solve optimal reinsurance problems directly.
This paper considers a class of increasing convex ceded loss functions and
derives the explicit solutions of the optimal reinsurance which can be in forms
of quota-share, stop-loss, change-loss, the combination of quota-share and
change-loss or the combination of change-loss and change-loss with different
retentions. Finally, we consider two specific cases: Value at Risk (VaR) and
Tail Value at Risk (TVaR).
","[{""version"":""v1"",""created"":""Wed, 18 Jul 2018 12:32:44 GMT""}]","2018-07-19"
"1807.06893","Ivan Gentil","Ivan Gentil (ICJ), Christian L\'eonard (MODAL'X), Luigia Ripani (ICJ),
  Luca Tamanini","An entropic interpolation proof of the HWI inequality",,,,,"math.PR math.CA","http://arxiv.org/licenses/nonexclusive-distrib/1.0/","  We present a pathwise proof of the HWI inequality which is based on en-tropic
interpolations rather than displacement ones. Unlike the latter, entropic
interpolations are regular both in space and time. Consequently, our approach
is closer to the Otto-Villani heuristics, presented in the first part of the
article [23], than the original rigorous proof presented in the second part of
[23].
","[{""version"":""v1"",""created"":""Wed, 18 Jul 2018 12:37:42 GMT""}]","2018-07-19"
"1807.06894","Yurii V. Brezhnev","Yurii V. Brezhnev","Linear superposition as a core theorem of quantum empiricism","Final version; 84 pages (major improvements), no figures. Russian
  version is available upon email-request","Universe (2022) v.8(4) 217(78pp)","10.3390/universe8040217",,"quant-ph math-ph math.MP","http://creativecommons.org/licenses/by/4.0/","  Clarifying the nature of the quantum state $|\Psi\rangle$ is at the root of
the problems with insight into counter-intuitive quantum postulates. We provide
a direct-and math-axiom free-empirical derivation of this object as an element
of a vector space. Establishing the linearity of this structure--quantum
superposition--is based on a set-theoretic creation of ensemble formations and
invokes the following three principia: ($\textsf{I}$) quantum statics,
($\textsf{II}$) doctrine of the number in the physical theory, and
($\textsf{III}$) mathematization of matching the two observations with each
other (quantum covariance).
  All of the constructs rest upon a formalization of the minimal experimental
entity--the registered micro-event, detector click. This is sufficient for
producing the $\mathbb C$-numbers, axioms of linear vector space (superposition
principle), statistical mixtures of states, eigenstates and their spectra, and
non-commutativity of observables. No use is required of the spatio-temporal
concepts. As a result, the foundations of theory are liberated to a significant
extent from the issues associated with physical interpretations, philosophical
exegeses, and mathematical reconstruction of the entire quantum edifice.
","[{""version"":""v1"",""created"":""Wed, 18 Jul 2018 12:39:56 GMT""},{""version"":""v2"",""created"":""Mon, 10 Dec 2018 13:40:52 GMT""},{""version"":""v3"",""created"":""Sat, 11 May 2019 11:58:45 GMT""},{""version"":""v4"",""created"":""Mon, 17 Jun 2019 07:53:26 GMT""},{""version"":""v5"",""created"":""Thu, 10 Oct 2019 13:41:56 GMT""},{""version"":""v6"",""created"":""Wed, 16 Dec 2020 12:16:57 GMT""},{""version"":""v7"",""created"":""Wed, 13 Apr 2022 13:39:51 GMT""}]","2022-04-14"
"1807.06895","Alina Dobrogowska","Alina Dobrogowska, David J. Fern\'andez C","Darboux transformations and second order difference equations","21 pages",,,,"math.DS math-ph math.MP","http://arxiv.org/licenses/nonexclusive-distrib/1.0/","  In this paper we implement the Darboux transformation, as well as an analogue
of Crum's theorem, for a discrete version of Schr\""odinger equation. The
technique is based on the use of first order operators intertwining two
difference operators of second order. This method, which has been applied
successfully for differential cases, leads also to interesting non trivial
results in the discrete case. The technique allows us to construct the
solutions for a wide class of difference Schr\""odinger equations. The exact
solutions for some special potentials are also found explicitly.
","[{""version"":""v1"",""created"":""Wed, 18 Jul 2018 12:42:34 GMT""}]","2018-07-19"
"1807.06896","Darko Volkov","Faouzi Triki, Darko Volkov","Stability estimates for the fault inverse problem",,,"10.1088/1361-6420/ab0b5c",,"math.AP","http://arxiv.org/licenses/nonexclusive-distrib/1.0/","  We study in this paper stability estimates for the fault inverse problem. In
this problem, faults are assumed to be planar open surfaces in a half space
elastic medium with known Lam\'e coefficients. A traction free condition is
imposed on the boundary of the half space. Displacement fields present jumps
across faults, called slips, while traction derivatives are continuous. It was
proved in \cite{volkov2017reconstruction} that if the displacement field is
known on an open set on the boundary of the half space, then the fault and the
slip are uniquely determined. In this present paper, we study the stability of
this uniqueness result with regard to the coefficients of the equation of the
plane containing the fault. If the slip field is known we state and prove a
Lipschitz stability result. In the more interesting case where the slip field
is unknown, we state and prove another Lipschitz stability result under the
additional assumption, which is still physically relevant, that the slip field
is one directional.
","[{""version"":""v1"",""created"":""Wed, 18 Jul 2018 12:44:20 GMT""}]","2019-07-24"
"1807.06897","Nathaniel Johnston","Nathaniel Johnston and Olivia MacLean","Pairwise Completely Positive Matrices and Conjugate Local Diagonal
  Unitary Invariant Quantum States","26 pages, comments welcome","Electronic Journal of Linear Algebra, 35:156-180, 2019","10.13001/1081-3810.3842",,"quant-ph","http://arxiv.org/licenses/nonexclusive-distrib/1.0/","  We introduce a generalization of the set of completely positive matrices that
we call ""pairwise completely positive"" (PCP) matrices. These are pairs of
matrices that share a joint decomposition so that one of them is necessarily
positive semidefinite while the other one is necessarily entrywise
non-negative. We explore basic properties of these matrix pairs and develop
several testable necessary and sufficient conditions that help determine
whether or not a pair is PCP. We then establish a connection with quantum
entanglement by showing that determining whether or not a pair of matrices is
pairwise completely positive is equivalent to determining whether or not a
certain type of quantum state, called a conjugate local diagonal unitary
invariant state, is separable. Many of the most important quantum states in
entanglement theory are of this type, including isotropic states, mixed Dicke
states (up to partial transposition), and maximally correlated states. As a
specific application of our results, we show that a wide family of states that
have absolutely positive partial transpose are in fact separable.
","[{""version"":""v1"",""created"":""Wed, 18 Jul 2018 12:48:53 GMT""}]","2019-05-30"
"1807.06898","Roberto Imbuzeiro Oliveira","Roberto I. Oliveira, Guilherme Reis","Interacting diffusions on random graphs with diverging degrees:
  hydrodynamics and large deviations","37 pages",,"10.1007/s10955-019-02332-1",,"math.PR cond-mat.dis-nn","http://arxiv.org/licenses/nonexclusive-distrib/1.0/","  We consider systems of mean-field interacting diffusions, where the pairwise
interaction structure is described by a sparse (and potentially inhomogeneous)
random graph. Examples include the stochastic Kuramoto model with pairwise
interactions given by an Erd\H{o}s-R\'{e}nyi graph. Our problem is to compare
the bulk behavior of such systems with that of corresponding systems with dense
nonrandom interactions. For a broad class of interaction functions, we find the
optimal sparsity condition that implies that the two systems have the same
hydrodynamic limit, which is given by a McKean-Vlasov diffusion. Moreover, we
also prove matching behavior of the two systems at the level of large
deviations. Our results extend classical results of dai Pra and den Hollander
and provide the first examples of LDPs for systems with sparse random
interactions.
","[{""version"":""v1"",""created"":""Wed, 18 Jul 2018 12:55:28 GMT""},{""version"":""v2"",""created"":""Sat, 15 Dec 2018 11:58:57 GMT""}]","2019-09-04"
"1807.06899","Gaurav Naithani","Gaurav Naithani, Joonas Nikunen, Lars Bramsl{\o}w, Tuomas Virtanen","Deep neural network based speech separation optimizing an objective
  estimator of intelligibility for low latency applications","To appear at International Workshop on Acoustic Signal Enhancement
  (IWAENC) 2018",,,,"cs.SD eess.AS","http://arxiv.org/licenses/nonexclusive-distrib/1.0/","  Mean square error (MSE) has been the preferred choice as loss function in the
current deep neural network (DNN) based speech separation techniques. In this
paper, we propose a new cost function with the aim of optimizing the extended
short time objective intelligibility (ESTOI) measure. We focus on applications
where low algorithmic latency ($\leq 10$ ms) is important. We use long
short-term memory networks (LSTM) and evaluate our proposed approach on four
sets of two-speaker mixtures from extended Danish hearing in noise (HINT)
dataset. We show that the proposed loss function can offer improved or at par
objective intelligibility (in terms of ESTOI) compared to an MSE optimized
baseline while resulting in lower objective separation performance (in terms of
the source to distortion ratio (SDR)). We then proceed to propose an approach
where the network is first initialized with weights optimized for MSE criterion
and then trained with the proposed ESTOI loss criterion. This approach
mitigates some of the losses in objective separation performance while
preserving the gains in objective intelligibility.
","[{""version"":""v1"",""created"":""Wed, 18 Jul 2018 12:55:59 GMT""}]","2018-07-19"
"1807.06900","D. Ghilencea","D. M. Ghilencea","Two-loop corrections to Starobinsky-Higgs inflation","21 pages, 8 figures; v2: small corrections; references added","Phys. Rev. D 98, 103524 (2018)","10.1103/PhysRevD.98.103524",,"hep-ph astro-ph.CO gr-qc hep-th","http://arxiv.org/licenses/nonexclusive-distrib/1.0/","  Higgs inflation and $R^2$-inflation (Starobinsky model) are two limits of the
same quantum model, hereafter called Starobinsky-Higgs. We analyse the two-loop
action of the Higgs-like scalar $\phi$ in the presence of: 1) non-minimal
coupling ($\xi$) and 2) quadratic curvature terms. The latter are generated at
the quantum level with $\phi$-dependent couplings ($\tilde\alpha$) even if
their tree-level couplings ($\alpha$) are tuned to zero. Therefore, the
potential always depends on both Higgs field $\phi$ and scalaron $\rho$, hence
multi-field inflation is a quantum consequence. The effects of the quantum
(one- and two-loop) corrections on the potential $\hat W(\phi,\rho)$ and on the
spectral index are discussed, showing that the Starobinsky-Higgs model is in
general stable in their presence. Two special cases are also considered: first,
for a large $\xi$ in the quantum action one can integrate $\phi$ and generate a
""refined"" Starobinsky model which contains additional terms $\xi^2 R^2\ln^p
(\xi \vert R\vert/\mu^2)$, $p=1,2$ ($\mu$ is the subtraction scale). These
generate corrections linear in the scalaron to the ""usual"" Starobinsky
potential and a ""running"" scalaron mass. Second, for a small fixed Higgs field
$\phi^2 \ll M_p^2/\xi$ and a vanishing classical coefficient of the $R^2$-term,
we show that the ""usual"" Starobinsky inflation is generated by the quantum
corrections alone, for a suitable non-minimal coupling ($\xi$).
","[{""version"":""v1"",""created"":""Wed, 18 Jul 2018 12:58:41 GMT""},{""version"":""v2"",""created"":""Wed, 24 Oct 2018 15:20:54 GMT""}]","2018-12-05"
"1807.06901","Pablo Rodr\'iguez-S\'anchez","Pablo Rodr\'iguez-S\'anchez, Egbert H. van Nes, Marten Scheffer","Neutral competition boosts chaos in food webs","Added biodiversity measures, lacking in our previous analysis",,,,"q-bio.PE","http://arxiv.org/licenses/nonexclusive-distrib/1.0/","  Similarity of competitors has been proposed to facilitate coexistence of
species because it slows down competitive exclusion, thus making it easier for
equalizing mechanisms to maintain diverse communities. On the other hand, chaos
can promote coexistence of species. Here we link these two previously unrelated
findings, by analyzing the dynamics of food web models. We show that
near-neutrality of competition of prey, in the presence of predators, increases
the chance of developing chaotic dynamics. Moreover we confirm that this
results in a higher biodiversity. Our results suggest that near-neutrality may
promote biodiversity in two ways: through reducing the rates of competitive
displacement and through promoting non-equilibrium dynamics.
","[{""version"":""v1"",""created"":""Wed, 18 Jul 2018 12:59:01 GMT""},{""version"":""v2"",""created"":""Tue, 26 Feb 2019 13:17:36 GMT""}]","2019-02-27"
