"1807.06653","Xu Ji","Xu Ji, Jo\~ao F. Henriques, Andrea Vedaldi","Invariant Information Clustering for Unsupervised Image Classification
  and Segmentation","International Conference on Computer Vision 2019",,,,"cs.CV cs.LG","http://arxiv.org/licenses/nonexclusive-distrib/1.0/","  We present a novel clustering objective that learns a neural network
classifier from scratch, given only unlabelled data samples. The model
discovers clusters that accurately match semantic classes, achieving
state-of-the-art results in eight unsupervised clustering benchmarks spanning
image classification and segmentation. These include STL10, an unsupervised
variant of ImageNet, and CIFAR10, where we significantly beat the accuracy of
our closest competitors by 6.6 and 9.5 absolute percentage points respectively.
The method is not specialised to computer vision and operates on any paired
dataset samples; in our experiments we use random transforms to obtain a pair
from each image. The trained network directly outputs semantic labels, rather
than high dimensional representations that need external processing to be
usable for semantic clustering. The objective is simply to maximise mutual
information between the class assignments of each pair. It is easy to implement
and rigorously grounded in information theory, meaning we effortlessly avoid
degenerate solutions that other clustering methods are susceptible to. In
addition to the fully unsupervised mode, we also test two semi-supervised
settings. The first achieves 88.8% accuracy on STL10 classification, setting a
new global state-of-the-art over all existing methods (whether supervised,
semi-supervised or unsupervised). The second shows robustness to 90% reductions
in label coverage, of relevance to applications that wish to make use of small
amounts of labels. github.com/xu-ji/IIC
","[{""version"":""v1"",""created"":""Tue, 17 Jul 2018 20:17:29 GMT""},{""version"":""v2"",""created"":""Sat, 21 Jul 2018 23:06:58 GMT""},{""version"":""v3"",""created"":""Tue, 26 Mar 2019 00:44:00 GMT""},{""version"":""v4"",""created"":""Thu, 22 Aug 2019 14:32:16 GMT""}]","2019-08-23"
"1807.06654","Douglas Ulrich","William Gasarch and Douglas Ulrich","Distinct Volume Subsets via Indiscernibles","15 pages",,,,"math.LO","http://arxiv.org/licenses/nonexclusive-distrib/1.0/","  Erd\""{o}s proved that for every infinite $X \subseteq \mathbb{R}^d$ there is
$Y \subseteq X$ with $|Y|=|X|$, such that all pairs of points from $Y$ have
distinct distances, and he gave partial results for general $a$-ary volume. In
this paper, we search for the strongest possible canonization results for
$a$-ary volume, making use of general model-theoretic machinery. The main
difficulty is for singular cardinals; to handle this case we prove the
following. Suppose $T$ is a stable theory, $\Delta$ is a finite set of formulas
of $T$, $M \models T$, and $X$ is an infinite subset of $M$. Then there is $Y
\subseteq X$ with $|Y| = |X|$ and an equivalence relation $E$ on $Y$ with
infinitely many classes, each class infinite, such that $Y$ is $(\Delta,
E)$-indiscernible. We also consider the definable version of these problems,
for example we assume $X \subseteq \mathbb{R}^d$ is perfect (in the topological
sense) and we find some perfect $Y \subseteq X$ with all distances distinct.
Finally we show that Erd\""{o}s's theorem requires some use of the axiom of
choice.
","[{""version"":""v1"",""created"":""Tue, 17 Jul 2018 20:19:57 GMT""}]","2018-07-19"
"1807.06655","Mucahid Kutlu","Mucahid Kutlu, Kareem Darwish, Tamer Elsayed","Devam vs. Tamam: 2018 Turkish Elections",,,,,"cs.SI","http://arxiv.org/licenses/nonexclusive-distrib/1.0/","  On June 24, 2018, Turkey held a historical election, transforming its
parliamentary system to a presidential one. One of the main questions for
Turkish voters was whether to start this new political era with reelecting its
long-time political leader Recep Tayyip Erdogan or not. In this paper, we
analyzed 108M tweets posted in the two months leading to the election to
understand the groups that supported or opposed Erdogan's reelection. We
examined the most distinguishing hashtags and retweeted accounts for both
groups. Our findings indicate strong polarization between both groups as they
differ in terms of ideology, news sources they follow, and preferred TV
entertainment.
","[{""version"":""v1"",""created"":""Tue, 17 Jul 2018 20:20:41 GMT""}]","2018-07-19"
"1807.06656","Leo Duan","Leo L. Duan, Xia Wang, Rhonda D. Szczesniak","Mixed-Stationary Gaussian Process for Flexible Non-Stationary Modeling
  of Spatial Outcomes",,,,,"stat.ML cs.LG","http://arxiv.org/licenses/nonexclusive-distrib/1.0/","  Gaussian processes (GPs) are commonplace in spatial statistics. Although many
non-stationary models have been developed, there is arguably a lack of
flexibility compared to equipping each location with its own parameters.
However, the latter suffers from intractable computation and can lead to
overfitting. Taking the instantaneous stationarity idea, we construct a
non-stationary GP with the stationarity parameter individually set at each
location. Then we utilize the non-parametric mixture model to reduce the
effective number of unique parameters. Different from a simple mixture of
independent GPs, the mixture in stationarity allows the components to be
spatial correlated, leading to improved prediction efficiency. Theoretical
properties are examined and a linearly scalable algorithm is provided. The
application is shown through several simulated scenarios as well as the massive
spatiotemporally correlated temperature data.
","[{""version"":""v1"",""created"":""Tue, 17 Jul 2018 20:21:27 GMT""}]","2018-07-19"
"1807.06657","Alejandro Mottini","Alejandro Mottini, Alix Lheritier, Rodrigo Acuna-Agost","Airline Passenger Name Record Generation using Generative Adversarial
  Networks","ICML 2018 - workshop on Theoretical Foundations and Applications of
  Deep Generative Models",,,,"cs.LG stat.ML","http://arxiv.org/licenses/nonexclusive-distrib/1.0/","  Passenger Name Records (PNRs) are at the heart of the travel industry.
Created when an itinerary is booked, they contain travel and passenger
information. It is usual for airlines and other actors in the industry to
inter-exchange and access each other's PNR, creating the challenge of using
them without infringing data ownership laws. To address this difficulty, we
propose a method to generate realistic synthetic PNRs using Generative
Adversarial Networks (GANs). Unlike other GAN applications, PNRs consist of
categorical and numerical features with missing/NaN values, which makes the use
of GANs challenging. We propose a solution based on Cram\'{e}r GANs,
categorical feature embedding and a Cross-Net architecture. The method was
tested on a real PNR dataset, and evaluated in terms of distribution matching,
memorization, and performance of predictive models for two real business
problems: client segmentation and passenger nationality prediction. Results
show that the generated data matches well with the real PNRs without memorizing
them, and that it can be used to train models for real business applications.
","[{""version"":""v1"",""created"":""Tue, 17 Jul 2018 20:22:15 GMT""}]","2018-07-19"
"1807.06658","Jeremy Darling","Jeremy Darling, Alexandra E. Truebenbach","All Transverse Motion is Peculiar: Connecting the Proper Motions of
  Galaxies to the Matter Power Spectrum","Accepted for publication by ApJ. 14 pages, 10 figures",,"10.3847/1538-4357/aad3d0",,"astro-ph.CO","http://arxiv.org/licenses/nonexclusive-distrib/1.0/","  In an isotropic and homogeneous Hubble expansion, all transverse motion is
peculiar. Like the radial peculiar velocities of galaxies, transverse peculiar
velocities are a means to trace the density of matter that does not rely on
light tracing mass. Unlike radial peculiar velocity measurements that require
precise redshift-independent distances in order to distinguish between the
Hubble expansion and the observed redshift, transverse peculiar velocities can
be measured using redshifts alone as a proxy for distance. Extragalactic proper
motions can therefore directly measure peculiar velocities and probe the matter
power spectrum. Here we develop two-point transverse velocity correlation
statistics and demonstrate their dependence on the matter power spectrum. We
predict the power in these correlation statistics as a function of the physical
separation, angular separation, and distance of pairs of galaxies and
demonstrate that the effect of large scale structure on transverse motions is
best measured for pairs of objects with comoving separations less than about 50
Mpc. Transverse peculiar velocities induced by large scale structure should be
observable as proper motions using long baseline radio interferometry or
space-based optical astrometry.
","[{""version"":""v1"",""created"":""Tue, 17 Jul 2018 20:24:48 GMT""}]","2018-09-05"
"1807.06659","Adam Aczel","M.D. LeBlanc, A.A. Aczel, G.E. Granroth, B.W. Southern, J.-Q. Yan,
  S.E. Nagler, J.P. Whitehead, and M.L. Plumer","Impact of further-range exchange and cubic anisotropy on magnetic
  excitations in the fcc kagome antiferromagnet IrMn3","Submitted to Phys. Rev. B","Phys. Rev. B 104, 014427 (2021)","10.1103/PhysRevB.104.014427",,"cond-mat.str-el","http://arxiv.org/licenses/nonexclusive-distrib/1.0/","  Exchange interactions up to fourth nearest neighbor are shown within a
classical local-moment Heisenberg approach to be important to model inelastic
neutron scattering data on the fcc kagome antiferromagnet IrMn$_3$. Spin wave
frequencies are calculated using the torque equation and the magnetic
scattering function, $S({\bf Q},\omega)$, is determined by a Green's function
method, as an extension of our previous work, LeBlanc et al, Phys. Rev. B 90,
144403 (2014). Results are compared with intensity contour data on powder
samples of ordered IrMn$_3$, where magnetic Mn ions occupy lattice sites of ABC
stacked kagome planes. Values of exchange parameters taken from DFT
calculations used in our model provide good agreement with the experimental
results only if further-neighbor exchange is included. Estimates of the
observed energy gap support the existence of strong cubic anisotropy predicted
by DFT calculations.
","[{""version"":""v1"",""created"":""Tue, 17 Jul 2018 20:31:36 GMT""}]","2021-08-04"
"1807.06660","Cristian Cortes L","Cristian L. Cortes and Zubin Jacob","Fundamental figures of merit for engineering Forster resonance energy
  transfer","18 pages, 6 figures","Optics Express 26, 19371-19387 (2018)","10.1364/OE.26.019371",,"physics.optics","http://arxiv.org/licenses/nonexclusive-distrib/1.0/","  Over the past 15 years there has been an ongoing debate regarding the
influence of the photonic environment on Forster resonance energy transfer
(FRET). Disparate results corresponding to enhancement, suppression and null
effect of the photonic environment have led to a lack of consensus between the
traditional theory of FRET and experiments. Here we show that the quantum
electrodynamic theory of FRET near an engineered nanophotonic environment is
exactly equivalent to an effective near-field model describing electrostatic
dipole-dipole interactions. This leads to an intuitive and rigorously exact
description of FRET bridging the gap between experimental observations and
theoretical interpretations. We show that the widely used concept of the
Purcell factor is only important for understanding spontaneous emission and is
an incorrect figure of merit for analyzing FRET. To this end, we analyze the
figures of merit which characterize FRET in a photonic environment: (1) the
FRET rate enhancement factor ($F_{ET}$), (2) the FRET efficiency enhancement
factor ($F_{eff}$) and (3) the two-point spectral density ($S_{EE}$) governing
FRET analogous to the local density of states that controls spontaneous
emission. Counterintuitive to existing knowledge, we show that suppression of
the Purcell factor is in fact necessary for enhancing the efficiency of the
FRET process. We place fundamental bounds on the FRET figures of merit arising
from material absorption in the photonic environment as well as key properties
of emitters including intrinsic quantum efficiencies and orientational
dependence. Finally, we use our approach to conclusively explain recent
experiments and predict regimes where the FRET rate is expected to be enhanced,
suppressed or remain the same. Our work paves for a complete theory of FRET
with predictive power for designing the ideal photonic environment to control
FRET.
","[{""version"":""v1"",""created"":""Tue, 17 Jul 2018 20:32:14 GMT""}]","2018-08-15"
"1807.06661","Madhurima Nath","Madhurima Nath and Stephen Eubank","Model selection for sequential designs in discrete finite systems using
  Bernstein kernels",,,,,"stat.ME","http://arxiv.org/licenses/nonexclusive-distrib/1.0/","  We view sequential design as a model selection problem to determine which new
observation is expected to be the most informative, given the existing set of
observations. For estimating a probability distribution on a bounded interval,
we use bounds constructed from kernel density estimators along with the
estimated density itself to estimate the information gain expected from each
observation. We choose Bernstein polynomials for the kernel functions because
they provide a complete set of basis functions for polynomials of finite degree
and thus have useful convergence properties. We illustrate the method with
applications to estimating network reliability polynomials, which give the
probability of certain sets of configurations in finite, discrete stochastic
systems.
","[{""version"":""v1"",""created"":""Tue, 17 Jul 2018 20:33:34 GMT""}]","2018-07-19"
"1807.06662","Erika Holmbeck","Erika M. Holmbeck, Rebecca Surman, Trevor M. Sprouse, Matthew R.
  Mumpower, Nicole Vassh, Timothy C. Beers, and Toshihiko Kawano","Actinide Production in Neutron-Rich Ejecta of a Neutron Star Merger","15 pages, 19 figures",,"10.3847/1538-4357/aaefef",,"astro-ph.SR astro-ph.HE nucl-th","http://arxiv.org/licenses/nonexclusive-distrib/1.0/","  The rapid-neutron-capture (""r"") process is responsible for synthesizing many
of the heavy elements observed in both the solar system and Galactic metal-poor
halo stars. Simulations of r-process nucleosynthesis can reproduce abundances
derived from observations with varying success, but so far fail to account for
the observed over-enhancement of actinides, present in about 30% of
r-process-enhanced stars. In this work, we investigate actinide production in
the dynamical ejecta of a neutron star merger and explore if varying levels of
neutron richness can reproduce the actinide boost. We also investigate the
sensitivity of actinide production on nuclear physics properties: fission
distribution, beta-decay, and mass model. For most cases, the actinides are
over-produced in our models if the initial conditions are sufficiently
neutron-rich for fission cycling. We find that actinide production can be so
robust in the dynamical ejecta that an additional lanthanide-rich,
actinide-poor component is necessary in order to match observations of
actinide-boost stars. We present a simple actinide-dilution model that folds in
estimated contributions from two nucleosynthetic sites within a merger event.
Our study suggests that while the dynamical ejecta of a neutron star merger is
a likely production site for the formation of actinides, a significant
contribution from another site or sites (e.g., the neutron star merger
accretion disk wind) is required to explain abundances of r-process-enhanced,
metal-poor stars.
","[{""version"":""v1"",""created"":""Tue, 17 Jul 2018 20:36:21 GMT""},{""version"":""v2"",""created"":""Thu, 18 Oct 2018 20:54:25 GMT""}]","2019-01-16"
"1807.06663","Suwon Shon","Suwon Shon, Najim Dehak, Douglas Reynolds, James Glass","MCE 2018: The 1st Multi-target Speaker Detection and Identification
  Challenge Evaluation (MCE) Plan, Dataset and Baseline System","MCE 2018 Plan (http://mce.csail.mit.edu)",,,,"eess.AS cs.SD","http://arxiv.org/licenses/nonexclusive-distrib/1.0/","  The Multitarget Challenge aims to assess how well current speech technology
is able to determine whether or not a recorded utterance was spoken by one of a
large number of 'blacklisted' speakers. It is a form of multi-target speaker
detection based on real-world telephone conversations. Data recordings are
generated from call center customer-agent conversations. Each conversation is
represented by a single i-vector. Given a pool of training and development data
from non-Blacklist and Blacklist speakers, the task is to measure how
accurately one can detect 1) whether a test recording is spoken by a Blacklist
speaker, and 2) which specific Blacklist speaker was talking.
","[{""version"":""v1"",""created"":""Tue, 17 Jul 2018 20:37:18 GMT""}]","2018-07-19"
"1807.06664","Jingzhe Ma","Jingzhe Ma, Arianna Brown, Asantha Cooray, Hooshang Nayyeri, Hugo
  Messias, Nicholas Timmons, Johannes Staguhn, Pasquale Temi, C. Darren Dowell,
  Julie Wardlow, Dario Fadda, Attila Kovacs, Dominik Riechers, Ivan Oteo, Derek
  Wilson, and Ismael Perez-Fournon","SOFIA/HAWC+ detection of a gravitationally lensed starburst galaxy at
  $z$ = 1.03","8 pages, 3 figures; accepted for publication in ApJ",,"10.3847/1538-4357/aad4a0",,"astro-ph.GA","http://arxiv.org/licenses/nonexclusive-distrib/1.0/","  We present the detection at 89 $\mu$m (observed frame) of the {\it
Herschel}-selected gravitationally lensed starburst galaxy HATLASJ1429-0028
(also known as G15v2.19) in 15 minutes with the High-resolution Airborne
Wideband Camera-plus (HAWC+) onboard the Stratospheric Observatory for Infrared
Astronomy (SOFIA). The spectacular lensing system consists of an edge-on
foreground disk galaxy at $z$ = 0.22 and a nearly complete Einstein ring of an
intrinsic ultra-luminous infrared galaxy at $z$ = 1.03. Is this high IR
luminosity powered by pure star formation (SF) or also an active galactic
nucleus (AGN)? Previous nebular line diagnostics indicate that it is
star-formation dominated. We perform a 27-band multi-wavelength spectral energy
distribution modeling (SED) including the new SOFIA/HAWC+ data to constrain the
fractional AGN contribution to the total IR luminosity. The AGN fraction in the
IR turns out to be negligible. In addition, J1429-0028 serves as a testbed for
comparing SED results from different models/templates and SED codes (MAGPHYS,
SED3FIT, and CIGALE). We stress that star formation history is the dominant
source of uncertainty in the derived stellar mass (as high as a factor of
$\sim$ 10) even in the case of extensive photometric coverage. Furthermore, the
detection of a source at $z$ $\sim$ 1 with SOFIA/HAWC+ demonstrates the
potential of utilizing this facility for distant galaxy studies including the
decomposition of SF/AGN components, which cannot be accomplished with other
current facilities.
","[{""version"":""v1"",""created"":""Tue, 17 Jul 2018 20:38:45 GMT""},{""version"":""v2"",""created"":""Thu, 19 Jul 2018 00:31:38 GMT""}]","2018-09-05"
"1807.06665","Adam Aczel","A.A. Aczel, L.M. DeBeer-Schmitt, T.J. Williams, M.A. McGuire, N.J.
  Ghimire, L. Li, and D. Mandrus","Extended exchange interactions stabilize long-period magnetic structures
  in Cr$_{1/3}$NbS$_2$","Accepted by Applied Physics Letters","Appl. Phys. Lett. 113, 032404 (2018)","10.1063/1.5038021",,"cond-mat.str-el","http://arxiv.org/licenses/nonexclusive-distrib/1.0/","  The topologically-protected, chiral soliton lattice is a unique state of
matter offering intriguing functionality and it may serve as a robust platform
for storing and transporting information in future spintronics devices. While
the monoaxial chiral magnet Cr$_{1/3}$NbS$_2$ is known to host this exotic
state in an applied magnetic field, its detailed microscopic origin has
remained a matter of debate. Here we work towards addressing this open question
by measuring the spin wave spectrum of Cr$_{1/3}$NbS$_2$ over the entire
Brillouin zone with inelastic neutron scattering. The well-defined spin wave
modes allow us to determine the values of several microscopic interactions for
this system. The experimental data is well-explained by a Heisenberg
Hamiltonian with exchange constants up to third nearest neighbor and an easy
plane magnetocrystalline anisotropy term. Our work shows that both the second
and third nearest neighbor exchange interactions contribute to the formation of
the helimagnetic and chiral soliton lattice states in this robust
three-dimensional magnet.
","[{""version"":""v1"",""created"":""Tue, 17 Jul 2018 20:40:34 GMT""}]","2019-04-12"
"1807.06666","Dong Hao","Dong Hao, Kai Li, Tao Zhou","Payoff Control in the Iterated Prisoner's Dilemma",,"Proceedings of the Twenty-Seventh International Joint Conference
  on Artificial Intelligence. Main track. Pages 296-302. 2018",,,"cs.GT cs.AI cs.MA","http://arxiv.org/licenses/nonexclusive-distrib/1.0/","  Repeated game has long been the touchstone model for agents' long-run
relationships. Previous results suggest that it is particularly difficult for a
repeated game player to exert an autocratic control on the payoffs since they
are jointly determined by all participants. This work discovers that the scale
of a player's capability to unilaterally influence the payoffs may have been
much underestimated. Under the conventional iterated prisoner's dilemma, we
develop a general framework for controlling the feasible region where the
players' payoff pairs lie. A control strategy player is able to confine the
payoff pairs in her objective region, as long as this region has feasible
linear boundaries. With this framework, many well-known existing strategies can
be categorized and various new strategies with nice properties can be further
identified. We show that the control strategies perform well either in a
tournament or against a human-like opponent.
","[{""version"":""v1"",""created"":""Tue, 17 Jul 2018 20:44:51 GMT""}]","2018-07-19"
"1807.06667","Samvit Jain","Samvit Jain, Xin Wang, Joseph Gonzalez","Accel: A Corrective Fusion Network for Efficient Semantic Segmentation
  on Video","CVPR 2019 (oral)",,,,"cs.CV cs.LG","http://arxiv.org/licenses/nonexclusive-distrib/1.0/","  We present Accel, a novel semantic video segmentation system that achieves
high accuracy at low inference cost by combining the predictions of two network
branches: (1) a reference branch that extracts high-detail features on a
reference keyframe, and warps these features forward using frame-to-frame
optical flow estimates, and (2) an update branch that computes features of
adjustable quality on the current frame, performing a temporal update at each
video frame. The modularity of the update branch, where feature subnetworks of
varying layer depth can be inserted (e.g. ResNet-18 to ResNet-101), enables
operation over a new, state-of-the-art accuracy-throughput trade-off spectrum.
Over this curve, Accel models achieve both higher accuracy and faster inference
times than the closest comparable single-frame segmentation networks. In
general, Accel significantly outperforms previous work on efficient semantic
video segmentation, correcting warping-related error that compounds on datasets
with complex dynamics. Accel is end-to-end trainable and highly modular: the
reference network, the optical flow network, and the update network can each be
selected independently, depending on application requirements, and then jointly
fine-tuned. The result is a robust, general system for fast, high-accuracy
semantic segmentation on video.
","[{""version"":""v1"",""created"":""Tue, 17 Jul 2018 20:45:23 GMT""},{""version"":""v2"",""created"":""Fri, 7 Sep 2018 03:28:11 GMT""},{""version"":""v3"",""created"":""Thu, 22 Nov 2018 23:47:24 GMT""},{""version"":""v4"",""created"":""Fri, 5 Jul 2019 20:36:08 GMT""}]","2019-07-09"
