"1807.06766","Soham De","Soham De, Anirbit Mukherjee, Enayat Ullah","Convergence guarantees for RMSProp and ADAM in non-convex optimization
  and an empirical comparison to Nesterov acceleration","Presented on 14th July 2018 at the ICML Workshop on Modern Trends in
  Nonconvex Optimization for Machine Learning. In this version, we have made
  changes to the setup of our Theorem 3.1, and added additional experimental
  results",,,,"cs.LG math.OC stat.ML","http://arxiv.org/licenses/nonexclusive-distrib/1.0/","  RMSProp and ADAM continue to be extremely popular algorithms for training
neural nets but their theoretical convergence properties have remained unclear.
Further, recent work has seemed to suggest that these algorithms have worse
generalization properties when compared to carefully tuned stochastic gradient
descent or its momentum variants. In this work, we make progress towards a
deeper understanding of ADAM and RMSProp in two ways. First, we provide proofs
that these adaptive gradient algorithms are guaranteed to reach criticality for
smooth non-convex objectives, and we give bounds on the running time.
  Next we design experiments to empirically study the convergence and
generalization properties of RMSProp and ADAM against Nesterov's Accelerated
Gradient method on a variety of common autoencoder setups and on VGG-9 with
CIFAR-10. Through these experiments we demonstrate the interesting sensitivity
that ADAM has to its momentum parameter $\beta_1$. We show that at very high
values of the momentum parameter ($\beta_1 = 0.99$) ADAM outperforms a
carefully tuned NAG on most of our experiments, in terms of getting lower
training and test losses. On the other hand, NAG can sometimes do better when
ADAM's $\beta_1$ is set to the most commonly used value: $\beta_1 = 0.9$,
indicating the importance of tuning the hyperparameters of ADAM to get better
generalization performance.
  We also report experiments on different autoencoders to demonstrate that NAG
has better abilities in terms of reducing the gradient norms, and it also
produces iterates which exhibit an increasing trend for the minimum eigenvalue
of the Hessian of the loss function at the iterates.
","[{""version"":""v1"",""created"":""Wed, 18 Jul 2018 03:58:02 GMT""},{""version"":""v2"",""created"":""Mon, 8 Oct 2018 16:44:35 GMT""},{""version"":""v3"",""created"":""Tue, 20 Nov 2018 21:57:15 GMT""}]","2018-11-22"
"1807.06767","Peter Hillyard","Peter Hillyard, Anh Luong, Alemayehu Solomon Abrar, Neal Patwari,
  Krishna Sundar, Robert Farney, Jason Burch, Christina A. Porucznik, Sarah
  Hatch Pollard","Comparing Respiratory Monitoring Performance of Commercial Wireless
  Devices",,,,,"eess.SP physics.med-ph","http://arxiv.org/licenses/nonexclusive-distrib/1.0/","  This paper addresses the performance of systems which use commercial wireless
devices to make bistatic RF channel measurements for non-contact respiration
sensing. Published research has typically presented results from short
controlled experiments on one system. In this paper, we deploy an extensive
real-world comparative human subject study. We observe twenty patients during
their overnight sleep (a total of 160 hours), during which contact sensors
record ground-truth breathing data, patient position is recorded, and four
different RF breathing monitoring systems simultaneously record measurements.
We evaluate published methods and algorithms. We find that WiFi channel state
information measurements provide the most robust respiratory rate estimates of
the four RF systems tested. However, all four RF systems have periods during
which RF-based breathing estimates are not reliable.
","[{""version"":""v1"",""created"":""Wed, 18 Jul 2018 03:58:46 GMT""}]","2018-07-19"
"1807.06768","Nabamita Banerjee","Nabamita Banerjee, Arindam Bhattacharjee, Ivano Lodato, Turmoli Neogi","Maximally $\cal{N}$-extended super-BMS$_3$ algebras and Generalized 3D
  Gravity Solutions","29+1 pages, typos corrected",,"10.1007/JHEP01(2019)115",,"hep-th","http://arxiv.org/licenses/nonexclusive-distrib/1.0/","  We consider the maximal $\cal{N}-$extended supergravity theory in 3
dimensions with fermionic generators transforming under real but non
necessarily irreducible representations of the internal algebra. We obtain the
symmetry algebra at null infinity preserving boundary conditions of
asymptotically flat solutions, i.e. the maximal $\cal{N}-$extended
super-BMS$_3$ algebra, which possesses non-linear correction in the
anti-commutators of supercharges. We present the supersymmetric energy bound
and derive the explicit form of the asymptotic Killing spinors. We also find
the most generic circular symmetric ground state of the theory, which
corresponds to a non-supersymmetric cosmological solutions and derive their
entropy.
","[{""version"":""v1"",""created"":""Wed, 18 Jul 2018 04:02:47 GMT""},{""version"":""v2"",""created"":""Thu, 19 Jul 2018 05:09:38 GMT""},{""version"":""v3"",""created"":""Tue, 8 Jan 2019 07:08:18 GMT""}]","2019-02-20"
"1807.06769","Li Huang","Li Huang and Haiyan Lu","Electronic structure of cerium: A comprehensive first-principles study","14 pages, 9 figures","Phys. Rev. B 99, 045122 (2019)","10.1103/PhysRevB.99.045122",,"cond-mat.str-el cond-mat.mtrl-sci","http://arxiv.org/licenses/nonexclusive-distrib/1.0/","  Cerium, in which the 4$f$ valence electrons live at the brink between
localized and itinerant characters, exhibits varying crystal structures and
therefore anomalous physical properties with respect to temperature and
pressure. Understanding its electronic structure and related lattice properties
is one of the central topics in condensed matter theory. In the present work,
we employed the state-of-the-art first-principles many-body approach (i.e., the
density functional theory in combination with the single-site dynamical
mean-field theory) to study its electronic structure thoroughly. The
momentum-resolved spectral functions, total and $4f$ partial density of states,
optical conductivities, self-energy functions, and atomic eigenstate histograms
for cerium's four allotropes under ambient pressure were calculated and
analyzed carefully. The calculated results demonstrate that the 4$f$ electrons
in the $\alpha$, $\beta$, $\gamma$, and $\delta$ phases are all correlated with
heavily remormalized electron masses. In the $\alpha$ phase, the 4$f$ electrons
tend to be itinerant, which cause strong hybridization between the 4$f$ and
$spd$ bands and remarkable 4$f$ valence state fluctuation. While for the other
phases, the 4$f$ electrons are close to be localized. Our calculated results
support the Kondo volume collapse scenario for the cerium $\alpha-\gamma$
transition. Finally, we examined the site dependence of $4f$ electronic
structure in the $\beta$ phase. The calculated results suggest that it doesn't
exhibit a site selective 4$f$ localized state, contrary to previous prediction.
","[{""version"":""v1"",""created"":""Wed, 18 Jul 2018 04:03:42 GMT""}]","2019-01-16"
"1807.06770","Wenfei Du","Wenfei Du and Rob Tibshirani","A pliable lasso for the Cox model",,,,,"stat.AP","http://arxiv.org/licenses/nonexclusive-distrib/1.0/","  We introduce a pliable lasso method for estimation of interaction effects in
the Cox proportional hazards model framework. The pliable lasso is a linear
model that includes interactions between covariates X and a set of modifying
variables Z and assumes sparsity of the main effects and interaction effects.
The hierarchical penalty excludes interaction effects when the corresponding
main effects are zero: this avoids overfitting and an explosion of model
complexity. We extend this method to the Cox model for survival data,
incorporating modifiers that are either fixed or varying in time into the
partial likelihood. For example, this allows modeling of survival times that
differ based on interactions of genes with age, gender, or other demographic
information. The optimization is done by blockwise coordinate descent on a
second order approximation of the objective.
","[{""version"":""v1"",""created"":""Wed, 18 Jul 2018 04:09:47 GMT""}]","2018-07-19"
"1807.06771","Kosuke Nagashio","Yoshiaki Hattori, Takashi Taniguchi, Kenji Watanabe and Kosuke
  Nagashio","Determination of Carrier Polarity in Fowler-Nordheim Tunneling and
  Evidence of Fermi Level Pinning at the Hexagonal Boron Nitride / Metal
  Interface",,"ACS appl. mater. interfaces, 2018, 10, 11732","10.1021/acsami.7b18454",,"cond-mat.mtrl-sci","http://arxiv.org/licenses/nonexclusive-distrib/1.0/","  Hexagonal boron nitride (h-BN) is an important insulating substrate for
two-dimensional (2D) heterostructure devices and possesses high dielectric
strength comparable to SiO2. Here, we report two clear differences in their
physical properties. The first one is the occurrence of Fermi level pinning at
the metal/h-BN interface, unlike that at the metal/SiO2 interface. The second
one is that the carrier of Fowler-Nordheim (F-N) tunneling through h-BN is a
hole, which is opposite to an electron in the case of SiO2. These unique
characteristics are verified by I-V measurements in the graphene/h-BN/metal
heterostructure device with the aid of a numerical simulation, where the
barrier height of graphene can be modulated by a back gate voltage owing to its
low density of states. Furthermore, from a systematic investigation using a
variety of metals, it is confirmed that the hole F-N tunneling current is a
general characteristic because the Fermi levels of metals are pinned in the
small energy range around ~3.5 eV from the top of the conduction band of h-BN,
with a pinning factor of 0.30. The accurate energy band alignment at the
h-BN/metal interface provides practical knowledge for 2D heterostructure
devices.
","[{""version"":""v1"",""created"":""Wed, 18 Jul 2018 04:25:53 GMT""}]","2018-07-19"
"1807.06772","Ranju Mandal Dr.","Ranju Mandal and Partha Pratim Roy and Umapada Pal and Michael
  Blumenstein","Bag-of-Visual-Words for Signature-Based Multi-Script Document Retrieval",,,,,"cs.CV","http://arxiv.org/licenses/nonexclusive-distrib/1.0/","  An end-to-end architecture for multi-script document retrieval using
handwritten signatures is proposed in this paper. The user supplies a query
signature sample and the system exclusively returns a set of documents that
contain the query signature. In the first stage, a component-wise
classification technique separates the potential signature components from all
other components. A bag-of-visual-words powered by SIFT descriptors in a
patch-based framework is proposed to compute the features and a Support Vector
Machine (SVM)-based classifier was used to separate signatures from the
documents. In the second stage, features from the foreground (i.e. signature
strokes) and the background spatial information (i.e. background loops,
reservoirs etc.) were combined to characterize the signature object to match
with the query signature. Finally, three distance measures were used to match a
query signature with the signature present in target documents for retrieval.
The `Tobacco' document database and an Indian script database containing 560
documents of Devanagari (Hindi) and Bangla scripts were used for the
performance evaluation. The proposed system was also tested on noisy documents
and promising results were obtained. A comparative study shows that the
proposed method outperforms the state-of-the-art approaches.
","[{""version"":""v1"",""created"":""Wed, 18 Jul 2018 04:29:20 GMT""}]","2018-07-19"
"1807.06773","Jerzy Kocik","Jerzy Kocik and Mohammad Sayeh","Coupled-Ring Resonance and Unitary Groups","15 pages, 11 figures",,"10.1364/JOSAB.36.000667",,"physics.optics","http://arxiv.org/licenses/nonexclusive-distrib/1.0/","  The group-theoretic content of photonic coupled microrings resonance
phenomena is shown, in particular, an interesting emergence of pseudo-unitary
group. The application to the resonance condition in a tri-microring
configuration is solved exactly. A practical application of this work will be
in the resonance frequency tuning based on the coupling coefficient, in
particular, the Mach-Zehnder interferometer approach was analyzed for the
coupling modulation.
","[{""version"":""v1"",""created"":""Wed, 18 Jul 2018 04:59:50 GMT""}]","2019-03-27"
"1807.06774","Markus Lohrey","Markus Lohrey","Knapsack in hyperbolic groups",,,,,"math.GR cs.FL","http://arxiv.org/licenses/nonexclusive-distrib/1.0/","  Recently knapsack problems have been generalized from the integers to
arbitrary finitely generated groups. The knapsack problem for a finitely
generated group $G$ is the following decision problem: given a tuple $(g, g_1,
\ldots, g_k)$ of elements of $G$, are there natural numbers $n_1, \ldots, n_k
\in \mathbb{N}$ such that $g = g_1^{n_1} \cdots g_k^{n_k}$ holds in $G$?
Myasnikov, Nikolaev, and Ushakov proved that for every (Gromov-)hyperbolic
group, the knapsack problem can be solved in polynomial time. In this paper,
the precise complexity of the knapsack problem for hyperbolic group is
determined: for every hyperbolic group $G$, the knapsack problem belongs to the
complexity class $\mathsf{LogCFL}$, and it is $\mathsf{LogCFL}$-complete if $G$
contains a free group of rank two. Moreover, it is shown that for every
hyperbolic group $G$ and every tuple $(g, g_1, \ldots, g_k)$ of elements of $G$
the set of all $(n_1, \ldots, n_k) \in \mathbb{N}^k$ such that $g = g_1^{n_1}
\cdots g_k^{n_k}$ in $G$ is semilinear and a semilinear representation where
all integers are of size polynomial in the total geodesic length of the $g,
g_1, \ldots, g_k$ can be computed. Groups with this property are also called
knapsack-tame. This enables us to show that knapsack can be solved in
$\mathsf{LogCFL}$ for every group that belongs to the closure of hyperbolic
groups under free products and direct products with $\mathbb{Z}$.
","[{""version"":""v1"",""created"":""Wed, 18 Jul 2018 05:20:56 GMT""},{""version"":""v2"",""created"":""Tue, 9 Apr 2019 06:28:23 GMT""}]","2019-04-10"
"1807.06775","Mohammed Hassanin","Mohammed Hassanin, Salman Khan, Murat Tahtali","Visual Affordance and Function Understanding: A Survey","26 pages, 22 images",,,,"cs.CV cs.RO","http://arxiv.org/licenses/nonexclusive-distrib/1.0/","  Nowadays, robots are dominating the manufacturing, entertainment and
healthcare industries. Robot vision aims to equip robots with the ability to
discover information, understand it and interact with the environment. These
capabilities require an agent to effectively understand object affordances and
functionalities in complex visual domains. In this literature survey, we first
focus on Visual affordances and summarize the state of the art as well as open
problems and research gaps. Specifically, we discuss sub-problems such as
affordance detection, categorization, segmentation and high-level reasoning.
Furthermore, we cover functional scene understanding and the prevalent
functional descriptors used in the literature. The survey also provides
necessary background to the problem, sheds light on its significance and
highlights the existing challenges for affordance and functionality learning.
","[{""version"":""v1"",""created"":""Wed, 18 Jul 2018 05:21:30 GMT""}]","2018-07-19"
"1807.06776","Leying Guan","Leying Guan, Xi Chen, Wing Hung Wong","Detecting strong signals in gene perturbation experiments: An adaptive
  approach with power guarantee and FDR control",,,,,"stat.ME","http://arxiv.org/licenses/nonexclusive-distrib/1.0/","  The perturbation of a transcription factor should affect the expression
levels of its direct targets. However, not all genes showing changes in
expression are direct targets. To increase the chance of detecting direct
targets, we propose a modified two-group model where the null group corresponds
to genes which are not direct targets, but can have small non-zero effects. We
model the behaviour of genes from the null set by a Gaussian distribution with
unknown variance $\tau^2$, and we discuss and compare three methods which
adaptively estimate $\tau^2$ from the data: the iterated empirical Bayes
estimator, the truncated MLE and the central moment matching estimator. We
conduct a detailed analysis of the properties of the iterated EB estimate which
has the best performance in the simulations. In particular, we provide
theoretical guarantee of its good performance under mild conditions.
  We provide simulations comparing the new modeling approach with existing
methods, and the new approach shows more stable and better performance under
different situations. We also apply it to a real data set from gene knock-down
experiments and obtained better results compared with the original two-group
model testing for non-zero effects.
","[{""version"":""v1"",""created"":""Wed, 18 Jul 2018 05:21:47 GMT""}]","2018-07-19"
"1807.06777","Sasha Rubin","Benjamin Aminof, Giuseppe De Giacomo, Aniello Murano, Sasha Rubin","Planning and Synthesis Under Assumptions",,,,,"cs.LO cs.AI","http://arxiv.org/licenses/nonexclusive-distrib/1.0/","  In Reasoning about Action and Planning, one synthesizes the agent plan by
taking advantage of the assumption on how the environment works (that is, one
exploits the environment's effects, its fairness, its trajectory constraints).
In this paper we study this form of synthesis in detail. We consider
assumptions as constraints on the possible strategies that the environment can
have in order to respond to the agent's actions. Such constraints may be given
in the form of a planning domain (or action theory), as linear-time formulas
over infinite or finite runs, or as a combination of the two. We argue though
that not all assumption specifications are meaningful: they need to be
consistent, which means that there must exist an environment strategy
fulfilling the assumption in spite of the agent actions. For such assumptions,
we study how to do synthesis/planning for agent goals, ranging from a classical
reachability to goal on traces specified in \LTL and \LTLf/\LDLf,
characterizing the problem both mathematically and algorithmically.
","[{""version"":""v1"",""created"":""Wed, 18 Jul 2018 05:23:43 GMT""},{""version"":""v2"",""created"":""Tue, 21 May 2019 22:42:13 GMT""}]","2019-05-23"
"1807.06778","Amirsina Torfi","Amirsina Torfi","Resilient Feedback Controller Design For Linear Model of Power Grids",,,,,"cs.SY","http://arxiv.org/licenses/nonexclusive-distrib/1.0/","  In this paper, a resilient controller is designed for the linear
time-invariant (LTI) systems subject to attacks on the sensors and the
actuators. A novel probabilistic attack model is proposed to capture
vulnerabilities of the communication links from sensors to the controller and
from the controller to actuators. The observer and the controller formulation
under the attack are derived. Thereafter, By leveraging Lyapunov functional
methods, it is shown that exponential mean-square stability of the system under
the output feedback controller is guaranteed if a certain LMI is feasible. The
simulation results show the effectiveness and applicability of the proposed
controller design approach.
","[{""version"":""v1"",""created"":""Wed, 18 Jul 2018 05:34:23 GMT""}]","2018-07-19"
"1807.06779","Yuan Liu","Yuan Liu, Yuancheng Wang, Nan Li, Xu Cheng, Yifeng Zhang, Yongming
  Huang, Guojun Lu","An Attention-Based Approach for Single Image Super Resolution",,,,,"cs.CV","http://creativecommons.org/licenses/by-nc-sa/4.0/","  The main challenge of single image super resolution (SISR) is the recovery of
high frequency details such as tiny textures. However, most of the
state-of-the-art methods lack specific modules to identify high frequency
areas, causing the output image to be blurred. We propose an attention-based
approach to give a discrimination between texture areas and smooth areas. After
the positions of high frequency details are located, high frequency
compensation is carried out. This approach can incorporate with previously
proposed SISR networks. By providing high frequency enhancement, better
performance and visual effect are achieved. We also propose our own SISR
network composed of DenseRes blocks. The block provides an effective way to
combine the low level features and high level features. Extensive benchmark
evaluation shows that our proposed method achieves significant improvement over
the state-of-the-art works in SISR.
","[{""version"":""v1"",""created"":""Wed, 18 Jul 2018 05:34:49 GMT""}]","2018-07-19"
"1807.06780","Nirbhay Kumar Behera Dr.","Nirbhay Kumar Behera (for the ALICE Collaboration)","Higher moment fluctuations of identified particle distributions from
  ALICE","4 pages, 3 figures, Proceedings of XXVIIth International Conference
  on Ultrarelativistic Nucleus-Nucleus Collisions (Quark Matter 2018)",,"10.1016/j.nuclphysa.2018.11.030",,"hep-ex nucl-ex","http://arxiv.org/licenses/nonexclusive-distrib/1.0/","  Cumulants of conserved charges fluctuations are regarded as a potential tool
to study the criticality in the QCD phase diagram and to determine the
freeze-out parameters in a model-independent way. At LHC energies, the
measurements of the ratio of the net-baryon (net-proton) cumulants can be used
to test the lattice QCD predictions. In this work, we present the first
measurements of cumulants of the net-proton number distributions up to $4^{th}$
order in Pb--Pb collisions at $\sqrt{s_{\mathrm{NN}}}$ = 2.76 and 5.02 TeV as a
function of collision centrality. We compare our cumulant ratios results with
the STAR experiment net-proton results measured in the first phase of the Beam
Energy Scan program at RHIC. The results can be used to obtain the chemical
freeze-out parameters at LHC.
","[{""version"":""v1"",""created"":""Wed, 18 Jul 2018 05:36:33 GMT""}]","2019-02-20"
"1807.06781","S\""oren Petrat","Nikolai Leopold and S\""oren Petrat","Mean-field Dynamics for the Nelson Model with Fermions","31 pages; v3: several minor improvements","Annales Henri Poincare, 20(10): 3471-3508 (2019)","10.1007/s00023-019-00828-w",,"math-ph math.AP math.MP","http://arxiv.org/licenses/nonexclusive-distrib/1.0/","  We consider the Nelson model with ultraviolet cutoff, which describes the
interaction between non-relativistic particles and a positive or zero mass
quantized scalar field. We take the non-relativistic particles to obey Fermi
statistics and discuss the time evolution in a mean-field limit of many
fermions. In this case, the limit is known to be also a semiclassical limit. We
prove convergence in terms of reduced density matrices of the many-body state
to a tensor product of a Slater determinant with semiclassical structure and a
coherent state, which evolve according to a fermionic version of the
Schroedinger-Klein-Gordon equations.
","[{""version"":""v1"",""created"":""Wed, 18 Jul 2018 05:43:15 GMT""},{""version"":""v2"",""created"":""Sun, 24 Feb 2019 23:02:18 GMT""},{""version"":""v3"",""created"":""Sat, 13 Jul 2019 12:06:11 GMT""}]","2019-10-08"
