"1807.06516","Emeric Gioan","Emeric Gioan, Michel Las Vergnas","The Active Bijection 2.a - Decomposition of activities for matroid
  bases, and Tutte polynomial of a matroid in terms of beta invariants of
  minors","27 pages",,,,"math.CO","http://arxiv.org/licenses/nonexclusive-distrib/1.0/","  We introduce and study filtrations of a matroid on a linearly ordered ground
set, which are particular sequences of nested sets. A given basis can be
decomposed into a uniquely defined sequence of bases of minors, such that these
bases have an internal/external activity equal to 1/0 or 0/1 (in the sense of
Tutte polynomial activities). This decomposition, which we call the active
filtration/partition of the basis, refines the known partition of the ground
set into internal and external elements with respect to a given basis. It can
be built by a certain closure operator, which we call the active closure. It
relies only on the fundamental bipartite graph of the basis and can be
expressed also as a decomposition of general bipartite graphs on a linearly
ordered set of vertices.
  From this, first, structurally, we obtain that the set of all bases can be
canonically partitioned and decomposed in terms of such bases of minors induced
by filtrations. Second, enumeratively, we derive an expression of the Tutte
polynomial of a matroid in terms of beta invariants of minors. This expression
refines at the same time the classical expressions in terms of basis activities
and orientation activities (if the matroid is oriented), and the well-known
convolution formula for the Tutte polynomial. Third, in a companion paper of
the same series (No. 2.b), we use this decomposition of matroid bases, along
with a similar decomposition of oriented matroids, and along with a bijection
in the 1/0 activity case from a previous paper (No. 1), to define the canonical
active bijection between orientations/signatures/reorientations and spanning
trees/simplices/bases of a graph/real hyperplane arrangement/oriented matroid,
as well as various related bijections.
","[{""version"":""v1"",""created"":""Tue, 17 Jul 2018 16:00:13 GMT""},{""version"":""v2"",""created"":""Wed, 18 Jul 2018 12:55:57 GMT""}]","2018-07-19"
"1807.06517","Osman Ramadan","Osman Ramadan, Pawe{\l} Budzianowski, Milica Ga\v{s}i\'c","Large-Scale Multi-Domain Belief Tracking with Knowledge Sharing","10 pages, 1 figure and 2 tables. In Proceedings of the 56th Annual
  Meeting of the Association for Computational Linguistics (ACL)",,,,"cs.CL","http://arxiv.org/licenses/nonexclusive-distrib/1.0/","  Robust dialogue belief tracking is a key component in maintaining good
quality dialogue systems. The tasks that dialogue systems are trying to solve
are becoming increasingly complex, requiring scalability to multi domain,
semantically rich dialogues. However, most current approaches have difficulty
scaling up with domains because of the dependency of the model parameters on
the dialogue ontology. In this paper, a novel approach is introduced that fully
utilizes semantic similarity between dialogue utterances and the ontology
terms, allowing the information to be shared across domains. The evaluation is
performed on a recently collected multi-domain dialogues dataset, one order of
magnitude larger than currently available corpora. Our model demonstrates great
capability in handling multi-domain dialogues, simultaneously outperforming
existing state-of-the-art models in single-domain dialogue tracking tasks.
","[{""version"":""v1"",""created"":""Tue, 17 Jul 2018 16:00:35 GMT""}]","2018-07-18"
"1807.06518","Charles Lorenzini","Charles Lorenzini, Lu\'is Fernando Alves Pereira, Alexandre Sanfelice
  Bazanella","A Generalized Forced Oscillation Method for tuning Proportional Resonant
  Controllers","12 pages, 12 figures, 15 tables, Preprint submitted to IEEE
  Transactions on Control Systems Technology",,,,"eess.SP","http://arxiv.org/licenses/nonexclusive-distrib/1.0/","  This paper proposes a tuning methodology for proportional resonant (PR)
controllers by using the design philosophy of the Ziegler-Nichols forced
oscillation method. Unlike such related methods that are usual for PID design,
and those that have been recently proposed for PR controllers, the method in
this paper is not restricted to plants whose Nyquist diagram crosses the
negative real axis. It involves a feedback experiment with a relay of
adjustable phase, which allows the identification of the most appropriate point
of the frequency response for each class of plants. The validation of the
proposed method, which includes the identification experiment and specific
tuning formulas that provide appropriate stability margins for each class of
plants, is performed by means of numerical examples in a large variety of
plants, showing its wide applicability.
","[{""version"":""v1"",""created"":""Tue, 17 Jul 2018 16:01:11 GMT""}]","2018-07-18"
"1807.06519","Jin-Hee Cho Dr.","Jin-Hee Cho and Sibel Adal{\i}","Is Uncertainty Always Bad?: Effect of Topic Competence on Uncertain
  Opinions",,"IEEE ICC 2018",,,"cs.SI","http://arxiv.org/licenses/nonexclusive-distrib/1.0/","  The proliferation of information disseminated by public/social media has made
decision-making highly challenging due to the wide availability of noisy,
uncertain, or unverified information. Although the issue of uncertainty in
information has been studied for several decades, little work has investigated
how noisy (or uncertain) or valuable (or credible) information can be
formulated into people's opinions, modeling uncertainty both in the quantity
and quality of evidence leading to a specific opinion. In this work, we model
and analyze an opinion and information model by using Subjective Logic where
the initial set of evidence is mixed with different types of evidence (i.e.,
pro vs. con or noisy vs. valuable) which is incorporated into the opinions of
original propagators, who propagate information over a network. With the help
of an extensive simulation study, we examine how the different ratios of
information types or agents' prior belief or topic competence affect the
overall information diffusion. Based on our findings, agents' high uncertainty
is not necessarily always bad in making a right decision as long as they are
competent enough not to be at least biased towards false information (e.g.,
neutral between two extremes).
","[{""version"":""v1"",""created"":""Tue, 17 Jul 2018 16:03:02 GMT""}]","2018-07-18"
"1807.06520","Bassam Shehadeh","Bassam Shehadeh and James P. Vary","Statistical Properties of 56-57Fe with Multi-Shell Degrees of Freedom","26 pages and 10 figures",,,,"nucl-th","http://creativecommons.org/licenses/by/4.0/","  We investigate the statistical properties of 56-57Fe within a model capable
of treating all the nucleons as active in an infinite model space including
pairing effects. Working within the canonical ensemble, our model is built on
single-particle states, thus it includes shell and subshell closures. We
include spin correlation parameters to account for nucleon spin multiplicities.
Pairing and shell effects are important in the low-temperature region where the
quantum effects dominate. The validity of the model is extended to higher
temperatures, approaching the classical regime, by including continuum states.
We present results for excitation energy, heat capacity and level density of
56-57Fe. The resulting favorable comparisons with experimental data and with
other approaches, where applicable, indicate that the methods we develop are
useful for statistical properties of medium to heavy nuclei.
","[{""version"":""v1"",""created"":""Tue, 17 Jul 2018 16:03:44 GMT""}]","2018-07-18"
"1807.06521","Jongchan Park","Sanghyun Woo, Jongchan Park, Joon-Young Lee, and In So Kweon","CBAM: Convolutional Block Attention Module","Accepted to ECCV 2018",,,,"cs.CV","http://arxiv.org/licenses/nonexclusive-distrib/1.0/","  We propose Convolutional Block Attention Module (CBAM), a simple yet
effective attention module for feed-forward convolutional neural networks.
Given an intermediate feature map, our module sequentially infers attention
maps along two separate dimensions, channel and spatial, then the attention
maps are multiplied to the input feature map for adaptive feature refinement.
Because CBAM is a lightweight and general module, it can be integrated into any
CNN architectures seamlessly with negligible overheads and is end-to-end
trainable along with base CNNs. We validate our CBAM through extensive
experiments on ImageNet-1K, MS~COCO detection, and VOC~2007 detection datasets.
Our experiments show consistent improvements in classification and detection
performances with various models, demonstrating the wide applicability of CBAM.
The code and models will be publicly available.
","[{""version"":""v1"",""created"":""Tue, 17 Jul 2018 16:05:59 GMT""},{""version"":""v2"",""created"":""Wed, 18 Jul 2018 11:20:08 GMT""}]","2018-07-19"
"1807.06522","The CMS Collaboration","CMS Collaboration","Search for dark matter particles produced in association with a top
  quark pair at $\sqrt{s} =$ 13 TeV","Replaced with the published version. Added the journal reference and
  the DOI. All the figures and tables can be found at
  http://cms-results.web.cern.ch/cms-results/public-results/publications/EXO-16-049
  (CMS Public Pages)","Phys. Rev. Lett. 122, 011803 (2019)","10.1103/PhysRevLett.122.011803","CMS-EXO-16-049, CERN-EP-2018-183","hep-ex","http://creativecommons.org/licenses/by/4.0/","  A search is performed for dark matter particles produced in association with
a top quark pair in proton-proton collisions at $\sqrt{s} =$ 13 TeV. The data
correspond to an integrated luminosity of 35.9 fb$^{-1}$ recorded by the CMS
detector at the LHC. No significant excess over the standard model expectation
is observed. The results are interpreted using simplified models of dark matter
production via spin-0 mediators that couple to dark matter particles and to
standard model quarks, providing constraints on the coupling strength between
the mediator and the quarks. These are the most stringent collider limits to
date for scalar mediators, and the most stringent for pseudoscalar mediators at
low masses.
","[{""version"":""v1"",""created"":""Tue, 17 Jul 2018 16:06:40 GMT""},{""version"":""v2"",""created"":""Wed, 18 Jul 2018 11:25:34 GMT""},{""version"":""v3"",""created"":""Mon, 14 Jan 2019 20:44:30 GMT""}]","2019-01-16"
"1807.06523","Daniel Maximilian Reich","Marec W. Heger, Christiane P. Koch, Daniel M. Reich","Optimized Sampling of Mixed-State Observables",,"Phys. Rev. E 100, 052105 (2019)","10.1103/PhysRevE.100.052105",,"quant-ph cond-mat.stat-mech","http://arxiv.org/licenses/nonexclusive-distrib/1.0/","  Quantum dynamical simulations of statistical ensembles pose a significant
computational challenge due to the fact that mixed states need to be
represented. If the underlying dynamics is fully unitary, for example in
ultrafast coherent control at finite temperatures, one approach to approximate
time-dependent observables is to sample the density operator by solving the
Schr\""{o}dinger equation for a set of wave functions with randomized phases. We
show that, on average, random-phase wave functions perform well for ensembles
with high mixedness, whereas at higher purities a deterministic sampling of the
energetically lowest-lying eigenstates becomes superior. We prove that
minimization of the worst-case error for computing arbitrary observables is
uniquely attained by eigenstate-based sampling. We show that this error can be
used to form a qualitative estimate of the set of ensemble purities for which
the sampling performance of the eigenstate-based approach is superior to
random-phase wave functions. Furthermore we present refinements to both schemes
which remove redundant information from the sampling procedure to accelerate
their convergence. Finally, we point out how the structure of low-rank
observables can be exploited to further improve eigenstate-based sampling
schemes.
","[{""version"":""v1"",""created"":""Tue, 17 Jul 2018 16:08:35 GMT""},{""version"":""v2"",""created"":""Wed, 6 Nov 2019 16:14:17 GMT""}]","2019-11-07"
"1807.06524","Chung Wen Kao","Chung-Wen Kao, Dong-Jing Yang, Wen-Chen Chang","Charged Kaon multiplicities of Semi-inclusive DIS off the deuteron
  target","Contributed talk at the XXVI International Workshop on Deep Inelastic
  Scattering and Related Subjects at Kobe university, Kobe, Japan from April 16
  to April 20, 2018",,,"CYCU-HEP-18-05","hep-ph hep-ex nucl-ex nucl-th","http://arxiv.org/licenses/nonexclusive-distrib/1.0/","  We investigate the results of the charged kaon multiplicities off the
deuteron target from HERMES and COMPASS experiments. The discrepancy of the two
data sets cannot be explained by different $Q^2$ values. Furthermore we examine
the empirical parametrization of the fragmentation functions, DSS2017, and find
that the agreement between the theoretical predictions and the HERMES data is
less satisfactory as claimed.
","[{""version"":""v1"",""created"":""Tue, 17 Jul 2018 16:09:32 GMT""}]","2018-07-18"
"1807.06526","Kuniyasu Saitoh","Kuniyasu Saitoh and Brian P. Tighe","Non-local effects in inhomogeneous flows of soft athermal disks","5 pages, 4 figures","Phys. Rev. Lett. 122, 188001 (2019)","10.1103/PhysRevLett.122.188001",,"cond-mat.soft","http://arxiv.org/licenses/nonexclusive-distrib/1.0/","  We numerically investigate non-local effects on inhomogeneous flows of soft
athermal disks close to but below their jamming transition. We employ molecular
dynamics to simulate Kolmogorov flows, in which a sinusoidal flow profile with
fixed wave number is externally imposed, resulting in a spatially inhomogeneous
shear rate. We find that the resulting rheology is strongly wave
number-dependent, and that particle migration, while present, is not sufficient
to describe the resulting stress profiles within a conventional local model. We
show that, instead, stress profiles can be captured with non-local constitutive
relations that account for gradients to fourth order. Unlike nonlocal flow in
yield stress fluids, we find no evidence of a diverging length scale.
","[{""version"":""v1"",""created"":""Tue, 17 Jul 2018 16:11:25 GMT""}]","2019-05-15"
"1807.06527","Daniil Dmitriev","Daniil Dmitriev, Maksim Zhukovskii","On monotonicity of Ramanujan function for binomial random variables",,,,,"math.CO","http://arxiv.org/licenses/nonexclusive-distrib/1.0/","  For a binomial random variable $\xi$ with parameters $n$ and $b/n$, it is
well known that the median equals $b$ when $b$ is an integer. In 1968, Jogdeo
and Samuels studied the behaviour of the relative difference between ${\sf
P}(\xi=b)$ and $1/2-{\sf P}(\xi<b)$. They proved its monotonicity in $n$ and
posed a question about its monotonicity in $b$. This question is motivated by
the solved problem proposed by Ramanujan in 1911 on the monotonicity of the
same quantity but for a Poisson random variable with an integer parameter $b$.
In the paper, we answer this question and introduce a simple way to analyse the
monotonicity of similar functions.
","[{""version"":""v1"",""created"":""Tue, 17 Jul 2018 16:16:51 GMT""},{""version"":""v2"",""created"":""Wed, 25 Jul 2018 19:41:28 GMT""},{""version"":""v3"",""created"":""Sat, 20 Oct 2018 15:31:32 GMT""},{""version"":""v4"",""created"":""Wed, 4 Mar 2020 15:12:21 GMT""},{""version"":""v5"",""created"":""Tue, 5 May 2020 17:35:43 GMT""},{""version"":""v6"",""created"":""Thu, 12 Nov 2020 01:18:05 GMT""},{""version"":""v7"",""created"":""Thu, 8 Apr 2021 13:31:50 GMT""}]","2021-04-09"
"1807.06528","Giovanni Barbarino","Giovanni Barbarino","Notes on asymptotic eigenvalues distribution on complex circles",,,,,"math.FA math.AG math.NA","http://arxiv.org/licenses/nonexclusive-distrib/1.0/","  With tools of measure theory and symbols of matrix sequences, we explore the
results regarding curves on finite fields and Weil Systems. This document wants
to draw a bridge between the two areas and link the concepts of distribution of
Frobenius roots in the context of Zeta functions on curves, with the spectral
distributions already studied in linear algebra.
","[{""version"":""v1"",""created"":""Tue, 17 Jul 2018 16:18:25 GMT""},{""version"":""v2"",""created"":""Wed, 18 Jul 2018 16:03:55 GMT""}]","2018-07-19"
"1807.06529","Rohit Voothaluru PhD","Rohit Voothaluru, Vikram Bedekar, Dunji Yu, Qingge Xie, Ke An, R Scott
  Hyde","Investigating the difference in mechanical stability of retained
  austenite in bainitic and martensitic high-carbon bearing steels using in
  situ neutron diffraction and crystal plasticity modeling","23 pages, Author's Copy Pre-Print",,,,"cond-mat.mtrl-sci math.NA physics.app-ph","http://arxiv.org/licenses/nonexclusive-distrib/1.0/","  In situ neutron diffraction of the uniaxial tension test was used to study
the effect of the surrounding matrix microstructure on the mechanical stability
of retained austenite in high-carbon bearing steels. Comparing the samples with
bainitic microstructures to those with martensitic ones it was found that the
retained austenite in a bainitic matrix starts transforming into martensite at
a lower strain compared to that within a martensitic matrix. On the other hand,
the rate of transformation of the austenite was found to be higher within a
martensitic microstructure. Crystal plasticity modeling was used to analyze the
transformation phenomenon in these two microstructures and determine the effect
of surrounding microstructure on elastic, plastic and transformation components
of the strain. The results showed that the predominant difference in the
deformation accumulated was from the transformation strain and the critical
transformation driving force within the two microstructures. The retained
austenite was more stable for identical loading conditions in case of
martensitic matrix compared to the bainitic one. It was also observed that the
initial volume fraction of retained austenite within the bainitic matrix would
alter the onset of transformation to martensite but not the rate of
transformation.
","[{""version"":""v1"",""created"":""Tue, 17 Jul 2018 16:22:08 GMT""}]","2018-07-18"
"1807.06530","Salaheddin Alakkari","Salaheddin Alakkari, John Dingliana","An Acceleration Scheme for Memory Limited, Streaming PCA","11 pages, 4 figures",,,,"stat.ML cs.CV cs.LG","http://arxiv.org/licenses/nonexclusive-distrib/1.0/","  In this paper, we propose an acceleration scheme for online memory-limited
PCA methods. Our scheme converges to the first $k>1$ eigenvectors in a single
data pass. We provide empirical convergence results of our scheme based on the
spiked covariance model. Our scheme does not require any predefined parameters
such as the eigengap and hence is well facilitated for streaming data
scenarios. Furthermore, we apply our scheme to challenging time-varying systems
where online PCA methods fail to converge. Specifically, we discuss a family of
time-varying systems that are based on Molecular Dynamics simulations where
batch PCA converges to the actual analytic solution of such systems.
","[{""version"":""v1"",""created"":""Tue, 17 Jul 2018 16:25:01 GMT""}]","2018-07-18"
"1807.06532","George Moschelli","George Moschelli and Sean Gavin","Measuring the Rate of Isotropization of Quark-Gluon Plasma Using
  Rapidity Correlations","Proceedings of The 27th International Conference on Ultrarelativistic
  Nucleus-Nucleus Collisions, Venezia, Italy 13-19 May 2018",,"10.1016/j.nuclphysa.2018.11.018",,"nucl-th","http://arxiv.org/licenses/nonexclusive-distrib/1.0/","  We propose that rapidity dependent momentum correlations can be used to
extract the shear relaxation time $\tau_\pi$ of the medium formed in high
energy nuclear collisions. The stress-energy tensor in an equilibrium
quark-gluon plasma is isotropic, but in nuclear collisions it is likely very
far from this state. The relaxation time $\tau_\pi$ characterizes the rate of
isotropization and is a transport coefficient as fundamental as the shear
viscosity. We show that fluctuations emerging from the initial anisotropy
survive to freeze-out, in excess of thermal fluctuations, influencing rapidity
correlation patterns. We show that these correlations can be used to extract
$\tau_\pi$. We describe a method for calculating the rapidity dependence of
two-particle momentum correlations with a second order, causal, diffusion
equation that includes Langevin noise as a source of thermal fluctuations. The
causality requirement introduces the relaxation time and we link the shape of
the rapidity correlation pattern to its presence. Here we examine how different
equations of state and temperature dependent transport coefficients in the
presence of realistic hydrodynamic flow influence the estimate of $\tau_\pi$.
In comparison to RHIC data, we find that the ratio $\tau_\pi/\nu \approx 5-6$
where $\nu=\eta/sT$ is the kinematic viscosity.
","[{""version"":""v1"",""created"":""Tue, 17 Jul 2018 16:28:52 GMT""}]","2019-02-20"
"1807.06533","Charis Anastopoulos","Charis Anastopoulos and Ntina Savvidou","Time of arrival and localization of relativistic particles","30 pages.Minor changes, to appear in JMP",,"10.1063/1.5080930",,"quant-ph gr-qc math-ph math.MP","http://arxiv.org/licenses/nonexclusive-distrib/1.0/","  Constructing observables that describe the localization of relativistic
particles is an important foundational problem in relativistic quantum field
theory (QFT). The description of localization in terms of single-time
observables leads to conflict with the requirement of causality. In this paper,
we describe particle localization in terms of time-of-arrival observables,
defined in terms of the interaction between a quantum field and a measuring
apparatus. The resulting probabilities are linear functionals of QFT
correlation functions. Specializing to the case of a scalar field, we identify
several time-of-arrival observables differing on the way that the apparatus
localizes particle-detection records. Maximum localization is obtained for a
unique observable that is related to the Newton-Wigner position operator.
Finally, we define a measure of localizability for relativistic particles in
terms of a novel time-energy uncertainty relation for the variance of the time
of arrival.
","[{""version"":""v1"",""created"":""Tue, 17 Jul 2018 16:29:15 GMT""},{""version"":""v2"",""created"":""Tue, 19 Mar 2019 21:02:20 GMT""}]","2019-05-01"
"1807.06535","R\'emi Cresson","R\'emi Cresson","A framework for remote sensing images processing using deep learning
  technique",,,"10.1109/LGRS.2018.2867949",,"cs.CV","http://creativecommons.org/publicdomain/zero/1.0/","  Deep learning techniques are becoming increasingly important to solve a
number of image processing tasks. Among common algorithms, Convolutional Neural
Networks and Recurrent Neural Networks based systems achieve state of the art
results on satellite and aerial imagery in many applications. While these
approaches are subject to scientific interest, there is currently no
operational and generic implementation available at user-level for the remote
sensing community. In this paper, we presents a framework enabling the use of
deep learning techniques with remote sensing images and geospatial data. Our
solution takes roots in two extensively used open-source libraries, the remote
sensing image processing library Orfeo ToolBox, and the high performance
numerical computation library TensorFlow. It can apply deep nets without
restriction on images size and is computationally efficient, regardless
hardware configuration.
","[{""version"":""v1"",""created"":""Tue, 17 Jul 2018 16:32:08 GMT""},{""version"":""v2"",""created"":""Wed, 5 Sep 2018 11:13:47 GMT""}]","2018-09-06"
"1807.06536","Guo-Zhu Liu","Zhao-Kun Yang, Jing-Rong Wang, Guo-Zhu Liu","Effects of the Dirac cone tilt in two-dimensional Dirac semimetal","22 pages, 9 figures, 2 tables","Phys. Rev. B 98, 195123 (2018)","10.1103/PhysRevB.98.195123",,"cond-mat.str-el cond-mat.dis-nn cond-mat.mtrl-sci","http://arxiv.org/licenses/nonexclusive-distrib/1.0/","  Two-dimensional Dirac semimetal with tilted Dirac cone has recently attracted
increasing interest. Tilt of Dirac cone can be realized in a number of
materials, including deformed graphene, surface state of topological
crystalline insulator, and certain organic compound. We study how Dirac cone
tilting affects the low-energy properties by presenting a renormalization group
analysis of the Coulomb interaction and quenched disorder. Random scalar
potential or random vector potential along the tilting direction cannot exist
on its own as it always dynamically generates a new type of disorder, which
dominates at low energies and turns the system into a compressible diffusive
metal. Consequently, the fermions acquire a finite disorder scattering rate.
Moreover, the isolated band-touching point is replaced by a bulk Fermi arc in
the Brillouin zone. These results are not qualitatively changed when the
Coulomb interaction is incorporated. In comparison, random mass and random
vector potential along the non-tilting direction can exist individually,
without generating other types of disorder. They both suppress tilt at low
energies, and do not produce bulk Fermi arc. Upon taking the Coulomb
interaction into account, the system enters into a stable quantum critical
state, in which the fermion field acquires a finite anomalous dimension but the
dynamical exponent $z=1$. These results indicate that Dirac cone tilt does lead
to some qualitatively different low-energy properties comparing to the untilted
system.
","[{""version"":""v1"",""created"":""Tue, 17 Jul 2018 16:32:11 GMT""},{""version"":""v2"",""created"":""Tue, 20 Nov 2018 07:34:41 GMT""}]","2018-11-21"
