"1812.07307","Sarp Akcay","Sarp Akcay, Morgan Fraser, Antonio Martin-Carrillo","A crystal ball for kilonovae","5 pages, 2 figures",,,,"astro-ph.HE","http://arxiv.org/licenses/nonexclusive-distrib/1.0/","  The discovery of gravitational waves from merging compact objects has opened
up a new window to the Universe. Planned third-generation gravitational-wave
detectors such as Einstein Telescope will potentially deliver hundreds of such
events at redshifts below $z\sim0.1$. Finding electromagnetic counterparts to
these events will be a major observational challenge. We demonstrate how
Einstein Telescope will provide advance warning of such events on a timescale
of hours, based on the low frequency emission from the pre-merger system. In
addition, we suggest how this early warning enables prompt identification of
any electromagnetic counterpart using the Large Synoptic Survey Telescope.
","[{""version"":""v1"",""created"":""Tue, 18 Dec 2018 11:34:00 GMT""}]","2018-12-19"
"1812.07308","Liang-You Peng","Hao Liang, Mu-Xue Wang, Xiang-Ru Xiao, Qihuang Gong, Liang-You Peng","Photon-momentum transfer in diatomic molecules: an ab initio study","7 pages, 4 fiugres","Liang, H., Wang, M.-X., Xiao, X.-R., Gong, Q. & Peng, L.-Y.
  Photon-momentum transfer in diatomic molecules: An ab initio study. Phys.
  Rev. A 98, 063413 (2018)","10.1103/PhysRevA.98.063413",,"physics.atom-ph","http://arxiv.org/licenses/nonexclusive-distrib/1.0/","  For a molecule, the two-center interference and the molecular scattering
phase of the electron are important for almost all the processes that may occur
in a laser field. In this study, we investigate their effects in the transfer
of linear photon momentum to the ionized electron by absorbing a single photon.
The time-dependent Schr\""odinger equation of H$_2^+$ is numerically solved in
{the multipolar} gauge in which the electric quadrupole term and the magnetic
dipole term are explicitly expressed. This allows us to separate the
contributions of the two terms in the momentum transfer. For different
configurations of the molecular and the laser orientation, the transferred
momentum to the electron is evaluated at different internuclear distances with
various photon energies { and two-center interferences are identified in the
whole region. At small electron energies and small internuclear distances, we
find significant deviations from the prediction of the classical double-slit
model due to the strong mediation of the Coulomb potential.} Finally, even for
a large internuclear distance, our results show that a varying molecular
scattering phase is important at all electron energies, which is beyond the
simple prediction of the linear combination of the atomical orbitals.
","[{""version"":""v1"",""created"":""Tue, 18 Dec 2018 11:35:15 GMT""}]","2018-12-19"
"1812.07309","Liang-You Peng","Chuncheng Wang, Xiaokai Li, Xiang-Ru Xiao, Yizhang Yang, Sizuo Luo,
  Xitao Yu, Xinpeng Xu, Liang-You Peng, Qihuang Gong and Dajun Ding","Accurate in situ Measurement of Ellipticity Based on Sub-cycle
  Ionization Dynamics","Phys. Rev. Lett., in press (2018), 4 figures",,"10.1103/PhysRevLett.122.013203",,"physics.atom-ph","http://arxiv.org/licenses/nonexclusive-distrib/1.0/","  Elliptically polarized laser pulses (EPLPs) are widely applied in many fields
of ultrafast sciences, but the ellipticity~($\varepsilon$) has never been in
situ measured in the interaction zone of the laser focus. In this work, we
propose and realize a robust scheme to retrieve the $\varepsilon$ by temporally
overlapping two identical counter-rotating EPLPs. The combined linearly
electric field is coherently controlled to ionize Xe atoms by varying the phase
delay between the two EPLPs. The electron spectra of the above-threshold
ionization and the ion yield are sensitively modulated by the phase delay. We
demonstrate that these modulations can be used to accurately determine
$\varepsilon$ of the EPLP. We show that the present method is highly reliable
and is applicable in a wide range of laser parameters. The accurate retrieval
of $\varepsilon$ offers a better characterization of a laser pulse, promising a
more delicate and quantitative control of the sub-cycle dynamics in many strong
field processes.
","[{""version"":""v1"",""created"":""Tue, 18 Dec 2018 11:39:27 GMT""}]","2019-01-30"
"1812.07310","Pratyush Pranav","Pratyush Pranav, Rien van de Weygaert, Gert Vegter, Bernard J.T.
  Jones, Robert J. Adler, Job Feldbrugge, Changbom Park, Thomas Buchert,
  Michael Kerber","Topology and Geometry of Gaussian random fields I: on Betti Numbers,
  Euler characteristic and Minkowski functionals","44 pages, 27 Figures, 2 Tables, accepted for publication in MNRAS in
  the original version. This version updates references and fixes typos","MNRAS, Volume 485, 3, 4167-4208 (2019)","10.1093/mnras/stz541",,"astro-ph.CO astro-ph.IM math.AT","http://arxiv.org/licenses/nonexclusive-distrib/1.0/","  This study presents a numerical analysis of the topology of a set of
cosmologically interesting three-dimensional Gaussian random fields in terms of
their Betti numbers $\beta_0$, $\beta_1$ and $\beta_2$. We show that Betti
numbers entail a considerably richer characterization of the topology of the
primordial density field. Of particular interest is that Betti numbers specify
which topological features - islands, cavities or tunnels - define its spatial
structure.
  A principal characteristic of Gaussian fields is that the three Betti numbers
dominate the topology at different density ranges. At extreme density levels,
the topology is dominated by a single class of features. At low levels this is
a \emph{Swiss-cheeselike} topology, dominated by isolated cavities, at high
levels a predominantly \emph{Meatball-like} topology of isolated objects. At
moderate density levels, two Betti number define a more \emph{Sponge-like}
topology. At mean density, the topology even needs three Betti numbers,
quantifying a field consisting of several disconnected complexes, not of one
connected and percolating overdensity.
  A {\it second} important aspect of Betti number statistics is that they are
sensitive to the power spectrum. It reveals a monotonic trend in which at a
moderate density range a lower spectral index corresponds to a considerably
higher (relative) population of cavities and islands.
  We also assess the level of complementary information that Betti numbers
represent, in addition to conventional measures such as Minkowski functionals.
To this end, we include an extensive description of the Gaussian Kinematic
Formula (GKF), which represents a major theoretical underpinning for this
discussion.
","[{""version"":""v1"",""created"":""Tue, 18 Dec 2018 11:41:03 GMT""},{""version"":""v2"",""created"":""Wed, 27 Feb 2019 16:57:51 GMT""}]","2019-06-25"
"1812.07311","Reinaldo Garc\'ia","Reinaldo Garc\'ia-Garc\'ia","Heat leakage in equilibrium processes","4 pages, 1 figure",,,,"cond-mat.stat-mech","http://arxiv.org/licenses/nonexclusive-distrib/1.0/","  The difference between the zero-mass limit of the heat exchanged with a
thermal reservoir, and its value as determined from overdamped dynamics, is
termed `heat leakage' or `hidden heat' in the Smoluchowski limit. If present,
heat leakages are the sign of the unsuitability of the overdamped approximation
for addressing thermodynamics. It is accepted that no hidden heat arises in an
isothermal process driven by conservative forces. Here, we challenge that
conclusion. The heat exchanged with a reservoir in any isothermal and
quasistatic process connecting two equilibrium states, indeed exhibits hidden
contributions. Our results imply that the overdamped dynamics misrepresents
thermodynamics quite generally. Surprisingly, the hidden heat is described by
an universal distribution in slow processes, easing the correction of the heat
statistics in that context.
","[{""version"":""v1"",""created"":""Tue, 18 Dec 2018 11:46:35 GMT""}]","2018-12-19"
"1812.07312","Sofia Ceppi Dr","Sofia Ceppi, Ian Kash, Rafael Frongillo","Partial Verification as a Substitute for Money","Extended Version of 'Partial Verification as a Substitute for Money',
  AAAI 2019",,,,"cs.GT","http://arxiv.org/licenses/nonexclusive-distrib/1.0/","  Recent work shows that we can use partial verification instead of money to
implement truthful mechanisms. In this paper we develop tools to answer the
following question. Given an allocation rule that can be made truthful with
payments, what is the minimal verification needed to make it truthful without
them? Our techniques leverage the geometric relationship between the type space
and the set of possible allocations.
","[{""version"":""v1"",""created"":""Tue, 18 Dec 2018 11:47:31 GMT""},{""version"":""v2"",""created"":""Wed, 23 Jan 2019 09:51:20 GMT""}]","2019-01-24"
"1812.07313","Tomoaki Ishiyama","Tetsushi Kodama and Tomoaki Ishiyama","Acceleration of the tree method with SIMD instruction set","14 pages, 6 figures, accepted by PASJ. The code is publicly available
  at the official website of Phantom-GRAPE
  https://bitbucket.org/kohji/phantom-grape",,"10.1093/pasj/psy151",,"astro-ph.IM","http://arxiv.org/licenses/nonexclusive-distrib/1.0/","  We have developed a highly-tuned software library that accelerates the
calculation of quadrupole terms in the Barnes-Hut tree code by use of a SIMD
instruction set on the x86 architecture, Advanced Vector eXtensions 2 (AVX2).
Our code is implemented as an extension of Phantom-GRAPE software library
(Tanikawa et al. 2012, 2013) that significantly accelerates the calculation of
monopole terms. If the same accuracy is required, the calculation of quadrupole
terms can accelerate the evaluation of forces than that of only monopole terms
because we can approximate gravitational forces from closer particles by
quadrupole moments than by only monopole moments. Our implementation can
calculate gravitational forces about 1.1 times faster in any system than the
combination of the pseudoparticle multipole method and Phantom-GRAPE. Our
implementation allows simulating homogeneous systems up to 2.2 times faster
than that with only monopole terms, however, speed up for clustered systems is
not enough because the increase of approximated interactions is insufficient to
negate the increased calculation cost by computing quadrupole terms. We have
estimated that improvement in performance can be achieved by the use of a new
SIMD instruction set, AVX-512. Our code is expected to be able to accelerate
simulations of clustered systems up to 1.08 times faster on AVX-512 environment
than that with only monopole terms.
","[{""version"":""v1"",""created"":""Tue, 18 Dec 2018 11:48:47 GMT""},{""version"":""v2"",""created"":""Mon, 14 Jan 2019 07:24:46 GMT""}]","2019-02-13"
"1812.07314","Vagif Guliyev","Vagif S. Guliyev, Javanshir J. Hasanov, Xayyam A. Badalov","Commutators of Riesz potential in the vanishing generalized weighted
  Morrey spaces with variable exponent","23 pages",,,,"math.FA","http://arxiv.org/licenses/nonexclusive-distrib/1.0/","  Let $\Omega \subset \mathbb{R}^n$ be an unbounded open set. We consider the
generalized weighted Morrey spaces
$\mathcal{M}^{p(\cdot),\varphi}_{\omega}(\Omega)$ and the vanishing generalized
weighted Morrey spaces $V\mathcal{M}^{p(\cdot),\varphi}_{\omega}(\Omega)$ with
variable exponent $p(x)$ and a general function $\varphi(x,r)$ defining the
Morrey-type norm. The main result of this paper are the boundedness of Riesz
potential and its commutators on the spaces
$\mathcal{M}^{p(\cdot),\varphi}_{\omega}(\Omega)$ and
$V\mathcal{M}^{p(\cdot),\varphi}_{\omega}(\Omega)$. This result generalizes
several existing results for Riesz potential and its commutators on Morrey type
spaces. Especially, it gives a unified result for generalized Morrey spaces and
variable Morrey spaces which currently gained a lot of attentions from
researchers in theory of function spaces.
","[{""version"":""v1"",""created"":""Tue, 18 Dec 2018 11:52:52 GMT""}]","2018-12-19"
"1812.07315","Hai-Zhou Lu","Hai-Zhou Lu","Perspective: 3D quantum Hall effect","An extended version based on a Perspective published on National
  Science Review","National Science Review, nwy082 (2018)","10.1093/nsr/nwy082",,"cond-mat.mes-hall","http://arxiv.org/licenses/nonexclusive-distrib/1.0/","  The discovery of the quantum Hall effect in 2D systems opens the door to
topological phases of matter. A quantum Hall effect in 3D is a long-sought
phase of matter and has inspired many efforts and claims. In the perspective,
we review our proposal that guarantees a 3D quantum Hall effect. The proposal
employs the topologically-protected Fermi arcs and the ""wormhole"" tunneling via
the Weyl nodes in a 3D topological semimetal. The 1D edge states in this 3D
quantum Hall effect show an example of (d-2)-dimensional boundary states.
Possible signatures of the 3D quantum Hall effect have been observed in the
topological Dirac semimetals, but with many questions, which will attract more
works to verify the mechanism and realize the 3D quantum Hall in the future.
","[{""version"":""v1"",""created"":""Tue, 18 Dec 2018 11:53:55 GMT""}]","2018-12-19"
"1812.07316","Sunil Kumar Mishra","Abhijit P. Chaudhari, Rajeev Singh and Sunil K. Mishra","Analytical solutions of inhomogeneous transverse field Ising models","9 pages, 4 figures",,,,"quant-ph","http://arxiv.org/licenses/nonexclusive-distrib/1.0/","  The inhomogeneous transverse field Ising models mainly impurity based and the
joint chain are analysed analytically using Jordan-Wigner transformations. The
effects of inhomogeneities on the phase transition have been discussed in
detail. We constructed an ansatz to diagonalize the two models which are taken
into consideration. The inhomogeneity is quantified by a coupling parameter,
which can be tuned to control the occurrence of quantum phase transition in
these models. We have shown a systematic setup using which we can generalise
the solution to a system with an arbitrary number of impurity sites and
junctions, which are separated by at least two lattice sites. We have analysed
the quantum critical point by calculating the correlation functions, transverse
magnetization and the gap between the ground state and the first excited state.
","[{""version"":""v1"",""created"":""Tue, 18 Dec 2018 11:56:00 GMT""}]","2018-12-19"
"1812.07317","Sourav Bhattacharya","Sourav Bhattacharya, Shankhadeep Chakrabortty and Shivang Goyal","Emergent $\alpha$-like fermionic vacuum structure and entanglement in
  the hyperbolic de Sitter spacetime","v2, 18pp, 5 figs.; manuscript consised a bit, main results
  emphasised, improved presentation; accepted in EPJC",,"10.1140/epjc/s10052-019-7319-x",,"hep-th gr-qc quant-ph","http://arxiv.org/licenses/nonexclusive-distrib/1.0/","  We report a non-trivial feature of the vacuum structure of free massive or
massless Dirac fields in the hyperbolic de Sitter spacetime. Here we have two
causally disconnected regions, say $R$ and $L$ separated by another region,
$C$. We are interested in the field theory in $R\cup L$ to understand the long
range quantum correlations between $R$ and $L$. There are local modes of the
Dirac field having supports individually either in $R$ or $L$, as well as
global modes found via analytically continuing the $R$ modes to $L$ and vice
versa. However, we show that unlike the case of a scalar field, the analytic
continuation does not preserve the orthogonality of the resulting global modes.
Accordingly, we need to orthonormalise them following the Gram-Schmidt
prescription, prior to the field quantisation in order to preserve the
canonical anti-commutation relations. We observe that this prescription
naturally incorporates a spacetime independent continuous parameter,
$\theta_{\rm RL}$, into the picture. Thus interestingly, we obtain a naturally
emerging one-parameter family of $\alpha$-like de Sitter vacua. The values of
$\theta_{\rm RL}$ yielding the usual thermal spectra of massless created
particles are pointed out. Next, using these vacua, we investigate both
entanglement and R\'enyi entropies of either of the regions and demonstrate
their dependence on $\theta_{\rm RL}$.
","[{""version"":""v1"",""created"":""Tue, 18 Dec 2018 11:59:33 GMT""},{""version"":""v2"",""created"":""Wed, 25 Sep 2019 08:00:19 GMT""}]","2019-10-23"
"1812.07318","Vladim\'ir Hol\'y","Francisco Blasques, Vladim\'ir Hol\'y and Petra Tomanov\'a","Zero-Inflated Autoregressive Conditional Duration Model for Discrete
  Trade Durations with Excessive Zeros",,,,,"q-fin.ST stat.ME","http://arxiv.org/licenses/nonexclusive-distrib/1.0/","  In finance, durations between successive transactions are usually modeled by
the autoregressive conditional duration model based on a continuous
distribution omitting zero values. Zero or close-to-zero durations can be
caused by either split transactions or independent transactions. We propose a
discrete model allowing for excessive zero values based on the zero-inflated
negative binomial distribution with score dynamics. This model allows to
distinguish between the processes generating split and standard transactions.
We use the existing theory on score models to establish the invertibility of
the score filter and verify that sufficient conditions hold for the consistency
and asymptotic normality of the maximum likelihood of the model parameters. In
an empirical study, we find that split transactions cause between 92 and 98
percent of zero and close-to-zero values. Furthermore, the loss of decimal
places in the proposed approach is less severe than the incorrect treatment of
zero values in continuous models.
","[{""version"":""v1"",""created"":""Tue, 18 Dec 2018 12:04:49 GMT""},{""version"":""v2"",""created"":""Mon, 6 Apr 2020 17:41:57 GMT""},{""version"":""v3"",""created"":""Sun, 30 Jan 2022 00:20:13 GMT""}]","2022-02-01"
"1812.07319","Johannes Hendriks","J.N. Hendriks, C. Jidling, A. Wills and T.B. Sch\""on","Evaluating the squared-exponential covariance function in Gaussian
  processes with integral observations",,,,,"stat.ML cs.LG","http://arxiv.org/licenses/nonexclusive-distrib/1.0/","  This paper deals with the evaluation of double line integrals of the squared
exponential covariance function. We propose a new approach in which the double
integral is reduced to a single integral using the error function. This single
integral is then computed with efficiently implemented numerical techniques.
The performance is compared against existing state of the art methods and the
results show superior properties in numerical robustness and accuracy per
computation time.
","[{""version"":""v1"",""created"":""Tue, 18 Dec 2018 12:04:56 GMT""}]","2018-12-19"
"1812.07320","Kadriye Aydemir","O. Sh. Mukhtarova, K. Aydemir and S. Y. Yakubov","Asymptotics of the eigenvalues and Abel basis property of the root
  functions of new type Sturm-Liouville problems",,,,,"math.CA math.FA","http://arxiv.org/licenses/nonexclusive-distrib/1.0/","  This work investigates spectrum and root functions (that is, eigen- and
associated functions) of a Sturm-Liouville problem involving an abstract linear
operator (nonselfadjoint in general) in the equation together with
supplementary transmission conditions at the one interior singular point. So,
the problem under consideration is not pure differential pro lem. At first we
establish isomorphism and coerciveness with respect to the spectral parameter
for the corresponding nonhomogeneous problem. Then by suggesting an own our
method we prove that the spectrum of the considered problem is discrete and
derive an asymptotic approximation formulas for the eigenvalues. We must note
that Asymptotics of the eigenvalues of such type problems is investigated at
first in literature in the present work and the obtained results are new even
in the continuous case (i.e. without transmission conditions). Finally it is
shown that the system of root functions form an Abel basis of the corresponding
Hilbert space.
","[{""version"":""v1"",""created"":""Tue, 18 Dec 2018 12:08:11 GMT""}]","2018-12-19"
"1812.07321","Guodong Shi","Guodong Shi and Shuanhong Wang","Q-graded Hopf quasigroups","$Q$-graded Hopf quasigroups; $Q$-graded Hopf quasimodules; Smash
  products",,,,"math.RA math.GR","http://arxiv.org/licenses/nonexclusive-distrib/1.0/","  Firstly, we introduce a class of new algebraic systems which generalize Hopf
quasigroups and Hopf $\pi-$algebras called $Q$-graded Hopf quasigroups, and
research some properties of them. Secondly, we define the representations of
$Q$-graded Hopf quasigroups, i.e $Q$-graded Hopf quasimodules, research the
construction method and fundamental theorem of them. Thirdly, we research the
smash products of $Q$-graded Hopf quasigroups.
","[{""version"":""v1"",""created"":""Tue, 18 Dec 2018 12:08:18 GMT""},{""version"":""v2"",""created"":""Tue, 19 Mar 2019 13:42:32 GMT""}]","2019-03-20"
"1812.07322","Jacek Jendrej","Gong Chen and Jacek Jendrej","Lyapunov-type characterisation of exponential dichotomies with
  applications to the heat and Klein-Gordon equations","31 pages. This version fixes a problem with the numbering of the
  equations",,,,"math.AP math.DS","http://arxiv.org/licenses/nonexclusive-distrib/1.0/","  We give a sufficient condition for existence of an exponential dichotomy for
a general linear dynamical system (not necessarily invertible) in a Banach
space, in discrete or continuous time. We provide applications to the backward
heat equation with a potential varying in time and to the heat equation with a
finite number of slowly moving potentials. We also consider the Klein-Gordon
equation with a finite number of potentials whose centres move at sub-light
speed with small accelerations.
","[{""version"":""v1"",""created"":""Tue, 18 Dec 2018 12:12:29 GMT""},{""version"":""v2"",""created"":""Sat, 29 Dec 2018 14:38:03 GMT""}]","2019-01-01"
"1812.07323","Zhi-Hui Guo","Rui Gao, Zhi-Hui Guo, Xian-Wei Kang, J.A.Oller","Effective-range-expansion study of near threshold heavy-flavor
  resonances","10 pages. Comparisons with other ways to define the compositeness are
  included. To match the published version","Adv.High Energy Phys. 2019 (2019) 4651908",,,"hep-ph","http://arxiv.org/licenses/nonexclusive-distrib/1.0/","  In this work we study the resonances near the thresholds of the open
heavy-flavor hadrons using the effective-range-expansion method. The unitarity,
analyticity and compositeness coefficient are also taken into account in our
theoretical formalism. We consider the $Z_c(3900)$, $X(4020)$,
$\chi_{c1}(4140)$, $\psi(4260)$ and $\psi(4660)$. The scattering lengths and
effective ranges from the relevant elastic $S$-wave scattering amplitudes are
determined. Tentative discussions on the inner structures of the aforementioned
resonances are given.
","[{""version"":""v1"",""created"":""Tue, 18 Dec 2018 12:14:45 GMT""},{""version"":""v2"",""created"":""Wed, 3 Jul 2019 08:21:28 GMT""}]","2019-07-04"
"1812.07324","Mihai P\^irvu","Mihai Cristian P\^irvu, Alexandra Anghel, Ciprian Borodescu, Alexandru
  Constantin","Predicting user intent from search queries using both CNNs and RNNs","14 pages",,,,"cs.CL","http://arxiv.org/licenses/nonexclusive-distrib/1.0/","  Predicting user behaviour on a website is a difficult task, which requires
the integration of multiple sources of information, such as geo-location, user
profile or web surfing history. In this paper we tackle the problem of
predicting the user intent, based on the queries that were used to access a
certain webpage. We make no additional assumptions, such as domain detection,
device used or location, and only use the word information embedded in the
given query. In order to build competitive classifiers, we label a small
fraction of the EDI query intent prediction dataset
\cite{edi-challenge-dataset}, which is used as ground truth. Then, using
various rule-based approaches, we automatically label the rest of the dataset,
train the classifiers and evaluate the quality of the automatic labeling on the
ground truth dataset. We used both recurrent and convolutional networks as the
models, while representing the words in the query with multiple embedding
methods.
","[{""version"":""v1"",""created"":""Tue, 18 Dec 2018 12:15:33 GMT""}]","2018-12-19"
"1812.07325","Jaromir Tosiek Dr.","Maciej Przanowski, Jaromir Tosiek, Francisco J. Turrubiates","The Weyl-Wigner-Moyal formalism on a discrete phase space. I. A Wigner
  function for a nonrelativistic particle with spin","34 pages. New references have been added. Some comments have been
  included. The title has been modified",,"10.1002/prop.201900080",,"quant-ph","http://arxiv.org/licenses/nonexclusive-distrib/1.0/","  The Weyl-Wigner-Moyal formalism for quantum particle with discrete internal
degrees of freedom is developed. A one to one correspondence between operators
in the Hilbert space $L^{2}(\mathbb{R}^{3})\otimes{\mathcal{H}}^{(s+1)}$ and
functions on the phase space $\mathbb{R}^{3}\times\mathbb{R}^{3}\times
\{0,...,s\} \times\{0,...,s\}$ is found. The expressions for the
Stratonovich-Weyl quantizer, star product and Wigner functions of such systems
for arbitrary values of spin are obtained in detail. As examples the Landau
levels and the corresponding Wigner functions for a spin $\frac{1}{2}$
nonrelativistic particle as well as the magnetic resonance for a spin
$\frac{1}{2}$ nonrelativistic uncharged particle are analysed.
","[{""version"":""v1"",""created"":""Tue, 18 Dec 2018 12:16:18 GMT""},{""version"":""v2"",""created"":""Wed, 11 Sep 2019 15:07:26 GMT""}]","2020-02-19"
