"1812.06118","Forel Salom\'e","Salom\'e Forel, Alice Castan, Hakim Amara, Ileana Florea, Fr\'ed\'eric
  Fossard, Laure Catala, Christophe Bichara, Talal Mallah, Vincent Huc, Annick
  Loiseau, and Costel-Sorin Cojocaru","Tuning bimetallic catalysts for a selective growth of SWCNTs","10 pages, 6 figures",,,,"physics.app-ph cond-mat.mes-hall","http://arxiv.org/licenses/nonexclusive-distrib/1.0/","  Recent advances in structural control during the synthesis of SWCNTs have in
common the use of bimetallic nanoparticles as catalysts, despite the fact that
their exact role is not fully understood. We therefore analyze the effect of
the catalyst' s chemical composition on the structure of the resulting SWCNTs
by comparing three bimetallic catalysts (FeRu, CoRu and NiRu). A specific
synthesis protocol is designed to impede the catalyst nanoparticle coalescence
mechanisms and stabilize their diameter distributions throughout the growth.
Owing to the ruthenium component which has a limited carbon solubility, tubes
grow in tangential mode and their diameter is close to that of their seeding
nanoparticle. By using as-synthesized SWCNTs as a channel material in field
effect transistors, we show how the chemical composition of the catalysts and
temperature can be used as parameters to tune the diameter distribution and
semiconducting-to-metallic ratio of SWCNT samples. Finally, a phenomenological
model, based on the dependence of the carbon solubility as a function of
catalyst nanoparticle size and nature of the alloying elements, is proposed to
interpret the results.
","[{""version"":""v1"",""created"":""Mon, 17 Dec 2018 18:40:10 GMT""}]","2018-12-18"
"1812.06182","Sherry Towers","Sherry Towers, Linda J.S. Allen, Fred Brauer, Baltazar Espinoza","Assessing the impact of non-vaccinators: quantifying the average length
  of infection chains in outbreaks of vaccine-preventable disease","19 pages, 4 figures",,,,"q-bio.PE q-bio.QM","http://arxiv.org/licenses/nonexclusive-distrib/1.0/","  Analytical expressions for the basic reproduction number, R0, have been
obtained in the past for a wide variety of mathematical models for infectious
disease spread, along with expressions for the expected final size of an
outbreak. However, what has so far not been studied is the average number of
infections that descend down the chains of infection begun by each of the
individuals infected in an outbreak (we refer to this quantity as the ""average
number of descendant infections"" per infectious individual, or ANDI). ANDI
includes not only the number of people that an individual directly contacts and
infects, but also the number of people that those go on to infect, and so on
until that particular chain of infection dies out. Quantification of ANDI has
relevance to the vaccination debate, since with ANDI one can calculate the
probability that one or more people are hospitalised (or die) from a disease
down an average chain of infection descending from an infected un-vaccinated
individual. Here we obtain estimates of ANDI using both deterministic and
stochastic modelling formalisms. With both formalisms we find that even for
relatively small community sizes and under most scenarios for R0 and initial
fraction vaccinated, ANDI can be surprisingly large when the effective
reproduction number is >1, leading to high probabilities of adverse outcomes
for one or more people down an average chain of infection in outbreaks of
diseases like measles.
","[{""version"":""v1"",""created"":""Mon, 17 Dec 2018 16:27:42 GMT""}]","2018-12-18"
"1812.06862","Isabelle Baraquin","Isabelle Baraquin","Random walks on finite quantum groups",,,,,"math.QA math.PR","http://arxiv.org/licenses/nonexclusive-distrib/1.0/","  In this paper we study convergence of random walks, on finite quantum groups,
arising from linear combination of irreducible characters. We bound the
distance to the Haar state and determine the asymptotic behavior, i.e. the
limit state if it exists. We note that the possible limits are any central
idempotent state. We also look at cut-off phenomenon in the Sekine finite
quantum groups.
","[{""version"":""v1"",""created"":""Mon, 17 Dec 2018 16:01:05 GMT""},{""version"":""v2"",""created"":""Mon, 13 May 2019 13:29:21 GMT""}]","2019-05-14"
"1812.06863","Thomas Fernique","Nicolas B\'edaride and Thomas Fernique","Canonical projection tilings defined by patterns","24 pages, 12 figures",,"10.1007/s10711-020-00515-9",,"math.DS cs.DM math.CO math.MG","http://arxiv.org/licenses/nonexclusive-distrib/1.0/","  We give a necessary and sufficient condition on a $d$-dimensional affine
subspace of $\mathbb{R}^n$ to be characterized by a finite set of patterns
which are forbidden to appear in its digitization. This can also be stated in
terms of local rules for canonical projection tilings, or subshift of finite
type. This provides a link between algebraic properties of affine subspaces and
combinatorics of their digitizations. The condition relies on the notion of
{\em coincidence} and can be effectively checked. As a corollary, we get that
only algebraic subspaces can be characterized by patterns.
","[{""version"":""v1"",""created"":""Mon, 17 Dec 2018 16:03:32 GMT""}]","2021-08-27"
"1812.06864","Neil Zeghidour","Neil Zeghidour, Qiantong Xu, Vitaliy Liptchinsky, Nicolas Usunier,
  Gabriel Synnaeve, Ronan Collobert","Fully Convolutional Speech Recognition",,,,,"cs.CL","http://arxiv.org/licenses/nonexclusive-distrib/1.0/","  Current state-of-the-art speech recognition systems build on recurrent neural
networks for acoustic and/or language modeling, and rely on feature extraction
pipelines to extract mel-filterbanks or cepstral coefficients. In this paper we
present an alternative approach based solely on convolutional neural networks,
leveraging recent advances in acoustic models from the raw waveform and
language modeling. This fully convolutional approach is trained end-to-end to
predict characters from the raw waveform, removing the feature extraction step
altogether. An external convolutional language model is used to decode words.
On Wall Street Journal, our model matches the current state-of-the-art. On
Librispeech, we report state-of-the-art performance among end-to-end models,
including Deep Speech 2 trained with 12 times more acoustic data and
significantly more linguistic data.
","[{""version"":""v1"",""created"":""Mon, 17 Dec 2018 16:07:12 GMT""},{""version"":""v2"",""created"":""Tue, 9 Apr 2019 11:43:14 GMT""}]","2019-04-10"
"1812.06865","Maokang Shen","Maokang Shen, Yue Zhang, Wei Luo, Long You, Xiaofei Yang","The reason for the tilting of domain wall with Dzyaloshinskii-Moriya
  interaction from a microscopic dynamical perspective","9 pages, 5 figures",,,,"physics.comp-ph cond-mat.mes-hall","http://arxiv.org/licenses/nonexclusive-distrib/1.0/","  The interfacial Dzyaloshinskii-Moriya interaction (DMI) of a heavy metal
(HM)/ferromagnetic (FM) metal heterostructure is vital to the current-induced
domain wall motion (CIDWM) at an ultrahigh velocity. However, strong DMI also
tilts the moving domain wall (DW) plane, and the mechanism for this tilting is
not quite clear. In this work, we have found that this tilting may be
understood based on a micromagnetic calculation from a microscopic dynamical
perspective. The DMI-induced antisymmetric moment structure at the two
boundaries of the track needs to be paid attention. In the early stage of CIDWM
induced by spin-orbit torque, this antisymmetry is destroyed. Afterwards, the
moments at the two boundaries experience distinct rotation processes with
different energy paths towards their final stable antisymmetric moment
structure. This results in different initial velocities of the local DW regions
at the two boundaries. In mathematics, this distinct DW dynamical progresses at
the two boundaries can be approximately revealed by modifying the initial
conditions for solving the Thiele equations.
","[{""version"":""v1"",""created"":""Mon, 17 Dec 2018 16:07:27 GMT""}]","2018-12-18"
"1812.06866","Alberto Lumbreras","Alberto Lumbreras, Louis Filstroff, C\'edric F\'evotte","Bayesian Mean-parameterized Nonnegative Binary Matrix Factorization",,,,,"stat.ML cs.LG","http://arxiv.org/licenses/nonexclusive-distrib/1.0/","  Binary data matrices can represent many types of data such as social
networks, votes, or gene expression. In some cases, the analysis of binary
matrices can be tackled with nonnegative matrix factorization (NMF), where the
observed data matrix is approximated by the product of two smaller nonnegative
matrices. In this context, probabilistic NMF assumes a generative model where
the data is usually Bernoulli-distributed. Often, a link function is used to
map the factorization to the $[0,1]$ range, ensuring a valid Bernoulli mean
parameter. However, link functions have the potential disadvantage to lead to
uninterpretable models. Mean-parameterized NMF, on the contrary, overcomes this
problem. We propose a unified framework for Bayesian mean-parameterized
nonnegative binary matrix factorization models (NBMF). We analyze three models
which correspond to three possible constraints that respect the
mean-parametrization without the need for link functions. Furthermore, we
derive a novel collapsed Gibbs sampler and a collapsed variational algorithm to
infer the posterior distribution of the factors. Next, we extend the proposed
models to a nonparametric setting where the number of used latent dimensions is
automatically driven by the observed data. We analyze the performance of our
NBMF methods in multiple datasets for different tasks such as dictionary
learning and prediction of missing data. Experiments show that our methods
provide similar or superior results than the state of the art, while
automatically detecting the number of relevant components.
","[{""version"":""v1"",""created"":""Mon, 17 Dec 2018 16:08:21 GMT""},{""version"":""v2"",""created"":""Mon, 11 Nov 2019 12:36:19 GMT""},{""version"":""v3"",""created"":""Sat, 20 Jun 2020 17:07:15 GMT""}]","2020-06-23"
"1812.06867","Thorben Casper","Alexander Krimm, Thorben Casper, Sebastian Sch\""ops, Herbert De
  Gersem, Ludovic Chamoin","Proper Generalized Decomposition of Parameterized Electrothermal
  Problems Discretized by the Finite Integration Technique","submitted to IEEE Transactions on Magnetics - Conferences, to appear",,"10.1109/TMAG.2019.2907223",,"cs.CE","http://arxiv.org/licenses/nonexclusive-distrib/1.0/","  The proper generalized decomposition is applied to a static electrothermal
model subject to uncertainties. A reduced model that circumvents the curse of
dimensionality is obtained. The quadratic electrothermal coupling term is
non-standard and requires the introduction of a trilinear form. An existing
finite integration technique based solver is used to demonstrate the
opportunities and difficulties in integrating the proper generalized
decomposition in existing codes.
","[{""version"":""v1"",""created"":""Mon, 17 Dec 2018 16:08:59 GMT""},{""version"":""v2"",""created"":""Thu, 21 Mar 2019 20:15:05 GMT""}]","2019-03-25"
"1812.06869","Alexey Gritsenko","Alexey A. Gritsenko, Alex D'Amour, James Atwood, Yoni Halpern, D.
  Sculley","BriarPatches: Pixel-Space Interventions for Inducing Demographic Parity","6 pages, 5 figures, NeurIPS Workshop on Ethical, Social and
  Governance Issues in AI",,,,"cs.LG cs.CV stat.ML","http://arxiv.org/licenses/nonexclusive-distrib/1.0/","  We introduce the BriarPatch, a pixel-space intervention that obscures
sensitive attributes from representations encoded in pre-trained classifiers.
The patches encourage internal model representations not to encode sensitive
information, which has the effect of pushing downstream predictors towards
exhibiting demographic parity with respect to the sensitive information. The
net result is that these BriarPatches provide an intervention mechanism
available at user level, and complements prior research on fair representations
that were previously only applicable by model developers and ML experts.
","[{""version"":""v1"",""created"":""Mon, 17 Dec 2018 16:13:42 GMT""}]","2018-12-18"
"1812.06870","Jon Sporring","Jon Sporring and Rasmus Waagepetersen and Stefan Sommer","Generalizations of Ripley's K-function with Application to Space Curves","9 pages & 8 figures",,,,"stat.ME","http://arxiv.org/licenses/nonexclusive-distrib/1.0/","  The intensity function and Ripley's K-function have been used extensively in
the literature to describe the first and second moment structure of spatial
point sets. This has many applications including describing the statistical
structure of synaptic vesicles. Some attempts have been made to extend Ripley's
K-function to curve pieces. Such an extension can be used to describe the
statistical structure of muscle fibers and brain fiber tracks. In this paper,
we take a computational perspective and construct new and very general variants
of Ripley's K-function for curves pieces, surface patches etc. We discuss the
method from [Chiu, Stoyan, Kendall, & Mecke 2013] and compare it with our
generalizations theoretically, and we give examples demonstrating the
difference in their ability to separate sets of curve pieces.
","[{""version"":""v1"",""created"":""Mon, 17 Dec 2018 16:16:06 GMT""}]","2018-12-18"
"1812.06871","Andrew Plume","Chris James, Lisa Colledge, Wim Meester, Norman Azoulay, Andrew Plume","CiteScore metrics: Creating journal metrics from the Scopus citation
  index",,,,,"cs.DL","http://creativecommons.org/licenses/by-nc-sa/4.0/","  In December 2016, after several years of development, Elsevier launched a set
of transparent, comprehensive, current, and freely-available journal citation
metrics called CiteScore metrics. Most of the CiteScore metrics are static,
annual indicators calculated from the dynamic Scopus citation index. In the
spirit of recent public statements on the responsible use of metrics, we
outline the desirable characteristics of journal citation metrics, discuss how
we decided on the cited and citing publications years and document types to be
used for CiteScore metrics, and detail the precise method of calculation of
each metric. We further discuss CiteScore metrics eligibility criteria and
online display choices, as well as our approach to calculating static
indicators from the dynamic citation index. Finally, we look at the feedback
the metrics have so far received and how CiteScore is already developing in
response.
","[{""version"":""v1"",""created"":""Mon, 17 Dec 2018 16:17:52 GMT""}]","2018-12-18"
"1812.06872","Soumyashant Nayak","Soumyashant Nayak","Matrix algebras over algebras of unbounded operators","22 pages, abstract changed and minor corrections, to appear in Banach
  J. Math. Anal",,"10.1007/s43037-019-00052-y",,"math-ph math.MP math.OA math.RA","http://arxiv.org/licenses/nonexclusive-distrib/1.0/","  Let $\mathscr{M}$ be a $II_1$ factor acting on the Hilbert space
$\mathscr{H}$, and $\mathscr{M}_{\textrm{aff}}$ be the Murray-von Neumann
algebra of closed densely-defined operators affiliated with $\mathscr{M}$. Let
$\tau$ denote the unique faithful normal tracial state on $\mathscr{M}$. By
virtue of Nelson's theory of non-commutative integration,
$\mathscr{M}_{\textrm{aff}}$ may be identified with the completion of
$\mathscr{M}$ in the measure topology. In this article, we show that
$M_n(\mathscr{M}_{\textrm{aff}}) \cong M_n(\mathscr{M})_{\textrm{aff}}$ as
unital ordered complex topological $*$-algebras with the isomorphism extending
the identity mapping of $M_n(\mathscr{M}) \to M_n(\mathscr{M})$. Consequently,
the algebraic machinery of rank identities and determinant identities are
applicable in this setting. As a step further in the Heisenberg-von Neumann
puzzle discussed by Kadison-Liu (SIGMA, 10 (2014), Paper 009), it follows that
if there exist operators $P, Q$ in $\mathscr{M}_{\textrm{aff}}$ satisfying the
commutation relation $Q \; \hat \cdot \; P \; \hat - \; P \; \hat \cdot \; Q =
{i\mkern1mu} I$, then at least one of them does not belong to $L^p(\mathscr{M},
\tau)$ for any $0 < p \le \infty$. Furthermore, the respective point spectrums
of $P$ and $Q$ must be empty. Hence the puzzle may be recasted in the following
equivalent manner - Are there invertible operators $P, A$ in
$\mathscr{M}_{\textrm{aff}}$ such that $P^{-1} \; \hat \cdot \; A \; \hat \cdot
\; P = I \; \hat + \; A$? This suggests that any strategy towards its
resolution must involve the study of conjugacy invariants of operators in
$\mathscr{M}_{\textrm{aff}}$ in an essential way.
","[{""version"":""v1"",""created"":""Mon, 17 Dec 2018 16:22:14 GMT""},{""version"":""v2"",""created"":""Tue, 10 Sep 2019 23:08:34 GMT""},{""version"":""v3"",""created"":""Mon, 13 Jan 2020 19:03:37 GMT""}]","2020-11-02"
"1812.06873","Boris Chidlovskii","Giorgio Giannone and Boris Chidlovskii","Learning Common Representation from RGB and Depth Images","7 pages, 3 figures, 2 tables",,,,"cs.AI","http://arxiv.org/licenses/nonexclusive-distrib/1.0/","  We propose a new deep learning architecture for the tasks of semantic
segmentation and depth prediction from RGB-D images. We revise the state of art
based on the RGB and depth feature fusion, where both modalities are assumed to
be available at train and test time. We propose a new architecture where the
feature fusion is replaced with a common deep representation. Combined with an
encoder-decoder type of the network, the architecture can jointly learn models
for semantic segmentation and depth estimation based on their common
representation. This representation, inspired by multi-view learning, offers
several important advantages, such as using one modality available at test time
to reconstruct the missing modality. In the RGB-D case, this enables the
cross-modality scenarios, such as using depth data for semantically
segmentation and the RGB images for depth estimation. We demonstrate the
effectiveness of the proposed network on two publicly available RGB-D datasets.
The experimental results show that the proposed method works well in both
semantic segmentation and depth estimation tasks.
","[{""version"":""v1"",""created"":""Mon, 17 Dec 2018 16:22:47 GMT""}]","2018-12-18"
"1812.06874","Daniel Mason","Daniel R Mason and Duc Nguyen-Manh and Mihai-Cosmin Marinica and
  Rebecca Alexander and Sergei L Dudarev","Relaxation volumes of microscopic and mesoscopic irradiation-induced
  defects in tungsten",,,"10.1063/1.5094852",,"cond-mat.mtrl-sci","http://arxiv.org/licenses/nonexclusive-distrib/1.0/","  The low energy structures of irradiation-induced defects have been studied in
detail, as these determine the available modes by which a defect can diffuse or
relax. As a result, there are many studies concerning the relative energies of
possible defect structures, and empirical potentials are commonly fitted to or
evaluated with respect to these energies. But recently [Dudarev et al Nuclear
Fusion 2018], we have shown how to determine the stresses, strains and swelling
of reactor components under irradiation from the elastic properties of
ensembles of irradiation-induced defects. These elastic properties have
received comparatively little attention. Here we evaluate relaxation volumes of
irradiation-induced defects in tungsten computed with empirical potentials, and
compare to density functional theory results where available. Different
empirical potentials give different results, but some potential-independent
trends in relaxation volumes can be identified. We show that the relaxation
volume of small defects can be predicted to within 10% from their point-defect
count. For larger defects we provide empirical fits for the relaxation volume
of as a function of size. We demonstrate that the relaxation volume associated
with a single primary-damage cascade can be estimated from the primary knock-on
atom (PKA) energy. We conclude that while annihilation of vacancy- and
interstitial- character defects will invariably reduce the total relaxation
volume of the cascade debris, empirical potentials disagree whether coalescence
of defects will reduce or increase the total relaxation volume.
","[{""version"":""v1"",""created"":""Mon, 17 Dec 2018 16:24:36 GMT""}]","2020-01-29"
"1812.06875","Abhijeet Anand","Abhijeet Anand, Nirupam Roy and Gopal-Krishna","Search for HI emission from superdisk candidates associated with radio
  galaxies","9 pages, 4 figures, 2 Tables. Accepted for publication in Research in
  Astronomy and Astrophysics (RAA)","2019, Res. Astron. Astrophys., 19, 83","10.1088/1674-4527/19/6/83",,"astro-ph.GA","http://arxiv.org/licenses/nonexclusive-distrib/1.0/","  Giant gaseous layers (termed ""superdisk"") have been hypothesized in the past
to account for the strip-like radio emission gap (or straight-edged central
brightness depression) observed between the twin radio lobes, in over a dozen
relatively nearby powerful Fanaroff-Riley Class II radio galaxies. They could
also provide a plausible alternative explanation for a range of observations.
Although a number of explanations have been proposed for the origin of the
superdisks, little is known about their material content. Some X-ray
observations of superdisk candidates indicate the presence of hot gas, but a
cool dusty medium also seems to be common in them. If they are made of entirely
or partly neutral gas, it may be directly detectable and we report here a first
attempt to detect/image any neutral hydrogen gas present in the superdisks that
are inferred to be present in four nearby radio galaxies. We have not found a
positive HI signal in any of the four sources, resulting in tight upper limits
on the HI number density in the postulated superdisks, estimated directly from
the central rms noise values of the final radio continuum subtracted image. The
estimated ranges of the upper limit on neutral hydrogen number density and
column density are $10^{-4}-10^{-3}$ atoms per cm$^3$ and $10^{19}-10^{20}$
atoms per cm$^{2}$, respectively. No positive HI signal is detected even after
combining all the four available HI images (with inverse variance weighting).
This clearly rules out an HI dominated superdisk as a viable model to explain
these structures, however, the possibility of superdisk being made of warm/hot
gas still remains open.
","[{""version"":""v1"",""created"":""Mon, 17 Dec 2018 16:32:01 GMT""}]","2021-01-13"
"1812.06876","Stefan Constantin","Stefan Constantin, Jan Niehues, Alex Waibel","Multi-task learning to improve natural language understanding","11 pages, 4 figures, 2 tables, forthcoming in IWSDS 2019",,,,"cs.CL","http://arxiv.org/licenses/nonexclusive-distrib/1.0/","  Recently advancements in sequence-to-sequence neural network architectures
have led to an improved natural language understanding. When building a neural
network-based Natural Language Understanding component, one main challenge is
to collect enough training data. The generation of a synthetic dataset is an
inexpensive and quick way to collect data. Since this data often has less
variety than real natural language, neural networks often have problems to
generalize to unseen utterances during testing. In this work, we address this
challenge by using multi-task learning. We train out-of-domain real data
alongside in-domain synthetic data to improve natural language understanding.
We evaluate this approach in the domain of airline travel information with two
synthetic datasets. As out-of-domain real data, we test two datasets based on
the subtitles of movies and series. By using an attention-based encoder-decoder
model, we were able to improve the F1-score over strong baselines from 80.76 %
to 84.98 % in the smaller synthetic dataset.
","[{""version"":""v1"",""created"":""Mon, 17 Dec 2018 16:32:05 GMT""},{""version"":""v2"",""created"":""Fri, 15 Feb 2019 17:43:00 GMT""}]","2019-02-18"
"1812.06877","Justin Forlano","Justin Forlano and William J. Trenberth","On the transport of Gaussian measures under the one-dimensional
  fractional nonlinear Schr\""odinger equations","42 pages; typos corrected, added Remark 1.8. To appear in Ann. Inst.
  H. Poincar\'e Anal. Non Lin\'eaire",,"10.1016/j.anihpc.2019.07.006",,"math.AP math.PR","http://arxiv.org/licenses/nonexclusive-distrib/1.0/","  Under certain regularity conditions, we establish quasi-invariance of
Gaussian measures on periodic functions under the flow of cubic fractional
nonlinear Schr\""{o}dinger equations on the one-dimensional torus.
","[{""version"":""v1"",""created"":""Mon, 17 Dec 2018 16:32:59 GMT""},{""version"":""v2"",""created"":""Sat, 7 Sep 2019 10:34:04 GMT""}]","2019-09-10"
