"1812.07151","Seongjin Choi","Seongjin Choi, Jiwon Kim, Hwasoo Yeo","Attention-based Recurrent Neural Network for Urban Vehicle Trajectory
  Prediction",,,,,"cs.LG cs.AI","http://arxiv.org/licenses/nonexclusive-distrib/1.0/","  With the increasing deployment of diverse positioning devices and
location-based services, a huge amount of spatial and temporal information has
been collected and accumulated as trajectory data. Among many applications,
trajectory-based location prediction is gaining increasing attention because of
its potential to improve the performance of many applications in multiple
domains. This research focuses on trajectory sequence prediction methods using
trajectory data obtained from the vehicles in urban traffic network. As
Recurrent Neural Network(RNN) model is previously proposed, we propose an
improved method of Attention-based Recurrent Neural Network model(ARNN) for
urban vehicle trajectory prediction. We introduce attention mechanism into
urban vehicle trajectory prediction to explain the impact of network-level
traffic state information. The model is evaluated using the Bluetooth data of
private vehicles collected in Brisbane, Australia with 5 metrics which are
widely used in the sequence modeling. The proposed ARNN model shows significant
performance improvement compared to the existing RNN models considering not
only the cells to be visited but also the alignment of the cells in sequence.
","[{""version"":""v1"",""created"":""Tue, 18 Dec 2018 03:36:50 GMT""},{""version"":""v2"",""created"":""Wed, 4 Dec 2019 02:19:42 GMT""}]","2019-12-05"
"1812.07152","Bangtian Liu","Bangtian Liu, Kazem Cheshmi, Saeed Soori, Michelle Mills Strout and
  Maryam Mehri Dehnavi","MatRox: Modular approach for improving data locality in Hierarchical
  (Mat)rix App(Rox)imation",,,,,"cs.DC","http://arxiv.org/licenses/nonexclusive-distrib/1.0/","  Hierarchical matrix approximations have gained significant traction in the
machine learning and scientific community as they exploit available low-rank
structures in kernel methods to compress the kernel matrix. The resulting
compressed matrix, HMatrix, is used to reduce the computational complexity of
operations such as HMatrix-matrix multiplications with tuneable accuracy in an
evaluation phase. Existing implementations of HMatrix evaluations do not
preserve locality and often lead to unbalanced parallel execution with high
synchronization. Also, current solutions require the compression phase to
re-execute if the kernel method or the required accuracy change. In this work,
we describe MatRox, a framework that uses novel structure analysis strategies,
blocking and coarsen, with code specialization and a storage format to improve
locality and create load-balanced parallel tasks for HMatrix-matrix
multiplications. Modularization of the matrix compression phase enables the
reuse of computations when there are changes to the input accuracy and the
kernel function. The MatRox-generated code for matrix-matrix multiplication is
2.98x, 1.60x, and 5.98x faster than library implementations available in GOFMM,
SMASH, and STRUMPACK respectively. Additionally, the ability to reuse portions
of the compression computation for changes to the accuracy leads to up to 2.64x
improvement with MatRox over five changes to accuracy using GOFMM.
","[{""version"":""v1"",""created"":""Tue, 18 Dec 2018 03:43:23 GMT""},{""version"":""v2"",""created"":""Wed, 19 Dec 2018 21:21:16 GMT""},{""version"":""v3"",""created"":""Wed, 26 Jun 2019 21:12:00 GMT""},{""version"":""v4"",""created"":""Thu, 1 Aug 2019 18:11:20 GMT""},{""version"":""v5"",""created"":""Wed, 20 Nov 2019 17:00:57 GMT""},{""version"":""v6"",""created"":""Thu, 21 Nov 2019 17:16:45 GMT""},{""version"":""v7"",""created"":""Sat, 30 Nov 2019 20:32:58 GMT""}]","2019-12-03"
"1812.07153","Abbas Zaidi","Abbas Zaidi, Sayan Mukherjee","Gaussian Process Mixtures for Estimating Heterogeneous Treatment Effects",,,,,"stat.ME stat.OT","http://arxiv.org/licenses/nonexclusive-distrib/1.0/","  We develop a Gaussian-process mixture model for heterogeneous treatment
effect estimation that leverages the use of transformed outcomes. The approach
we will present attempts to improve point estimation and uncertainty
quantification relative to past work that has used transformed variable related
methods as well as traditional outcome modeling. Earlier work on modeling
treatment effect heterogeneity using transformed outcomes has relied on tree
based methods such as single regression trees and random forests. Under the
umbrella of non-parametric models, outcome modeling has been performed using
Bayesian additive regression trees and various flavors of weighted single
trees. These approaches work well when large samples are available, but suffer
in smaller samples where results are more sensitive to model misspecification -
our method attempts to garner improvements in inference quality via a correctly
specified model rooted in Bayesian non-parametrics. Furthermore, while we begin
with a model that assumes that the treatment assignment mechanism is known, an
extension where it is learnt from the data is presented for applications to
observational studies. Our approach is applied to simulated and real data to
demonstrate our theorized improvements in inference with respect to two causal
estimands: the conditional average treatment effect and the average treatment
effect. By leveraging our correctly specified model, we are able to more
accurately estimate the treatment effects while reducing their variance.
","[{""version"":""v1"",""created"":""Tue, 18 Dec 2018 03:43:41 GMT""}]","2018-12-19"
"1812.07154","Chengyuan Li","Chengyuan Li, Weijia Sun, Jongsuk Hong, Licai Deng, Richard de Grijs,
  Alison Sills","Blue straggler stars beyond the Milky Way. IV. Radial distributions and
  dynamical implications","16 pages, 15 figures, accepted by the ApJ",,,,"astro-ph.GA astro-ph.SR","http://arxiv.org/licenses/nonexclusive-distrib/1.0/","  Blue straggler stars have been proposeed as powerful indicators to measure
the dynamical state of Galactic globular clusters. Here we examine for the
first time if this framework of blue straggler stars as dynamical clocks, which
was specifically developed for Galactic globular clusters, may also hold for
younger globular clusters in the Large Magellanic Cloud. Using Hubble Space
Telescope observations, we study seven Large Magellanic Cloud star clusters
with ages between ~700 Myr and 7 Gyr. We confirm that our sample clusters are
consistent with the empirical correlation previously derived for Galactic
globular clusters, within a modest tolerance. We suggest that to further
examine if blue straggler stars can measure the dynamical state of their host
clusters over an extended range of dynamical ages, more studies of dynamically
older Magellanic Cloud clusters are required. We discuss the physical
implications of our results in terms of their central, dimensionless King
potential, as well as the initial retention fraction of black holes.
","[{""version"":""v1"",""created"":""Tue, 18 Dec 2018 03:45:55 GMT""}]","2018-12-19"
"1812.07155","Zach Meisel","Zach Meisel, Grant Merz, and Sophia Medvid","Influence of Nuclear Reaction Rate Uncertainties on Neutron Star
  Properties Extracted From X-ray Burst Model-Observation Comparisons","Submitted","Astrophysical Journal 872, 84 (2019)","10.3847/1538-4357/aafede",,"astro-ph.HE","http://arxiv.org/licenses/nonexclusive-distrib/1.0/","  Type-I X-ray bursts can be used to determine properties of accreting neutron
stars via comparisons between model calculations and astronomical observations,
exploiting the sensitivity of models to astrophysical conditions. However, the
sensitivity of models to nuclear physics uncertainties calls into question the
fidelity of constraints derived in this way. Using X-ray burst model
calculations performed with the code {\tt MESA}, we investigate the impact of
uncertainties for nuclear reaction rates previously identified as influential
and compare them to the impact of changes in astrophysical conditions, using
the conditions that are thought to best reproduce the source GS 1826-24 as a
baseline. We find that reaction rate uncertainties are unlikely to
significantly change conclusions about the properties of accretion onto the
neutron star surface for this source. However, we find that reaction rate
uncertainties significantly hinder the possibility of extracting the neutron
star mass-radius ratio by matching the modeled and observed light curves due to
the influence of reaction rates on the modeled light curve shape. Particularly
influential nuclear reaction rates are $^{15}{\rm O}(\alpha,\gamma)$ and
$^{23}{\rm Al}(p,\gamma)$, though other notable impacts arise from $^{14}{\rm
O}(\alpha,p)$, $^{18}{\rm Ne}(\alpha,p)$, $^{22}{\rm Mg}(\alpha,p)$, $^{24}{\rm
Mg}(\alpha,\gamma)$, $^{59}{\rm Cu}(p,\gamma)$, and $^{61}{\rm Ga}(p,\gamma)$.
Furthermore, we find that varying some nuclear reaction rates within their
uncertainties has an impact on the neutron star crust composition and thermal
structure that is comparable to relatively significant changes accretion
conditions.
","[{""version"":""v1"",""created"":""Tue, 18 Dec 2018 03:46:27 GMT""}]","2019-02-19"
"1812.07156","Daniel Giles","Daniel Giles and Lucianne Walkowicz","Systematic Serendipity: A Test of Unsupervised Machine Learning as a
  Method for Anomaly Detection","21 pages, 10 figures, Submitted to MNRAS",,"10.1093/mnras/sty3461",,"astro-ph.IM astro-ph.SR","http://arxiv.org/licenses/nonexclusive-distrib/1.0/","  Advances in astronomy are often driven by serendipitous discoveries. As
survey astronomy continues to grow, the size and complexity of astronomical
databases will increase, and the ability of astronomers to manually scour data
and make such discoveries decreases. In this work, we introduce a machine
learning-based method to identify anomalies in large datasets to facilitate
such discoveries, and apply this method to long cadence lightcurves from NASA's
Kepler Mission. Our method clusters data based on density, identifying
anomalies as data that lie outside of dense regions. This work serves as a
proof-of-concept case study and we test our method on four quarters of the
Kepler long cadence lightcurves. We use Kepler's most notorious anomaly,
Boyajian's Star (KIC 8462852), as a rare `ground truth' for testing outlier
identification to verify that objects of genuine scientific interest are
included among the identified anomalies. We evaluate the method's ability to
identify known anomalies by identifying unusual behavior in Boyajian's Star, we
report the full list of identified anomalies for these quarters, and present a
sample subset of identified outliers that includes unusual phenomena, objects
that are rare in the Kepler field, and data artifacts. By identifying <4% of
each quarter as outlying data, we demonstrate that this anomaly detection
method can create a more targeted approach in searching for rare and novel
phenomena.
","[{""version"":""v1"",""created"":""Tue, 18 Dec 2018 03:49:15 GMT""}]","2019-01-09"
"1812.07157","Yuncheng Du","Jeongeun Son, Dongping Du, Yuncheng Du","Stochastic Modelling and Dynamic Analysis of Cardiovascular System with
  Rotary Left Ventricular Assist Devices",,"Mathematical Problems in Engineering, 2018",,,"q-bio.TO physics.med-ph","http://arxiv.org/licenses/nonexclusive-distrib/1.0/","  The left ventricular assist device (LVAD) has been used for end-stage heart
failure patients as a therapeutic option. The aortic valve plays a critical
role in heart failure and its treatment with LVAD. The cardiovascular-LVAD
model is often used to investigate the physiological demands required by
patients and predict the hemodynamic of the native heart supported with a LVAD.
As a bridge to recovery treatment, it is important to maintain appropriate and
active dynamics of the aortic valve and the cardiac output of the native heart,
which requires that the LVAD pump must be adjusted so that a proper balance
between the blood contributed through the aortic valve and the pump is
maintained. In this paper, our objective is to identify a critical value of the
pump power to ensure that the LVAD pump does not take over the pumping function
in the cardiovascular-pump system and share the ejected blood with left
ventricle to help the heart to recover. In addition, hemodynamic often involves
variability due to patients heterogeneity and the stochastic nature of
cardiovascular system. The variability poses significant challenges to
understand dynamic behaviors of the aortic valve and cardiac output. A
generalized polynomial chaos (gPC) expansion is used in this work to develop a
stochastic cardiovascular-pump model for efficient uncertainty propagation,
from which it is possible to rapidly calculate the variance in the aortic valve
opening duration and the cardiac output in the presence of variability. The
simulation results show that the gPC based cardiovascular-pump model is a
reliable platform that can provide useful information to understand the effect
of LVAD pump on the hemodynamic of the heart.
","[{""version"":""v1"",""created"":""Tue, 18 Dec 2018 03:49:28 GMT""}]","2018-12-19"
"1812.07158","Yi Xu","Yi Xu, Lin Wu, and L. K. Ang","Surface exciton polaritons: a promising mechanism for sensing
  applications","11 pages, 7 figures","Phys. Rev. Applied 12, 024029 (2019)","10.1103/PhysRevApplied.12.024029",,"cond-mat.mes-hall physics.optics","http://arxiv.org/licenses/nonexclusive-distrib/1.0/","  The possibility of constructing a surface exciton polariton (SEP) based
sensor at room temperature is explored. The proposed SEP sensor is based on the
Kretschmann-Raether configuration of conventional surface plasmon resonance
(SPR) sensor, where the metal thin film was replaced by the J-aggregate cyanine
dye film. The excitation of SEP results in a strong electric field at the
interface of TDBC and analyte, and exponentially decaying into the analyte,
which is sensitive to the refractive index variations of analyte. The
sensitivity of 118.1818 $^\circ/\text{RIU}$ (140.4286 $^\circ/\text{RIU}$) was
achieved for the proposed SEP sensor within the refractive index range
1.0-1.001 (1.33-1.36) of gaseous analyte (aqueous solutions), which is about 2
(3.5) times higher than that of conventional gold-based SPR sensor. The
significant superiority of the SEP sensor in sensitivity revealing SEP as a new
promising mechanism for sensing applications.
","[{""version"":""v1"",""created"":""Tue, 18 Dec 2018 03:50:01 GMT""}]","2019-08-21"
"1812.07159","Dhruv Ramani","Dhruv Ramani, Samarjit Karmakar, Anirban Panda, Asad Ahmed, Pratham
  Tangri","Autoencoder Based Architecture For Fast & Real Time Audio Style Transfer",,,,,"cs.SD cs.LG eess.AS stat.ML","http://arxiv.org/licenses/nonexclusive-distrib/1.0/","  Recently, there has been great interest in the field of audio style transfer,
where a stylized audio is generated by imposing the style of a reference audio
on the content of a target audio. We improve on the current approaches which
use neural networks to extract the content and the style of the audio signal
and propose a new autoencoder based architecture for the task. This network
generates a stylized audio for a content audio in a single forward pass. The
proposed network architecture proves to be advantageous over the quality of
audio produced and the time taken to train the network. The network is
experimented on speech signals to confirm the validity of our proposal.
","[{""version"":""v1"",""created"":""Tue, 18 Dec 2018 04:04:38 GMT""},{""version"":""v2"",""created"":""Wed, 26 Dec 2018 15:30:16 GMT""}]","2018-12-27"
"1812.07160","Franck Natali","Felicia Ullstad, Gabriel Bioletti, Jay Chan, Audrey Proust, Charlotte
  Bodin, Ben J. Ruck, H. Joe Trodahl, Franck Natali","Breaking molecular nitrogen under mild conditions with an atomically
  clean lanthanide surface",,,,,"cond-mat.mtrl-sci","http://arxiv.org/licenses/nonexclusive-distrib/1.0/","  A route to break molecular nitrogen (N2) under mild conditions is
demonstrated by N2 gas cracking on, and incorporation into, lanthanide films.
Successful growth of lanthanide nitride thin films, made by evaporation of
lanthanides in a partial N2 atmosphere at room temperature and pressure as low
as 10-4 Torr, is confirmed using X-ray diffraction. In-situ conductance
measurements of pure lanthanide thin films exposed to N2 gas show an immediate
surface reaction and a slower bulk reaction. Finally, we report partial
reversal of the nitrogen incorporation in a lanthanide nitride by cycling
vacuum and nitrogen conditions in the sample chamber.A route to break molecular
nitrogen (N2) under mild conditions is demonstrated by N2 gas cracking on, and
incorporation into, lanthanide films. Successful growth of lanthanide nitride
thin films, made by evaporation of lanthanides in a partial N2 atmosphere at
room temperature and pressure as low as 10-4 Torr, is confirmed using X-ray
diffraction. Insitu conductance measurements of pure lanthanide thin films
exposed to N2 gas show an immediate surface reaction and a slower bulk
reaction. Finally, we report partial reversal of the nitrogen incorporation in
a lanthanide nitride by cycling vacuum and nitrogen conditions in the sample
chamber.
","[{""version"":""v1"",""created"":""Tue, 18 Dec 2018 04:05:40 GMT""}]","2018-12-19"
"1812.07161","Gabrielle Saller Nornberg","Ederson Moreira dos Santos and Gabrielle Nornberg","Symmetry properties of positive solutions for fully nonlinear elliptic
  systems",,,,,"math.AP","http://arxiv.org/licenses/nonexclusive-distrib/1.0/","  We investigate symmetry properties of positive solutions for fully nonlinear
uniformly elliptic systems, such as $$ F_i \,(x,Du_i,D^2u_i) +f_i \,(x,u_1,
\ldots , u_n,Du_i)=0, \;\; 1 \leq i \leq n, $$ in a bounded domain $\Omega$ in
$\mathbb{R}^N$ with Dirichlet boundary condition $u_1=\ldots,u_n=0$ on
$\partial\Omega$. Here, $f_i $'s are nonincreasing with the radius $r=|x|$, and
satisfy a cooperativity assumption. In addition, each $f_i $ is the sum of a
locally Lipschitz with a nondecreasing function in the variable $u_i$, and may
have superlinear gradient growth. We show that symmetry occurs for systems with
nondifferentiable $f_i$'s by developing a unified treatment of the classical
moving planes method in the spirit of Gidas-Ni-Nirenberg. We also present
different applications of our results, including uniqueness of positive
solutions for Lane-Emden systems in the subcritical case in a ball, and
symmetry for a class of systems with natural growth in the gradient.
","[{""version"":""v1"",""created"":""Tue, 18 Dec 2018 04:09:03 GMT""},{""version"":""v2"",""created"":""Fri, 25 Jan 2019 21:49:44 GMT""},{""version"":""v3"",""created"":""Thu, 30 Jan 2020 17:05:12 GMT""}]","2020-01-31"
"1812.07162","Koichi Nagasaki","Koichi Nagasaki","Interface in AdS black hole spacetime","10 pages, 9 figures, some figures and conclusion are added","Prog Theor Exp Phys (2020)","10.1093/ptep/ptz164",,"hep-th","http://arxiv.org/licenses/nonexclusive-distrib/1.0/","  We consider a defect solution in the AdS5 x S5 spacetime. This is the
generalization of the previous work [arXiv:1109.1927] to the other spacetime.
This also gives the generalization of Complexity and Action relation
[arXiv:1705.08424] including the flux. The equation of motion for an interface
is given and its solution is shown by the numerical calculation. We also
consider the Nambu-Goto action of the string affected by this interface. This
corresponds the quark-interface potential in the black hole spacetime.
","[{""version"":""v1"",""created"":""Tue, 18 Dec 2018 04:12:37 GMT""},{""version"":""v2"",""created"":""Sun, 14 Apr 2019 21:39:59 GMT""},{""version"":""v3"",""created"":""Wed, 17 Apr 2019 21:18:50 GMT""},{""version"":""v4"",""created"":""Thu, 28 Nov 2019 05:37:31 GMT""}]","2020-02-26"
"1812.07163","Quan Zhou","Philip Ernst, Goran Peskir, Quan Zhou","Optimal real-time detection of a drifting Brownian coordinate",,,,,"math.PR","http://arxiv.org/licenses/nonexclusive-distrib/1.0/","  Consider the motion of a Brownian particle in three dimensions, whose two
spatial coordinates are standard Brownian motions with zero drift, and the
remaining (unknown) spatial coordinate is a standard Brownian motion with a
non-zero drift. Given that the position of the Brownian particle is being
observed in real time, the problem is to detect as soon as possible and with
minimal probabilities of the wrong terminal decisions, which spatial coordinate
has the non-zero drift. We solve this problem in the Bayesian formulation,
under any prior probabilities of the non-zero drift being in any of the three
spatial coordinates, when the passage of time is penalised linearly. Finding
the exact solution to the problem in three dimensions, including a rigorous
treatment of its non-monotone optimal stopping boundaries, is the main
contribution of the present paper. To our knowledge this is the first time that
such a problem has been solved in the literature.
","[{""version"":""v1"",""created"":""Tue, 18 Dec 2018 04:28:17 GMT""}]","2018-12-19"
"1812.07164","Mohamed Mabrok Mohamed A. Mabrok","Mohamed Mabrok","Passivity Analysis of Replicator Dynamics and its Variations",,,,,"math.OC","http://arxiv.org/licenses/nonexclusive-distrib/1.0/","  In this paper, we focus on studying the passivity properties of different
versions of replicator dynamics (RD). RD is an important class of evolutionary
dynamics in evolutionary game theory. Evolutionary dynamics describe how the
population composition changes in response to the fitness levels, resulting in
a closed-loop feedback system. RD is a deterministic monotone non-linear
dynamic that allows incorporation of the distribution of population types
through a fitness function. Here, in this paper, we use a tools for control
theory, in particular, the passivity theory, to study the stability of the RD
when it is in action with evolutionary games. The passivity theory allows us to
identify class of evolutionary games in which stability with RD is guaranteed.
We show that several variations of the first order RD satisfy the standard
loseless passivity property. In contrary, the second order RD do not satisfy
the standard passivity property, however, it satisfies a similar dissipativity
property known as negative imaginary property. The negative imaginary property
of the second order RD allows us to identify the class of games that converge
to a stable equilibrium with the second order RD.
","[{""version"":""v1"",""created"":""Tue, 18 Dec 2018 04:32:23 GMT""}]","2018-12-19"
"1812.07165","Uttam Paudel","Uttam Paudel, Jia Jun Wong, Michael Goggin, Paul Kwiat, Allan S.
  Bracker, Michael Yakes, Daniel Gammon, Duncan Steel","Direct Excitation of a Single Quantum Dot with Cavity-SPDC Photons",,"Optics Express, Vol. 27, Issue 11, pp. 16308-16319 (2019)","10.1364/OE.27.016308",,"quant-ph","http://arxiv.org/licenses/nonexclusive-distrib/1.0/","  The ability to generate mode-engineered single photons to interface with
disparate quantum systems is of importance for building a quantum network. Here
we report on the generation of a pulsed, heralded single photon source with a
sub-GHz spectral bandwidth that couples to indium arsenide quantum dots
centered at 942 nm. The source is built with a type-II PPKTP down-conversion
crystal embedded in a semi-confocal optical cavity and pumped with a 76 MHz
repetition rate pulsed laser to emit collinear, polarization-correlated photon
pairs resonant with a single quantum dot. In order to demonstrate direct
coupling, we use the mode-engineered cavity-SPDC single-photon source to
resonantly excite an isolated single quantum dot.
","[{""version"":""v1"",""created"":""Tue, 18 Dec 2018 04:40:16 GMT""},{""version"":""v2"",""created"":""Sat, 25 May 2019 01:12:02 GMT""}]","2019-05-28"
"1812.07166","Jiechao Ma","Jiechao Ma, Xiang Li, Hongwei Li, Bjoern H Menze, Sen Liang, Rongguo
  Zhang, Wei-Shi Zheng","Group-Attention Single-Shot Detector (GA-SSD): Finding Pulmonary Nodules
  in Large-Scale CT Images",,,,,"cs.CV","http://arxiv.org/licenses/nonexclusive-distrib/1.0/","  Early diagnosis of pulmonary nodules (PNs) can improve the survival rate of
patients and yet is a challenging task for radiologists due to the image noise
and artifacts in computed tomography (CT) images. In this paper, we propose a
novel and effective abnormality detector implementing the attention mechanism
and group convolution on 3D single-shot detector (SSD) called group-attention
SSD (GA-SSD). We find that group convolution is effective in extracting rich
context information between continuous slices, and attention network can learn
the target features automatically. We collected a large-scale dataset that
contained 4146 CT scans with annotations of varying types and sizes of PNs
(even PNs smaller than 3mm were annotated). To the best of our knowledge, this
dataset is the largest cohort with relatively complete annotations for PNs
detection. Our experimental results show that the proposed group-attention SSD
outperforms the classic SSD framework as well as the state-of-the-art 3DCNN,
especially on some challenging lesion types.
","[{""version"":""v1"",""created"":""Tue, 18 Dec 2018 04:41:16 GMT""},{""version"":""v2"",""created"":""Fri, 24 May 2019 02:54:18 GMT""}]","2019-05-27"
