"1812.06999","Byungmin Kang","Byungmin Kang, Ken Shiozaki, and Gil Young Cho","Many-Body Order Parameters for Multipoles in Solids","Added discussions on Bosonic systems and C4-symmetric insulators;
  Main Text: 6 pages, 3 figures. Supplemental Material: 15 pages, 10 figures","Phys. Rev. B 100, 245134 (2019)","10.1103/PhysRevB.100.245134",,"cond-mat.str-el","http://arxiv.org/licenses/nonexclusive-distrib/1.0/","  We propose many-body order parameters for bulk multipoles in crystalline
systems, which originate from the non-trivial topology of the nested Wilson
loop spectrum. The many-body order parameters are designed to measure
multipolar charge distribution in a crystalline unit cell, and they match the
localized corner charge originating from the multipoles. We provide analytic
arguments and numerical proof for the order parameters. Furthermore, we show
that the many-body order parameters faithfully measure the physical multipole
moments even when the symmetries quantizing multipoles are lost and thus the
nested Wilson loop spectrum does not exactly reproduce the physical multipole
moments.
","[{""version"":""v1"",""created"":""Mon, 17 Dec 2018 19:01:07 GMT""},{""version"":""v2"",""created"":""Fri, 28 Dec 2018 06:10:43 GMT""},{""version"":""v3"",""created"":""Sun, 17 Feb 2019 10:01:06 GMT""},{""version"":""v4"",""created"":""Sun, 10 Mar 2019 12:19:07 GMT""}]","2019-12-25"
"1812.07000","Daniel Egana-Ugrinovic","Jae Hyeok Chang, Daniel Egana-Ugrinovic, Rouven Essig and Chris
  Kouvaris","Structure Formation and Exotic Compact Objects in a Dissipative Dark
  Sector","55 pages, 12 figures, 4 appendices",,"10.1088/1475-7516/2019/03/036",,"hep-ph astro-ph.GA astro-ph.SR","http://arxiv.org/licenses/nonexclusive-distrib/1.0/","  We present the complete history of structure formation in a simple
dissipative dark-sector model. The model has only two particles: a dark
electron, which is a subdominant component of dark matter, and a dark photon.
Dark-electron perturbations grow from primordial overdensities, become
non-linear, and form dense dark galaxies. Bremsstrahlung cooling leads to
fragmentation of the dark-electron halos into clumps that vary in size from a
few to millions of solar masses, depending on the particle model parameters. In
particular, we show that asymmetric dark stars and black holes form within the
Milky Way from the collapse of dark electrons. These exotic compact objects may
be detected and their properties measured at new high-precision astronomical
observatories, giving insight into the particle nature of the dark sector
without the requirement of non-gravitational interactions with the visible
sector.
","[{""version"":""v1"",""created"":""Mon, 17 Dec 2018 19:03:59 GMT""}]","2019-04-03"
"1812.07001","Sven De Rijcke","Sven De Rijcke, Jean-Baptiste Fouvry, and Walter Dehnen","How gravitational softening affects galaxy stability I. Linear mode
  analysis of disc galaxies","14 pages, 7 figures, submitted to MNRAS",,"10.1093/mnras/stz309",,"astro-ph.GA","http://arxiv.org/licenses/nonexclusive-distrib/1.0/","  Linear perturbation is used to investigate the effect of gravitational
softening on the retrieved two-armed spiral eigenmodes of razor-thin stellar
discs.
  We explore four softening kernels with different degrees of gravity bias, and
with/without compact support (compact in the sense that they yield exactly
Newtonian forces outside the softening kernel). These kernels are applied to
two disc galaxy models with well-known unsoftened unstable modes. We illustrate
quantitatively the importance of a vanishing linear gravity bias to yield
accurate frequency estimates of the unstable modes. As such, Plummer softening,
while very popular amongst simulators, performs poorly in our tests.
  The best results, with excellent agreement between the softened and
unsoftened mode properties, are obtained with softening kernels that have a
reduced gravity bias, obtained by compensating for the sub-Newtonian forces at
small interparticle distances with slightly super-Newtonian forces at radii
near the softening length. We present examples of such kernels that, moreover,
are analytically simple and computationally cheap. Finally, these results light
the way to the construction of softening methods with even smaller gravity
bias, although at the price of increasingly complex kernels.
","[{""version"":""v1"",""created"":""Mon, 17 Dec 2018 19:04:09 GMT""}]","2019-02-27"
"1812.07002","Sven De Rijcke","Sven De Rijcke, Jean-Baptiste Fouvry, and Christophe Pichon","Instabilities in disc galaxies: from noise to grooves to spirals","11 pages, 7 figures, submitted to MNRAS",,"10.1093/mnras/stz166",,"astro-ph.GA","http://arxiv.org/licenses/nonexclusive-distrib/1.0/","  Using the linearized Boltzmann equation, we investigate how grooves carved in
the phase space of a half-mass Mestel disc can trigger the vigorous growth of
two-armed spiral eigenmodes. Such grooves result from the collisional dynamics
of a disc subject to finite-N shot noise, as swing-amplified noise patterns
push stars towards lower-angular momentum orbits at their inner Lindblad
radius. Supplementing the linear theory with analytical arguments, we show that
the dominant spiral mode is a cavity mode with reflections off the forbidden
region around corotation and off the deepest groove. Other subdominant modes
are identified as groove modes. We provide evidence that the depletion of
near-circular orbits, and not the addition of radial orbits, is the crucial
physical ingredient that causes these new eigenmodes.
  Thus, it is possible for an isolated, linearly stable stellar disc to
spontaneously become linearly unstable via the self-induced formation of
phase-space grooves through finite-N dynamics. These results may help explain
the growth and maintenance of spiral patterns in real disc galaxies.
","[{""version"":""v1"",""created"":""Mon, 17 Dec 2018 19:04:10 GMT""}]","2019-01-23"
"1812.07003","Ji Hou","Ji Hou, Angela Dai, Matthias Nie{\ss}ner","3D-SIS: 3D Semantic Instance Segmentation of RGB-D Scans","video: https://youtu.be/IH9rNLD1-JE",,,,"cs.CV","http://arxiv.org/licenses/nonexclusive-distrib/1.0/","  We introduce 3D-SIS, a novel neural network architecture for 3D semantic
instance segmentation in commodity RGB-D scans. The core idea of our method is
to jointly learn from both geometric and color signal, thus enabling accurate
instance predictions. Rather than operate solely on 2D frames, we observe that
most computer vision applications have multi-view RGB-D input available, which
we leverage to construct an approach for 3D instance segmentation that
effectively fuses together these multi-modal inputs. Our network leverages
high-resolution RGB input by associating 2D images with the volumetric grid
based on the pose alignment of the 3D reconstruction. For each image, we first
extract 2D features for each pixel with a series of 2D convolutions; we then
backproject the resulting feature vector to the associated voxel in the 3D
grid. This combination of 2D and 3D feature learning allows significantly
higher accuracy object detection and instance segmentation than
state-of-the-art alternatives. We show results on both synthetic and real-world
public benchmarks, achieving an improvement in mAP of over 13 on real-world
data.
","[{""version"":""v1"",""created"":""Mon, 17 Dec 2018 19:04:31 GMT""},{""version"":""v2"",""created"":""Tue, 23 Apr 2019 09:44:43 GMT""},{""version"":""v3"",""created"":""Mon, 29 Apr 2019 14:18:55 GMT""}]","2019-04-30"
"1812.07004","Shohei Okawa","Junichiro Kawamura, Shohei Okawa, Yuji Omura, Yong Tang","WIMP dark matter in the parity solution to the strong CP problem","35 pages, 5 figures, v2: references added, version published in JHEP","JHEP 1904 (2019) 162","10.1007/JHEP04(2019)162",,"hep-ph hep-ex","http://arxiv.org/licenses/nonexclusive-distrib/1.0/","  We extend the Standard Model (SM) with parity symmetry, motivated by the
strong CP problem and dark matter. In our model, parity symmetry is conserved
at high energy by introducing a mirror sector with the extra gauge symmetry, $
SU(2)_R \times U(1)_R$. The charges of $SU(2)_R \times U(1)_R$ are assigned to
the mirror fields in the same way as in the SM, but the chiralities of the
mirror fermions are opposite to respect the parity symmetry. The strong CP
problem is resolved, since the mirror quarks are also charged under the
$SU(3)_c$ in the SM. In the minimal setup, the mirror gauge symmetry leads to
stable colored particles which would be inconsistent with the observed data, so
that we introduce two scalars in order to deplete the stable colored particles.
Interestingly, one of the scalars becomes stable because of the gauge symmetry
and therefore can be a good dark matter candidate. We especially study the
phenomenology relevant to the dark matter, i.e. thermal relic density, direct
and indirect searches for the dark matter. The bounds from the LHC experiment
and the Landau pole are also taken into account. As a result, we find that a
limited region is viable: the mirror up quark mass is around [600\,GeV, 3\,TeV]
and the relative mass difference between the dark matter and the mirror up
quark or electron is about ${\cal O}$(1-10\,\%). We also discuss the neutrino
sector and show that the right-handed neutrinos in the mirror sector can
increase the effective number of neutrinos or dark radiation by $0.14$.
","[{""version"":""v1"",""created"":""Mon, 17 Dec 2018 19:05:26 GMT""},{""version"":""v2"",""created"":""Tue, 14 May 2019 02:20:44 GMT""}]","2019-05-15"
"1812.07005","Wenbo Wang","Wenbo Wang, Matthew W. Daniels, Zhaoliang Liao, Yifan Zhao, Jun Wang,
  Gertjan Koster, Guus Rijnders, Cui-zu Chang, Di Xiao, and Weida Wu","Spin chirality fluctuation in two-dimensional ferromagnets with
  perpendicular anisotropy","accepted by nature materials","Nat. Mater. 18, 1054-1059 (2019)","10.1038/s41563-019-0454-9",,"cond-mat.mtrl-sci cond-mat.str-el","http://arxiv.org/licenses/nonexclusive-distrib/1.0/","  Non-coplanar spin textures with scalar spin chirality can generate effective
magnetic field that deflects the motion of charge carriers, resulting in
topological Hall effect (THE), a powerful probe of the ground state and
low-energy excitations of correlated systems. However, spin chirality
fluctuation in two-dimensional ferromagnets with perpendicular anisotropy has
not been considered in prior studies. Herein, we report direct evidence of
universal spin chirality fluctuation by probing the THE above the transition
temperatures in two different ferromagnetic ultra-thin films, SrRuO$_3$ and V
doped Sb$_2$Te$_3$. The temperature, magnetic field, thickness, and carrier
type dependences of the THE signal, along with our Monte-Carlo simulations,
unambiguously demonstrate that the spin chirality fluctuation is a universal
phenomenon in two-dimensional Ising ferromagnets. Our discovery opens a new
paradigm of exploring the spin chirality with topological Hall transport in
two-dimensional magnets and beyond
","[{""version"":""v1"",""created"":""Mon, 17 Dec 2018 19:06:16 GMT""},{""version"":""v2"",""created"":""Fri, 19 Jul 2019 01:33:19 GMT""}]","2019-12-16"
"1812.07006","Athanasios Kapoyannis","N. G. Antoniou, F. K. Diakonos and A. S. Kapoyannis","Chiral QCD phase in equilibrium with Hadron Gas and the location of the
  critical point","40 pages, 17 figures. In version 2 we use lattice QCD calculations at
  zero baryon density below the critical temperature to fit hadronic volumes.
  We present three models for hadronic volumes, one of which utilizes different
  volumes for mesons and baryons. We further constrain the region compatible
  with a critical point and introduce an additional criterion for the location
  of the critical point",,,,"nucl-th hep-ph","http://arxiv.org/licenses/nonexclusive-distrib/1.0/","  We develop a description of the equation of state of QCD matter with restored
chiral symmetry, which is in thermal and chemical equilibrium with the hadronic
phase. The hadron gas is described with self-consistent volume corrections. The
chiral phase is composed of a group of few quark condensates, each of which
corresponds to a family of hadrons with specific quark content. Between the two
phases and along the chemical freeze-out curve we apply the requirement of
conservation of particle numbers per family. We use lattice calculations for
temperatures lower than the critical one to determine hadronic volumes. We find
that the pion system plays decisive role in the shift of the transition from
higher order (crossover) to first order. For three volume models we calculate
the position of the critical point as function of critical temperature $T_c$ at
vanishing baryon density. Particularly, in a model with different radii for
mesons and baryons --if we additionally impose the equality between the
densities of quarks contained in mesons and baryons-- we find a critical point
residing at $\mu_B \simeq$ 266 MeV and $T \simeq$ 152 MeV which corresponds to
$T_c \simeq$ 161 MeV.
","[{""version"":""v1"",""created"":""Mon, 17 Dec 2018 19:08:25 GMT""},{""version"":""v2"",""created"":""Thu, 19 Nov 2020 18:48:02 GMT""}]","2020-11-20"
"1812.07007","John Chambers","John E Chambers","Symplectic Integrators: T + V Revisited and Round-Off Reduced","Accepted for publication in Monthly Notices of the Royal Astronomical
  Society",,"10.1093/mnras/sty3447",,"astro-ph.IM physics.comp-ph","http://arxiv.org/licenses/nonexclusive-distrib/1.0/","  Symplectic integrators separate a problem into parts that can be solved in
isolation, alternately advancing these sub-problems to approximate the
evolution of the complete system. Problems with a single, dominant mass can use
mixed-variable symplectic (MVS) integrators that separate the problem into
Keplerian motion of satellites about the primary, and satellite-satellite
interactions. Here, we examine T+V algorithms where the problem is separated
into kinetic T and potential energy V terms. T+V integrators are typically less
efficient than MVS algorithms. This difference is reduced by using different
step sizes for primary-satellite and satellite-satellite interactions. The T+V
method is improved further using 4th and 6th-order algorithms that include
force gradients and symplectic correctors. We describe three 6th-order
algorithms, containing 2 or 3 force evaluations per step, that are competitive
with MVS in some cases. Round-off errors for T+V integrators can be reduced by
several orders of magnitude, at almost no computational cost, using a simple
modification that keeps track of accumulated changes in the coordinates and
momenta. This makes T+V algorithms desirable for long-term, high-accuracy
calculations.
","[{""version"":""v1"",""created"":""Mon, 17 Dec 2018 19:11:12 GMT""}]","2018-12-26"
