"1804.02021","Aliaksei Charnukha","A. Charnukha, D. Pr\""opper, N. D. Zhigadlo, M. Naito, M. Schmidt, Z.
  Wang, J. Deisenhofer, A. Loidl, B. Keimer, A. V. Boris, D. N. Basov","Intrinsic charge dynamics in high-Tc AFeAs(O,F) superconductors","Revised version and supplementary material published in Phys. Rev.
  Lett. (see
  https://journals.aps.org/prl/abstract/10.1103/PhysRevLett.120.087001)","Phys. Rev. Lett. 120, 087001 (2018)","10.1103/PhysRevLett.120.087001",,"cond-mat.supr-con cond-mat.str-el","http://arxiv.org/licenses/nonexclusive-distrib/1.0/","  We report the first determination of the in-plane complex optical
conductivity of 1111 high-Tc superconducting iron oxypnictide single crystals
PrFeAsO0.6F0.35 and thin films SmFeAsO1-xFx by means of bulk-sensitive
conventional and micro-focused infrared spectroscopy, ellipsometry, and
time-domain THz transmission spectroscopy. A strong itinerant contribution is
found to exhibit a dramatic difference in coherence between the crystal and the
film. Using extensive temperature-dependent measurements of THz transmission we
identify a previously undetected 2.5-meV collective mode in the optical
conductivity of SmFeAs(O,F), which is strongly suppressed at Tc and experiences
an anomalous T-linear softening and narrowing below T*=110K>>Tc. The
suppression of the infrared absorption in the superconducting state reveals a
large optical superconducting gap with a similar gap ratio 2D=kBTc=7 in both
materials, indicating strong pairing.
","[{""version"":""v1"",""created"":""Thu, 5 Apr 2018 18:44:37 GMT""}]","2018-04-09"
"1804.02022","Kaustav Chakraborty","Kaustav Chakraborty, K.N. Deepthi, Srubabati Goswami, Anjan S.
  Joshipura, Newton Nath","Exploring Partial $\mu$-$\tau$ Reflection Symmetry at DUNE and
  Hyper-Kamiokande","10 pages, 17 figures, Updated to the published version","Phys. Rev. D 98, 075031 (2018)","10.1103/PhysRevD.98.075031",,"hep-ph","http://arxiv.org/licenses/nonexclusive-distrib/1.0/","  We study origin, consequences and testability of a hypothesis of `partial
$\mu$-$\tau$' reflection symmetry. This symmetry predicts $ |U_{\mu
i}|=|U_{\tau i}|~(i=1,2,3) $ for a single column of the leptonic mixing matrix
$U$. Depending on whether this symmetry holds for the first or second column of
$U$ different correlations between $\theta_{23}$ and $ \delta_{CP} $ can be
obtained. This symmetry can be obtained using discrete flavour symmetries. In
particular, all the subgroups of SU(3) with 3-dimensional irreducible
representation which are classified as class C or D can lead to partial
$\mu$-$\tau$ reflection symmetry. We show how the predictions of this symmetry
compare with the allowed area in the $\sin^2\theta_{23} - \delta_{CP}$ plane as
obtained from the global analysis of neutrino oscillation data. Furthermore, we
study the possibility of testing these symmetries at the proposed DUNE and
Hyper-Kamiokande (HK) experiments (T2HK, T2HKK), by incorporating the
correlations between $\theta_{23}$ and $ \delta_{CP}$ predicted by the
symmetries. We find that when simulated data of DUNE and HK is fitted with the
symmetry predictions, the $\theta_{23}-\delta_{CP}$ parameter space gets
largely restricted near the CP conserving values of $ \delta_{CP} $. Finally,
we illustrate the capability of these experiments to distinguish between the
two cases leading to partial $\mu-\tau$ symmetry namely $|U_{\mu1}| = |U_{\tau
1}|$ and $|U_{\mu 2}| = |U_{\tau 2}|$.
","[{""version"":""v1"",""created"":""Thu, 5 Apr 2018 18:45:46 GMT""},{""version"":""v2"",""created"":""Fri, 8 Feb 2019 09:07:31 GMT""}]","2019-02-11"
"1804.02023","Olof Ohlsson Sax","Olof Ohlsson Sax and Bogdan Stefanski","Closed Strings and Moduli in $AdS_3/CFT_2$","37 pages; v2: added references, corrected typos; v3: published
  version",,,"NORDITA 2018-027","hep-th","http://arxiv.org/licenses/nonexclusive-distrib/1.0/","  String theory on $AdS_3 \times S^3 \times T^4$ has 20 moduli. We investigate
how the perturbative closed string spectrum changes as we move around this
moduli space in both the RR and NSNS flux backgrounds. We find that, at weak
string coupling, only four of the moduli affect the energies. In the RR
background the only effect of these moduli is to change the radius of curvature
of the background. On the other hand, in the NSNS background, the moduli
introduce worldsheet interactions which enable the use of integrability methods
to solve the spectral problem. Our results show that the worldsheet theory is
integrable across the 20 dimensional moduli space.
","[{""version"":""v1"",""created"":""Thu, 5 Apr 2018 18:51:04 GMT""},{""version"":""v2"",""created"":""Mon, 16 Apr 2018 09:39:48 GMT""},{""version"":""v3"",""created"":""Tue, 22 May 2018 11:56:13 GMT""}]","2018-05-23"
"1804.02024","Lukas Neumeier","Lukas Neumeier, Darrick E. Chang","Exploring unresolved sideband, optomechanical strong coupling using a
  single atom coupled to a cavity","31 pages, 12 figures",,"10.1088/1367-2630/aad497",,"quant-ph","http://arxiv.org/licenses/nonexclusive-distrib/1.0/","  A major trend within the field of cavity QED is to boost the interaction
strength between the cavity field and the atomic internal degrees of freedom of
the trapped atom by decreasing the mode volume of the cavity. In such systems,
it is natural to achieve strong atom-cavity coupling, where the coherent
interaction strength exceeds the cavity linewidth, while the linewidth exceeds
the atomic trap frequency. While most work focuses on coupling of photons to
the internal degrees of freedom, additional rich dynamics can occur by
considering the atomic motional degree of freedom as well. In particular, we
show that such a system is a natural candidate to explore an interesting regime
of quantum optomechanics, where the zero-point atomic motion yields a cavity
frequency shift larger than its linewidth (so-called single-photon
optomechanical strong coupling), but simultaneously where the motional
frequency cannot be resolved by the cavity. We show that this regime can result
in a number of remarkable phenomena, such as strong entanglement between the
atomic wave-function and the scattering properties of single incident photons,
or an anomalous mechanism where the atomic motion can significantly heat up due
to single-photon scattering, even if the atom is trapped tightly within the
Lamb-Dicke limit.
","[{""version"":""v1"",""created"":""Thu, 5 Apr 2018 18:51:57 GMT""}]","2018-08-29"
"1804.02025","Philip Dufton","P.L. Dufton, A. Thompson, P. A. Crowther, C. J. Evans, F.R.N.
  Schneider, A. de Koter, S. E. de Mink, R. Garland, N. Langer, D. J. Lennon,
  C. M. McEvoy, O.H. Ram\'irez-Agudelo, H. Sana, S. S\'imon D\'iaz, W. D.
  Taylor, J. S. Vink","The VLT-FLAMES Tarantula Survey: XXVIII. Nitrogen abundances for
  apparently single dwarf and giant B-type stars with small projected
  rotational velocities","Accepted in Astronomy and Astrophyics. Abstract significantly
  shortened - see paper for full abstract","A&A 615, A101 (2018)","10.1051/0004-6361/201732440",,"astro-ph.SR","http://arxiv.org/licenses/nonexclusive-distrib/1.0/","  Previous analyses of the spectra of OB-type stars in the Magellanic Clouds
have identified targets with low projected rotational velocities and relatively
high nitrogen abundances. The VFTS obtained spectroscopy for B-type 434 stars.
We have estimated atmospheric parameters and nitrogen abundances using TLUSTY
model atmospheres for 54 B-type targets that appear to be single, have
projected rotational velocities <80 \kms and were not classified as
supergiants. In addition, nitrogen abundances for 34 similar stars from a
previous survey have been re-evaluated. Approximately 75-80% of the targets
have nitrogen enhancements of less than 0.3 dex, consistent with them having
experienced only small amounts of mixing. However, stars with low projected
rotational velocities <40 \kms and significant nitrogen enrichments are found
in both our samples and simulations imply that these cannot all be rapidly
rotating objects observed near pole-on. Adopting an enhancement threshold of
0.6 dex, we observed five stars, yet stellar evolution models with rotation
predict only 1.25$\pm$1.11 for random stellar viewing inclinations. The excess
of such objects is estimated to be 20-30% of all stars with current rotational
velocities of less than 40 \kms and 2-4% of the total single B-type sample.
These estimates constitute lower limits for stars that appear inconsistent with
current grids of stellar evolutionary models. Including targets with smaller
nitrogen enhancements of greater than 0.2 dex implies larger percentages of
targets that are inconsistent with current evolutionary models, viz. 70% of the
stars with rotational velocities less than 40 \kms and 6-8% of the total single
stellar population. We consider possible explanations of which the most
promising would appear to be breaking due to magnetic fields or stellar mergers
with subsequent magnetic braking.
","[{""version"":""v1"",""created"":""Thu, 5 Apr 2018 19:01:07 GMT""}]","2018-07-25"
"1804.02026","Marcus Waurick","Marcus Waurick","Nonlocal $H$-convergence","typos removed; accepted for publication in Calculus of Variations and
  Partial Differential Equations",,"10.1007/s00526-018-1436-5",,"math.AP math.FA","http://arxiv.org/licenses/nonexclusive-distrib/1.0/","  We introduce the concept of nonlocal $H$-convergence. For this we employ the
theory of abstract closed complexes of operators in Hilbert spaces. We show
uniqueness of the nonlocal $H$-limit as well as a corresponding compactness
result. Moreover, we provide a characterisation of the introduced concept,
which implies that local and nonlocal $H$-convergence coincide for
multiplication operators. We provide applications to both nonlocal and
nonperiodic fully time-dependent 3D Maxwell's equations on rough domains. The
material law for Maxwell's equations may also rapidly oscillate between eddy
current type approximations and their hyperbolic non-approximated counter
parts. Applications to models in nonlocal response theory used in quantum
theory and the description of meta-materials, to fourth order elliptic problems
as well as to homogenisation problems on Riemannian manifolds are provided.
","[{""version"":""v1"",""created"":""Thu, 5 Apr 2018 19:16:03 GMT""},{""version"":""v2"",""created"":""Wed, 6 Jun 2018 15:56:06 GMT""},{""version"":""v3"",""created"":""Wed, 25 Jul 2018 16:18:57 GMT""},{""version"":""v4"",""created"":""Fri, 27 Jul 2018 14:11:52 GMT""},{""version"":""v5"",""created"":""Wed, 26 Sep 2018 16:46:10 GMT""}]","2018-09-27"
"1804.02027","Xiaojiang Du","Zhijian Lin, Xiaojiang Du, Hsiao-Hwa Chen, Bo Ai, Zhifeng Chen, Dapeng
  Wu","Millimeter-Wave Propagation Modeling and Measurement",,,,,"eess.SP","http://arxiv.org/licenses/nonexclusive-distrib/1.0/","  Millimeter wave (mmWave) communication is one of the most promising
technologies in fifth generation (5G) mobile networks due to its access to a
large amount of available spectrum resources. Despite the theoretical potential
of a high data rate, there are still several key technical challenges with
using mmWave in mobile networks, such as severe pathloss, high penetration
loss, narrow beamwidth, etc. Hence, accurate and reliable knowledge of mmWave
channel propagation characteristics is essential for developing 5G wireless
communication systems. In this article, the fundamental characteristics of
mmWave are first presented. Then, two main channel modeling methods are
discussed. Finally, in order to investigate the channel characteristics at the
mmWave band, measurement campaigns using three different large-scale array
topologies are carried out and the typical channel parameters are extracted and
analyzed.
","[{""version"":""v1"",""created"":""Thu, 5 Apr 2018 19:17:35 GMT""}]","2018-04-09"
"1804.02028","Nelson Leung","N. Leung, Y. Lu, S. Chakram, R.K. Naik, N. Earnest, R. Ma, K. Jacobs,
  A. N. Cleland, D. I. Schuster","Deterministic Bidirectional Communication and Remote Entanglement
  Generation Between Superconducting Quantum Processors",,,,,"quant-ph cond-mat.mes-hall cond-mat.supr-con","http://arxiv.org/licenses/nonexclusive-distrib/1.0/","  We propose and experimentally demonstrate a simple and efficient scheme for
photonic communication between two remote superconducting modules. Each module
consists of a random access quantum information processor with eight-qubit
multimode memory and a single flux tunable transmon. The two processor chips
are connected through a one-meter long coaxial cable that is coupled to a
dedicated ""communication"" resonator on each chip. The two communication
resonators hybridize with a mode of the cable to form a dark ""communication
mode"" that is highly immune to decay in the coaxial cable. We modulate the
transmon frequency via a parametric drive to generate sideband interactions
between the transmon and the communication mode. We demonstrate bidirectional
single-photon transfer with a success probability exceeding 60 %, and generate
an entangled Bell pair with a fidelity of 79.3 $\pm$ 0.3 %.
","[{""version"":""v1"",""created"":""Thu, 5 Apr 2018 19:20:32 GMT""}]","2018-04-09"
"1804.02029","Georgy Scholten","Georgy Scholten, Cynthia Vinzant","Semi-inverted linear spaces and an analogue of the broken circuit
  complex","16 pages, 1 figure, minor revisions and added connections to the
  external activity complex of a matroid",,,,"math.CO math.AC math.AG","http://arxiv.org/licenses/nonexclusive-distrib/1.0/","  The image of a linear space under inversion of some coordinates is an affine
variety whose structure is governed by an underlying hyperplane arrangement. In
this paper, we generalize work by Proudfoot and Speyer to show that circuit
polynomials form a universal Groebner basis for the ideal of polynomials
vanishing on this variety. The proof relies on degenerations to the
Stanley-Reisner ideal of a simplicial complex determined by the underlying
matroid. If the linear space is real, then the semi-inverted linear space is
also an example of a hyperbolic variety, meaning that all of its intersection
points with a large family of linear spaces are real.
","[{""version"":""v1"",""created"":""Thu, 5 Apr 2018 19:22:41 GMT""},{""version"":""v2"",""created"":""Thu, 6 Jun 2019 21:55:29 GMT""}]","2019-06-10"
"1804.02030","Fernando Teixeira","Dong-Yeop Na, Ben-Hur V. Borges, Fernando L. Teixeira","Finite Element Time-Domain Body-of-Revolution Maxwell Solver based on
  Discrete Exterior Calculus","42 pages, 19 figures","Journal of Computational Physics, vol. 376, pp. 249-275, 2019","10.1016/j.jcp.2018.09.024",,"physics.comp-ph math.NA physics.class-ph","http://arxiv.org/licenses/nonexclusive-distrib/1.0/","  We present a finite-element time-domain (FETD) Maxwell solver for the
analysis of body-of-revolution (BOR) geometries based on discrete exterior
calculus (DEC) of differential forms and transformation optics (TO) concepts.
We explore TO principles to map the original 3-D BOR problem to a 2-D one in
the meridian plane based on a Cartesian coordinate system where the cylindrical
metric is fully embedded into the constitutive properties of an effective
inhomogeneous and anisotropic medium that fills the domain. The proposed solver
uses a TE/TM field decomposition and an appropriate set of DEC-based basis
functions on an irregular grid discretizing the meridian plane. A symplectic
time discretization based on a leap-frog scheme is applied to obtain the
full-discrete marching-on-time algorithm. We validate the algorithm by
comparing the numerical results against analytical solutions for resonant
fields in cylindrical cavities and against pseudo-analytical solutions for
fields radiated by cylindrically symmetric antennas in layered media. We also
illustrate the application of the algorithm for a particle-in-cell (PIC)
simulation of beam-wave interactions inside a high-power backward-wave
oscillator.
","[{""version"":""v1"",""created"":""Thu, 5 Apr 2018 19:27:13 GMT""},{""version"":""v2"",""created"":""Fri, 14 Sep 2018 15:52:07 GMT""},{""version"":""v3"",""created"":""Tue, 25 Sep 2018 15:02:38 GMT""}]","2018-10-08"
"1804.02031","Ivan Kobyzev","Ivan Kobyzev and Ilya Shapiro","Anti-Yetter-Drinfeld Modules for Quasi-Hopf Algebras","This is a follow-up paper to arXiv:1803.09194. Section 3 (definition
  and properties of quasi-Hopf algebra) mostly overlaps","SIGMA 14 (2018), 098, 10 pages","10.3842/SIGMA.2018.098",,"math.KT math.CT math.QA","http://creativecommons.org/licenses/by-sa/4.0/","  We apply categorical machinery to the problem of defining
anti-Yetter-Drinfeld modules for quasi-Hopf algebras. While a definition of
Yetter-Drinfeld modules in this setting, extracted from their categorical
interpretation as the center of the monoidal category of modules has been
given, none was available for the anti-Yetter-Drinfeld modules that serve as
coefficients for a Hopf cyclic type cohomology theory for quasi-Hopf algebras.
This is a followup paper to the authors' previous effort that addressed the
somewhat different case of anti-Yetter-Drinfeld contramodule coefficients in
this and in the Hopf algebroid setting.
","[{""version"":""v1"",""created"":""Thu, 5 Apr 2018 19:27:22 GMT""},{""version"":""v2"",""created"":""Thu, 13 Sep 2018 04:36:46 GMT""}]","2018-09-14"
"1804.02032","Li Sulimowicz Mrs.","Li Sulimowicz, Ishfaq Ahmad, Alexander Aved","A Multi-Layer Approach to Superpixel-based Higher-order Conditional
  Random Field for Semantic Image Segmentation","7pages, 6 figures, 3 tables, an updated version from original
  submission to ICME2018",,,,"cs.CV","http://creativecommons.org/licenses/by-nc-sa/4.0/","  Superpixel-based Higher-order Conditional random fields (SP-HO-CRFs) are
known for their effectiveness in enforcing both short and long spatial
contiguity for pixelwise labelling in computer vision. However, their
higher-order potentials are usually too complex to learn and often incur a high
computational cost in performing inference. We propose an new approximation
approach to SP-HO-CRFs that resolves these problems. Our approach is a
multi-layer CRF framework that inherits the simplicity from pairwise CRFs by
formulating both the higher-order and pairwise cues into the same pairwise
potentials in the first layer. Essentially, this approach provides accuracy
enhancement on the basis of pairwise CRFs without training by reusing their
pre-trained parameters and/or weights. The proposed multi-layer approach
performs especially well in delineating the boundary details (boarders) of
object categories such as ""trees"" and ""bushes"". Multiple sets of experiments
conducted on dataset MSRC-21 and PASCAL VOC 2012 validate the effectiveness and
efficiency of the proposed methods.
","[{""version"":""v1"",""created"":""Thu, 5 Apr 2018 19:31:03 GMT""}]","2018-04-09"
"1804.02033","Sudarshan Bartaula","Ishan Kafle, Sudarshan Bartaula, Afroza Shirin, Isaac Klickstein,
  Pankaz Das and Francesco Sorrentino","Optimal Control of Networks in the presence of Attackers and Defenders",,,"10.1063/1.5030899",,"cs.SY","http://arxiv.org/licenses/nonexclusive-distrib/1.0/","  We consider the problem of a dynamical network whose dynamics is subject to
external perturbations (`attacks') locally applied at a subset of the network
nodes. We assume that the network has an ability to defend itself against
attacks with appropriate countermeasures, which we model as actuators located
at (another) subset of the network nodes. We derive the optimal defense
strategy as an optimal control problem. We see that the network topology, as
well as the distribution of attackers and defenders over the network affect the
optimal control solution and the minimum control energy. We study the optimal
control defense strategy for several network topologies, including chain
networks, star networks, ring networks, and scale free networks.
","[{""version"":""v1"",""created"":""Thu, 5 Apr 2018 19:33:00 GMT""}]","2018-06-13"
"1804.02034","Lorenzo Tentarelli","Lorenzo Tentarelli","On the extensions of the De Giorgi approach to nonlinear hyperbolic
  equations","9 pages, proceeding of conference Bruxelles-Torino Talks in PDEs,
  Turin, May 2-5, 2016","Special Issue for the conference ""BruxellesTurin talks in PDE's""
  held in Turin, May 2-5, 2016, Rend. Semin. Mat. Univ. Politec. Torino 74
  (2016), no. 3-4, 151-160",,,"math.AP","http://arxiv.org/licenses/nonexclusive-distrib/1.0/","  In this talk we present an overview on the extensions of the De Giorgi
approach to general second order nonlinear hyperbolic equations. We start with
an introduction to the original conjecture by E. De Giorgi (De Giorgi '96) and
to its solution by E. Serra and P. Tilli (Serra&Tilli '12). Then, we discuss a
first extension of this idea (Serra&Tilli '16) aimed at investigating a wide
class of homogeneous equations. Finally, we announce a further extension to
nonhomogeneous equations, obtained by the author in collaboration with P. Tilli
(Tentarelli&Tilli '17).
","[{""version"":""v1"",""created"":""Thu, 5 Apr 2018 19:33:34 GMT""}]","2019-02-06"
"1804.02035","Xiaojiang Du","Minghui LiWang, Shijie Dai, Zhibin Gao, Xiaojiang Du, Mohsen Guizani,
  Huaiyu Dai","A Computation Offloading Incentive Mechanism with Delay and Cost
  Constraints under 5G Satellite-ground IoV architecture",,,,,"cs.NI","http://arxiv.org/licenses/nonexclusive-distrib/1.0/","  The 5G Internet of Vehicles has become a new paradigm alongside the growing
popularity and variety of computation-intensive applications with high
requirements for computational resources and analysis capabilities. Existing
network architectures and resource management mechanisms may not sufficiently
guarantee satisfactory Quality of Experience and network efficiency, mainly
suffering from coverage limitation of Road Side Units, insufficient resources,
and unsatisfactory computational capabilities of onboard equipment, frequently
changing network topology, and ineffective resource management schemes. To meet
the demands of such applications, in this article, we first propose a novel
architecture by integrating the satellite network with 5G cloud-enabled
Internet of Vehicles to efficiently support seamless coverage and global
resource management. A incentive mechanism based joint optimization problem of
opportunistic computation offloading under delay and cost constraints is
established under the aforementioned framework, in which a vehicular user can
either significantly reduce the application completion time by offloading
workloads to several nearby vehicles through opportunistic vehicle-to-vehicle
channels while effectively controlling the cost or protect its own profit by
providing compensated computing service. As the optimization problem is
non-convex and NP-hard, simulated annealing based on the Markov Chain Monte
Carlo as well as the metropolis algorithm is applied to solve the optimization
problem, which can efficaciously obtain both high-quality and cost-effective
approximations of global optimal solutions. The effectiveness of the proposed
mechanism is corroborated through simulation results.
","[{""version"":""v1"",""created"":""Thu, 5 Apr 2018 19:33:59 GMT""}]","2018-04-09"
"1804.02036","Yuankan Fang","Y. Fang, S. Ran, W. Xie, M. B. Maple","Observation of transition from semiconducting to metallic ground state
  in high-quality single crystalline FeSi",,,,,"cond-mat.mtrl-sci","http://arxiv.org/licenses/nonexclusive-distrib/1.0/","  We report anomalous physical properties of single-crystalline FeSi over a
wide temperature range 1.8-400 K. X-ray diffraction, specific heat, and
magnetization measurements indicate that the FeSi crystals synthesized in this
study are of high quality with a very low concentration of magnetic impurities
($\sim$0.01$\%$). The electrical resistivity $\rho$($T$) can be described by
activated behavior with an energy gap $\Delta$ = 57 meV between 67 K and 150 K.
At temperatures below 67 K, $\rho$($T$) is significantly lower than an
extrapolation of the activated behavior, and the Hall coefficient and
magneto-resistivity undergo a sign change in this region. At $\sim$19 K, a
transition from semiconducting to metallic-like behavior is observed with
deceasing temperature. Whereas the transition temperature is very robust in a
magnetic field, the magnitude of the resistivity below $\sim$30 K is very
sensitive to magnetic field. There is no indication of a bulk phase transition
or onset of magnetic order in the vicinity of either 67 K or 19 K from specific
heat and magnetic susceptibility measurements. These measurements provide
evidence for a conducting surface state in FeSi at low temperatures.
","[{""version"":""v1"",""created"":""Thu, 5 Apr 2018 19:37:43 GMT""}]","2018-04-09"
"1804.02037","Johannes Knolle","Johannes Knolle and Roderich Moessner","A Field Guide to Spin Liquids","17 pages, 3 figures; to appear in Annual Reviews of Condensed Matter
  Physics","Annu. Rev. Condens. Matter Phys. 10, 451-472 (2019)","10.1146/annurev-conmatphys-031218-013401",,"cond-mat.str-el","http://arxiv.org/licenses/nonexclusive-distrib/1.0/","  Spin liquids are collective phases of quantum matter which have eluded
discovery in correlated magnetic materials for over half a century. Theoretical
models of these enigmatic topological phases are no longer in short supply. In
experiment there also exist plenty of promising candidate materials for their
realisation. One of the central challenges for the clear diagnosis of a spin
liquid has been to connect the two. From that perspective, this review
discusses characteristic features in experiment, resulting from the unusual
properties of spin liquids. This takes us to thermodynamic, spectroscopic,
transport, and other experiments on a search for traces of emergent gauge
fields, spinons, Majorana Fermions and other fractionalised particles.
","[{""version"":""v1"",""created"":""Thu, 5 Apr 2018 19:42:15 GMT""}]","2019-03-28"
