"1804.02127","Noriyoshi Fukaya","Noriyoshi Fukaya, Masahito Ohta","Strong instability of standing waves for nonlinear Schr\""odinger
  equations with attractive inverse power potential","17 pages",,,,"math.AP","http://arxiv.org/licenses/nonexclusive-distrib/1.0/","  We study the strong instability of standing waves $e^{i\omega
t}\phi_\omega(x)$ for nonlinear Schr\""{o}dinger equations with an
$L^2$-supercritical nonlinearity and an attractive inverse power potential,
where $\omega\in\mathbb{R}$ is a frequency, and $\phi_\omega\in
H^1(\mathbb{R}^N)$ is a ground state of the corresponding stationary equation.
Recently, for nonlinear Schr\""odinger equations with a harmonic potential, Ohta
(2018) proved that if
$\partial_\lambda^2S_\omega(\phi_\omega^\lambda)|_{\lambda=1}\le0$, then the
standing wave is strongly unstable, where $S_\omega$ is the action, and
$\phi_\omega^\lambda(x)\mathrel{\mathop:}=\lambda^{N/2}\phi_\omega(\lambda x)$
is the scaling, which does not change the $L^2$-norm. In this paper, we prove
the strong instability under the same assumption as the above-mentioned in
inverse power potential case. Our proof is applicable to nonlinear
Schr\""odinger equations with other potentials such as an attractive Dirac delta
potential.
","[{""version"":""v1"",""created"":""Fri, 6 Apr 2018 04:21:02 GMT""}]","2018-04-09"
"1804.02128","Xiaoyue Li","Xiaoyue Li, Qianlin Ma, Hongfu Yang, Chenggui Yuan","The Numerical Invariant Measure of Stochastic Differential Equations
  With Markovian Switching","23 pages, 4 figures",,,,"math.PR cs.NA math.NA","http://arxiv.org/licenses/nonexclusive-distrib/1.0/","  The existence and uniqueness of the numerical invariant measure of the
backward Euler-Maruyama method for stochastic differential equations with
Markovian switching is yielded, and it is revealed that the numerical invariant
measure converges to the underlying invariant measure in the Wasserstein
metric. Under the polynomial growth condition of drift term the convergence
rate is estimated. The global Lipschitz condition on the drift coefficients
required by Bao et al., 2016 and Yuan et al., 2005 is released. Several
examples and numerical experiments are given to verify our theory.
","[{""version"":""v1"",""created"":""Fri, 6 Apr 2018 04:28:24 GMT""},{""version"":""v2"",""created"":""Thu, 3 Nov 2022 04:26:50 GMT""}]","2022-11-04"
"1804.02129","Masaaki Harada","Masaaki Harada","Singly even self-dual codes of length $24k+10$ and minimum weight $4k+2$","16 pages","Cryptography and Communications (2019) 11:597-608","10.1007/s12095-018-0303-8",,"math.CO cs.IT math.IT","http://arxiv.org/licenses/nonexclusive-distrib/1.0/","  Currently, the existence of an extremal singly even self-dual code of length
$24k+10$ is unknown for all nonnegative integers $k$. In this note, we study
singly even self-dual $[24k+10,12k+5,4k+2]$ codes. We give some restrictions on
the possible weight enumerators of singly even self-dual $[24k+10,12k+5,4k+2]$
codes with shadows of minimum weight at least $5$ for $k=2,3,4,5$. We discuss a
method for constructing singly even self-dual codes with minimal shadow. As an
example, a singly even self-dual $[82,41,14]$ code with minimal shadow is
constructed for the first time. In addition, as neighbors of the code, we
construct singly even self-dual $[82,41,14]$ codes with weight enumerator for
which no singly even self-dual code was previously known to exist.
","[{""version"":""v1"",""created"":""Fri, 6 Apr 2018 04:35:16 GMT""}]","2020-11-20"
"1804.02130","Igor Aharonovich","Kerem Bray, Blake Regan, Aleksandra Trycz, Rodolfo Previdi, Gediminas
  Seniutinas, Kumaravelu Ganesan, Mehran Kianinia, Sejeong Kim, and Igor
  Aharonovich","Single crystal diamond membranes containing germanium vacancy color
  centers",,,,,"physics.optics cond-mat.mtrl-sci quant-ph","http://arxiv.org/licenses/nonexclusive-distrib/1.0/","  Single crystal diamond membranes that host optically active emitters are
highly attractive components for integrated quantum nanophotonics. In this work
we demonstrate bottom-up synthesis of single crystal diamond membranes
containing the germanium vacancy (GeV) color centers. We employ a lift-off
technique to generate the membranes and perform chemical vapour deposition in a
presence of germanium oxide to realize the insitu doping. Finally, we show that
these membranes are suitable for engineering of photonic resonators such as
microring cavities with quality factors of 1500. The robust and scalable
approach to engineer single crystal diamond membranes containing emerging color
centers is a promising pathway for realization of diamond integrated quantum
nanophotonic circuits on a chip.
","[{""version"":""v1"",""created"":""Fri, 6 Apr 2018 04:47:41 GMT""}]","2018-04-09"
"1804.02131","Veer Awana Dr","Rabia Sultana (CSIR-NPL, India), Ganesh Gurjar, and S. Patnaik
  (JNU-India), V.P.S. Awana (CSIR-NPL, India)","Crystal Growth and Characterization of Bulk Sb2Te3Topological Insulator","18 Pages Text + Figs: Accepted Mat. Res. Exp. (May 2018)","Mat. Res. Exp. 5, 046107 (2018)",,,"cond-mat.mtrl-sci cond-mat.str-el cond-mat.supr-con","http://arxiv.org/licenses/nonexclusive-distrib/1.0/","  The Sb2Te3 crystals are grown using the conventional self flux method via
solid state reaction route, by melting constituent elements (Sb and Te) at high
temperature (850 C), followed by slow cooling (2 C per hour).The weak anti
localization (WAL) related low field (2 Tesla) magneto-conductance at low
temperatures (2.5 K and 20 K) has been analysed and discussed using the Hikami-
Larkin - Nagaoka (HLN) model. Summarily, the short letter reports an easy and
versatile method for crystal growth of bulk Sb2Te3 topological insulator (TI)
and its brief physical property characterization.
","[{""version"":""v1"",""created"":""Fri, 6 Apr 2018 04:49:49 GMT""},{""version"":""v2"",""created"":""Thu, 26 Apr 2018 10:14:08 GMT""}]","2018-04-27"
"1804.02132","Aren Heinze","A. N. Heinze, John L. Tonry, Larry Denneau, Heather Flewelling, Brian
  Stalder, Armin Rest, Ken W. Smith, Stephen J. Smartt, and Henry Weiland","A First Catalog of Variable Stars Measured by the Asteroid
  Terrestrial-impact Last Alert System (ATLAS)","Accepted by AJ; gives instructions for querying ATLAS variable star
  database; this new version has nicer lightcurve figures",,"10.3847/1538-3881/aae47f",,"astro-ph.SR","http://arxiv.org/licenses/nonexclusive-distrib/1.0/","  The Asteroid Terrestrial-impact Last Alert System (ATLAS) carries out its
primary planetary defense mission by surveying about 13000 deg^2 at least four
times per night. The resulting data set is useful for the discovery of variable
stars to a magnitude limit fainter than r~18, with amplitudes down to 0.01 mag
for bright objects. Here we present a Data Release One catalog of variable
stars based on analyzing 142 million stars measured at least 100 times in the
first two years of ATLAS operations. Using a Lomb-Scargle periodogram and other
variability metrics, we identify 4.7 million candidate variables which we
analyze in detail. Through Space Telescope Science Institute, we publicly
release lightcurves for all of them, together with a vector of 169
classification features for each star. We do this at the level of unconfirmed
candidate variables in order to provide the community with a large set of
homogeneously analyzed photometry and avoid pre-judging which types of objects
others may find most interesting. We use machine learning to classify the
candidates into fifteen different broad categories based on lightcurve
morphology. About 10% (430,000 stars) pass extensive tests designed to screen
out spurious variability detections: we label these as `probable' variables. Of
these, 230,000 receive specific classifications as eclipsing binaries,
pulsating, Mira-type, or sinusoidal variables: these are the `classified'
variables. New discoveries among the probable variables number more than
300,000, while 150,000 of the classified variables are new, including about
10,000 pulsating variables, 2,000 Mira stars, and 70,000 eclipsing binaries.
","[{""version"":""v1"",""created"":""Fri, 6 Apr 2018 05:01:10 GMT""},{""version"":""v2"",""created"":""Mon, 24 Sep 2018 23:33:51 GMT""},{""version"":""v3"",""created"":""Thu, 4 Oct 2018 05:56:31 GMT""}]","2018-11-07"
"1804.02133","Celeste Damiani","Celeste Damiani, Seiichi Kamada","On the group of ring motions of an H-trivial link","v2: corrected acknowledgements (grant number), and minor typos",,,,"math.GT","http://arxiv.org/licenses/nonexclusive-distrib/1.0/","  In this paper we compute a presentation for the group of ring motions of the
split union of a Hopf link with Euclidean components and a Euclidean circle. A
key part of this work is the study of a short exact sequence of groups of ring
motions of general ring links in $\mathbb{R}^3$. This sequence allowed us to
build the main result from the previously known case of the ring group with one
component, which a particular case of the ring groups studied by Brendle and
Hatcher. This work is a first step towards the computation of a presentation
for groups of motions of H-trivial links with an arbitrary number of
components.
","[{""version"":""v1"",""created"":""Fri, 6 Apr 2018 05:13:38 GMT""},{""version"":""v2"",""created"":""Fri, 18 May 2018 14:48:22 GMT""}]","2018-05-21"
"1804.02134","Naruki Yoshikawa","Naruki Yoshikawa, Kei Terayama, Teruki Honma, Kenta Oono, Koji Tsuda","Population-based de novo molecule generation, using grammatical
  evolution",,"Chemistry Letters, 47(11), 1431-1434 (2018)","10.1246/cl.180665",,"physics.chem-ph q-bio.BM","http://arxiv.org/licenses/nonexclusive-distrib/1.0/","  Automatic design with machine learning and molecular simulations has shown a
remarkable ability to generate new and promising drug candidates. Current
models, however, still have problems in simulation concurrency and molecular
diversity. Most methods generate one molecule at a time and do not allow
multiple simulators to run simultaneously. Additionally, better molecular
diversity could boost the success rate in the subsequent drug discovery
process. We propose a new population-based approach using grammatical evolution
named ChemGE. In our method, a large population of molecules are updated
concurrently and evaluated by multiple simulators in parallel. In docking
experiments with thymidine kinase, ChemGE succeeded in generating hundreds of
high-affinity molecules whose diversity is better than that of known inding
molecules in DUD-E.
","[{""version"":""v1"",""created"":""Fri, 6 Apr 2018 05:22:51 GMT""}]","2018-10-31"
"1804.02135","Kei Akuzawa","Kei Akuzawa, Yusuke Iwasawa, Yutaka Matsuo","Expressive Speech Synthesis via Modeling Expressions with Variational
  Autoencoder","Accepted by Interspeech 2018",,,,"cs.CL cs.SD eess.AS","http://arxiv.org/licenses/nonexclusive-distrib/1.0/","  Recent advances in neural autoregressive models have improve the performance
of speech synthesis (SS). However, as they lack the ability to model global
characteristics of speech (such as speaker individualities or speaking styles),
particularly when these characteristics have not been labeled, making neural
autoregressive SS systems more expressive is still an open issue. In this
paper, we propose to combine VoiceLoop, an autoregressive SS model, with
Variational Autoencoder (VAE). This approach, unlike traditional autoregressive
SS systems, uses VAE to model the global characteristics explicitly, enabling
the expressiveness of the synthesized speech to be controlled in an
unsupervised manner. Experiments using the VCTK and Blizzard2012 datasets show
the VAE helps VoiceLoop to generate higher quality speech and to control the
expressions in its synthesized speech by incorporating global characteristics
into the speech generating process.
","[{""version"":""v1"",""created"":""Fri, 6 Apr 2018 05:27:14 GMT""},{""version"":""v2"",""created"":""Wed, 27 Jun 2018 06:42:35 GMT""},{""version"":""v3"",""created"":""Mon, 11 Feb 2019 09:41:22 GMT""}]","2019-02-12"
"1804.02136","Daichi Takeuchi","Daichi Takeuchi","Blow-ups and the class field theory for curves","19pages","Alg. Number Th. 13 (2019) 1327-1351","10.2140/ant.2019.13.1327",,"math.AG","http://arxiv.org/licenses/nonexclusive-distrib/1.0/","  We propose another proof of the geometric class field theory for curves by
considering blow-ups of symmetric products of curves.
","[{""version"":""v1"",""created"":""Fri, 6 Apr 2018 05:27:33 GMT""}]","2019-08-21"
"1804.02137","Rakesh Kumar","Payal Wadhwa, Shailesh Kumar, T.J. Dhilip Kumar, Alok Shukla, Rakesh
  Kumar","Band Gap tunability in One-dimensional system","10 pages",,,,"cond-mat.mtrl-sci","http://arxiv.org/licenses/nonexclusive-distrib/1.0/","  The ability to tune the gaps of direct bandgap materials has tremendous
potential for applications in the fields of LEDs and solar cells. However, lack
of reproducibility of bandgaps due to quantum confinement observed in
experiments on reduced dimensional materials, severely affects tunability of
their bandgaps. In this letter, we report broad theoretical investigations of
direct bandgap one-dimensional functionalized isomeric system using their
periodic potential profile, where bandgap tunability is demonstrated simply by
modifying the potential profile by changing the position of the functional
group in a periodic supercell. It is verified for known synthetic, as well as
natural polymers (biological and organic), and also for other one-dimensional
direct bandgap systems. This insight would greatly help experimentalists in
designing new isomeric systems of various bandgap values for polymers and
one-dimensional inorganic systems for LEDs applications, and for effectively
harvesting energy in solar cells.
","[{""version"":""v1"",""created"":""Fri, 6 Apr 2018 05:29:30 GMT""}]","2018-04-09"
"1804.02138","Rebin Karaparambil Rajan","Karaparambil Rajan Rebin, Jim Libby, D. Indumathi, Lakshmi S. Mohan","Study of neutrino oscillation parameters at the INO-ICAL detector using
  event-by-event reconstruction",,,"10.1140/epjc/s10052-019-6798-0",,"hep-ex physics.ins-det","http://arxiv.org/licenses/nonexclusive-distrib/1.0/","  We present the reach of the proposed INO-ICAL in measuring the
atmospheric-neutrino-oscillation parameters $\theta_{23}$ and $\Delta m^2_{32}$
using full event-by-event reconstruction for the first time. We also study the
fluctuations in the data and their effect on the precision measurements and
mass-hierarchy analysis for a five-year exposure of the 50 kton ICAL detector.
We find a mean resolution of $\Delta\chi^2 \approx 2.9$, which rules out the
wrong mass hierarchy of the neutrinos with a significance of approximately
$1.7\sigma$. These results are similar to those to presented earlier studies
that approximated the performance of the ICAL detector.
","[{""version"":""v1"",""created"":""Fri, 6 Apr 2018 05:34:36 GMT""}]","2019-04-09"
"1804.02139","Md Shahzamal","Md Shahzamal","Lightweight Mobile Ad-hoc Network Routing Protocols for Smartphones","Research Frontier Report 2015, Dept. of Computing, Macquarie
  University, Australia",,,,"cs.NI","http://creativecommons.org/publicdomain/zero/1.0/","  Mobile Ad-hoc Network (MANET) is one of the promising wireless networking
approaches where a group of wireless devices can establish communication among
themselves without any infrastructure. MANET has successfully been implemented
in the emergency communication, battlefield and Vehicular Ad-hoc Network
(VANET) etc. Recently, MANET has also been studied to establish village level
off-the-grid telephony system using mobile phones (smartphones). As the mobile
phones and other modern electronic devices are increasingly equipped with
efficient wireless Wi-Fi devices, phone based MANET implementation will open
new horizons for off-the-self services for phones as well as IoT
implementations. However, current MANET routing protocols show poor
performances in implementing MANET among mobile phones due to the requirements
of high memory, commutation power and high energy usage. The performance
seriously degrades when the number of phones increases in the network.
Therefore, a lightweight routing protocol is the key requirement for successful
implementation of MANET using mobile phones. This report presents relevant
routing protocol designs and their applicability to develop lightweight MANET
routing protocols for mobile phones. In conclusion, we have presented the
challenges and research directions in this field
","[{""version"":""v1"",""created"":""Fri, 6 Apr 2018 05:42:34 GMT""}]","2018-04-09"
"1804.02140","Christiaan Hattingh","Christiaan J Hattingh","Sums and products of square-zero matrices","Master of science dissertation, accepted at the University of South
  Africa. 179 numbered pages",,,,"math.RA","http://arxiv.org/licenses/nonexclusive-distrib/1.0/","  Which matrices can be written as sums or products of square-zero matrices?
This question is the central premise of this dissertation. Over the past 25
years a significant body of research on products and linear combinations of
square-zero matrices has developed, and it is the aim of this study to present
this body of research in a consolidated, holistic format, that could serve as a
theoretical introduction to the subject. The content of the research is
presented in three parts: first results within the broader context of sums and
products of nilpotent matrices are discussed, then products of square-zero
matrices, and finally sums of square-zero matrices.
","[{""version"":""v1"",""created"":""Fri, 6 Apr 2018 05:59:11 GMT""}]","2018-04-09"
"1804.02141","Alexander Sokolov","Andreas V. Copan, Alexander Yu. Sokolov","Linear-response density cumulant theory for excited electronic states",,"A.V. Copan and A.Y. Sokolov, J. Chem. Theory Comput. 14, 4097
  (2018)",,,"physics.chem-ph","http://arxiv.org/licenses/nonexclusive-distrib/1.0/","  We present a linear-response formulation of density cumulant theory (DCT)
that provides a balanced and accurate description of many electronic states
simultaneously. In the original DCT formulation, only information about a
single electronic state (usually, the ground state) is obtained. We discuss the
derivation of linear-response DCT, present its implementation for the ODC-12
method (LR-ODC-12), and benchmark its performance for excitation energies in
small molecules (N$_2$, CO, HCN, HNC, C$_2$H$_2$, and H$_2$CO), as well as
challenging excited states in ethylene, butadiene, and hexatriene. For small
molecules, LR-ODC-12 shows smaller mean absolute errors in excitation energies
than equation-of-motion coupled cluster theory with single and double
excitations (EOM-CCSD), relative to the reference data from EOM-CCSDT. In a
study of butadiene and hexatriene, LR-ODC-12 correctly describes the relative
energies of the singly-excited $1^1\mathrm{B_{u}}$ and the doubly-excited
$2^1\mathrm{A_{g}}$ states, in excellent agreement with highly accurate
semistochastic heat-bath configuration interaction results, while EOM-CCSD
overestimates the energy of the $2^1\mathrm{A_{g}}$ state by almost 1 eV. Our
results demonstrate that linear-response DCT is a promising theoretical
approach for excited states of molecules.
","[{""version"":""v1"",""created"":""Fri, 6 Apr 2018 06:01:45 GMT""},{""version"":""v2"",""created"":""Mon, 21 May 2018 16:11:07 GMT""},{""version"":""v3"",""created"":""Fri, 7 Sep 2018 16:18:14 GMT""}]","2018-09-10"
"1804.02142","Xun Xu","Xun Xu, Loong-Fah Cheong, Zhuwen Li","Motion Segmentation by Exploiting Complementary Geometric Models","CVPR 2018",,,,"cs.CV","http://arxiv.org/licenses/nonexclusive-distrib/1.0/","  Many real-world sequences cannot be conveniently categorized as general or
degenerate; in such cases, imposing a false dichotomy in using the fundamental
matrix or homography model for motion segmentation would lead to difficulty.
Even when we are confronted with a general scene-motion, the fundamental matrix
approach as a model for motion segmentation still suffers from several defects,
which we discuss in this paper. The full potential of the fundamental matrix
approach could only be realized if we judiciously harness information from the
simpler homography model. From these considerations, we propose a multi-view
spectral clustering framework that synergistically combines multiple models
together. We show that the performance can be substantially improved in this
way. We perform extensive testing on existing motion segmentation datasets,
achieving state-of-the-art performance on all of them; we also put forth a more
realistic and challenging dataset adapted from the KITTI benchmark, containing
real-world effects such as strong perspectives and strong forward translations
not seen in the traditional datasets.
","[{""version"":""v1"",""created"":""Fri, 6 Apr 2018 06:04:45 GMT""}]","2018-04-09"
"1804.02143","Thibault Lefeuvre","Thibault Lefeuvre","Local marked boundary rigidity under hyperbolic trapping assumptions","18 pages, 1 figure",,,,"math.AP math.DG math.DS","http://arxiv.org/licenses/nonexclusive-distrib/1.0/","  Under the assumption that the X-ray transform over symmetric solenoidal
2-tensors is injective, we prove that smooth compact connected manifolds with
strictly convex boundary, no conjugate points and a hyperbolic trapped set are
locally marked boundary rigid.
","[{""version"":""v1"",""created"":""Fri, 6 Apr 2018 06:09:39 GMT""},{""version"":""v2"",""created"":""Wed, 7 Aug 2019 17:32:36 GMT""}]","2019-08-08"
"1804.02144","Hazim Shakhatreh","Hazim Shakhatreh and Abdallah Khreishah","Optimal Placement of a UAV to Maximize the Lifetime of Wireless Devices",,,,,"cs.IT math.IT","http://creativecommons.org/licenses/by/4.0/","  Unmanned aerial vehicles (UAVs) can be used as aerial wireless base stations
when cellular networks go down. Prior studies on UAV-based wireless coverage
typically consider downlink scenarios from an aerial base station to ground
users. In this paper, we consider an uplink scenario under disaster situations
(such as earthquakes or floods), when cellular networks are down. We formulate
the problem of optimal UAV placement, where the objective is to determine the
placement of a single UAV such that the sum of time durations of uplink
transmissions is maximized. We prove that the constraint sets of problem can be
represented by the intersection of half spheres and the region formed by this
intersection is a convex set in terms of two variables. This proof enables us
to transform our problem to an optimization problem with two variables. We also
prove that the objective function of the transformed problem is a concave
function under a restriction on the minimum altitude of the UAV and propose a
gradient projection-based algorithm to find the optimal location of the UAV. We
validate the analysis by simulations and demonstrate the effectiveness of the
proposed algorithm under different cases.
","[{""version"":""v1"",""created"":""Fri, 6 Apr 2018 06:15:42 GMT""}]","2018-04-09"
"1804.02145","Mitsuhiko Honda","Mitsuhiko Honda, Kazushi Okada, Takashi Miyata, Gijs D. Mulders,
  Jeremy R. Swearingen, Takashi Kamizuka, Ryou Ohsawa, Takuya Fujiyoshi,
  Hideaki Fujiwara, Mizuho Uchiyama, Takuya Yamashita And Takashi Onaka","Mid-infrared Multi-wavelength Imaging of
  Ophiuchus\,IRS\,48\,Transitional Disk","13 pages, 6 figures, accepted in PASJ",,"10.1093/pasj/psy033",,"astro-ph.EP","http://arxiv.org/licenses/nonexclusive-distrib/1.0/","  Transitional disks around the Herbig Ae/Be stars are fascinating targets in
the contexts of disk evolution and also planet formation. Oph IRS 48 is one of
such Herbig Ae stars, which shows an inner dust cavity and azimuthally lopsided
large dust distribution. We present new images of Oph IRS 48 at eight
mid-infrared (MIR) wavelengths from 8.59 to 24.6\,$\mu {\rm m}$ taken with the
COMICS mounted on the 8.2\,m Subaru Telescope. The N-band (7 to 13\,$\mu {\rm
m}$) images show that the flux distribution is centrally peaked with a slight
spatial extent, while the Q-band (17 to 25\,$\mu {\rm m}$) images show
asymmetric double peaks (east and west). Using 18.8 and 24.6\,$\mu$m images, we
derived the dust temperature at both east and west peaks to be 135$\pm$22 K.
Thus, the asymmetry may not be attributed to a difference in the temperature. %
thus other reason is necessary to explain the asymmetry of east and west peaks
in Q-band. Comparing our results with previous modeling works, we conclude that
the inner disk is aligned to the outer disk. A shadow casted by the optically
thick inner disk has a great influence on the morphology of MIR thermal
emission from the outer disk.
","[{""version"":""v1"",""created"":""Fri, 6 Apr 2018 06:27:01 GMT""}]","2018-04-25"
"1804.02146","Masataka Iwai","Masataka Iwai","Characterization of pseudo-effective vector bundles by singular
  Hermitian metrics","18pages v4: completely revised version, to appear in Michigan
  Mathematical Journal",,,,"math.AG math.CV","http://arxiv.org/licenses/nonexclusive-distrib/1.0/","  In this paper, we give complex geometric descriptions of the notions of
algebraic geometric positivity of vector bundles and torsion-free coherent
sheaves, such as nef, big, pseudo-effective and weakly positive, by using
singular Hermitian metrics. As an applications, we obtain a generalization of
Mori's result. We also give a characterization of the augmented base locus by
using singular Hermitian metrics on vector bundles and the Lelong numbers.
","[{""version"":""v1"",""created"":""Fri, 6 Apr 2018 06:27:22 GMT""},{""version"":""v2"",""created"":""Tue, 1 May 2018 11:04:29 GMT""},{""version"":""v3"",""created"":""Tue, 26 Nov 2019 02:13:33 GMT""},{""version"":""v4"",""created"":""Tue, 16 Mar 2021 00:32:04 GMT""}]","2021-03-17"
