"1804.02253","Konstantin Eckle","Konstantin Eckle, Johannes Schmidt-Hieber","A comparison of deep networks with ReLU activation function and linear
  spline-type methods",,,,,"stat.ML cs.LG stat.ME","http://arxiv.org/licenses/nonexclusive-distrib/1.0/","  Deep neural networks (DNNs) generate much richer function spaces than shallow
networks. Since the function spaces induced by shallow networks have several
approximation theoretic drawbacks, this explains, however, not necessarily the
success of deep networks. In this article we take another route by comparing
the expressive power of DNNs with ReLU activation function to piecewise linear
spline methods. We show that MARS (multivariate adaptive regression splines) is
improper learnable by DNNs in the sense that for any given function that can be
expressed as a function in MARS with $M$ parameters there exists a multilayer
neural network with $O(M \log (M/\varepsilon))$ parameters that approximates
this function up to sup-norm error $\varepsilon.$ We show a similar result for
expansions with respect to the Faber-Schauder system. Based on this, we derive
risk comparison inequalities that bound the statistical risk of fitting a
neural network by the statistical risk of spline-based methods. This shows that
deep networks perform better or only slightly worse than the considered spline
methods. We provide a constructive proof for the function approximations.
","[{""version"":""v1"",""created"":""Fri, 6 Apr 2018 13:28:15 GMT""},{""version"":""v2"",""created"":""Mon, 24 Sep 2018 09:11:59 GMT""}]","2018-09-25"
"1804.02254","Dirk-Philip Brandes","Dirk-Philip Brandes and Imma Valentina Curato","On the sample autocovariance of a L\'evy driven moving average process
  when sampled at a renewal sequence","27 pages, 4 figures",,,,"math.PR math.ST stat.TH","http://arxiv.org/licenses/nonexclusive-distrib/1.0/","  We consider a L\'evy driven continuous time moving average process $X$
sampled at random times which follow a renewal structure independent of $X$.
Asymptotic normality of the sample mean, the sample autocovariance, and the
sample autocorrelation is established under certain conditions on the kernel
and the random times. We compare our results to a classical non-random
equidistant sampling method and give an application to parameter estimation of
the L\'evy driven Ornstein-Uhlenbeck process.
","[{""version"":""v1"",""created"":""Fri, 6 Apr 2018 13:28:57 GMT""}]","2018-04-09"
"1804.02255","Nikolay Sluchanko E","Nadezhda B. Bolotina, Alexander P. Dudka, Olga N. Khrykina, Vladimir
  N. Krasnorussky, Natalya Yu. Shitsevalova, Volodymyr B. Filipov, Nikolay E.
  Sluchanko","The lower symmetry electron-density distribution and the charge
  transport anisotropy in cubic dodecaboride LuB12","17 pages, 6 figures, 1 Table",,"10.1088/1361-648X/aac742",,"cond-mat.str-el","http://arxiv.org/licenses/nonexclusive-distrib/1.0/","  High-quality single crystals of LuB12 are grown using the induction zone
melting method. The X-ray data are collected at temperatures 293, 135, 95, 50
K. The crystal structure of LuB12 can be refined with record low R-factor in
the cubic Fm-3m symmetry group despite reiterated observations of the cubic
symmetry distortions both in the unit-cell values and in the physical
properties. A peculiar computing strategy is developed to resolve this
contradiction. True symmetry of the electron-density distribution in LuB12 is
proved to be much lower than cubic as a result, which correlates very
accurately with anisotropy of transport properties of LuB12.
","[{""version"":""v1"",""created"":""Fri, 6 Apr 2018 13:29:49 GMT""}]","2018-07-04"
"1804.02256","Michael Mattern","Michael Mattern, Jouni Kainulainen, Miaomiao Zhang, Henrik Beuther","Structure and Fragmentation of a high line-mass filament: Nessie",,"A&A 616, A78 (2018)","10.1051/0004-6361/201731778",,"astro-ph.GA","http://arxiv.org/licenses/nonexclusive-distrib/1.0/","  An increasing number of hundred-parsec scale, high line-mass filaments have
been detected in the Galaxy. Their evolutionary path, including fragmentation
towards star formation, is virtually unknown. We characterize the fragmentation
within the Nessie filament, covering size-scales between $\sim$ 0.1-100 pc. We
also connect the small-scale fragments to the star-forming potential of the
cloud. We combine near-infrared data from the VVV survey with mid-infrared
GLIMPSE data to derive a high-resolution dust extinction map and apply a
wavelet decomposition technique on it to analyze the fragmentation
characteristics of the cloud, which are compared with predictions from
fragmentation models. We compare the detected objects to those identified in
$\sim$ 10 times coarser resolution from ATLASGAL data. We present a
high-resolution extinction map of Nessie. We estimate the mean line-mass of
Nessie to be $\sim$ 627 M$_\odot$/pc and the distance to be $\sim$ 3.5 kpc. We
find that Nessie shows fragmentation at multiple size scales. The
nearest-neighbour separations of the fragments at all scales are within a
factor of 2 of the Jeans' length at that scale. However, the relationship
between the mean densities of the fragments and their separations is
significantly shallower than expected for Jeans' fragmentation. The
relationship is similar to the one predicted for a filament that exhibits a
Larson-like scaling between size-scale and velocity dispersion; such a scaling
may result from turbulent support. Based on the number of YSOs in Nessie, we
estimate that the star formation rate is $\sim$ 371 M$_\odot$/Myr; similar
values result if using the number of dense cores, or the amount of dense gas,
as the proxy of star formation. The star formation efficiency is 0.017. These
numbers indicate that Nessie's star-forming content is comparable to the Solar
neighborhood giant molecular clouds like Orion A.
","[{""version"":""v1"",""created"":""Fri, 6 Apr 2018 13:32:18 GMT""}]","2018-08-22"
"1804.02257","Sam Kriegman","Sam Kriegman, Nick Cheney, Francesco Corucci, and Josh C. Bongard","Interoceptive robustness through environment-mediated morphological
  development",,,"10.1145/3205455.3205529",,"cs.AI cs.NE cs.RO","http://arxiv.org/licenses/nonexclusive-distrib/1.0/","  Typically, AI researchers and roboticists try to realize intelligent behavior
in machines by tuning parameters of a predefined structure (body plan and/or
neural network architecture) using evolutionary or learning algorithms. Another
but not unrelated longstanding property of these systems is their brittleness
to slight aberrations, as highlighted by the growing deep learning literature
on adversarial examples. Here we show robustness can be achieved by evolving
the geometry of soft robots, their control systems, and how their material
properties develop in response to one particular interoceptive stimulus
(engineering stress) during their lifetimes. By doing so we realized robots
that were equally fit but more robust to extreme material defects (such as
might occur during fabrication or by damage thereafter) than robots that did
not develop during their lifetimes, or developed in response to a different
interoceptive stimulus (pressure). This suggests that the interplay between
changes in the containing systems of agents (body plan and/or neural
architecture) at different temporal scales (evolutionary and developmental)
along different modalities (geometry, material properties, synaptic weights)
and in response to different signals (interoceptive and external perception)
all dictate those agents' abilities to evolve or learn capable and robust
strategies.
","[{""version"":""v1"",""created"":""Fri, 6 Apr 2018 13:33:37 GMT""},{""version"":""v2"",""created"":""Wed, 20 Jun 2018 01:39:25 GMT""}]","2018-06-21"
"1804.02258","Jasur Matrasulov","Gulmira Babajanova, Jasur Matrasulov, Katsuhiro Nakamura","Quantum gas in the fast forward scheme of adiabatically expanding
  cavities: Force and equation of states",,"Phys. Rev. E 97, 042104 (2018)","10.1103/PhysRevE.97.042104",,"quant-ph cond-mat.quant-gas cond-mat.stat-mech","http://arxiv.org/licenses/nonexclusive-distrib/1.0/","  With use of the scheme of fast forward which realizes quasi-static or
adiabatic dynamics in shortened time scale, we investigate a thermally-isolated
ideal quantum gas confined in a rapidly dilating one-dimensional (1D) cavity
with the time-dependent size $L=L(t)$. In the fast-forward variants of equation
of states, i.e., Bernoulli's formula and Poisson's adiabatic equation, the
force or 1D analog of pressure can be expressed as a function of the velocity
($\dot{L}$) and acceleration ($\ddot{L}$) of $L$ besides rapidly-changing state
variables like effective temperature ($T$) and $L$ itself. The force is now a
sum of nonadiabatic (NAD) and adiabatic contributions with the former caused by
particles moving synchronously with kinetics of $L$ and the latter by ideal
bulk particles insensitive to such a kinetics. The ratio of NAD and adiabatic
contributions does not depend on the particle number ($N$) in the case of the
soft-wall confinement, whereas such a ratio is controllable in the case of
hard-wall confinement. We also reveal the condition when the NAD contribution
overwhelms the adiabatic one and thoroughly changes the standard form of the
equilibrium equation of states.
","[{""version"":""v1"",""created"":""Fri, 6 Apr 2018 13:35:54 GMT""}]","2018-05-09"
"1804.02259","Dieter Rautenbach","S. Ehard and D. Rautenbach","On the extremal graphs for degenerate subsets, dynamic monopolies, and
  partial incentives",,,,,"math.CO","http://arxiv.org/licenses/nonexclusive-distrib/1.0/","  The famous lower bound $\alpha(G)\geq \sum_{u\in V(G)}\frac{1}{d_G(u)+1}$ on
the independence number $\alpha(G)$ of a graph $G$ due to Caro and Wei is known
to be tight if and only if the components of $G$ are cliques, and has been
generalized several times in the context of large degenerate subsets and small
dynamic monopolies. We characterize the extremal graphs for a generalization
due to Ackerman, Ben-Zwi, and Wolfovitz. Furthermore, we give a simple proof of
a related bound concerning partial incentives due to Cordasco, Gargano,
Rescigno, and Vaccaro, and also characterize the corresponding extremal graphs.
","[{""version"":""v1"",""created"":""Fri, 6 Apr 2018 13:36:32 GMT""}]","2018-04-09"
"1804.02260","Xianan Huang","Xianan Huang, Huei Peng","Efficient Mobility-on-Demand System with Ride-Sharing",,,"10.1109/ITSC.2018.8569777",,"math.OC","http://arxiv.org/licenses/nonexclusive-distrib/1.0/","  An algorithm to cluster mobility-on-demand trips considering road network
structure is developed in this paper. The benefits of our network partition
algorithm are demonstrated in numerical simulations, showing that we can use
fewer vehicles and can serve more customers with slightly longer wait time by
including predicted future travel demand in trip assignment, compared with the
benchmark reactive control policy.
","[{""version"":""v1"",""created"":""Fri, 6 Apr 2018 13:37:10 GMT""}]","2018-12-18"
"1804.02262","Marco de Cesare","Marco de Cesare","Cosmological consequences of Quantum Gravity proposals","PhD thesis, King's College London (supervisor: Mairi Sakellariadou),
  282 pages, 20 figures; submitted in September 2017",,,,"gr-qc hep-th","http://arxiv.org/licenses/nonexclusive-distrib/1.0/","  In this thesis, we study the implications of Quantum Gravity models for the
dynamics of spacetime and the ensuing departures from classical General
Relativity. The main focus is on cosmological applications, particularly the
impact of quantum gravitational effects on the dynamics of a homogenous and
isotropic cosmological background. Our interest lies in the consequences for
the evolution of the early universe and singularity resolution, as well as in
the possibility of providing an alternative explanation for dark matter and
dark energy in the late universe.
  The thesis is divided into two main parts, dedicated to alternative (and
complementary) ways of tackling the problem of Quantum Gravity. The first part
is concerned with cosmological applications of background independent
approaches to Quantum Gravity, both in the context of loop quantisation and in
quantum geometrodynamics. Particularly relevant in this work is the Group Field
Theory approach, which we use to study the effective dynamics of the emergent
universe from a full theory of Quantum Gravity (i.e. without symmetry
reduction).
  In the second part, modified gravity theories are introduced as tools to
provide an effective description of quantum gravitational effects, e.g. by
introducing new degrees of freedom and symmetries. Particularly relevant in
this respect is local conformal invariance, which finds a natural realisation
in the framework of Weyl geometry. We build a modified theory of gravity based
on such symmetry principle, and argue that new fields in the extended
gravitational sector may play the role of dark matter. New degrees of freedom
are also natural in models with varying fundamental `constants', which we
examine critically.
  Finally, we discuss prospects for future work and point at directions for the
derivation of realistic cosmological models from Quantum Gravity candidates.
","[{""version"":""v1"",""created"":""Fri, 6 Apr 2018 13:39:12 GMT""}]","2018-04-09"
"1804.02263","Arni Alfredsson","Arni F. Alfredsson and Erik Agrell and Henk Wymeersch","Iterative Detection and Phase-Noise Compensation for Coded Multichannel
  Optical Transmission",,"IEEE Transactions on Communications 67 (2019) 5532-5543","10.1109/TCOMM.2019.2912569",,"cs.IT math.IT","http://arxiv.org/licenses/nonexclusive-distrib/1.0/","  The problem of phase-noise compensation for correlated phase noise in coded
multichannel optical transmission is investigated. To that end, a simple
multichannel phase-noise model is considered and the maximum a posteriori
detector for this model is approximated using two frameworks, namely factor
graphs (FGs) combined with the sum-product algorithm (SPA), and a variational
Bayesian (VB) inference method. The resulting pilot-aided algorithms perform
iterative phase-noise compensation in cooperation with a decoder, using
extended Kalman smoothing to estimate the a posteriori phase-noise distribution
jointly for all channels. The system model and the proposed algorithms are
verified using experimental data obtained from space-division multiplexed
multicore-fiber transmission. Through Monte Carlo simulations, the algorithms
are further evaluated in terms of phase-noise tolerance for coded transmission.
It is observed that they significantly outperform the conventional approach to
phase-noise compensation in the optical literature. Moreover, the FG/SPA
framework performs similarly or better than the VB framework in terms of
phase-noise tolerance of the resulting algorithms, for a slightly higher
computational complexity.
","[{""version"":""v1"",""created"":""Fri, 6 Apr 2018 13:42:43 GMT""},{""version"":""v2"",""created"":""Fri, 29 Jun 2018 11:46:17 GMT""},{""version"":""v3"",""created"":""Mon, 3 Dec 2018 10:55:18 GMT""},{""version"":""v4"",""created"":""Sun, 13 Oct 2019 08:47:00 GMT""}]","2019-10-15"
"1804.02264","Tabea Tscherpel","Endre S\""uli, Tabea Tscherpel","Fully discrete finite element approximation of unsteady flows of
  implicitly constituted incompressible fluids","43 pages",,"10.1093/imanum/dry097",,"math.NA","http://arxiv.org/licenses/nonexclusive-distrib/1.0/","  Implicit constitutive theory provides a very general framework for fluid flow
models, including both Newtonian and generalized Newtonian fluids, where the
Cauchy stress tensor and the rate of strain tensor are assumed to be related by
an implicit relation associated with a maximal monotone graph. For
incompressible unsteady flows of such fluids, subject to a homogeneous
Dirichlet boundary condition on a Lipschitz polytopal domain $\Omega \subset
\mathbb{R}^d$, $d \in \{2,3\}$, we investigate a fully-discrete approximation
scheme, using a spatial mixed finite element approximation combined with
backward Euler time-stepping. We show convergence of a subsequence of
approximate solutions, when the velocity field belongs to the space of
solenoidal functions contained in $L^\infty(0,T;L^2(\Omega)^d)\cap
L^q(0,T;W^{1,q}_0(\Omega)^d)$, provided that $q\in
\big(\frac{2d}{d+2},\infty\big)$, which is the maximal range for $q$ with
respect to existence of weak solutions. This is achieved by a technique based
on splitting and regularizing, the use of a solenoidal parabolic Lipschitz
truncation method, a local Minty-type monotonicity result, and various weak
compactness results.
","[{""version"":""v1"",""created"":""Fri, 6 Apr 2018 13:44:37 GMT""}]","2019-02-22"
"1804.02265","Thorsten Wissmann","Sean Tull","A Categorical Reconstruction of Quantum Theory",,"Logical Methods in Computer Science, Volume 16, Issue 1 (January
  17, 2020) lmcs:6035","10.23638/LMCS-16(1:4)2020",,"quant-ph cs.LO math.CT","http://creativecommons.org/licenses/by/4.0/","  We reconstruct finite-dimensional quantum theory from categorical principles.
That is, we provide properties ensuring that a given physical theory described
by a dagger compact category in which one may `discard' objects is equivalent
to a generalised finite-dimensional quantum theory over a suitable ring $S$.
The principles used resemble those due to Chiribella, D'Ariano and Perinotti.
Unlike previous reconstructions, our axioms and proof are fully categorical in
nature, in particular not requiring tomography assumptions. Specialising the
result to probabilistic theories we obtain either traditional quantum theory
with $S$ being the complex numbers, or that over real Hilbert spaces with $S$
being the reals.
","[{""version"":""v1"",""created"":""Fri, 6 Apr 2018 13:45:01 GMT""},{""version"":""v2"",""created"":""Thu, 10 Jan 2019 14:08:41 GMT""},{""version"":""v3"",""created"":""Tue, 26 Feb 2019 16:44:30 GMT""},{""version"":""v4"",""created"":""Thu, 16 Jan 2020 14:50:18 GMT""}]","2020-06-17"
"1804.02266","Ashish Bhatt","Ashish Bhatt, Brian E. Moore","Exponential Integrators Preserving Local Conservation Laws of PDEs with
  Time-Dependent Damping/Driving Forces","17 pages, 3 figures",,,,"math.NA","http://arxiv.org/licenses/nonexclusive-distrib/1.0/","  Structure-preserving algorithms for solving conservative PDEs with added
linear dissipation are generalized to systems with time-dependent
damping/driving terms. This study is motivated by several PDE models of
physical phenomena, such as Korteweg-de Vries, Klein-Gordon, Schr\""{o}dinger,
and Camassa-Holm equations, all with damping/driving terms and time-dependent
coefficients. Since key features of the PDEs under consideration are described
by local conservation laws, which are independent of the boundary conditions,
the proposed (second-order in time) discretizations are developed with the
intent of preserving those local conservation laws. The methods are
respectively applied to a damped-driven nonlinear Schr\""{o}dinger equation and
a damped Camassa-Holm equation. Numerical experiments illustrate the
structure-preserving properties of the methods, as well as favorable results
over other competitive schemes.
","[{""version"":""v1"",""created"":""Fri, 6 Apr 2018 13:47:24 GMT""}]","2018-04-09"
"1804.02267","Evgeni Bezus","Evgeni A. Bezus, Leonid L. Doskolovich, Dmitry A. Bykov, and Victor A.
  Soifer","Spatial differentiation and integration of optical beams in a slab
  waveguide by a single dielectric ridge","6 pages, 4 figures","Opt. Express 26, 25156-25165 (2018)","10.1364/OE.26.025156",,"physics.optics","http://arxiv.org/licenses/nonexclusive-distrib/1.0/","  We show that a very simple structure consisting of a single subwavelength
dielectric ridge on the surface of a slab waveguide enables spatial
differentiation and integration of the profile of optical beams propagating in
the waveguide. The differentiation and integration operations are performed in
transmission and in reflection, respectively, at oblique incidence of the beam
impinging on the ridge. The implementation of these operations is associated
with the resonant excitation of a cross-polarized eigenmode of the ridge. At
the considered parameters of the structure and incidence geometry, neither
""parasitic"" out-of-plane scattering nor polarization conversion occurs. The
presented rigorous numerical simulation results confirm high-quality
differentiation and integration. We demonstrate that by choosing the quality
factor of the resonance, one can achieve the required tradeoff between the
differentiation (or integration) quality and the amplitude of the resulting
beam. The proposed integrated structure may find application in ultrafast
all-optical analog computing and signal processing systems.
","[{""version"":""v1"",""created"":""Fri, 6 Apr 2018 13:47:45 GMT""}]","2018-09-26"
"1804.02268","Hongyao Ma","Hongyao Ma, Reshef Meir, David C. Parkes","Social Choice with Non Quasi-linear Utilities",,,,,"cs.GT","http://arxiv.org/licenses/nonexclusive-distrib/1.0/","  Without monetary payments, the Gibbard-Satterthwaite theorem proves that
under mild requirements all truthful social choice mechanisms must be
dictatorships. When payments are allowed, the Vickrey-Clarke-Groves (VCG)
mechanism implements the value-maximizing choice, and has many other good
properties: it is strategy-proof, onto, deterministic, individually rational,
and does not make positive transfers to the agents. By Roberts' theorem, with
three or more alternatives, the weighted VCG mechanisms are essentially unique
for domains with quasi-linear utilities. The goal of this paper is to
characterize domains of non-quasi-linear utilities where ""reasonable""
mechanisms (with VCG-like properties) exist. Our main result is a tight
characterization of the maximal non quasi-linear utility domain, which we call
the largest parallel domain. We extend Roberts' theorem to parallel domains,
and use the generalized theorem to prove two impossibility results. First, any
reasonable mechanism must be dictatorial when the utility domain is
quasi-linear together with any single non-parallel type. Second, for richer
utility domains that still differ very slightly from quasi-linearity, every
strategy-proof, onto and deterministic mechanism must be a dictatorship.
","[{""version"":""v1"",""created"":""Fri, 6 Apr 2018 13:47:50 GMT""},{""version"":""v2"",""created"":""Wed, 25 Apr 2018 19:21:58 GMT""}]","2018-04-27"
"1804.02269","Karol W\k{e}grzycki","Marcin Mucha, Karol W\k{e}grzycki, Micha{\l} W{\l}odarczyk","A Subquadratic Approximation Scheme for Partition","Extended abstract published in the proceedings of SODA 2019",,"10.1137/1.9781611975482.5",,"cs.DS","http://arxiv.org/licenses/nonexclusive-distrib/1.0/","  The subject of this paper is the time complexity of approximating Knapsack,
Subset Sum, Partition, and some other related problems. The main result is an
$\widetilde{O}(n+1/\varepsilon^{5/3})$ time randomized FPTAS for Partition,
which is derived from a certain relaxed form of a randomized FPTAS for Subset
Sum. To the best of our knowledge, this is the first NP-hard problem that has
been shown to admit a subquadratic time approximation scheme, i.e., one with
time complexity of $O((n+1/\varepsilon)^{2-\delta})$ for some $\delta>0$. To
put these developments in context, note that a quadratic FPTAS for \partition
has been known for 40 years.
  Our main contribution lies in designing a mechanism that reduces an instance
of Subset Sum to several simpler instances, each with some special structure,
and keeps track of interactions between them. This allows us to combine
techniques from approximation algorithms, pseudo-polynomial algorithms, and
additive combinatorics.
  We also prove several related results. Notably, we improve approximation
schemes for 3SUM, (min,+)-convolution, and Tree Sparsity. Finally, we argue why
breaking the quadratic barrier for approximate Knapsack is unlikely by giving
an $\Omega((n+1/\varepsilon)^{2-o(1)})$ conditional lower bound.
","[{""version"":""v1"",""created"":""Fri, 6 Apr 2018 13:49:33 GMT""},{""version"":""v2"",""created"":""Mon, 6 May 2019 14:15:28 GMT""}]","2019-05-07"
"1804.02273","Vyacheslav Moklev","Vyacheslav Moklev and Vladimir Ulyantsev","BFS Enumeration for Breaking Symmetries in Graphs",,,,,"cs.DS","http://arxiv.org/licenses/nonexclusive-distrib/1.0/","  There are numerous NP-hard combinatorial problems which involve searching for
an undirected graph satisfying a certain property. One way to solve such
problems is to translate a problem into an instance of the boolean
satisfiability (SAT) or constraint satisfaction (CSP) problem. Such reduction
usually can give rise to numerous isomorphic representations of the same graph.
One way to reduce the search space and speed up the search under these
conditions is to introduce symmetrybreaking predicates. In this paper we
introduce three novel and practically effective symmetry-breaking predicates
for an undirected connected graph search based on breadth-first search (BFS)
enumeration and compare with existing symmetry-breaking methods on several
graph problems.
","[{""version"":""v1"",""created"":""Fri, 6 Apr 2018 13:53:31 GMT""}]","2018-04-09"
