"1804.04325","M. Bigdeli","A.H. Farajian, M. Bigdeli and S. Belbasi","LOCV calculation of the equation of state and properties of rapidly
  rotating neutron stars","7 pages, 7 figures","Chinese Physics C, Vol.42, No.6 (2018)065102","10.1088/1674-1137/42/6/065102",,"nucl-th","http://arxiv.org/licenses/nonexclusive-distrib/1.0/","  In this paper, we have investigated the structural properties of rotating
neutron stars using the numerical RNS code and the equation of states which
have been calculated within the lowest order constrained variational approach.
In order to calculate the equation of state of nuclear matter, we have used
UV$_{14}$ $+$TNI and AV$_{18}$ potentials. Here, we have computed the maximum
mass of the neutron star and the corresponding equatorial radius at different
angular velocity. We have also computed the structural properties of Keplerian
rotating neutron star for maximum mass configuration, $M_{K}$, $R_{K}$, $f_{K}$
and $j_{max}$.
","[{""version"":""v1"",""created"":""Thu, 12 Apr 2018 05:35:36 GMT""},{""version"":""v2"",""created"":""Fri, 11 May 2018 06:01:24 GMT""}]","2018-07-04"
"1804.04326","Yuya Yoshikawa","Yuya Yoshikawa, Jiaqing Lin, Akikazu Takeuchi","STAIR Actions: A Video Dataset of Everyday Home Actions","STAIR Actions dataset can be downloaded from
  http://actions.stair.center",,,,"cs.CV cs.AI cs.MM","http://arxiv.org/licenses/nonexclusive-distrib/1.0/","  A new large-scale video dataset for human action recognition, called STAIR
Actions is introduced. STAIR Actions contains 100 categories of action labels
representing fine-grained everyday home actions so that it can be applied to
research in various home tasks such as nursing, caring, and security. In STAIR
Actions, each video has a single action label. Moreover, for each action
category, there are around 1,000 videos that were obtained from YouTube or
produced by crowdsource workers. The duration of each video is mostly five to
six seconds. The total number of videos is 102,462. We explain how we
constructed STAIR Actions and show the characteristics of STAIR Actions
compared to existing datasets for human action recognition. Experiments with
three major models for action recognition show that STAIR Actions can train
large models and achieve good performance. STAIR Actions can be downloaded from
http://actions.stair.center
","[{""version"":""v1"",""created"":""Thu, 12 Apr 2018 05:48:06 GMT""},{""version"":""v2"",""created"":""Fri, 13 Apr 2018 03:26:54 GMT""},{""version"":""v3"",""created"":""Mon, 16 Apr 2018 05:40:42 GMT""}]","2018-04-17"
"1804.04327","Lucas Vinh Tran","Lucas Vinh Tran, Tuan-Anh Nguyen Pham, Yi Tay, Yiding Liu, Gao Cong,
  Xiaoli Li","Interact and Decide: Medley of Sub-Attention Networks for Effective
  Group Recommendation","Accepted at SIGIR 2019",,,,"cs.AI cs.IR","http://arxiv.org/licenses/nonexclusive-distrib/1.0/","  This paper proposes Medley of Sub-Attention Networks (MoSAN), a new novel
neural architecture for the group recommendation task. Group-level
recommendation is known to be a challenging task, in which intricate group
dynamics have to be considered. As such, this is to be contrasted with the
standard recommendation problem where recommendations are personalized with
respect to a single user. Our proposed approach hinges upon the key intuition
that the decision making process (in groups) is generally dynamic, i.e., a
user's decision is highly dependent on the other group members. All in all, our
key motivation manifests in a form of an attentive neural model that captures
fine-grained interactions between group members. In our MoSAN model, each
sub-attention module is representative of a single member, which models a
user's preference with respect to all other group members. Subsequently, a
Medley of Sub-Attention modules is then used to collectively make the group's
final decision. Overall, our proposed model is both expressive and effective.
Via a series of extensive experiments, we show that MoSAN not only achieves
state-of-the-art performance but also improves standard baselines by a
considerable margin.
","[{""version"":""v1"",""created"":""Thu, 12 Apr 2018 05:54:13 GMT""},{""version"":""v2"",""created"":""Wed, 18 Apr 2018 09:45:35 GMT""},{""version"":""v3"",""created"":""Tue, 10 Jul 2018 03:15:39 GMT""},{""version"":""v4"",""created"":""Sat, 23 Nov 2019 05:12:52 GMT""},{""version"":""v5"",""created"":""Thu, 28 Nov 2019 10:08:23 GMT""}]","2019-12-02"
"1804.04328","Yasuhiro Utsumi","Yasuhiro Utsumi","Full counting statistics of information content","16 pages, 5 figures","Eur. Phys. J. Spec. Top. (2019)","10.1140/epjst/e2018-800043-4",,"cond-mat.mes-hall cond-mat.stat-mech quant-ph","http://arxiv.org/licenses/nonexclusive-distrib/1.0/","  We review connections between the cumulant generating function of full
counting statistics of particle number and the R\'enyi entanglement entropy. We
calculate these quantities based on the fermionic and bosonic path-integral
defined on multiple Keldysh contours. We relate the R\'enyi entropy with the
information generating function, from which the probability distribution
function of self-information is obtained in the nonequilibrium steady state. By
exploiting the distribution, we analyze the information content carried by a
single bosonic particle through a narrow-band quantum communication channel.
The ratio of the self-information content to the number of bosons fluctuates.
For a small boson occupation number, the average and the fluctuation of the
ratio are enhanced.
","[{""version"":""v1"",""created"":""Thu, 12 Apr 2018 05:54:29 GMT""}]","2019-02-05"
"1804.04329","Zhaoqin Huang","Zhaoqin Huang, Xu Zhou, Tao Huang, Jun Yao, Xiaoguang Wang, Herv\'e
  Jourde","Homogenization of a Biot-Stokes system modeling deformable vuggy porous
  media","23 pages, 10 figures",,,,"physics.comp-ph","http://arxiv.org/licenses/nonexclusive-distrib/1.0/","  Vugs are small to medium-sized cavities inside rock, which have significant
effects on the fluid flow in rock. Moreover, the presence of vugs may have
non-trivial impacts on the geomechanical behavior of rock. How to quantify and
analyze such effects is still an opening problem. To this end, we derive a
macroscopic poroelastic model for a single-phase viscous fluid flow through a
deformable vuggy porous medium. At first, a vuggy porous medium is divided into
two parts: the porous matrix and vugs. Then, we model the hydro-mechanical
coupling process on the fine scale using Biot's equations within porous matrix,
Stokes equations within the vugs, and an extended Beavers-Joseph-Saffman
boundary condition on the porous-fluid interface. Next, based on the
homogenization theory, we obtain a macroscopic Biot's equations governing the
hydro-mechanical coupling behavior of vuggy porous media on larger scale.
Subsequently, the macroscopic poroelastic coefficients, such as the effective
Darcy permeability, effective Young's modulus and effective Biot coefficient,
can be computed from three cell problems. Finally, several numerical examples
are designed to demonstrate the computational procedure of evaluating the
geomechanical behavior of vuggy porous media.
","[{""version"":""v1"",""created"":""Thu, 12 Apr 2018 05:56:19 GMT""}]","2018-04-13"
"1804.04330","Amine Helali","Amine Helali","The convergence rate of the Gibbs sampler for generalized $1-$D Ising
  model",,,,,"math.PR cond-mat.stat-mech","http://arxiv.org/licenses/nonexclusive-distrib/1.0/","  The rate of convergence of the Gibbs sampler for the generalized
one-dimensional Ising model is determined by the second largest eigenvalue of
its transition matrix in absolute value denoted by $\beta^*$. In this paper we
generalize a result from Shiu and Chen $(2015)$ for the one-dimensional Ising
model with two states which gives a bound for $\beta^*$ . The method is based
on Diaconis and Stroock bound for reversible Markov processes. The new bound
presented in this paper improves Ingrassia's $(1994)$ result.
","[{""version"":""v1"",""created"":""Thu, 12 Apr 2018 06:00:52 GMT""},{""version"":""v2"",""created"":""Thu, 7 Feb 2019 10:42:54 GMT""}]","2019-02-08"
"1804.04331","Jalil Khatibi Moqadam","Jalil Khatibi Moqadam and Ali T. Rezakhani","Boundary-induced coherence in the staggered quantum walk on different
  topologies","9 pages, 8 figures","Phys. Rev. A 98, 012123 (2018)","10.1103/PhysRevA.98.012123",,"quant-ph cond-mat.str-el","http://arxiv.org/licenses/nonexclusive-distrib/1.0/","  The staggered quantum walk is a type of discrete-time quantum walk model
without a coin which can be generated on a graph using particular partitions of
the graph nodes. We design Hamiltonians for potential realization of the
staggered dynamics on a two-dimensional lattice composed of superconducting
microwave resonators connected with tunable couplings. The naive generalization
of the one-dimensional staggered dynamics generates two uncoupled
one-dimensional quantum walks thus more complex partitions need to be employed.
However, by analyzing the coherence of the dynamics, we show that the
quantumness of the evolution corresponding to two independent one-dimensional
quantum walks can be elevated to the level of a single two-dimensional quantum
walk, only by modifying the boundary conditions. In fact, by changing the
lattice boundary conditions (or topology), we explore the walk on different
surfaces such as torus, Klein bottle, real projective plane and sphere. The
coherence and the entropy reach different levels depending on the topology of
the surface. We observe that the entropy captures similar information as
coherence, thus we use it to explore the effects of boundaries on the dynamics
of the continuous-time quantum walk and the classical random walk.
","[{""version"":""v1"",""created"":""Thu, 12 Apr 2018 06:03:33 GMT""}]","2018-07-25"
"1804.04332","Michael Urban","S. Ramanan and M. Urban","Screening and anti-screening of the pairing interaction in low-density
  neutron matter","16 pages, 16 figures; v2: added references, one table, and ancillary
  files containing matrix elements of the screened pairing interaction","Phys. Rev. C 98, 024314 (2018)","10.1103/PhysRevC.98.024314",,"nucl-th astro-ph.HE cond-mat.quant-gas","http://arxiv.org/licenses/nonexclusive-distrib/1.0/","  We study pairing in low-density neutron matter including the screening
interaction due to the exchange of particle-hole and RPA excitations. As bare
force we employ the effective low-momentum interaction $V_{low\,k}$, while the
Fermi-liquid parameters are taken from a phenomenological energy density
functional (SLy4) which correctly reproduces the equation of state of neutron
matter. At low density, we find screening, i.e., pairing is reduced, while at
higher densities, we find anti-screening, i.e., pairing is enhanced. This
enhancement is mostly due to the strongly attractive Landau parameter $f_0$. We
discuss in detail the critical temperature $T_c$ in the limit of low densities
and show that the suppression of $T_c$ predicted by Gor'kov and
Melik-Barkhudarov can only be reproduced if the cutoff of the $V_{low\,k}$
interaction is scaled with the Fermi momentum. We also discuss the effect of
non-condensed pairs on the density dependence of $T_c$ in the framework of the
Nozi\`eres-Schmitt-Rink theory.
","[{""version"":""v1"",""created"":""Thu, 12 Apr 2018 06:07:33 GMT""},{""version"":""v2"",""created"":""Fri, 3 Aug 2018 09:19:15 GMT""}]","2018-08-23"
"1804.04333","Mingming Gong","Mingming Gong, Kun Zhang, Biwei Huang, Clark Glymour, Dacheng Tao,
  Kayhan Batmanghelich","Causal Generative Domain Adaptation Networks","12 pages",,,,"stat.ML cs.LG","http://arxiv.org/licenses/nonexclusive-distrib/1.0/","  An essential problem in domain adaptation is to understand and make use of
distribution changes across domains. For this purpose, we first propose a
flexible Generative Domain Adaptation Network (G-DAN) with specific latent
variables to capture changes in the generating process of features across
domains. By explicitly modeling the changes, one can even generate data in new
domains using the generating process with new values for the latent variables
in G-DAN. In practice, the process to generate all features together may
involve high-dimensional latent variables, requiring dealing with distributions
in high dimensions and making it difficult to learn domain changes from few
source domains. Interestingly, by further making use of the causal
representation of joint distributions, we then decompose the joint distribution
into separate modules, each of which involves different low-dimensional latent
variables and can be learned separately, leading to a Causal G-DAN (CG-DAN).
This improves both statistical and computational efficiency of the learning
procedure. Finally, by matching the feature distribution in the target domain,
we can recover the target-domain joint distribution and derive the learning
machine for the target domain. We demonstrate the efficacy of both G-DAN and
CG-DAN in domain generation and cross-domain prediction on both synthetic and
real data experiments.
","[{""version"":""v1"",""created"":""Thu, 12 Apr 2018 06:10:46 GMT""},{""version"":""v2"",""created"":""Sat, 16 Jun 2018 21:49:19 GMT""},{""version"":""v3"",""created"":""Thu, 28 Jun 2018 06:38:11 GMT""}]","2018-06-29"
"1804.04334","Hisashi Kotegawa","Hisashi Kotegawa, Keiki Takeda, Yoshiki Kuwata, Junichi Hayashi,
  Hideki Tou, Hitoshi Sugawara, Takahiro Sakurai, Hitoshi Ohta, and Hisatomo
  Harima","Superlattice formation lifting degeneracy protected by non-symmorphic
  symmetry through a metal-insulator transition in RuAs","10 pages, 10 figures","Phys. Rev. Materials 2, 055001 (2018)","10.1103/PhysRevMaterials.2.055001",,"cond-mat.str-el","http://arxiv.org/licenses/nonexclusive-distrib/1.0/","  The single crystal of RuAs obtained by Bi-flux method shows obvious
successive metal-insulator transitions at T_MI1~255 K and T_MI2~195$ K. The
X-ray diffraction measurement reveals a formation of superlattice of 3x3x3 of
the original unit cell below T_MI2, accompanied by a change of the crystal
system from the orthorhombic structure to the monoclinic one. Simple
dimerization of the Ru ions is nor seen in the ground state. The multiple As
sites observed in nuclear quadrupole resonance (NQR) spectrum also demonstrate
the formation of the superlattice in the ground state, which is clarified to be
nonmagnetic. The divergence in 1/T_1 at T_MI1 shows that a symmetry lowering by
the metal-insulator transition is accompanied by strong critical fluctuations
of some degrees of freedom. Using the structural parameters in the insulating
state, the first principle calculation reproduces successfully the reasonable
size of nuclear quadrupole frequencies for the multiple As sites, ensuring the
high validity of the structural parameters. The calculation also gives a
remarkable suppression in the density of states (DOS) near the Fermi level,
although the gap opening is insufficient. A coupled modulation of the
calculated Ru d electron numbers and the crystal structure proposes a formation
of charge density wave (CDW) in RuAs. Some lacking factors remain, but it shows
that a lifting of degeneracy protected by the non-symmorphic symmetry through
the superlattice formation is a key ingredient for the metal-insulator
transition in RuAs.
","[{""version"":""v1"",""created"":""Thu, 12 Apr 2018 06:11:24 GMT""}]","2018-05-09"
"1804.04335","Enrico Au-Yeung","Enrico Au-Yeung","Sparse Reconstruction with Multiple Walsh matrices",,,,,"math.FA eess.SP","http://arxiv.org/licenses/nonexclusive-distrib/1.0/","  The problem of how to find a sparse representation of a signal is an
important one in applied and computational harmonic analysis. It is closely
related to the problem of how to reconstruct a sparse vector from its
projection in a much lower-dimensional vector space. This is the setting of
compressed sensing, where the projection is given by a matrix with many more
columns than rows. We introduce a class of random matrices that can be used to
reconstruct sparse vectors in this paradigm. These matrices satisfy the
restricted isometry property with overwhelming probability. We also discuss an
application in dimensionality reduction where we initially discovered this
class of matrices.
","[{""version"":""v1"",""created"":""Thu, 12 Apr 2018 06:14:07 GMT""}]","2018-04-13"
"1804.04336","Walaa Seif","W. M. Seif and A. S. Hashem","Constraints on the nuclear symmetry energy and its density slope from
  the {\alpha} decay process","To be published in Chinese Physics C",,"10.1088/1674-1137/42/6/064104",,"nucl-th","http://creativecommons.org/licenses/by-nc-sa/4.0/","  We study the impact of the nuclear symmetry energy and its density dependence
on the {\alpha}-decay process. Within the frame work of the performed cluster
model and the energy density formalism, we use different parameterizations of
the Skyrme energy density functionals that yield different equations of state
EOSs. Each EOS is characterized by a particular symmetry-energy coefficient
(asym) and a corresponding density-slope parameters L. The stepwise trends of
the neutron (proton) skin thickness of the involved nuclei with both asym and L
do not clarify the obtained oscillating behaviors of the {\alpha}-decay
half-life T{\alpha} with them. We find that the change of the skin thickness
after {\alpha}-decay satisfactory explains these behaviors. The presented
results provide constrains on asym centered around an optimum value asym= 32
MeV, and on L between 41 and 57 MeV. These values of asym and L, which indicate
larger reduction of the proton-skin thickness and less increase in the
neutron-skin thickness after an {\alpha}-decay, yield minimum calculated
half-life with the same extracted value of the {\alpha}-preformation factor
inside the parent nucleus.
","[{""version"":""v1"",""created"":""Thu, 12 Apr 2018 06:15:04 GMT""}]","2018-07-04"
"1804.04337","Hal Tasaki","Hal Tasaki","Topological phase transition and $\mathbb{Z}_2$ index for $S=1$ quantum
  spin chains","6 pages, no figures, minor changes have been made","Phys. Rev. Lett. 121, 140604 (2018)","10.1103/PhysRevLett.121.140604",,"cond-mat.stat-mech math-ph math.MP quant-ph","http://arxiv.org/licenses/nonexclusive-distrib/1.0/","  We study $S=1$ quantum spin systems on the infinite chain with short ranged
Hamiltonians which have certain rotational and discrete symmetry. We define a
$\mathbb{Z}_2$ index for any gapped unique ground state, and prove that it is
invariant under smooth deformation. By using the index, we provide the first
rigorous proof of the existence of a ""topological"" phase transition, which
cannot be characterized by any conventional order parameters, between the AKLT
ground state and trivial ground states. This rigorously establishes that the
AKLT model is in a nontrivial symmetry protected topological phase.
","[{""version"":""v1"",""created"":""Thu, 12 Apr 2018 06:15:35 GMT""},{""version"":""v2"",""created"":""Sun, 22 Apr 2018 06:08:52 GMT""},{""version"":""v3"",""created"":""Tue, 1 May 2018 10:05:40 GMT""},{""version"":""v4"",""created"":""Wed, 6 Jun 2018 05:51:33 GMT""},{""version"":""v5"",""created"":""Sun, 29 Jul 2018 05:45:32 GMT""}]","2018-10-10"
"1804.04338","Christoph Baur","Christoph Baur, Shadi Albarqouni, Nassir Navab","MelanoGANs: High Resolution Skin Lesion Synthesis with GANs",,,,,"cs.CV","http://arxiv.org/licenses/nonexclusive-distrib/1.0/","  Generative Adversarial Networks (GANs) have been successfully used to
synthesize realistically looking images of faces, scenery and even medical
images. Unfortunately, they usually require large training datasets, which are
often scarce in the medical field, and to the best of our knowledge GANs have
been only applied for medical image synthesis at fairly low resolution.
However, many state-of-the-art machine learning models operate on high
resolution data as such data carries indispensable, valuable information. In
this work, we try to generate realistically looking high resolution images of
skin lesions with GANs, using only a small training dataset of 2000 samples.
The nature of the data allows us to do a direct comparison between the image
statistics of the generated samples and the real dataset. We both
quantitatively and qualitatively compare state-of-the-art GAN architectures
such as DCGAN and LAPGAN against a modification of the latter for the task of
image generation at a resolution of 256x256px. Our investigation shows that we
can approximate the real data distribution with all of the models, but we
notice major differences when visually rating sample realism, diversity and
artifacts. In a set of use-case experiments on skin lesion classification, we
further show that we can successfully tackle the problem of heavy class
imbalance with the help of synthesized high resolution melanoma samples.
","[{""version"":""v1"",""created"":""Thu, 12 Apr 2018 06:18:31 GMT""}]","2018-04-13"
"1804.04339","Naveed Akhtar Dr.","ShiJie Sun, Naveed Akhtar, HuanSheng Song, ChaoYang Zhang, JianXin Li,
  Ajmal Mian","Benchmark data and method for real-time people counting in cluttered
  scenes using depth sensors","Submitted to a journal",,,,"cs.CV","http://arxiv.org/licenses/nonexclusive-distrib/1.0/","  Vision-based automatic counting of people has widespread applications in
intelligent transportation systems, security, and logistics. However, there is
currently no large-scale public dataset for benchmarking approaches on this
problem. This work fills this gap by introducing the first real-world RGB-D
People Counting DataSet (PCDS) containing over 4,500 videos recorded at the
entrance doors of buses in normal and cluttered conditions. It also proposes an
efficient method for counting people in real-world cluttered scenes related to
public transportations using depth videos. The proposed method computes a point
cloud from the depth video frame and re-projects it onto the ground plane to
normalize the depth information. The resulting depth image is analyzed for
identifying potential human heads. The human head proposals are meticulously
refined using a 3D human model. The proposals in each frame of the continuous
video stream are tracked to trace their trajectories. The trajectories are
again refined to ascertain reliable counting. People are eventually counted by
accumulating the head trajectories leaving the scene. To enable effective head
and trajectory identification, we also propose two different compound features.
A thorough evaluation on PCDS demonstrates that our technique is able to count
people in cluttered scenes with high accuracy at 45 fps on a 1.7 GHz processor,
and hence it can be deployed for effective real-time people counting for
intelligent transportation systems.
","[{""version"":""v1"",""created"":""Thu, 12 Apr 2018 06:22:31 GMT""},{""version"":""v2"",""created"":""Sun, 28 Oct 2018 07:45:37 GMT""}]","2018-10-30"
"1804.04340","Ankan Bansal","Ankan Bansal and Karan Sikka and Gaurav Sharma and Rama Chellappa and
  Ajay Divakaran","Zero-Shot Object Detection","17 pages. ECCV 2018",,,,"cs.CV","http://arxiv.org/licenses/nonexclusive-distrib/1.0/","  We introduce and tackle the problem of zero-shot object detection (ZSD),
which aims to detect object classes which are not observed during training. We
work with a challenging set of object classes, not restricting ourselves to
similar and/or fine-grained categories as in prior works on zero-shot
classification. We present a principled approach by first adapting
visual-semantic embeddings for ZSD. We then discuss the problems associated
with selecting a background class and motivate two background-aware approaches
for learning robust detectors. One of these models uses a fixed background
class and the other is based on iterative latent assignments. We also outline
the challenge associated with using a limited number of training classes and
propose a solution based on dense sampling of the semantic label space using
auxiliary data with a large number of categories. We propose novel splits of
two standard detection datasets - MSCOCO and VisualGenome, and present
extensive empirical results in both the traditional and generalized zero-shot
settings to highlight the benefits of the proposed methods. We provide useful
insights into the algorithm and conclude by posing some open questions to
encourage further research.
","[{""version"":""v1"",""created"":""Thu, 12 Apr 2018 06:23:11 GMT""},{""version"":""v2"",""created"":""Fri, 27 Jul 2018 06:07:37 GMT""}]","2018-07-30"
