"1804.04446","Hexi Shi","H. Shi, E. Milotti, S. Bartalucci, M. Bazzi, S. Bertolucci, A.M.
  Bragadireanu, M. Cargnelli, A. Clozza, L. De Paolis, S. Di Matteo, J.-P.
  Egger, H. Elnaggar, C. Guaraldo, M. Iliescu, M. Laubenstein, J. Marton, M.
  Miliucci, A. Pichler, D. Pietreanu, K. Piscicchia, A. Scordo, D.L. Sirghi, F.
  Sirghi, L. Sperandio, O. Vazquez Doce, E. Widmann, J. Zmeskal, C. Curceanu","Experimental search for the violation of Pauli Exclusion Principle","18 pages, 10 figures, 2 tables, accepted by EPJ C on 12th April 2018","Eur. Phys. J. C (2018) 78: 319","10.1140/epjc/s10052-018-5802-4",,"physics.atom-ph physics.ins-det quant-ph","http://arxiv.org/licenses/nonexclusive-distrib/1.0/","  The VIolation of Pauli exclusion principle -2 experiment, or VIP-2
experiment, at the Laboratori Nazionali del Gran Sasso searches for x-rays from
copper atomic transition that are prohibited by the Pauli Exclusion Principle.
Candidate direct violation events come from the transition of a $2p$ electron
to the ground state that is already occupied by two electrons. From the first
data taking campaign in 2016 of VIP-2 experiment, we determined a best upper
limit of 3.4 $\times$ 10$^{-29}$ for the probability that such a violation
exists. Significant improvement in the control of the experimental systematics
was also achieved, although not explicitly reflected in the improved upper
limit. By introducing a simultaneous spectral fit of the signal and background
data in the analysis, we succeeded in taking into account systematic errors
that could not be evaluated previously in this type of measurements.
","[{""version"":""v1"",""created"":""Thu, 12 Apr 2018 11:50:17 GMT""},{""version"":""v2"",""created"":""Fri, 13 Apr 2018 10:36:06 GMT""},{""version"":""v3"",""created"":""Mon, 23 Apr 2018 09:41:26 GMT""}]","2018-04-24"
"1804.04447","Estefania Loayza Romero","J.C. De los Reyes and E. Loayza","Total Generalized Variation Regularization in Variational Data
  Assimilation for Burgers' Equation",,,,,"math.OC","http://arxiv.org/licenses/nonexclusive-distrib/1.0/","  We propose a second-order total generalized variation (TGV) regularization
for the reconstruction of the initial condition in variational data
assimilation problems. After showing the equivalence between TGV regularization
and the Bayesian method for the MAP estimator, we focus on the detailed study
of the inviscid Burgers' data assimilation problem. Due to the difficult
structure of the governing hyperbolic conservation law, we consider a
discretize-then-optimize approach and derive first-order optimality conditions
for the problem. For the numerical solution, we propose a globalized reduced
Newton-type method and prove convergence of the algorithm to stationary points.
The paper finishes with some numerical experiments where among others, the
performance of TGV-regularization compared to the TV-regularization is tested.
","[{""version"":""v1"",""created"":""Thu, 12 Apr 2018 11:56:34 GMT""}]","2018-04-13"
"1804.04448","Twan van Laarhoven","Jeroen Manders, Twan van Laarhoven, Elena Marchiori","Adversarial Alignment of Class Prediction Uncertainties for Domain
  Adaptation","To appear in ICPRAM 2019",,,,"stat.ML cs.LG","http://arxiv.org/licenses/nonexclusive-distrib/1.0/","  We consider unsupervised domain adaptation: given labelled examples from a
source domain and unlabelled examples from a related target domain, the goal is
to infer the labels of target examples. Under the assumption that features from
pre-trained deep neural networks are transferable across related domains,
domain adaptation reduces to aligning source and target domain at class
prediction uncertainty level. We tackle this problem by introducing a method
based on adversarial learning which forces the label uncertainty predictions on
the target domain to be indistinguishable from those on the source domain.
Pre-trained deep neural networks are used to generate deep features having high
transferability across related domains. We perform an extensive experimental
analysis of the proposed method over a wide set of publicly available
pre-trained deep neural networks. Results of our experiments on domain
adaptation tasks for image classification show that class prediction
uncertainty alignment with features extracted from pre-trained deep neural
networks provides an efficient, robust and effective method for domain
adaptation.
","[{""version"":""v1"",""created"":""Thu, 12 Apr 2018 11:56:42 GMT""},{""version"":""v2"",""created"":""Fri, 4 Jan 2019 20:13:07 GMT""}]","2019-01-08"
"1804.04449","Sebastian Ruf","Sebastian F. Ruf, Magnus Egersted, Jeff S. Shamma","Herding Positive, Complex Networks","Updated the proof of Theorem 2",,,,"cs.SY cs.SI physics.soc-ph","http://arxiv.org/licenses/nonexclusive-distrib/1.0/","  The problem of controlling complex networks is of interest to disciplines
ranging from biology to swarm robotics. However, controllability can be too
strict a condition, failing to capture a range of desirable behaviors.
Herdability, which describes the ability to drive a system to a specific set in
the state space, was recently introduced as an alternative network control
notion. This paper considers the application of herdability to the study of
complex networks under the assumption that a positive system evolves on the
network. The herdability of a class of networked systems is investigated and
two problems related to ensuring system herdability are explored. The first is
the input addition problem, which investigates which nodes in a network should
receive inputs to ensure that the system is herdable. The second is a related
problem of selecting the best single node from which to herd the network, in
the case that a single node is guaranteed to make the system is herdable. In
order to select the best herding node, a novel control energy based herdability
centrality measure is introduced.
","[{""version"":""v1"",""created"":""Thu, 12 Apr 2018 11:56:43 GMT""},{""version"":""v2"",""created"":""Sat, 28 Apr 2018 15:08:31 GMT""}]","2018-05-01"
"1804.04450","Jongchan Park","Jongchan Park, Joon-Young Lee, Donggeun Yoo, and In So Kweon","Distort-and-Recover: Color Enhancement using Deep Reinforcement Learning","Accepted to CVPR 2018",,,,"cs.CV","http://arxiv.org/licenses/nonexclusive-distrib/1.0/","  Learning-based color enhancement approaches typically learn to map from input
images to retouched images. Most of existing methods require expensive pairs of
input-retouched images or produce results in a non-interpretable way. In this
paper, we present a deep reinforcement learning (DRL) based method for color
enhancement to explicitly model the step-wise nature of human retouching
process. We cast a color enhancement process as a Markov Decision Process where
actions are defined as global color adjustment operations. Then we train our
agent to learn the optimal global enhancement sequence of the actions. In
addition, we present a 'distort-and-recover' training scheme which only
requires high-quality reference images for training instead of input and
retouched image pairs. Given high-quality reference images, we distort the
images' color distribution and form distorted-reference image pairs for
training. Through extensive experiments, we show that our method produces
decent enhancement results and our DRL approach is more suitable for the
'distort-and-recover' training scheme than previous supervised approaches.
Supplementary material and code are available at
https://sites.google.com/view/distort-and-recover/
","[{""version"":""v1"",""created"":""Thu, 12 Apr 2018 11:59:20 GMT""},{""version"":""v2"",""created"":""Mon, 16 Apr 2018 01:48:00 GMT""}]","2018-04-17"
"1804.04451","Michael Schmid","Bernhard St\""oger, Marcel Hieckel, Florian Mittendorfer, Zhiming Wang,
  David Fobes, Jin Peng, Zhiqiang Mao, Michael Schmid, Josef Redinger, Ulrike
  Diebold","High chemical activity of a perovskite surface: reaction of CO with
  Sr$_3$Ru$_2$O$_7$",,"Phys. Rev. Lett. 113, 116101 (2014)","10.1103/PhysRevLett.113.116101",,"cond-mat.mtrl-sci","http://arxiv.org/licenses/nonexclusive-distrib/1.0/","  Adsorption of CO at the Sr$_3$Ru$_2$O$_7$(001) surface was studied with
low-temperature scanning tunneling microscopy (STM) and density functional
theory. In situ cleaved single crystals terminate in an almost perfect SrO
surface. At 78 K, CO first populates impurities and then adsorbs above the
apical surface O with a binding energy E$_\mathrm{ads}$=-0.7 eV. Above 100 K,
this physisorbed CO replaces the surface O, forming a bent CO2 with the C end
bound to the Ru underneath. The resulting metal carboxylate (Ru-COO) can be
desorbed by STM manipulation. A low activation (0.2 eV) and high binding (-2.2
eV) energy confirm a strong reaction between CO and regular surface sites of
Sr$_3$Ru$_2$O$_7$; likely, this reaction causes the ""UHV aging effect"" reported
for this and other perovskite oxides.
","[{""version"":""v1"",""created"":""Thu, 12 Apr 2018 11:59:49 GMT""}]","2018-04-13"
"1804.04452","Stefan Depeweg","Stefan Depeweg, Constantin A. Rothkopf, Frank J\""akel","Solving Bongard Problems with a Visual Language and Pragmatic Reasoning",,,,,"stat.ML cs.AI cs.LG","http://arxiv.org/licenses/nonexclusive-distrib/1.0/","  More than 50 years ago Bongard introduced 100 visual concept learning
problems as a testbed for intelligent vision systems. These problems are now
known as Bongard problems. Although they are well known in the cognitive
science and AI communities only moderate progress has been made towards
building systems that can solve a substantial subset of them. In the system
presented here, visual features are extracted through image processing and then
translated into a symbolic visual vocabulary. We introduce a formal language
that allows representing complex visual concepts based on this vocabulary.
Using this language and Bayesian inference, complex visual concepts can be
induced from the examples that are provided in each Bongard problem. Contrary
to other concept learning problems the examples from which concepts are induced
are not random in Bongard problems, instead they are carefully chosen to
communicate the concept, hence requiring pragmatic reasoning. Taking pragmatic
reasoning into account we find good agreement between the concepts with high
posterior probability and the solutions formulated by Bongard himself. While
this approach is far from solving all Bongard problems, it solves the biggest
fraction yet.
","[{""version"":""v1"",""created"":""Thu, 12 Apr 2018 12:05:28 GMT""}]","2018-04-13"
"1804.04453","Pascal T\""orek","Axel Maas and Pascal T\""orek","The spectrum of an SU(3) gauge theory with a fundamental Higgs field","24 pages, 14 figures, 8 tables, font errors fixed","Annals of Physics 397, 303 (2018)","10.1016/j.aop.2018.08.018",,"hep-lat hep-ph","http://arxiv.org/licenses/nonexclusive-distrib/1.0/","  In gauge theories, the physical, experimentally observable spectrum consists
only of gauge-invariant states. This spectrum can be different from the
elementary spectrum even at weak coupling and in the presence of the
Brout-Englert-Higgs effect. We demonstrate this for an SU(3) gauge theory with
a single fundamental Higgs, a toy theory for grand-unified theories. The
manifestly gauge-invariant approach of lattice gauge theory is used to
determine the spectrum in four different channels. It is found to be
qualitatively different from the elementary one, and especially from the one
predicted by standard perturbation theory. The result can be understood in
terms of the Froehlich-Morchio-Strocchi mechanism. In fact, we find that
analytic methods based on this mechanism, a gauge-invariant extension of
perturbation theory, correctly determines the spectrum, and gives already at
leading order a reasonably good quantitative description. Together with
previous results this supports that this approach is the analytic method of
choice for theories with a Brout-Englert-Higgs effect.
","[{""version"":""v1"",""created"":""Thu, 12 Apr 2018 12:05:40 GMT""},{""version"":""v2"",""created"":""Mon, 16 Apr 2018 17:01:33 GMT""}]","2018-09-11"
"1804.04454","Kazi Rafsanjani Amin","Kazi Rafsanjani Amin, Samriddhi Sankar Ray, Nairita Pal, Rahul Pandit
  and Aveek Bid","Exotic Multifractal Conductance Fluctuations in Graphene",,"Communications Physics, volume 1, Article number: 1 (2018)","10.1038/s42005-017-0001-4",,"cond-mat.mes-hall","http://arxiv.org/licenses/nonexclusive-distrib/1.0/","  In quantum systems, signatures of multifractality are rare. They have been
found only in the multiscaling of eigenfunctions at critical points. Here we
demonstrate multifractality in the magnetic-field-induced universal conductance
fluctuations of the conductance in a quantum condensed-matter system, namely,
high-mobility single-layer graphene field-effect transistors. This
multifractality decreases as the temperature increases or as doping moves the
system away from the Dirac point. Our measurements and analysis present
evidence for an incipient Anderson-localization near the Dirac point as the
most plausible cause for this multifractality. Our experiments suggest that
multifractality in the scaling behaviour of local eigenfunctions are reflected
in macroscopic transport coefficients. We conjecture that an incipient
Anderson-localization transition may be the origin of this multifractality. It
is possible that multifractality is ubiquitous in transport properties of
low-dimensional systems. Indeed, our work suggests that we should look for
multifractality in transport in other low-dimensional quantum condensed-matter
systems.
","[{""version"":""v1"",""created"":""Thu, 12 Apr 2018 12:06:18 GMT""}]","2018-04-13"
"1804.04455","Ben Heuer","Clifford Blakestad, Dami\'an Gvirtz-Chen, Ben Heuer, Daria Shchedrina,
  Koji Shimizu, Peter Wear, Zijian Yao","Perfectoid covers of abelian varieties",,,,,"math.AG math.NT","http://arxiv.org/licenses/nonexclusive-distrib/1.0/","  For an abelian variety $A$ over an algebraically closed non-archimedean field
of residue characteristic $p$, we show that there exists a perfectoid space
which is the tilde-limit of $\varprojlim_{[p]}A$. Our proof also works for the
larger class of abeloid varieties.
","[{""version"":""v1"",""created"":""Thu, 12 Apr 2018 12:07:55 GMT""},{""version"":""v2"",""created"":""Thu, 6 Feb 2020 18:44:29 GMT""}]","2023-05-22"
"1804.04456","A. Yu. Petrov","F. S. Gama, J. R. Nascimento, A. Yu. Petrov and P. J. Porfirio","Spontaneous Symmetry Breaking in the Nonlocal Scalar QED","15 pages",,,,"hep-th","http://arxiv.org/licenses/nonexclusive-distrib/1.0/","  We investigate the spontaneous symmetry breaking in a nonlocal version of the
scalar QED. When the mass parameter $m^2$ satisfies the requirement $m^2>0$, we
find that all fields, including the Nambu-Goldstone field, acquire a non-zero
mass dependent on the nonlocal scales. On the other hand, when $m^2=0$, we find
that the nonlocal corrections to the masses are very small and can be
neglected.
","[{""version"":""v1"",""created"":""Thu, 12 Apr 2018 12:12:58 GMT""}]","2018-04-13"
"1804.04457","Claire Heaney","C. E. Heaney (1, 2), P. Salinas (1, 2), F. Fang (1, 2, 3), C. C. Pain
  (1, 2, 3) and I. M. Navon (4) ((1) Applied Modelling and Computation Group,
  Department of Earth Science and Engineering, Imperial College London, UK (2)
  Novel Reservoir Modelling and Simulation Group, Department of Earth Science
  and Engineering, Imperial College London, UK (3) Data Assimilation
  Laboratory, Data Science Institute, Imperial College London, UK (4)
  Department of Scientific Computing, Florida State University, USA)","Goal-based sensitivity maps using time windows and ensemble
  perturbations","35 pages, 13 figures. Submitted to JCP in September 2018 Changes:
  additional context given in the introduction, additional explanation given in
  section 2.2, some changes to equations. Results unchanged",,,,"cs.CE physics.comp-ph","http://arxiv.org/licenses/nonexclusive-distrib/1.0/","  We present an approach for forming sensitivity maps (or sensitivites) using
ensembles. The method is an alternative to using an adjoint, which can be very
challenging to formulate and also computationally expensive to solve. The main
novelties of the presented approach are: 1) the use of goals, weighting the
perturbation to help resolve the most important sensitivities, 2) the use of
time windows, which enable the perturbations to be optimised independently for
each window and 3) re-orthogonalisation of the solution through time, which
helps optimise each perturbation when calculating sensitivity maps. These novel
methods greatly reduce the number of ensembles required to form the sensitivity
maps as demonstrated in this paper. As the presented method relies solely on
ensembles obtained from the forward model, it can therefore be applied directly
to forward models of arbitrary complexity arising from, for example,
multi-physics coupling, legacy codes or model chains. It can also be applied to
compute sensitivities for optimisation of sensor placement, optimisation for
design or control, goal-based mesh adaptivity, assessment of goals (e.g. hazard
assessment and mitigation in the natural environment), determining the worth of
current data and data assimilation.
  We analyse and demonstrate the efficiency of the approach by applying the
method to advection problems and also a non-linear heterogeneous multi-phase
porous media problem, showing, in all cases, that the number of ensembles
required to obtain accurate sensitivity maps is relatively low, in the order of
10s.
","[{""version"":""v1"",""created"":""Thu, 12 Apr 2018 12:13:34 GMT""},{""version"":""v2"",""created"":""Thu, 20 Sep 2018 12:07:44 GMT""}]","2018-09-21"
"1804.04458","Daniel Worrall","Daniel Worrall and Gabriel Brostow","CubeNet: Equivariance to 3D Rotation and Translation","Preprint",,,,"cs.CV cs.AI cs.LG stat.ML","http://arxiv.org/licenses/nonexclusive-distrib/1.0/","  3D Convolutional Neural Networks are sensitive to transformations applied to
their input. This is a problem because a voxelized version of a 3D object, and
its rotated clone, will look unrelated to each other after passing through to
the last layer of a network. Instead, an idealized model would preserve a
meaningful representation of the voxelized object, while explaining the
pose-difference between the two inputs. An equivariant representation vector
has two components: the invariant identity part, and a discernable encoding of
the transformation. Models that can't explain pose-differences risk ""diluting""
the representation, in pursuit of optimizing a classification or regression
loss function.
  We introduce a Group Convolutional Neural Network with linear equivariance to
translations and right angle rotations in three dimensions. We call this
network CubeNet, reflecting its cube-like symmetry. By construction, this
network helps preserve a 3D shape's global and local signature, as it is
transformed through successive layers. We apply this network to a variety of 3D
inference problems, achieving state-of-the-art on the ModelNet10 classification
challenge, and comparable performance on the ISBI 2012 Connectome Segmentation
Benchmark. To the best of our knowledge, this is the first 3D rotation
equivariant CNN for voxel representations.
","[{""version"":""v1"",""created"":""Thu, 12 Apr 2018 12:14:18 GMT""}]","2018-04-13"
"1804.04459","Rafael Hern\'andez Heredero","Agust\'in Caparr\'os Quintero and Rafael Hern\'andez Heredero","Formal recursion operators of integrable nonevolutionary equations and
  Lagrangian systems",,"J. Phys. A: Math. Theor. 51 (2018) 385201 (22pp)","10.1088/1751-8121/aad63e",,"nlin.SI","http://arxiv.org/licenses/nonexclusive-distrib/1.0/","  We derive the general structure of the space of formal recursion operators of
nonevolutionary
equations~$q_{tt}=f(q,q_{x},q_t,q_{xx},q_{xt},q_{xxx},q_{xxxx})$. This allows
us to classify integrable Lagrangian systems with a higher order Lagrangian of
the form~$\mathscr{L}=\frac12 L_2(q_{xx}, q_x, q)\,q_t^2 + L_1(q_{xx}, q_x,
q)\, q_{t} + L_0(q_{xx}, q_x, q)$. The key technique relays on exploiting a
homogeneity of the determining equations of formal recursion operators. This
technique allows us to extend the main results to more general
equations~$q_{tt}=f(q,q_{x},\ldots,q_{n};q_{t},q_{xt},\ldots,q_{mt})$.
","[{""version"":""v1"",""created"":""Thu, 12 Apr 2018 12:15:29 GMT""},{""version"":""v2"",""created"":""Wed, 25 Jul 2018 07:40:57 GMT""},{""version"":""v3"",""created"":""Mon, 13 Aug 2018 05:57:18 GMT""}]","2019-04-03"
"1804.04460","Peng Chen","Peng Chen and Zhenxin Cao and Zhimin Chen and Xianbin Wang","Off-Grid DOA Estimation Using Sparse Bayesian Learning in MIMO Radar
  With Unknown Mutual Coupling",,"IEEE Transactions on Signal Processing(2019): 208-220","10.1109/TSP.2018.2881663",,"eess.SP","http://arxiv.org/licenses/nonexclusive-distrib/1.0/","  In the practical radar with multiple antennas, the antenna imperfections
degrade the system performance. In this paper, the problem of estimating the
direction of arrival (DOA) in multiple-input and multiple-output (MIMO) radar
system with unknown mutual coupling effect between antennas is investigated. To
exploit the target sparsity in the spatial domain, the compressed sensing
(CS)-based methods have been proposed by discretizing the detection area and
formulating the dictionary matrix, so an \emph{off-grid} gap is caused by the
discretization processes. In this paper, different from the present DOA
estimation methods, both the off-grid gap due to the sparse sampling and the
unknown mutual coupling effect between antennas are considered at the same
time, and a novel sparse system model for DOA estimation is formulated. Then, a
novel sparse Bayesian learning (SBL)-based method named sparse Bayesian
learning with the mutual coupling (SBLMC) is proposed, where an
expectation-maximum (EM)-based method is established to estimate all the
unknown parameters including the noise variance, the mutual coupling vectors,
the off-grid vector and the variance vector of scattering coefficients.
Additionally, the prior distributions for all the unknown parameters are
theoretically derived. With regard to the DOA estimation performance, the
proposed SBLMC method can outperform state-of-the-art methods in the MIMO radar
with unknown mutual coupling effect, while keeping the acceptable computational
complexity.
","[{""version"":""v1"",""created"":""Thu, 12 Apr 2018 12:17:17 GMT""},{""version"":""v2"",""created"":""Tue, 17 Apr 2018 13:34:03 GMT""},{""version"":""v3"",""created"":""Fri, 7 Dec 2018 08:28:58 GMT""},{""version"":""v4"",""created"":""Sat, 19 Mar 2022 02:17:29 GMT""}]","2022-03-22"
"1804.04461","Michael Schmid","Zhiming Wang, Xianfeng Hao, Stefan Gerhold, Petr Mares, Margareta
  Wagner, Roland Bliem, Karina Schulte, Michael Schmid, Cesare Franchini,
  Ulrike Diebold","Stabilizing Single Ni adatoms on a Two-dimensional Porous Titania
  Overlayer at the SrTiO$_3$(110) Surface",,"J. Phys. Chem. C 118, 19904 (2014)","10.1021/jp506234r",,"cond-mat.mtrl-sci","http://arxiv.org/licenses/nonexclusive-distrib/1.0/","  Nickel vapor-deposited on the SrTiO$_3$(110) surface was studied using
scanning tunneling microscopy, photoemission spectroscopy (PES), and density
functional theory calculations. This surface forms a (4 $\times$ 1)
reconstruction, composed of a 2-D titania structure with periodic six- and
ten-membered nanopores. Anchored at these nanopores, Ni single adatoms are
stabilized at room temperature. PES measurements show that the Ni adatoms
create an in-gap state located at 1.9 eV below the conduction band minimum and
induce an upward band bending. Both experimental and theoretical results
suggest that Ni adatoms are positively charged. Our study produces
well-dispersed single-adatom arrays on a well-characterized oxide support,
providing a model system to investigate single-adatom catalytic and magnetic
properties.
","[{""version"":""v1"",""created"":""Thu, 12 Apr 2018 12:17:52 GMT""}]","2018-04-13"
"1804.04462","Jonas Heverhagen","Jonas Heverhagen, Maria Daghofer","Spinon-orbiton repulsion and attraction mediated by Hund's rule",,"Phys. Rev. B 98, 085120 (2018)","10.1103/PhysRevB.98.085120",,"cond-mat.str-el","http://arxiv.org/licenses/nonexclusive-distrib/1.0/","  We study the impact of Hund's-rule coupling on orbital excitations, as e.g.
measured in inelastic resonant x-ray scattering. We find that the
interpretation in terms of spin-orbit separation, which has been derived for
one-dimensional systems without Hund's rule, remains robust in its presence.
Depending on whether or not the orbital excitation includes a spin excitation,
Hund's rule leads to an attractive or repulsive interaction between spinon and
orbiton. Attraction and repulsion leave clear signatures through a transfer of
spectral weight to the lower resp. upper edge of the spectrum.
","[{""version"":""v1"",""created"":""Thu, 12 Apr 2018 12:18:23 GMT""}]","2018-08-15"
