"1804.04197","Ryan Watson","Ryan M. Watson and Jason N. Gross","Evaluation of Kinematic Precise Point Positioning Convergence with an
  Incremental Graph Optimizer","8 pages","2018 IEEE/ION Position, Location and Navigation Symposium (PLANS)","10.1109/PLANS.2018.8373431",,"cs.RO","http://arxiv.org/licenses/nonexclusive-distrib/1.0/","  Estimation techniques to precisely localize a kinematic platform with GNSS
observables can be broadly partitioned into two categories: differential, or
undifferenced. The differential techniques (e.g., real-time kinematic (RTK))
have several attractive properties, such as correlated error mitigation and
fast convergence; however, to support a differential processing scheme, an
infrastructure of reference stations within a proximity of the platform must be
in place to construct observation corrections. This infrastructure requirement
makes differential processing techniques infeasible in many locations. To
mitigate the need for additional receivers within proximity of the platform,
the precise point positioning (PPP) method utilizes accurate orbit and clock
models to localize the platform. The autonomy of PPP from local reference
stations make it an attractive processing scheme for several applications;
however, a current disadvantage of PPP is the slow positioning convergence when
compared to differential techniques. In this paper, we evaluate the convergence
properties of PPP with an incremental graph optimization scheme (Incremental
Smoothing and Mapping (iSAM2)), which allows for real-time filtering and
smoothing. The characterization is first conducted through a Monte Carlo
analysis within a simulation environment, which allows for the variations of
parameters, such as atmospheric conditions, satellite geometry, and intensity
of multipath. Then, an example collected data set is utilized to validate the
trends presented in the simulation study.
","[{""version"":""v1"",""created"":""Wed, 11 Apr 2018 20:08:03 GMT""}]","2018-08-01"
"1804.04199","Jin Won Kim","Jin W. Kim, Amirhossein Taghvaei, Prashant G. Mehta","Derivation and Extensions of the Linear Feedback Particle Filter based
  on Duality Formalisms",,,,,"math.OC math.DS","http://creativecommons.org/licenses/by/4.0/","  This paper is concerned with a duality-based approach to derive the linear
feedback particle filter (FPF). The FPF is a controlled interacting particle
system where the control law is designed to provide an exact solution for the
nonlinear filtering problem. For the linear Gaussian special case, certain
simplifications arise whereby the linear FPF is identical to the square-root
form of the ensemble Kalman filter. For this and for the more general nonlinear
non-Gaussian case, it has been an open problem to derive/interpret the FPF
control law as a solution of an optimal control problem. In this paper, certain
duality-based arguments are employed to transform the filtering problem into an
optimal control problem. Its solution is shown to yield the deterministic form
of the linear FPF. An extension is described to incorporate stochastic effects
due to noise leading to a novel homotopy of exact ensemble Kalman filters. All
the derivations are based on duality formalisms.
","[{""version"":""v1"",""created"":""Wed, 11 Apr 2018 20:11:24 GMT""}]","2018-04-13"
"1804.04200","Maria Gamal'","Maria F. Gamal'","On power bounded operators that are quasiaffine tranforms of singular
  unitaries","Acta Sci. Math. (Szeged), 77(2011), 589-606. A misprint in the
  formulation of Theorem 2.5 is corrected",,,,"math.FA","http://arxiv.org/licenses/nonexclusive-distrib/1.0/","  In [9] a question is raised: if a power bounded operator is quasisimilar to a
singular unitary operator, is it similar to this unitary operator? For
polynomially bounded operators, a positive answer to this question is known
[1], [13]. In this paper a positive answer is given in some particular cases,
but in general an answer remains unknown.
","[{""version"":""v1"",""created"":""Wed, 11 Apr 2018 20:12:18 GMT""}]","2018-04-13"
"1804.04201","Yuzki Oey","Yuzki M. Oey, James Eujin Park, Jing Tao, Elizabeth M. Carnicom, Tai
  Kong, Marisa B. Sanders, and R. J. Cava","Stabilizing the Tb-based 214 cuprate by partial Pd substitution","25 pages, 9 figures, 1 table",,"10.1557/jmr.2018.102",,"cond-mat.supr-con","http://arxiv.org/licenses/nonexclusive-distrib/1.0/","  Previously known to form only under high pressure synthetic conditions, here
we report that the T'-type 214-structure cuprate based on the rare earth atom
Tb is stabilized for ambient pressure synthesis through partial substitution of
Pd for Cu. The new material is obtained in purest form for mixtures of nominal
composition $Tb_{1.96}Cu_{0.80}Pd_{0.20}O_{4}$. The refined formula, in
orthorhombic space group Pbca, with a = 5.5117(1) {\AA}, b = 5.5088(1) {\AA},
and c = 11.8818(1) {\AA}, is $Tb_{2}Cu_{0.83}Pd_{0.17}O_{4}$. An incommensurate
structural modulation is seen along the a axis by electron diffraction and high
resolution imaging. Magnetic susceptibility measurements reveal long range
antiferromagnetic ordering at 7.9 K, with a less pronounced feature at 95 K; a
magnetic moment reorientation transition is observed to onset at a field of
approximately 1.1 Tesla at 3 K. The material is an n-type semiconductor.
","[{""version"":""v1"",""created"":""Wed, 11 Apr 2018 20:13:11 GMT""},{""version"":""v2"",""created"":""Wed, 16 May 2018 15:30:05 GMT""}]","2018-08-01"
"1804.04202","Hannes Hornischer","Joshua Cherian Varughese, Hannes Hornischer, Ronald Thenius, Payam
  Zahadat, Franz Wotawa, Thomas Schmickl","Controlling Swarms: A Programming Paradigm with Minimalistic
  Communication",,,,,"cs.MA","http://arxiv.org/licenses/nonexclusive-distrib/1.0/","  Inspired by natural swarms, numerous control schemes enabling robotic swarms,
mobile sensor networks and other multi-agent systems to exhibit various
self-organized behaviors have been suggested. In this work, we present a Wave
Oriented Swarm Programming Paradigm (WOSPP) enabling the control of swarms with
minimalistic communication bandwidth in a simple manner, yet allowing the
emergence of diverse complex behaviors and autonomy of the swarm. Communi
cation in the proposed paradigm is based on ""ping""-signals inspired by
strategies for communication and self organization of slime mold (dictyostelium
discoideum) and fireflies (lampyridae). Signals propagate as information-waves
throughout the swarm. We show that even with 1-bit bandwidth communication
between agents suffices for the design of a substantial set of behaviors in the
domain of essential behaviors of a collective. Ultimately, the reader will be
enabled to develop and design a control scheme for individual swarms.
","[{""version"":""v1"",""created"":""Wed, 11 Apr 2018 20:14:31 GMT""},{""version"":""v2"",""created"":""Mon, 18 Jun 2018 13:52:12 GMT""}]","2018-06-19"
"1804.04203","Nan Cheng","Nan Cheng, Feng Lyu, Jiayin Chen, Wenchao Xu, Haibo Zhou, Shan Zhang,
  Xuemin (Sherman) Shen","Big Data Driven Vehicular Networks","Accepted by IEEE Network Magazine. 5 Figures",,,,"eess.SP","http://arxiv.org/licenses/nonexclusive-distrib/1.0/","  Vehicular communications networks (VANETs) enable information exchange among
vehicles, other end devices and public networks, which plays a key role in road
safety/infotainment, intelligent transportation system, and self-driving
system. As the vehicular connectivity soars, and new on-road mobile
applications and technologies emerge, VANETs are generating an ever-increasing
amount of data, requiring fast and reliable transmissions through VANETs. On
the other hand, a variety of VANETs related data can be analyzed and utilized
to improve the performance of VANETs. In this article, we first review the
VANETs technologies to efficiently and reliably transmit the big data. Then,
the methods employing big data for studying VANETs characteristics and
improving VANETs performance are discussed. Furthermore, we present a case
study where machine learning schemes are applied to analyze the VANETs
measurement data for efficiently detecting negative communication conditions.
","[{""version"":""v1"",""created"":""Wed, 11 Apr 2018 20:18:19 GMT""}]","2018-04-13"
"1804.04204","Priyabrata Bag","Priyabrata Bag, Santanu Dey","A Subspace of Maximal Dimension with Bounded Schmidt Rank","6 pages",,,,"quant-ph","http://arxiv.org/licenses/nonexclusive-distrib/1.0/","  We study Schmidt rank for a vector (i.e., a pure state) and Schmidt number
for a mixed state which are entanglement measures. We show that if a subspace
of a certain bipartite system contains no vector of Schmidt rank $\leqslant k$,
then any state supported on that space has Schmidt number at least $k+1$. A
construction of subspace of $\mathbb{C}^m \otimes \mathbb{C}^n$ of maximal
dimension, which does not contain any vector of Schmidt rank less than $3$, is
given here.
","[{""version"":""v1"",""created"":""Wed, 11 Apr 2018 20:19:19 GMT""}]","2018-04-13"
"1804.04205","Ziyi Zhao","Ziyi Zhao, Krittaphat Pugdeethosapol, Sheng Lin, Zhe Li, Caiwen Ding,
  Yanzhi Wang, Qinru Qiu","Learning Topics using Semantic Locality","International Conference of Pattern Recognition (ICPR) in 2018",,,,"cs.LG cs.CL cs.IR stat.ML","http://arxiv.org/licenses/nonexclusive-distrib/1.0/","  The topic modeling discovers the latent topic probability of the given text
documents. To generate the more meaningful topic that better represents the
given document, we proposed a new feature extraction technique which can be
used in the data preprocessing stage. The method consists of three steps.
First, it generates the word/word-pair from every single document. Second, it
applies a two-way TF-IDF algorithm to word/word-pair for semantic filtering.
Third, it uses the K-means algorithm to merge the word pairs that have the
similar semantic meaning.
  Experiments are carried out on the Open Movie Database (OMDb), Reuters
Dataset and 20NewsGroup Dataset. The mean Average Precision score is used as
the evaluation metric. Comparing our results with other state-of-the-art topic
models, such as Latent Dirichlet allocation and traditional Restricted
Boltzmann Machines. Our proposed data preprocessing can improve the generated
topic accuracy by up to 12.99\%.
","[{""version"":""v1"",""created"":""Wed, 11 Apr 2018 20:23:23 GMT""}]","2018-04-13"
"1804.04206","Boheng Zhang","Boheng Zhang, Shenglei Huang, Shaohan Hu","Multi-scale Neural Networks for Retinal Blood Vessels Segmentation",,,,,"cs.CV cs.LG stat.ML","http://arxiv.org/licenses/nonexclusive-distrib/1.0/","  Existing supervised approaches didn't make use of the low-level features
which are actually effective to this task. And another deficiency is that they
didn't consider the relation between pixels, which means effective features are
not extracted. In this paper, we proposed a novel convolutional neural network
which make sufficient use of low-level features together with high-level
features and involves atrous convolution to get multi-scale features which
should be considered as effective features. Our model is tested on three
standard benchmarks - DRIVE, STARE, and CHASE databases. The results presents
that our model significantly outperforms existing approaches in terms of
accuracy, sensitivity, specificity, the area under the ROC curve and the
highest prediction speed. Our work provides evidence of the power of wide and
deep neural networks in retinal blood vessels segmentation task which could be
applied on other medical images tasks.
","[{""version"":""v1"",""created"":""Wed, 11 Apr 2018 20:25:36 GMT""}]","2018-04-13"
"1804.04207","Oleg Yazyev","Naunidh Virk, Gabriel Aut\`es, Oleg V. Yazyev","Electronic properties of one-dimensional nanostructures of the
  Bi$_2$Se$_3$ topological insulator","10 pages, 9 figures","Phys. Rev. B 97, 165411 (2018)","10.1103/PhysRevB.97.165411",,"cond-mat.mes-hall cond-mat.mtrl-sci","http://arxiv.org/licenses/nonexclusive-distrib/1.0/","  We theoretically study the electronic structure and spin properties of
one-dimensional nanostructures of the prototypical bulk topological insulator
Bi$_2$Se$_3$. Realistic models of experimentally observed Bi$_2$Se$_3$
nanowires and nanoribbons are considered using the tight-binding method. At low
energies, the band structures are composed of a series of evenly spaced
degenerate sub-bands resulting from circumferential confinement of the
topological surface states. The direct band gaps due to the non-trivial $\pi$
Berry phase show a clear dependence on the circumference. The spin-momentum
locking of the topological surface states results in a pronounced 2$\pi$ spin
rotation around the circumference with the degree of spin polarization
dependent on the the momentum along the nanostructure. Overall, the band
structures and spin textures are more complicated for nanoribbons, which expose
two distinct facets. The effects of reduced dimensionality are rationalized
with the help of a simple model that considers circumferential quantization of
the topological surface states. Furthermore, the surface spin density induced
by electric current along the nanostructure shows a pronounced oscillatory
dependence on the charge-carrier energy, which can be exploited in spintronics
applications.
","[{""version"":""v1"",""created"":""Wed, 11 Apr 2018 20:28:47 GMT""}]","2018-04-13"
"1804.04208","Georg Gottwald A.","J. Frank and G.A. Gottwald","A note on statistical consistency of numerical integrators for
  multi-scale dynamics","accepted for publication in SIAM MMS",,,,"math.DS math.NA","http://arxiv.org/licenses/nonexclusive-distrib/1.0/","  A minimal requirement for simulating multi-scale systems is to reproduce the
statistical behavior of the slow variables. In particular, a good numerical
method should accurately aproximate the probability density function of the
continuous-time slow variables. In this note we use results from homogenization
and from backward error analysis to quantify how errors of time integrators
affect the mean behavior of trajectories. We show that numerical simulations
converge, not to the exact probability density function (pdf) of the
homogenized multi-scale system, but rather to that of the homogenized modified
equations following from backward error analysis. Using homogenization theory
we find that the observed statistical bias is exacerbated for multi-scale
systems driven by fast chaotic dynamics that decorrelate insufficiently
rapidly. This suggests that to resolve the statistical behavior of trajectories
in certain multi-scale systems solvers of sufficiently high order are
necessary. Alternatively, backward error analysis suggests the form of an
amended vector field that corrects the lowest order bias in Euler's method. The
resulting scheme, a second order Taylor method, avoids any statistical drift
bias. We corroborate our analysis with a numerical example.
","[{""version"":""v1"",""created"":""Wed, 11 Apr 2018 20:31:26 GMT""}]","2018-04-13"
"1804.04209","Thomas Stastny","Thomas Stastny","L1 guidance logic extension for small UAVs: handling high winds and
  small loiter radii",,,,,"cs.RO","http://arxiv.org/licenses/nonexclusive-distrib/1.0/","  L1 guidance logic is one of the most widely used path following controllers
for small fixed-wing unmanned aerial vehicles (UAVs), primarily due to its
simplicity (low-cost implementation on embedded on-board processors, e.g.
micro-controllers) and ability to track both circles and lines, which make up
the vast majority of a typical fixed-wing vehicle's flight plan. The logic was
later extended for speed independent dynamic similarity with an adaptive L1
distance, a formulation currently used on common open-source autopilot
platforms. Two primary drawbacks remain, specific to small, slow flying
fixed-wing UAVs; namely, 1) the combination of low operator defined gains and
high ground speeds may violate the bounds of the algorithms convergence region
for the case of loiter circles with small radii and 2) L1 logic breaks down
when wind speeds exceed the vehicle's airspeed, another common predicament for
small, slow-flying UAVs. This brief presents simple extensions to this
extensively field tested algorithm, allowing legacy operators to keep existing
controller tunings while taking advantage of the enhanced performance and
safety features developed within.
","[{""version"":""v1"",""created"":""Wed, 11 Apr 2018 20:31:27 GMT""},{""version"":""v2"",""created"":""Wed, 23 May 2018 18:00:06 GMT""}]","2018-05-25"
"1804.04210","Graciela Boente Prof.","Graciela Boente, Daniela Rodriguez and Mariela Sued","The spatial sign covariance operator: Asymptotic results and
  applications",,,,,"math.ST stat.TH","http://arxiv.org/licenses/nonexclusive-distrib/1.0/","  Due to the increasing recording capability, functional data analysis has
become an important research topic. For functional data the study of outlier
detection and/or the development of robust statistical procedures has started
recently. One robust alternative to the sample covariance operator is the
sample spatial sign covariance operator. In this paper, we study the asymptotic
behaviour of the sample spatial sign covariance operator when location is
unknown. Among other possible applications of the obtained results, we derive
the asymptotic distribution of the principal directions obtained from the
sample spatial sign covariance operator and we develop test to detect
differences between the scatter operators of two populations. In particular,
the test performance is illustrated through a Monte Carlo study for small
sample sizes.
","[{""version"":""v1"",""created"":""Wed, 11 Apr 2018 20:35:05 GMT""}]","2018-04-13"
"1804.04211","Maryam Fanaeepour","Maryam Fanaeepour, Adam Makarucha, Jey Han Lau","Evaluating Word Embedding Hyper-Parameters for Similarity and Analogy
  Tasks","8 pages, 16 figures",,,,"cs.CL","http://arxiv.org/licenses/nonexclusive-distrib/1.0/","  The versatility of word embeddings for various applications is attracting
researchers from various fields. However, the impact of hyper-parameters when
training embedding model is often poorly understood. How much do
hyper-parameters such as vector dimensions and corpus size affect the quality
of embeddings, and how do these results translate to downstream applications?
Using standard embedding evaluation metrics and datasets, we conduct a study to
empirically measure the impact of these hyper-parameters.
","[{""version"":""v1"",""created"":""Wed, 11 Apr 2018 20:35:36 GMT""}]","2018-04-13"
"1804.04212","Hugo Caselles-Dupr\'e","Hugo Caselles-Dupr\'e, Florian Lesaint, Jimena Royo-Letelier","Word2Vec applied to Recommendation: Hyperparameters Matter","This paper is published on the 12th ACM Conference on Recommender
  Systems, Vancouver, Canada, 2nd-7th October 2018",,,,"cs.IR cs.CL cs.LG stat.ML","http://arxiv.org/licenses/nonexclusive-distrib/1.0/","  Skip-gram with negative sampling, a popular variant of Word2vec originally
designed and tuned to create word embeddings for Natural Language Processing,
has been used to create item embeddings with successful applications in
recommendation. While these fields do not share the same type of data, neither
evaluate on the same tasks, recommendation applications tend to use the same
already tuned hyperparameters values, even if optimal hyperparameters values
are often known to be data and task dependent. We thus investigate the marginal
importance of each hyperparameter in a recommendation setting through large
hyperparameter grid searches on various datasets. Results reveal that
optimizing neglected hyperparameters, namely negative sampling distribution,
number of epochs, subsampling parameter and window-size, significantly improves
performance on a recommendation task, and can increase it by an order of
magnitude. Importantly, we find that optimal hyperparameters configurations for
Natural Language Processing tasks and Recommendation tasks are noticeably
different.
","[{""version"":""v1"",""created"":""Wed, 11 Apr 2018 20:37:35 GMT""},{""version"":""v2"",""created"":""Tue, 8 May 2018 19:30:18 GMT""},{""version"":""v3"",""created"":""Wed, 29 Aug 2018 15:16:08 GMT""}]","2018-08-30"
"1804.04213","Hao Zhu","Hao Zhu, Hao Su, Peng Wang, Xun Cao, Ruigang Yang","View Extrapolation of Human Body from a Single Image","Accepted to CVPR 2018",,,,"cs.CV","http://arxiv.org/licenses/nonexclusive-distrib/1.0/","  We study how to synthesize novel views of human body from a single image.
Though recent deep learning based methods work well for rigid objects, they
often fail on objects with large articulation, like human bodies. The core step
of existing methods is to fit a map from the observable views to novel views by
CNNs; however, the rich articulation modes of human body make it rather
challenging for CNNs to memorize and interpolate the data well. To address the
problem, we propose a novel deep learning based pipeline that explicitly
estimates and leverages the geometry of the underlying human body. Our new
pipeline is a composition of a shape estimation network and an image generation
network, and at the interface a perspective transformation is applied to
generate a forward flow for pixel value transportation. Our design is able to
factor out the space of data variation and makes learning at each step much
easier. Empirically, we show that the performance for pose-varying objects can
be improved dramatically. Our method can also be applied on real data captured
by 3D sensors, and the flow generated by our methods can be used for generating
high quality results in higher resolution.
","[{""version"":""v1"",""created"":""Wed, 11 Apr 2018 20:41:19 GMT""}]","2018-04-13"
"1804.04214","Ryan Kavanagh","Ryan Kavanagh and Stephen Brookes","A denotational account of C11-style memory",,,,,"cs.PL","http://arxiv.org/licenses/nonexclusive-distrib/1.0/","  We introduce a denotational semantic framework for shared-memory concurrent
programs in a C11-style memory model. This denotational approach is an
alternative to techniques based on ""execution graphs"" and axiomatizations, and
it allows for compositional reasoning. Our semantics generalizes from traces
(sequences of actions) to pomsets (partial orders of actions): instead of
traces and interleaving, we embrace ""true"" concurrency. We build on techniques
from our prior work that gives a denotational semantics to SPARC TSO. We add
support for C11's wider range of memory orderings, e.g., acquire-release and
relaxed, and support for local variables and various synchronization
primitives, while eliminating significant amounts of technical bookkeeping. Our
approach features two main components. We first give programs a syntax-directed
denotation in terms of sets of pomsets of memory actions. We then give a
race-detecting executional interpretation of pomsets using footprints and a
local view of state.
","[{""version"":""v1"",""created"":""Wed, 11 Apr 2018 20:44:25 GMT""}]","2018-04-13"
"1804.04215","Lingjiong Zhu","Zhenyu Cui, Michael C. Fu, Yijie Peng, Lingjiong Zhu","Optimal Unbiased Estimation for Expected Cumulative Cost","35 pages, 5 figures","European Journal of Operational Research 2020, Volume 286, Issue
  2, 604-618",,,"math.NA cs.NA math.OC math.PR","http://arxiv.org/licenses/nonexclusive-distrib/1.0/","  We consider estimating an expected infinite-horizon cumulative discounted
cost/reward contingent on an underlying stochastic process by Monte Carlo
simulation. An unbiased estimator based on truncating the cumulative cost at a
random horizon is proposed. Explicit forms for the optimal distributions of the
random horizon are given, and explicit expressions for the optimal random
truncation level are obtained, leading to a full analysis of the bias-variance
tradeoff when comparing this new class of randomized estimators with
traditional fixed truncation estimators. Moreover, we characterize when the
optimal randomized estimator is preferred over a fixed truncation estimator by
considering the tradeoff between bias and variance. This comparison provides
guidance on when to choose randomized estimators over fixed truncation
estimators in practice. Numerical experiments substantiate the theoretical
results.
","[{""version"":""v1"",""created"":""Wed, 11 Apr 2018 20:45:24 GMT""},{""version"":""v2"",""created"":""Wed, 19 Feb 2020 16:14:33 GMT""}]","2020-05-26"
"1804.04216","Thomas Spooner","Thomas Spooner, John Fearnley, Rahul Savani and Andreas Koukorinis","Market Making via Reinforcement Learning","10 pages, 5 figures, AAMAS2018 Conference Proceedings",,,,"cs.AI q-fin.TR","http://arxiv.org/licenses/nonexclusive-distrib/1.0/","  Market making is a fundamental trading problem in which an agent provides
liquidity by continually offering to buy and sell a security. The problem is
challenging due to inventory risk, the risk of accumulating an unfavourable
position and ultimately losing money. In this paper, we develop a high-fidelity
simulation of limit order book markets, and use it to design a market making
agent using temporal-difference reinforcement learning. We use a linear
combination of tile codings as a value function approximator, and design a
custom reward function that controls inventory risk. We demonstrate the
effectiveness of our approach by showing that our agent outperforms both simple
benchmark strategies and a recent online learning approach from the literature.
","[{""version"":""v1"",""created"":""Wed, 11 Apr 2018 20:46:33 GMT""}]","2018-04-13"
