"1804.05901","Zulqarnain Khattak","Zulqarnain H. Khattak, Hyungjun Park, Seongah Hong, Richard Atta
  Boateng, and Brian L. Smith","Investigating Cybersecurity Issues In Active Traffic Management Systems","25 pages,7 figures, Accepted for Publication in Transportation
  Research Record, Journal of Transportation Research Board 2018",,,"TRR Paper Number: 18-03501","cs.CR","http://creativecommons.org/licenses/by/4.0/","  Active Traffic Management (ATM) systems have been introduced by
transportation agencies to manage recurrent and non-recurrent congestion. ATM
systems rely on the interconnectivity of components made possible by wired
and/or wireless networks. Unfortunately, this connectivity that supports ATM
systems also provides potential system access points that results in
vulnerability to cyberattacks. This is becoming more pronounced as ATM systems
begin to integrate internet of things (IoT) devices. Hence, there is a need to
rigorously evaluate ATM systems for cyberattack vulnerabilities, and explore
design concepts that provide stability and graceful degradation in the face of
cyberattacks. In this research, a prototype ATM system along with a real-time
cyberattack monitoring system were developed for a 1.5-mile section of I-66 in
Northern Virginia. The monitoring system detects deviation from expected
operation of an ATM system by comparing lane control states generated by the
ATM system with lane control states deemed most likely by the monitoring
system. In case of any deviation between two sets of states, the monitoring
system displays the lane control states generated by the back-up data source.
In a simulation experiment, the prototype ATM system and cyberattack monitoring
system were subject to emulated cyberattacks. The evaluation results showed
that when subject to cyberattack, the mean speed reduced by 15% compared to the
case with the ATM system and was similar to the baseline case. This illustrates
that the effectiveness of the ATM system was negated by cyberattacks. The
monitoring system however, allowed the ATM system to revert to an expected safe
state and reduced the negative impact of cyberattacks. These results illustrate
the need to revisit ATM system design concepts as a means to protect against
cyberattacks in addition to traditional system intrusion prevention approaches.
","[{""version"":""v1"",""created"":""Mon, 16 Apr 2018 19:23:19 GMT""}]","2018-04-18"
"1804.05902","Yiwen Huang","Yiwen Huang, Ming Qin","Densely Connected High Order Residual Network for Single Frame Image
  Super Resolution",,,,,"cs.CV","http://arxiv.org/licenses/nonexclusive-distrib/1.0/","  Deep convolutional neural networks (DCNN) have been widely adopted for
research on super resolution recently, however previous work focused mainly on
stacking as many layers as possible in their model, in this paper, we present a
new perspective regarding to image restoration problems that we can construct
the neural network model reflecting the physical significance of the image
restoration process, that is, embedding the a priori knowledge of image
restoration directly into the structure of our neural network model, we
employed a symmetric non-linear colorspace, the sigmoidal transfer, to replace
traditional transfers such as, sRGB, Rec.709, which are asymmetric non-linear
colorspaces, we also propose a ""reuse plus patch"" method to deal with super
resolution of different scaling factors, our proposed methods and model show
generally superior performance over previous work even though our model was
only roughly trained and could still be underfitting the training set.
","[{""version"":""v1"",""created"":""Mon, 16 Apr 2018 19:25:33 GMT""}]","2018-04-18"
"1804.05903","Lia Medeiros","Lia Medeiros, Tod R. Lauer, Dimitrios Psaltis, Feryal \""Ozel","Principal Component Analysis as a Tool for Characterizing Black Hole
  Images and Variability","16 pages, 17 figures, submitted to ApJ",,"10.3847/1538-4357/aad37a",,"astro-ph.IM astro-ph.HE","http://arxiv.org/licenses/nonexclusive-distrib/1.0/","  We explore the use of principal component analysis (PCA) to characterize
high-fidelity simulations and interferometric observations of the millimeter
emission that originates near the horizons of accreting black holes. We show
mathematically that the Fourier transforms of eigenimages derived from PCA
applied to an ensemble of images in the spatial-domain are identical to the
eigenvectors of PCA applied to the ensemble of the Fourier transforms of the
images, which suggests that this approach may be applied to modeling the sparse
interferometric Fourier-visibilities produced by an array such as the Event
Horizon Telescope (EHT). We also show that the simulations in the spatial
domain themselves can be compactly represented with a PCA-derived basis of
eigenimages allowing for detailed comparisons between variable observations and
time-dependent models, as well as for detection of outliers or rare events
within a time series of images. Furthermore, we demonstrate that the spectrum
of PCA eigenvalues is a diagnostic of the power spectrum of the structure and,
hence, of the underlying physical processes in the simulated and observed
images.
","[{""version"":""v1"",""created"":""Mon, 16 Apr 2018 19:26:04 GMT""}]","2018-09-05"
"1804.05904","Maria Weber","Maria A. Weber","Dynamo Processes Constrained by Solar and Stellar Observations","6 pages, invited review, accepted for publication in the proceedings
  of IAUS 340: Long-Term Datasets for the Understanding of Solar and Stellar
  Magnetic Cycles",,"10.1017/S1743921318001424",,"astro-ph.SR","http://arxiv.org/licenses/nonexclusive-distrib/1.0/","  Our understanding of stellar dynamos has largely been driven by the phenomena
we have observed of our own Sun. Yet, as we amass longer-term datasets for an
increasing number of stars, it is clear that there is a wide variety of stellar
behavior. Here we briefly review observed trends that place key constraints on
the fundamental dynamo operation of solar-type stars to fully convective M
dwarfs, including: starspot and sunspot patterns, various magnetism-rotation
correlations, and mean field flows such as differential rotation and meridional
circulation. We also comment on the current insight that simulations of dynamo
action and flux emergence lend to our working knowledge of stellar dynamo
theory. While the growing landscape of both observations and simulations of
stellar magnetic activity work in tandem to decipher dynamo action, there are
still many puzzles that we have yet to fully understand.
","[{""version"":""v1"",""created"":""Mon, 16 Apr 2018 19:30:42 GMT""}]","2019-01-30"
"1804.05905","Wenbo Dong","Wenbo Dong, Volkan Isler","Tree Morphology for Phenotyping from Semantics-Based Mapping in Orchard
  Environments","10 pages, 13 figures",,,,"cs.RO cs.CV","http://arxiv.org/licenses/nonexclusive-distrib/1.0/","  Measuring tree morphology for phenotyping is an essential but labor-intensive
activity in horticulture. Researchers often rely on manual measurements which
may not be accurate for example when measuring tree volume. Recent approaches
on automating the measurement process rely on LIDAR measurements coupled with
high-accuracy GPS. Usually each side of a row is reconstructed independently
and then merged using GPS information. Such approaches have two disadvantages:
(1) they rely on specialized and expensive equipment, and (2) since the
reconstruction process does not simultaneously use information from both sides,
side reconstructions may not be accurate. We also show that standard loop
closure methods do not necessarily align tree trunks well. In this paper, we
present a novel vision system that employs only an RGB-D camera to estimate
morphological parameters. A semantics-based mapping algorithm merges the
two-sides 3D models of tree rows, where integrated semantic information is
obtained and refined by robust fitting algorithms. We focus on measuring tree
height, canopy volume and trunk diameter from the optimized 3D model.
Experiments conducted in real orchards quantitatively demonstrate the accuracy
of our method.
","[{""version"":""v1"",""created"":""Mon, 16 Apr 2018 19:33:37 GMT""}]","2018-04-18"
"1804.05906","Zhen Peng","Zhen Peng, Tim Genewein, Felix Leibfried, Daniel A. Braun","An information-theoretic on-line update principle for perception-action
  coupling","8 pages, 2017 IEEE/RSJ International Conference on Intelligent Robots
  and Systems (IROS)",,,,"cs.AI","http://arxiv.org/licenses/nonexclusive-distrib/1.0/","  Inspired by findings of sensorimotor coupling in humans and animals, there
has recently been a growing interest in the interaction between action and
perception in robotic systems [Bogh et al., 2016]. Here we consider perception
and action as two serial information channels with limited
information-processing capacity. We follow [Genewein et al., 2015] and
formulate a constrained optimization problem that maximizes utility under
limited information-processing capacity in the two channels. As a solution we
obtain an optimal perceptual channel and an optimal action channel that are
coupled such that perceptual information is optimized with respect to
downstream processing in the action module. The main novelty of this study is
that we propose an online optimization procedure to find bounded-optimal
perception and action channels in parameterized serial perception-action
systems. In particular, we implement the perceptual channel as a multi-layer
neural network and the action channel as a multinomial distribution. We
illustrate our method in a NAO robot simulator with a simplified cup lifting
task.
","[{""version"":""v1"",""created"":""Mon, 16 Apr 2018 19:33:39 GMT""}]","2018-04-18"
"1804.05907","Rodrigo Pissardini M.Sc.","R.S. Pissardini and E.S. Fonseca Junior","Automatic Detection of Indoor and Outdoor Scenarios using NMEA Message
  Data from GPS Receivers","in Portuguese","Revista Brasileira de Geom\'atica, v.6, n.4, 2018","10.3895/rbgeo.v6n4.8269",,"cs.OH","http://arxiv.org/licenses/nonexclusive-distrib/1.0/","  Detection of indoor and outdoor scenarios is an important resource for many
types of activities such as multisensor navigation and location-based services.
This research presents the use of NMEA data provided by GPS receivers to
characterize different types of scenarios automatically. A set of static tests
was performed to evaluate metrics such as number of satellites, positioning
solution geometry and carrier-to-receiver noise-density ratio values to detect
possible patterns to determine indoor and outdoor scenarios. Subsequently,
validation tests are applied to verify that parameters obtained are adequate.
","[{""version"":""v1"",""created"":""Mon, 16 Apr 2018 19:34:48 GMT""}]","2020-12-08"
"1804.05908","Manh Hong Duong","Van Hao Can, Manh Hong Duong and Viet Hung Pham","Persistence probability of a random polynomial arising from evolutionary
  game theory","revised version",,,,"math.AP math-ph math.DS math.MP math.PR q-bio.PE","http://arxiv.org/licenses/nonexclusive-distrib/1.0/","  In this paper, we obtain an asymptotic formula for the persistence
probability in the positive real line of a random polynomial arising from
evolutionary game theory. It corresponds to the probability that a multi-player
two-strategy random evolutionary game has no internal equilibria. The key
ingredient is to approximate the sequence of random polynomials indexed by
their degrees by an appropriate centered stationary Gaussian process.
","[{""version"":""v1"",""created"":""Mon, 16 Apr 2018 19:37:05 GMT""},{""version"":""v2"",""created"":""Thu, 30 May 2019 06:13:15 GMT""}]","2019-05-31"
"1804.05909","Martin Scharlemann","Michael Freedman and Martin Scharlemann","Powell moves and the Goeritz group","39 pages; 17 figures",,,"UCSB Math 2018-11","math.GT","http://creativecommons.org/publicdomain/zero/1.0/","  In 1980 J. Powell proposed that five specific elements sufficed to generate
the Goeritz group of any Heegaard splitting of $S^3$, extending work of Goeritz
on genus $2$ splittings. Here we prove that Powell's conjecture was correct for
splittings of genus $3$ as well, and discuss a framework for deciding the truth
of the conjecture for higher genus splittings.
","[{""version"":""v1"",""created"":""Mon, 16 Apr 2018 19:39:17 GMT""}]","2018-04-18"
"1804.05910","Andreas Valdmann","Andreas Valdmann, Peeter Piksarv, Heli Valtna-Lukner and Peeter Saari","White-light hyperbolic Airy beams",,,"10.1088/2040-8986/aad700",,"physics.optics","http://arxiv.org/licenses/nonexclusive-distrib/1.0/","  Ultra-broadband hyperbolic Airy beams are experimentally realized and
spatio-temporally characterized. Transmissive (refractive) and reflective cubic
phase elements were used to impose a cubic phase on the input beam.
Nondispersing beams are produced in reflective geometry, while the main lobe of
the hyperbolic Airy beam created with a transmissive refractive phase element
suffered from lateral dispersion.
","[{""version"":""v1"",""created"":""Mon, 16 Apr 2018 19:41:13 GMT""}]","2018-08-29"
"1804.05911","Wolfram Kollatschny","M. Zetzl, W. Kollatschny, M. W. Ochmann, D. Grupe, M. Haas, M.
  Ramolla, D. Chelouche, S. Kaspi, N. Schartel","Long-term optical, UV, and X-ray continuum variations in the
  changing-look AGN HE 1136-2304","25 pages, 21 figures, Astronomy & Astrophysics in press","A&A 618, A83 (2018)","10.1051/0004-6361/201732506",,"astro-ph.GA","http://arxiv.org/licenses/nonexclusive-distrib/1.0/","  A strong outburst in the X-ray continuum and a change of its Seyfert spectral
type was detected in HE 1136-2304 in 2014. The spectral type changed from
nearly Seyfert 2 type (1.95) to Seyfert 1.5 type in comparison to previous
observations taken ten to twenty years before. In a subsequent variability
campaign we wanted to investigate whether this outburst was a single event or
whether the variability pattern following the outburst was similar to those
seen in other variable Seyfert galaxies. In addition to a SALT spectral
variability campaign, we carried out optical continuum as well as X-ray and UV
(Swift) monitoring studies from 2014 to 2017. HE 1136-2304 strongly varied on
timescales of days to months from 2014 to 2017. No systematic trends were found
in the variability behavior following the outburst in 2014. A general decrease
in flux would have been expected for a tidal disruption event. This could not
be confirmed. More likely the flux variations are connected to irregular
fluctuations in the accretion rate. The strongest variability amplitudes have
been found in the X-ray regime: HE 1136-2304 varied by a factor of eight during
2015. The amplitudes of the continuum variability (from the UV to the optical)
systematically decreased with wavelength following a power law F_var = a
${\times}$ {\lambda}^-c with c = 0.84. There is a trend that the B-band
continuum shows a delay of three light days with respect to the variable X-ray
flux. The Seyfert type 1.5 did not change despite the strong continuum
variations for the period between 2014 and 2017.
","[{""version"":""v1"",""created"":""Mon, 16 Apr 2018 19:47:58 GMT""}]","2018-10-17"
"1804.05912","Jose D'Incao","J. P. D'Incao, J. Wang, V. E. Colussi","Efimov Physics in Quenched Unitary Bose Gases","5 pages, 4 figures (supplementary material: 5 pages, 4 figures)","Phys. Rev. Lett. 121, 023401 (2018)","10.1103/PhysRevLett.121.023401",,"physics.atom-ph","http://arxiv.org/licenses/nonexclusive-distrib/1.0/","  We study the impact of three-body physics in quenched unitary Bose gases,
focusing on the role of the Efimov effect. Using a local density model, we
solve the three-body problem and determine three-body decay rates at unitary,
finding density-dependent, log-periodic Efimov oscillations, violating the
expected continuous scale-invariance in the system. We find that the breakdown
of continuous scale-invariance, due to Efimov physics, manifests also in the
earliest stages of evolution after the interaction quench to unitarity, where
we find the growth of a substantial population of Efimov states for densities
in which the interparticle distance is comparable to the size of an Efimov
state. This agrees with the early-time dynamical growth of three-body
correlations at unitarity [Colussi {\em et al}., Phys. Rev. Lett. 120, 100401
(2018)]. By varying the sweep rate away from unitarity, we also find a
departure from the usual Landau-Zener analysis for state transfer when the
system is allowed to evolve at unitarity and develop correlations.
","[{""version"":""v1"",""created"":""Mon, 16 Apr 2018 19:48:17 GMT""},{""version"":""v2"",""created"":""Wed, 18 Apr 2018 18:04:07 GMT""},{""version"":""v3"",""created"":""Tue, 22 May 2018 02:28:34 GMT""}]","2018-07-18"
"1804.05913","Bruno Santiago","Lorenzo J. D\'iaz, Katrin Gelfert and Bruno Santiago","Weak* and entropy approximation of nonhyperbolic measures: a geometrical
  approach","Final version. Will appear in Mathematical Proceedings of the
  Cambridge Philosophical Society",,,,"math.DS","http://arxiv.org/licenses/nonexclusive-distrib/1.0/","  We study $C^1$-robustly transitive and nonhyperbolic diffeomorphisms having a
partially hyperbolic splitting with one-dimensional central bundle whose strong
un-/stable foliations are both minimal. {In dimension $3$, an important class
of examples of such systems is given by those with a simple closed periodic
curve tangent to the central bundle.} We prove that there is a $C^1$-open and
dense subset of such diffeomorphisms such that every nonhyperbolic ergodic
measure (i.e. with zero central exponent) can be approximated in the weak$\ast$
topology and in entropy by measures supported in basic sets with positive
(negative) central Lyapunov exponent. Our method also allows to show how
entropy changes across measures with central Lyapunov exponent close to zero.
We also prove that any nonhyperbolic ergodic measure is in the intersection of
the convex hulls of the measures with positive central exponent and with
negative central exponent.
","[{""version"":""v1"",""created"":""Mon, 16 Apr 2018 19:51:37 GMT""},{""version"":""v2"",""created"":""Wed, 19 Jun 2019 01:28:05 GMT""}]","2019-06-20"
"1804.05914","Carlos Navia C. navia","Carlos E. Navia","On the radial acceleration relation for galaxies in a wide range of
  redshifts","9 pages, 6 figures",,,,"astro-ph.GA","http://arxiv.org/licenses/nonexclusive-distrib/1.0/","  The thermal history of the Universe is introduced within the Debye
Gravitational Theory (DGT), a thermodynamic theory of induced gravity, and
allows to obtain the evolution of systems with the redshift. DGT reproduce the
ESO VLT observations, showing falling outer rotation curves for galaxies at
redshift above 0.77. A scaling law is observed in the radial acceleration
relation (RAR) of galaxies. For accelerations smaller than $\sim
10^{-10}ms^{-1}$ the observed acceleration $g_{obs}$ decreases more slowly than
acceleration generated by the baryonic mass $g_{bar}$, following always the
relation $g_{obs} \sim \sqrt{g_{bar}}$. The RAR does not care about the
specific properties of the galaxy, the relation exists in nearby high-mass
elliptical and low-mass spheroidal galaxies. In this paper, through a
straightforward analysis, we show that according to DGT, the RAR scaling law
observed in nearby galaxies is broken, when are considered distant galaxies.
The extreme case happen for galaxies at redshift above 0.77, because according
to DGT, the galaxies have declining rotation curves, and the rotation velocity
falling faster than the Keplerian-law curve. Then in this case $g_{obs}$
decreases more faster than $g_{bar}$, this means that $g_{obs}$ is
systematically lower than $g_{bar}$. We show that DGT prediction for the RAR of
galaxies at high redshift is in agreement from those obtained from the falling
rotation curves observed by VLT telescope.
","[{""version"":""v1"",""created"":""Mon, 16 Apr 2018 19:53:05 GMT""}]","2018-04-18"
"1804.05915","Liyuan Zhang","Liyuan Zhang and Kshitij Khare","Trace class Markov chains for the Normal-Gamma Bayesian shrinkage model","29 pages",,,,"math.ST stat.TH","http://arxiv.org/licenses/nonexclusive-distrib/1.0/","  High-dimensional data, where the number of variables exceeds or is comparable
to the sample size, is now pervasive in many scientific applications. In recent
years, Bayesian shrinkage models have been developed as effective and
computationally feasible tools to analyze such data, especially in the context
of linear regression. In this paper, we focus on the Normal-Gamma shrinkage
model developed by Griffin and Brown. This model subsumes the popular Bayesian
lasso model, and a three-block Gibbs sampling algorithm to sample from the
resulting intractable posterior distribution has been developed by Griffin and
Brown. We consider an alternative two-block Gibbs sampling algorithm and
rigorously demonstrate its advantage over the three-block sampler by comparing
specific spectral properties. In particular, we show that the Markov operator
corresponding to the two-block sampler is trace class (and hence
Hilbert-Schmidt), whereas the operator corresponding to the three-block sampler
is not even Hilbert-Schmidt. The trace class property for the two-block sampler
implies geometric convergence for the associated Markov chain, which justifies
the use of Markov chain CLT's to obtain practical error bounds for MCMC based
estimates. Additionally, it facilitates theoretical comparisons of the
two-block sampler with sandwich algorithms which aim to improve performance by
inserting inexpensive extra steps in between the two conditional draws of the
two-block sampler.
","[{""version"":""v1"",""created"":""Mon, 16 Apr 2018 19:55:21 GMT""}]","2018-04-18"
"1804.05916","Ludovico Minati","Stanis{\l}aw Dro\.zd\.z, Robert G\k{e}barowski, Ludovico Minati,
  Pawe{\l} O\'swi\k{e}cimka, Marcin W\k{a}torek","Bitcoin market route to maturity? Evidence from return fluctuations,
  temporal correlations and multiscaling effects",,"S. Drozdz, R. Gebarowski, L. Minati, P. Oswiecimka, and M.
  Watorek, Chaos 28, 071101 (2018)","10.1063/1.5036517",,"q-fin.ST cs.CE econ.EM","http://arxiv.org/licenses/nonexclusive-distrib/1.0/","  Based on 1-minute price changes recorded since year 2012, the fluctuation
properties of the rapidly-emerging Bitcoin (BTC) market are assessed over
chosen sub-periods, in terms of return distributions, volatility
autocorrelation, Hurst exponents and multiscaling effects. The findings are
compared to the stylized facts of mature world markets. While early trading was
affected by system-specific irregularities, it is found that over the months
preceding Apr 2018 all these statistical indicators approach the features
hallmarking maturity. This can be taken as an indication that the Bitcoin
market, and possibly other cryptocurrencies, carry concrete potential of
imminently becoming a regular market, alternative to the foreign exchange
(Forex). Since high-frequency price data are available since the beginning of
trading, the Bitcoin offers a unique window into the statistical
characteristics of a market maturation trajectory.
","[{""version"":""v1"",""created"":""Mon, 16 Apr 2018 20:00:01 GMT""},{""version"":""v2"",""created"":""Thu, 19 Jul 2018 06:12:39 GMT""}]","2018-07-20"
"1804.05917","Ramon Fraga Pereira","Ramon Fraga Pereira and Felipe Meneguzzi","Heuristic Approaches for Goal Recognition in Incomplete Domain Models",,,,,"cs.AI","http://arxiv.org/licenses/nonexclusive-distrib/1.0/","  Recent approaches to goal recognition have progressively relaxed the
assumptions about the amount and correctness of domain knowledge and available
observations, yielding accurate and efficient algorithms. These approaches,
however, assume completeness and correctness of the domain theory against which
their algorithms match observations: this is too strong for most real-world
domains. In this paper, we develop goal recognition techniques that are capable
of recognizing goals using \textit{incomplete} (and possibly incorrect) domain
theories. We show the efficiency and accuracy of our approaches empirically
against a large dataset of goal and plan recognition problems with incomplete
domains.
","[{""version"":""v1"",""created"":""Mon, 16 Apr 2018 20:00:41 GMT""}]","2018-04-18"
"1804.05918","Zeyu Dai","Zeyu Dai, Ruihong Huang","Improving Implicit Discourse Relation Classification by Modeling
  Inter-dependencies of Discourse Units in a Paragraph","Accepted by NAACL 2018",,,,"cs.CL","http://arxiv.org/licenses/nonexclusive-distrib/1.0/","  We argue that semantic meanings of a sentence or clause can not be
interpreted independently from the rest of a paragraph, or independently from
all discourse relations and the overall paragraph-level discourse structure.
With the goal of improving implicit discourse relation classification, we
introduce a paragraph-level neural networks that model inter-dependencies
between discourse units as well as discourse relation continuity and patterns,
and predict a sequence of discourse relations in a paragraph. Experimental
results show that our model outperforms the previous state-of-the-art systems
on the benchmark corpus of PDTB.
","[{""version"":""v1"",""created"":""Mon, 16 Apr 2018 20:01:06 GMT""}]","2018-04-18"
