"1804.05763","Francesco Albarelli","Francesco Albarelli, Marco G. Genoni, Matteo G. A. Paris, Alessandro
  Ferraro","Resource theory of quantum non-Gaussianity and Wigner negativity","18 pages, 10 figures, close to published version","Phys. Rev. A 98, 052350 (2018)","10.1103/PhysRevA.98.052350",,"quant-ph","http://arxiv.org/licenses/nonexclusive-distrib/1.0/","  We develop a resource theory for continuous-variable systems grounded on
operations routinely available within current quantum technologies. In
particular, the set of free operations is convex and includes quadratic
transformations and conditional coarse-grained measurements. The present theory
lends itself to quantify both quantum non-Gaussianity and Wigner negativity as
resources, depending on the choice of the free-state set --- i.e., the convex
hull of Gaussian states or the states with positive Wigner function,
respectively. After showing that the theory admits no maximally resourceful
state, we define a computable resource monotone --- the Wigner logarithmic
negativity. We use the latter to assess the resource content of experimentally
relevant states --- e.g., photon-added, photon-subtracted, cubic-phase, and cat
states --- and to find optimal working points of some resource concentration
protocols. We envisage applications of this framework to sub-universal and
universal quantum information processing over continuous variables.
","[{""version"":""v1"",""created"":""Mon, 16 Apr 2018 16:05:44 GMT""},{""version"":""v2"",""created"":""Tue, 4 Dec 2018 17:15:01 GMT""}]","2018-12-05"
"1804.05764","Samuel Remedios","Samuel Remedios, Dzung L. Pham, John A. Butman, Snehashis Roy","Classifying magnetic resonance image modalities with convolutional
  neural networks","Github: https://github.com/sremedios/phinet",,"10.1117/12.2293943",,"cs.CV","http://arxiv.org/licenses/nonexclusive-distrib/1.0/","  Magnetic Resonance (MR) imaging allows the acquisition of images with
different contrast properties depending on the acquisition protocol and the
magnetic properties of tissues. Many MR brain image processing techniques, such
as tissue segmentation, require multiple MR contrasts as inputs, and each
contrast is treated differently. Thus it is advantageous to automate the
identification of image contrasts for various purposes, such as facilitating
image processing pipelines, and managing and maintaining large databases via
content-based image retrieval (CBIR). Most automated CBIR techniques focus on a
two-step process: extracting features from data and classifying the image based
on these features. We present a novel 3D deep convolutional neural network
(CNN)-based method for MR image contrast classification. The proposed CNN
automatically identifies the MR contrast of an input brain image volume.
Specifically, we explored three classification problems: (1) identify
T1-weighted (T1-w), T2-weighted (T2-w), and fluid-attenuated inversion recovery
(FLAIR) contrasts, (2) identify pre vs post-contrast T1, (3) identify pre vs
post-contrast FLAIR. A total of 3418 image volumes acquired from multiple sites
and multiple scanners were used. To evaluate each task, the proposed model was
trained on 2137 images and tested on the remaining 1281 images. Results showed
that image volumes were correctly classified with 97.57% accuracy.
","[{""version"":""v1"",""created"":""Mon, 16 Apr 2018 16:08:39 GMT""},{""version"":""v2"",""created"":""Tue, 17 Apr 2018 01:47:16 GMT""}]","2018-04-18"
"1804.05765","Fulvio Tessarotto","J.Agarwala, M.Alexeev, C.D.R.Azevedo, R.Birsa, F.Bradamante,
  A.Bressan, C.Chatterjee, M.Chiosso, A.Cicuttin, P.Ciliberti, M.L.Crespo,
  S.Dalla Torre, S.S.Dasgupta, O.Denisov, M.Finger, M.Finger Jr., B.Gobbo,
  M.Gregori, G.Hamar, S.Levorato, A.Maggiora, A.Martin, G.Menon, J.Novy,
  D.Panzieri, F.A.B.Pereira, C.A.Santos, G.Sbrizzai, M.Slunecka, K.Steiger,
  L.Steiger, M.Sulc, F.Tessarotto, J.F.C.A.Veloso, Y.Zhao","The novel photon detectors based on MPGD technologies for the upgrade of
  COMPASS RICH-1","5th International Conference on Micro-Pattern Gas Detectors
  (MPGD2017), speaker: F.Tessarotto (INFN -Trieste)",,,,"physics.ins-det hep-ex nucl-ex","http://arxiv.org/licenses/nonexclusive-distrib/1.0/","  The RICH-1 Detector of the COMPASS experiment at CERN SPS has undergone an
important upgrade in 2016. Four new photon detectors, based on MPGD technology
and covering a total active area larger than 1.2~$m^2$ have replaced the
previously used MWPC-based photon detectors. The new detector architecture,
resulting from a dedicated, eight years long, R\&D program, consists in a
hybrid MPGD combination of two THGEMs and a Micromegas stage; the first THGEM,
coated with a CsI layer, acts as a reflective photocathode. The signals are
extracted from the anode pads by capacitive coupling and read-out by analog
front-end electronics based on the APV25 chip. The new COMPASS RICH-1 photon
detectors are described in detail: the detector design, the engineering
aspects, the mass production, and the quality assessment are discussed. The
assembly of the MPGD components and the installation of the new detectors are
illustrated together with the main aspects of the commissioning. Preliminary
indication of performance results are also presented.
","[{""version"":""v1"",""created"":""Mon, 16 Apr 2018 16:08:57 GMT""}]","2018-04-17"
"1804.05766","Kevin Brown","Kevin S. Brown and Paul D. Allopenna and William R. Hunt and Rachael
  Steiner and Elliot Saltzman and Ken McRae and James S. Magnuson","Universal Features in Phonological Neighbor Networks",,,"10.3390/e20070526",,"q-bio.NC","http://arxiv.org/licenses/nonexclusive-distrib/1.0/","  Human speech perception involves transforming a countinous acoustic signal
into discrete linguistically meaningful units, such as phonemes, while
simultaneously causing a listener to activate words that are similar to the
spoken utterance and to each other. The Neighborhood Activation Model
(NAM~\cite{Luce:1986,Luce:1998}) posits that phonological neighbors (two forms
[words] that differ by one phoneme) compete significantly for recognition as a
spoken word is heard. This definition of phonological similarity can be
extended to an entire corpus of forms to produce a phonological neighbor
network~\cite{Vitevitch:2008} (PNN). We study PNNs for five languages: English,
Spanish, French, Dutch, and German. Consistent with previous work, we find that
the PNNs share a consistent set of topological features. Using an approach that
generates random lexicons with increasing levels of phonological realism, we
show that even random forms with minimal relationship to any real language,
combined with only the empirical distribution of language-specific phonological
form lengths, are sufficient to produce the topological properties observed in
the real language PNNs. The resulting pseudo-PNNs are insensitive to the level
of lingusitic realism in the random lexicons but quite sensitive to the shape
of the form length distribution. We therefore conclude that ""universal""
features seen across multiple languages are really string universals, not
language universals, and arise primarily due to limitations in the kinds of
networks generated by the one-step neighbor definition. Taken together, our
results indicate that caution is warranted when linking the dynamics of human
spoken word recognition to the topological properties of PNNs, and that the
investigation of alternative similarity metrics for phonological forms should
be a priority.
","[{""version"":""v1"",""created"":""Mon, 16 Apr 2018 16:10:00 GMT""}]","2018-08-01"
"1804.05767","Roberto Pagaria","Roberto Pagaria","Two Examples of Toric Arrangements","12 pages, 1 figure, removed section 3","Journal of Combinatorial Theory, Series A 167 (2019) 389-402","10.1016/j.jcta.2019.05.006",,"math.CO math.AT","http://arxiv.org/licenses/nonexclusive-distrib/1.0/","  We show that the integral cohomology algebra of the complement of a toric
arrangement is not determined by the poset of layers. Moreover, the rational
cohomology algebra is not determined by the arithmetic matroid (however it is
determined by the poset of layers).
","[{""version"":""v1"",""created"":""Mon, 16 Apr 2018 16:13:43 GMT""},{""version"":""v2"",""created"":""Thu, 7 Jun 2018 10:24:09 GMT""},{""version"":""v3"",""created"":""Tue, 18 Jun 2019 13:29:12 GMT""}]","2019-06-19"
"1804.05768","Efthymios Sofos","Efthymios Sofos, Erik Visse","The density of fibres with a rational point for a fibration over
  hypersurfaces of low degree","To appear in Annales de l'Institut Fourier",,,,"math.NT","http://arxiv.org/licenses/nonexclusive-distrib/1.0/","  We prove asymptotics for the proportion of fibres with a rational point in a
conic bundle fibration. The basis of the fibration is a general hypersurface of
low degree.
","[{""version"":""v1"",""created"":""Mon, 16 Apr 2018 16:15:29 GMT""},{""version"":""v2"",""created"":""Wed, 27 Feb 2019 12:50:51 GMT""},{""version"":""v3"",""created"":""Tue, 8 Oct 2019 17:35:08 GMT""},{""version"":""v4"",""created"":""Fri, 20 Dec 2019 14:21:30 GMT""}]","2019-12-23"
"1804.05769","Tomaz Mertelj","M. Naseska (1), A. Pogrebna (1,2), G. Cao (3), Z. A. Xu (3), D.
  Mihailovic (1,4) and T. Mertelj (1,4) ((1) Complex Matter Dept., Jozef Stefan
  Institute, Jamova 39, Ljubljana, SI-1000, Ljubljana, Slovenia (2) Radboud
  University, Institute for Molecules and Materials, Nijmegen 6525 AJ, The
  Netherlands (3) Department of Physics, Zhejiang University, Hangzhou 310027,
  People's Republic of China (4) CENN Nanocenter, Jamova 39, Ljubljana SI-1000,
  Slovenia)","Ultrafast destruction and recovery of the spin density wave order in
  iron based pnictides: a multi-pulse optical study",,"Phys. Rev. B 98, 035148 (2018)","10.1103/PhysRevB.98.035148",,"cond-mat.str-el","http://arxiv.org/licenses/nonexclusive-distrib/1.0/","  We report on systematic excitation-density dependent all-optical femtosecond
time resolved study of the spin-density wave state in iron-based
superconductors. The destruction and recovery dynamics are measured by means of
the standard and a multi-pulse pump-probe technique. The experimental data are
analyzed and interpreted in the framework of an extended three temperature
model. The analysis suggests that the optical-phonons energy-relaxation plays
an important role in the recovery of almost exclusively electronically driven
spin density wave order.
","[{""version"":""v1"",""created"":""Mon, 16 Apr 2018 16:17:28 GMT""}]","2018-08-08"
"1804.05770","Jochen Br\""ocker","Jochen Br\""ocker","Assessing the reliability of ensemble forecasting systems under serial
  dependence","12 pages, 3 figures",,"10.1002/qj.3379",,"physics.ao-ph math.ST stat.TH","http://arxiv.org/licenses/nonexclusive-distrib/1.0/","  The problem of testing the reliability of ensemble forecasting systems is
revisited. A popular tool to assess the reliability of ensemble forecasting
systems (for scalar verifications) is the rank histogram, this histogram is
expected to be more or less flat, since for a reliable ensemble, the ranks are
uniformly distributed among their possible outcomes. Quantitative tests for
flatness (e.g.\ Pearson's goodness--of--fit test) have been suggested, without
exception though, these tests assume the ranks to be a sequence of independent
random variables, which is not the case in general as can be demonstrated with
simple toy examples. In this paper, tests are developed that take the temporal
correlations between the ranks into account. A refined analysis shows that
exploiting the reliability property, the ranks still exhibit strong decay of
correlations. This property is key to the analysis, and the proposed tests are
valid for general ensemble forecasting systems with minimal extraneous
assumptions.
","[{""version"":""v1"",""created"":""Mon, 16 Apr 2018 16:17:37 GMT""}]","2018-12-26"
"1804.05772","Nils Gessert","Kaori V. Laino, Thore Saathoff, Thiusius R. Savarimuthu, Kim Lindberg
  Schwaner, Nils Gessert, Alexander Schlaefer","Design and implementation of a wireless instrument adapter","Published at CURAC 2017",,,,"cs.RO","http://arxiv.org/licenses/nonexclusive-distrib/1.0/","  The evaluation of new methods for control and manipulation in minimally
invasive robotic surgery requires a realistic setup. To decouple the evaluation
of methods from overall clinical systems, we propose an instrument adapter for
the S line EndoWrist\c{opyright} instruments of the da Vinci surgical system.
The adapter is small and lightweight and can be mounted to any robot to mimic
motion. We describe its design and implementation, as well as a setup to
calibrate instruments to study precise motion control. Our results indicate
that each instrument requires individual calibration. The calibration shows
that the system is not fully linear. The repeatability of poses in the same
sense of rotation has an RMSE of 0.27{\deg}/ and a standard deviation below
0.3{\deg} for pitching and 4.7{\deg} for yawing averaged over three
measurements. When comparing the same poses in clockwise and counter-clockwise
direction the RMSE is 12.8{\deg} and 5.7{\deg} for pitching and yawing,
respectively. This is likely due to motor hysteresis.
","[{""version"":""v1"",""created"":""Mon, 16 Apr 2018 16:22:08 GMT""},{""version"":""v2"",""created"":""Tue, 17 Apr 2018 10:33:39 GMT""}]","2018-04-18"
"1804.05773","Jakub Zakrzewski","Jan H. Thiede, Bruno Eckhardt, Dmitry K. Efimov, Jakub S.
  Prauzner-Bechcicki and Jakub Zakrzewski","Ab initio study of time-dependent dynamics in strong-field triple
  ionization","updated close to published version","Phys. Rev. A 98, 031401 (2018)","10.1103/PhysRevA.98.031401",,"physics.atom-ph physics.optics","http://arxiv.org/licenses/nonexclusive-distrib/1.0/","  An ab initio analysis of strong-field three-electron ionization in a
restricted-dimensionality model reveals the dynamics of the ionization process
and the dominant channels for double (DI) and triple ionization (TI).
Simulations using wave functions that respect the Pauli principle show that the
most likely channel is a sequence of single ionization (SI) and DI, while
direct TI has a much lower probability. The dominant DI process has the highest
probability for a singlet of up- and down-spin electrons. The results
demonstrate the significance of the Pauli principle for the selection of
dominant pathways in ionization and possibly other many-electron processes in
strong fields.
","[{""version"":""v1"",""created"":""Mon, 16 Apr 2018 16:22:53 GMT""},{""version"":""v2"",""created"":""Sat, 18 Apr 2020 15:00:22 GMT""}]","2020-04-21"
"1804.05774","Sergio Ram\'irez-Gallego","Sergio Ram\'irez-Gallego and Salvador Garc\'ia and Ning Xiong and
  Francisco Herrera","BELIEF: A distance-based redundancy-proof feature selection method for
  Big Data","30 pages, 6 figures",,,,"cs.LG stat.ML","http://arxiv.org/licenses/nonexclusive-distrib/1.0/","  With the advent of Big Data era, data reduction methods are highly demanded
given its ability to simplify huge data, and ease complex learning processes.
Concretely, algorithms that are able to filter relevant dimensions from a set
of millions are of huge importance. Although effective, these techniques suffer
from the ""scalability"" curse as well.
  In this work, we propose a distributed feature weighting algorithm, which is
able to rank millions of features in parallel using large samples. This method,
inspired by the well-known RELIEF algorithm, introduces a novel redundancy
elimination measure that provides similar schemes to those based on entropy at
a much lower cost. It also allows smooth scale up when more instances are
demanded in feature estimations. Empirical tests performed on our method show
its estimation ability in manifold huge sets --both in number of features and
instances--, as well as its simplified runtime cost (specially, at the
redundancy detection step).
","[{""version"":""v1"",""created"":""Mon, 16 Apr 2018 16:23:14 GMT""}]","2018-04-17"
"1804.05775","Laureano Ramirez-Piscina","Laureano Ram\'irez-Piscina, Jos\'e M. Sancho","Physical properties of voltage gated pores","9 pages, 8 figures","European Physical Journal B 91, 10 (2018)","10.1140/epjb/e2017-80569-5",,"physics.bio-ph","http://arxiv.org/licenses/nonexclusive-distrib/1.0/","  Experiments on single ionic channels have contributed to a large extent to
our current view on the function of cell membrane. In these experiments the
main observables are the physical quantities: ionic concentration, membrane
electrostatic potential and ionic fluxes, all of them presenting large
fluctuations. The classical theory of Goldman--Hodking--Katz assumes that an
open channel can be well described by a physical pore where ions follow
statistical physics. Nevertheless real molecular channels are active pores with
open and close dynamical states. By skipping the molecular complexity of real
channels, here we present the internal structure and calibration of two active
pore models. These models present a minimum set of degrees of freedom,
specifically ion positions and gate states, which follow Langevin equations
constructed from an unique potential energy functional and by using standard
rules of statistical physics. Numerical simulations of both models are
implemented and the results show that they have dynamical properties very close
to those observed in experiments of Na and K molecular channels. In particular
a significant effect of the external ion concentration on gating dynamics is
predicted, which is consistent with previous experimental observations. This
approach can be extended to other channel types with more specific
phenomenology.
","[{""version"":""v1"",""created"":""Mon, 16 Apr 2018 16:23:28 GMT""}]","2018-04-17"
"1804.05776","Kuan Cheng","Kuan Cheng, Zhengzhong Jin, Xin Li, Ke Wu","Deterministic Document Exchange Protocols, and Almost Optimal Binary
  Codes for Edit Errors","34 pages, 2 figures",,,,"cs.DS","http://arxiv.org/licenses/nonexclusive-distrib/1.0/","  We study two basic problems regarding edit error, i.e. document exchange and
error correcting codes for edit errors (insdel codes). For message length $n$
and edit error upper bound $k$, it is known that in both problems the optimal
sketch size or the optimal number of redundant bits is $\Theta(k \log
\frac{n}{k})$. However, known constructions are far from achieving these
bounds.
  We significantly improve previous results on both problems. For document
exchange, we give an efficient deterministic protocol with sketch size
$O(k\log^2 \frac{n}{k})$. This significantly improves the previous best known
deterministic protocol, which has sketch size $O(k^2 + k \log^2 n)$
(Belazzougui15). For binary insdel codes, we obtain the following results:
  1. An explicit binary insdel code which encodes an $n$-bit message $x$
against $k$ errors with redundancy $O(k \log^2 \frac{n}{k})$. In particular
this implies an explicit family of binary insdel codes that can correct
$\varepsilon$ fraction of insertions and deletions with rate $1-O(\varepsilon
\log^2 (\frac{1}{\varepsilon}))=1-\widetilde{O}(\varepsilon)$.
  2. An explicit binary insdel code which encodes an $n$-bit message $x$
against $k$ errors with redundancy $O(k \log n)$. This is the first explicit
construction of binary insdel codes that has optimal redundancy for a wide
range of error parameters $k$, and this brings our understanding of binary
insdel codes much closer to that of standard binary error correcting codes.
  In obtaining our results we introduce the notion of \emph{$\varepsilon$-self
matching hash functions} and \emph{$\varepsilon$-synchronization hash
functions}. We believe our techniques can have further applications in the
literature.
","[{""version"":""v1"",""created"":""Mon, 16 Apr 2018 16:24:13 GMT""},{""version"":""v2"",""created"":""Tue, 17 Apr 2018 00:44:21 GMT""},{""version"":""v3"",""created"":""Fri, 20 Apr 2018 03:54:48 GMT""},{""version"":""v4"",""created"":""Tue, 17 Jul 2018 04:06:55 GMT""}]","2018-07-18"
"1804.05777","M. N. Rebelo","M. N. Rebelo","Neutrino Physics and Leptonic Weak Basis Invariants","7 pages, no figures. Invited talk given at 18th Lomonosov Conference
  on Elementary Particle Physics (Moscow, Russia, August 24-30, 2017)",,,,"hep-ph","http://arxiv.org/licenses/nonexclusive-distrib/1.0/","  In this talk we present a powerful tool applied to the study of Leptonic
Physics. This tool is based on the construction of Weak Basis invariant
relations associated to different properties of leptonic models. The rationale
behind these constructions is the fact that fermion mass matrices related
through weak basis transformations look different but lead to the same physics.
Such invariants can be built, for instance, with the aim to test leptonic
models for different types of CP violation. These invariants are also relevant
beyond such tests and have been applied to the study of implications from zero
textures appearing in the leptonic mass matrices. In this case an important
question is, how can a flavour model corresponding to a set of texture zeros be
recognised, when written in a different weak basis, where the zeros are not
explicitly present. Another important application is the construction of
invariants sensitive to the neutrino mass ordering and the $\theta_{23}$
octant.
","[{""version"":""v1"",""created"":""Mon, 16 Apr 2018 16:30:35 GMT""}]","2018-04-17"
"1804.05778","Tathagata Basak","Tathagata Basak","A new complex reflection group in $PU(9,1)$ and the Barnes-Wall lattice","24 pages, 1 figure, submitted","Pacific J. Math. 307 (2020) 13-51","10.2140/pjm.2020.307.13",,"math.RT","http://arxiv.org/licenses/nonexclusive-distrib/1.0/","  We show that the projectivized complex reflection group $\Gamma$ of the
unique $(1+i)$-modular Hermitian $\mathbb{Z}[i]$-module of signature $(9,1)$ is
a new arithmetic reflection group in $PU(9,1)$. We find $32$ complex
reflections of order four generating $\Gamma$. The mirrors of these $32$
reflections form the vertices of a sort of Coxeter-Dynkin diagram $D$ for
$\Gamma$ that encode Coxeter-type generators and relations for $\Gamma$. The
vertices of $D$ can be indexed by sixteen points and sixteen affine hyperplanes
in $\mathbb{F}_2^4$. The edges of $D$ are determined by the finite geometry of
these points and hyperplanes. The group of automorphisms of the diagram $D$ is
$2^4 \colon (2^3 \colon L_3(2)) \colon 2$. This group transitively permutes the
$32$ mirrors of generating reflections and fixes an unique point $\tau$ in
$\mathbb{C} H^9$. These $32$ mirrors are precisely the mirrors closest to
$\tau$. These results are strikingly similar to the results satisfied by the
complex hyperbolic reflection group at the center of Allcock's monstrous
proposal.
","[{""version"":""v1"",""created"":""Mon, 16 Apr 2018 16:31:05 GMT""}]","2020-08-12"
"1804.05779","Stefan Steinerberger","Stefan Steinerberger","Quantitative Projections in the Sturm Oscillation Theorem",,,,,"math.CA math.FA math.SP","http://arxiv.org/licenses/nonexclusive-distrib/1.0/","  There is $c_{} > 0$ such that for all $f \in C[0,\pi]$ with at most $d-1$
roots inside $(0,\pi)$ $$ \sum_{1 \leq n \leq d}{ \left| \left\langle f,
\sin\left( n x\right) \right\rangle \right|} \geq \kappa^{-\kappa^2
\log{\kappa}}\|f\|_{L^2} \qquad \mbox{where} \quad \kappa = \frac{c_{} \|
\nabla f\|_{L^2}}{\|f\|_{L^2}}.$$ This quantifies the Sturm-Hurwitz Theorem and
connects a purely topological condition (number of roots) to the Fourier
spectrum. It is also one of few estimates on Fourier coefficients from below.
The result holds more generally for eigenfunctions of regular Sturm-Liouville
problems $$ - (p(x) y'(x))' + q(x) y(x) = \lambda w(x) y(x) \qquad
\mbox{on}~(a,b).$$ Sturm-Liouville theory shows the existence of a sequence of
solutions $(\phi_n)_{n=1}^{\infty}$ that form an orthogonal basis of $L^2(a,b)$
with respect to $w(x)dx$. Sturm himself proved that if $f:(a,b) \rightarrow
\mathbb{R}$ is a finite linear combinations of $\phi_n$ having $d-1$ roots
inside $(a,b)$, then $f$ cannot be orthogonal to $A = \mbox{span}\left\{\phi_1,
\dots, \phi_{d}\right\}$. We prove a lower bound on the size of the projection
$\| \pi_A f\|_{}$.
","[{""version"":""v1"",""created"":""Mon, 16 Apr 2018 16:38:06 GMT""},{""version"":""v2"",""created"":""Wed, 18 Apr 2018 16:40:08 GMT""}]","2018-04-19"
"1804.05780","Mart\'i Prats","Mart\'i Prats","Measuring Triebel-Lizorkin fractional smoothness on domains in terms of
  first-order differences","25 pages, 3 figures log: misprints fixed, a couple of proofs amended,
  the range of indices $p$ and $q$ has been extended to the usual endpoints, an
  appendix is needed to address some background in these cases",,"10.1112/jlms.12225",,"math.CA","http://arxiv.org/licenses/nonexclusive-distrib/1.0/","  In this note we give equivalent characterizations for a fractional
Triebel-Lizorkin space $F^s_{p,q}(\Omega)$ in terms of first-order differences
in a uniform domain $\Omega$. The characterization is valid for any positive,
non-integer real smoothness $s\in \mathbb{R}_+\setminus \mathbb{N}$ and
{indices $1\leq p<\infty$, $1\leq q \leq \infty$} as long as the fractional
part $\{s\}$ is greater than $d/p-d/q$.
","[{""version"":""v1"",""created"":""Mon, 16 Apr 2018 16:40:20 GMT""},{""version"":""v2"",""created"":""Tue, 17 Apr 2018 13:01:26 GMT""},{""version"":""v3"",""created"":""Wed, 18 Apr 2018 07:59:28 GMT""},{""version"":""v4"",""created"":""Tue, 2 Oct 2018 15:09:42 GMT""}]","2022-02-03"
