"1804.06043","Simon Sirca","M. Mihovilovi\v{c}, G. Jin, E. Long, Y.-W. Zhang, K. Allada, B.
  Anderson, J. R. M. Annand, T. Averett, W. Bertozzi, W. Boeglin, P. Bradshaw,
  A. Camsonne, M. Canan, G. D. Cates, C. Chen, J. P. Chen, E. Chudakov, R. De
  Leo, X. Deng, A. Deltuva, A. Deur, C. Dutta, L. El Fassi, D. Flay, S.
  Frullani, F. Garibaldi, H. Gao, S. Gilad, R. Gilman, O. Glamazdin, J. Golak,
  S. Golge, J. Gomez, O. Hansen, D. W. Higinbotham, T. Holmstrom, J. Huang, H.
  Ibrahim, C. W. de Jager, E. Jensen, X. Jiang, M. Jones, H. Kamada, H. Kang,
  J. Katich, H. P. Khanal, A. Kievsky, P. King, W. Korsch, J. LeRose, R.
  Lindgren, H.-J. Lu, W. Luo, L. E. Marcucci, P. Markowitz, M. Meziane, R.
  Michaels, B. Moffit, P. Monaghan, N. Muangma, S. Nanda, B. E. Norum, K. Pan,
  D. S. Parno, E. Piasetzky, M. Posik, V. Punjabi, A. J. R. Puckett, X. Qian,
  Y. Qiang, X. Qui, S. Riordan, A. Saha, P. U. Sauer, B. Sawatzky, R.
  Schiavilla, B. Schoenrock, M. Shabestari, A. Shahinyan, S. \v{S}irca, R.
  Skibi\'nski, J. St. John, R. Subedi, V. Sulkosky, W. Tireman, W. A. Tobias,
  K. Topolnicki, G. M. Urciuoli, M. Viviani, D. Wang, K. Wang, Y. Wang, J.
  Watson, B. Wojtsekhowski, H. Wita{\l}a, Z. Ye, X. Zhan, Y. Zhang, X. Zheng,
  B. Zhao, L. Zhu, The Jefferson Lab Hall A Collaboration","Measurement of double-polarization asymmetries in the quasi-elastic
  $^3\vec{\mathrm{He}}(\vec{\mathrm{e}},\mathrm{e}'\mathrm{p})$ process","5 pages, 3 figures, submitted to Phys. Rev. Lett","Phys. Lett. B 788 (2019) 117","10.1016/j.physletb.2018.10.063","JLAB-PHY-18-2681","nucl-ex","http://arxiv.org/licenses/nonexclusive-distrib/1.0/","  We report on a precise measurement of double-polarization asymmetries in
electron-induced breakup of $^3\mathrm{He}$ proceeding to $\mathrm{pd}$ and
$\mathrm{ppn}$ final states, performed in quasi-elastic kinematics at $Q^2 =
0.25\,(\mathrm{GeV}/c)^2$ for missing momenta up to $250\,\mathrm{MeV}/c$.
These observables represent highly sensitive tools to investigate the
electromagnetic and spin structure of $^3\mathrm{He}$ and the relative
importance of two- and three-body effects involved in the breakup reaction
dynamics. The measured asymmetries cannot be satisfactorily reproduced by
state-of-the-art calculations of $^3\mathrm{He}$ unless their three-body
segment is adjusted, indicating that the spin-dependent part of the nuclear
interaction governing the three-body breakup process is much smaller than
previously thought.
","[{""version"":""v1"",""created"":""Tue, 17 Apr 2018 05:09:01 GMT""}]","2018-12-04"
"1804.06044","Abhinav Palia","Baiyu Liu, Abhinav Palia and Shan-Ho Yang","A Scalable Permission Management System With Support of Conditional and
  Customized Attributes","4 pages, 3 figures",,,,"cs.CR","http://creativecommons.org/licenses/by/4.0/","  Along with the classical problem of managing multiple identities, actions,
devices, APIs etc. in different businesses, there has been an escalating need
for having the capability of flexible attribute based access control~(ABAC)
mechanisms. In order to fill this gap, several variations of ABAC model have
been proposed such as \textit{Amazon's AWS IAM}, which uses JSON as their
underlying storage data structure and adds policies/constraints as fields over
the regular ABAC. However, these systems still do not provide the capability to
have customized permissions and to perform various operations (such as
comparison/aggregation) on them. In this paper, we introduce a string based
resource naming strategy that supports the customized and conditional
permissions for resource access. Further, we propose the basic architecture of
our system which, along with our naming scheme, makes the system scalable,
secure, efficient, flexible and customizable. Finally, we present the proof of
concept for our algorithm as well as the experimental set up and the future
trajectory for this work.
","[{""version"":""v1"",""created"":""Tue, 17 Apr 2018 05:13:26 GMT""}]","2018-04-18"
"1804.06045","Adam Iaizzi","Adam Iaizzi and Kedar Damle and Anders W. Sandvik","Metamagnetism and zero-scale-factor universality in the two-dimensional
  $J$-$Q$ model","8 pages, 5 figures","Phys. Rev. B 98, 064405 (2018)","10.1103/PhysRevB.98.064405",,"cond-mat.str-el","http://arxiv.org/licenses/nonexclusive-distrib/1.0/","  Using a combination of quantum Monte Carlo and exact methods, we study the
field-driven saturation transition of the two-dimensional $J$-$Q$ model, in
which the antiferromagnetic Heisenberg exchange $(J)$ coupling competes with an
additional four-spin interaction $(Q)$ that favors valence-bond solid order.
For small values of $Q$, the saturation transition is continuous, and is
expected to be governed by zero-scale-factor universality at its upper critical
dimension, with a specific form of logarithmic corrections to scaling (first
proposed by Sachdev \textit{et al.} [Phys. Rev. B \textbf{50}, 258 (1994)]).
Our results conform to this expectation, but the logarithmic corrections to
scaling do not match the form predicted by Sachdev \textit{et al.} We also show
that the saturation transition becomes first order above a critical coupling
ratio $(Q/J)_{\rm min}$ and is accompanied by magnetization
jumps---metamagnetism. We obtain an exact solution for $(Q/J)_{\rm min}$ using
a high magnetization expansion, and confirm the existence of the magnetization
jumps beyond this value of coupling using quantum Monte Carlo simulations.
","[{""version"":""v1"",""created"":""Tue, 17 Apr 2018 05:13:44 GMT""},{""version"":""v2"",""created"":""Wed, 8 Aug 2018 07:34:38 GMT""}]","2018-08-15"
"1804.06046","Li-Ping Xin","Li-Ping Xin, Shu-Qing Zhong, En-Wei Liang, Jing Wang, Hao Liu,
  Tian-Meng Zhang, Xiao-Li Huang, Hua-Li Li, Yu-Lei Qiu, Xu-Hui Han, Jian-Yan
  Wei","Photometric and Spectroscopic Observations of GRB 140629A","ApJ accepted, 6 figures, 3 tables",,"10.3847/1538-4357/aabf3d",,"astro-ph.HE","http://arxiv.org/licenses/nonexclusive-distrib/1.0/","  We present our optical photometric and spectroscopical observations of GRB
140629A. A redshift of $z=2.275\pm0.043$ is measured through the metal
absorption lines in our spectroscopic data. Using our photometric data and
multiple observational data observed with other telescopes, we show that its
optical light curve is well interpreted with the standard forward shock models
in the thin shell case. Its optical-X-ray afterglow spectrum is jointly fitted
with a single power-law function, yielding a photon index of $-1.90\pm 0.05$.
The optical extinction and neutral hydrogen absorption of the GRB host galaxy
are negligible. The fit to the light curve with the standard models shows that
the ambient density is $60\pm 9$ cm$^{-3}$ and the GRB radiating efficiency is
as low as $\sim 0.24\%$, likely indicating a baryonic-dominated ejecta of this
GRB. This burst agrees well with the $L_{\rm p, iso}-E_p^{'}-\Gamma_0$
relation, but confidently violates those empirical relations involving
geometric corrections (or jet break time). This gives rise to an issue of
possible selection effect on these relations since the jet opening angle of
this GRB is extremely narrow (0.04 rad).
","[{""version"":""v1"",""created"":""Tue, 17 Apr 2018 05:13:51 GMT""}]","2018-06-13"
"1804.06047","Nandeesh Hiremath","Nandeesh Hiremath, Jose C. Sanchez, Narayanan Komerath","Static Pressure Extraction from Velocimetry in Vortical Flow Fields","6 pages long formatted for Rapid Communications to Physical Review
  Fluids, APS journal. The included 6 pages consists of abstract, references,
  12 figures, and a Table",,,,"physics.flu-dyn","http://arxiv.org/licenses/nonexclusive-distrib/1.0/","  Rapid fluctuations of static pressure away from flow boundaries in a
low-speed vortical flow, are extracted using the measured velocity field. The
technique departs from prior work in not requiring far boundary values. Stereo
Particle Image Velocimetry data satisfying the continuity equation are used as
input to a Navier-Stokes solver. Streamline curvature, inspired by the Polhamus
suction analogy, is used to determine the pressure inside recirculation
regions. The technique is validated numerically using the flow around a
circular cylinder before being applied to the vortical flow beneath the sharp
edge of a rotor blade in reversed flow. The technique proves effective for
sparsely seeded regions including recirculation zones and shear layers in
vortices.
","[{""version"":""v1"",""created"":""Tue, 17 Apr 2018 05:15:54 GMT""}]","2018-04-18"
"1804.06048","Cristina Manolache","Luca Battistella, Francesca Carocci, Cristina Manolache","Virtual classes for the working mathematician",,"SIGMA 16 (2020), 026, 38 pages","10.3842/SIGMA.2020.026",,"math.AG","http://creativecommons.org/licenses/by-sa/4.0/","  This note is intended to be a friendly introduction to virtual classes. We
review virtual classes and we give a number of properties and applications. We
also include a new virtual push-forward theorem and many computations of
virtual classes in simple examples.
","[{""version"":""v1"",""created"":""Tue, 17 Apr 2018 05:21:29 GMT""},{""version"":""v2"",""created"":""Mon, 3 Dec 2018 23:24:54 GMT""},{""version"":""v3"",""created"":""Thu, 9 Apr 2020 21:30:00 GMT""}]","2020-04-13"
"1804.06049","Katarzyna Lewandowska","Katarzyna D. Lewandowska, Tadeusz Koszto{\l}owicz","The method of an experimental determination of boundary conditions at a
  thin membrane for diffusion","6 pages",,"10.5506/APhysPolB.49.955",,"cond-mat.stat-mech","http://arxiv.org/licenses/nonexclusive-distrib/1.0/","  We present a method of deriving two boundary conditions at a thin membrane
for diffusion from experimental data. This method can be really useful in
complex membrane systems in which we do not know mechanisms of processes
occurring within the membrane, since in such a situation the theoretical
derivation of the boundary conditions seems to be impossible.
","[{""version"":""v1"",""created"":""Tue, 17 Apr 2018 05:22:13 GMT""}]","2018-08-01"
"1804.06050","Jingyi Jessica Li","Wei Vivian Li, Jingyi Jessica Li","Modeling and analysis of RNA-seq data: a review from a statistical
  perspective",,"Quantitative Biology 6 (2018) 195-209","10.1007/s40484-018-0144-7",,"q-bio.GN","http://arxiv.org/licenses/nonexclusive-distrib/1.0/","  Background: Since the invention of next-generation RNA sequencing (RNA-seq)
technologies, they have become a powerful tool to study the presence and
quantity of RNA molecules in biological samples and have revolutionized
transcriptomic studies. The analysis of RNA-seq data at four different levels
(samples, genes, transcripts, and exons) involve multiple statistical and
computational questions, some of which remain challenging up to date.
  Results: We review RNA-seq analysis tools at the sample, gene, transcript,
and exon levels from a statistical perspective. We also highlight the
biological and statistical questions of most practical considerations.
  Conclusion: The development of statistical and computational methods for
analyzing RNA- seq data has made significant advances in the past decade.
However, methods developed to answer the same biological question often rely on
diverse statical models and exhibit different performance under different
scenarios. This review discusses and compares multiple commonly used
statistical models regarding their assumptions, in the hope of helping users
select appropriate methods as needed, as well as assisting developers for
future method development.
","[{""version"":""v1"",""created"":""Tue, 17 Apr 2018 05:26:53 GMT""},{""version"":""v2"",""created"":""Sun, 29 Apr 2018 09:10:58 GMT""},{""version"":""v3"",""created"":""Tue, 1 May 2018 15:01:45 GMT""}]","2021-12-01"
"1804.06051","Kunimasa Miyazaki","Kunimasa Miyazaki, Yohei Nakayama, and Hiromichi Matsuyama","The Entropy Anomaly and the Linear Irreversible Thermodynamics","5 pages","Phys. Rev. E 98, 022101 (2018)","10.1103/PhysRevE.98.022101",,"cond-mat.stat-mech","http://arxiv.org/licenses/nonexclusive-distrib/1.0/","  The irreversible currents and entropy production rate of a dilute colloidal
suspension are calculated using the linear irreversible thermodynamics and the
linear response theory. The \anomalous"" or \hidden"" entropy recently discussed
in the context of the stochastic thermodynamics is fully accounted in these
classic frameworks. We show that the two distinct formulations lead to
identical results as long as the local equilibrium assumption or, equivalently
the linear response theory, is valid.
","[{""version"":""v1"",""created"":""Tue, 17 Apr 2018 05:35:04 GMT""},{""version"":""v2"",""created"":""Thu, 23 Aug 2018 06:23:24 GMT""}]","2018-08-24"
"1804.06052","Seungkyun Park","Seungkyun Park","An algorithm for the classification of twisted forms of toric varieties","28 pages",,,,"math.AG math.RA","http://arxiv.org/licenses/nonexclusive-distrib/1.0/","  Let $K/k$ be a finite Galois extension, $G=\text{Gal}(K/k)$, $\Sigma$ be a
fan in a lattice $N$ and $X_{\Sigma}$ be an associated toric variety over $k$.
It is well known that the set of $K/k$-forms of $X_{\Sigma}$ is in bijection
with $H^1(G,\text{Aut}_{\Sigma}^T)$, where $\text{Aut}_{\Sigma}^T$ is an
algebraic group of toric automorphisms of $X_{\Sigma}$. In this paper, we
suggest an algorithm to compute $H^1(G,\text{Aut}_{\Sigma}^T)$ and find that
followings can be classified via this algorithm : $K/k$-forms of all toric
surfaces, $K/k$-forms of all 3-dimensional affine toric varieties with no torus
factor, $K/k$-forms of all 3-dimensional quasi-projective toric varieties when
$K/k$ is cyclic.
","[{""version"":""v1"",""created"":""Tue, 17 Apr 2018 05:36:31 GMT""},{""version"":""v2"",""created"":""Thu, 26 Apr 2018 11:43:04 GMT""}]","2018-04-27"
"1804.06053","Michelle Manes","Jamie Juul, Holly Krieger, Nicole Looper, Michelle Manes, Bianca
  Thompson, and Laura Walton","Arboreal representations for rational maps with few critical points",,,,,"math.NT","http://arxiv.org/licenses/nonexclusive-distrib/1.0/","  Jones conjectures the arboreal representation of a degree two rational map
will have finite index in the full automorphism group of a binary rooted tree
except under certain conditions. We prove a version of Jones' Conjecture for
quadratic and cubic polynomials assuming the $abc$-Conjecture and Vojta's
Conjecture. We also exhibit a family of degree $2$ rational maps and give
examples of degree $3$ polynomial maps whose arboreal representations have
finite index in the appropriate group of tree automorphisms.
","[{""version"":""v1"",""created"":""Tue, 17 Apr 2018 05:45:05 GMT""},{""version"":""v2"",""created"":""Wed, 18 Apr 2018 20:35:51 GMT""}]","2018-04-20"
"1804.06054","Karim Mnasri","Joshua Feis, Karim Mnasri, Andrii Khrabustovskyi, Christian Stohrer,
  Michael Plum and Carsten Rockstuhl","Surface Plasmon Polaritons Sustained at the Interface of a Nonlocal
  Metamaterial","8 pages, 6 figures","Phys. Rev. B 98, 115409 (2018)","10.1103/PhysRevB.98.115409",,"physics.optics","http://arxiv.org/licenses/nonexclusive-distrib/1.0/","  Studying basic physical effects sustained in metamaterials characterized by
specific constitutive relation is a research topic with a long standing
tradition. Besides intellectual curiosity, it derives its importance from the
ability to predict observable phenomena that are, if found with an actual
metamaterial, a clear indication on its properties. Here, we consider a
nonlocal (strong spatial dispersion), lossy, and isotropic metamaterial and
study the impact of the nonlocality on the dispersion relation of surface
plasmon polaritons sustained at an interface between vacuum and such
metamaterial. For that, Fresnel coefficients are calculated and appropriate
surface plasmon polaritons existence conditions are being proposed. Predictions
regarding the experimentally observable reflection from a frustrated internal
reflection geometry are being made. A different behavior for TE and TM
polarization is observed. Our work unlocks novel opportunities to seek for
traces of the nonlocality in experiments made with nowadays metamaterials.
","[{""version"":""v1"",""created"":""Tue, 17 Apr 2018 05:46:46 GMT""}]","2018-09-12"
"1804.06055","Di Xie","Chao Li and Qiaoyong Zhong and Di Xie and Shiliang Pu","Co-occurrence Feature Learning from Skeleton Data for Action Recognition
  and Detection with Hierarchical Aggregation","IJCAI18 oral",,,,"cs.CV","http://arxiv.org/licenses/nonexclusive-distrib/1.0/","  Skeleton-based human action recognition has recently drawn increasing
attentions with the availability of large-scale skeleton datasets. The most
crucial factors for this task lie in two aspects: the intra-frame
representation for joint co-occurrences and the inter-frame representation for
skeletons' temporal evolutions. In this paper we propose an end-to-end
convolutional co-occurrence feature learning framework. The co-occurrence
features are learned with a hierarchical methodology, in which different levels
of contextual information are aggregated gradually. Firstly point-level
information of each joint is encoded independently. Then they are assembled
into semantic representation in both spatial and temporal domains.
Specifically, we introduce a global spatial aggregation scheme, which is able
to learn superior joint co-occurrence features over local aggregation. Besides,
raw skeleton coordinates as well as their temporal difference are integrated
with a two-stream paradigm. Experiments show that our approach consistently
outperforms other state-of-the-arts on action recognition and detection
benchmarks like NTU RGB+D, SBU Kinect Interaction and PKU-MMD.
","[{""version"":""v1"",""created"":""Tue, 17 Apr 2018 06:00:13 GMT""}]","2018-04-18"
"1804.06056","Yigit Akkus","Yigit Akkus and Ali Beskok","Molecular Diffusion Replaces Capillary Pumping in Phase-Change Driven
  Nanopumps",,,"10.1007/s10404-018-2185-7",,"cond-mat.mes-hall physics.atm-clus physics.chem-ph","http://arxiv.org/licenses/nonexclusive-distrib/1.0/","  Nano-scale fluid transport has vast applications spanning from water
desalination to biotechnology [1,2]. It is possible to pump fluids in
nano-conduits using pressure gradients [3], thermal methods [4], electric [5,6]
and magnetic fields [7], and with manipulations of surface chemistry and
electric fields [8-10]. Inspired by the capillary-driven phase change heat
transfer devices, we present a phase-change driven nanopump operating almost
isothermally. Meticulous computational experiments on different sized nanopumps
revealed efficient operation of the pump despite the reduction in system size
that extinguishes capillary pumping by annihilating the liquid meniscus
structures. Measuring the density distribution of liquid in cross sections near
to the evaporating and condensing liquid-vapor interfaces, we discovered that
phase change induced molecular scale mass diffusion mechanism replaces the
capillary pumping in the absence of meniscus structures. Therefore, proposed
pumps can serve as a part of both nanoelectromechanical (NEMS) and
microelectromechanical systems (MEMS) with similar working efficiencies, and
can be used for continuous gas separation applications.
","[{""version"":""v1"",""created"":""Tue, 17 Apr 2018 06:00:31 GMT""}]","2019-01-09"
"1804.06057","Ryota Hinami","Ryota Hinami, Junwei Liang, Shin'ichi Satoh, Alexander Hauptmann","Multimodal Co-Training for Selecting Good Examples from Webly Labeled
  Video",,,,,"cs.MM","http://arxiv.org/licenses/nonexclusive-distrib/1.0/","  We tackle the problem of learning concept classifiers from videos on the web
without using manually labeled data. Although metadata attached to videos
(e.g., video titles, descriptions) can be of help collecting training data for
the target concept, the collected data is often very noisy. The main challenge
is therefore how to select good examples from noisy training data. Previous
approaches firstly learn easy examples that are unlikely to be noise and then
gradually learn more complex examples. However, hard examples that are much
different from easy ones are never learned. In this paper, we propose an
approach called multimodal co-training (MMCo) for selecting good examples from
noisy training data. MMCo jointly learns classifiers for multiple modalities
that complement each other to select good examples. Since MMCo selects examples
by consensus of multimodal classifiers, a hard example for one modality can
still be used as a training example by exploiting the power of the other
modalities. The algorithm is very simple and easily implemented but yields
consistent and significant boosts in example selection and classification
performance on the FCVID and YouTube8M benchmarks.
","[{""version"":""v1"",""created"":""Tue, 17 Apr 2018 06:03:14 GMT""}]","2018-04-18"
"1804.06058","Irving Dai","Irving Dai","Connected Heegaard Floer homology of sums of Seifert fibrations","33 pages; final version, to appear in Algebraic & Geometric Topology","Algebr. Geom. Topol. 19 (2019) 2535-2574","10.2140/agt.2019.19.2535",,"math.GT","http://arxiv.org/licenses/nonexclusive-distrib/1.0/","  We compute the connected Heegaard Floer homology (defined by Hendricks, Hom,
and Lidman) for a large class of 3-manifolds, including all linear combinations
of Seifert fibered homology spheres. We show that for such manifolds, the
connected Floer homology completely determines the local equivalence class of
the associated $\iota$-complex. Some identities relating the rank of the
connected Floer homology to the Rokhlin invariant and the Neumann-Siebenmann
invariant are also derived. Our computations are based on combinatorial models
inspired by the work of N\'emethi on lattice homology.
","[{""version"":""v1"",""created"":""Tue, 17 Apr 2018 06:07:47 GMT""},{""version"":""v2"",""created"":""Sat, 3 Nov 2018 02:52:38 GMT""}]","2019-10-30"
"1804.06059","Mohit Iyyer","Mohit Iyyer, John Wieting, Kevin Gimpel, Luke Zettlemoyer","Adversarial Example Generation with Syntactically Controlled Paraphrase
  Networks","NAACL 2018",,,,"cs.CL","http://arxiv.org/licenses/nonexclusive-distrib/1.0/","  We propose syntactically controlled paraphrase networks (SCPNs) and use them
to generate adversarial examples. Given a sentence and a target syntactic form
(e.g., a constituency parse), SCPNs are trained to produce a paraphrase of the
sentence with the desired syntax. We show it is possible to create training
data for this task by first doing backtranslation at a very large scale, and
then using a parser to label the syntactic transformations that naturally occur
during this process. Such data allows us to train a neural encoder-decoder
model with extra inputs to specify the target syntax. A combination of
automated and human evaluations show that SCPNs generate paraphrases that
follow their target specifications without decreasing paraphrase quality when
compared to baseline (uncontrolled) paraphrase systems. Furthermore, they are
more capable of generating syntactically adversarial examples that both (1)
""fool"" pretrained models and (2) improve the robustness of these models to
syntactic variation when used to augment their training data.
","[{""version"":""v1"",""created"":""Tue, 17 Apr 2018 06:12:36 GMT""}]","2018-04-18"
"1804.06060","Rosine Lallement","R. Lallement, L. Capitanio, L. Ruiz-Dern, C. Danielski, C. Babusiaux,
  J.L. Vergely, M. Elyajouri, F. Arenou, N.Leclerc","3D maps of interstellar dust in the Local Arm: using $Gaia$, 2MASS and
  APOGEE-DR14","12 pages, to appear in Astronomy and Astrophysics","A&A 616, A132 (2018)","10.1051/0004-6361/201832832",,"astro-ph.GA","http://arxiv.org/licenses/nonexclusive-distrib/1.0/","  Gaia data and stellar surveys open the way to the construction of detailed 3D
maps of the Galactic interstellar (IS) dust based on the synthesis of star
distances and extinctions. Reliable extinction measurements require very
accurate photometric calibrations. We show the first step of an iterative
process linking 3D dust maps and photometric calibrations and improving them
simultaneously. Our previous 3D map of nearby IS dust was used to select low
reddening SDSS/APOGEE-DR14 red giants, and this database served for an
empirical effective temperature- and metallicity-dependent photometric
calibration in the Gaia G and 2MASS Ks bands. This calibration has been
combined with Gaia G-band empirical extinction coefficients recently published,
G, J and Ks photometry and APOGEE atmospheric parameters to derive the
extinction of a large fraction of the survey targets. Distances were estimated
independently using isochrones and the magnitude-independent extinction
K(J-Ks). This new dataset has been merged with the one used for the earlier
version of dust map. A new Bayesian inversion of distance-extinction pairs has
been performed to produce an updated 3D map. We present several properties of
the new map. Its comparison with 2D dust emission reveals that all large dust
shells seen in emission at mid- and high-latitude are closer than 300pc. The
updated distribution constrains the well debated, X-ray bright North Polar Spur
to originate beyond 800 pc. We use the Orion region to illustrate additional
details and distant clouds. On the large scale the map reveals a complex
structure of the Local Arm. 2 to 3 kpc-long chains of clouds appear in planes
tilted by 15 deg with respect to the Galactic plane. A series of cavities
oriented along a l=60-240deg axis crosses the Arm. (http://stilism.obspm.fr)
","[{""version"":""v1"",""created"":""Tue, 17 Apr 2018 06:13:50 GMT""}]","2018-09-05"
