"1804.06189","Alberto Poncelas","Alberto Poncelas, Dimitar Shterionov, Andy Way, Gideon Maillette de
  Buy Wenniger and Peyman Passban","Investigating Backtranslation in Neural Machine Translation",,,,,"cs.CL","http://arxiv.org/licenses/nonexclusive-distrib/1.0/","  A prerequisite for training corpus-based machine translation (MT) systems --
either Statistical MT (SMT) or Neural MT (NMT) -- is the availability of
high-quality parallel data. This is arguably more important today than ever
before, as NMT has been shown in many studies to outperform SMT, but mostly
when large parallel corpora are available; in cases where data is limited, SMT
can still outperform NMT.
  Recently researchers have shown that back-translating monolingual data can be
used to create synthetic parallel corpora, which in turn can be used in
combination with authentic parallel data to train a high-quality NMT system.
Given that large collections of new parallel text become available only quite
rarely, backtranslation has become the norm when building state-of-the-art NMT
systems, especially in resource-poor scenarios.
  However, we assert that there are many unknown factors regarding the actual
effects of back-translated data on the translation capabilities of an NMT
model. Accordingly, in this work we investigate how using back-translated data
as a training corpus -- both as a separate standalone dataset as well as
combined with human-generated parallel data -- affects the performance of an
NMT model. We use incrementally larger amounts of back-translated data to train
a range of NMT systems for German-to-English, and analyse the resulting
translation performance.
","[{""version"":""v1"",""created"":""Tue, 17 Apr 2018 12:16:25 GMT""}]","2018-04-18"
"1804.06190","Dariusz Miklaszewski","Dariusz Miklaszewski","Borsuk-Ulam theorem for the loopspace of a sphere","8 pages",,,,"math.AT","http://arxiv.org/licenses/nonexclusive-distrib/1.0/","  We study Borsuk-Ulam type results for the loopspace of an euclidean sphere
without loops equal to their inverses.
","[{""version"":""v1"",""created"":""Tue, 17 Apr 2018 12:18:50 GMT""}]","2018-04-18"
"1804.06191","Konrad Szyma\'nski","Konrad Szyma\'nski and Karol \.Zyczkowski","Geometric and algebraic origins of additive uncertainty relations","11 pages, 5 figures, 6 pages of appendix",,,,"quant-ph","http://arxiv.org/licenses/nonexclusive-distrib/1.0/","  Constructive techniques to establish state-independent uncertainty relations
for the sum of variances of arbitrary two observables are presented. We
investigate the range of simultaneously attainable pairs of variances, which
can be applied to a wide variety of problems including finding exact bound for
the sum of variances of two components of angular momentum operator for any
total angular momentum quantum number $j$ and detection of quantum
entanglement. Resulting uncertainty relations are state-independent,
semianalytical, bounded-error and can be made arbitrarily tight. The advocated
approach, based on the notion of joint numerical range of a number of
observables and uncertainty range, allows us to improve earlier numerical works
and to derive semianalytical tight bounds for the uncertainty relation for the
sum of variances expressed as roots of a polynomial of a single real variable.
","[{""version"":""v1"",""created"":""Tue, 17 Apr 2018 12:20:38 GMT""},{""version"":""v2"",""created"":""Thu, 25 Apr 2019 06:59:57 GMT""}]","2019-04-26"
"1804.06192","Bertrand Lods","Ricardo Alonso (PUC-RIO), V\'eronique Bagland (LMBP), Bertrand Lods, V
  Eronique Bagland","Convergence to self-similarity for ballistic annihilation dynamics",,,,,"math.AP math-ph math.MP","http://arxiv.org/licenses/nonexclusive-distrib/1.0/","  We consider the spatially homogeneous Boltzmann equation for ballistic
annihilation in dimension d 2. Such model describes a system of ballistic hard
spheres that, at the moment of interaction, either annihilate with probability
$\alpha$ $\in$ (0, 1) or collide elastically with probability 1 -- $\alpha$.
Such equation is highly dissipative in the sense that all observables, hence
solutions, vanish as time progresses. Following a contribution , by two of the
authors, considering well posedness of the steady self-similar profile in the
regime of small annihilation rate $\alpha$ $\ll$ 1, we prove here that such
self-similar profile is the intermediate asymptotic attractor to the
annihilation dynamics with explicit universal algebraic rate. This settles the
issue about universality of the annihilation rate for this model brought in the
applied literature.
","[{""version"":""v1"",""created"":""Tue, 17 Apr 2018 12:20:57 GMT""},{""version"":""v2"",""created"":""Fri, 20 Apr 2018 09:34:38 GMT""}]","2018-04-23"
"1804.06193","Hui Liu","Hui Liu and Wei Wang","Closed geodesics on positively curved spheres $S^n$ with Finsler metric
  induced by $(\mathbb{R}P^n,F)$","we cannot get the lower bound for I_d(-1) in page 11",,,,"math.DG math.DS","http://arxiv.org/licenses/nonexclusive-distrib/1.0/","  It's well known that the n-sphere $S^n$ is the universal double covering of
the $n$-dimensional real projective space $\mathbb{R}P^n$ and then any Finsler
metric on $\mathbb{R}P^n$ induces a Finsler metric of $S^n$. In this paper, we
prove that for every Finsler $(S^n, F)$ for $n\geq3$ whose metric is induced by
irreversible Finsler $(\mathbb{R}P^n,F)$ with reversibility $\lambda$ and flag
curvature $K$ satisfying $(\frac{\lambda}{\lambda+1})^2<K\leq 1$, there exist
at least $n-1$ prime closed geodesics on $(S^n, F)$. Furthermore, if there
exist finitely many distinct closed geodesics on $(S^n, F)$, then there exist
at least $2[\frac{n}{2}]-1$ of them are non-hyperbolic.
","[{""version"":""v1"",""created"":""Tue, 17 Apr 2018 12:21:11 GMT""},{""version"":""v2"",""created"":""Fri, 31 May 2019 02:25:20 GMT""}]","2019-06-03"
"1804.06194","Laurent Buse","Laurent Bus\'e (AROMATH), Alexandru Dimca (JAD, AROMATH), Gabriel
  Sticlaru","Freeness and invariants of rational plane curves","Mathematics of Computation, American Mathematical Society, In press",,"10.1090/mcom/3495",,"math.AG cs.SC math.AC","http://arxiv.org/licenses/nonexclusive-distrib/1.0/","  Given a parameterization $\phi$ of a rational plane curve C, we study some
invariants of C via $\phi$. We first focus on the characterization of rational
cuspidal curves, in particular we establish a relation between the discriminant
of the pull-back of a line via $\phi$, the dual curve of C and its singular
points. Then, by analyzing the pull-backs of the global differential forms via
$\phi$, we prove that the (nearly) freeness of a rational curve can be tested
by inspecting the Hilbert function of the kernel of a canonical map. As a by
product, we also show that the global Tjurina number of a rational curve can be
computed directly from one of its parameterization, without relying on the
computation of an equation of C.
","[{""version"":""v1"",""created"":""Tue, 17 Apr 2018 12:23:42 GMT""},{""version"":""v2"",""created"":""Wed, 22 Jan 2020 15:13:18 GMT""}]","2020-01-23"
"1804.06195","Zhi-Gang Wang","Zhi-Gang Wang, Jun-Xia Zhang","Possible pentaquark candidates: new excited $\Omega_c$ states","24 pages, 28 figures","Eur. Phys. J. C78 (2018) 503","10.1140/epjc/s10052-018-5989-4",,"hep-ph","http://arxiv.org/licenses/nonexclusive-distrib/1.0/","  In this article, we study the axialvector-diquark-scalar-diquark-antiquark
type charmed pentaquark states with $J^P={\frac{3}{2}}^\pm$ with the QCD sum
rules by carrying out the operator product expansion up to the vacuum
condensates of dimension $13$ in a consistent way. In calculations, we separate
the contributions of the negative parity and positive parity pentaquark states
unambiguously, and choose three sets input parameters to study the masses and
pole residues of the charmed pentaquark states $uuuc\bar{u}$ and $sssc\bar{s}$
in details. Then we estimate the masses of the charmed pentaquark states
$ssuc\bar{u}$, $susc\bar{u}$, $ssdc\bar{d}$ and $sdsc\bar{d}$ with
$J^P={\frac{3}{2}}^-$ to be $3.15\pm0.13\,\rm{GeV}$ according to the $SU(3)$
breaking effects, which is compatible with the $\Omega_c(3050)$,
$\Omega_c(3066)$, $\Omega_c(3090)$, $\Omega_c(3119)$.
","[{""version"":""v1"",""created"":""Tue, 17 Apr 2018 12:25:21 GMT""},{""version"":""v2"",""created"":""Wed, 23 May 2018 14:07:37 GMT""}]","2018-06-19"
"1804.06196","Daniel Fraunholz","Daniel Fraunholz, Simon Duque Anton, Christoph Lipps, Daniel Reti,
  Daniel Krohmer, Frederic Pohl, Matthias Tammen, Hans Dieter Schotten","Demystifying Deception Technology:A Survey","25 pages, 169 references",,,,"cs.CR","http://arxiv.org/licenses/nonexclusive-distrib/1.0/","  Deception boosts security for systems and components by denial, deceit,
misinformation, camouflage and obfuscation. In this work an extensive overview
of the deception technology environment is presented. Taxonomies, theoretical
backgrounds, psychological aspects as well as concepts, implementations, legal
aspects and ethics are discussed and compared.
","[{""version"":""v1"",""created"":""Tue, 17 Apr 2018 12:25:39 GMT""}]","2018-04-18"
"1804.06197","Moshe Sulamy","Dor Bank, Moshe Sulamy, Eyal Waserman","Reaching Distributed Equilibrium with Limited ID Space",,,,,"cs.DC cs.GT","http://arxiv.org/licenses/nonexclusive-distrib/1.0/","  We examine the relation between the size of the id space and the number of
rational agents in a network under which equilibrium in distributed algorithms
is possible. When the number of agents in the network is not a-priori known, a
single agent may duplicate to gain an advantage, pretending to be more than one
agent. However, when the id space is limited, each duplication involves a risk
of being caught. By comparing the risk against the advantage, given an id space
of size $L$, we provide a method of calculating the minimal threshold $t$, the
required number of agents in the network, such that the algorithm is in
equilibrium. That is, it is the minimal value of $t$ such that if agents
a-priori know that $n \geq t$ then the algorithm is in equilibrium. We
demonstrate this method by applying it to two problems, Leader Election and
Knowledge Sharing, as well as providing a constant-time approximation $t
\approx \frac{L}{5}$ of the minimal threshold for Leader Election.
","[{""version"":""v1"",""created"":""Tue, 17 Apr 2018 12:26:31 GMT""},{""version"":""v2"",""created"":""Wed, 18 Apr 2018 06:58:27 GMT""}]","2018-04-19"
"1804.06198","Seiichi Kamada","Naoko Kamada and Seiichi Kamada","Virtual links which are equivalent as twisted links",,,,,"math.GT","http://arxiv.org/licenses/nonexclusive-distrib/1.0/","  A virtual link is a generalization of a classical link that is defined as an
equivalence class of certain diagrams, called virtual link diagrams. It is
further generalized to a twisted link. Twisted links are in one-to-one
correspondence with stable equivalence classes of links in oriented thickenings
of (possibly non-orientable) closed surfaces. By definition, equivalent virtual
links are also equivalent as twisted links. In this paper, we discuss when two
virtual links are equivalent as twisted links, and give a necessary and
sufficient condition for this to be the case.
","[{""version"":""v1"",""created"":""Tue, 17 Apr 2018 12:27:54 GMT""},{""version"":""v2"",""created"":""Mon, 4 Jun 2018 23:49:04 GMT""},{""version"":""v3"",""created"":""Mon, 23 Sep 2019 06:21:50 GMT""}]","2019-09-24"
"1804.06199","Mirella Harsoula","Panos Patsis and Mirella Harsoula","Building CX peanut-shaped disk galaxy profiles. The relative importance
  of the 3D families of periodic orbits bifurcating at the vertical 2:1
  resonance","8 pages, 8 figures","A&A 612, A114 (2018)","10.1051/0004-6361/201731114",,"astro-ph.GA","http://arxiv.org/licenses/nonexclusive-distrib/1.0/","  We present and discuss the orbital content of a rather unusual rotating
barred galaxy model, in which the three-dimensional (3D) family, bifurcating
from x1 at the 2:1 vertical resonance with the known ""frown-smile"" side-on
morphology, is unstable. Our goal is to study the differences that occur in the
phase space structure at the vertical 2:1 resonance region in this case, with
respect to the known, well studied, standard case, in which the families with
the frown-smile profiles are stable and support an X-shaped morphology. The
potential used in the study originates in a frozen snapshot of an $N$-body
simulation in which a fast bar has evolved. We follow the evolution of the
vertical stability of the central family of periodic orbits as a function of
the energy (Jacobi constant) and we investigate the phase space content by
means of spaces of section. The two bifurcating families at the vertical 2:1
resonance region of the new model change their stability with respect to that
of most studied analytic potentials. The structure in the side-on view that is
directly supported by the trapping of quasi-periodic orbits around 3D stable
periodic orbits has now an infinity symbol (i.e. $\infty$-type) profile.
However, the available sticky orbits can reinforce other types of side-on
morphologies as well. In the new model, the dynamical mechanism of trapping
quasi-periodic orbits around the 3D stable periodic orbits that build the
peanut, supports the $\infty$-type profile. The same mechanism in the standard
case supports the X shape with the frown-smile orbits. Nevertheless, in both
cases (i.e. in the new and in the standard model) a combination of 3D
quasi-periodic orbits around the stable x1 family with sticky orbits can
support a profile reminiscent of the shape of the orbits of the 3D unstable
family existing in each model.
","[{""version"":""v1"",""created"":""Tue, 17 Apr 2018 12:29:33 GMT""}]","2018-05-09"
"1804.06200","Caroline Moosm\""uller","Caroline Moosm\""uller, Svenja H\""uning, Costanza Conti","Stirling numbers and Gregory coefficients for the factorization of
  Hermite subdivision operators","31 pages, 1 figure, references and contact information updated",,,,"math.NA cs.NA","http://arxiv.org/licenses/nonexclusive-distrib/1.0/","  In this paper we present a factorization framework for Hermite subdivision
schemes refining function values and first derivatives, which satisfy a
spectral condition of high order. In particular we show that spectral order $d$
allows for $d$ factorizations of the subdivision operator with respect to the
Gregory operators: A new sequence of operators we define using Stirling numbers
and Gregory coefficients. We further prove that the $d$-th factorization
provides a ``convergence from contractivity'' method for showing
$C^d$-convergence of the associated Hermite subdivision scheme. The power of
our factorization framework lies in the reduction of computational effort for
large $d$: In order to prove $C^d$-convergence, up to now, $d$ factorization
steps were needed, while our method requires only one step, independently of
$d$. Furthermore, in this paper, we show by an example that the spectral
condition is not equivalent to the reproduction of polynomials.
","[{""version"":""v1"",""created"":""Tue, 17 Apr 2018 12:31:25 GMT""},{""version"":""v2"",""created"":""Mon, 22 Jul 2019 17:31:14 GMT""}]","2019-07-23"
"1804.06201","Herbert Hu","Guangneng Hu, Yu Zhang, Qiang Yang","LCMR: Local and Centralized Memories for Collaborative Filtering with
  Unstructured Text",,,,,"cs.IR cs.AI cs.CL","http://arxiv.org/licenses/nonexclusive-distrib/1.0/","  Collaborative filtering (CF) is the key technique for recommender systems.
Pure CF approaches exploit the user-item interaction data (e.g., clicks, likes,
and views) only and suffer from the sparsity issue. Items are usually
associated with content information such as unstructured text (e.g., abstracts
of articles and reviews of products). CF can be extended to leverage text. In
this paper, we develop a unified neural framework to exploit interaction data
and content information seamlessly. The proposed framework, called LCMR, is
based on memory networks and consists of local and centralized memories for
exploiting content information and interaction data, respectively. By modeling
content information as local memories, LCMR attentively learns what to exploit
with the guidance of user-item interaction. On real-world datasets, LCMR shows
better performance by comparing with various baselines in terms of the hit
ratio and NDCG metrics. We further conduct analyses to understand how local and
centralized memories work for the proposed framework.
","[{""version"":""v1"",""created"":""Tue, 17 Apr 2018 12:32:23 GMT""},{""version"":""v2"",""created"":""Fri, 20 Apr 2018 16:23:00 GMT""}]","2020-10-19"
"1804.06202","Jingdong Wang","Guotian Xie, Jingdong Wang, Ting Zhang, Jianhuang Lai, Richang Hong,
  and Guo-Jun Qi","IGCV$2$: Interleaved Structured Sparse Convolutional Neural Networks","Accepted by CVPR 2018",,,,"cs.CV","http://arxiv.org/licenses/nonexclusive-distrib/1.0/","  In this paper, we study the problem of designing efficient convolutional
neural network architectures with the interest in eliminating the redundancy in
convolution kernels. In addition to structured sparse kernels, low-rank kernels
and the product of low-rank kernels, the product of structured sparse kernels,
which is a framework for interpreting the recently-developed interleaved group
convolutions (IGC) and its variants (e.g., Xception), has been attracting
increasing interests.
  Motivated by the observation that the convolutions contained in a group
convolution in IGC can be further decomposed in the same manner, we present a
modularized building block, {IGCV$2$:} interleaved structured sparse
convolutions. It generalizes interleaved group convolutions, which is composed
of two structured sparse kernels, to the product of more structured sparse
kernels, further eliminating the redundancy. We present the complementary
condition and the balance condition to guide the design of structured sparse
kernels, obtaining a balance among three aspects: model size, computation
complexity and classification accuracy. Experimental results demonstrate the
advantage on the balance among these three aspects compared to interleaved
group convolutions and Xception, and competitive performance compared to other
state-of-the-art architecture design methods.
","[{""version"":""v1"",""created"":""Tue, 17 Apr 2018 12:36:36 GMT""}]","2018-04-18"
"1804.06203","Qidi Li","Qidi Li, Hu Wang, Yang Zeng, Zhiwei Lv","A D-vine copula-based coupling uncertainty analysis for stiffness
  predication of variable-stiffness composite",,,,,"cs.CE","http://arxiv.org/licenses/nonexclusive-distrib/1.0/","  This study suggests a coupling uncertainty analysis method to investigate the
stiffness characteristics of variable stiffness (VS) composite. The D-vine
copula function is used to address the coupling of random variables. To
identify the copula relation between random variables, a novel one-step
Bayesian copula model selection (OBCS) method is proposed to obtain a suitable
copula function as well as the marginal CDF of random variables. The entire
process is Monte Carlo simulation (MCS). However, due to the expensive
computational cost of complete finite element analysis (FEA) in MCS, a fast
solver, reanalysis method is introduced. To further improve the efficiency of
entire procedure, a back propagation neural network (BPNN) model is also
introduced based on the reanalysis method. Compared with the reanalysis method,
BPNN shows a higher efficiency as well as sufficient accuracy. Finally, the
fiber angle deviation of VS composite is investigated by the suggested
strategy. Two numerical examples are presented to verify the feasibility of
this method.
","[{""version"":""v1"",""created"":""Tue, 17 Apr 2018 12:41:20 GMT""},{""version"":""v2"",""created"":""Fri, 20 Apr 2018 03:12:58 GMT""}]","2018-04-23"
"1804.06204","Huijie Qiao","Huijie Qiao","Effective Filtering for Multiscale Stochastic Dynamical Systems in
  Hilbert Spaces","21 pages",,,,"math.PR","http://arxiv.org/licenses/nonexclusive-distrib/1.0/","  In the paper, effective filtering for a type of slow-fast data assimilation
systems in Hilbert spaces is considered. Firstly, the system is reduced to a
system on a random invariant manifold. Secondly, nonlinear filtering of the
origin system can be approximated by that of the reduction system. Finally, we
apply the obtained result to an example.
","[{""version"":""v1"",""created"":""Tue, 17 Apr 2018 12:43:27 GMT""},{""version"":""v2"",""created"":""Thu, 6 Sep 2018 01:17:17 GMT""},{""version"":""v3"",""created"":""Wed, 6 Mar 2019 19:02:05 GMT""},{""version"":""v4"",""created"":""Tue, 9 Jul 2019 02:14:06 GMT""},{""version"":""v5"",""created"":""Fri, 18 Oct 2019 11:50:46 GMT""}]","2019-10-21"
"1804.06205","Yuji Mochizuki","Hideo Doi, Koji Okuwaki, Takamitsu Naito, Sona Saitou, Yuji Mochizuki","A portable code for dissipative particle dynamics (DPD) simulations with
  additional specific interactions","33 pages, 3 tables, 7 figures","Chem-Bio Informatics Journal, Volume 18 (2018) Pages 70-85","10.1273/cbij.18.70",,"physics.chem-ph","http://arxiv.org/licenses/nonexclusive-distrib/1.0/","  We developed a portable code for dissipative particle dynamics (DPD)
simulations. This Fortran program named CAMUS has a couple of notable features.
One is the omission of constructing the so-called neighboring particles list,
providing a sizable speed-up per step and also a near linear scaling of costs
with respect to the number of particles. The other is an easy inclusion of
additional specific (such as 1-3 and 1-5 Morse bonding) interactions which are
crucial in describing protein structures. The formations of alpha-helix and
beta-sheet through DPD were then demonstrated. CAMUS is freely available at the
GitHub site.
","[{""version"":""v1"",""created"":""Tue, 17 Apr 2018 12:43:28 GMT""}]","2018-07-03"
"1804.06206","Jaroslav Dud\'ik","Marian Karlicky, Alena Zemanova, Jaroslav Dudik, and Krzysztof
  Radiszewski","Solar radio burst associated with the falling bright EUV blob",,"The Astrophysical Journal Letters, Volume 854, Issue 2, article
  id. L29, 6 pp. (2018)","10.3847/2041-8213/aaadf9",,"astro-ph.SR","http://arxiv.org/licenses/nonexclusive-distrib/1.0/","  At the beginning of the 4 November 2015 flare, in the 1300 -- 2000 MHz
frequency range, we observed a very rare slowly positively drifting burst. We
searched for associated phenomena in simultaneous EUV observations made by
IRIS, SDO/AIA, Hinode/XRT and in H alpha observations. We found that this radio
burst was accompanied with the bright blob, visible at transition region,
coronal, and flare temperatures, falling down to the chromosphere along the
dark loop with the velocity of about 280 km/s. The dark loop was visible in H
alpha but disappeared afterwards. Furthermore, we found that the falling blob
interacted with the chromosphere as expressed by a sudden change of the H alpha
spectra at the location of this interaction. Considering different
possibilities we propose that the observed slowly positively drifting burst is
generated by the thermal conduction front formed in front of the falling hot
EUV blob.
","[{""version"":""v1"",""created"":""Tue, 17 Apr 2018 12:46:23 GMT""}]","2018-04-18"
"1804.06207","Luis Moreira-Matias Dr.","Jihed Khiari, Luis Moreira-Matias, Ammar Shaker, Bernard Zenko, Saso
  Dzeroski","MetaBags: Bagged Meta-Decision Trees for Regression",,,,,"cs.LG stat.ML","http://arxiv.org/licenses/nonexclusive-distrib/1.0/","  Ensembles are popular methods for solving practical supervised learning
problems. They reduce the risk of having underperforming models in
production-grade software. Although critical, methods for learning
heterogeneous regression ensembles have not been proposed at large scale,
whereas in classical ML literature, stacking, cascading and voting are mostly
restricted to classification problems. Regression poses distinct learning
challenges that may result in poor performance, even when using well
established homogeneous ensemble schemas such as bagging or boosting.
  In this paper, we introduce MetaBags, a novel, practically useful stacking
framework for regression. MetaBags is a meta-learning algorithm that learns a
set of meta-decision trees designed to select one base model (i.e. expert) for
each query, and focuses on inductive bias reduction. A set of meta-decision
trees are learned using different types of meta-features, specially created for
this purpose - to then be bagged at meta-level. This procedure is designed to
learn a model with a fair bias-variance trade-off, and its improvement over
base model performance is correlated with the prediction diversity of different
experts on specific input space subregions. The proposed method and
meta-features are designed in such a way that they enable good predictive
performance even in subregions of space which are not adequately represented in
the available training data.
  An exhaustive empirical testing of the method was performed, evaluating both
generalization error and scalability of the approach on synthetic, open and
real-world application datasets. The obtained results show that our method
significantly outperforms existing state-of-the-art approaches.
","[{""version"":""v1"",""created"":""Tue, 17 Apr 2018 12:51:52 GMT""}]","2018-04-18"
