"1804.09237","Jordi Mur-Petit","Ayaka Usui and Berislav Bu\v{c}a and Jordi Mur-Petit","Quantum probe spectroscopy for cold atomic systems","17 single-column pages, 4 figures. Matches published version","New J. Phys. 20, 103006 (2018)","10.1088/1367-2630/aae418",,"cond-mat.quant-gas physics.atom-ph quant-ph","http://arxiv.org/licenses/nonexclusive-distrib/1.0/","  We study a two-level impurity coupled locally to a quantum gas on an optical
lattice. For state-dependent interactions between the impurity and the gas, we
show that its evolution encodes information on the local excitation spectrum of
gas at the coupling site. Based on this, we design a nondestructive method to
probe the system's excitations in a broad range of energies by measuring the
state of the probe using standard atom optics methods. We illustrate our
findings with numerical simulations for quantum lattice systems, including
realistic dephasing noise on the quantum probe, and discuss practical limits on
the probe dephasing rate to fully resolve both regular and chaotic spectra.
","[{""version"":""v1"",""created"":""Tue, 24 Apr 2018 20:17:26 GMT""},{""version"":""v2"",""created"":""Tue, 16 Oct 2018 15:57:29 GMT""}]","2018-10-17"
"1804.09238","Haitian Sun","Haitian Sun, William W. Cohen, Lidong Bing","Semi-Supervised Learning with Declaratively Specified Entropy
  Constraints",,,,,"cs.LG cs.AI stat.ML","http://arxiv.org/licenses/nonexclusive-distrib/1.0/","  We propose a technique for declaratively specifying strategies for
semi-supervised learning (SSL). The proposed method can be used to specify
ensembles of semi-supervised learning, as well as agreement constraints and
entropic regularization constraints between these learners, and can be used to
model both well-known heuristics such as co-training and novel domain-specific
heuristics. In addition to representing individual SSL heuristics, we show that
multiple heuristics can also be automatically combined using Bayesian
optimization methods. We show consistent improvements on a suite of
well-studied SSL benchmarks, including a new state-of-the-art result on a
difficult relation extraction task.
","[{""version"":""v1"",""created"":""Tue, 24 Apr 2018 20:19:09 GMT""},{""version"":""v2"",""created"":""Fri, 18 May 2018 04:22:50 GMT""}]","2018-05-21"
"1804.09239","Ermanno F. Borra","Ermanno F. Borra, Jonathan D. Romney, Eric Trottier","A technique to detect periodic and non-periodic ultra-rapid flux time
  variations with standard radio-astronomical data","Accepted for publication in The Journal of Astrophysics and Astronomy",,"10.1007/s12036-018-9525-6",,"astro-ph.IM","http://arxiv.org/licenses/nonexclusive-distrib/1.0/","  We demonstrate that extremely rapid and weak periodic and non-periodic
signals can easily be detected by using the autocorrelation of intensity as a
function of time. We use standard radio-astronomical observations that have
artificial periodic and non-periodic signals generated by the electronics of
terrestrial origin. The autocorrelation detects weak signals that have small
amplitudes because it averages over long integration times. Another advantage
is that it allows a direct visualization of the shape of the signals, while it
is difficult to see the shape with a Fourier transform. Although Fourier
transforms can also detect periodic signals, a novelty of this work is that we
demonstrate another major advantage of the autocorrelation, that it can detect
non-periodic signals while the Fourier transform cannot. Another major novelty
of our work is that we use electric fields taken in a standard format with
standard instrumentation at a radio observatory and therefore no specialized
instrumentation is needed. Because the electric fields are sampled every 15.625
nanoseconds, they therefore allow detection of very rapid time variations.
Notwithstanding the long integration times, the autocorrelation detects very
rapid intensity variations as a function of time. The autocorrelation could
also detect messages from Extraterrestrial Intelligence as non-periodic
signals.
","[{""version"":""v1"",""created"":""Tue, 24 Apr 2018 20:26:25 GMT""}]","2018-05-16"
"1804.09240","Vijay Subramanya","Benjamin Moore, Naomi Nishimura, Vijay Subramanya","Reconfiguration of graph minors",,,,,"cs.DS cs.DM math.CO","http://arxiv.org/licenses/nonexclusive-distrib/1.0/","  Under the reconfiguration framework, we consider the various ways that a
target graph $H$ is a {\em minor} of a host graph $G$, where a subgraph of $G$
can be transformed into $H$ by means of {\em edge contraction} (replacement of
both endpoints of an edge by a new vertex adjacent to any vertex adjacent to
either endpoint). Equivalently, an {\em $H$-model} of $G$ is a labeling of the
vertices of $G$ with the vertices of $H$, where the contraction of all edges
between identically-labeled vertices results in a graph containing
representations of all edges in $H$.
  We explore the properties of $G$ and $H$ that result in a connected {\em
reconfiguration graph}, in which nodes represent $H$-models and two nodes are
adjacent if their corresponding $H$-models differ by the label of a single
vertex of $G$. Various operations on $G$ or $H$ are shown to preserve
connectivity. In addition, we demonstrate properties of graphs $G$ that result
in connectivity for the target graphs $K_2$, $K_3$, and $K_4$, including a full
characterization of graphs $G$ that result in connectivity for $K_2$-models, as
well as the relationship between connectivity of $G$ and other $H$-models.
","[{""version"":""v1"",""created"":""Tue, 24 Apr 2018 20:28:07 GMT""}]","2018-04-26"
"1804.09243","Bozhidar Velichkov Dr.","Dario Mazzoleni, Susanna Terracini, Bozhidar Velichkov","Regularity of the free boundary for the vectorial Bernoulli problem",,"Analysis & PDE 13 (2020) 741-764","10.2140/apde.2020.13.741",,"math.AP","http://arxiv.org/licenses/nonexclusive-distrib/1.0/","  In this paper we study the regularity of the free boundary for a
vector-valued Bernoulli problem, with no sign assumptions on the boundary data.
More precisely, given an open, smooth set of finite measure $D\subset
\mathbb{R}^d$, $\Lambda>0$ and $\varphi_i\in H^{1/2}(\partial D)$, we deal with
\[ \min{\left\{\sum_{i=1}^k\int_D|\nabla
v_i|^2+\Lambda\Big|\bigcup_{i=1}^k\{v_i\not=0\}\Big|\;:\;v_i=\varphi_i\;\mbox{on
}\partial D\right\}}. \] We prove that, for any optimal vector $U=(u_1,\dots,
u_k)$, the free boundary $\partial (\cup_{i=1}^k\{u_i\not=0\})\cap D$ is made
of a regular part, which is relatively open and locally the graph of a
$C^\infty$ function, a singular part, which is relatively closed and has
Hausdorff dimension at most $d-d^*$, for a $d^*\in\{5,6,7\}$ and by a set of
branching (two-phase) points, which is relatively closed and of finite
$\mathcal{H}^{d-1}$ measure. Our arguments are based on the NTA structure of
the regular part of the free boundary.
","[{""version"":""v1"",""created"":""Tue, 24 Apr 2018 20:32:52 GMT""}]","2020-04-22"
"1804.09247","Tomasz Rzepecki","Krzysztof Krupi\'nski, Tomasz Rzepecki","Galois groups as quotients of Polish groups","45 pages (excluding references)","Journal of Mathematical Logic 20.03 (2020), art. no 2050018","10.1142/S021906132050018X",,"math.LO","http://arxiv.org/licenses/nonexclusive-distrib/1.0/","  We present the (Lascar) Galois group of any countable theory as a quotient of
a compact Polish group by an $F_\sigma$ normal subgroup: in general, as a
topological group, and under NIP, also in terms of Borel cardinality. This
allows us to obtain similar results for arbitrary strong types defined on a
single complete type over $\emptyset$. As an easy conclusion of our main
theorem, we get the main result from our recent paper joint with Andand Pillay,
which says that for any strong type defined on a single complete type over
$\emptyset$, smoothness is equivalent to type-definability.
  We also explain how similar results are obtained in the case of bounded
quotients of type-definable groups. This gives us a generalization of a former
result from the aforementioned paper about bounded quotients of type-definable
subgroups of definable groups.
","[{""version"":""v1"",""created"":""Tue, 24 Apr 2018 20:34:37 GMT""}]","2020-12-15"
"1804.09252","Geir Drage Berentsen Dr.","Geir D. Berentsen, Jan Bulla, Antonello Maruotti and B{\aa}rd St{\o}ve","Modelling corporate defaults: A Markov-switching Poisson log-linear
  autoregressive model",,,,,"stat.ME","http://arxiv.org/licenses/nonexclusive-distrib/1.0/","  This article extends the autoregressive count time series model class by
allowing for a model with regimes, that is, some of the parameters in the model
depend on the state of an unobserved Markov chain. We develop a quasi-maximum
likelihood estimator by adapting the extended Hamilton-Grey algorithm for the
Poisson log-linear autoregressive model, and we perform a simulation study to
check the finite sample behaviour of the estimator. The motivation for the
model comes from the study of corporate defaults, in particular the study of
default clustering. We provide evidence that time series of counts of US
monthly corporate defaults consists of two regimes and that the so-called
contagion effect, that is current defaults affect the probability of other
firms defaulting in the future, is present in one of these regimes, even after
controlling for financial and economic covariates. We further find evidence for
that the covariate effects are different in each of the two regimes. Our
results imply that the notion of contagion in the default count process is
time-dependent, and thus more dynamic than previously believed.
","[{""version"":""v1"",""created"":""Tue, 24 Apr 2018 20:46:59 GMT""}]","2018-04-26"
"1804.09253","Kevin Kuo","Kevin Kuo","DeepTriangle: A Deep Learning Approach to Loss Reserving","Published version available at https://www.mdpi.com/2227-9091/7/3/97","Risks 2019, 7(3), 97","10.3390/risks7030097",,"stat.AP cs.LG q-fin.RM","http://arxiv.org/licenses/nonexclusive-distrib/1.0/","  We propose a novel approach for loss reserving based on deep neural networks.
The approach allows for joint modeling of paid losses and claims outstanding,
and incorporation of heterogeneous inputs. We validate the models on loss
reserving data across lines of business, and show that they improve on the
predictive accuracy of existing stochastic methods. The models require minimal
feature engineering and expert input, and can be automated to produce forecasts
more frequently than manual workflows.
","[{""version"":""v1"",""created"":""Tue, 24 Apr 2018 20:47:04 GMT""},{""version"":""v2"",""created"":""Fri, 18 May 2018 20:35:59 GMT""},{""version"":""v3"",""created"":""Sun, 17 Mar 2019 19:04:15 GMT""},{""version"":""v4"",""created"":""Mon, 16 Sep 2019 17:12:04 GMT""}]","2019-09-17"
"1804.09254","Maksim Yegorov","Maksim Yegorov","Cache-aware data structures for packet forwarding tables on general
  purpose CPUs","Bloom filter, Longest Matching Prefix, Forwarding Lookups",,,,"cs.NI","http://arxiv.org/licenses/nonexclusive-distrib/1.0/","  Longest prefix matching has long been the bottleneck of the Bloom
filter-based solutions for packet forwarding implemented in software. We
propose a search algorithm to match a destination IP address against a compact
representation of the FIB table in CPU cache on general purpose hardware with
an average performance target of O(log n) for an n-bit address.
","[{""version"":""v1"",""created"":""Tue, 24 Apr 2018 20:48:44 GMT""}]","2018-04-26"
"1804.09255","Adisak Seesanea","Adisak Seesanea and Igor E. Verbitsky","Solutions to sublinear elliptic equations with finite generalized energy","25 pages, published online in Calculus of Variations and Partial
  Differential Equations",,"10.1007/s00526-018-1448-1",,"math.AP","http://arxiv.org/licenses/nonexclusive-distrib/1.0/","  We give necessary and sufficient conditions for the existence of a positive
solution with zero boundary values to the elliptic equation \[ \mathcal{L}u =
\sigma u^{q} + \mu \quad \text{in} \;\; \Omega, \] in the sublinear case
$0<q<1$, with finite generalized energy: $\mathbb{E}_{\gamma}[u]:=\int_{\Omega}
|\nabla u|^{2} u^{\gamma-1}dx<\infty$, for $\gamma >0$. In this case $u \in
L^{\gamma+q}(\Omega, \sigma)\cap L^{\gamma}(\Omega, \mu)$, where $\gamma=1$
corresponds to finite energy solutions.
  Here $\mathcal{L} u:= -\,\text{div}(\mathcal{A}\nabla u)$ is a linear
uniformly elliptic operator with bounded measurable coefficients, and $\sigma$,
$\mu$ are nonnegative functions (or Radon measures), on an arbitrary domain
$\Omega\subseteq \mathbb{R}^n$ which possesses a positive Green function
associated with $\mathcal{L}$.
  When $0<\gamma\leq 1$, this result yields sufficient conditions for the
existence of a positive solution to the above problem which belongs to the
Dirichlet space $\dot{W}_{0}^{1,p}(\Omega)$ for $1<p\leq 2$.
","[{""version"":""v1"",""created"":""Tue, 24 Apr 2018 20:51:05 GMT""},{""version"":""v2"",""created"":""Wed, 12 Dec 2018 08:02:49 GMT""}]","2018-12-13"
"1804.09256","Giuseppe Tronci","Giuseppe Tronci","The application of collagen in advanced wound dressings","37 pages, 6 figures, 1 table (to appear in ""Advanced Textiles for
  Wound Care, 2nd ed"")","Advanced Textiles for Wound Care (2nd ed), 2018",,,"q-bio.TO","http://arxiv.org/licenses/nonexclusive-distrib/1.0/","  Chronic wounds fail to proceed through an orderly and timely self healing
process, resulting in cutaneous damage with full thickness in depth and leading
to a major healthcare and economic burden worldwide. In the UK alone, 200,000
patients suffer from a chronic wound, whilst the global advanced wound care
market is expected to reach nearly $11 million in 2022. Despite extensive
research efforts so far, clinically-approved chronic wound therapies are still
time-consuming, economically unaffordable and present restricted customisation.
In this chapter, the role of collagen in the extracellular matrix of biological
tissues and wound healing will be discussed, together with its use as building
block for the manufacture of advanced wound dressings. Commercially-available
collagen dressings and respective clinical performance will be presented,
followed by an overview on the latest research advances in the context of
multifunctional collagen systems for advanced wound care.
","[{""version"":""v1"",""created"":""Tue, 24 Apr 2018 20:54:36 GMT""},{""version"":""v2"",""created"":""Fri, 27 Apr 2018 11:39:08 GMT""}]","2018-04-30"
"1804.09257","Bj\""orn Schenke","Vladimir Khachatryan, Bjoern Schenke, Mickey Chiu, Axel Drees, Thomas
  K. Hemmick, Norbert Novitzky","Photons from thermalizing matter in heavy ion collisions","48 pages, 15 figures, version accepted for publication in NPA,
  extended discussion in the conclusions section",,"10.1016/j.nuclphysa.2018.07.013",,"nucl-th","http://arxiv.org/licenses/nonexclusive-distrib/1.0/","  We investigate the production of direct photons in heavy ion collisions
within the modified bottom-up thermalization scenario, which we show to be
related to the thermalizing Glasma framework. The dynamics of the parton system
up to thermalization/equilibration can be described by two momentum scales, by
means of which we express the photon invariant yield excluding the prompt pQCD
contribution. We derive an analytic formula, which provides an estimate of
photon production from thermalizing matter for a wide range of collision
systems and energies. We compare the yield with that measured in the PHENIX
Au+Au run04 and the combined run07+run10 data sets at root-s = 200GeV. We also
make theory-data comparisons for Pb+Pb at 2760 GeV and d+Au at 200 GeV
collision energies. Finally, we make predictions for the direct photon
invariant yield from collisions of U+U, Cu+Au, $^3$He+Au at 200 GeV and Pb+Pb
at 5020 GeV.
","[{""version"":""v1"",""created"":""Tue, 24 Apr 2018 20:56:40 GMT""},{""version"":""v2"",""created"":""Wed, 8 Aug 2018 23:33:09 GMT""}]","2018-10-17"
"1804.09259","Stanis{\l}aw Jastrz\k{e}bski","Stanis{\l}aw Jastrz\k{e}bski, Dzmitry Bahdanau, Seyedarian Hosseini,
  Michael Noukhovitch, Yoshua Bengio, Jackie Chi Kit Cheung","Commonsense mining as knowledge base completion? A study on the impact
  of novelty","Published in Workshop on New Forms of Generalization in Deep Learning
  and Natural Language Processing (NAACL 2018)",,,,"cs.CL","http://arxiv.org/licenses/nonexclusive-distrib/1.0/","  Commonsense knowledge bases such as ConceptNet represent knowledge in the
form of relational triples. Inspired by the recent work by Li et al., we
analyse if knowledge base completion models can be used to mine commonsense
knowledge from raw text. We propose novelty of predicted triples with respect
to the training set as an important factor in interpreting results. We
critically analyse the difficulty of mining novel commonsense knowledge, and
show that a simple baseline method outperforms the previous state of the art on
predicting more novel.
","[{""version"":""v1"",""created"":""Tue, 24 Apr 2018 21:07:04 GMT""}]","2018-04-26"
"1804.09260","Kevin Hughes","Kevin Hughes","$\ell^p$-improving for discrete spherical averages","18 pages, Comments welcome. 5 Oct 2018 submitted draft with referees'
  comments. In this version I used a more robust interpolation which improved
  the bounds. I emphasized the bounds for dyadic maximal functions appearing in
  the 1st version and streamlined the exposition for publication. An appendix
  on the range of $\ell^p$-boundedness in Magyar's Birch maximal functions was
  added",,,,"math.CA","http://arxiv.org/licenses/nonexclusive-distrib/1.0/","  We initiate the theory of $\ell^p$-improving inequalities for arithmetic
averages over hypersurfaces and their maximal functions. In particular, we
prove $\ell^p$-improving estimates for the discrete spherical averages and some
of their generalizations. As an application of our $\ell^p$-improving
inequalities for the dyadic discrete spherical maximal function, we give a new
estimate for the full discrete spherical maximal function in four dimensions.
Our proofs are analogous to Littman's result on Euclidean spherical averages.
One key aspect of our proof is a Littlewood--Paley decomposition in both the
arithmetic and analytic aspects. In the arithmetic aspect this is a major
arc-minor arc decomposition of the circle method.
","[{""version"":""v1"",""created"":""Tue, 24 Apr 2018 21:09:40 GMT""},{""version"":""v2"",""created"":""Wed, 23 May 2018 14:14:46 GMT""},{""version"":""v3"",""created"":""Wed, 27 Nov 2019 03:10:38 GMT""}]","2019-11-28"
"1804.09261","Ali Hyder","Ali Hyder, Luca Martinazzi","Gluing metrics with prescribed $Q$-curvature and different asymptotic
  behaviour in high dimension",,,,,"math.AP","http://arxiv.org/licenses/nonexclusive-distrib/1.0/","  We show a new example of blow-up behaviour for the prescribed $Q$-curvature
equation in even dimension $6$ and higher, namely given a sequence
$(V_k)\subset C^0(\mathbb{R}^{2n})$ suitably converging we construct {for
$n\geq 3$} a sequence $(u_k)$ of radially symmetric solutions to the equation
$${(-\Delta)^n u_k=V_k e^{2n u_k} \quad \text{in }\mathbb{R}^{2n},}$$ with
$u_k$ blowing up at the origin \emph{and} on a sphere. We also prove sharp
blow-up estimates. This is in sharp contrast with the $4$-dimensional case
studied by F. Robert (J. Diff. Eq. 2006).
","[{""version"":""v1"",""created"":""Tue, 24 Apr 2018 21:20:30 GMT""},{""version"":""v2"",""created"":""Mon, 3 Jun 2019 20:02:25 GMT""}]","2019-06-05"
"1804.09262","Hamid Ossareh","Hamid R. Ossareh","Reference Governors and Maximal Output Admissible Sets for Linear
  Periodic Systems",,,,,"math.OC","http://arxiv.org/licenses/nonexclusive-distrib/1.0/","  In this paper, we consider the problem of constraint management in Linear
Periodic (LP) systems using Reference Governors (RG). First, we present the
periodic-invariant maximal output admissible sets for LP systems. We extend the
earlier results in the literature to Lyapunov stable LP systems with output
constraints, which arise in RG applications. We show that, while the invariant
sets for these systems may not be finitely determined, a finitely-determined
inner approximation can be obtained by constraint tightening. We further show
that these sets are related via simple transformations, implying that it
suffices to compute only one of them for real-time applications. This greatly
reduces the memory burden of RG, at the expense of an increase in processing
requirements. We present a thorough analysis of this trade-off. In the second
part of this paper, we discuss two RG formulations and discuss their
feasibility criteria and algorithms for their computation. Numerical
simulations demonstrate the efficacy of the approach.
","[{""version"":""v1"",""created"":""Tue, 24 Apr 2018 21:24:49 GMT""}]","2018-04-26"
"1804.09263","Saleh Rezaeiravesh","Saleh Rezaeiravesh, Ricardo Vinuesa, Mattias Liefvendahl, Philipp
  Schlatter","Assessment of uncertainties in hot-wire anemometry and oil-film
  interferometry measurements for wall-bounded turbulent flows",,,"10.1016/j.euromechflu.2018.04.012",,"physics.flu-dyn","http://arxiv.org/licenses/nonexclusive-distrib/1.0/","  In this study, the sources of uncertainty of hot-wire anemometry (HWA) and
oil-film interferometry (OFI) measurements are assessed. Both statistical and
classical methods are used for the forward and inverse problems, so that the
contributions to the overall uncertainty of the measured quantities can be
evaluated. The correlations between the parameters are taken into account
through the Bayesian inference with error-in-variable (EiV) model. In the
forward problem, very small differences were found when using Monte Carlo (MC),
Polynomial Chaos Expansion (PCE) and linear perturbation methods. In flow
velocity measurements with HWA, the results indicate that the estimated
uncertainty is lower when the correlations among parameters are considered,
than when they are not taken into account. Moreover, global sensitivity
analyses with Sobol indices showed that the HWA measurements are most sensitive
to the wire voltage, and in the case of OFI the most sensitive factor is the
calculation of fringe velocity. The relative errors in wall-shear stress,
friction velocity and viscous length are 0.44%, 0.23% and 0.22%, respectively.
Note that these values are lower than the ones reported in other wall-bounded
turbulence studies. Note that in most studies of wall-bounded turbulence the
correlations among parameters are not considered, and the uncertainties from
the various parameters are directly added when determining the overall
uncertainty of the measured quantity. In the present analysis we account for
these correlations, which may lead to a lower overall uncertainty estimate due
to error cancellation. Furthermore, our results also indicate that the crucial
aspect when obtaining accurate inner-scaled velocity measurements is the
wind-tunnel flow quality, which is more critical than the accuracy in
wall-shear stress measurements.
","[{""version"":""v1"",""created"":""Tue, 24 Apr 2018 21:25:36 GMT""}]","2018-05-07"
"1804.09264","Sergey Samsonau","Sergey V. Samsonau","Computer simulations combined with experiments for calculus-based
  physics laboratory course","Simplified code for lab 7. Extended introduction","Physics Education, 53 (2018) 055013","10.1088/1361-6552/aacef5",,"physics.ed-ph","http://arxiv.org/licenses/nonexclusive-distrib/1.0/","  This paper is presenting a set of laboratory classes to be taught as a part
of a 1-year calculus-based physics class. It is composed out of 7 modules
designed to bring together experiments and computer simulations (numerical
simulations). Each module uses both simulations and experiments to address a
phenomenon under study, and lasts for 3 weeks (21 weeks total for the whole
set). Wolfram Mathematica is used for computer simulations. Topics are: Motion
with a drag, Pendulum with an arbitrary amplitude, Magnus effect, Centripetal
force acting on a pendulum, A ball rolling from paths of various shapes,
Doppler shift and Fourier transformation, Equipotential lines. These laboratory
classes were taught for 2 years at Princeton International School of
Mathematics and Science.
","[{""version"":""v1"",""created"":""Tue, 24 Apr 2018 21:25:46 GMT""},{""version"":""v2"",""created"":""Sun, 13 May 2018 20:38:34 GMT""},{""version"":""v3"",""created"":""Tue, 22 May 2018 22:35:48 GMT""}]","2018-07-16"
