"1804.09374","Coryn Bailer-Jones","Rene Andrae, Morgan Fouesneau, Orlagh Creevey, Christophe Ordenovic,
  Nicolas Mary, Alexandru Burlacu, Laurence Chaoul, Anne Jean-Antoine-Piccolo,
  Georges Kordopatis, Andreas Korn, Yveline Lebreton, Chantal Panem, Bernard
  Pichon, Frederic Thevenin, Gavin Walmsley, Coryn A.L. Bailer-Jones","Gaia Data Release 2: first stellar parameters from Apsis","A&A in press",,"10.1051/0004-6361/201732516",,"astro-ph.SR astro-ph.GA","http://arxiv.org/licenses/nonexclusive-distrib/1.0/","  The second Gaia data release (Gaia-DR2) contains, beyond the astrometry,
three-band photometry for 1.38 billion sources. We have used these three broad
bands to infer stellar effective temperatures, Teff, for all sources brighter
than G=17 mag with Teff in the range 3000-10 000 K (161 million sources). Using
in addition the parallaxes, we infer the line-of-sight extinction, A_G, and the
reddening, E[BP-RP], for 88 million sources. Together with a bolometric
correction we derive luminosity and radius for 77 million sources. These
quantities as well as their estimated uncertainties are part of Gaia-DR2. Here
we describe the procedures by which these quantities were obtained, including
the underlying assumptions, comparison with literature estimates, and the
limitations of our results. Typical accuracies are of order 324 K (Teff), 0.46
mag (A_G), 0.23 mag (E[BP-RP]), 15% (luminosity), and 10% (radius). Being based
on only a small number of observable quantities and limited training data, our
results are necessarily subject to some extreme assumptions that can lead to
strong systematics in some cases (not included in the aforementioned accuracy
estimates). One aspect is the non-negativity contraint of our estimates, in
particular extinction. Yet in several regions of parameter space our results
show very good performance, for example for red clump stars and solar
analogues. Large uncertainties render the extinctions less useful at the
individual star level, but they show good performance for ensemble estimates.
We identify regimes in which our parameters should and should not be used and
we define a ""clean"" sample. Despite the limitations, this is the largest
catalogue of uniformly-inferred stellar parameters to date. More precise and
detailed astrophysical parameters based on the full BP/RP spectrophotometry are
planned as part of the third Gaia data release.
","[{""version"":""v1"",""created"":""Wed, 25 Apr 2018 06:25:24 GMT""}]","2018-08-22"
"1804.09375","Fr\'ed\'eric Arenou","F. Arenou, X. Luri, C. Babusiaux, C. Fabricius, A. Helmi, T. Muraveva,
  A. C. Robin, F. Spoto, A. Vallenari, T. Antoja, T. Cantat-Gaudin, C. Jordi,
  N. Leclerc, C. Reyl\'e, M. Romero-G\'omez, I-C. Shih, S. Soria, C. Barache,
  D. Bossini, A. Bragaglia, M. A. Breddels, M. Fabrizio, S. Lambert, P.M.
  Marrese, D. Massari, A. Moitinho, N. Robichon, L. Ruiz-Dern, R. Sordo, J.
  Veljanoski, P. Di Matteo, L. Eyer, G. Jasniewicz, E. Pancino, C. Soubiran, A.
  Spagna, P. Tanga, C. Turon, C. Zurbach","Gaia Data Release 2: Catalogue validation","Submitted to A&A","A&A 616, A17 (2018)","10.1051/0004-6361/201833234",,"astro-ph.GA astro-ph.IM","http://arxiv.org/licenses/nonexclusive-distrib/1.0/","  The second Gaia data release (DR2), contains very precise astrometric and
photometric properties for more than one billion sources, astrophysical
parameters for dozens of millions, radial velocities for millions, variability
information for half a million of stellar sources and orbits for thousands of
solar system objects. Before the Catalogue publication, these data have
undergone dedicated validation processes. The goal of this paper is to describe
the validation results in terms of completeness, accuracy and precision of the
various Gaia DR2 data. The validation processes include a systematic analysis
of the Catalogue content to detect anomalies, either individual errors or
statistical properties, using statistical analysis, and comparisons to external
data or to models. Although the astrometric, photometric and spectroscopic data
are of unprecedented quality and quantity, it is shown that the data cannot be
used without a dedicated attention to the limitations described here, in the
Catalogue documentation and in accompanying papers. A particular emphasis is
put on the caveats for the statistical use of the data in scientific
exploitation.
","[{""version"":""v1"",""created"":""Wed, 25 Apr 2018 06:25:25 GMT""}]","2018-08-22"
"1804.09376","Xavier Luri","X. Luri, A.G.A. Brown, L.M. Sarro, F. Arenou, C.A.L. Bailer-Jones, A.
  Castro-Ginard, J. de Bruijne, T. Prusti, C. Babusiaux and H.E. Delgado","Gaia Data Release 2: using Gaia parallaxes","Accepted for publication in the special issue ""Gaia data release 2""
  of Astronomy & Astrophysics","A&A 616, A9 (2018)","10.1051/0004-6361/201832964",,"astro-ph.IM","http://arxiv.org/licenses/nonexclusive-distrib/1.0/","  The second Gaia data release (GDR2) provides precise five-parameter
astrometric data (positions, proper motions and parallaxes) for an
unprecedented amount of sources (more than $1.3$ billion, mostly stars). The
use of this wealth of astrometric data comes with a specific challenge: how
does one properly infer from these data the astrophysical parameters of
interest?
  The main - but not only - focus of this paper is the issue of the estimation
of distances from parallaxes, possibly combined with other information. We
start with a critical review of the methods traditionally used to obtain
distances from parallaxes and their shortcomings. Then we provide guidelines on
how to use parallaxes more efficiently to estimate distances by using Bayesian
methods. In particular also we show that negative parallaxes, or parallaxes
with relatively larger uncertainties still contain valuable information.
Finally, we provide examples that show more generally how to use astrometric
data for parameter estimation, including the combination of proper motions and
parallaxes and the handling of covariances in the uncertainties.
  The paper contains examples based on simulated Gaia data to illustrate the
problems and the solutions proposed. Furthermore, the developments and methods
proposed in the paper are linked to a set of tutorials included in the Gaia
archive documentation that provide practical examples and a good starting point
for the application of the recommendations to actual problems. In all cases the
source code for the analysis methods is provided. Our main recommendation is to
always treat the derivation of (astro-) physical parameters from astrometric
data, in particular when parallaxes are involved, as an inference problem which
should preferably be handled with a full Bayesian approach.
","[{""version"":""v1"",""created"":""Wed, 25 Apr 2018 06:25:26 GMT""},{""version"":""v2"",""created"":""Fri, 8 Jun 2018 20:12:17 GMT""}]","2018-08-15"
"1804.09377","Francois Mignard","F. Mignard, S. Klioner, L. Lindegren, J. Hernandez, U. Bastian, A.
  Bombrun","Gaia Data Release 2: The Celestial reference frame (Gaia-CRF2)","30 pages, 20 figures, and 446 co-authors",,"10.1051/0004-6361/201832916",,"astro-ph.GA astro-ph.IM","http://arxiv.org/licenses/nonexclusive-distrib/1.0/","  The second release of Gaia data (Gaia DR2) contains the astrometric
parameters for more than half a million quasars. This set defines a
kinematically non-rotating reference frame in the optical domain referred to as
the Gaia-CRF2. The Gaia-CRF2 is the first realisation of a non-rotating global
optical reference frame that meets the ICRS prescriptions, meaning that it is
built only on extragalactic sources. It consists of the positions of a sample
of 556 869 sources in Gaia DR2, obtained from a positional cross-match with the
ICRF3-prototype and AllWISE AGN catalogues. The sample constitutes a clean,
dense, and homogeneous set of extragalactic point sources in the magnitude
range G from 16 to 21 mag with accurately known optical positions. The median
positional uncertainty is 0.12 mas for G < 18 mag and 0.5 mas at G = 20 mag.
Large-scale systematics are estimated to be in the range 20 to 30 muas. The
accuracy claims are supported by the parallaxes and proper motions of the
quasars in Gaia DR2. The optical positions for a subset of 2820 sources in
common with the ICRF3-prototype show very good overall agreement with the radio
positions, but several tens of sources have significantly discrepant positions.
","[{""version"":""v1"",""created"":""Wed, 25 Apr 2018 06:25:27 GMT""}]","2019-11-06"
"1804.09378","Carine Babusiaux","Gaia Collaboration, C. Babusiaux, F. van Leeuwen, M.A. Barstow, C.
  Jordi, A. Vallenari, D. Bossini, A. Bressan, T. Cantat-Gaudin, M. van
  Leeuwen, A.G.A. Brown, T. Prusti, J.H.J. de Bruijne, C.A.L. Bailer-Jones, M.
  Biermann, D.W. Evans, L. Eyer, F. Jansen, S.A. Klioner, U. Lammers, L.
  Lindegren, X. Luri, F. Mignard, C. Panem, D. Pourbaix, S. Randich, P.
  Sartoretti, H.I. Siddiqui, C. Soubiran, N.A. Walton, F. Arenou, U. Bastian,
  M. Cropper, R. Drimmel, D. Katz, M.G. Lattanzi, J. Bakker, C. Cacciari, J.
  Casta\~neda, L. Chaoul, N. Cheek, F. DeAngeli, C. Fabricius, R. Guerra, B.
  Holl, E. Masana, R. Messineo, N. Mowlavi, K. Nienartowicz, P. Panuzzo, J.
  Portell, M. Riello, G.M. Seabroke, P. Tanga, F. Th\'evenin, G. Gracia-Abril,
  G. Comoretto, M. Garcia-Reinaldos, D. Teyssier, M. Altmann, R. Andrae, M.
  Audard, I. Bellas-Velidis, K. Benson, J. Berthier, R. Blomme, P. Burgess, G.
  Busso, B. Carry, A. Cellino, G. Clementini, M. Clotet, O. Creevey, M.
  Davidson, J. DeRidder, L. Delchambre, A. Dell'Oro, C. Ducourant, J.
  Fern\'andez-Hern\'andez, M. Fouesneau, Y. Fr\'emat, L. Galluccio, M.
  Garc\'ia-Torres, J. Gonz\'alez-N\'u\~nez, J.J. Gonz\'alez-Vidal, E. Gosset,
  L.P. Guy, J.-L. Halbwachs, N.C. Hambly, D.L. Harrison, J. Hern\'andez, D.
  Hestroffer, S.T. Hodgkin, A. Hutton, G. Jasniewicz, A. Jean-Antoine-Piccolo,
  S. Jordan, A.J. Korn, A. Krone-Martins, A.C. Lanzafame, T. Lebzelter, W.
  L\""offler, M. Manteiga, P.M. Marrese, J.M. Mart\'in-Fleitas, A. Moitinho, A.
  Mora, K. Muinonen, J. Osinde, E. Pancino, T. Pauwels, J.-M. Petit, A.
  Recio-Blanco, P.J. Richards, L. Rimoldini, A.C. Robin, L.M. Sarro, C. Siopis,
  M. Smith, A. Sozzetti, M. S\""uveges, J. Torra, W. vanReeven, U. Abbas, A.
  Abreu Aramburu, S. Accart, C. Aerts, G. Altavilla, M.A. \'Alvarez, R.
  Alvarez, J. Alves, R.I. Anderson, A.H. Andrei, E. Anglada Varela, E. Antiche,
  T. Antoja, B. Arcay, T.L. Astraatmadja, N. Bach, S.G. Baker, L.
  Balaguer-N\'u\~nez, P. Balm, C. Barache, C. Barata, D. Barbato, F. Barblan,
  P.S. Barklem, D. Barrado, M. Barros, S. Bartholom\'e Mu\~noz, J.-L.
  Bassilana, U. Becciani, M. Bellazzini, A. Berihuete, S. Bertone, L. Bianchi,
  O. Bienaym\'e, S. Blanco-Cuaresma, T. Boch, C. Boeche, A. Bombrun, R.
  Borrachero, S. Bouquillon, G. Bourda, A. Bragaglia, L. Bramante, M.A.
  Breddels, N. Brouillet, T. Br\""usemeister, E. Brugaletta, B. Bucciarelli, A.
  Burlacu, D. Busonero, A.G. Butkevich, R. Buzzi, E. Caffau, R. Cancelliere, G.
  Cannizzaro, R. Carballo, T. Carlucci, J.M. Carrasco, L. Casamiquela, M.
  Castellani, A. Castro-Ginard, P. Charlot, L. Chemin, A. Chiavassa, G.
  Cocozza, G. Costigan, S. Cowell, F. Crifo, M. Crosta, C. Crowley, J. Cuypers,
  C. Dafonte, Y. Damerdji, A. Dapergolas, P. David, M. David, P. deLaverny, F.
  DeLuise, R. DeMarch, D. deMartino, R. deSouza, A. deTorres, J. Debosscher, E.
  delPozo, M. Delbo, A. Delgado, H.E. Delgado, S. Diakite, C. Diener, E.
  Distefano, C. Dolding, P. Drazinos, J. Dur\'an, B. Edvardsson, H. Enke, K.
  Eriksson, P. Esquej, G. Eynard Bontemps, C. Fabre, M. Fabrizio, S. Faigler,
  A.J. Falc\~ao, M. Farr\`as Casas, L. Federici, G. Fedorets, P. Fernique, F.
  Figueras, F. Filippi, K. Findeisen, A. Fonti, E. Fraile, M. Fraser, B.
  Fr\'ezouls, M. Gai, S. Galleti, D. Garabato, F. Garc\'ia-Sedano, A. Garofalo,
  N. Garralda, A. Gavel, P. Gavras, J. Gerssen, R. Geyer, P. Giacobbe, G.
  Gilmore, S. Girona, G. Giuffrida, F. Glass, M. Gomes, M. Granvik, A. Gueguen,
  A. Guerrier, J. Guiraud, R. Guti\'errez-S\'anchez, R. Haigron, D.
  Hatzidimitriou, M. Hauser, M. Haywood, U. Heiter, A. Helmi, J. Heu, T.
  Hilger, D. Hobbs, W. Hofmann, G. Holland, H.E. Huckle, A. Hypki, V. Icardi,
  K. Jan{\ss}en, G. JevardatdeFombelle, P.G. Jonker, \'A.L. Juh\'asz, F. Julbe,
  A. Karampelas, A. Kewley, J. Klar, A. Kochoska, R. Kohley, K. Kolenberg, M.
  Kontizas, E. Kontizas, S.E. Koposov, G. Kordopatis, Z. Kostrzewa-Rutkowska,
  P. Koubsky, S. Lambert, A.F. Lanza, Y. Lasne, J.-B. Lavigne, Y. LeFustec, C.
  LePoncin-Lafitte, Y. Lebreton, S. Leccia, N. Leclerc, I. Lecoeur-Taibi, H.
  Lenhardt, F. Leroux, S. Liao, E. Licata, H.E.P. Lindstr{\o}m, T.A. Lister, E.
  Livanou, A. Lobel, M. L\'opez, S. Managau, R.G. Mann, G. Mantelet, O.
  Marchal, J.M. Marchant, M. Marconi, S. Marinoni, G. Marschalk\'o, D.J.
  Marshall, M. Martino, G. Marton, N. Mary, D. Massari, G. Matijevi\v{c}, T.
  Mazeh, P.J. McMillan, S. Messina, D. Michalik, N.R. Millar, D. Molina, R.
  Molinaro, L. Moln\'ar, P. Montegriffo, R. Mor, R. Morbidelli, T. Morel, D.
  Morris, A.F. Mulone, T. Muraveva, I. Musella, G. Nelemans, L. Nicastro, L.
  Noval, W. O'Mullane, C. Ord\'enovic, D. Ord\'o\~nez-Blanco, P. Osborne, C.
  Pagani, I. Pagano, F. Pailler, H. Palacin, L. Palaversa, A. Panahi, M.
  Pawlak, A.M. Piersimoni, F.-X. Pineau, E. Plachy, G. Plum, E. Poggio, E.
  Poujoulet, A. Pr\v{s}a, L. Pulone, E. Racero, S. Ragaini, N. Rambaux, M.
  Ramos-Lerate, S. Regibo, C. Reyl\'e, F. Riclet, V. Ripepi, A. Riva, A.
  Rivard, G. Rixon, T. Roegiers, M. Roelens, M. Romero-G\'omez, N. Rowell, F.
  Royer, L. Ruiz-Dern, G. Sadowski, T. Sagrist\`a Sell\'es, J. Sahlmann, J.
  Salgado, E. Salguero, N. Sanna, T. Santana-Ros, M. Sarasso, H. Savietto, M.
  Schultheis, E. Sciacca, M. Segol, J.C. Segovia, D. S\'egransan, I-C. Shih, L.
  Siltala, A.F. Silva, R.L. Smart, K.W. Smith, E. Solano, F. Solitro, R. Sordo,
  S. SoriaNieto, J. Souchay, A. Spagna, F. Spoto, U. Stampa, I.A. Steele, H.
  Steidelm\""uller, C.A. Stephenson, H. Stoev, F.F. Suess, J. Surdej, L.
  Szabados, E. Szegedi-Elek, D. Tapiador, F. Taris, G. Tauran, M.B. Taylor, R.
  Teixeira, D. Terrett, P. Teyssandier, W. Thuillot, A. Titarenko, F.
  TorraClotet, C. Turon, A. Ulla, E. Utrilla, S. Uzzi, M. Vaillant, G.
  Valentini, V. Valette, A. vanElteren, E. Van Hemelryck, M. Vaschetto, A.
  Vecchiato, J. Veljanoski, Y. Viala, D. Vicente, S. Vogt, C. vonEssen, H.
  Voss, V. Votruba, S. Voutsinas, G. Walmsley, M. Weiler, O. Wertz, T. Wevers,
  {\L}. Wyrzykowski, A. Yoldas, M. \v{Z}erjal, H. Ziaeepour, J. Zorec, S.
  Zschocke, S. Zucker, C. Zurbach, T. Zwitter","Gaia Data Release 2: Observational Hertzsprung-Russell diagrams","Published in the A&A Gaia Data Release 2 special issue. Tables 2 and
  A.4 corrected. Tables available at
  http://cdsarc.u-strasbg.fr/viz-bin/qcat?J/A+A/616/A10","A&A 616, A10 (2018)","10.1051/0004-6361/201832843",,"astro-ph.SR astro-ph.GA","http://arxiv.org/licenses/nonexclusive-distrib/1.0/","  We highlight the power of the Gaia DR2 in studying many fine structures of
the Hertzsprung-Russell diagram (HRD). Gaia allows us to present many different
HRDs, depending in particular on stellar population selections. We do not aim
here for completeness in terms of types of stars or stellar evolutionary
aspects. Instead, we have chosen several illustrative examples. We describe
some of the selections that can be made in Gaia DR2 to highlight the main
structures of the Gaia HRDs. We select both field and cluster (open and
globular) stars, compare the observations with previous classifications and
with stellar evolutionary tracks, and we present variations of the Gaia HRD
with age, metallicity, and kinematics. Late stages of stellar evolution such as
hot subdwarfs, post-AGB stars, planetary nebulae, and white dwarfs are also
analysed, as well as low-mass brown dwarf objects. The Gaia HRDs are
unprecedented in both precision and coverage of the various Milky Way stellar
populations and stellar evolutionary phases. Many fine structures of the HRDs
are presented. The clear split of the white dwarf sequence into hydrogen and
helium white dwarfs is presented for the first time in an HRD. The relation
between kinematics and the HRD is nicely illustrated. Two different populations
in a classical kinematic selection of the halo are unambiguously identified in
the HRD. Membership and mean parameters for a selected list of open clusters
are provided. They allow drawing very detailed cluster sequences, highlighting
fine structures, and providing extremely precise empirical isochrones that will
lead to more insight in stellar physics. Gaia DR2 demonstrates the potential of
combining precise astrometry and photometry for large samples for studies in
stellar evolution and stellar population and opens an entire new area for
HRD-based studies.
","[{""version"":""v1"",""created"":""Wed, 25 Apr 2018 06:25:28 GMT""},{""version"":""v2"",""created"":""Mon, 13 Aug 2018 09:27:49 GMT""}]","2018-08-15"
"1804.09379","Federica Spoto","Gaia Collaboration: F. Spoto, P. Tanga, F. Mignard, J. Berthier, B.
  Carry, A. Cellino, et al","Gaia Data Release 2: Observations of solar system objects",,"A&A 616, A13 (2018)","10.1051/0004-6361/201832900",,"astro-ph.EP astro-ph.IM","http://arxiv.org/licenses/nonexclusive-distrib/1.0/","  The Gaia spacecraft of the European Space Agency (ESA) has been securing
observations of solar system objects (SSOs) since the beginning of its
operations. Gaia Data Release 2 (DR2) contains the observations of a selected
sample of 14,099 SSOs. These asteroids have been already identified and have
been numbered by the Minor Planet Center. Positions are provided for each Gaia
observation at CCD level. As additional information, the apparent brightness of
SSOs in the unfiltered G band is also provided for selected observations. We
explain the processing of SSO data, and describe the criteria we used to select
the sample published in Gaia DR2. We then explore the data set to assess its
quality. To exploit the epoch astrometry of asteroids in Gaia DR2 it is
necessary to take into account the unusual properties of the uncertainty, as
the position information is nearly one-dimensional. When this aspect is handled
appropriately, an orbit fit can be obtained with post-fit residuals that are
overall consistent with the a-priori error model that was used to define
individual values of the astrometric uncertainty. The distribution of residuals
allowed us to identify possible contaminants in the data set. Photometry in the
G band was compared to computed values from reference asteroid shapes and to
the flux registered at the corresponding epochs by the red and blue photometers
(RP and BP). The overall astrometric performance is close to the expectations,
with an optimal range of brightness G~12-17. In this range, the typical
transit-level accuracy is well below 1 mas. For fainter asteroids, the growing
photon noise deteriorates the performance. Asteroids brighter than G~12 are
affected by a lower performance of the processing of their signals. The
dramatic improvement brought by Gaia DR2 astrometry of SSOs is demonstrated by
preliminary tests on the detection of subtle non-gravitational effects.
","[{""version"":""v1"",""created"":""Wed, 25 Apr 2018 06:25:29 GMT""}]","2018-08-15"
"1804.09380","David Katz","Gaia Collaboration: D. Katz, T. Antoja, M. Romero-G\'omez, R. Drimmel,
  C. Reyl\'e, G.M. Seabroke, C. Soubiran, C. Babusiaux, P. Di Matteo, F.
  Figueras, E. Poggio, A.C. Robin, D.W. Evans and 440 DPAC co-authors","Gaia Data Release 2: Mapping the Milky Way disc kinematics","Accepted for publication in A&A Gaia DR2 special issue","A&A 616, A11 (2018)","10.1051/0004-6361/201832865",,"astro-ph.GA","http://arxiv.org/licenses/nonexclusive-distrib/1.0/","  To illustrate the potential of GDR2, we provide a first look at the
kinematics of the Milky Way disc, within a radius of several kiloparsecs around
the Sun. We benefit for the first time from a sample of 6.4 million F-G-K stars
with full 6D phase-space coordinates, precise parallaxes, and precise Galactic
cylindrical velocities . From this sample, we extracted a sub-sample of 3.2
million giant stars to map the velocity field of the Galactic disc from
$\sim$5~kpc to $\sim$13~kpc from the Galactic centre and up to 2~kpc above and
below the plane. We also study the distribution of 0.3 million solar
neighbourhood stars ($r < 200$~pc), with median velocity uncertainties of
0.4~km/s, in velocity space and use the full sample to examine how the
over-densities evolve in more distant regions. GDR2 allows us to draw 3D maps
of the Galactocentric median velocities and velocity dispersions with
unprecedented accuracy, precision, and spatial resolution. The maps show the
complexity and richness of the velocity field of the galactic disc. We observe
streaming motions in all the components of the velocities as well as patterns
in the velocity dispersions. For example, we confirm the previously reported
negative and positive galactocentric radial velocity gradients in the inner and
outer disc, respectively. Here, we see them as part of a non-axisymmetric
kinematic oscillation, and we map its azimuthal and vertical behaviour. We also
witness a new global arrangement of stars in the velocity plane of the solar
neighbourhood and in distant regions in which stars are organised in thin
substructures with the shape of circular arches that are oriented approximately
along the horizontal direction in the $U-V$ plane. Moreover, in distant
regions, we see variations in the velocity substructures more clearly than ever
before, in particular, variations in the velocity of the Hercules stream.
(abridged)
","[{""version"":""v1"",""created"":""Wed, 25 Apr 2018 06:25:30 GMT""}]","2018-08-15"
"1804.09381","Amina Helmi","Gaia Collaboration: A. Helmi, F. van Leeuwen, P.J. McMillan, D.
  Massari, T. Antoja, A. Robin, L. Lindegren, U. Bastian and 445 co-authors","Gaia Data Release 2: Kinematics of globular clusters and dwarf galaxies
  around the Milky Way","49 pages, 35 figures, 9 tables. A&A Gaia DR2 Special Issue. Tables
  and additional visuals are available at
  http://www.astro.rug.nl/~ahelmi/research/dr2-dggc. This version includes the
  minor corrections implemented in the Erratum by Gaia Collaboration et al
  (2020), affecting Eqs.B.10 and B.21",,"10.1051/0004-6361/201832698",,"astro-ph.GA","http://arxiv.org/licenses/nonexclusive-distrib/1.0/","  The goal of this paper is to demonstrate the outstanding quality of the
second data release of the Gaia mission and its power for constraining many
different aspects of the dynamics of the satellites of the Milky Way. We focus
here on determining the proper motions of 75 Galactic globular clusters, nine
dwarf spheroidal galaxies, one ultra-faint system, and the Large and Small
Magellanic Clouds. Using data extracted from the Gaia archive, we derived the
proper motions and parallaxes for these systems, as well as their
uncertainties. We demonstrate that the errors, statistical and systematic, are
relatively well understood. We integrated the orbits of these objects in three
different Galactic potentials, and characterised their properties. We present
the derived proper motions, space velocities, and characteristic orbital
parameters in various tables to facilitate their use by the astronomical
community. Our limited and straightforward analyses have allowed us for example
to (i) determine absolute and very precise proper motions for globular
clusters; (ii) detect clear rotation signatures in the proper motions of at
least five globular clusters; (iii) show that the satellites of the Milky Way
are all on high-inclination orbits, but that they do not share a single plane
of motion; (iv) derive a lower limit for the mass of the Milky Way of
9.8^{+6.7}_{-2.7} x 10^{11} Msun based on the assumption that the Leo I dwarf
spheroidal is bound; (v) derive a rotation curve for the Large Magellanic Cloud
based solely on proper motions that is competitive with line-of-sight velocity
curves, now using many orders of magnitude more sources; and (vi) unveil the
dynamical effect of the bar on the motions of stars in the Large Magellanic
Cloud. All these results highlight the incredible power of the Gaia astrometric
mission, and in particular of its second data release.
","[{""version"":""v1"",""created"":""Wed, 25 Apr 2018 06:25:31 GMT""},{""version"":""v2"",""created"":""Mon, 18 Jun 2018 17:09:40 GMT""},{""version"":""v3"",""created"":""Sun, 22 Nov 2020 21:26:00 GMT""}]","2020-11-24"
