"1811.09731","Ashkan Aghdai","Ashkan Aghdai, Michael I.-C. Wang, Yang Xu, Charles H.-P. Wen, H.
  Jonathan Chao","In-network Congestion-aware Load Balancing at Transport Layer",,,"10.1109/NFV-SDN47374.2019.9040109",,"cs.NI","http://arxiv.org/licenses/nonexclusive-distrib/1.0/","  Load balancing at transport layer is an important function in data centers,
content delivery networks, and mobile networks, where per-connection
consistency (PCC) has to be met for optimal performance. Cloud-native L4 load
balancers are commonly deployed as virtual network functions (VNFs) and are a
critical forwarding element in modern cloud infrastructure. We identify load
imbalance among service instances as the main cause of additional processing
delay caused by transport-layer load balancers. Existing transport-layer load
balancers rely on one of two methods: host-level traffic redirection, which may
add as much as 12.48% additional traffic to underlying networks, or connection
tracking, which consumes a considerable amount of memory in load balancers.
Both of these methods result in inefficient usage of network resources. We
propose the in-network congestion-aware load Balancer (INCAB) to achieve even
load distribution among service instances and optimal network resources usage
in addition to meeting the PCC requirement. We show that INCAB is capable of
identifying and monitoring each instance's most-utilized resource and can
improve the load distribution among all service instances. INCAB utilizes a
Bloom filter and an ultra-compact connection table for in-network flow
distribution. Furthermore, it does not rely on end hosts for traffic
redirection. Our flow level simulations show that INCAB improves flows' average
completion time by 31.97% compared to stateless solutions.
","[{""version"":""v1"",""created"":""Sat, 24 Nov 2018 00:20:19 GMT""},{""version"":""v2"",""created"":""Fri, 14 Jun 2019 03:40:44 GMT""}]","2020-03-27"
"1811.09732","Abdul Dakkak","Abdul Dakkak, Cheng Li, Simon Garcia de Gonzalo, Jinjun Xiong, Wen-mei
  Hwu","TrIMS: Transparent and Isolated Model Sharing for Low Latency Deep
  LearningInference in Function as a Service Environments","In Proceedings CLOUD 2019",,"10.1109/CLOUD.2019.00067",,"cs.DC cs.LG","http://creativecommons.org/licenses/by/4.0/","  Deep neural networks (DNNs) have become core computation components within
low latency Function as a Service (FaaS) prediction pipelines: including image
recognition, object detection, natural language processing, speech synthesis,
and personalized recommendation pipelines. Cloud computing, as the de-facto
backbone of modern computing infrastructure for both enterprise and consumer
applications, has to be able to handle user-defined pipelines of diverse DNN
inference workloads while maintaining isolation and latency guarantees, and
minimizing resource waste. The current solution for guaranteeing isolation
within FaaS is suboptimal -- suffering from ""cold start"" latency. A major cause
of such inefficiency is the need to move large amount of model data within and
across servers. We propose TrIMS as a novel solution to address these issues.
Our proposed solution consists of a persistent model store across the GPU, CPU,
local storage, and cloud storage hierarchy, an efficient resource management
layer that provides isolation, and a succinct set of application APIs and
container technologies for easy and transparent integration with FaaS, Deep
Learning (DL) frameworks, and user code. We demonstrate our solution by
interfacing TrIMS with the Apache MXNet framework and demonstrate up to 24x
speedup in latency for image classification models and up to 210x speedup for
large models. We achieve up to 8x system throughput improvement.
","[{""version"":""v1"",""created"":""Sat, 24 Nov 2018 00:52:11 GMT""}]","2019-11-19"
"1811.09733","Roberto Vila Gabriel","Luis R. Lucinger and Roberto Vila","Existence of Scaling Limit Phase Transition in a Two-dimensional Random
  Polymer Model","14 pages. Accepted for publication in Markov Processes And Related
  Fields",,,,"math-ph math.MP","http://arxiv.org/licenses/nonexclusive-distrib/1.0/","  In this paper we prove a scaling limit phase transition for a class of
two-dimensional random polymers.
","[{""version"":""v1"",""created"":""Sat, 24 Nov 2018 00:57:54 GMT""},{""version"":""v2"",""created"":""Sun, 16 Jun 2019 16:36:01 GMT""}]","2019-06-18"
"1811.09734","Won Chang","Won Chang, Sunghoon Kim, Heewon Chae","A Regularized Spatial Market Segmentation Method with Dirichlet Process
  Gaussian Mixture Prior",,,,,"stat.AP stat.ME","http://arxiv.org/licenses/nonexclusive-distrib/1.0/","  Spatially referenced data are increasingly available thanks to the
development of modern GPS technology. They also provide rich opportunities for
spatial analytics in the field of marketing science. Our main interest is to
propose a new efficient statistical framework to conduct spatial segmentation
analysis for restaurants located in a metropolitan area in the U.S. The spatial
segmentation problem poses important statistical challenges: selecting the
optimal number of underlying structures of market segments, capturing complex
and flexible spatial structures, and resolving any possible small n and large p
issue which can be typical in latent class analysis. Existing approaches try to
tackle these issues in heuristic ways or seem silent on them. To overcome these
challenges, we propose a new statistical framework based on regularized
Bayesian spatial mixture regressions with Dirichlet process integrating ridge
or lasso regularization. Our simulation study demonstrates that the proposed
models successfully recover the underlying spatial clustering structures and
outperforms two existing benchmark models. In the empirical analysis using
online customer satisfaction data from the Yelp, our models provides
interesting insights on segment-level key drivers of customer satisfaction and
interpretable relationships between regional demographics and restaurants'
characteristics.
","[{""version"":""v1"",""created"":""Sat, 24 Nov 2018 01:01:44 GMT""}]","2018-11-27"
"1811.09735","Long Nguyen","Sisheng Liang, Long Nguyen, Fang Jin","A Multi-variable Stacked Long-Short Term Memory Network for Wind Speed
  Forecasting",,,,,"cs.LG stat.ML","http://arxiv.org/licenses/nonexclusive-distrib/1.0/","  Precisely forecasting wind speed is essential for wind power producers and
grid operators. However, this task is challenging due to the stochasticity of
wind speed. To accurately predict short-term wind speed under uncertainties,
this paper proposed a multi-variable stacked LSTMs model (MSLSTM). The proposed
method utilizes multiple historical meteorological variables, such as wind
speed, temperature, humidity, pressure, dew point and solar radiation to
accurately predict wind speeds. The prediction performance is extensively
assessed using real data collected in West Texas, USA. The experimental results
show that the proposed MSLSTM can preferably capture and learn uncertainties
while output competitive performance.
","[{""version"":""v1"",""created"":""Sat, 24 Nov 2018 01:12:31 GMT""}]","2018-11-27"
"1811.09736","Abdul Dakkak","Abdul Dakkak, Cheng Li, Isaac Gelado, Jinjun Xiong, Wen-mei Hwu","Accelerating Reduction and Scan Using Tensor Core Units","In Proceedings of the ACM International Conference on Supercomputing
  (ICS '19)",,"10.1145/3330345.3331057",,"cs.PF","http://creativecommons.org/licenses/by/4.0/","  Driven by deep learning, there has been a surge of specialized processors for
matrix multiplication, referred to as TensorCore Units (TCUs). These TCUs are
capable of performing matrix multiplications on small matrices (usually 4x4 or
16x16) to accelerate the convolutional and recurrent neural networks in deep
learning workloads. In this paper we leverage NVIDIA's TCU to express both
reduction and scan with matrix multiplication and show the benefits -- in terms
of program simplicity, efficiency, and performance. Our algorithm exercises the
NVIDIA TCUs which would otherwise be idle, achieves 89%-98% of peak memory copy
bandwidth, and is orders of magnitude faster (up to 100x for reduction and 3x
for scan) than state-of-the-art methods for small segment sizes -- common in
machine learning and scientific applications. Our algorithm achieves this while
decreasing the power consumption by up to 22% for reduction and16%for scan.
","[{""version"":""v1"",""created"":""Sat, 24 Nov 2018 01:17:51 GMT""},{""version"":""v2"",""created"":""Sat, 23 Nov 2019 22:34:29 GMT""}]","2019-11-26"
"1811.09737","Abdul Dakkak","Abdul Dakkak, Cheng Li, Jinjun Xiong, Wen-Mei Hwu","Frustrated with Replicating Claims of a Shared Model? A Solution",,,,,"cs.LG stat.ML","http://creativecommons.org/licenses/by/4.0/","  Machine Learning (ML) and Deep Learning (DL) innovations are being introduced
at such a rapid pace that model owners and evaluators are hard-pressed
analyzing and studying them. This is exacerbated by the complicated procedures
for evaluation. The lack of standard systems and efficient techniques for
specifying and provisioning ML/DL evaluation is the main cause of this ""pain
point"". This work discusses common pitfalls for replicating DL model
evaluation, and shows that these subtle pitfalls can affect both accuracy and
performance. It then proposes a solution to remedy these pitfalls called
MLModelScope, a specification for repeatable model evaluation and a runtime to
provision and measure experiments. We show that by easing the model
specification and evaluation process, MLModelScope facilitates rapid adoption
of ML/DL innovations.
","[{""version"":""v1"",""created"":""Sat, 24 Nov 2018 01:18:00 GMT""},{""version"":""v2"",""created"":""Tue, 25 Jun 2019 17:15:01 GMT""}]","2019-06-26"
"1811.09738","Chengping Shen","Belle Collaboration: Y. B. Li, C. P. Shen, C. Z. Yuan, I. Adachi, H.
  Aihara, S. Al Said, D. M. Asner, T. Aushev, R. Ayad, I. Badhrees, V. Bansal,
  C. Bele\~no, M. Berger, V. Bhardwaj, B. Bhuyan, T. Bilka, J. Biswal, A.
  Bondar, A. Bozek, M. Bra\v{c}ko, L. Cao, D. \v{C}ervenkov, A. Chen, B. G.
  Cheon, K. Chilikin, K. Cho, S.-K. Choi, Y. Choi, D. Cinabro, S. Cunliffe, S.
  Di Carlo, Z. Dole\v{z}al, T. V. Dong, Z. Dr\'asal, S. Eidelman, J. E. Fast,
  B. G. Fulsom, R. Garg, V. Gaur, N. Gabyshev, A. Garmash, A. Giri, P.
  Goldenzweig, D. Greenwald, B. Grube, K. Hayasaka, H. Hayashii, C.-L. Hsu, T.
  Iijima, K. Inami, G. Inguglia, A. Ishikawa, R. Itoh, M. Iwasaki, Y. Iwasaki,
  W. W. Jacobs, S. Jia, Y. Jin, D. Joffe, K. K. Joo, G. Karyan, T. Kawasaki, H.
  Kichimi, D. Y. Kim, H. J. Kim, J. B. Kim, K. T. Kim, S. H. Kim, K. Kinoshita,
  P. Kody\v{s}, S. Korpar, D. Kotchetkov, P. Kri\v{z}an, R. Kroeger, P.
  Krokovny, T. Kumita, A. Kuzmin, Y.-J. Kwon, J. Y. Lee, S. C. Lee, L. Li Gioi,
  J. Libby, D. Liventsev, M. Lubej, J. MacNaughton, M. Masuda, T. Matsuda, M.
  Merola, H. Miyata, R. Mizuk, G. B. Mohanty, R. Mussa, E. Nakano, M. Nakao, K.
  J. Nath, M. Nayak, M. Niiyama, S. Nishida, H. Ono, Y. Onuki, P. Pakhlov, G.
  Pakhlova, B. Pal, S. Pardi, S.-H. Park, S. Paul, T. K. Pedlar, R. Pestotnik,
  L. E. Piilonen, V. Popov, E. Prencipe, G. Russo, Y. Sakai, M. Salehi, S.
  Sandilya, L. Santelj, T. Sanuki, V. Savinov, O. Schneider, G. Schnell, J.
  Schueler, C. Schwanda, A. J. Schwartz, Y. Seino, K. Senyo, M. E. Sevior,
  T.-A. Shibata, J.-G. Shiu, B. Shwartz, E. Solovieva, M. Stari\v{c}, M.
  Sumihama, T. Sumiyoshi, W. Sutcliffe, M. Takizawa, K. Tanida, Y. Tao, F.
  Tenchini, K. Trabelsi, M. Uchida, T. Uglov, Y. Unno, S. Uno, P. Urquijo, R.
  Van Tonder, G. Varner, B. Wang, C. H. Wang, M.-Z. Wang, P. Wang, X. L. Wang,
  E. Won, S. B. Yang, H. Ye, J. Yelton, J. H. Yin, Y. Yusa, Z. P. Zhang, V.
  Zhilich, V. Zhukova","First measurements of absolute branching fractions of $\Xi_c^0$ at Belle","7 pages, 3 figures, 1 table; accepted for publication as a Letter in
  Physical Review Letters","Phys. Rev. Lett. 122, 082001 (2019)","10.1103/PhysRevLett.122.082001","Belle Preprint # 2018-25, KEK Preprint #: 2018-76","hep-ex hep-ph","http://arxiv.org/licenses/nonexclusive-distrib/1.0/","  We present the first measurements of absolute branching fractions of
$\Xi_c^0$ decays into $\Xi^- \pi^+$, $\Lambda K^- \pi^+$, and $p K^- K^- \pi^+$
final states. The measurements are made using a data set comprising $(772\pm
11)\times 10^{6}$ $B\bar{B}$ pairs collected at the $\Upsilon(4S)$ resonance
with the Belle detector at the KEKB $e^+e^-$ collider. We first measure the
absolute branching fraction for $B^- \to \bar{\Lambda}_c^- \Xi_c^0$ using a
missing-mass technique; the result is ${\cal B}(B^- \to \bar{\Lambda}_c^-
\Xi_c^0) = (9.51 \pm 2.10 \pm 0.88) \times 10^{-4}$. We subsequently measure
the product branching fractions ${\cal B}(B^- \to \bar{\Lambda}_c^-
\Xi_c^0){\cal B}(\Xi_c^0 \to \Xi^- \pi^+)$, ${\cal B}( B^- \to
\bar{\Lambda}_c^- \Xi_c^0) {\cal B}(\Xi_c^0 \to \Lambda K^- \pi^+)$, and ${\cal
B}( B^- \to \bar{\Lambda}_c^- \Xi_c^0) {\cal B}(\Xi_c^0 \to p K^- K^- \pi^+)$
with improved precision. Dividing these product branching fractions by the
result for $B^- \to \bar{\Lambda}_c^- \Xi_c^0$ yields the following branching
fractions: ${\cal B}(\Xi_c^0 \to \Xi^- \pi^+)= (1.80 \pm 0.50 \pm 0.14)\%$,
${\cal B}(\Xi_c^0 \to \Lambda K^- \pi^+)=(1.17 \pm 0.37 \pm 0.09)\%$, and
${\cal B}(\Xi_c^0 \to p K^- K^- \pi^+)=(0.58 \pm 0.23 \pm 0.05)\%.$ For the
above branching fractions, the first uncertainties are statistical and the
second are systematic. Our result for ${\cal B}(\Xi_c^0 \to \Xi^- \pi^+)$ can
be combined with $\Xi_c^0$ branching fractions measured relative to $\Xi_c^0
\to \Xi^- \pi^+$ to yield other absolute $\Xi_c^0$ branching fractions.
","[{""version"":""v1"",""created"":""Sat, 24 Nov 2018 01:25:51 GMT""},{""version"":""v2"",""created"":""Tue, 5 Feb 2019 09:02:09 GMT""}]","2019-02-26"
"1811.09739","Sabyasachi Shivkumar","Sabyasachi Shivkumar, Richard D. Lange, Ankani Chattoraj, Ralf M.
  Haefner","A probabilistic population code based on neural samples","First three contributed equally to the work",,,,"q-bio.NC","http://arxiv.org/licenses/nonexclusive-distrib/1.0/","  Sensory processing is often characterized as implementing probabilistic
inference: networks of neurons compute posterior beliefs over unobserved causes
given the sensory inputs. How these beliefs are computed and represented by
neural responses is much-debated (Fiser et al. 2010, Pouget et al. 2013). A
central debate concerns the question of whether neural responses represent
samples of latent variables (Hoyer & Hyvarinnen 2003) or parameters of their
distributions (Ma et al. 2006) with efforts being made to distinguish between
them (Grabska-Barwinska et al. 2013). A separate debate addresses the question
of whether neural responses are proportionally related to the encoded
probabilities (Barlow 1969), or proportional to the logarithm of those
probabilities (Jazayeri & Movshon 2006, Ma et al. 2006, Beck et al. 2012).
Here, we show that these alternatives - contrary to common assumptions - are
not mutually exclusive and that the very same system can be compatible with all
of them. As a central analytical result, we show that modeling neural responses
in area V1 as samples from a posterior distribution over latents in a linear
Gaussian model of the image implies that those neural responses form a linear
Probabilistic Population Code (PPC, Ma et al. 2006). In particular, the
posterior distribution over some experimenter-defined variable like
""orientation"" is part of the exponential family with sufficient statistics that
are linear in the neural sampling-based firing rates.
","[{""version"":""v1"",""created"":""Sat, 24 Nov 2018 01:26:04 GMT""}]","2018-11-27"
"1811.09740","Zhiting Hu","Bowen Tan, Zhiting Hu, Zichao Yang, Ruslan Salakhutdinov, Eric Xing","Connecting the Dots Between MLE and RL for Sequence Prediction","Major revision. The first two authors contributed equally",,,,"cs.LG cs.AI cs.CL stat.ML","http://arxiv.org/licenses/nonexclusive-distrib/1.0/","  Sequence prediction models can be learned from example sequences with a
variety of training algorithms. Maximum likelihood learning is simple and
efficient, yet can suffer from compounding error at test time. Reinforcement
learning such as policy gradient addresses the issue but can have prohibitively
poor exploration efficiency. A rich set of other algorithms such as RAML, SPG,
and data noising, have also been developed from different perspectives. This
paper establishes a formal connection between these algorithms. We present a
generalized entropy regularized policy optimization formulation, and show that
the apparently distinct algorithms can all be reformulated as special instances
of the framework, with the only difference being the configurations of a reward
function and a couple of hyperparameters. The unified interpretation offers a
systematic view of the varying properties of exploration and learning
efficiency. Besides, inspired from the framework, we present a new algorithm
that dynamically interpolates among the family of algorithms for scheduled
sequence model learning. Experiments on machine translation, text
summarization, and game imitation learning demonstrate the superiority of the
proposed algorithm.
","[{""version"":""v1"",""created"":""Sat, 24 Nov 2018 01:33:39 GMT""},{""version"":""v2"",""created"":""Sat, 29 Jun 2019 19:44:06 GMT""}]","2019-07-02"
"1811.09741","Marco Boggi","Marco Boggi, Eduard Looijenga","Curves with prescribed symmetry and associated representations of
  mapping class groups","Aaron Landesman and Daniel Litt pointed out to us that the proofs of
  Lemma 1.6 and Lemma 1.8 are incomplete. While we believe that the proof of
  Lemma 1.8 can be completed, the gap in the proof of Lemma 1.6 is of a more
  fundamental nature and leads us to withdraw the paper, as its main result
  (Theorem 1.1) depends on this",,,,"math.AG math.AT","http://arxiv.org/licenses/nonexclusive-distrib/1.0/","  Let C be a complex smooth projective algebraic curve endowed with an action
of a finite group G such that the quotient curve has genus at least 3. We prove
that if the G-curve C is very general for these properties, then the natural
map from the group algebra QG to the algebra of Q-endomorphisms of its Jacobian
is an isomorphism. We use this to obtain (topological) properties regarding
certain virtual linear representations of a mapping class group. For example,
we show that the connected component of the Zariski closure of such a
representation acts Q-irreducibly in a G-isogeny space of H^1(C; Q)and with
image often a Q-almost simple group.
","[{""version"":""v1"",""created"":""Sat, 24 Nov 2018 01:49:36 GMT""},{""version"":""v2"",""created"":""Sun, 11 Jul 2021 17:11:39 GMT""},{""version"":""v3"",""created"":""Tue, 31 Aug 2021 09:11:36 GMT""},{""version"":""v4"",""created"":""Thu, 24 Feb 2022 17:42:19 GMT""}]","2022-02-25"
"1811.09742","Alice Publications","ALICE Collaboration","Jet fragmentation transverse momentum measurements from di-hadron
  correlations in $\sqrt{s}$ = 7 TeV pp and $\sqrt{s_{\rm{NN}}}$ = 5.02 TeV
  p-Pb collisions","21 pages, 1 captioned table, 8 figures, authors from page 16,
  published version, figures at http://alice-publications.web.cern.ch/node/4750","JHEP 03 (2019) 169","10.1007/JHEP03(2019)169","CERN-EP-2018-303","nucl-ex hep-ex","http://creativecommons.org/licenses/by/4.0/","  The transverse structure of jets was studied via jet fragmentation transverse
momentum ($j_{\rm{T}}$) distributions, obtained using two-particle correlations
in proton-proton and proton-lead collisions, measured with the ALICE experiment
at the LHC. The highest transverse momentum particle in each event is used as
the trigger particle and the region $3 < p_{\rm{Tt}} < 15$ GeV/$c$ is explored
in this study. The measured distributions show a clear narrow Gaussian
component and a wide non-Gaussian one. Based on Pythia simulations, the narrow
component can be related to non-perturbative hadronization and the wide
component to quantum chromodynamical splitting. The width of the narrow
component shows a weak dependence on the transverse momentum of the trigger
particle, in agreement with the expectation of universality of the
hadronization process. On the other hand, the width of the wide component shows
a rising trend suggesting increased branching for higher transverse momentum.
The results obtained in pp collisions at $\sqrt{s}$ = 7 TeV and in p-Pb
collisions at $\sqrt{s_{\rm{NN}}}$ = 5.02 TeV are compatible within
uncertainties and hence no significant cold nuclear matter effects are
observed. The results are compared to previous measurements from CCOR and
PHENIX as well as to Pythia 8 and Herwig 7 simulations.
","[{""version"":""v1"",""created"":""Sat, 24 Nov 2018 02:02:09 GMT""},{""version"":""v2"",""created"":""Mon, 15 Jun 2020 23:00:36 GMT""}]","2020-06-17"
"1811.09743","Hermanus Batelaan","Sam Keramati, Eric R. Jones, Jeremy Armstrong, Herman Batelaan","Partially coherent quantum degenerate electron matter waves","This version has an additional author and a new section relating
  degeneracy as defined in textbooks compared to the definition used in the
  paper. 25 pages, 7 figures, 2 tables",,,,"quant-ph","http://arxiv.org/licenses/nonexclusive-distrib/1.0/","  The use of electron beams is ubiquitous; electron microscopy, scanning
tunneling microscopy, electron lithography, and electron diffractometry all use
well-collimated and focused beams. On the other hand, quantum degenerate
electron beams do currently not exist. The realization of such beams may impact
all electron beam technologies and are interesting to pursue. Past attempts to
reach degeneracy were hampered by the low degeneracy of continuously emitting
electron sources. With the recent advent of ultra-short electron pulses, high
degeneracy is expected. Coulomb repulsion and low quantum coherence are hurdles
that need to be overcome. A quantum analysis of the electron degeneracy for
partially coherent pulsed electron sources is presented. Two-particle
coincidence spectra are obtained for source parameters that are currently
available. The conclusive demonstration of the fermionic Hanbury-Brown Twiss
(HBT) effect for free electrons is shown to be within reach, and our results
support the claim that femto-second nanotip electron sources, both polarized
and unpolarized, can manifest partial to complete quantum degeneracy with
appreciable signal-to-noise-ratios for free electron pulses notwithstanding
their small particle numbers.
","[{""version"":""v1"",""created"":""Sat, 24 Nov 2018 02:02:46 GMT""},{""version"":""v2"",""created"":""Tue, 8 Jan 2019 04:20:26 GMT""}]","2019-01-09"
"1811.09744","Yashar Mehmani","Yashar Mehmani","Wrinkle-Free Interface Compression for Two-Fluid Flows","6 pages, 4 figures",,,,"physics.flu-dyn physics.comp-ph","http://arxiv.org/licenses/nonexclusive-distrib/1.0/","  Pure advection of a conservative scalar is relevant to several applications
including two-phase flow. Successful numerical schemes must capture the sharp
interface between the phases while maintaining a smooth (wrinkle-free)
interfacial contour. Among other methods, algebraic schemes that are based on
the addition of an extra artificial interface compression term to the scalar
transport equation have gained recent popularity (e.g., OpenFOAM; porous
media). While the approach offers unique flexibilities in spatiotemporal
discretizations, common numerical treatments result in the wrinkling of the
interface. In this short note, an easy-to-implement solution to this problem is
presented.
","[{""version"":""v1"",""created"":""Sat, 24 Nov 2018 02:11:59 GMT""}]","2018-11-27"
"1811.09745","Zhongwen Zhang","Zhongwen Zhang, Egor Chesakov, Dmitrii Marin, Yuri Boykov","Divergence Prior and Vessel-tree Reconstruction","10 pages, 18 figures",,,,"cs.CV","http://arxiv.org/licenses/nonexclusive-distrib/1.0/","  We propose a new geometric regularization principle for reconstructing vector
fields based on prior knowledge about their divergence. As one important
example of this general idea, we focus on vector fields modelling blood flow
pattern that should be divergent in arteries and convergent in veins. We show
that this previously ignored regularization constraint can significantly
improve the quality of vessel tree reconstruction particularly around
bifurcations where non-zero divergence is concentrated. Our divergence prior is
critical for resolving (binary) sign ambiguity in flow orientations produced by
standard vessel filters, e.g. Frangi. Our vessel tree centerline reconstruction
combines divergence constraints with robust curvature regularization. Our
unsupervised method can reconstruct complete vessel trees with near-capillary
details on synthetic and real 3D volumes.
","[{""version"":""v1"",""created"":""Sat, 24 Nov 2018 02:14:43 GMT""}]","2018-11-27"
