"1811.09628","Ryan Miranda","Ryan Miranda (1), Roman R. Rafikov (1,2) ((1) IAS, (2) DAMTP,
  Cambridge)","Multiple Spiral Arms in Protoplanetary Disks: Linear Theory","22 pages, 16 figures, accepted for publication in ApJ",,"10.3847/1538-4357/ab0f9e",,"astro-ph.EP","http://arxiv.org/licenses/nonexclusive-distrib/1.0/","  Recent observations of protoplanetary disks, as well as simulations of
planet-disk interaction, have suggested that a single planet may excite
multiple spiral arms in the disk, in contrast to the previous expectations
based on linear theory (predicting a one-armed density wave). We re-assess the
origin of multiple arms in the framework of linear theory, by solving for the
global two-dimensional response of a non-barotropic disk to an orbiting planet.
We show that the formation of a secondary arm in the inner disk, at about half
of the orbital radius of the planet, is a robust prediction of linear theory.
This arm becomes stronger than the primary spiral at several tenths of the
orbital radius of the planet. Several additional, weaker spiral arms may also
form in the inner disk. On the contrary, a secondary spiral arm is unlikely to
form in the outer disk. Our linear calculations, fully accounting for the
global behavior of both the phases and amplitudes of perturbations, generally
support the recently proposed WKB phase argument for the secondary arm origin
(as caused by the intricacy of constructive interference of azimuthal harmonics
of the perturbation at different radii). We provide analytical arguments
showing that the process of a single spiral wake splitting up into multiple
arms is a generic linear outcome of wave propagation in differentially rotating
disks. It is not unique to planet-driven waves and occurs also in linear
calculations of spiral wakes freely propagating with no external torques. These
results are relevant for understanding formation of multiple rings and gaps in
protoplanetary disks.
","[{""version"":""v1"",""created"":""Fri, 23 Nov 2018 19:00:00 GMT""},{""version"":""v2"",""created"":""Fri, 21 Dec 2018 00:17:53 GMT""},{""version"":""v3"",""created"":""Mon, 18 Mar 2019 01:01:46 GMT""}]","2019-04-17"
"1811.09629","Ruobing Dong","Ruobing Dong, Sheng-yuan Liu, and Jeffrey Fung","Observational Signatures of Planets in Protoplanetary Disks:
  Planet-Induced Line Broadening in Gaps","20 pages, 11 figures, 1 appendix, ApJ accepted",,"10.3847/1538-4357/aaf38e",,"astro-ph.EP astro-ph.SR","http://arxiv.org/licenses/nonexclusive-distrib/1.0/","  Protoplanets can produce structures in protoplanetary disks via gravitational
disk-planet interactions. Once detected, such structures serve as signposts of
planet formation. Here we investigate the kinematic signatures in disks
produced by multi-Jupiter mass ($M_{\rm J}$) planets using 3D hydrodynamics and
radiative transfer simulations. Such a planet opens a deep gap, and drives
transonic vertical motions inside. Such motions include both a bulk motion of
the entire half-disk column, and turbulence on scales comparable to and smaller
than the scale height. They significantly broaden molecular lines from the gap,
producing double-peaked line profiles at certain locations, and a kinematic
velocity dispersion comparable to thermal after azimuthal averaging. The same
planet does not drive fast vertical motions outside the gap, except at the
inner spiral arms and the disk surface. Searching for line broadening induced
by multi-$M_{\rm J}$ planets inside gaps requires an angular resolution
comparable to the gap width, an assessment of the gap gas temperature to within
a factor of 2, and a high sensitivity needed to detect line emission from the
gap.
","[{""version"":""v1"",""created"":""Fri, 23 Nov 2018 19:00:00 GMT""},{""version"":""v2"",""created"":""Thu, 27 Dec 2018 01:39:20 GMT""},{""version"":""v3"",""created"":""Tue, 14 May 2019 06:43:38 GMT""}]","2019-05-15"
"1811.09630","Siddhartha Gurung-L\'opez","Siddhartha Gurung-Lopez, Alvaro A. Orsi and Silvia Bonoli","FLaREON : a fast computation of Ly$\alpha$ escape fractions and line
  profiles","7 pages, 5 figures",,"10.1093/mnras/stz2591",,"astro-ph.GA","http://arxiv.org/licenses/nonexclusive-distrib/1.0/","  We present FLaREON (Fast Lyman-Alpha Radiative Escape from Outflowing Neutral
gas), a public python package that delivers fast and accurate Lyman alpha
escape fractions and line profiles over a wide range of outflow geometries and
properties. The code incorporates different algorithms, such as interpolation
and machine learning to predict Lyman alpha line properties from a pre-computed
grid of outflow configurations based on the outputs of a Monte Carlo radiative
transfer code. Here we describe the algorithm, discuss its performance and
illustrate some of its many applications. Most notably, FLaREON can be used to
infer the physical properties of the outflowing medium from an observed Lyman
alpha line profile, including the escape fraction, or it can be run over
millions of objects in a galaxy formation model to simulate the escape of Lyman
alpha photons in a cosmological volume.
","[{""version"":""v1"",""created"":""Fri, 23 Nov 2018 19:00:01 GMT""},{""version"":""v2"",""created"":""Thu, 23 Jan 2020 23:10:54 GMT""}]","2020-01-27"
"1811.09631","Tunrayo Adeleke-Larodo","Tunrayo Adeleke-Larodo, Jaime Agudo-Canalejo and Ramin Golestanian","Chemical and hydrodynamic alignment of an enzyme","7+4 pages, 3 figures",,"10.1063/1.5081717",,"cond-mat.soft","http://arxiv.org/licenses/nonexclusive-distrib/1.0/","  Motivated by the implications of the complex and dynamic modular geometry of
an enzyme on its motion, we investigate the effect of combining long-range
internal and external hydrodynamic interactions due to thermal fluctuations
with short-range surface interactions. An asymmetric dumbbell consisting of two
unequal subunits, in a nonuniform suspension of a solute with which it
interacts via hydrodynamic interactions as well as non-contact surface
interactions, is shown to have two alignment mechanisms due to the two types of
interactions. In addition to alignment, the chemical gradient results in a
drift velocity that is modified by hydrodynamic interactions between the
constituents of the enzyme.
","[{""version"":""v1"",""created"":""Fri, 23 Nov 2018 19:00:01 GMT""}]","2019-03-27"
"1811.09632","Amir Siraj","Amir Siraj, Abraham Loeb","Identifying Interstellar Objects Trapped in the Solar System through
  Their Orbital Parameters","5 pages, 4 figures, 1 table; accepted for publication in ApJL",,"10.3847/2041-8213/ab042a",,"astro-ph.EP","http://arxiv.org/licenses/nonexclusive-distrib/1.0/","  The first interstellar object, `Oumuamua, was discovered in the Solar System
by Pan-STARRS in 2017, allowing for a calibration of the abundance of
interstellar objects of its size and an estimation of the subset of objects
trapped by the Jupiter-Sun system. Photographing or visiting these trapped
objects would allow for learning about the conditions in other planetary
systems, saving the need to send interstellar probes. Here, we explore the
orbital properties of captured interstellar objects in the Solar System using
dynamical simulations of the Jupiter-Sun system and initial conditions drawn
from the distribution of relative velocities of stars in the Solar
neighborhood. We compare the resulting distributions of orbital elements to
those of the most similar population of known asteroids, namely Centaurs, to
search for a parameter space in which interstellar objects should dominate and
therefore be identifiable solely by their orbits. We find that there should be
thousands of `Oumuamua-size interstellar objects identifiable by Centaur-like
orbits at high inclinations, assuming a number density of `Oumuamua-size
interstellar objects of $\sim 10^{15} \; \mathrm{pc^{-3}}$. We note eight known
objects that may be of interstellar origin. Finally, we estimate that LSST will
be able to detect several hundreds of these objects.
","[{""version"":""v1"",""created"":""Fri, 23 Nov 2018 19:00:02 GMT""},{""version"":""v2"",""created"":""Tue, 27 Nov 2018 19:25:21 GMT""},{""version"":""v3"",""created"":""Tue, 1 Jan 2019 22:04:00 GMT""},{""version"":""v4"",""created"":""Wed, 16 Jan 2019 20:09:31 GMT""},{""version"":""v5"",""created"":""Mon, 4 Feb 2019 03:34:07 GMT""}]","2019-02-20"
"1811.09633","Sambit Giri","Sambit K. Giri, Anson D'Aloisio, Garrelt Mellema, Eiichiro Komatsu,
  Raghunath Ghara and Suman Majumdar","Position-dependent power spectra of the 21-cm signal from the epoch of
  reionization","24 pages, 10 figures, accepted in JCAP",,"10.1088/1475-7516/2019/02/058",,"astro-ph.CO astro-ph.GA","http://arxiv.org/licenses/nonexclusive-distrib/1.0/","  The 21-cm signal from the epoch of reionization is non-Gaussian. Current
radio telescopes are focused on detecting the 21-cm power spectrum, but in the
future the Square Kilometre Array is anticipated to provide a first measurement
of the bispectrum. Previous studies have shown that the position-dependent
power spectrum is a simple and efficient way to probe the squeezed-limit
bispectrum. In this approach, the survey is divided into subvolumes and the
correlation between the local power spectrum and the corresponding mean density
of the subvolume is computed. This correlation is equivalent to an integral of
the bispectrum in the squeezed limit, but is much simpler to implement than the
usual bispectrum estimators. It also has a clear physical interpretation: it
describes how the small-scale power spectrum of tracers such as galaxies and
the 21-cm signal respond to a large-scale environment. Reionization naturally
couples large and small scales as ionizing radiation produced by galactic
sources can travel up to tens of Megaparsecs through the intergalactic medium
during this process. Here we apply the position-dependent power spectrum
approach to fluctuations in the 21-cm background from reionization. We show
that this statistic has a distinctive evolution in time that can be understood
with a simple analytic model. We also show that the statistic can easily
distinguish between simple ""inside-out"" and ""outside-in"" models of
reionization. The position-dependent power spectrum is thus a promising method
to validate the reionization signal and to extract higher-order information on
this process.
","[{""version"":""v1"",""created"":""Fri, 23 Nov 2018 19:00:04 GMT""},{""version"":""v2"",""created"":""Wed, 27 Feb 2019 10:05:52 GMT""}]","2019-03-06"
"1811.09634","Rui Lin","Rui Lin, Luca Papariello, Paolo Molignini, R. Chitra, Axel U. J. Lode","Superfluid--Mott insulator transition of ultracold superradiant bosons
  in a cavity","17 pages, 9 figures","Phys. Rev. A 100, 013611 (2019)","10.1103/PhysRevA.100.013611",,"cond-mat.quant-gas","http://arxiv.org/licenses/nonexclusive-distrib/1.0/","  We investigate harmonically-trapped, laser-pumped bosons with infinite-range
interactions induced by a dissipative high-finesse red-detuned optical cavity
with numerical and analytical methods. We obtain multiple cavity and atomic
observables as well as the full phase diagram of the system using the
multiconfigurational time-dependent Hartree method for indistinguishable
particles (MCTDH-X) approach. Besides the transition from an unorganized normal
phase to a superradiant phase where atoms self-organize, we focus on an
in-depth investigation of the self-organized superfluid to self-organized Mott
insulator phase transition in the superradiant phase as a function of the
cavity-atom coupling. The numerical results are substantiated by an analytical
study of an effective Bose-Hubbard model. We numerically analyze cavity
fluctuations and emergent strong correlations between atoms in the many-body
state across the Mott transition via the atomic density distributions and
Glauber correlation functions. Unexpectedly, the weak harmonic trap leads to
features like a lattice switching between the two symmetry-broken
$\mathbb{Z}_2$ configurations of the untrapped system and a reentrance of
superfluidity in the Mott insulating phase. Our analytical considerations
quantitatively explain the numerically observed correlation features.
","[{""version"":""v1"",""created"":""Fri, 23 Nov 2018 19:00:04 GMT""}]","2019-07-12"
"1811.09635","Michael Tucker","M. A. Tucker and B. J. Shappee and J. P. Wisniewski","No Stripped Companion Material in the Nebular Spectrum of the
  ""Two-Component"" Type Ia Supernova ASASSN-18bt","7 pages, 4 figures, 1 table, accepted by ApJL",,"10.3847/2041-8213/ab0286",,"astro-ph.HE astro-ph.SR","http://arxiv.org/licenses/nonexclusive-distrib/1.0/","  We analyze a KeckI/LRIS nebular spectrum taken 268 days after $B$-band
maximum of ASASSN-18bt (SN~2018oh), a Type Ia supernova (SN Ia) observed by
{\it K2} at the time of explosion. ASASSN-18bt exhibited a two-component rise
to peak brightness, possibly the signature of an interaction between the SN
ejecta and a large ($\gtrsim 20~R_\odot$) nearby, non-degenerate companion. We
search for emission signatures of stripped material from a non-degenerate
companion in the nebular spectrum and find no evidence for any unbound
material. We place an upper limit of $< 0.006~M_\odot$ on the amount of
stripped/ablated H-rich material that could go undetected in our spectrum,
effectively ruling out all hydrogen-rich donor stars. Additionally, we place a
more tentative upper limit on HeI emission in the observed spectrum of
$\lesssim 0.02~M_\odot$ which also rules out helium star companions. Our deep
limits rule out a non-degenerate companion as the explanation for the
early-time feature in ASASSN-18bt.
","[{""version"":""v1"",""created"":""Fri, 23 Nov 2018 19:00:04 GMT""},{""version"":""v2"",""created"":""Sun, 10 Feb 2019 03:14:23 GMT""},{""version"":""v3"",""created"":""Tue, 12 Feb 2019 21:25:13 GMT""}]","2019-02-27"
"1811.09636","Matthias Schlaffer","J. Duarte-Campderros, G. Perez, M. Schlaffer, A. Soffer","Probing the strange Higgs coupling at lepton colliders using light-jet
  flavor tagging","6 pages, v2 accepted for publication in PRD","Phys. Rev. D 101, 115005 (2020)","10.1103/PhysRevD.101.115005",,"hep-ph hep-ex","http://arxiv.org/licenses/nonexclusive-distrib/1.0/","  We propose a method to probe the coupling of the Higgs to strange quarks by
tagging strange jets at future lepton colliders. For this purpose we describe a
jet-flavor observable, $J_F$, that is correlated with the flavor of the quark
associated with the hard part of the jet. Using this variable, we set up a
strangeness tagger aimed at studying the decay $h\to s\bar{s}$. We determine
the sensitivity of our method to the strange Yukawa coupling, and find it to be
of the order of the standard-model expectation.
","[{""version"":""v1"",""created"":""Fri, 23 Nov 2018 19:00:05 GMT""},{""version"":""v2"",""created"":""Thu, 28 May 2020 22:10:11 GMT""}]","2020-07-01"
"1811.09637","Fredrik Bj\""orkeroth","Fredrik Bj\""orkeroth, Luca Di Luzio, Federico Mescia, Enrico Nardi","$U(1)$ flavour symmetries as Peccei-Quinn symmetries","v2: version accepted for publication in JHEP; figure 1 updated; minor
  additions; 23 pages, 1 figure. v1: 20 pages, 1 figure",,"10.1007/JHEP02(2019)133",,"hep-ph","http://arxiv.org/licenses/nonexclusive-distrib/1.0/","  We investigate to what extent a generic, generation-dependent $U(1)$ symmetry
acting on the quark Yukawa operators can reduce the number of free parameters
by forcing some entries in the Yukawa matrices to vanish. The maximal reduction
compatible with CP violation yields nine real parameters and one phase, which
matches the number of physical observables, implying that such models have no
free parameters. We derive a set of results: (i) the only possible structures
have the form $M_4 \oplus M_5$, where the subscripts indicate the number of
real parameters in the Yukawa matrices, (ii) there are only two inequivalent
Yukawa structures, each one giving rise to six different models depending on
quark flavour assignments, (iii) the $U(1)$ symmetries that generate these
textures all have a QCD anomaly, and hence are Peccei-Quinn symmetries,
reinforcing the idea of a possible connection between the quark flavour puzzle
and the axion solution to the strong CP problem, (iv) in some cases the
contributions to the QCD anomaly of two generations cancels out, and this opens
the possibility that the axion coupling to nucleons could be strongly
suppressed. Flavour-violating axion couplings to quarks are completely fixed,
up to the axion decay constant, providing a non-trivial complementarity between
low-energy flavour-violating processes and standard axion searches.
","[{""version"":""v1"",""created"":""Fri, 23 Nov 2018 19:00:05 GMT""},{""version"":""v2"",""created"":""Tue, 19 Feb 2019 14:42:16 GMT""}]","2019-03-27"
"1811.09638","Nadav Drukker","Michael Cooke, Amit Dekel, Nadav Drukker, Diego Trancanelli and
  Edoardo Vescovi","Deformations of the circular Wilson loop and spectral (in)dependence","25 pages. v2: minor correction and added (with sincere appologies)
  missing acknowlegments","JHEP 1901 (2019) 076","10.1007/JHEP01(2019)076","Imperial-TP-EV-2018-01, NORDITA 2018-120","hep-th","http://arxiv.org/licenses/nonexclusive-distrib/1.0/","  In this paper we study the expectation value of deformations of the circular
Wilson loop in ${\cal N}=4$ super Yang-Mills theory. The leading order
deformation, known as the Bremsstrahlung function, can be obtained exactly from
supersymmetric localization, so our focus is on deformations at higher orders.
We find simple expressions for the expectation values for generic deformations
at the quartic order at one-loop at weak coupling and at leading order at
strong coupling. We also present a very simple algorithm (not requiring
integration) to evaluate the two-loop result. We find that an exact symmetry of
the strong coupling sigma-model, known as the spectral-parameter independence,
is an approximate symmetry at weak coupling, modifying the expectation value
starting only at the sextic order in the deformation. Furthermore, we find very
simple patterns for how the spectral parameter can appear in the weak coupling
calculation, suggesting all-order structures.
","[{""version"":""v1"",""created"":""Fri, 23 Nov 2018 19:00:06 GMT""},{""version"":""v2"",""created"":""Sat, 12 Jan 2019 09:31:27 GMT""}]","2019-01-15"
"1811.09639","Maggie Miller","Maggie Miller","Extending fibrations on knot complements to ribbon disk complements","61 pages, 52 figures, one flipbook. Version 2 agrees with published
  version; in particular many typos corrected and figures improved","Geom. Topol. 25 (2021) 1479-1550","10.2140/gt.2021.25.1479",,"math.GT","http://arxiv.org/licenses/nonexclusive-distrib/1.0/","  We show that if $K$ is a fibered ribbon knot in $S^3=\partial B^4$ bounding a
ribbon disk $D$, then given an extra transversality condition the fibration on
$S^3\setminus\nu(K)$ extends to a fibration of $B^4\setminus\nu(D)$. This
partially answers a question of Casson and Gordon. In particular, we show the
fibration always extends when $D$ has exactly two local minima. More generally,
we construct movies of singular fibrations on $4$-manifolds and describe a
sufficient property of a movie to imply the underlying $4$-manifold is fibered
over $S^1$.
","[{""version"":""v1"",""created"":""Fri, 23 Nov 2018 19:00:07 GMT""},{""version"":""v2"",""created"":""Fri, 23 Sep 2022 20:52:58 GMT""}]","2022-09-27"
"1811.09640","Tommi Tenkanen","Juan P. Beltr\'an Almeida, Nicol\'as Bernal, Javier Rubio, Tommi
  Tenkanen","Hidden Inflaton Dark Matter","36 pages, 11 figures. v2: Two appendices, discussion, and references
  added. Matches the version accepted for publication in JCAP",,"10.1088/1475-7516/2019/03/012","PI/UAN-2018-641FT, HIP-2018-29/TH","hep-ph astro-ph.CO","http://arxiv.org/licenses/nonexclusive-distrib/1.0/","  If cosmic inflation was driven by an electrically neutral scalar field stable
on cosmological time scales, the field necessarily constitutes all or part of
dark matter (DM). We study this possibility in a scenario where the inflaton
field $s$ resides in a hidden sector, which is coupled to the Standard Model
sector through the Higgs portal $\lambda_{hs}
s^2\mathcal{H}^\dagger\mathcal{H}$ and non-minimally to gravity via $\xi_s s^2
R$. We study scenarios where the field $s$ first drives inflation, then reheats
the Universe, and later constitutes all DM. We consider two benchmark scenarios
where the DM abundance is generated either by production during reheating or
via non-thermal freeze-in. In both cases, we take into account all production
channels relevant for DM in the mass range from keV to PeV scale. On the
inflationary side, we compare the dynamics and the relevant observables in two
different but well-motivated theories of gravity (metric and Palatini), discuss
multifield effects in case both fields ($s$ and $h$) were dynamical during
inflation, and take into account the non-perturbative nature of particle
production during reheating. We find that, depending on the initial conditions
for inflation, couplings and the DM mass, the scenario works well especially
for large DM masses, $10^2$ GeV$\lesssim m_{s}\lesssim 10^6$ GeV, although
there are also small observationally allowed windows at the keV and MeV scales.
We discuss how the model can be tested through astrophysical observations.
","[{""version"":""v1"",""created"":""Fri, 23 Nov 2018 19:00:13 GMT""},{""version"":""v2"",""created"":""Mon, 25 Feb 2019 09:15:59 GMT""}]","2019-03-13"
"1811.09641","Sa\v{s}o Grozdanov","Sa\v{s}o Grozdanov","On the connection between hydrodynamics and quantum chaos in holographic
  theories with stringy corrections","V2: 20 pages, 1 figure. References added. Version to appear in JHEP","JHEP 1901 (2019) 048","10.1007/JHEP01(2019)048","MIT-CTP/5085","hep-th cond-mat.str-el gr-qc nlin.CD","http://arxiv.org/licenses/nonexclusive-distrib/1.0/","  Pole-skipping is a recently discovered signature of many-body quantum chaos
in collective energy dynamics. It establishes a precise connection between
resummed, all-order hydrodynamics and the underlying microscopic chaos. In this
paper, we demonstrate the existence of pole-skipping in holographic conformal
field theories with higher-derivative gravity duals. In particular, we first
consider Einstein-Hilbert gravity deformed by curvature-squared ($R^2$)
corrections and then type IIB supergravity theory with the $\alpha'^3 R^4$
term, where $\alpha'$ is set by the length of the fundamental string. The
former case allows us to discuss the effects of leading-order $1/N_c$
corrections (with $N_c$ being the number of colours of the dual gauge group)
and phenomenological coupling constant dependence. In Einstein-Gauss-Bonnet
theory, pole-skipping turns out to be valid non-perturbatively in the
Gauss-Bonnet coupling. The $\alpha'^3 R^4$ deformation enables us to study
perturbative inverse 't Hooft coupling corrections ($\alpha'^3 \sim 1 /
\lambda^{3/2}$) in $SU(N_c)$, $\mathcal{N} = 4$ supersymmetric Yang-Mills
theory with infinite $N_c$. While the maximal Lyapunov exponent characterising
quantum chaos remains uncorrected, the butterfly velocity is shown to depend
both on $N_c$ and the coupling. Several implications of the relation between
hydrodynamics and chaos are discussed, including an intriguing similarity
between the dependence of the butterfly velocity and the ratio of shear
viscosity to entropy density on stringy corrections.
","[{""version"":""v1"",""created"":""Fri, 23 Nov 2018 19:00:28 GMT""},{""version"":""v2"",""created"":""Thu, 3 Jan 2019 14:25:57 GMT""}]","2019-01-07"
"1811.09642","Filippo Mannucci","R. Maiolino and F. Mannucci","De Re Metallica: The cosmic chemical evolution of galaxies","Invited review fo Astronomy & Astrophysics Review, 139 pages, 60
  figures",,"10.1007/s00159-018-0112-2",,"astro-ph.GA","http://arxiv.org/licenses/nonexclusive-distrib/1.0/","  The evolution of the content of heavy elements in galaxies, the relative
chemical abundances, their spatial distribution, and how these scale with
various galactic properties, provide unique information on the galactic
evolutionary processes across the cosmic epochs. In recent years major progress
has been made in constraining the chemical evolution of galaxies and inferring
key information relevant to our understanding of the main mechanisms involved
in galaxy evolution. In this review we provide an overview of these various
areas. After an overview of the methods used to constrain the chemical
enrichment in galaxies and their environment, we discuss the observed scaling
relations between metallicity and galaxy properties, the observed relative
chemical abundances, how the chemical elements are distributed within galaxies,
and how these properties evolve across the cosmic epochs. We discuss how the
various observational findings compare with the predictions from theoretical
models and numerical cosmological simulations. Finally, we briefly discuss the
open problems the prospects for progress in this field in the nearby future.
","[{""version"":""v1"",""created"":""Fri, 23 Nov 2018 19:00:34 GMT""}]","2019-02-13"
