"1811.09799","Shuang Zhou","Shuang Zhou, H.J. Mo, Cheng Li, Zheng Zheng, Niu Li, Cheng Du, Shude
  Mao, Taniya Parikh, Richard R. Lane, Daniel Thomas","SDSS-IV MaNGA: Stellar initial mass function variation inferred from
  Bayesian analysis of the integral field spectroscopy of early type galaxies","21 pages,20 figures, accepted for publication in MNRAS",,"10.1093/mnras/stz764",,"astro-ph.GA","http://arxiv.org/licenses/nonexclusive-distrib/1.0/","  We analyze the stellar initial mass functions (IMF) of a large sample of
early type galaxies (ETGs) provided by MaNGA. The large number of IFU spectra
of individual galaxies provide high signal-to-noise composite spectra that are
essential for constraining IMF and to investigate possible radial gradients of
the IMF within individual galaxies. The large sample of ETGs also make it
possible to study how the IMF shape depends on various properties of galaxies.
We adopt a novel approach to study IMF variations in ETGs, use Bayesian
inferences based on full spectrum fitting. The Bayesian method provides a
statistically rigorous way to explore potential degeneracy in spectrum fitting,
and to distinguish different IMF models with Bayesian evidence. We find that
the IMF slope depends systematically on galaxy velocity dispersion, in that
galaxies of higher velocity dispersion prefer a more bottom-heavy IMF, but the
dependence is almost entirely due to the change of metallicity, $Z$, with
velocity dispersion. The IMF shape also depends on stellar age, $A$, but the
dependence is completely degenerate with that on metallicity through a
combination $AZ^{-1.42}$. Using independent age and metallicity estimates we
find that the IMF variation is produced by metallicity instead of age. The IMF
near the centers of massive ETGs appears more bottom-heavy than that in the
outer parts, while a weak opposite trend is seen for low-mass ETGs.
Uncertainties produced by star formation history, dust extinction,
$\alpha$-element abundance enhancement and noise in the spectra are tested.
","[{""version"":""v1"",""created"":""Sat, 24 Nov 2018 09:39:41 GMT""},{""version"":""v2"",""created"":""Tue, 12 Mar 2019 14:46:28 GMT""}]","2019-03-20"
"1811.09800","Abhijit Guha Roy","Abhijit Guha Roy, Sailesh Conjeti, Nassir Navab, Christian Wachinger","Bayesian QuickNAT: Model Uncertainty in Deep Whole-Brain Segmentation
  for Structure-wise Quality Control","Under Review in NeuroImage",,,,"cs.CV","http://arxiv.org/licenses/nonexclusive-distrib/1.0/","  We introduce Bayesian QuickNAT for the automated quality control of
whole-brain segmentation on MRI T1 scans. Next to the Bayesian fully
convolutional neural network, we also present inherent measures of segmentation
uncertainty that allow for quality control per brain structure. For estimating
model uncertainty, we follow a Bayesian approach, wherein, Monte Carlo (MC)
samples from the posterior distribution are generated by keeping the dropout
layers active at test time. Entropy over the MC samples provides a voxel-wise
model uncertainty map, whereas expectation over the MC predictions provides the
final segmentation. Next to voxel-wise uncertainty, we introduce four metrics
to quantify structure-wise uncertainty in segmentation for quality control. We
report experiments on four out-of-sample datasets comprising of diverse age
range, pathology and imaging artifacts. The proposed structure-wise uncertainty
metrics are highly correlated with the Dice score estimated with manual
annotation and therefore present an inherent measure of segmentation quality.
In particular, the intersection over union over all the MC samples is a
suitable proxy for the Dice score. In addition to quality control at
scan-level, we propose to incorporate the structure-wise uncertainty as a
measure of confidence to do reliable group analysis on large data repositories.
We envisage that the introduced uncertainty metrics would help assess the
fidelity of automated deep learning based segmentation methods for large-scale
population studies, as they enable automated quality control and group analyses
in processing large data repositories.
","[{""version"":""v1"",""created"":""Sat, 24 Nov 2018 09:41:28 GMT""}]","2018-11-27"
"1811.09801","Chuan Zhang","Weihong Xu (1 and 2), Xiaohu You (2), Chuan Zhang (1 and 2), and Yair
  Be'ery (3) ((1) Lab of Efficient Architectures for Digital-communication and
  Signal-processing (LEADS), (2) National Mobile Communications Research
  Laboratory, (3) School of Electrical Engineering, Tel-Aviv University,
  Tel-Aviv, Israel)","Polar Decoding on Sparse Graphs with Deep Learning","submitted to Asilomar 2018",,,,"eess.SP cs.IT cs.LG math.IT","http://arxiv.org/licenses/nonexclusive-distrib/1.0/","  In this paper, we present a sparse neural network decoder (SNND) of polar
codes based on belief propagation (BP) and deep learning. At first, the
conventional factor graph of polar BP decoding is converted to the bipartite
Tanner graph similar to low-density parity-check (LDPC) codes. Then the Tanner
graph is unfolded and translated into the graphical representation of deep
neural network (DNN). The complex sum-product algorithm (SPA) is modified to
min-sum (MS) approximation with low complexity. We dramatically reduce the
number of weight by using single weight to parameterize the networks. Optimized
by the training techniques of deep learning, proposed SNND achieves comparative
decoding performance of SPA and obtains about $0.5$ dB gain over MS decoding on
($128,64$) and ($256,128$) codes. Moreover, $60 \%$ complexity reduction is
achieved and the decoding latency is significantly lower than the conventional
polar BP.
","[{""version"":""v1"",""created"":""Sat, 24 Nov 2018 09:50:23 GMT""}]","2018-11-27"
"1811.09802","Denis Sidorov","Samad Noeiaghdam, Denis Sidorov and Valery Sizikov","Control of accuracy on Taylor-collocation method to solve the weakly
  regular Volterra integral equations of the first kind by using the CESTAC
  method","24 pages",,,,"math.NA math.DS","http://arxiv.org/licenses/nonexclusive-distrib/1.0/","  Finding the optimal parameters and functions of iterative methods is among
the main problems of the Numerical Analysis. For this aim, a technique of the
stochastic arithmetic (SA) is used to control of accuracy on Taylor-collocation
method for solving first kind weakly regular integral equations (IEs). Thus,
the CESTAC (Controle et Estimation Stochastique des Arrondis de Calculs) method
is applied and instead of usual mathematical softwares the CADNA (Control of
Accuracy and Debugging for Numerical Applications) library is used. Also, the
convergence theorem of presented method is illustrated. In order to apply the
CESTAC method we will prove a theorem that it will be our licence to use the
new termination criterion instead of traditional absolute error. By using this
theorem we can show that number of common significant digits (NCSDs) between
two successive approximations are almost equal to NCSDs between exact and
numerical solution. Finally, some examples are solved by using the
Taylor-collocation method based on the CESTAC method. Several tables of
numerical solutions based on the both arithmetics are presented. Comparison
between number of iterations are demonstrated by using the floating point
arithmetic (FPA) for different values of $\varepsilon$.
","[{""version"":""v1"",""created"":""Sat, 24 Nov 2018 09:56:19 GMT""}]","2018-11-27"
"1811.09803","Rupak Mukherjee","Rupak Mukherjee, Rajaraman Ganesh","Numerical relaxation of a 3D MHD Taylor - Woltjer state subject to
  abrupt expansion","Preprint of 27th IAEA Fusion Energy Conference (FEC 2018), Page 476,
  Poster","Conference Proceedings of 27th IAEA Fusion Energy Conference (FEC
  2018), Page 476",,"IAEA--CN--258--663","physics.plasm-ph physics.comp-ph physics.flu-dyn","http://arxiv.org/licenses/nonexclusive-distrib/1.0/","  Since the advent of Taylor-Woltjer theory [J B Taylor, PRL, 33, 1139 (1974),
L Woltjer, PNAS, 44, 489 (1958)], it has been widely believed that situations
with perfectly conducting boundaries and near ideal conditions, the final state
of MHD system would be force-free Taylor-Woltjer states defined as
$\vec{\nabla} \times \vec{B} = \alpha \vec{B}$ with $\alpha$ as a constant and
$\vec{B}$ is the magnetic field defined over a volume $V$. These states are of
fundamental importance in fusion plasmas [J B Taylor, RMP 58, 741 (1986)]. More
recently, several new MHD models have been proposed - for example Reduced
Multi-region relaxed MHD [S R Hudson {\it et al}, Phys. Plasmas, 19, 112502
(2012)] and arbitrary scale relaxation model to Taylor-Woltjer state [H Qin
{\it et al}, PRL, 109, 235001 (2012)] to mention a few.
  In the present work, we use a 3D compressible MHD solver in cartesian
geometry which can handle conducting or periodic as well has mixed boundary
conditions to investigate numerically the arbitrary scale relaxation model
proposed by Qin et al [H Qin {\it et al}, PRL, 109, 235001 (2012)]. For this
purpose, we consider two volumes $V_{init}$ and $V_{final}$. We load the 3D MHD
solver in the limit of zero compressibility with a Taylor-Woltjer state
$B_{init}(x,y,z,t=0)$ and let it again a numerical evolve with conducting
boundaries at $V_{init}$ to make sure that we have obtained a numerically
steady Taylor - Woltjer state for volume $V_{init}$. Followed by this
procedure, we ""suddenly"" relax the boundaries to a new volume $V_{final}$, such
that $V_{init}$ $<$ $V_{final}$ and evaluate whether or not the system attains
quasi-steady state. Details of the numerical method used, the protocol
followed, the expansion technique and the novelty of this numerical experiment
and details of our results have been presented in this paper.
","[{""version"":""v1"",""created"":""Sat, 24 Nov 2018 09:56:21 GMT""}]","2019-06-07"
"1811.09804","Jose Maria Grau","J. M. Grau Ribas","A note on last-success-problems",,,,,"math.PR","http://arxiv.org/licenses/nonexclusive-distrib/1.0/","  We consider the Last-Success-Problem with $n$ independent Bernoulli random
variables with parameters $p_i>0$. We improve the lower bound provided by F.T.
Bruss for the probability of winning and provide an alternative proof to the
one given for the lower bound ($1/e$) when $R:=\sum_{i=1}^n
(p_i/(1-p_i))\geq1$. We also consider a modification of the game which consists
in not considering it a failure when all the random variables take the value of
0 and the game is repeated as many times as necessary until a $""1""$ appears. We
prove that the probability of winning in this game is lower-bounded by
$e^{-1}(1-e^{-R})^{-1}$. Finally, we consider the variant in which the player
can choose between participating in the game in its standard version or predict
that all the random variables will take the value 0.
","[{""version"":""v1"",""created"":""Sat, 24 Nov 2018 10:13:19 GMT""},{""version"":""v2"",""created"":""Thu, 13 Dec 2018 05:35:14 GMT""},{""version"":""v3"",""created"":""Thu, 17 Dec 2020 19:05:27 GMT""}]","2020-12-21"
"1811.09805","Andreas Leopold Knutsen","Andreas Leopold Knutsen","Global sections of twisted normal bundles of K3 surfaces and their
  hyperplane sections","23 pages. Correction of a few misprints. Final version, to appear in
  Atti Accad. Naz. Lincei Rend. Lincei Mat. Appl",,,,"math.AG","http://arxiv.org/licenses/nonexclusive-distrib/1.0/","  Let $S \subset \mathbb{P}^g$ be a smooth $K3$ surface of degree $2g-2$, $g
\geq 3$. We classify all the cases for which
$h^0(\mathcal{N}_{S/\mathbb{P}^g}(-2)) \neq 0$ and the cases for which
$h^0(\mathcal{N}_{S/\mathbb{P}^g}(-2)) <
h^0(\mathcal{N}_{C/\mathbb{P}^{g-1}}(-2))$ for $C \subset \mathbb{P}^{g-1}$ a
general canonical curve section of $S$.
","[{""version"":""v1"",""created"":""Sat, 24 Nov 2018 10:19:46 GMT""},{""version"":""v2"",""created"":""Sun, 14 Apr 2019 17:27:05 GMT""}]","2019-04-16"
"1811.09806","Jeet Desai","Jeet Desai and Amol Marathe","Combined homotopy and Galerkin stability analysis of Mathieu-like
  equations","18 pages, 6 figures",,,,"math.DS","http://arxiv.org/licenses/nonexclusive-distrib/1.0/","  We propose homotopy analysis method in combination with Galerkin projections
to obtain transition curves of Mathieu-like equations. While constructing
homotopy, we think of convergence-control parameter as a function of embedding
parameter and call it a convergence-control function. Homotopy analysis
provides a relation between the parameters of Mathieu equation that also
includes free parameters arising from convergence-control function. We generate
extra nonlinear algebraic equations using Galerkin projections and solve
numerically for arriving at transition curves. We demonstrate the usefulness of
our method in case of three distinct versions of linear Mathieu equation by
carefully choosing nonlinear and auxiliary operators. Since homotopy analysis
does not demand smallness of any of the parameters, our approach has distinct
advantage over perturbation methods in determining transition curves covering a
large region of the parameter space. The method is applicable to a wide variety
of parametrically excited oscillators.
","[{""version"":""v1"",""created"":""Sat, 24 Nov 2018 10:39:49 GMT""}]","2018-11-27"
"1811.09807","Vahid Reza Shajiee","Vahid Reza Shajiee and Ali Tofighi","Electroweak Phase Transition, Gravitational Waves and Dark Matter in Two
  Scalar Singlet Extension of The Standard Model","18 pages, 2 figures (4 subfigures), 4 tables, final version to match
  the published version","Eur. Phys. J. C (2019) 79: 360","10.1140/epjc/s10052-019-6881-6",,"hep-ph astro-ph.CO","http://arxiv.org/licenses/nonexclusive-distrib/1.0/","  In this paper, the electroweak phase transition, the gravitational waves and
the dark matter issues are investigated in two scalar singlet extension of the
standard model. The detectability of the gravitational wave signals are
discussed by comparing the results with the sensitivity curves of
$\mathbf{eLISA}$, $\mathbf{ALIA}$, $\mathbf{DECIGO}$ and $\mathbf{BBO}$
detectors. It is shown that the results support the recent reports on the dark
matter relic density by $\mathbf{Planck}$ $\mathbf{2018}$ collaboration and the
direct detection experiment by $\mathbf{XENON1T}$ $\mathbf{2018}$
collaboration.
","[{""version"":""v1"",""created"":""Sat, 24 Nov 2018 10:40:14 GMT""},{""version"":""v2"",""created"":""Sun, 27 Jan 2019 19:48:13 GMT""},{""version"":""v3"",""created"":""Thu, 25 Apr 2019 06:38:05 GMT""}]","2019-04-26"
"1811.09808","Donatella Donatelli","Donatella Donatelli","Scale analysis for an atmosphere flow",,,,,"math.AP","http://arxiv.org/licenses/nonexclusive-distrib/1.0/","  In this paper we consider a fluid dynamic model which describes the
atmospheric flow and we perform an asymptotic analysis for different time and
length scales. In particular we will focus on the two following cases: when the
Mach number dominates on the Rossby number yielding an incompressible regime or
when the high rotating (low Rossby number) and incompressibility regime act on
the same scale ending up with a geostrophic balance. The limit analysis is
performed in the ill prepared data setting and therefore we will develop a
rigorous and detailed analysis of the local decay and dispersive behavior of
the related acoustic waves. Finally we point out, that the set of equations
analyzed in the paper may also fit in the artificial compressibility
approximation methods.
","[{""version"":""v1"",""created"":""Sat, 24 Nov 2018 10:51:35 GMT""}]","2018-11-27"
"1811.09809","Arash Pourkia","Arash Pourkia","A basic $n$ dimensional representation of Artin braid group $B_n$, and a
  general Burau representation","8 pages","Mathematics and Statistics, 10(1), 145-152 (2022)","10.13189/ms.2022.100112",,"math.GT math.GN","http://arxiv.org/licenses/nonexclusive-distrib/1.0/","  Burau representation of the Artin braid group remains as one of the very
important representations for the braid group. Partly, because of its
connections to the Alexander polynomial which is one of the first and most
useful invariants for knots and links. In the present work, we show that
interesting representations of braid group could be achieved using a simple and
intuitive approach, where we simply analyse the path of strands in a braid and
encode the over-crossings, under-crossings or no-crossings into some
parameters. More precisely, at each crossing, where, for example, the strand
$i$ crosses over the strand $i+1$ we assign $\mathbf{t}$ to the {\bf t}op
strand and $\mathbf{b}$ to the {\bf b}ottom strand. We consider the parameter
$\mathbf{t}$ as a {\it relative weight} given to strand $i$ relative to $i+1$,
hence the position $i\ i+1$ for $\mathbf{t}$ in the matrix representation.
Similarly, the parameter $\mathbf{b}$ is a {\it relative weight} given to
strand $i+1$ relative to $i$, hence the position $i+1\ i$ for $\mathbf{b}$ in
the matrix representation. We show this simple {\it path analyzing approach}
leads us to an interesting simple representation. Next, we show that following
the same intuitive approach, only by introducing an additional parameter, we
can greatly improve the representation into the one with much smaller kernel.
This more general representation includes the unreduced Burau representation,
as a special case. Our new {\it path analyzing approach} has the advantage that
it applies a very simple and intuitive method capturing the fundamental
interactions of the strands in a braid. In this approach we intuitively follow
each strand in a braid and create a {\it history} for the strand as it
interacts with other strands via over-crossings, under-crossings or
no-crossings. This, directly, leads us to the desired representations.
","[{""version"":""v1"",""created"":""Sat, 24 Nov 2018 10:53:07 GMT""},{""version"":""v2"",""created"":""Tue, 18 Dec 2018 18:13:13 GMT""},{""version"":""v3"",""created"":""Sat, 8 Jun 2019 07:40:29 GMT""},{""version"":""v4"",""created"":""Mon, 17 Jan 2022 04:40:10 GMT""},{""version"":""v5"",""created"":""Thu, 27 Jan 2022 04:17:50 GMT""}]","2022-01-28"
"1811.09810","Mike Lockwood Prof.","Mike Lockwood, Aude Chambodut, Luke A. Barnard, Mathew J. Owens, Ellen
  Clarke and V\'eronique Mendel","A homogeneous aa index: 1. Secular variation",,"J. Space Weather & Space Climate, 8, A53, 2018","10.1051/swsc/2018038",,"astro-ph.SR physics.space-ph","http://arxiv.org/licenses/nonexclusive-distrib/1.0/","  Originally complied for 1868-1967 and subsequently continued so that it now
covers 150 years, the $aa$ index has become a vital resource for studying space
climate change. However, there have been debates about the inter-calibration of
data from the different stations. In addition, the effects of secular change in
the geomagnetic field have not previously been allowed for. As a result, the
components of the 'classical' $aa$ index for the southern and northern
hemispheres ($aa_S$ and $aa_N$) have drifted apart. We here separately correct
both $aa_S$ and $aa_N$ for both these effects using the same method as used to
generate the classic $aa$ values but allowing ${\delta}$, the minimum angular
separation of each station from a nominal auroral oval, to vary as calculated
using the IGRF-12 and gufm1 models of the intrinsic geomagnetic field. Our
approach is to correct the quantized aK-values for each station, originally
scaled on the assumption that ${\delta}$ values are constant, with
time-dependent scale factors that allow for the drift in ${\delta}$. This
requires revisiting the intercalibration of successive stations used in making
the $aa_S$ and $aa_N$ composites. These intercalibrations are defined using
independent data and daily averages from 11 years before and after each station
change and it is shown that they depend on the time of year. This procedure
produces new homogenized hemispheric aa indices, $aa_{HS}$ and $aa_{HN}$, which
show centennial-scale changes that are in very close agreement. Calibration
problems with the classic $aa$ index are shown to have arisen from drifts in
${\delta}$ combined with simpler corrections which gave an incorrect temporal
variation and underestimate the rise in $aa$ during the 20th century by about
15%.
","[{""version"":""v1"",""created"":""Sat, 24 Nov 2018 10:55:25 GMT""},{""version"":""v2"",""created"":""Mon, 17 Dec 2018 10:02:57 GMT""}]","2018-12-18"
"1811.09811","Roman Vetter","Roman Vetter and J\""urgen O. Schumacher","Free open reference implementation of a two-phase PEM fuel cell model","13 pages, 7 figures, 7 tables","Computer Physics Communications 234, 223-234 (2019)","10.1016/j.cpc.2018.07.023",,"physics.comp-ph","http://arxiv.org/licenses/nonexclusive-distrib/1.0/","  In almost 30 years of PEM fuel cell modeling, countless numerical models have
been developed in science and industrial applications, almost none of which
have been fully disclosed to the public. There is a large need for
standardization and establishing a common ground not only in experimental
characterization of fuel cells, but also in the development of simulation
codes, to prevent each research group from having to start anew from scratch.
Here, we publish the first open standalone implementation of a full-blown,
steady-state, non-isothermal two-phase model for low-temperature PEM fuel
cells. It is based on macro-homogeneous modeling approaches and implements the
most essential through-plane transport processes in a five-layer MEA. The focus
is on code simplicity and compactness with only a few hundred lines of clearly
readable code, providing a starting point for more complex model development.
The model is implemented as a standalone MATLAB function, based on MATLAB's
standard boundary value problem solver. The default simulation setup reflects
wide-spread commercially available MEA materials. Operating conditions
recommended for automotive applications by the European Commission are used to
establish new fuel cell simulation base data, making our program a valuable
candidate for model comparison, validation and benchmarking.
","[{""version"":""v1"",""created"":""Sat, 24 Nov 2018 10:55:44 GMT""}]","2018-11-27"
"1811.09812","Konstantinos Vetas","Nikos I. Karachalios, Paris Kyriazopoulos and Konstantinos Vetas","Excitation of Peregrine-type waveforms from vanishing initial conditions
  in the presence of periodic forcing",,,"10.1515/zna-2018-0540",,"nlin.PS","http://arxiv.org/licenses/nonexclusive-distrib/1.0/","  We show by direct numerical simulations that spatiotemporally localized wave
forms, strongly reminiscent of the Peregrine rogue wave, can be excited by
vanishing initial conditions for the periodically driven nonlinear
Schr\""odinger equation. The emergence of the Peregrine-type waveforms can be
potentially justified, in terms of the existence and modulational instability
of spatially homogeneous solutions of the model, and the continuous dependence
of the localized initial data for small time intervals. We also comment on the
persistence of the above dynamics, under the presence of small damping effects,
and justify, that this behavior should be considered as far from approximations
of the corresponding integrable limit.
","[{""version"":""v1"",""created"":""Sat, 24 Nov 2018 10:56:47 GMT""},{""version"":""v2"",""created"":""Thu, 6 Dec 2018 07:22:05 GMT""},{""version"":""v3"",""created"":""Fri, 8 Feb 2019 12:35:01 GMT""}]","2019-05-22"
"1811.09813","Aditya Grover","Aditya Grover, Tudor Achim, Stefano Ermon","Streamlining Variational Inference for Constraint Satisfaction Problems","NeurIPS 2018",,"10.1088/1742-5468/ab371f",,"cs.AI cs.LG cs.LO stat.ML","http://arxiv.org/licenses/nonexclusive-distrib/1.0/","  Several algorithms for solving constraint satisfaction problems are based on
survey propagation, a variational inference scheme used to obtain approximate
marginal probability estimates for variable assignments. These marginals
correspond to how frequently each variable is set to true among satisfying
assignments, and are used to inform branching decisions during search; however,
marginal estimates obtained via survey propagation are approximate and can be
self-contradictory. We introduce a more general branching strategy based on
streamlining constraints, which sidestep hard assignments to variables. We show
that streamlined solvers consistently outperform decimation-based solvers on
random k-SAT instances for several problem sizes, shrinking the gap between
empirical performance and theoretical limits of satisfiability by 16.3% on
average for k=3,4,5,6.
","[{""version"":""v1"",""created"":""Sat, 24 Nov 2018 11:08:14 GMT""}]","2020-01-29"
"1811.09814","Jeet Desai","Jeet Desai and Amol Marathe","Natural response of non-smooth oscillators using homotopy analysis
  combined with Galerkin projections","20 pages, 13 figures",,,,"math.DS math.NA","http://arxiv.org/licenses/nonexclusive-distrib/1.0/","  We propose homotopy analysis method in combination with Galerkin projections
to approximate the natural response of non-smooth oscillators with
discontinuities of type Heaviside, signum, modulus etc. While constructing the
homotopy, we think of convergence-control parameter as a function of the
embedding parameter and call it a convergence-control function. Homotopy
analysis provides an expression for the natural frequency of the oscillator
that also includes free parameters arising from the convergence-control
function. Generating extra equations using Galerkin projections and solving the
same numerically gives the approximate natural response of the non-smooth
oscillators. We also seek aperiodic natural response of a unilaterally
constrained simple pendulum. The superiority of the approach is
well-established over the method of harmonic balance, Lindstedt-Poincar\'e
method and conventional homotopy analysis method.
","[{""version"":""v1"",""created"":""Sat, 24 Nov 2018 11:15:33 GMT""}]","2018-11-27"
