"1811.09529","Agnieszka Lawrynowicz","Dawid Wisniewski, Jedrzej Potoniec, Agnieszka Lawrynowicz, C. Maria
  Keet","Competency Questions and SPARQL-OWL Queries Dataset and Analysis","22 pages",,,,"cs.AI cs.CL cs.DB","http://arxiv.org/licenses/nonexclusive-distrib/1.0/","  Competency Questions (CQs) are natural language questions outlining and
constraining the scope of knowledge represented by an ontology. Despite that
CQs are a part of several ontology engineering methodologies, we have observed
that the actual publication of CQs for the available ontologies is very limited
and even scarcer is the publication of their respective formalisations in terms
of, e.g., SPARQL queries. This paper aims to contribute to addressing the
engineering shortcomings of using CQs in ontology development, to facilitate
wider use of CQs. In order to understand the relation between CQs and the
queries over the ontology to test the CQs on an ontology, we gather, analyse,
and publicly release a set of 234 CQs and their translations to SPARQL-OWL for
several ontologies in different domains developed by different groups. We
analysed the CQs in two principal ways. The first stage focused on a linguistic
analysis of the natural language text itself, i.e., a lexico-syntactic analysis
without any presuppositions of ontology elements, and a subsequent step of
semantic analysis in order to find patterns. This increased diversity of CQ
sources resulted in a 5-fold increase of hitherto published patterns, to 106
distinct CQ patterns, which have a limited subset of few patterns shared across
the CQ sets from the different ontologies. Next, we analysed the relation
between the found CQ patterns and the 46 SPARQL-OWL query signatures, which
revealed that one CQ pattern may be realised by more than one SPARQL-OWL query
signature, and vice versa. We hope that our work will contribute to
establishing common practices, templates, automation, and user tools that will
support CQ formulation, formalisation, execution, and general management.
","[{""version"":""v1"",""created"":""Fri, 23 Nov 2018 16:00:51 GMT""}]","2018-11-26"
"1811.09530","Andreas Steenpass","Gerhard Pfister, Andreas Steenpass","On the Primary Decomposition of Some Determinantal Hyperedge Ideal","9 pages, 1 algorithm",,,,"math.AC","http://arxiv.org/licenses/nonexclusive-distrib/1.0/","  In this paper we describe the method which we applied to successfully compute
the primary decomposition of a certain ideal coming from applications in
combinatorial algebra and algebraic statistics regarding conditional
independence statements with hidden variables. While our method is based on the
algorithm for primary decomposition by Gianni, Trager and Zacharias, we were
not able to decompose the ideal using the standard form of that algorithm, nor
by any other method known to us.
","[{""version"":""v1"",""created"":""Fri, 23 Nov 2018 16:01:17 GMT""},{""version"":""v2"",""created"":""Wed, 17 Jul 2019 11:51:09 GMT""}]","2019-07-18"
"1811.09531","Ralf Metzler","V. Sposini, A. V. Chechkin, F. Seno, G. Pagnini, and R. Metzler","Random diffusivity from stochastic equations: comparison of two models
  for Brownian yet non-Gaussian diffusion","33 pages, 13 figures, IOP LaTeX","New J. Phys. 20, 043044 (2018)","10.1088/1367-2630/aab696",,"cond-mat.stat-mech","http://arxiv.org/licenses/nonexclusive-distrib/1.0/","  A considerable number of systems have recently been reported in which
Brownian yet non-Gaussian dynamics was observed. These are processes
characterised by a linear growth in time of the mean squared displacement, yet
the probability density function of the particle displacement is distinctly
non-Gaussian, and often of exponential (Laplace) shape. This apparently
ubiquitous behaviour observed in very different physical systems has been
interpreted as resulting from diffusion in inhomogeneous environments and
mathematically represented through a variable, stochastic diffusion
coefficient. Indeed different models describing a fluctuating diffusivity have
been studied. Here we present a new view of the stochastic basis describing
time dependent random diffusivities within a broad spectrum of distributions.
Concretely, our study is based on the very generic class of the generalised
Gamma distribution. Two models for the particle spreading in such random
diffusivity settings are studied. The first belongs to the class of generalised
grey Brownian motion while the second follows from the idea of diffusing
diffusivities. The two processes exhibit significant characteristics which
reproduce experimental results from different biological and physical systems.
We promote these two physical models for the description of stochastic particle
motion in complex environments.
","[{""version"":""v1"",""created"":""Fri, 23 Nov 2018 16:02:23 GMT""}]","2018-11-26"
"1811.09532","John Bourke","John Bourke","Iterated algebraic injectivity and the faithfulness conjecture","30 pages. Expanded abstract and some reorganisation. To appear in
  Higher Structures","Higher Structures 4(2),183-210, 2020",,,"math.CT","http://arxiv.org/licenses/nonexclusive-distrib/1.0/","  Algebraic injectivity was introduced to capture homotopical structures like
algebraic Kan complexes. But at a much simpler level, it allows one to describe
sets with operations subject to no equations. If one wishes to add equations
(or operations of greater complexity) then it is natural to consider iterated
algebraic injectives, which we introduce and study in the present paper. Our
main application concerns Grothendieck's weak $\omega$-groupoids, introduced in
Pursuing Stacks, and the closely related definition of weak $\omega$-category
due to Maltsiniotis. Using $\omega$ iterations we describe these as iterated
algebraic injectives and, via this correspondence, prove the faithfulness
conjecture of Maltsiniotis. Through work of Ara, this implies a tight
correspondence between the weak $\omega$-categories of Maltsiniotis and those
of Batanin/Leinster.
","[{""version"":""v1"",""created"":""Fri, 23 Nov 2018 16:03:14 GMT""},{""version"":""v2"",""created"":""Fri, 8 Feb 2019 13:23:47 GMT""},{""version"":""v3"",""created"":""Mon, 29 Jun 2020 12:09:39 GMT""}]","2022-01-31"
"1811.09533","Claire Bourquard","Claire Bourquard and Nicolas Noiray","Stabilization of acoustic modes using Helmholtz and Quarter-Wave
  resonators tuned at exceptional points","34 pages, 19 figures, acepted in the Journal of Sound and Vibration",,"10.1016/j.jsv.2018.12.011",,"physics.app-ph","http://arxiv.org/licenses/nonexclusive-distrib/1.0/","  Acoustic dampers are efficient and cost-effective means for suppressing
thermoacoustic instabilities in combustion chambers. However, their design and
the choice of their purging air mass flow is a challenging task, when one aims
at ensuring thermoacoustic stability after their implementation. In the present
experimental and theoretical study, Helmholtz (HH) and Quarter-Wave (QW)
dampers are considered. A model for their acoustic impedance is derived and
experimentally validated. In a second part, a thermoacoustic instability is
mimicked by an electro-acoustic feedback loop in a rectangular cavity, to which
the dampers are added. The length of the dampers can be adjusted, so that the
system can be studied for tuned and detuned conditions. The stability of the
coupled system is investigated experimentally and then analytically, which
shows that for tuned dampers, the best stabilization is achieved at the
exceptional point. The stabilization capabilities of HH and QW dampers are
compared for given damper volume and purge mass flow.
","[{""version"":""v1"",""created"":""Fri, 23 Nov 2018 16:10:20 GMT""},{""version"":""v2"",""created"":""Tue, 18 Dec 2018 11:36:14 GMT""}]","2019-02-20"
"1811.09534","Pedro Moreira","Pedro Augusto Franco Pinheiro Moreira, Roberto Gomes de Aguiar Veiga
  and Maurice de Koning","Elastic constants of Ice I$_h$ as described by semi-empirical water
  models",,,,,"cond-mat.mtrl-sci cond-mat.soft physics.comp-ph","http://arxiv.org/licenses/nonexclusive-distrib/1.0/","  Using molecular dynamics simulations we compute the elastic constants of ice
I$_h$ for a set of 8 frequently used semi-empirical potentials for water,
namely the rigid-molecule SPC/E, TIP4P, TIP4P2005, TIP4P/Ice and TIP5P models,
the flexible-molecule qTIP4P/Fw and SPC/Fw models and the coarse-grained atomic
mW potential. In quantitative terms, the mW description gives values for the
individual stiffness constants that are closest to experiment, whereas the
explicit-proton models display substantial discrepancies. On the other hand, in
contrast to all explicit-proton potentials, the mW model is unable to reproduce
central qualitative trends such as the anisotropy in Young's modulus and the
shear modulus. This suggests that the elastic behavior of ice I$_h$ is closely
related to its molecular nature, which has been coarse-grained out in the mW
model. These observations are consistent with other recent manifestations
concerning the limitations of the mW model in the description of mechanical
properties of ice I$_h$.
","[{""version"":""v1"",""created"":""Fri, 23 Nov 2018 16:12:25 GMT""}]","2018-11-26"
"1811.09535","Francisco Navarro-Lerida","Francisco Navarro-Lerida, Eugen Radu, and D. H. Tchrakian","On the topological charge of $SO(2)$ gauged Skyrmions in $2+1$ and $3+1$
  dimensions","12 pages, 7 figures; new references added",,"10.1016/j.physletb.2019.02.011","DIAS-STP-18-13","hep-th gr-qc","http://arxiv.org/licenses/nonexclusive-distrib/1.0/","  The question of the dependence of the topological charge $q$ of a gauged
Skyrmion, on the gauge field, is studied quantitatively. Two examples, both
gauged with $SO(2)$ are studied and contrasted: i) The $O(3)$ model in $2+1$
dimensions, and ii) The $O(4)$ model in $3+1$ dimensions. In case i), where the
(usual) Chern-Simons (CS) term is present, the value of $q$ changes sign, going
through zero. This evolution is tracked by a parameter characterising the
solutions in the given theory. In case ii), in which dimensions no CS density
is available, the evolution of $q$ is not observed.
","[{""version"":""v1"",""created"":""Fri, 23 Nov 2018 16:13:58 GMT""},{""version"":""v2"",""created"":""Fri, 30 Nov 2018 11:18:19 GMT""}]","2019-02-20"
"1811.09537","Dipayan Chakraborty","Dipayan Chakraborty and Florent Foucaud and Aline Parreau and Annegret
  K. Wagler","On three domination-based identification problems in block graphs",,,,,"math.CO cs.DM","http://arxiv.org/licenses/nonexclusive-distrib/1.0/","  The problems of determining the minimum-sized \emph{identifying},
\emph{locating-dominating} and \emph{open locating-dominating codes} of an
input graph are special search problems that are challenging from both
theoretical and computational viewpoints. In these problems, one selects a
dominating set $C$ of a graph $G$ such that the vertices of a chosen subset of
$V(G)$ (i.e. either $V(G)\setminus C$ or $V(G)$ itself) are uniquely determined
by their neighborhoods in $C$. A typical line of attack for these problems is
to determine tight bounds for the minimum codes in various graphs classes. In
this work, we present tight lower and upper bounds for all three types of codes
for \emph{block graphs} (i.e. diamond-free chordal graphs). Our bounds are in
terms of the number of maximal cliques (or \emph{blocks}) of a block graph and
the order of the graph. Two of our upper bounds verify conjectures from the
literature - with one of them being now proven for block graphs in this
article. As for the lower bounds, we prove them to be linear in terms of both
the number of blocks and the order of the block graph. We provide examples of
families of block graphs whose minimum codes attain these bounds, thus showing
each bound to be tight.
","[{""version"":""v1"",""created"":""Fri, 23 Nov 2018 16:19:52 GMT""},{""version"":""v2"",""created"":""Fri, 7 Oct 2022 08:23:27 GMT""},{""version"":""v3"",""created"":""Mon, 27 Feb 2023 16:00:27 GMT""}]","2023-02-28"
"1811.09538","Viciano Lee","Steve Alpern and Viciano Lee","A Game Model of Search and Pursuit","17 pages, 0 figures, presented at the 18th International Symposium on
  Dynamic Games and Application July 9-12, 2018",,,,"cs.GT","http://creativecommons.org/licenses/by-nc-sa/4.0/","  Shmuel Gal and Jerome Casas have recently introduced a game theoretic model
that combines search and pursuit by a predator for a prey animal. The prey
(hider) can hide in a finite number of locations. The predator (searcher) can
inspect any k of these locations. If the prey is not in any of these, the prey
wins. If the prey is found at an inspected location, a pursuit begins which is
successful for the predator with a known capture probability which depends on
the location. We modify the problem so that each location takes a certain time
to inspect and the predator has total inspection time k. We also consider a
repeated game model where the capture probabilities only become known to the
players over time, as each successful escape from a location lowers its
perceived value capture probability.
","[{""version"":""v1"",""created"":""Fri, 23 Nov 2018 16:22:21 GMT""},{""version"":""v2"",""created"":""Mon, 9 Dec 2019 16:52:28 GMT""}]","2019-12-10"
"1811.09540","Sokbae Lee","Le-Yu Chen and Sokbae Lee","High Dimensional Classification through $\ell_0$-Penalized Empirical
  Risk Minimization",,,,,"stat.ME econ.EM stat.ML","http://arxiv.org/licenses/nonexclusive-distrib/1.0/","  We consider a high dimensional binary classification problem and construct a
classification procedure by minimizing the empirical misclassification risk
with a penalty on the number of selected features. We derive non-asymptotic
probability bounds on the estimated sparsity as well as on the excess
misclassification risk. In particular, we show that our method yields a sparse
solution whose l0-norm can be arbitrarily close to true sparsity with high
probability and obtain the rates of convergence for the excess
misclassification risk. The proposed procedure is implemented via the method of
mixed integer linear programming. Its numerical performance is illustrated in
Monte Carlo experiments.
","[{""version"":""v1"",""created"":""Fri, 23 Nov 2018 16:26:27 GMT""}]","2018-11-26"
"1811.09541","Aitor Balmaseda","A. Balmaseda and J.M. P\'erez-Pardo","Quantum Control at the Boundary",,,,,"math-ph math.MP math.OC","http://arxiv.org/licenses/nonexclusive-distrib/1.0/","  We present a scheme for controlling the state of a quantum system by
modifying the boundary conditions. This constitutes an infinite-dimensional
control problem. We provide conditions for the existence of solutions of the
dynamics and prove that this system is approximately controllable.
","[{""version"":""v1"",""created"":""Fri, 23 Nov 2018 16:26:51 GMT""},{""version"":""v2"",""created"":""Mon, 30 Sep 2019 13:31:48 GMT""}]","2019-10-01"
"1811.09542","Emiliano Cancellieri Mr.","E. Cancellieri and H. Schomerus","PC-symmetry-protected edge states in interacting driven-dissipative
  bosonic systems",,"Phys. Rev. A 99, 033801 (2019)","10.1103/PhysRevA.99.033801",,"physics.optics","http://arxiv.org/licenses/nonexclusive-distrib/1.0/","  A main objective of topological photonics is the design of disorder-resilient
optical devices. Many prospective applications would benefit from nonlinear
effects, which not only are naturally present in real systems but also are
needed for switching in computational processes, while the underlying particle
interactions are a key ingredient for the manifestation of genuine quantum
effects. A particularly attractive switching mechanism of dynamical systems are
infinite-period bifurcations into limit cycles, as these set on with a finite
amplitude. Here we describe how to realize this switching mechanism by
combining attractive and repulsive particle interactions in a
driven-dissipative Su-Schrieffer-Heeger model, such as realized in excitonic
lasers and condensates so that the system displays a nonhermitian combination
of parity and charge-conjugation (PC) symmetry. We show that this symmetry
survives in the nonlinear case and induces infinite-period and limit-cycle
bifurcations (distinct from a Hopf bifurcation) where the system switches from
a symmetry-breaking stationary state into a symmetry-protected
power-oscillating state of finite amplitude. These protected dynamical
solutions display a number of characteristic features, among which are their
finite amplitude at onset, their arbitrary long oscillation period close to
threshold, and the symmetry of their frequency spectrum which provides a
tuneable frequency comb. Phases with different transition scenarios are
separated by exceptional points in the stability spectrum, involving
nonhermitian degeneracies of symmetry-protected excitations.
","[{""version"":""v1"",""created"":""Fri, 23 Nov 2018 16:27:20 GMT""}]","2019-03-04"
"1811.09545","Jakub Jadwiszczak","Jakub Jadwiszczak, Darragh Keane, Pierce Maguire, Conor P. Cullen,
  Yangbo Zhou, Hua-Ding Song, Clive Downing, Daniel S. Fox, Niall McEvoy, Rui
  Zhu, Jun Xu, Georg S. Duesberg, Zhi-Min Liao, John J. Boland and Hongzhou
  Zhang","Neuromorphic MoS2 memtransistors fabricated by localised helium ion beam
  irradiation","37 pages, 5 main figures, 14 supplementary figures",,,,"cond-mat.mtrl-sci","http://arxiv.org/licenses/nonexclusive-distrib/1.0/","  Two-dimensional layered semiconductors have recently emerged as attractive
building blocks for next-generation low-power non-volatile memories. However,
challenges remain in the controllable sub-micron fabrication of bipolar
resistively switching circuit components from these novel materials. Here we
report on the scalable experimental realisation of lateral on-dielectric
memtransistors from monolayer single-crystal molybdenum disulfide (MoS2)
utilising a focused helium ion beam. Site-specific irradiation with the probe
of a helium ion microscope (HIM) allows for the creation of charged defects in
the MoS2 lattice. The reversible drift of these locally seeded defects in the
applied electric field modulates the resistance of the semiconducting channel,
enabling versatile memristive functionality on the nanoscale. We find the
device can reliably retain its resistance ratios and set biases for hundreds of
switching cycles at sweep frequencies of up to 2.9 V/s with relatively low
drain-source biases. We also demonstrate long-term potentiation and depression
with sharp habituation that promises application in future neuromorphic
architectures. This work advances the down-scaling progress of memristive
devices without sacrificing key performance parameters such as power
consumption or its applicability for synaptic emulation.
","[{""version"":""v1"",""created"":""Fri, 23 Nov 2018 16:31:02 GMT""}]","2018-11-26"
"1811.09546","Ernesto Altshuler","V. L. D\'iaz-Meli\'an, L. A. Rodr\'iguez, F. Pedroso-Camejo, J.
  Mieres, Y. de Armas, A. J. Batista-Leyva, E. Altshuler","Optics undergraduate experiments using smart (and not so smart) phones","9 pages, 4 figures",,,,"physics.ed-ph","http://arxiv.org/licenses/nonexclusive-distrib/1.0/","  Smartphones may be seen as miniature toolboxs to perform Physics experiments.
In this paper, we present three different ""optics workbenches"" mainly based on
the light meter of a smartphone. One is aimed at the precise study of Malus law
and other effects associated to linearly polarized light, the second allows
quantifying the light intensity distribution of diffraction or interference
patterns projected on a screen, and the third demonstrates the so-called
inverse square law obeyed by the light from a pointlike source. These
experiments allow to quantitatively demonstrate three fundamental laws of
optics using quite inexpensive equipment.
","[{""version"":""v1"",""created"":""Fri, 23 Nov 2018 16:32:52 GMT""},{""version"":""v2"",""created"":""Tue, 27 Nov 2018 22:32:08 GMT""}]","2018-11-29"
"1811.09547","Alexander Vikman","Pavel Jirou\v{s}ek and Alexander Vikman","New Weyl-invariant vector-tensor theory for the cosmological constant","9 pages+references, comments are welcome","JCAP04(2019)004","10.1088/1475-7516/2019/04/004",,"gr-qc astro-ph.CO hep-th","http://arxiv.org/licenses/nonexclusive-distrib/1.0/","  We introduce a new Weyl-invariant and generally-covariant vector-tensor
theory with higher derivatives. This theory can be induced by extending the
mimetic construction to vector fields of conformal weight four. We demonstrate
that in gauge-invariant variables this novel theory reduces to the
Henneaux-Teitelboim description of the unimodular gravity. Hence, compared with
the standard general relativity, our new higher derivative vector-tensor theory
has only one new global degree of freedom - the cosmological constant. Finally
we discuss potential extensions of this vector-tensor theory.
","[{""version"":""v1"",""created"":""Fri, 23 Nov 2018 16:34:19 GMT""}]","2019-04-03"
"1811.09548","Thomas Le Goff","Thomas Le Goff and Alph\'ee Michelot","The Range of Cooperativity Modulates Actin Binding Protein Cluster Size,
  Density and Dynamics","7 figures in main text + 3 figures in supplementary material",,,,"physics.bio-ph q-bio.SC","http://arxiv.org/licenses/nonexclusive-distrib/1.0/","  The actin cytoskeleton is composed of multiple networks which are specialized
for several processes such as cell motility or cell division. Each of these
networks are composed of organized actin microfilaments which are decorated
with specific sets of actin binding proteins (ABPs). The molecular mechanisms
guiding ABPs to specific actin networks are still poorly understood, but
cooperativity, the mechanism by which the binding of an ABP is positively
influenced by proximal bound ABPs, plays a crucial role in generating locally
dense stretches of ABPs. Cooperative binding is characterized by its amplitude,
but also by the range at which its effects are propagated along an actin
filament through long-range allosteric interactions. The range of these
allosteric effects is still debated, but is likely to be significant at the
lengthscale of actin filaments in cells. Here, we investigated how
cooperativity influences the clustering of ABPs, using a stochastic
computational model of binding of ABPs to actin filaments. The model reproduces
the formation of ABP clusters observed experimentally at the single filament
scale, and provides a theoretical estimation of the range of cooperativity for
proteins such as ADF/cofilin. We found that both the amplitude and the spatial
range of cooperativity dramatically impact the properties of clustering.
However, the parameters of cooperativity modulate differently the rate of
assembly, size and dynamics of the ABP clusters, suggesting that cooperativity
is an efficient mechanism to regulate precisely the recruitment of ABPs in
cells. This work provides a more general framework for future understanding of
how actin networks acquire distinct and specific protein compositions from a
common cytoplasm.
","[{""version"":""v1"",""created"":""Fri, 23 Nov 2018 16:37:41 GMT""}]","2018-11-26"
"1811.09549","Tom Jin","Vangelis Bacoyannis, Vacslav Glukhov, Tom Jin, Jonathan Kochems, Doo
  Re Song","Idiosyncrasies and challenges of data driven learning in electronic
  trading","Accepted for NIPS 2018 Workshop on Challenges and Opportunities for
  AI in Financial Services: the Impact of Fairness, Explainability, Accuracy,
  and Privacy",,,,"q-fin.TR q-fin.CP","http://arxiv.org/licenses/nonexclusive-distrib/1.0/","  We outline the idiosyncrasies of neural information processing and machine
learning in quantitative finance. We also present some of the approaches we
take towards solving the fundamental challenges we face.
","[{""version"":""v1"",""created"":""Fri, 23 Nov 2018 16:40:16 GMT""},{""version"":""v2"",""created"":""Fri, 30 Nov 2018 18:33:25 GMT""}]","2018-12-03"
"1811.09550","Thomas Prescott","Thomas P Prescott and Ruth E Baker","Multifidelity Approximate Bayesian Computation","25 pages plus Supplementary Material (as appendices)",,"10.1137/18M1229742",,"stat.CO","http://arxiv.org/licenses/nonexclusive-distrib/1.0/","  A vital stage in the mathematical modelling of real-world systems is to
calibrate a model's parameters to observed data. Likelihood-free parameter
inference methods, such as Approximate Bayesian Computation, build Monte Carlo
samples of the uncertain parameter distribution by comparing the data with
large numbers of model simulations. However, the computational expense of
generating these simulations forms a significant bottleneck in the practical
application of such methods. We identify how simulations of cheap, low-fidelity
models have been used separately in two complementary ways to reduce the
computational expense of building these samples, at the cost of introducing
additional variance to the resulting parameter estimates. We explore how these
approaches can be unified so that cost and benefit are optimally balanced, and
we characterise the optimal choice of how often to simulate from cheap,
low-fidelity models in place of expensive, high-fidelity models in Monte Carlo
ABC algorithms. The resulting early accept/reject multifidelity ABC algorithm
that we propose is shown to give improved performance over existing
multifidelity and high-fidelity approaches.
","[{""version"":""v1"",""created"":""Fri, 23 Nov 2018 16:40:31 GMT""},{""version"":""v2"",""created"":""Thu, 27 Jun 2019 11:02:41 GMT""}]","2021-12-23"
