"1809.03566","Sikun Yang","Sikun Yang, Heinz Koeppl","Collapsed Variational Inference for Nonparametric Bayesian Group Factor
  Analysis",,,,,"cs.LG stat.ML","http://arxiv.org/licenses/nonexclusive-distrib/1.0/","  Group factor analysis (GFA) methods have been widely used to infer the common
structure and the group-specific signals from multiple related datasets in
various fields including systems biology and neuroimaging. To date, most
available GFA models require Gibbs sampling or slice sampling to perform
inference, which prevents the practical application of GFA to large-scale data.
In this paper we present an efficient collapsed variational inference (CVI)
algorithm for the nonparametric Bayesian group factor analysis (NGFA) model
built upon an hierarchical beta Bernoulli process. Our CVI algorithm proceeds
by marginalizing out the group-specific beta process parameters, and then
approximating the true posterior in the collapsed space using mean field
methods. Experimental results on both synthetic and real-world data demonstrate
the effectiveness of our CVI algorithm for the NGFA compared with
state-of-the-art GFA methods.
","[{""version"":""v1"",""created"":""Mon, 10 Sep 2018 19:50:56 GMT""},{""version"":""v2"",""created"":""Mon, 24 Sep 2018 15:38:44 GMT""}]","2018-09-25"
"1809.03569","Richard Dudley","Richard A. Dudley, Paul R. Anderson, Roberto Balbinot, Alessandro
  Fabbri","Correlation patterns from massive phonons in 1+1 dimensional acoustic
  black holes: A toy model","40 pages, 13 figures. Minor changes and corrections Phys. Rev. D
  version","Phys. Rev. D 98, 124011 (2018)","10.1103/PhysRevD.98.124011",,"gr-qc cond-mat.quant-gas hep-th","http://arxiv.org/licenses/nonexclusive-distrib/1.0/","  Transverse excitations in analogue black holes induce a mass like term in the
longitudinal mode equation. With a simple toy model we show that correlation
functions display a rather rich structure characterized by groups of parallel
peaks. For the most part the structure is completely different from that found
in the massless case.
","[{""version"":""v1"",""created"":""Mon, 10 Sep 2018 19:55:51 GMT""},{""version"":""v2"",""created"":""Thu, 13 Sep 2018 18:51:29 GMT""},{""version"":""v3"",""created"":""Wed, 19 Dec 2018 19:27:02 GMT""}]","2018-12-21"
"1809.03570","Philipp Schoenbauer","Philipp Sch\""onbauer","Malliavin Calculus and Density for Singular Stochastic Partial
  Differential Equations",,,,,"math.PR","http://arxiv.org/licenses/nonexclusive-distrib/1.0/","  We study Malliavin differentiability of solutions to sub-critical singular
parabolic stochastic partial differential equations (SPDEs) and we prove the
existence of densities for a class of singular SPDEs. Both of these results are
implemented in the setting of regularity structures. For this we construct
renormalized models in situations where some of the driving noises are replaced
by deterministic Cameron-Martin functions, and we show Lipschitz continuity of
these models with respect to the Cameron-Martin norm. In particular, in many
interesting situations we obtain a convergence and stability result for lifts
of $L^2$-functions to models, which is of independent interest. The proof also
involves two separate algebraic extensions of the regularity structure which
are carried out in rather large generality.
","[{""version"":""v1"",""created"":""Mon, 10 Sep 2018 19:58:25 GMT""}]","2018-09-12"
"1809.03571","Chen Wang","Chen Wang and Jeffrey M. Gertler","Autonomous Quantum State Transfer by Dissipation Engineering","Approximately 6 pages of main text, 7 figures","Phys. Rev. Research 1, 033198 (2019)","10.1103/PhysRevResearch.1.033198",,"quant-ph","http://arxiv.org/licenses/nonexclusive-distrib/1.0/","  Quantum state transfer from an information-carrying qubit to a receiving
qubit is ubiquitous for quantum information technology. In a closed quantum
system, this task requires precisely-timed control of coherent qubit-qubit
interactions that are intrinsically reciprocal. Here, breaking reciprocity by
tailoring dissipation in an open system, we show that it is possible to
autonomously transfer a quantum state between stationary qubits without
time-dependent control. We present the general requirements for this
directional transfer process, and show that the minimum system dimension for
transferring one qubit of information is 3 $\times$ 2 (between one physical
qutrit and one physical qubit), plus one auxiliary reservoir. We propose
realistic implementations in present-day superconducting circuit QED
experiments, and further propose schemes compatible with long-distance state
transfer using impedance-matched dissipation engineering.
","[{""version"":""v1"",""created"":""Mon, 10 Sep 2018 19:59:10 GMT""},{""version"":""v2"",""created"":""Mon, 19 Nov 2018 18:56:37 GMT""},{""version"":""v3"",""created"":""Wed, 23 Oct 2019 02:36:11 GMT""}]","2020-01-01"
"1809.03572","Partouche Herve","Herve Partouche","Quantum no-scale regimes and string moduli","1+17 pages, 3 figures",,,"CPHT-PC085.092018","hep-th gr-qc hep-ph","http://arxiv.org/licenses/nonexclusive-distrib/1.0/","  We review that in perturbative string theory, flat, homogeneous and isotropic
cosmological evolutions found in no-scale models at the quantum level can enter
into ""quantum no-scale regimes"" (QNSRs). When this is the case, the quantum
effective potential is dominated by the classical kinetic energies of the
no-scale modulus, dilaton and moduli not involved in the supersymmetry
breaking. As a result, the evolutions approach the classical ones, where the
no-scale structure is exact. When the 1-loop potential is positive, a global
attractor mechanism forces the initially expanding solutions to enter the QNSR
describing a flat, ever-expanding universe. On the contrary, when the potential
can reach negative values, the internal moduli induce in most cases some kind
of instability of the growing universe. The latter stops expanding and
eventually collapses, unless the initial conditions are tuned in a tiny region
of the phase space. Finally, in QNSR, no gauge instability takes place,
regardless of the details of the potential.
","[{""version"":""v1"",""created"":""Mon, 10 Sep 2018 20:03:02 GMT""},{""version"":""v2"",""created"":""Sat, 10 Nov 2018 13:10:51 GMT""}]","2018-11-13"
"1809.03573","Tomasz Stebel","Yan-Qing Ma, Tomasz Stebel and Raju Venugopalan","$J/\psi$ polarization in the CGC+NRQCD approach","26 pages, 8 figures, accepted for publication in JHEP","JHEP12(2018)057","10.1007/JHEP12(2018)057",,"hep-ph nucl-ex nucl-th","http://arxiv.org/licenses/nonexclusive-distrib/1.0/","  We compute the $J/\psi$ polarization observables $\lambda_\theta$,
$\lambda_\phi$, $\lambda_{\theta\phi}$ in a Color Glass Condensate (CGC) +
nonrelativistic QCQ (NRQCD) formalism that includes contributions from both
color singlet and color octet intermediate states. Our results are compared to
low $p_T$ data on $J/\psi$ polarization from the LHCb and ALICE experiments on
proton-proton collisions at center-of-mass energies of $\sqrt{s}=7$ TeV and 8
TeV. Our CGC+NRQCD computation provides a better description of data for $p_T
\leq 15$ GeV relative to extant next-to-leading (NLO) calculations within the
collinear factorization framework. These results suggest that higher order
computations in the CGC+NRQCD framework have the potential to greatly improve
the accuracy of extracted values of the NRQCD universal long distance matrix
elements.
","[{""version"":""v1"",""created"":""Mon, 10 Sep 2018 20:03:57 GMT""},{""version"":""v2"",""created"":""Thu, 29 Nov 2018 21:28:47 GMT""}]","2018-12-17"
"1809.03574","Bismark Singh","Bismark Singh and David Pozo","A Guide to Solar Power Forecasting using ARMA Models",,,,,"stat.AP","http://arxiv.org/licenses/nonexclusive-distrib/1.0/","  We describe a simple and succinct methodology to develop hourly
auto-regressive moving average (ARMA) models to forecast power output from a
photovoltaic solar generator. We illustrate how to build an ARMA model, to use
statistical tests to validate it, and construct hourly samples. The resulting
model inherits nice properties for embedding it into more sophisticated
operation and planning models, while at the same time showing relatively good
accuracy. Additionally, it represents a good forecasting tool for sample
generation for stochastic energy optimization models.
","[{""version"":""v1"",""created"":""Mon, 10 Sep 2018 20:08:34 GMT""}]","2018-09-12"
"1809.03577","Putra Manggala","Chen Karako and Putra Manggala","Using Image Fairness Representations in Diversity-Based Re-ranking for
  Recommendations",,"Adjunct Publication of the 26th Conference on User Modeling,
  Adaptation and Personalization, UMAP 2018, Singapore, July 08-11, 2018. ACM
  2018",,,"cs.IR","http://arxiv.org/licenses/nonexclusive-distrib/1.0/","  The trade-off between relevance and fairness in personalized recommendations
has been explored in recent works, with the goal of minimizing learned
discrimination towards certain demographics while still producing relevant
results.
  We present a fairness-aware variation of the Maximal Marginal Relevance (MMR)
re-ranking method which uses representations of demographic groups computed
using a labeled dataset. This method is intended to incorporate fairness with
respect to these demographic groups.
  We perform an experiment on a stock photo dataset and examine the trade-off
between relevance and fairness against a well known baseline, MMR, by using
human judgment to examine the results of the re-ranking when using different
fractions of a labeled dataset, and by performing a quantitative analysis on
the ranked results of a set of query images. We show that our proposed method
can incorporate fairness in the ranked results while obtaining higher precision
than the baseline, while our case study shows that even a limited amount of
labeled data can be used to compute the representations to obtain fairness.
This method can be used as a post-processing step for recommender systems and
search.
","[{""version"":""v1"",""created"":""Mon, 10 Sep 2018 20:18:47 GMT""}]","2018-09-12"
"1809.03578","The CMS Collaboration","CMS Collaboration","Studies of B$^*_\mathrm{s2}(5840)^0$ and B$_\mathrm{s1}(5830)^0$ mesons
  including the observation of the B$^*_\mathrm{s2}(5840)^0\to$
  B$^0$K$_\mathrm{S}^0$ decay in proton-proton collisions at $\sqrt{s} =$ 8 TeV","Replaced with the published version. Added the journal reference and
  the DOI. All the figures and tables can be found at
  http://cms-results.web.cern.ch/cms-results/public-results/publications/BPH-16-003
  (CMS Public Pages)","Eur. Phys. J. C 78 (2018) 939","10.1140/epjc/s10052-018-6390-z","CMS-BPH-16-003, CERN-EP-2018-224","hep-ex","http://creativecommons.org/licenses/by/4.0/","  Measurements of $\mathrm{B}^*_\mathrm{s2}(5840)^0$ and
$\mathrm{B}_\mathrm{s1}(5830)^0$ mesons are performed using a data sample of
proton-proton collisions corresponding to an integrated luminosity of 19.6
fb$^{-1}$, collected with the CMS detector at the LHC at a centre-of-mass
energy of 8 TeV. The analysis studies $P$-wave $\mathrm{B}^0_\mathrm{S}$ meson
decays into $\mathrm{B}^{(*)+}\mathrm{K}^-$ and
$\mathrm{B}^{(*)0}\mathrm{K}^0_\mathrm{S}$, where the $\mathrm{B}^+$ and
$\mathrm{B}^0$ mesons are identified using the decays
$\mathrm{B}^+\to\mathrm{J}/\psi\,\mathrm{K}^+$ and
$\mathrm{B}^0\to\mathrm{J}/\psi\,\mathrm{K}^*(892)^0$. The masses of the
$P$-wave $\mathrm{B}^0_\mathrm{S}$ meson states are measured and the natural
width of the $\mathrm{B}^*_\mathrm{s2}(5840)^0$ state is determined. The first
measurement of the mass difference between the charged and neutral
$\mathrm{B}^*$ mesons is also presented. The $\mathrm{B}^*_\mathrm{s2}(5840)^0$
decay to $\mathrm{B}^0\mathrm{K}^0_\mathrm{S}$ is observed, together with a
measurement of its branching fraction relative to the
$\mathrm{B}^*_\mathrm{s2}(5840)^0\to\mathrm{B}^+\mathrm{K}^-$ decay.
","[{""version"":""v1"",""created"":""Mon, 10 Sep 2018 20:19:14 GMT""},{""version"":""v2"",""created"":""Thu, 15 Nov 2018 22:02:00 GMT""}]","2018-11-19"
"1809.03579","Behnam Pourhassan","Sudhaker Upadhyay, Behnam Pourhassan, and Salvatore Capozziello","Thermodynamics and phase transitions of galactic clustering in
  higher-order Modified Gravity","Accepted for publication in IJMPD","Int. J. Mod. Phys. D 28 (2019) 1950027","10.1142/S0218271819500275",,"gr-qc","http://arxiv.org/licenses/nonexclusive-distrib/1.0/","  We study the thermodynamics of galactic clustering under the higher-order
corrected Newtonian dynamics. The clustering of galaxies is considered as a
gravitational phase transition. In order to study the effects of higher-order
correction to the thermodynamics of gravitational system, we compute more exact
equations of state. Moreover, we investigate the corrected probability
distribution function for such gravitating system. A relation between order
parameter and the critical temperature is also established.
","[{""version"":""v1"",""created"":""Tue, 11 Sep 2018 06:04:57 GMT""}]","2019-01-23"
"1809.03580","Natalia Zywucka","Natalia \.Zywucka, Arti Goyal, Marek Jamrozy, {\L}ukasz Stawarz,
  Micha{\l} Ostrowski, Szymon Koz{\l}owski, Andrzej Udalski","Identification of blazar candidates behind Small and Large Magellanic
  Clouds","17 pages, 10 figures, accepted for publication in ApJ",,"10.3847/1538-4357/aae36d",,"astro-ph.GA astro-ph.HE","http://arxiv.org/licenses/nonexclusive-distrib/1.0/","  We report the identification of blazar candidates behind the Magellanic
Clouds. The objects were selected from the Magellanic Quasars Survey (MQS),
which targeted the entire Large Magellanic Cloud (LMC) and 70\% of the Small
Magellanic Cloud (SMC). Among the 758 MQS quasars and 898 of unidentified
(featureless spectra) objects, we identified a sample of 44 blazar candidates,
including 27 flat spectrum radio quasars and 17 BL Lacertae objects,
respectively. All the blazar candidates from our sample were identified with
respect to their radio, optical, and mid-infrared properties. The newly
selected blazar candidates possess the long-term, multi-colour photometric data
from the Optical Gravitational Lensing Experiment, multi-colour mid-infrared
observations, and archival radio data for one frequency at least. In addition,
for nine of them the radio polarization data are available. With such data,
these objects can be used to study the physics behind the blazar variability
detected in the optical and mid-infrared bands, as a tool to investigate
magnetic field geometry of the LMC and SMC, and as an exemplary sample of point
like sources most likely detectable in $\gamma$-ray range with the newly
emerging Cherenkov Telescope Array.
","[{""version"":""v1"",""created"":""Mon, 10 Sep 2018 20:20:40 GMT""}]","2018-11-14"
"1809.03581","Yixiang Wu","W.E. Fitzgibbon and J.J. Morgan and Glenn F. Webb and Yixiang Wu","Spatial Models of Vector-Host Epidemics with Directed Movement of
  Vectors Over Long Distances",,,,,"math.AP q-bio.PE","http://arxiv.org/licenses/nonexclusive-distrib/1.0/","  We investigate a time-dependent spatial vector-host epidemic model with
non-coincident domains for the vector and host populations. The host population
resides in small non-overlapping sub-regions, while the vector population
resides throughout a much larger region. The dynamics of the populations are
modeled by a reaction-diffusion-advection compartmental system of partial
differential equations. The disease is transmitted through vector and host
populations in criss-cross fashion. We establish global well-posedness and
uniform a prior bounds as well as the long-term behavior. The model is applied
to simulate the outbreak of bluetongue disease in sheep transmitted by midges
infected with bluetongue virus. We show that the long-range directed movement
of the midge population, due to wind-aided movement, enhances the transmission
of the disease to sheep in distant sites.
","[{""version"":""v1"",""created"":""Mon, 10 Sep 2018 20:25:09 GMT""}]","2018-09-12"
"1809.03582","Xueliang Li","Ran Gu, Xueliang Li","Conflict-free connection number of random graphs","13 pages",,,,"math.CO","http://arxiv.org/licenses/nonexclusive-distrib/1.0/","  An edge-colored graph $G$ is conflict-free connected if any two of its
vertices are connected by a path which contains a color used on exactly one of
its edges. The conflict-free connection number of a connected graph $G$,
denoted by $cfc(G)$, is the smallest number of colors needed in order to make
$G$ conflict-free connected. In this paper, we show that almost all graphs have
the conflict-free connection number 2. More precisely, let $G(n,p)$ denote the
Erd\H{o}s-R\'{e}nyi random graph model, in which each of the $\binom{n}{2}$
pairs of vertices appears as an edge with probability $p$ independent from
other pairs. We prove that for sufficiently large $n$, $cfc(G(n,p))\le 2$ if
$p\ge\frac{\log n +\alpha(n)}{n}$, where $\alpha(n)\rightarrow \infty$. This
means that as soon as $G(n,p)$ becomes connected with high probability,
$cfc(G(n,p))\le 2$.
","[{""version"":""v1"",""created"":""Mon, 10 Sep 2018 20:29:04 GMT""}]","2018-09-12"
"1809.03583","Olga Galinina","Mike Koivisto, Olga Galinina, Sergey Andreev, Antti T\""olli, Giuseppe
  Destino, M\'ario Costa, Kari Lepp\""anen, Yevgeni Koucheryavy, and Mikko
  Valkama","Benefits of Positioning-Aided Communication Technology in High-Frequency
  Industrial IoT","7 pages, 5 figures, 1 table. This work has been submitted to the IEEE
  for possible publication",,,,"eess.SP","http://arxiv.org/licenses/nonexclusive-distrib/1.0/","  The future of industrial applications is shaped by intelligent moving IoT
devices, such as flying drones, advanced factory robots, and connected
vehicles, which may operate (semi-)autonomously. In these challenging
scenarios, dynamic radio connectivity at high frequencies -- augmented with
timely positioning-related information -- becomes instrumental to improve
communication performance and facilitate efficient computation offloading. Our
work reviews the main research challenges and reveals open implementation gaps
in Industrial IoT (IIoT) applications that rely on location awareness and
multi-connectivity in super high and extremely high frequency bands. It further
conducts a rigorous numerical investigation to confirm the potential of precise
device localization in the emerging IIoT systems. We focus on positioning-aided
benefits made available to multi-connectivity IIoT device operation at 28 GHz,
which notably improve data transfer rates, communication latency, and extent of
control overhead.
","[{""version"":""v1"",""created"":""Mon, 10 Sep 2018 20:29:07 GMT""}]","2018-09-12"
"1809.03584","Matias Cattaneo","Matias D. Cattaneo and Richard K. Crump and Max H. Farrell and Ernst
  Schaumburg","Characteristic-Sorted Portfolios: Estimation and Inference",,"Review of Economics and Statistics, 102(3), 531--551, 2020",,,"econ.EM econ.GN q-fin.EC stat.ME","http://arxiv.org/licenses/nonexclusive-distrib/1.0/","  Portfolio sorting is ubiquitous in the empirical finance literature, where it
has been widely used to identify pricing anomalies. Despite its popularity,
little attention has been paid to the statistical properties of the procedure.
We develop a general framework for portfolio sorting by casting it as a
nonparametric estimator. We present valid asymptotic inference methods and a
valid mean square error expansion of the estimator leading to an optimal choice
for the number of portfolios. In practical settings, the optimal choice may be
much larger than the standard choices of 5 or 10. To illustrate the relevance
of our results, we revisit the size and momentum anomalies.
","[{""version"":""v1"",""created"":""Mon, 10 Sep 2018 20:31:28 GMT""},{""version"":""v2"",""created"":""Mon, 28 Jan 2019 17:13:30 GMT""},{""version"":""v3"",""created"":""Sat, 5 Oct 2019 15:52:49 GMT""}]","2020-07-21"
"1809.03585","William P. Minicozzi II","Tobias Holck Colding and William P. Minicozzi II","Wandering Singularities",,,,,"math.DG math.AP math.DS math.GT","http://arxiv.org/licenses/nonexclusive-distrib/1.0/","  Parabolic geometric flows are smoothing for short time however, over long
time, singularities are typically unavoidable, can be very nasty and may be
impossible to classify. The idea of [CM6] and here is that, by bringing in the
dynamical properties of the flow, we obtain also smoothing for large time for
generic initial conditions. When combined with [CM1], this shows, in an
important special case, the singularities are the simplest possible.
  The question of the dynamics of a singularity has two parts. One is: What are
the dynamics near a singularity? The second is: What is the long time behavior?
That is, if the flow leaves a neighborhood of a singularity, can it return at a
much later time? The first question was addressed in [CM6] and the second here.
  Combined with [CM1], [CM6], we show that all other closed singularities than
the (round) sphere have a neighborhood where `nearly every' closed hypersurface
leaves under the flow and never returns, even to a dilated, rotated or
translated copy of the singularity. In other words, it wanders off. In
contrast, by Huisken, any closed hypersurface near a sphere remains close to a
dilated or translated copy of the sphere at each time.
","[{""version"":""v1"",""created"":""Mon, 10 Sep 2018 20:34:13 GMT""}]","2018-09-12"
"1809.03586","Marco Falconi","Daniele Dimonte, Marco Falconi, Alessandro Olgiati","On some rigorous aspects of fragmented condensation","22 pages, no figures",,,,"cond-mat.quant-gas math-ph math.MP","http://arxiv.org/licenses/nonexclusive-distrib/1.0/","  In this paper we discuss some aspects of fragmented condensation from a
mathematical perspective. We first propose a simple way of characterizing
finite fragmentation. Then, inspired by recent results of semiclassical
analysis applied to bosonic systems with infinitely many degrees of freedom, we
address the problem of persistence of fragmented condensation. We show that the
latter occurs in interacting systems, in the mean-field regime, and in the
limit of large gap of the one-body Hamiltonian.
","[{""version"":""v1"",""created"":""Mon, 10 Sep 2018 20:38:05 GMT""},{""version"":""v2"",""created"":""Fri, 28 Aug 2020 09:07:46 GMT""}]","2020-08-31"
"1809.03587","Fang Ou","Fang Ou, Cushla McGoverin, Simon Swift, Fr\'ed\'erique Vanholsbeeck","Near real-time enumeration of live and dead bacteria using a fibre-based
  spectroscopic device","13 pages, 5 figures",,,,"q-bio.QM","http://arxiv.org/licenses/nonexclusive-distrib/1.0/","  A rapid, cost-effective and easy method that allows on-site determination of
the concentration of live and dead bacterial cells using a fibre-based
spectroscopic device (the optrode system) is proposed and demonstrated.
Identification of live and dead bacteria was achieved by using the commercially
available dyes SYTO 9 and propidium iodide, and fluorescence spectra were
measured by the optrode. Three spectral processing methods were evaluated for
their effectiveness in predicting the original bacterial concentration in the
samples: principal components regression (PCR), partial least squares
regression (PLSR) and support vector regression (SVR). Without any sample
pre-concentration, PCR achieved the most reliable results. It was able to
quantify live bacteria from $10^{8}$ down to $10^{6.2}$ bacteria/mL and showed
the potential to detect as low as $10^{5.7}$ bacteria/mL. Meanwhile,
enumeration of dead bacteria using PCR was achieved between $10^{8}$ and
$10^{7}$ bacteria/mL. The general procedures described in this article can be
applied or modified for the enumeration of bacteria within populations stained
with fluorescent dyes. The optrode is a promising device for the enumeration of
live and dead bacterial populations particularly where rapid, on-site
measurement and analysis is required.
","[{""version"":""v1"",""created"":""Mon, 10 Sep 2018 20:38:28 GMT""}]","2018-09-12"
