"1809.03890","Christopher Edgcombe","C. J. Edgcombe, S. M. Masur, E. B. Linscott, J. A. J. Whaley-Baldwin
  and C. H. W. Barnes","Analysis of a capped carbon nanotube (CNT) with linear-scaling
  density-functional theory","11 pages, 9 figures Corresponding author: C. J. Edgcombe
  (cje1@cam.ac.uk). Version 2 of the paper contains Errata and mark-ups.
  Version 3 deletes errors. Version 5 adds orbitals and comparison of Exc and
  image potentials. Version 9-1 gives more theory and adds an author. The
  different behaviour of potentials found here by DFT and by the classical
  image is due to the use of the LD approximation",,"10.1016/j.ultramic.2018.11.007",,"physics.app-ph","http://arxiv.org/licenses/nonexclusive-distrib/1.0/","  The apex region of a capped (5,5) carbon nanotube (CNT) has been modelled
with the DFT package ONETEP, using boundary conditions provided by a classical
calculation with a conducting surface in place of the CNT. Results from the DFT
solution include the Fermi level and the physical distribution and energies of
individual Kohn-Sham orbitals for the CNT tip. Application of an external
electric field changes the orbital number of the highest occupied molecular
orbital (the HOMO) and consequently changes the distribution of the HOMO on the
CNT.
","[{""version"":""v1"",""created"":""Tue, 11 Sep 2018 13:44:45 GMT""},{""version"":""v2"",""created"":""Tue, 2 Oct 2018 10:39:05 GMT""},{""version"":""v3"",""created"":""Mon, 15 Oct 2018 12:27:45 GMT""},{""version"":""v4"",""created"":""Fri, 16 Nov 2018 18:00:52 GMT""},{""version"":""v5"",""created"":""Wed, 16 Jan 2019 12:48:11 GMT""}]","2019-01-17"
"1809.03891","Yonatan Belinkov","Yonatan Belinkov, Alexander Magidow, Alberto Barr\'on-Cede\~no, Avi
  Shmidman, Maxim Romanov","Studying the History of the Arabic Language: Language Technology and a
  Large-Scale Historical Corpus",,,,,"cs.CL","http://arxiv.org/licenses/nonexclusive-distrib/1.0/","  Arabic is a widely-spoken language with a long and rich history, but existing
corpora and language technology focus mostly on modern Arabic and its
varieties. Therefore, studying the history of the language has so far been
mostly limited to manual analyses on a small scale. In this work, we present a
large-scale historical corpus of the written Arabic language, spanning 1400
years. We describe our efforts to clean and process this corpus using Arabic
NLP tools, including the identification of reused text. We study the history of
the Arabic language using a novel automatic periodization algorithm, as well as
other techniques. Our findings confirm the established division of written
Arabic into Modern Standard and Classical Arabic, and confirm other established
periodizations, while suggesting that written Arabic may be divisible into
still further periods of development.
","[{""version"":""v1"",""created"":""Tue, 11 Sep 2018 13:44:48 GMT""}]","2018-09-12"
"1809.03892","Ivan Smith","Nick Sheridan, Ivan Smith","Rational equivalence and Lagrangian tori on K3 surfaces","30 pages. Version 2: minor clarifications. This is the final version,
  to appear in Commentarii","Comment. Math. Helv. 95 (2020), no. 2, 301-337","10.4171/CMH/489",,"math.SG math.AG","http://arxiv.org/licenses/nonexclusive-distrib/1.0/","  Fix a symplectic K3 surface X homologically mirror to an algebraic K3 surface
Y by an equivalence taking a graded Lagrangian torus L in X to the skyscraper
sheaf of a point y of Y. We show there are Lagrangian tori with vanishing
Maslov class in X whose class in the Grothendieck group of the Fukaya category
is not generated by Lagrangian spheres. This is mirror to a statement about the
`Beauville--Voisin subring' in the Chow groups of Y, and fits into a
conjectural relationship between Lagrangian cobordism and rational equivalence
of algebraic cycles.
","[{""version"":""v1"",""created"":""Tue, 11 Sep 2018 13:46:13 GMT""},{""version"":""v2"",""created"":""Mon, 5 Aug 2019 21:34:22 GMT""}]","2020-11-03"
"1809.03894","Simon Schaal","S. Schaal, A. Rossi, S. Barraud, J. J. L. Morton and M. F.
  Gonzalez-Zalba","A CMOS dynamic random access architecture for radio-frequency readout of
  quantum devices",,"Nature Electronics (2019)","10.1038/s41928-019-0259-5",,"cond-mat.mes-hall quant-ph","http://arxiv.org/licenses/nonexclusive-distrib/1.0/","  Quantum computing technology is maturing at a relentless pace, yet individual
quantum bits are wired one by one. As quantum processors become more complex,
they require efficient interfaces to deliver signals for control and readout
while keeping the number of inputs manageable. Digital electronics offers
solutions to the scaling challenge by leveraging established industrial
infrastructure and applying it to integrate silicon-based quantum devices with
conventional CMOS circuits. Here, we combine both technologies at milikelvin
temperatures and demonstrate the building blocks of a dynamic random access
architecture for efficient readout of complex quantum circuits. Our circuit is
divided into cells, each containing a CMOS quantum dot (QD) and a field-effect
transistor that enables selective readout of the QD, as well as charge storage
on the QD gate similar to 1T-1C DRAM technology. We show dynamic readout of two
cells by interfacing them with a single radio-frequency resonator. Our results
demonstrate a path to reducing the number of input lines per qubit and enable
addressing of large-scale device arrays.
","[{""version"":""v1"",""created"":""Tue, 11 Sep 2018 13:47:16 GMT""}]","2019-06-18"
"1809.03899","Mario Hern\'an Casta\~neda Garc\'ia","Mario H. Casta\~neda Garc\'ia, Marcin Iwanow and Richard A.
  Stirling-Gallacher","LOS MIMO Design based on Multiple Optimum Antenna Separations","Published at the IEEE Vehicular Technology Conference 2018 Fall,
  where it was selected as the IEEE VTC 2018-Fall Conference's Best Paper",,,,"eess.SP cs.IT math.IT","http://arxiv.org/licenses/nonexclusive-distrib/1.0/","  The use of multiple antennas in a transmit and receive antenna array for MIMO
wireless communication allows the spatial degrees of freedom in rich scattering
environments to be exploited. However, for line-of-sight (LOS) MIMO channels
with uniform linear arrays (ULAs) at the transmitter and receiver, the antenna
separations at the transmit and receive array need to be optimized to maximize
the spatial degrees of freedom and the channel capacity. In this paper, we
first revisit the derivation of the optimum antenna separation at the transmit
and receive ULAs in a LOS MIMO system, and provide the general expression for
the optimum antenna separation product, which consists of multiple solutions.
Although only the solution corresponding to the smallest antenna separation
product is usually considered in the literature, we exploit the multiple
solutions for a LOS MIMO design over a range of distances between the
transmitter and receiver. In particular, we consider the LOS MIMO design in a
vehicle-to-vehicle (V2V) communication scenario, over a range of distances
between the transmit and receive vehicle.
","[{""version"":""v1"",""created"":""Tue, 11 Sep 2018 13:52:36 GMT""}]","2018-09-12"
"1809.03900","Artur O. Lopes","Hermes H. Ferreira, Artur O. Lopes and Elismar R. Oliveira","Explicit examples in Ergodic Optimization",,,,,"math.DS","http://arxiv.org/licenses/nonexclusive-distrib/1.0/","  Denote by $T$ the transformation $T(x)= 2 \,x $ (mod 1). Given a potential
$A:S^1 \to \mathbb{R}$ we are interested in exhibiting in several examples the
explicit expression for the calibrated subaction $V: S^1 \to \mathbb{R}$ for
$A$. The action of the $1/2$ iterative procedure $\mathcal{G}$, acting on
continuous functions $f: S^1 \to \mathbb{R}$, was analyzed in a companion
paper. Given an initial condition $f_0$, the sequence, $\mathcal{G}^n(f_0)$
will converge to a subaction. The sharp numerical evidence obtained from this
iteration allow us to guess explicit expressions for the subaction in several
worked examples: among them for $A(x) = \sin^2 ( 2 \pi x)$ and $A(x) = \sin ( 2
\pi x)$. Here, among other things, we present piecewise analytical expressions
for several calibrated subactions. The iterative procedure can also be applied
to the estimation of the joint spectral radius of matrices. We also analyze the
iteration of $\mathcal{G}$ when the subaction is not unique. Moreover, we
briefly present the version of the $1/2$ iterative procedure for the estimation
of the main eigenfunction of the Ruelle operator.
","[{""version"":""v1"",""created"":""Tue, 11 Sep 2018 13:52:47 GMT""},{""version"":""v2"",""created"":""Tue, 22 Jan 2019 11:53:33 GMT""},{""version"":""v3"",""created"":""Thu, 26 Dec 2019 20:07:21 GMT""},{""version"":""v4"",""created"":""Fri, 28 Aug 2020 19:10:35 GMT""},{""version"":""v5"",""created"":""Wed, 16 Sep 2020 11:47:50 GMT""},{""version"":""v6"",""created"":""Tue, 27 Oct 2020 14:33:01 GMT""}]","2020-10-28"
"1809.03901","Dominik Kowald PhD","Elisabeth Lex, Mario Wagner, Dominik Kowald","Mitigating Confirmation Bias on Twitter by Recommending Opposing Views","European Symposium on Computational Social Science, Cologne, Germany",,,,"cs.IR cs.SI","http://creativecommons.org/licenses/by/4.0/","  In this work, we propose a content-based recommendation approach to increase
exposure to opposing beliefs and opinions. Our aim is to help provide users
with more diverse viewpoints on issues, which are discussed in partisan groups
from different perspectives. Since due to the backfire effect, people's
original beliefs tend to strengthen when challenged with counter evidence, we
need to expose them to opposing viewpoints at the right time. The preliminary
work presented here describes our first step into this direction. As
illustrative showcase, we take the political debate on Twitter around the
presidency of Donald Trump.
","[{""version"":""v1"",""created"":""Tue, 11 Sep 2018 13:54:54 GMT""}]","2018-09-12"
"1809.03902","Eduard V. Deviatov","O.O. Shvetsov, A. Kononov, A.V. Timonina, N.N. Kolesnikov, E.V.
  Deviatov","Multivalued current-phase relationship in a.c. Josephson effect for a
  three-dimensional Weyl semimetal WTe$_2$","the text is seriously corrected. arXiv admin note: text overlap with
  arXiv:1801.09551","EPL, 124, 47003 (2018)","10.1209/0295-5075/124/47003",,"cond-mat.mes-hall cond-mat.supr-con","http://arxiv.org/licenses/nonexclusive-distrib/1.0/","  We experimentally study electron transport between two superconducting indium
leads, coupled to a single WTe$_2$ crystal, which is a three-dimensional Weyl
semimetal. We demonstrate Josephson current in long 5~$\mu$m In-WTe$_2$-In
junctions, as confirmed by the observation of integer (1,2,3) and fractional
(1/3, 1/2, 2/3) Shapiro steps under microwave irradiation. Demonstration of
fractional a.c. Josephson effect indicates multivalued character of the
current-phase relationship, which we connect with Weyl topological surface
states contribution to Josephson current. In contrast to topological insulators
and Dirac semimetals, we do not observe $4\pi$ periodicity in a.c. Josephson
effect for WTe$_2$ at different frequencies and power, which might reflect
chiral character of the Fermi arc surface states in Weyl semimetal.
","[{""version"":""v1"",""created"":""Mon, 10 Sep 2018 16:35:27 GMT""},{""version"":""v2"",""created"":""Wed, 19 Sep 2018 12:14:45 GMT""}]","2019-01-21"
"1809.03903","Henri Vincenti","L. Chopineau, A. Leblanc, G. Blaclard, A. Denoeud, M. Th\'evenet, J-L.
  Vay, G. Bonnaud, Ph. Martin, H. Vincenti and F. Qu\'er\'e","Identification of coupling mechanisms between ultraintense laser light
  and dense plasmas","16 pages, 12 figures","Phys. Rev. X 9, 011050 (2019)","10.1103/PhysRevX.9.011050",,"physics.plasm-ph","http://arxiv.org/licenses/nonexclusive-distrib/1.0/","  The interaction of intense laser beams with plasmas created on solid targets
involves a rich non-linear physics. Because such dense plasmas are reflective
for laser light, the coupling with the incident beam occurs within a thin layer
at the interface between plasma and vacuum. One of the main paradigms used to
understand this coupling, known as Brunel mechanism, is expected to be valid
only for very steep plasma surfaces. Despite innumerable studies, its validity
range remains uncertain, and the physics involved for smoother plasma-vacuum
interfaces is unclear, especially for ultrahigh laser intensities. We report
the first comprehensive experimental and numerical study of the laser-plasma
coupling mechanisms as a function of the plasma interface steepness, in the
relativistic interaction regime. Our results reveal a clear transition from the
temporally-periodic Brunel mechanism to a chaotic dynamic associated to
stochastic heating. By revealing the key signatures of these two distinct
regimes on experimental observables, we provide an important landmark for the
interpretation of future experiments.
","[{""version"":""v1"",""created"":""Tue, 11 Sep 2018 13:57:49 GMT""}]","2019-03-27"
"1809.03904","Max Farrell","Sebastian Calonico and Matias D. Cattaneo and Max H. Farrell and Rocio
  Titiunik","Regression Discontinuity Designs Using Covariates",,"Review of Economics and Statistics, 101(3), 442--451, 2019",,,"econ.EM stat.ME","http://arxiv.org/licenses/nonexclusive-distrib/1.0/","  We study regression discontinuity designs when covariates are included in the
estimation. We examine local polynomial estimators that include discrete or
continuous covariates in an additive separable way, but without imposing any
parametric restrictions on the underlying population regression functions. We
recommend a covariate-adjustment approach that retains consistency under
intuitive conditions, and characterize the potential for estimation and
inference improvements. We also present new covariate-adjusted mean squared
error expansions and robust bias-corrected inference procedures, with
heteroskedasticity-consistent and cluster-robust standard errors. An empirical
illustration and an extensive simulation study is presented. All methods are
implemented in \texttt{R} and \texttt{Stata} software packages.
","[{""version"":""v1"",""created"":""Tue, 11 Sep 2018 13:58:17 GMT""}]","2019-07-02"
"1809.03905","Benjamin Taylor","Erick Chacon, Luke Parry, Emanuele Giorgi, Patricia Torres, Jesem
  Orellana, Benjamin M. Taylor","Spatial Item Factor Analysis With Application to Mapping Food Insecurity","44 pages, 11 figures",,,,"stat.ME","http://arxiv.org/licenses/nonexclusive-distrib/1.0/","  Item factor analysis is widely used for studying the relationship between a
latent construct and a set of observed variables. One of the main assumptions
of this method is that the latent construct or factor is independent between
subjects, which might not be adequate in certain contexts. In the study of food
insecurity, for example, this is likely not true due to a close relationship
with socio-economic characteristics, that are spatially structured. In order to
capture these effects, we propose an extension of item factor analysis to the
spatial domain that is able to predict the latent factors at unobserved spatial
locations. We develop a Bayesian sampling scheme for providing inference and
illustrate the explanatory strength of our model by application to a study of
the latent construct `food insecurity' in a remote urban centre in the
Brazilian Amazon. We use our method to map the dimensions of food insecurity in
this area and identify the most severely affected areas. Our methods are
implemented in an R package, spifa, available from Github.
","[{""version"":""v1"",""created"":""Tue, 11 Sep 2018 13:59:13 GMT""}]","2018-09-12"
"1809.03906","Ricardo Monteiro","Ricardo Monteiro, Isobel Nicholson, Donal O'Connell","Spinor-helicity and the algebraic classification of higher-dimensional
  spacetimes","47 pages, 3 figures, 15 tables. v2: minor changes","Class.Quant.Grav. 36 (2019) 065006","10.1088/1361-6382/ab03df",,"gr-qc hep-th","http://arxiv.org/licenses/nonexclusive-distrib/1.0/","  The spinor-helicity formalism is an essential technique of the amplitudes
community. We draw on this method to construct a scheme for classifying
higher-dimensional spacetimes in the style of the four-dimensional Petrov
classification and the Newman-Penrose formalism. We focus on the
five-dimensional case for concreteness. Our spinorial scheme naturally
reproduces the full structure previously seen in both the CMPP and de Smet
classifications, and resolves longstanding questions concerning the
relationship between the two classifications.
","[{""version"":""v1"",""created"":""Tue, 11 Sep 2018 14:02:44 GMT""},{""version"":""v2"",""created"":""Mon, 1 Apr 2019 10:25:28 GMT""}]","2019-04-02"
"1809.03907","Eleanor Vickers","E. Vickers, I. Ballai, R. Erd\'elyi","Propagation of Leaky MHD Waves at Discontinuities with Tilted Magnetic
  Field","19 pages, 5 figures",,"10.1007/s11207-018-1359-5",,"astro-ph.SR","http://arxiv.org/licenses/nonexclusive-distrib/1.0/","  We investigate the characteristics of magneto-acoustic surface waves
propagating at a single density interface, in the presence of an inclined
magnetic field. For linear wave propagation, dispersion relation is obtained
and analytical solutions are derived for small inclination angle. The
inclination of the field renders the frequency of waves to be complex, where
the imaginary part describes wave attenuation, due to lateral energy leakage.
","[{""version"":""v1"",""created"":""Tue, 11 Sep 2018 14:03:24 GMT""}]","2018-10-17"
"1809.03908","Jeppe Christiansen","Jeppe Christiansen, Harish Lakhotiya, Emil Eriksen, S{\o}ren P.
  Madsen, Peter Balling, and Brian Julsgaard","Analytical model for the intensity dependence of 1500 nm to 980 nm
  upconversion in Er$^{3+}$: a new tool for material characterization","8 pages, 6 figures, to be submitted to PRB",,"10.1063/1.5064409",,"cond-mat.mtrl-sci","http://arxiv.org/licenses/nonexclusive-distrib/1.0/","  We propose a simplified rate-equation model for the 1500 nm to 980 nm
upconversion in Er$^{3+}$. The simplifications, based on typical experimental
conditions as well as on conclusions based on previously published more
advanced models, enable an analytical solution of the rate equations, which
reproduces known properties of upconversion. We have compared the model
predictions with intensity-dependent measurements on four samples with
different optical properties, such as upconversion-luminescence yield and the
characteristic lifetime of the $^4I_{13/2}$ state. The saturation of the
upconversion is in all cases well-described by the model over several orders of
magnitude in excitation intensities. Finally, the model provides a new measure
for the quality of upconverter systems based on Er$^{3+}$ -- the saturation
intensity. This parameter provides valuable information on upconversion
parameters such as the rates of energy-transfer upconversion and
cross-relaxation. In the present investigation, we used the saturation
intensity to conclude that the differences in upconversion performance of the
investigated samples are mainly due to differences in the non-radiative
relaxation rates.
","[{""version"":""v1"",""created"":""Tue, 11 Sep 2018 14:04:54 GMT""}]","2019-02-20"
"1809.03909","Oskar Hartbrich","CALICE Collaboration: J. Repond, L. Xia, J. Apostolakis, G. Folger, V.
  Ivantchenko, A. Ribon, V. Uzhinskiy, D. Boumediene, V. Francais, G. C.
  Blazey, A. Dyshkant, K. Francis, V. Zutshi, O. Bach, E. Brianne, A. Ebrahimi,
  K. Gadow, P. Gttlicher, O. Hartbrich F. Krivan, K. Kr\""uger, J. Kvasnicka, S.
  Lu, C. Neub\""user, A. Provenza, M. Reinecke, F. Sefkow, S. Schuwalow, Y.
  Sudo, H.L. Tran, P. Buhmann, E. Garutti, S. Laurien, D. Lomidze, M. Matysek,
  A. Kaplan, H.-Ch. Schultz-Coulon, G.W. Wilson, D. Jeans, K. Kawagoe, I.
  Sekiya, T. Suehara, H. Yamashiro, T. Yoshioka, M. Wing, K. Kotera, M.
  Nishiyama, T. Sakuma, T. Takeshita, S. Tozuka, T. Tubokawa, S. Uozumi, E.
  Calvo Alamillo, M.C. Fouz, J. Marin, J. Navarrete, J. Puerta Pelayo, A.
  Verdugo, M. Chadeeva, M. Danilov, A. Drutskoy, E. Popova, V. Rusinov, E.
  Tarkovsky, L. Emberger, M. Gabriel, C. Graf, Y. Israeli, N. van der Kolk, F.
  Simon, M. Szalay, H. Windel, S. Bilokin J. Bonis, R. P\""oschl, A. Irles, A.
  Thiebault, F. Richard, D. Zerwas, M. Anduze, V. Balagura, E. Becheva, V.
  Boudry, J-C. Brient, R. Cornat, E. Edy, M. Frotin F. Gastaldi, B. Li, F.
  Magniette, J. Nanni, M. Rubio-Roy, K. Shpak, T.H. Tran, H. Videau, J. Cvach,
  M. Janata, M. Kovalcuk, I. Polak, J. Smolik, V. Vrba, J. Zalesak, J. Zuklin,
  S. Chang, A. Khan, D.H. Kim, D.J. Kong, Y.D. Oh, A. Elkhalii, M. G\""otze, C.
  Zeitnitz","Hadronic Energy Resolution of a Combined High Granularity Scintillator
  Calorimeter System","31 pages, 41 figures",,,,"physics.ins-det","http://arxiv.org/licenses/nonexclusive-distrib/1.0/","  This paper presents results obtained with the combined CALICE Scintillator
Electromagnetic Calorimeter, Analogue Hadronic Calorimeter and Tail Catcher &
Muon Tracker, three high granularity scintillator-SiPM calorimeter prototypes.
The response of the system to pions with momenta between 4 GeV/c and 32 GeV/c
is analysed, including the energy response, resolution, and longitudinal shower
profiles. The results of a software compensation technique based on weighting
according to hit energy are compared to those of a standard linear energy
reconstruction. The results are compared to predictions of the GEANT4 physics
lists QGSP_BERT_HP and FTFP_BERT_HP.
","[{""version"":""v1"",""created"":""Tue, 11 Sep 2018 14:08:52 GMT""},{""version"":""v2"",""created"":""Wed, 12 Sep 2018 07:50:38 GMT""}]","2018-09-13"
"1809.03910","Madeline Ausdemore","Madeline Ausdemore, Jessie H. Hendricks, and Cedric Neumann","Review of several false positive error rate estimates for latent
  fingerprint examination proposed based on the 2014 Miami Dade Police
  Department study",,,,,"stat.AP","http://arxiv.org/licenses/nonexclusive-distrib/1.0/","  During the past decade, several studies have been conducted to estimate the
false positive error rate (FPR) associated with latent fingerprint examination.
The so-called Black-box study by Ulery et al. is regularly used to support the
claim that the FPR in fingerprint examination is reasonably low (0.1%). The
Ulery et al.'s estimate of the FPR is supported by the results of the extensive
study of the overall fingerprint examination process by Langenburg. In 2014,
the Miami Dade Police Department (MDPD) Forensic Services Bureau conducted
research to study the false positive error rate associated with latent
fingerprint examination. They report that approximately 3.0% of latent
fingerprint examinations result in a false positive conclusion. Their estimate
of the FPR becomes as high as 4.2% when inconclusive decisions are excluded
from the calculation. In their 2016 report, the President's Council of Advisors
on Science and Technology (PCAST) proposes that the MDPD FPR estimate be used
to inform jurors that errors occur at a detectable rate in fingerprint
examination; more specifically, they declare that false positives may occur as
often as 1 in 18 cases. The large discrepancy between the FPR estimates
reported by Ulery et al. and Langenburg on the one hand, and the MDPD on the
other hand, causes a great deal of controversy. In this paper, we review the
MDPD study and the various error rate calculations that have been proposed to
interpret its data. To assess the appropriateness of the different proposed
estimates, we develop a model that re-creates the MDPD study. This model allows
us to estimate the expected number of false positive conclusions that should be
obtained with any proposed FPR and compare this number to the actual number of
erroneous identifications observed by MDPD.
","[{""version"":""v1"",""created"":""Tue, 11 Sep 2018 14:09:21 GMT""},{""version"":""v2"",""created"":""Mon, 22 Oct 2018 16:10:12 GMT""}]","2018-10-23"
"1809.03911","Vadim Makarov","Aleksey Fedorov, Ilja Gerhardt, Anqi Huang, Jonathan Jogenfors, Yury
  Kurochkin, Ant\'ia Lamas-Linares, Jan-{\AA}ke Larsson, Gerd Leuchs, Lars
  Lydersen, Vadim Makarov, Johannes Skaar","Comment on ""Inherent security of phase coding quantum key distribution
  systems against detector blinding attacks"" [Laser Phys. Lett. 15, 095203
  (2018)]","2 pages","Laser Phys. Lett. 16, 019401 (2019)","10.1088/1612-202X/aaf22d",,"quant-ph","http://arxiv.org/licenses/nonexclusive-distrib/1.0/","  This is a brief comment on the Letter by Balygin and his coworkers [Laser
Phys. Lett. 15, 095203 (2018)]. We point out an error that invalidates the
Letter's conclusions.
","[{""version"":""v1"",""created"":""Tue, 11 Sep 2018 14:11:31 GMT""}]","2018-12-18"
"1809.03912","Emese Plachy","E. Plachy, A. B\'odi, Z. Koll\'ath","Chaotic dynamics in the pulsation of DF Cygni, as observed by Kepler","9 pages, 7 figures, accepted in MNRAS",,"10.1093/mnras/sty2511",,"astro-ph.SR","http://arxiv.org/licenses/nonexclusive-distrib/1.0/","  Pulsations of RV Tauri-type variable stars can be governed by chaotic
dynamics. However, observational evidence for this happening is usually hard to
come by. Here we use the continuous, 4-year-long observations of the Kepler
space telescope to search for the signs of chaos in the RVb-type pulsating
supergiant, DF Cygni. We use the Global Flow Reconstruction method to estimate
the quantitative properties of the dynamics driving the pulsations of the star.
The secondary, long-term light variation, i.e., the RVb phenomenon was removed
in the analysis with the Empirical Mode Decomposition method. Our analysis
revealed that the pulsation of DF Cyg could be described as a chaotic signal
with a Lyapunov dimension of ~2.8. DF Cyg is only the third RV Tau star, and
the first of the RVb subtype, where the nonlinear analysis indicates that
low-dimensional chaos may explain the peculiarities of the pulsation.
","[{""version"":""v1"",""created"":""Tue, 11 Sep 2018 14:12:37 GMT""}]","2018-09-26"
