"1809.03714","Arijit Sen","Subramani Amutha and Arijit Sen","Asymmetric Coulomb Oscillation and Giant Anisotropic Magnetoresistance
  in Doped Graphene Nanojunctions","14 pages, 4 figures","Applied Surface Science, Volume 449, 15 August 2018, Pages 384-388
  Applied Surface Science, Volume 449, 15 August 2018, Pages 384-388 Applied
  Surface Science, Volume 449, 15 August 2018, Pages 384-388","10.1016/j.apsusc.2017.12.154",,"cond-mat.mtrl-sci cond-mat.mes-hall","http://arxiv.org/licenses/nonexclusive-distrib/1.0/","  We report here the charge transport behavior in graphene nanojunctions in
which graphene nanodots, with relatively long relaxation time, are interfaced
with ferromagnetic electrodes. Subsequently we explore the effect of
substitutional doping of transition metal atoms in zigzag graphene nanodots
(z-GNDs) on the charge transport under non-collinear magnetization. Only
substitutional doping of transition metal atoms in z-GNDs at certain sites
demonstrates the spin filtering effect with a large tunnelling
magnetoresistance as high as 700%, making it actually suitable for spintronic
applications. From the electrical field simulation around the junction area
within the electrostatic physics model, we find that the value of electric
field strength increases especially with doped graphene nanodots, as the gap
between the gate electrode and tip axis is reduced from 3 nm to 1 nm. Our
detailed analysis further suggests the onset of asymmetric Coulomb oscillations
with varying amplitudes in graphene nanodots, on being doped with magnetic
ions. Such kind of tunability in the electronic conductance can potentially be
exploited in designing spintronic logic gates at nanoscale.
","[{""version"":""v1"",""created"":""Tue, 11 Sep 2018 07:38:55 GMT""}]","2018-09-12"
"1809.03715","Yusei Koyama","Yusei Koyama, Rhythm Shimakawa, Issei Yamamura, Tadayuki Kodama, Masao
  Hayashi","On the different levels of dust attenuation to nebular and stellar light
  in star-forming galaxies","14 pages, 14 figures, accepted for publication in PASJ AKARI Special
  Issue",,"10.1093/pasj/psy113",,"astro-ph.GA","http://arxiv.org/licenses/nonexclusive-distrib/1.0/","  As a science verification study of the newly released AKARI/FIS Faint Source
Catalog ver.1, this paper discusses the different levels of dust attenuation
toward stellar light and nebular emission lines within local star-forming
galaxies at 0.02<z<0.10. By constructing an updated version of the
AKARI-SDSS-GALEX matched galaxy catalog (with >2,000 sources), we compare the
dust attenuation levels toward stellar light (from L(IR)/L(UV) ratio) and
nebular emission lines (from H-alpha/H-beta ratio). We find that there is a
clear trend that more massive galaxies tend to have higher ""extra"" attenuation
toward nebular regions, while galaxies with higher specific star formation
rates tend to have lower extra attenuation. We also confirm these trends by
using the WISE mid-infrared photometry with a significantly large sample size
of the WISE-SDSS-GALEX galaxies (>50,000 sources). Finally, we study how the
levels of extra attenuation toward nebular regions change across the SFR-Mstar
plane. We find that, even at a fixed stellar mass, galaxies located below the
main sequence tend to have higher levels of extra attenuation toward nebular
regions, suggesting the change in dust geometry within the galaxies across the
star-forming main sequence during the course of star formation quenching
process.
","[{""version"":""v1"",""created"":""Tue, 11 Sep 2018 07:43:04 GMT""}]","2018-10-17"
"1809.03716","Hisashi Kasuya","Hisashi Kasuya","Morgan's mixed Hodge structures and nonabelian Hodge structures","22 pages The paper have been shorten for journal submission purposes.
  Some contents in the previous version have been removed","Comm. Algebra 49 (2021), no. 6, 2655--2678","10.1080/00927872.2021.1880590",,"math.AG math.AT math.CV math.DG math.KT","http://arxiv.org/licenses/nonexclusive-distrib/1.0/","  We refine the Morgan's work on mixed Hodge structures on Sullivan's
$1$--minimal models by using non-abelian Hodge theory. As an application, we
give explicit representatives of real unipotent variations of mixed Hodge
structures over compact K""ahler manifolds.
","[{""version"":""v1"",""created"":""Tue, 11 Sep 2018 07:44:40 GMT""},{""version"":""v2"",""created"":""Tue, 10 May 2022 03:47:10 GMT""}]","2022-05-11"
"1809.03717","Ilkka T\""orm\""a","Ilkka T\""orm\""a","Countable Sofic Shifts with a Periodic Direction","24 pages, 8 figures",,,,"math.DS","http://arxiv.org/licenses/nonexclusive-distrib/1.0/","  As a variant of the equal entropy cover problem, we ask whether all
multidimensional sofic shifts with countably many configurations have SFT
covers with countably many configurations. We answer this question in the
negative by presenting explicit counterexamples. We formulate necessary
conditions for a vertically periodic shift space to have a countable SFT cover,
and prove that they are sufficient in a natural (but quite restricted) subclass
of shift spaces.
","[{""version"":""v1"",""created"":""Tue, 11 Sep 2018 07:45:47 GMT""}]","2018-09-12"
"1809.03718","Cyril Labb\'e","Cyril Labb\'e","The continuous Anderson hamiltonian in $d\le 3$","38 pages","J. Funct. Anal. 277, no. 9, (2019), 3187-3235","10.1016/j.jfa.2019.05.027",,"math.PR math-ph math.AP math.MP","http://arxiv.org/licenses/nonexclusive-distrib/1.0/","  We construct the continuous Anderson hamiltonian on $(-L,L)^d$ driven by a
white noise and endowed with either Dirichlet or periodic boundary conditions.
Our construction holds in any dimension $d\le 3$ and relies on the theory of
regularity structures: it yields a self-adjoint operator in
$L^2\big((-L,L)^d\big)$ with pure point spectrum. In $d\ge 2$, a
renormalisation of the operator by means of infinite constants is required to
compensate for ill-defined products involving functionals of the white noise.
We also obtain left tail estimates on the distributions of the eigenvalues: in
particular, for $d=3$ these estimates show that the eigenvalues do not have
exponential moments.
","[{""version"":""v1"",""created"":""Tue, 11 Sep 2018 07:53:47 GMT""},{""version"":""v2"",""created"":""Fri, 30 Aug 2019 08:20:05 GMT""}]","2019-09-02"
"1809.03719","Antonio Turco","A. Turco, E. Primiceri, M. Frigione, G. Maruccio, C. Malitesta","An innovative, fast and facile soft-template approach for the
  fabrication of porous PDMS for oil-water separation",,,"10.1039/C7TA06840A",,"physics.app-ph","http://arxiv.org/licenses/nonexclusive-distrib/1.0/","  Oil wastewater and spilled oil caused serious environmental pollution and
damage to public health in the last years. Therefore, considerable efforts are
made to develop sorbent materials able to separate oil from water with high
selectivity and sorption capacity. However most of them are low reusable, with
low volume absorption capacity and poor mechanical properties. Moreover, the
synthesis is time-consuming, complex and expensive limiting its practical
application in case of emergency. Here we propose an innovative approach for
the fabrication of porous PDMS starting from an inverse water-in-silicone
procedure able to selectively collect oil from water in few seconds. The
synthesis is dramatically faster than previous approaches, permitting the
fabrication of the material in few minutes independently from the dimension of
the sponges. The porous material evidenced a higher volume sorption capacity
with respect to other materials already proposed for oil sorption from water
and excellent mechanical and reusability properties.This innovative fast and
simple approach can be successful in case of emergency, as oil spill accidents,
permitting in situ fabrication of porous absorbents.
","[{""version"":""v1"",""created"":""Tue, 11 Sep 2018 08:05:03 GMT""}]","2018-09-12"
"1809.03720","Oleg Peil","Oleg E. Peil, Alexander Hampel, Claude Ederer and Antoine Georges","Mechanism and Control Parameters of the Coupled Structural and
  Metal-Insulator Transition in Nickelates","6 pages, 4 figures","Phys. Rev. B 99, 245127 (2019)","10.1103/PhysRevB.99.245127",,"cond-mat.str-el cond-mat.mtrl-sci","http://arxiv.org/licenses/nonexclusive-distrib/1.0/","  Rare-earth nickelates exhibit a remarkable metal-insulator transition
accompanied by a structural transition associated with a lattice `breathing'
mode. Using model considerations and first-principles calculations, we present
a theory of this phase transition, which reveals the key role of the coupling
between the electronic and lattice instabilities. We show that the transition
is driven by the proximity to an electronic disproportionation instability
which couples to the breathing mode, thus cooperatively driving the system into
the insulating state. This allows us to identify two key control parameters of
the transition: the susceptibility to electronic disproportionation and the
stiffness of the lattice mode. We show that our findings can be rationalized in
terms of a Landau theory involving two coupled order parameters, with general
implications for transition-metal oxides.
","[{""version"":""v1"",""created"":""Tue, 11 Sep 2018 08:07:12 GMT""},{""version"":""v2"",""created"":""Tue, 12 Feb 2019 13:06:50 GMT""}]","2019-06-19"
"1809.03721","Seungjoon Yang","Jinhyeok Jang, Hyunjoong Cho, Jaehong Kim, Jaeyeon Lee, and Seungjoon
  Yang","Deep Asymmetric Networks with a Set of Node-wise Variant Activation
  Functions",,,,,"cs.LG cs.CV cs.NE eess.SP stat.ML","http://arxiv.org/licenses/nonexclusive-distrib/1.0/","  This work presents deep asymmetric networks with a set of node-wise variant
activation functions. The nodes' sensitivities are affected by activation
function selections such that the nodes with smaller indices become
increasingly more sensitive. As a result, features learned by the nodes are
sorted by the node indices in the order of their importance. Asymmetric
networks not only learn input features but also the importance of those
features. Nodes of lesser importance in asymmetric networks can be pruned to
reduce the complexity of the networks, and the pruned networks can be retrained
without incurring performance losses. We validate the feature-sorting property
using both shallow and deep asymmetric networks as well as deep asymmetric
networks transferred from famous networks.
","[{""version"":""v1"",""created"":""Tue, 11 Sep 2018 08:09:25 GMT""},{""version"":""v2"",""created"":""Fri, 17 May 2019 07:24:15 GMT""}]","2019-05-20"
"1809.03722","Sylvain Ribault","Sylvain Ribault","On 2d CFTs that interpolate between minimal models","30 pages, v3: restructuring and clarifications, in particular in the
  introduction","SciPost Phys. 6, 075 (2019)","10.21468/SciPostPhys.6.6.075",,"hep-th","http://creativecommons.org/licenses/by/4.0/","  We investigate exactly solvable two-dimensional conformal field theories that
exist at generic values of the central charge, and that interpolate between
A-series or D-series minimal models. When the central charge becomes rational,
correlation functions of these CFTs may tend to correlation functions of
minimal models, or diverge, or have finite limits which can be logarithmic.
These results are based on analytic relations between four-point structure
constants and residues of conformal blocks.
","[{""version"":""v1"",""created"":""Tue, 11 Sep 2018 08:12:36 GMT""},{""version"":""v2"",""created"":""Tue, 4 Dec 2018 14:58:37 GMT""},{""version"":""v3"",""created"":""Tue, 28 May 2019 13:44:31 GMT""}]","2019-06-26"
"1809.03723","Joshua Brown","Joshua Brown, Terry Bossomaier, Lionel Barnett","Information Flow in Finite Flocks","10 pages, 6 figures, 1 ancillary file (supplemental materials)",,,,"cond-mat.stat-mech","http://arxiv.org/licenses/nonexclusive-distrib/1.0/","  We simulate the canonical Vicsek model and estimate the flow of information
as a function of noise (the variability in the extent to which each animal
aligns with its neighbours). We show that the global transfer entropy for
finite flocks not only fails to peak near the phase transition, as demonstrated
for the canonical 2D Ising model, but remains constant from the transition to
very low noise values. This provides a foundation for future study regarding
information flow in more complex models and real-world flocking data.
","[{""version"":""v1"",""created"":""Tue, 11 Sep 2018 08:17:24 GMT""}]","2018-09-12"
"1809.03724","Francesco Malandrino","Senay Semu Tadesse and Carla Fabiana Chiasserini and Francesco
  Malandrino","Characterizing the Power Cost of Virtualization Environments",,,,,"cs.NI","http://arxiv.org/licenses/nonexclusive-distrib/1.0/","  Virtualization is a key building block of next-generation mobile networks. It
can be implemented through two main approaches: traditional virtual machines
and lighter-weight containers. Our objective in this paper is to compare these
approaches and study the power consumption they are associated with. To this
end, we perform a large set of real-world measurements, using both synthetic
workloads and real-world applications, and use them to model the relationship
between the resource usage of the hosted application and the power consumption
of both virtual machines and containers hosting it. We find that containers
incur substantially lower power consumption than virtual machines, and that
such consumption increases more slowly with the application load.
","[{""version"":""v1"",""created"":""Tue, 11 Sep 2018 08:17:40 GMT""}]","2018-09-12"
"1809.03725","Qingye Jiang","Qingye Jiang, Young Choon Lee, Joseph G. Davis, Ablert Y. Zomaya","Diversity, Productivity, and Growth of Open Source Developer Communities","10 pages, 6 figures",,,,"cs.SE","http://arxiv.org/licenses/nonexclusive-distrib/1.0/","  The open source development model has become a paradigm shift from
traditional in-house/closed-source software development model, with many
successes. Traditionally, open source projects were characterized essentially
by their individual volunteer developers. Such tradition has changed
significantly with the participation of many organizations in particular.
However, there exists a knowledge gap concerning how open source developer
communities evolve. In this paper, we present some observations on open source
developer communities. In particular, we analyze git repositories of 20
well-known open source projects, with over 3 million commit activities in
total. The analysis has been carried out in three respects, productivity,
diversity and growth using the Spearman's rank correlation coefficient,
diversity index and the Gompertz/logistic curves, respectively. We find out
that (a) the Spearman's rank correlation coefficient between active
contributors and commit activities reveals how changes in the size of the
developer community impacts the productivity of the community; (b) the
diversity index of an open source developer community reveals the structure of
the community; and (c) the growth of open source developer communities can be
described using different phases of growth curves as in many organic matters.
","[{""version"":""v1"",""created"":""Tue, 11 Sep 2018 08:17:53 GMT""}]","2018-09-12"
"1809.03726","Shubin Fu","Shubin Fu and Eric T. Chung","Constraint Energy Minimizing Generalized Multiscale Finite Element
  Method for high-contrast linear elasticity problem",,,,,"math.NA","http://arxiv.org/licenses/nonexclusive-distrib/1.0/","  In this paper, we consider the offline and online Constraint Energy
Minimizing Generalized Mul- tiscale Finite Element Method (CEM-GMsFEM) for
high-contrast linear elasticity problem. Offline basis construction starts with
an auxiliary multiscale space by solving local spectral problems. We select
eigenfunctions that correspond to a few small eigenvalues to form the auxiliary
space. Using the auxiliary space, we solve a constraint energy minimization
problem to construct offline multiscale spaces. The minimization problem is
defined in the oversampling domain, which is larger than the target coarse
block. To get a good approximation space, the oversampling domain should be
large enough. We also propose a relaxed minimization problem to construct
multiscale basis functions, which will yield more accurate and robust solution.
To take into account the influence of input pa- rameters, such as source terms,
we propose the construction of online multiscale basis and an adaptive
enrichment algorithm. We provide extensive numerical experiments on 2D and 3D
models to show the performance of the proposed method.
","[{""version"":""v1"",""created"":""Tue, 11 Sep 2018 08:20:22 GMT""}]","2018-09-12"
"1809.03727","Alexander Davis","Alex O.C. Davis, Valerian Thiel, Brian J. Smith","Measuring the quantum state of a photon pair entangled in frequency and
  time",,,,,"quant-ph","http://arxiv.org/licenses/nonexclusive-distrib/1.0/","  We present a technique to completely characterise the spectral-temporal wave
function of a broadband photon pair using spectral-shearing interferometry. Our
method is fully self-referencing and is generalisable across a wide range of
wavelengths. To demonstrate, we generate an entangled photon pair with
controllable time-frequency entanglement and perform a full reconstruction.
These results allow previously unobservable features of quantum states to be
measured and utilised for the first time. We foresee this will unlock new
opportunities in high-dimensional quantum technology, enabling the development
of novel ways of generating and interacting with quantum systems.
","[{""version"":""v1"",""created"":""Tue, 11 Sep 2018 08:20:28 GMT""}]","2018-09-12"
"1809.03728","Riccardo Frisenda Dr.","Riccardo Frisenda, Aday J Molina-Mendoza, Thomas Mueller, Andres
  Castellanos-Gomez, Herre SJ van der Zant","Atomically thin p-n junctions based on two-dimensional materials","Review, 34 pages, 11 figures, 4 tables","Chemical Society Reviews 47 (2018) 3339-3358","10.1039/C7CS00880E",,"cond-mat.mes-hall cond-mat.mtrl-sci","http://arxiv.org/licenses/nonexclusive-distrib/1.0/","  Recent research in two-dimensional (2D) materials has boosted a renovated
interest in the p-n junction, one of the oldest electrical components which can
be used in electronics and optoelectronics. 2D materials offer remarkable
flexibility to design novel p-n junction device architectures, not possible
with conventional bulk semiconductors. In this Review we thoroughly describe
the different 2D p-n junction geometries studied so far, focusing on vertical
(out-of-plane) and lateral (in-plane) 2D junctions and on mixed-dimensional
junctions. We discuss the assembly methods developed to fabricate 2D p-n
junctions making a distinction between top-down and bottom-up approaches. We
also revise the literature studying the different applications of these
atomically thin p-n junctions in electronic and optoelectronic devices. We
discuss experiments on 2D p-n junctions used as current rectifiers,
photodetectors, solar cells and light emitting devices. The important
electronics and optoelectronics parameters of the discussed devices are listed
in a table to facilitate their comparison. We conclude the Review with a
critical discussion about the future outlook and challenges of this incipient
research field.
","[{""version"":""v1"",""created"":""Tue, 11 Sep 2018 08:20:37 GMT""}]","2018-09-12"
"1809.03729","Zachary Chase","Zachary Chase","The Maximum Number of Three Term Arithmetic Progressions, and Triangles
  in Cayley Graphs","13 pages",,,,"math.CO math.NT","http://arxiv.org/licenses/nonexclusive-distrib/1.0/","  Let $G$ be a finite Abelian group. For a subset $S \subseteq G$, let $T_3(S)$
denote the number of length three arithemtic progressions in $S$ and Prob[$S$]
$= \frac{1}{|S|^2}\sum_{x,y \in S} 1_S(x+y)$. For any $q \ge 1$ and $\alpha \in
[0,1]$, and any $S \subseteq G$ with $|S| = \frac{|G|}{q+\alpha}$, we show
$\frac{T_3(S)}{|S|^2}$ and Prob[$S$] are bounded above by
$\max\left(\frac{q^2-\alpha q+\alpha^2}{q^2},\frac{q^2+2\alpha
q+4\alpha^2-6\alpha+3}{(q+1)^2},\gamma_0\right)$, where $\gamma_0 < 1$ is an
absolute constant. As a consequence, we verify a graph theoretic conjecture of
Gan, Loh, and Sudakov for Cayley graphs.
","[{""version"":""v1"",""created"":""Tue, 11 Sep 2018 08:21:24 GMT""}]","2018-09-12"
"1809.03730","Matthew Agnew","Matthew T. Agnew, Sarah T. Maddison, Jonathan Horner","Prospecting for exo-Earths in multiple planet systems with a gas giant","20 pages, 12 figures, 6 tables",,"10.1093/mnras/sty2509",,"astro-ph.EP","http://arxiv.org/licenses/nonexclusive-distrib/1.0/","  In this work, we hunt for the best places to find exo-Earths in the currently
known exoplanet population. While it is still unclear whether Jupiter had a
beneficial or detrimental effect on the creation of the right environment for a
habitable Earth to develop, we focus on the 51 multiple planet systems that
have at least one Jupiter-like planet and aim to identify which would be good
candidates to host an exo-Earth. We conduct a series of numerical simulations
to identify dynamically stable regions of the habitable zone of the multiple
exoplanet systems capable of hosting an Earth-mass planet. We produce a
candidate list of 16 systems that could host such a stable exo-Earth in their
habitable zone, and for which the induced radial velocity signal of a
hypothetical one, two or four Earth-mass planet on the host star would be
detectable with the ESPRESSO spectrograph. We find that whilst the
gravitational interactions with the massive planet nearest the habitable zone
are critical in determining stability, the secular resonant interactions
between multiple planets can also have a dramatic influence on the overall
stability of the habitable zone.
","[{""version"":""v1"",""created"":""Tue, 11 Sep 2018 08:22:20 GMT""}]","2018-09-26"
"1809.03731","Sergio L\'opez-Ure\~na","Rosa Donat and Sergio L\'opez-Ure\~na","Nonlinear stationary subdivision schemes that reproduce trigonometric
  functions",,,,,"math.NA","http://arxiv.org/licenses/nonexclusive-distrib/1.0/","  In this paper we define a family of nonlinear, stationary, interpolatory
subdivision schemes with the capability of reproducing conic shapes including
polynomials upto second order. Linear, non-stationary, subdivision schemes do
also achieve this goal, but different conic sections require different
refinement rules to guarantee exact reproduction. On the other hand, with our
construction, exact reproduction of different conic shapes can be achieved
using exactly the same nonlinear scheme. Convergence, stability, approximation
and shape preservation properties of the new schemes are analyzed. In addition,
the conditions to obtain $\mathcal{C}^1$ limit functions are also studied.
","[{""version"":""v1"",""created"":""Tue, 11 Sep 2018 08:24:41 GMT""}]","2018-09-12"
"1809.03732","Jos\'e Manuel Aburto","Adam Lenart, Jos\'e Manuel Aburto, Anders Stockmarr, James W. Vaupel","The human longevity record may hold for decades","6 pages",,,,"q-bio.PE","http://arxiv.org/licenses/nonexclusive-distrib/1.0/","  Since 1990 Jeanne Louise Calment has held the record for human longevity. She
was born on 21 February 1875, became the longest-lived human on 12 May 1990
when she was 115.21 and died on 4 August 1997 at age 122.45 years. In this
chapter, we use data available on 25 September 2017 on people who reached age
110, supercentenarians, to address the following questions: 1. How likely is it
that a person has reached age 122.45? 2. How unlikely is it that Calment's
record has not yet been broken? 3. How soon might it be broken? Assuming a
constant annual probability of death of 50% after age 110, we found that the
probability that a person who survived to age 110 would have lived to 122.45 by
25 September 2017 is 17.1%. Furthermore, we calculated that there was only a
20.3% chance that Calment's record would have been broken after 1997 but before
2017. Finally, we estimated that there is less than a 50% chance that someone
will surpass Calment's lifespan before 2045. Jeanne Louise Calment's record is
exceptional but not impossible. It does not provide evidence that her lifespan
is an upper limit to human lifespans.
","[{""version"":""v1"",""created"":""Tue, 11 Sep 2018 08:26:07 GMT""}]","2018-09-12"
"1809.03733","Elyar Zavvari","Elyar Zavary, Pouya Badri, Mahdi Sojoodi","Consensus of a class of nonlinear fractional-order multi-agent systems
  via dynamic output feedback controller","25 pages, 10 figures. Transactions of the Institute of Measurement
  and Control. October 2021",,"10.1177/01423312211049936",,"math.OC cs.NA eess.SP math.NA","http://arxiv.org/licenses/nonexclusive-distrib/1.0/","  This paper addresses the consensus of a class of uncertain nonlinear
fractional-order multi-agent systems (FOMAS). First a fractional non-fragile
dynamic output feedback controller is put forward via the output measurements
of neighboring agents, then appropriate state transformation reduced the
consensus problem to a stability one. A sufficient condition based on direct
Lyapunov approach, for the robust asymptotic stability of the transformed
system and subsequently for the consensus of the main system is presented.
Additionally, utilizing S-procedure and Schur complement, the systematic
stabilization design algorithm is proposed for fractional-order system with and
without nonlinear term. The results are formulated as an optimization problem
with linear matrix inequality constraints. Simulation results are given to
verify the effectiveness of the theoretical results.
","[{""version"":""v1"",""created"":""Tue, 11 Sep 2018 08:26:21 GMT""},{""version"":""v2"",""created"":""Tue, 4 Jun 2019 13:36:08 GMT""},{""version"":""v3"",""created"":""Sun, 28 Nov 2021 18:32:09 GMT""}]","2021-12-14"
