"1805.02016","Matthew J. Stott","Matthew J. Stott, David J. E. Marsh","Black Hole Spin Constraints on the Mass Spectrum and Number of
  Axion-like Fields","30 Pages, 18 Figures","Phys. Rev. D 98, 083006 (2018)","10.1103/PhysRevD.98.083006","KCL-PH-TH/2018-17","hep-ph astro-ph.HE gr-qc hep-th","http://arxiv.org/licenses/nonexclusive-distrib/1.0/","  Astrophysical observations of spinning BHs, which span $ 5M_\odot\lesssim
M_{\rm BH}\lesssim 5\times 10^8 M_\odot$, can be used to exclude the existence
of certain massive bosons via the superradiance phenomenon. In this work, we
explore for the first time how these measurements can be used to constrain
properties of statistical distributions for the masses of multiple bosonic
fields. Quite generally, our methodology excludes $N_{\rm ax}\gtrsim 30$ scalar
fields with a range of mass distribution widths and central values spanning
many orders of magnitude. We demonstrate this for the specific example of
axions in string theory and M-theory, where the mass distributions in certain
cases take universal forms. We place upper bounds on $N_{\rm ax}$ for certain
scenarios of interest realised approximately as mass distributions in M-theory,
including the QCD axion, grand unified theories, and fuzzy dark matter.
","[{""version"":""v1"",""created"":""Sat, 5 May 2018 07:21:22 GMT""},{""version"":""v2"",""created"":""Thu, 7 Jun 2018 14:34:50 GMT""}]","2018-10-17"
"1805.02017","Philipp Maass","Matthias Wolff, Pedro G. Lind, and Philipp Maass","Power grid stability under perturbation of single nodes: Effects of
  heterogeneity and internal nodes","19 pages, 9 figures",,"10.1063/1.5040689",,"nlin.AO","http://arxiv.org/licenses/nonexclusive-distrib/1.0/","  Non-linear equations describing the time evolution of frequencies and
voltages in power grids exhibit fixed points of stable grid operation. The
dynamical behaviour after perturbations around these fixed points can be used
to characterise the stability of the grid. We investigate both probabilities of
return to a fixed point and times needed for this return after perturbation of
single nodes. Our analysis is based on an IEEE test grid and the second-order
swing equations for voltage phase angles $\theta_j$ at nodes $j$ in the
synchronous machine model. The perturbations cover all possible changes
$\Delta\theta$ of voltage angles and a wide range of frequency deviations in a
range $\Delta f=\pm1$~Hz around the common frequency $\omega=2\pi
f=\dot\theta_j$ in a synchronous fixed point state. Extensive numerical
calculations are carried out to determine, for all node pairs $(j,k)$, the
return times $t_{jk}(\Delta\theta,\Delta \omega)$ of node $k$ after a
perturbation of node $j$. We find that for strong perturbations of some nodes,
the grid does not return to its synchronous state. If returning to the fixed
point, the times needed for the return are strongly different for different
disturbed nodes and can reach values up to 20 seconds and more. When
homogenising transmission line and node properties, the grid always returns to
a synchronous state for the considered perturbations, and the longest return
times have a value of about 4 seconds for all nodes. The neglect of reactances
between points of power generation (internal nodes) and injection (terminal
nodes) leads to an underestimation of return probabilities.
","[{""version"":""v1"",""created"":""Sat, 5 May 2018 07:23:53 GMT""}]","2018-11-14"
"1805.02018","Ran Yang","Xijun Hu, Li Wu, Ran Yang","Morse Index Theorem of Lagrangian Systems and Stability of Brake Orbit","24 pages",,,,"math.DS","http://arxiv.org/licenses/nonexclusive-distrib/1.0/","  In this paper, we prove Morse index theorem of Lagrangian system with any
self-adjoint boundary conditions. Based on it, we give some nontrivial
estimation on the difference of Morse indices. As an application, we get a new
criterion for the stability problem of brake periodic orbit.
","[{""version"":""v1"",""created"":""Sat, 5 May 2018 07:38:06 GMT""}]","2018-05-08"
"1805.02019","Sergei Mukhin I","J. A. M. van Ostaay, S. I. Mukhin","Phonon-kink scattering effect on the low temperature thermal transport
  in solids","12 pages, 3 figures, A.A.Abrikosov 90-th anniversary issue","Low Temperature Physics (Kharkov), 2018,v.44, No.6, pp. 747-757","10.1063/1.5037562",,"cond-mat.str-el","http://arxiv.org/licenses/nonexclusive-distrib/1.0/","  We consider contribution to the phonon scattering, in the temperature range
of 1K, by the dislocation kinks pinned in the random stress fields in a
crystal. The effect of electron-kink scattering on the thermal transport in the
normal metals was considered much earlier \cite{Muk86}. The phonon thermal
transport anomaly at low temperature was demonstrated by experiments in the
deformed (bent) superconducting lead samples \cite{Mez79} and in helium-4
crystals \cite{Mez82, Mez84} and was ascribed to the dislocation dynamics.
Previously, we had discussed semi-qualitatively the phonon-kink scattering
effects on the thermal conductivity of insulating crystals in a series of
papers \cite{mezmuk, ostmukmez}. In this work it is demonstrated explicitly
that exponent of the power low in the temperature dependence of the phonon
thermal conductivity depends, due to kinks, on the distribution of the random
elastic stresses in the crystal, that pin the kinks motion along the
dislocation lines. We found that one of the random matrix distributions of the
well known Wigner-Dyson theory is most suitable to fit the lead samples
experimental data \cite{Mez79}. We also demonstrate that depending on the
distribution function of the oscillation frequencies of the kinks, the power
low temperature dependences of the phonon thermal conductivity, in principle,
may possess exponents in the range of $2\div 5$.
","[{""version"":""v1"",""created"":""Sat, 5 May 2018 07:43:55 GMT""}]","2018-08-01"
"1805.02020","Wu Yantong","YanTong Wu, Yang Liu","Position Estimation of Camera Based on Unsupervised Learning","6 pages,5 figures,1 table",,,,"cs.CV","http://arxiv.org/licenses/nonexclusive-distrib/1.0/","  It is an exciting task to recover the scene's 3d-structure and camera pose
from the video sequence. Most of the current solutions divide it into two
parts, monocular depth recovery and camera pose estimation. The monocular depth
recovery is often studied as an independent part, and a better depth estimation
is used to solve the pose. While camera pose is still estimated by traditional
SLAM (Simultaneous Localization And Mapping) methods in most cases. The use of
unsupervised method for monocular depth recovery and pose estimation has
benefited from the study of [1] and achieved good results. In this paper, we
improve the method of [1]. Our emphasis is laid on the improvement of the idea
and related theory, introducing a more reasonable inter frame constraints and
finally synthesize the camera trajectory with inter frame pose estimation in
the unified world coordinate system. And our results get better performance.
","[{""version"":""v1"",""created"":""Sat, 5 May 2018 08:35:23 GMT""}]","2018-05-24"
"1805.02021","Andrzej Stupakiewicz","A. Stupakiewicz, K. Szerenos, M. D. Davydova, K. A. Zvezdin, A. K.
  Zvezdin, A. Kirilyuk and A. V. Kimel","Selection Rules for All-Optical Magnetic Recording in Iron Garnet",,,"10.1038/s41467-019-08458-w",,"cond-mat.mtrl-sci","http://arxiv.org/licenses/nonexclusive-distrib/1.0/","  Finding an electronic transition a subtle excitation of which can launch
dramatic changes of electric, optical or magnetic properties of media is one of
the long-standing dreams in the field of photo-induced phase transitions [1-5].
Therefore the discovery of the magnetization switching only by a femtosecond
laser pulse [6-10] triggered intense discussions about mechanisms responsible
for these laser-induced changes. Here we report the experimentally revealed
selection rules on polarization and wavelengths of ultrafast photo-magnetic
recording in Co-doped garnet film and identify the workspace of the parameters
(magnetic damping, wavelength and polarization of light) allowing this effect.
The all-optical magnetic switching under both single pulse and multiple-pulse
sequences can be achieved at room temperature, in narrow spectral ranges with
light polarized either along <110> or <100> crystallographic axes of the
garnet. The revealed selection rules indicate that the excitations responsible
for the coupling of light to spins are d-electron transitions in octahedral and
tetrahedral Co-sublattices, respectively.
","[{""version"":""v1"",""created"":""Sat, 5 May 2018 08:42:49 GMT""}]","2019-03-06"
"1805.02022","Kalpant Pathak","Kalpant Pathak and Adrish Banerjee","Optimal Harvest-or-Transmit Strategy for Energy Harvesting Underlay
  Cognitive Radio Network","Accepted in International Conference on Signal Processing and
  Communications (SPCOM)",,,,"cs.IT math.IT","http://arxiv.org/licenses/nonexclusive-distrib/1.0/","  An underlay cognitive radio network with energy harvesting is considered
which operates in slotted fashion. The primary user (PU) transmits with a
constant power in each slot, while the secondary user (SU) either harvests
energy from primary's transmission or transmits its data. We propose an optimal
offline harvest-or-transmit strategy where in each slot, SU takes a decision
whether to harvest energy or transmit its data limiting interference at the
primary receiver. We aim to maximize the achievable rate of SU under energy
causality and interference constraints. The optimization problem is formulated
as a mixed integer non-linear program and the optimal harvest-or-transmit
policy is obtained using generalized Benders decomposition algorithm. Through
simulations, we analyze the effects of various system parameters and
interference constraint at the primary receiver on the optimal policy.
","[{""version"":""v1"",""created"":""Sat, 5 May 2018 08:44:12 GMT""}]","2018-05-08"
"1805.02023","Jie Yang","Yue Zhang and Jie Yang","Chinese NER Using Lattice LSTM","Accepted at ACL 2018 as Long paper",,,,"cs.CL","http://arxiv.org/licenses/nonexclusive-distrib/1.0/","  We investigate a lattice-structured LSTM model for Chinese NER, which encodes
a sequence of input characters as well as all potential words that match a
lexicon. Compared with character-based methods, our model explicitly leverages
word and word sequence information. Compared with word-based methods, lattice
LSTM does not suffer from segmentation errors. Gated recurrent cells allow our
model to choose the most relevant characters and words from a sentence for
better NER results. Experiments on various datasets show that lattice LSTM
outperforms both word-based and character-based LSTM baselines, achieving the
best results.
","[{""version"":""v1"",""created"":""Sat, 5 May 2018 08:48:32 GMT""},{""version"":""v2"",""created"":""Tue, 15 May 2018 15:34:28 GMT""},{""version"":""v3"",""created"":""Thu, 31 May 2018 13:10:52 GMT""},{""version"":""v4"",""created"":""Thu, 5 Jul 2018 16:02:59 GMT""}]","2018-07-06"
"1805.02024","Sergio Sanchez Cruz","Sergio S\'anchez Cruz (on behalf of the ATLAS and CMS Collaborations)","Associated top production in ATLAS and CMS",,,,"CMS CR-2018/033","hep-ex","http://arxiv.org/licenses/nonexclusive-distrib/1.0/","  A set of measurements of top quark pair and single top quark production in
association with standard model (SM) bosons performed by the CMS and ATLAS
Collaborations is presented. The consistency of these results among themselves
and with the SM prediction is discussed. The latest results on four top quark
production are also shown.
","[{""version"":""v1"",""created"":""Sat, 5 May 2018 09:04:47 GMT""}]","2018-07-01"
"1805.02025","Zhi-Long Han","Zhi-Long Han, Weijian Wang","$Z'$ Portal Dark Matter in $B-L$ Scotogenic Dirac Model","28 pages, 15 figures",,"10.1140/epjc/s10052-018-6308-9",,"hep-ph","http://arxiv.org/licenses/nonexclusive-distrib/1.0/","  In this paper, we perform a detail analysis on the phenomenology of $Z'$
portal scalar and Dirac fermion dark matter in $B-L$ scotogenic Dirac model.
Unconventional $B-L$ charge $Q$ is assigned to the right-handed neutrino
$\nu_R$ in order to realise scotogenic Dirac neutrino mass at one-loop level,
where three typical value $Q=-\frac{1}{4},-4,\frac{3}{2}$ are chosen to
illustrate. Observational properties involving dilepton signature at LHC,
relativistic degrees of freedom $N_\text{eff}$, dark matter relic density,
direct and indirect detections are comprehensively studied. Combined results of
these observables for the benchmark scenarios imply that the resonance region
$M_\text{DM}\sim M_{Z'}/2$ is the viable parameter space. Focusing on the
resonance region, a scanning for TeV-scale dark matter is also performed to
obtain current allowed and future prospective parameter space.
","[{""version"":""v1"",""created"":""Sat, 5 May 2018 09:10:55 GMT""}]","2018-11-14"
"1805.02026","Fotis Iliopoulos","Dimitris Achlioptas, Fotis Iliopoulos, Alistair Sinclair","Beyond the Lovasz Local Lemma: Point to Set Correlations and Their
  Algorithmic Applications",,,,,"cs.DM cs.DS math.CO math.PR","http://arxiv.org/licenses/nonexclusive-distrib/1.0/","  Following the groundbreaking algorithm of Moser and Tardos for the Lovasz
Local Lemma (LLL), there has been a plethora of results analyzing local search
algorithms for various constraint satisfaction problems. The algorithms
considered fall into two broad categories: resampling algorithms, analyzed via
different algorithmic LLL conditions; and backtracking algorithms, analyzed via
entropy compression arguments. This paper introduces a new convergence
condition that seamlessly handles resampling, backtracking, and hybrid
algorithms, i.e., algorithms that perform both resampling and backtracking
steps. Unlike all past LLL work, our condition replaces the notion of a
dependency or causality graph by quantifying point-to-set correlations between
bad events. As a result, our condition simultaneously: (i)~captures the most
general algorithmic LLL condition known as a special case; (ii)~significantly
simplifies the analysis of entropy compression applications; (iii)~relates
backtracking algorithms, which are conceptually very different from resampling
algorithms, to the LLL; and most importantly (iv)~allows for the analysis of
hybrid algorithms, which were outside the scope of previous techniques. We give
several applications of our condition, including a new hybrid vertex coloring
algorithm that extends the recent breakthrough result of Molloy for coloring
triangle-free graphs to arbitrary graphs.
","[{""version"":""v1"",""created"":""Sat, 5 May 2018 09:15:00 GMT""},{""version"":""v2"",""created"":""Tue, 13 Nov 2018 01:56:00 GMT""},{""version"":""v3"",""created"":""Fri, 2 Aug 2019 20:03:20 GMT""},{""version"":""v4"",""created"":""Wed, 19 Aug 2020 01:24:53 GMT""}]","2020-08-20"
"1805.02027","Daniel Seipt","D. Seipt, D. Del Sorbo, C. P. Ridgers, and A. G. R. Thomas","Theory of Radiative Electron Polarization in Strong Laser Fields","21 pages, 8 figures","Phys. Rev. A 98, 023417 (2018)","10.1103/PhysRevA.98.023417",,"hep-ph physics.atom-ph physics.plasm-ph","http://arxiv.org/licenses/nonexclusive-distrib/1.0/","  Radiative polarization of electrons and positrons through the Sokolov-Ternov
effect is important for applications in high-energy physics. Radiative
spin-polarization is a manifestation of quantum radiation reaction affecting
the spin-dynamics of electrons. We recently proposed that an analogue of the
Sokolov-Ternov effect could occur in the strong electromagnetic fields of
ultra-high-intensity lasers, which would result in a build-up of
spin-polarization in femtoseconds. In this paper we develop a density matrix
formalism for describing beam polarization in strong electromagnetic fields. We
start by using the density matrix formalism to study spin-flips in non-linear
Compton scattering and its dependence on the initial polarization state of the
electrons. Numerical calculations show a radial polarization of the scattered
electron beam in a circularly polarized laser, and we find azimuthal
asymmetries in the polarization patterns for ultra-short laser pulses. A degree
of polarization approaching 9 % is achieved after emitting just a single
photon. We develop the theory by deriving a local constant crossed field
approximation (LCFA) for the polarization density matrix, which is a
generalization of the well known LCFA scattering rates. We find spin-dependent
expressions that may be included in electromagnetic charged-particle simulation
codes, such as particle-in-cell plasma simulation codes, using Monte-Carlo
modules. In particular, these expressions include the spin-flip rates for
arbitrary initial polarization of the electrons. The validity of the LCFA is
confirmed by explicit comparison with an exact QED calculation of electron
polarization in an ultrashort laser pulse.
","[{""version"":""v1"",""created"":""Sat, 5 May 2018 09:27:35 GMT""},{""version"":""v2"",""created"":""Mon, 20 Aug 2018 16:26:22 GMT""}]","2018-08-29"
"1805.02028","Torben Stolte","Torben Stolte, Tianyu Liao, Matthias Nee, Marcus Nolte, and Markus
  Maurer","Investigating Functional Redundancies in the Context of Vehicle
  Automation - A Trajectory Tracking Perspective","8 pages, 6 figures, 3 tables, presented at the 2018 21st
  International Conference on Intelligent Transportation Systems (ITSC), Maui,
  HI, USA",,"10.1109/ITSC.2018.8569243",,"cs.SY","http://arxiv.org/licenses/nonexclusive-distrib/1.0/","  Level 3+ automated driving implies highest safety demands for the entire
vehicle automation functionality. For the part of trajectory tracking,
functional redundancies among all available actuators provide an opportunity to
reduce safety requirements for single actuators. Yet, the exploitation of
functional redundancies must be well argued if employed in a safety concept as
physical limits can be reached. In this paper, we want to examine from a
trajectory tracking perspective whether such a concept can be used. For this,
we present a model predictive fault-tolerant trajectory tracking approach for
over-actuated vehicles featuring wheel individual all-wheel drive, brakes, and
steering. Applying this approach exemplarily demonstrates for a selected
reference trajectory that degradations such as missing or undesired wheel
torques as well as reduced steering dynamics can be compensated. Degradations
at the physical actuator limits lead to significant deviations from the
reference trajectory while small constant steering angles are partially
critical.
","[{""version"":""v1"",""created"":""Sat, 5 May 2018 09:32:15 GMT""},{""version"":""v2"",""created"":""Tue, 25 Dec 2018 23:35:06 GMT""}]","2018-12-27"
"1805.02029","Philipp Klos","P. Klos, S. K\""onig, H.-W. Hammer, J. E. Lynn, A. Schwenk","Signatures of few-body resonances in finite volume","13 pages, 10 figures, 2 tables, published version","Phys. Rev. C 98, 034004 (2018)","10.1103/PhysRevC.98.034004",,"nucl-th cond-mat.quant-gas hep-lat","http://arxiv.org/licenses/nonexclusive-distrib/1.0/","  We study systems of bosons and fermions in finite periodic boxes and show how
the existence and properties of few-body resonances can be extracted from
studying the volume dependence of the calculated energy spectra. Using a
plane-wave-based discrete variable representation to conveniently implement
periodic boundary conditions, we establish that avoided level crossings occur
in the spectra of up to four particles and can be linked to the existence of
multi-body resonances. To benchmark our method we use two-body calculations,
where resonance properties can be determined with other methods, as well as a
three-boson model interaction known to generate a three-boson resonance state.
Finding good agreement for these cases, we then predict three-body and
four-body resonances for models using a shifted Gaussian potential. Our results
establish few-body finite-volume calculations as a new tool to study few-body
resonances. In particular, the approach can be used to study few-neutron
systems, where such states have been conjectured to exist.
","[{""version"":""v1"",""created"":""Sat, 5 May 2018 09:35:30 GMT""},{""version"":""v2"",""created"":""Sat, 29 Sep 2018 15:08:22 GMT""}]","2018-10-03"
"1805.02030","Arthur Renaudineau","Arthur Renaudineau and Kristin Shaw","Bounding the Betti numbers of real hypersurfaces near the tropical limit","34 pages, 7 figures",,,,"math.AG","http://arxiv.org/licenses/nonexclusive-distrib/1.0/","  We prove a bound conjectured by Itenberg on the Betti numbers of real
algebraic hypersurfaces near non-singular tropical limits. These bounds are
given in terms of the Hodge numbers of the complexification. To prove the
conjecture we introduce a real variant of tropical homology and define a
filtration on the corresponding chain complex inspired by Kalinin's filtration.
The spectral sequence associated to this filtration converges to the homology
groups of the real algebraic variety and we show that the terms of the first
page are tropical homology groups with $\mathbb{Z}_2$-coefficients. The
dimensions of these homology groups correspond to the Hodge numbers of complex
projective hypersurfaces. The bounds on the Betti numbers of the real part
follow, as well as a criterion to obtain a maximal variety. We also generalise
a known formula relating the signature of the complex hypersurface and the
Euler characteristic of the real algebraic hypersurface, as well as Haas'
combinatorial criterion for the maximality of plane curves near the tropical
limit.
","[{""version"":""v1"",""created"":""Sat, 5 May 2018 09:37:37 GMT""},{""version"":""v2"",""created"":""Tue, 12 Nov 2019 22:20:25 GMT""}]","2019-11-14"
"1805.02031","Jen-Yu Liu","Jen-Yu Liu, Yi-Hsuan Yang, Shyh-Kang Jeng","Weakly-supervised Visual Instrument-playing Action Detection in Videos",,,,,"cs.MM cs.CV","http://arxiv.org/licenses/nonexclusive-distrib/1.0/","  Instrument playing is among the most common scenes in music-related videos,
which represent nowadays one of the largest sources of online videos. In order
to understand the instrument-playing scenes in the videos, it is important to
know what instruments are played, when they are played, and where the playing
actions occur in the scene. While audio-based recognition of instruments has
been widely studied, the visual aspect of the music instrument playing remains
largely unaddressed in the literature. One of the main obstacles is the
difficulty in collecting annotated data of the action locations for
training-based methods. To address this issue, we propose a weakly-supervised
framework to find when and where the instruments are played in the videos. We
propose to use two auxiliary models, a sound model and an object model, to
provide supervisions for training the instrument-playing action model. The
sound model provides temporal supervisions, while the object model provides
spatial supervisions. They together can simultaneously provide temporal and
spatial supervisions. The resulted model only needs to analyze the visual part
of a music video to deduce which, when and where instruments are played. We
found that the proposed method significantly improves the localization
accuracy. We evaluate the result of the proposed method temporally and
spatially on a small dataset (totally 5,400 frames) that we manually annotated.
","[{""version"":""v1"",""created"":""Sat, 5 May 2018 09:52:36 GMT""}]","2018-05-08"
"1805.02032","Adan Cabello","Zhen-Peng Xu, Ad\'an Cabello","Necessary and sufficient condition for contextuality from
  incompatibility","7 pages, 1 figure","Phys. Rev. A 99, 020103 (2019)","10.1103/PhysRevA.99.020103",,"quant-ph","http://arxiv.org/licenses/nonexclusive-distrib/1.0/","  Measurement incompatibility is the most basic resource that distinguishes
quantum from classical physics. Contextuality is the critical resource behind
the power of some models of quantum computation and is also a necessary
ingredient for many applications in quantum information. A fundamental problem
is thus identifying when incompatibility produces contextuality. Here, we show
that, given a structure of incompatibility characterized by a graph in which
nonadjacent vertices represent incompatible ideal measurements, the necessary
and sufficient condition for the existence of a quantum realization producing
contextuality is that this graph contains induced cycles of size larger than
three.
","[{""version"":""v1"",""created"":""Sat, 5 May 2018 10:05:28 GMT""},{""version"":""v2"",""created"":""Tue, 12 Feb 2019 17:22:00 GMT""}]","2019-02-20"
