"1805.01966","Donghyuk Lee","Yoongu Kim, Vivek Seshadri, Donghyuk Lee, Jamie Liu, Onur Mutlu","Exploiting the DRAM Microarchitecture to Increase Memory-Level
  Parallelism",,,,,"cs.AR","http://arxiv.org/licenses/nonexclusive-distrib/1.0/","  This paper summarizes the idea of Subarray-Level Parallelism (SALP) in DRAM,
which was published in ISCA 2012, and examines the work's significance and
future potential. Modern DRAMs have multiple banks to serve multiple memory
requests in parallel. However, when two requests go to the same bank, they have
to be served serially, exacerbating the high latency of on-chip memory. Adding
more banks to the system to mitigate this problem incurs high system cost. Our
goal in this work is to achieve the benefits of increasing the number of banks
with a low-cost approach. To this end, we propose three new mechanisms, SALP-1,
SALP-2, and MASA (Multitude of Activated Subarrays), to reduce the
serialization of different requests that go to the same bank. The key
observation exploited by our mechanisms is that a modern DRAM bank is
implemented as a collection of subarrays that operate largely independently
while sharing few global peripheral structures.
  Our three proposed mechanisms mitigate the negative impact of bank
serialization by overlapping different components of the bank access latencies
of multiple requests that go to different subarrays within the same bank.
SALP-1 requires no changes to the existing DRAM structure, and needs to only
reinterpret some of the existing DRAM timing parameters. SALP-2 and MASA
require only modest changes (< 0.15% area overhead) to the DRAM peripheral
structures, which are much less design constrained than the DRAM core. Our
evaluations show that SALP-1, SALP-2 and MASA significantly improve performance
for both single-core systems (7%/13%/17%) and multi-core systems (15%/16%/20%),
averaged across a wide range of workloads. We also demonstrate that our
mechanisms can be combined with application-aware memory request scheduling in
multicore systems to further improve performance and fairness.
","[{""version"":""v1"",""created"":""Fri, 4 May 2018 23:50:13 GMT""}]","2018-05-08"
"1805.01967","Yoshihiko Susuki","Yoshihiko Susuki, Ryo Hamasaki, Atsushi Ishigame","Estimation of Power System Inertia Using Nonlinear Koopman Modes","10 pages, 4 figures, conference","Proc. 2018 IEEE Power & Energy Society General Meeting (PESGM)","10.1109/PESGM.2018.8586007",,"eess.SP cs.SY math.DS math.OC","http://arxiv.org/licenses/nonexclusive-distrib/1.0/","  We report a new approach to estimating power system inertia directly from
time-series data on power system dynamics. The approach is based on the
so-called Koopman Mode Decomposition (KMD) of such dynamic data, which is a
nonlinear generalization of linear modal decomposition through spectral
analysis of the Koopman operator for nonlinear dynamical systems. The KMD-based
approach is thus applicable to dynamic data that evolve in nonlinear regime of
power system characteristics. Its effectiveness is numerically evaluated with
transient stability simulations of the IEEE New England test system.
","[{""version"":""v1"",""created"":""Fri, 4 May 2018 23:59:01 GMT""}]","2020-10-01"
"1805.01968","Kamran Javid Mr","Kamran Javid, Yvette C. Perrott, Michael P. Hobson, Malak Olamaie,
  Clare Rumsey, and Richard D. E. Saunders","Comparison of physical and observational galaxy cluster modelling","12 pages, 6 figures, 9 tables, 12 equations, MNRAS",,"10.17863/CAM.38865",,"astro-ph.CO","http://arxiv.org/licenses/nonexclusive-distrib/1.0/","  We present a comparison between three cluster models applied to data obtained
by the Arcminute Microkelvin Imager radio interferometer system. The physical
model (PM) parameterises a cluster in terms of its physical quantities to model
the dark matter and baryonic components of the cluster using NFW and GNFW
profiles respectively. The observational models (OM I and OM II) model only the
gas content of the cluster. The two OMs vary only in the priors they use in
Bayesian inference: OM I has a joint prior on angular radius $\theta$ and
integrated Comptonisation $Y$, derived from simulations, while OM II uses
separable priors on $\theta$ and $Y$ which are based on calculations of the
physical model. For the comparison we consider a sample of $54$ clusters which
are a subsample of the second Planck catalogue of Sunyaev-Zel'dovich sources.
We first compare the $Y$ estimates of the three models, and find that the PM
generally yields lower estimates relative to the OMs. We then compute the Earth
Mover's Distance between the $\theta$ - $Y$ posterior distributions obtained
from each model for each cluster, and find that the two models which are most
discrepant are PM and OM I. Finally, we compare the Bayesian evidence values
obtained from each model for each cluster. OM I generally provides the best fit
to the data but not at a statistically significant level, according to the
Jeffreys scale. The highest evidence ratio obtained is actually in favour of
the PM over OM I.
","[{""version"":""v1"",""created"":""Sat, 5 May 2018 00:01:09 GMT""},{""version"":""v2"",""created"":""Tue, 8 May 2018 11:36:45 GMT""},{""version"":""v3"",""created"":""Wed, 22 May 2019 13:46:22 GMT""},{""version"":""v4"",""created"":""Sun, 13 Oct 2019 18:49:33 GMT""},{""version"":""v5"",""created"":""Sun, 9 Feb 2020 20:55:43 GMT""}]","2020-02-11"
"1805.01969","Mohammad Javad Khojasteh","Mohammad Javad Khojasteh, Mojtaba Hedayatpour, Jorge Cortes, Massimo
  Franceschetti","Exploiting timing information in event-triggered stabilization of linear
  systems with disturbances",,,,,"cs.SY cs.IT math.IT math.OC","http://arxiv.org/licenses/nonexclusive-distrib/1.0/","  In the same way that subsequent pauses in spoken language are used to convey
information, it is also possible to transmit information in communication
networks not only by message content, but also with its timing. This paper
presents an event-triggering strategy that utilizes timing information by
transmitting in a state-dependent fashion. We consider the stabilization of a
continuous-time, time-invariant, linear plant over a digital communication
channel with bounded delay and subject to bounded plant disturbances and
establish two main results. On the one hand, we design an encoding-decoding
scheme that guarantees a sufficient information transmission rate for
stabilization. On the other hand, we determine a lower bound on the information
transmission rate necessary for stabilization by any control policy.
","[{""version"":""v1"",""created"":""Sat, 5 May 2018 00:07:53 GMT""},{""version"":""v2"",""created"":""Sat, 8 Sep 2018 08:54:10 GMT""},{""version"":""v3"",""created"":""Sun, 16 Sep 2018 23:28:20 GMT""},{""version"":""v4"",""created"":""Mon, 17 Jun 2019 20:06:15 GMT""},{""version"":""v5"",""created"":""Sun, 2 Feb 2020 21:10:35 GMT""},{""version"":""v6"",""created"":""Tue, 21 Jul 2020 20:25:00 GMT""}]","2020-07-23"
"1805.01970","Roberto Vega-Morales","Roberto Vega, Roberto Vega-Morales, Keping Xie","Light (and darkness) from a light hidden Higgs","references added, typos corrected, version to be published",,"10.1007/JHEP06(2018)137","UG-FT 327/18, CAFPE 197/18, SMU-HEP-18-08, FERMILAB-PUB-18-159-T","hep-ph hep-ex","http://arxiv.org/licenses/nonexclusive-distrib/1.0/","  We examine light diphoton signals from extended Higgs sectors possessing
(approximate) fermiophobia with Standard Model (SM) fermions as well as
custodial symmetry. This class of Higgs sectors can be realized in various
beyond the SM scenarios and is able to evade many experimental limits, even at
light masses, which are otherwise strongly constraining. Below the $WW$
threshold, the most robust probes of the neutral component are di and
multi-photon searches. Utilizing the dominant Drell-Yan Higgs pair production
mechanism and combining it with updated LHC diphoton data, we derive robust
upper bounds on the allowed branching ratio for masses between $45 - 160$ GeV.
Furthermore, masses $\lesssim 110$ GeV are ruled out if the coupling to photons
is dominated by $W$ boson loops. We then examine two simple ways to evade these
bounds via cancellations between different loop contributions or by introducing
decays into an invisible sector. This also opens up the possibility of future
LHC diphoton signals from a light hidden Higgs sector. As explicit
realizations, we consider the Georgi-Machacek (GM) and Supersymmetric GM (SGM)
models which contain custodial (degenerate) Higgs bosons with suppressed
couplings to SM fermions and, in the SGM model, a (neutralino) LSP. We also
breifly examine the recent $\sim 3\sigma$ CMS diphoton excess at $\sim 95$ GeV.
","[{""version"":""v1"",""created"":""Sat, 5 May 2018 00:11:46 GMT""},{""version"":""v2"",""created"":""Wed, 20 Jun 2018 13:45:03 GMT""}]","2018-08-01"
"1805.01971","Habib Karbasian","Aqdas Malik, Aditya Johri, Rajat Handa, Habib Karbasian and Hemant
  Purohit","#ILookLikeAnEngineer: Using Social Media Based Hashtag Activism
  Campaigns as a Lens to Better Understand Engineering Diversity Issues","17 pages, published in Collaborative Network for Engineering and
  Computing Diversity Conference 2018",,,,"cs.SI cs.CY","http://arxiv.org/licenses/nonexclusive-distrib/1.0/","  Each year, significant investment of time and resources is made to improve
diversity within engineering across a range of federal and state agencies,
private/not-for-profit organizations, and foundations. In spite of decades of
investments, efforts have not yielded desired returns - participation by
minorities continues to lag at a time when STEM workforce requirements are
increasing. In recent years a new stream of data has emerged - online social
networks, including Twitter, Facebook, and Instagram - that act as a key sensor
of social behavior and attitudes of the public. Almost 87% of the American
population now participates in some form of social media activity.
Consequently, social networking sites have become powerful indicators of social
action and social media data has shown significant promise for studying many
issues including public health communication, political campaign, humanitarian
crisis, and, activism. We argue that social media data can likewise be
leveraged to better understand and improve engineering diversity. As a case
study to illustrate the viability of the approach, we present findings from a
campaign, #ILookLikeAnEngineer (using Twitter data - 19,354 original tweets and
29,529 retweets), aimed at increasing gender diversity in the engineering
workplace. The campaign provided a continuous momentum to the overall effort to
increase diversity and novel ways of connecting with relevant audience. Our
analysis demonstrates that diversity initiatives related to STEM attract voices
from various entities including individuals, large corporations, media outlets,
and community interest groups.
","[{""version"":""v1"",""created"":""Sat, 5 May 2018 00:15:22 GMT""}]","2018-05-08"
"1805.01972","Chengcheng Li","Chengcheng Li, Zi Wang, Hairong Qi","Fast-converging Conditional Generative Adversarial Networks for Image
  Synthesis","Accepted by ICIP 2018",,,,"cs.CV","http://arxiv.org/licenses/nonexclusive-distrib/1.0/","  Building on top of the success of generative adversarial networks (GANs),
conditional GANs attempt to better direct the data generation process by
conditioning with certain additional information. Inspired by the most recent
AC-GAN, in this paper we propose a fast-converging conditional GAN (FC-GAN). In
addition to the real/fake classifier used in vanilla GANs, our discriminator
has an advanced auxiliary classifier which distinguishes each real class from
an extra `fake' class. The `fake' class avoids mixing generated data with real
data, which can potentially confuse the classification of real data as AC-GAN
does, and makes the advanced auxiliary classifier behave as another real/fake
classifier. As a result, FC-GAN can accelerate the process of differentiation
of all classes, thus boost the convergence speed. Experimental results on image
synthesis demonstrate our model is competitive in the quality of images
generated while achieving a faster convergence rate.
","[{""version"":""v1"",""created"":""Sat, 5 May 2018 00:18:19 GMT""}]","2018-05-08"
"1805.01973","Xuan Zhang","Manfred Denker, Samuel Senti and Xuan Zhang","Fluctuations of ergodic sums on periodic orbits under specification",,"Discrete and Continuous Dynamical Systems - A, 2020, 40 (8) :
  4665-4687","10.3934/dcds.2020197",,"math.DS","http://arxiv.org/licenses/nonexclusive-distrib/1.0/","  We study the fluctuations of ergodic sums using global and local
specifications on periodic points. We obtain Lindeberg-type central limit
theorems in both situations. As an application, when the system possesses a
unique measure of maximal entropy, we show weak convergence of ergodic sums to
a mixture of normal distributions. Our results suggest decomposing the
variances of ergodic sums according to global and local sources.
","[{""version"":""v1"",""created"":""Sat, 5 May 2018 00:20:13 GMT""},{""version"":""v2"",""created"":""Wed, 15 Apr 2020 00:55:14 GMT""}]","2020-05-14"
"1805.01974","Jian-Jia Weng","Jian-Jia Weng, Fady Alajaji, and Tam\'as Linder","Lossy Transmission of Correlated Sources over Two-Way Channels","5 pages, 3 figures, a minor typo fixed, presented at IEEE ITW 2017",,,,"cs.IT math.IT","http://arxiv.org/licenses/nonexclusive-distrib/1.0/","  Achievability and converse results for the lossy transmission of correlated
sources over Shannon's two-way channels (TWCs) are presented. A joint
source-channel coding theorem for independent sources and TWCs for which
adaptation cannot enlarge the capacity region is also established. We further
investigate the optimality of scalar coding for TWCs with discrete modulo
additive noise as well as additive white Gaussian noise. Comparing the
distortion of scalar coding with the derived bounds, we observe that scalar
coding achieves the minimum distortion over both families of TWCs for
independent and uniformly distributed sources and independent Gaussian sources.
","[{""version"":""v1"",""created"":""Sat, 5 May 2018 00:31:26 GMT""}]","2018-05-08"
"1805.01975","Julius Aguma","J Ceasar Aguma, Bruce McMillin, Amelia Regan","Introduction of a Hybrid Monitor to Cyber-Physical Systems",,,,,"cs.CR","http://arxiv.org/licenses/nonexclusive-distrib/1.0/","  Computing and technology have vastly changed since the introduction of
firewall technology in 1988. The internet has grown from a simple network of
networks to a cyber and physical entity that encompasses the entire planet.
Cyber-physical systems(CPS) now control most of the day to day operations of
human civilization from autonomous cars to nuclear energy plants. While
phenomenal, this growth spurt has created new security threats. These are
threats that cannot be blocked by a firewall for they are not only cyber but
cyber-physical. In light of these new cyber-physical threats, this text
proposes a security measure that promises to enhance the security of
cyber-physical systems. Using theoretical cyber, physical, and cyber-physical
attack scenarios, this text will highlight the need for some sort of monitor in
cyber-physical systems as an extra security measure. Additionally, this text
will illustrate the efficiency of said monitor using a Shannon entropy proof,
and a multiple security domain nondeducibility(MSDND) proof.
","[{""version"":""v1"",""created"":""Sat, 5 May 2018 00:31:48 GMT""},{""version"":""v2"",""created"":""Fri, 9 Aug 2019 19:48:48 GMT""}]","2019-08-13"
"1805.01976","Zhongjian Xie","Zhongjian Xie, Shiyou Chen, Quan Liu, Zhitao Lin, Jinlai Zhao, Taojian
  Fan, Liping Liu, Shiyun Bao, Dianyuan Fan, and Han Zhang","Biocompatible Two-dimensional Titanium Nanosheets for Efficient
  Plasmonic Photothermal Cancer Therapy",,,,,"physics.app-ph","http://arxiv.org/licenses/nonexclusive-distrib/1.0/","  Photothermal therapy (PTT) has shown significant potential in cancer
treatment. However, developing nanomaterial-based photothermal agents with good
biocompatibility and high photothermal conversion efficiency (PTCE) remains a
key challenge. Titanium has been widely employed as biomedical materials based
on their excellent biocompatibility. In this work, the titanium based plasmonic
photothermal therapy (Ti-PPTT) is demonstrated. Using the liquid-phase
exfoliation (LPE), the metallic Ti can be fabricated into the two-dimensional
(2D) nanosheets (NSs), similar to exfoliating other layered 2D materials. The
2D Ti NSs exhibited good biocompatibility, high extinction coefficient of 20.8
Lg-1cm1 and high PTCE of 73.4%, owing to localized surface plasmon resonances
(LSPR); which is significantly higher than other photothermal agents, including
Au (21%), MoS2 (24.4%), BP (28.4%) and Ti3C2 MXene (30.6%). Consequently, 2D
Ti-PPTT exhibited a notable therapeutic effect in a human hepatocellular
carcinoma model without side effects. Our study could pave a new avenue for PTT
using metal Ti and arouse a wide interest in the potential efficient PTT for
other elemental transition metals owing to their LSPR. Furthermore, the
efficient photothermal effect and environmental friendliness of Ti NSs make
them deserve more research toward other application, such as solar energy
harvesting and sea water desalination.
","[{""version"":""v1"",""created"":""Sat, 5 May 2018 00:37:19 GMT""}]","2018-06-08"
"1805.01977","Armon Barton","Armon Barton, Mohsen Imani, Jiang Ming, and Matthew Wright","Towards Predicting Efficient and Anonymous Tor Circuits",,,,,"cs.CR","http://arxiv.org/licenses/nonexclusive-distrib/1.0/","  The Tor anonymity system provides online privacy for millions of users, but
it is slower than typical web browsing. To improve Tor performance, we propose
PredicTor, a path selection technique that uses a Random Forest classifier
trained on recent measurements of Tor to predict the performance of a proposed
path. If the path is predicted to be fast, then the client builds a circuit
using those relays. We implemented PredicTor in the Tor source code and show
through live Tor experiments and Shadow simulations that PredicTor improves Tor
network performance by 11% to 23% compared to Vanilla Tor and by 7% to 13%
compared to the previous state-of-the-art scheme. Our experiments show that
PredicTor is the first path selection algorithm to dynamically avoid highly
congested nodes during times of high congestion and avoid long-distance paths
during times of low congestion. We evaluate the anonymity of PredicTor using
standard entropy-based and time-to-first-compromise metrics, but these cannot
capture the possibility of leakage due to the use of location in path
selection. To better address this, we propose a new anonymity metric called
CLASI: Client Autonomous System Inference. CLASI is the first anonymity metric
in Tor that measures an adversary's ability to infer client Autonomous Systems
(ASes) by fingerprinting circuits at the network, country, and relay level. We
find that CLASI shows anonymity loss for location-aware path selection
algorithms, where entropy-based metrics show little to no loss of anonymity.
Additionally, CLASI indicates that PredicTor has similar sender AS leakage
compared to the current Tor path selection algorithm due to PredicTor building
circuits that are independent of client location.
","[{""version"":""v1"",""created"":""Sat, 5 May 2018 00:40:08 GMT""}]","2018-05-08"
"1805.01978","Zhirong Wu","Zhirong Wu, Yuanjun Xiong, Stella Yu, Dahua Lin","Unsupervised Feature Learning via Non-Parametric Instance-level
  Discrimination","CVPR 2018 spotlight paper. Code:
  https://github.com/zhirongw/lemniscate.pytorch",,,,"cs.CV cs.LG","http://arxiv.org/licenses/nonexclusive-distrib/1.0/","  Neural net classifiers trained on data with annotated class labels can also
capture apparent visual similarity among categories without being directed to
do so. We study whether this observation can be extended beyond the
conventional domain of supervised learning: Can we learn a good feature
representation that captures apparent similarity among instances, instead of
classes, by merely asking the feature to be discriminative of individual
instances? We formulate this intuition as a non-parametric classification
problem at the instance-level, and use noise-contrastive estimation to tackle
the computational challenges imposed by the large number of instance classes.
Our experimental results demonstrate that, under unsupervised learning
settings, our method surpasses the state-of-the-art on ImageNet classification
by a large margin. Our method is also remarkable for consistently improving
test performance with more training data and better network architectures. By
fine-tuning the learned feature, we further obtain competitive results for
semi-supervised learning and object detection tasks. Our non-parametric model
is highly compact: With 128 features per image, our method requires only 600MB
storage for a million images, enabling fast nearest neighbour retrieval at the
run time.
","[{""version"":""v1"",""created"":""Sat, 5 May 2018 00:47:01 GMT""}]","2018-05-08"
"1805.01979","Renkai Li","R. K. Li, M. C. Hoffmann, E. A. Nanni, S. H. Glenzer, A. M.
  Lindenberg, B. K. Ofori-Okai, A. H. Reid, X. Shen, S. P. Weathersby, J. Yang,
  M. Zajac and X. J. Wang","Terahertz-based attosecond metrology of relativistic electron beams",,"Phys. Rev. Accel. Beams 22, 012803 (2019)","10.1103/PhysRevAccelBeams.22.012803",,"physics.acc-ph","http://arxiv.org/licenses/nonexclusive-distrib/1.0/","  Photons, electrons, and their interplay are at the heart of photonic devices
and modern instruments for ultrafast science [1-10]. Nowadays, electron beams
of the highest intensity and brightness are created by photoemission with short
laser pulses, and then accelerated and manipulated using GHz radiofrequency
electromagnetic fields. The electron beams are utilized to directly map
photoinduced dynamics with ultrafast electron scattering techniques, or further
engaged for coherent radiation production at up to hard X-ray wavelengths
[11-13]. The push towards improved timing precision between the electron beams
and pump optical pulses though, has been stalled at the few tens of femtosecond
level, due to technical challenges with synchronizing the high power rf fields
with optical sources. Here, we demonstrate attosecond electron metrology using
laser-generated single-cycle THz radiation, which is intrinsically phase locked
to the optical drive pulses, to manipulate multi-MeV relativistic electron
beams. Control and single-shot characterization of bright electron beams at
this unprecedented level open up many new opportunities for atomic
visualization.
","[{""version"":""v1"",""created"":""Sat, 5 May 2018 00:57:28 GMT""}]","2019-01-16"
"1805.01980","Carlos Borges","Carlos Borges and George Biros","Reconstruction of a compactly supported sound profile in the presence of
  a random background medium","40 pages",,"10.1088/1361-6420/aadbc5",,"math.NA math-ph math.MP math.OC physics.comp-ph","http://arxiv.org/licenses/nonexclusive-distrib/1.0/","  In this paper, we present algorithms for reconstructing an unknown compact
scatterer embedded in a random noisy background medium, given measurements of
the scattered field and information about the background medium and the sound
profile. We present six different methods for the solution of this inverse
problem using different amounts of scattered data and prior information about
the random background medium and the scatterer. The different inversion
algorithms are defined by a combination of stochastic programming methods and
Bayesian formulation. Our basic results show that if we have data for just one
instance of the random background medium the best strategy is to invert for
both random medium and unknown scatterer with appropriate regularization.
However, if we have data for multiple instances of the medium it may be worth
solving a coupled set of multiple inverse problems. We present several
numerical results for inverting for various scatterer geometries under
different inversion scenarios. The main take-away of our study is that one
should invert for both unknown scatterer and random medium, with appropriate,
prior-information based regularization. Furthermore, if data from multiple
realizations of the background medium is available, then it may be beneficial
to combine results from multiple inversions.
","[{""version"":""v1"",""created"":""Sat, 5 May 2018 01:02:18 GMT""},{""version"":""v2"",""created"":""Fri, 25 May 2018 20:04:27 GMT""}]","2019-01-29"
