"1805.01911","Yannick Sire","M. Musso, Y. Sire, J. Wei, Z. Zheng and Y. Zhou","Infinite time blow-up for the fractional heat equation with critical
  exponent",,,,,"math.AP","http://arxiv.org/licenses/nonexclusive-distrib/1.0/","  We consider positive solutions for the fractional heat equation with critical
exponent \begin{equation*} \begin{cases} u_t = -(-\Delta)^{s}u +
u^{\frac{n+2s}{n-2s}}\text{ in } \Omega\times (0, \infty),
  u = 0\text{ on } (\mathbb{R}^n\setminus \Omega)\times (0, \infty),
  u(\cdot, 0) = u_0\text{ in }\mathbb{R}^n,
  \end{cases} \end{equation*} where $\Omega$ is a smooth bounded domain in
$\mathbb{R}^n$, $n > 4s$, $s\in (0, 1)$, $u:\mathbb{R}^n\times [0, \infty)\to
\mathbb{R}$ and $u_0$ is a positive smooth initial datum with
$u_0|_{\mathbb{R}^n\setminus \Omega} = 0$. We prove the existence of $u_0$ such
that the solution blows up precisely at prescribed distinct points $q_1,\cdots,
q_k$ in $\Omega$ as $t\to +\infty$. The main ingredient of the proofs is a new
inner-outer gluing scheme for the fractional parabolic problems.
","[{""version"":""v1"",""created"":""Fri, 4 May 2018 18:34:37 GMT""},{""version"":""v2"",""created"":""Thu, 24 May 2018 04:04:35 GMT""}]","2018-05-25"
"1805.01912","Denton Bobeldyk Mr","Denton Bobeldyk and Arun Ross","Analyzing Covariate Influence on Gender and Race Prediction from
  Near-Infrared Ocular Images","15 pages, 20 tables, 11 figures",,"10.1109/ACCESS.2018.2886275",,"cs.CV","http://arxiv.org/licenses/nonexclusive-distrib/1.0/","  Recent research has explored the possibility of automatically deducing
information such as gender, age and race of an individual from their biometric
data. While the face modality has been extensively studied in this regard, the
iris modality less so. In this paper, we first review the medical literature to
establish a biological basis for extracting gender and race cues from the iris.
Then, we demonstrate that it is possible to use simple texture descriptors,
like BSIF (Binarized Statistical Image Feature) and LBP (Local Binary
Patterns), to extract gender and race attributes from an NIR ocular image used
in a typical iris recognition system. The proposed method predicts gender and
race from a single eye image with an accuracy of 86% and 90%, respectively. In
addition, the following analysis are conducted: (a) the role of different parts
of the ocular region on attribute prediction; (b) the influence of gender on
race prediction, and vice-versa; (c) the impact of eye color on gender and race
prediction; (d) the impact of image blur on gender and race prediction; (e) the
generalizability of the method across different datasets; and (f) the
consistency of prediction performance across the left and right eyes.
","[{""version"":""v1"",""created"":""Fri, 4 May 2018 18:42:50 GMT""},{""version"":""v2"",""created"":""Tue, 24 Jul 2018 03:11:16 GMT""},{""version"":""v3"",""created"":""Sat, 28 Jul 2018 23:47:14 GMT""},{""version"":""v4"",""created"":""Thu, 17 Jan 2019 22:10:51 GMT""}]","2019-01-21"
"1805.01913","Tom Heitmann","Wouter Montfrooij, Tom Heitmann, Yiming Qiu, Shannon Watson, Ross
  Erwin, Wangchun Chen, Yang Zhao, Meigan Aronson, Yinkai Huang, and Anne de
  Visser","Quantum critical behavior in Ce(Fe$_{0.76}$Ru$_{0.24}$)$_2$Ge$_2$: the
  full story","57 pages; 21 figures","Phys. Rev. B 99, 195113 (2019)","10.1103/PhysRevB.99.195113",,"cond-mat.str-el","http://arxiv.org/licenses/nonexclusive-distrib/1.0/","  Systems with embedded magnetic ions that exhibit a competition between
magnetic order and disorder down to absolute zero can display unusual low
temperature behaviors of the resistivity, susceptibility, and specific heat.
Moreover, the dynamic response of such a system can display hyperscaling
behavior in which the relaxation back to equilibrium when an amount of energy E
is given to the system at temperature T only depends on the ratio E/T.
Ce(Fe$_{0.755}$Ru$_{0.245}$)$_2$Ge$_2$ is a system that displays these
behaviors. We show that these complex behaviors are rooted in a fragmentation
of the magnetic lattice upon cooling caused by a distribution of local Kondo
screening temperatures, and that the hyperscaling behavior can be attributed to
the flipping of the total magnetic moment of magnetic clusters that
spontaneously form and order upon cooling. We present our arguments based on
the review of two-decades worth of neutron scattering and transport data on
this system, augmented with new polarized neutron scattering experiments.
","[{""version"":""v1"",""created"":""Fri, 4 May 2018 18:56:26 GMT""}]","2019-05-15"
"1805.01914","Mariano Mateos","Eduardo Casas, Mariano Mateos, Fredi Tr\""oltzsch","Optimal time delays in a class of reaction-diffusion equations","17 pages, 2 figures",,"10.1080/02331934.2018.1509215",,"math.OC","http://arxiv.org/licenses/nonexclusive-distrib/1.0/","  A class of semilinear parabolic reaction diffusion equations with multiple
time delays is considered. These time delays and corresponding weights are to
be optimized such that the associated solution of the delay equation is the
best approximation of a desired state function. The differentiability of the
mapping is proved that associates the solution of the delay equation to the
vector of weights and delays. Based on an adjoint calculus, first-order
necessary optimality conditions are derived. Numerical test examples show the
applicability of the concept of optimizing time delays.
","[{""version"":""v1"",""created"":""Fri, 4 May 2018 19:00:27 GMT""}]","2018-09-19"
"1805.01915","Sebastian Marino","S. Marino, J. Carpenter, M. C. Wyatt, M. Booth, S. Casassus, V.
  Faramaz, V. Guzman, A. M. Hughes, A. Isella G. M. Kennedy, L. Matr\`a, L.
  Ricci and S. Corder","A gap in the planetesimal disc around HD 107146 and asymmetric warm dust
  emission revealed by ALMA","Accepted for publication in MNRAS, 19 pages, 11 figures",,"10.1093/mnras/sty1790",,"astro-ph.EP","http://arxiv.org/licenses/nonexclusive-distrib/1.0/","  While detecting low mass exoplanets at tens of au is beyond current
instrumentation, debris discs provide a unique opportunity to study the outer
regions of planetary systems. Here we report new ALMA observations of the
80-200 Myr old Solar analogue HD 107146 that reveal the radial structure of its
exo-Kuiper belt at wavelengths of 1.1 and 0.86 mm. We find that the
planetesimal disc is broad, extending from 40 to 140 au, and it is
characterised by a circular gap extending from 60 to 100 au in which the
continuum emission drops by about 50%. We also report the non-detection of the
CO J=3-2 emission line, confirming that there is not enough gas to affect the
dust distribution. To date, HD 107146 is the only gas-poor system showing
multiple rings in the distribution of millimeter sized particles. These rings
suggest a similar distribution of the planetesimals producing small dust grains
that could be explained invoking the presence of one or more perturbing
planets. Because the disk appears axisymmetric, such planets should be on
circular orbits. By comparing N-body simulations with the observed visibilities
we find that to explain the radial extent and depth of the gap, it would be
required the presence of multiple low mass planets or a single planet that
migrated through the disc. Interior to HD 107146's exo-Kuiper belt we find
extended emission with a peak at ~20 au and consistent with the inner warm belt
that was previously predicted based on 22$\mu$m excess as in many other
systems. This warm belt is the first to be imaged, although unexpectedly
suggesting that it is asymmetric. This could be due to a large belt
eccentricity or due to clumpy structure produced by resonant trapping with an
additional inner planet.
","[{""version"":""v1"",""created"":""Fri, 4 May 2018 19:12:09 GMT""},{""version"":""v2"",""created"":""Tue, 3 Jul 2018 16:11:14 GMT""}]","2018-07-18"
"1805.01916","B{\l}a\.zej Miasojedow","Szymon Majewski, B{\l}a\.zej Miasojedow, Eric Moulines","Analysis of nonsmooth stochastic approximation: the differential
  inclusion approach",,,,,"math.OC stat.CO","http://arxiv.org/licenses/nonexclusive-distrib/1.0/","  In this paper we address the convergence of stochastic approximation when the
functions to be minimized are not convex and nonsmooth. We show that the
""mean-limit"" approach to the convergence which leads, for smooth problems, to
the ODE approach can be adapted to the non-smooth case. The limiting dynamical
system may be shown to be, under appropriate assumption, a differential
inclusion. Our results expand earlier works in this direction by Benaim et al.
(2005) and provide a general framework for proving convergence for
unconstrained and constrained stochastic approximation problems, with either
explicit or implicit updates. In particular, our results allow us to establish
the convergence of stochastic subgradient and proximal stochastic gradient
descent algorithms arising in a large class of deep learning and
high-dimensional statistical inference with sparsity inducing penalties.
","[{""version"":""v1"",""created"":""Fri, 4 May 2018 19:13:56 GMT""}]","2018-05-08"
"1805.01917","Tia Camarillo","Tia Camarillo, Pauline Dredger, and Bharat Ratra","Median Statistics Estimate of the Galactic Rotational Velocity",,,"10.1007/s10509-018-3486-8",,"astro-ph.GA gr-qc hep-ph hep-th","http://arxiv.org/licenses/nonexclusive-distrib/1.0/","  We compile a complete collection of 19 recent (since 2000) measurements of
$\Theta_0$, the rotational velocity of the Milky Way at $R_0$ (the radial
distance of the Sun from the Galactic center). These measurements use tracers
that are believed to more accurately reflect the systematic rotation of the
Milky Way. Unlike other recent compilations of $\Theta_0$, our collection
includes only independent measurements. We find that these 19 measurements are
distributed in a mildly non-Gaussian fashion and a median statistics estimate
indicates $\Theta_0 = 220\ \pm 10$ km\,s$^{-1}$ (2$\sigma$ error) as the most
reliable summary, at $R_0 = 8.0 \pm 0.3$ kpc (2$\sigma$ error).
","[{""version"":""v1"",""created"":""Fri, 4 May 2018 19:22:22 GMT""}]","2019-01-09"
"1805.01918","Chien-Lung Huang","Binod K. Rai, Iain W. H. Oswald, Wenjing Ban, C.-L. Huang, V.
  Loganathan, A. M. Hallas, M. N. Wilson, G. M. Luke, L. Harriger, Q. Huang, Y.
  Li, Sami Dzsaber, Julia Y. Chan, N. L. Wang, Silke Paschen, J. W. Lynn,
  Andriy H. Nevidomskyy, P. Dai, Q. Si, and E. Morosan","Low-carrier density and fragile magnetism in a Kondo lattice system",,"Phys. Rev. B 99, 085120 (2019)","10.1103/PhysRevB.99.085120",,"cond-mat.str-el","http://arxiv.org/licenses/nonexclusive-distrib/1.0/","  Kondo-based semimetals and semiconductors are of extensive current interest
as a viable platform for strongly correlated states. It is thus important to
understand the routes towards such dilute-carrier correlated states. One
established pathway is through Kondo effect in metallic non-magnetic analogues.
Here we advance a new mechanism, through which Kondo-based semimetals develop
out of conduction electrons with a low carrier-density in the presence of an
even number of rare-earth sites. We demonstrate this effect by studying the
Kondo material Yb3Ir4Ge13 along with its closed-f-shell counterpart,
Lu3Ir4Ge13. Through magnetotransport, optical conductivity and thermodynamic
measurements, we establish that the correlated semimetallic state of Yb3Ir4Ge13
below its Kondo temperature originates from the Kondo effect of a low carrier
conduction-electron background. In addition, it displays fragile magnetism at
very low temperatures, which, in turn, can be tuned to a non Fermi liquid
regime through Lu-for-Yb substitution. These findings are connected with recent
theoretical studies in simplified models. Our results open an entirely new
venue to explore the strong correlation physics in a semimetallic environment.
","[{""version"":""v1"",""created"":""Fri, 4 May 2018 19:24:58 GMT""},{""version"":""v2"",""created"":""Mon, 20 Aug 2018 19:32:51 GMT""}]","2019-02-14"
"1805.01919","Skenderis Kostas","Michela Petrini, Henning Samtleben, Stanislav Schmidt and Kostas
  Skenderis","The 10d Uplift of the GPPZ Solution","45 pages, v3: JHEP version, Mathematica file with the IIB solution
  and the verification of Einstein equations attached, corrected some typos,
  v4: Note Added, typos corrected","J. High Energ. Phys. (2018) 2018: 26","10.1007/JHEP07(2018)026",,"hep-th","http://arxiv.org/licenses/nonexclusive-distrib/1.0/","  We present the uplift of the GPPZ solution of the five-dimensional maximal
supergravity to ten dimensions. The five dimensional solution involves two real
scalar fields, with one of them encoding holographically the (norm of the
complex) supersymmetric ${\mathcal N}=1$ mass deformation and the other the
real part of the gaugino condensate. We embed this solution in a consistent
truncation of $D=5$ maximal supergravity which involves two complex scalars
dual to the complex mass deformations and the complex gaugino condensate, and a
$U(1)$ gauge field dual to the $U(1)_R$ current, and uplift it to ten
dimensions. The ten dimensional solution is completely explicit, with all
fields given in terms of elementary functions. The metric and the axion-dilaton
agree with those of a partial uplift of the GPPZ flow by Pilch and Warner. We
analyze the asymptotics and the singularity structure of the ten dimensional
solution. The uplifted solution is singular, but the singularity is milder than
that of the five dimensional solution, and there is conformal frame in which
the metric is only singular at one point of $S^5$. We compare the asymptotics
of the $10d$ solution with that of the Polchinski-Strassler and
Freedman-Minahan solutions, and find agreement with Freedman-Minahan and
disagreement with Polchinski-Strassler. In particular, we infer that while the
Polchinski-Strassler $10d$ fields satisfy the correct boundary conditions, they
do not solve the field equations near the boundary.
","[{""version"":""v1"",""created"":""Fri, 4 May 2018 19:33:48 GMT""},{""version"":""v2"",""created"":""Fri, 22 Jun 2018 10:41:58 GMT""},{""version"":""v3"",""created"":""Fri, 6 Jul 2018 11:46:47 GMT""},{""version"":""v4"",""created"":""Thu, 7 Feb 2019 13:44:18 GMT""}]","2019-02-08"
"1805.01920","Prost, Lionel R.","L.Prost, J.-P. Carneiro, A. Shemyakin (Fermilab)","Low Emittance Growth in a LEBT with Un-Neutralized Section","10 pp",,,"Fermilab-Pub-17-599-AD","physics.acc-ph","http://creativecommons.org/licenses/by/4.0/","  In a Low Energy Beam Transport line (LEBT), the emittance growth due to the
beam's space charge is typically suppressed by way of neutralization from
either electrons or ions, which originate from ionization of the background
gas. In cases where the beam is chopped, the neutralization pattern usually
changes throughout the beginning of the pulse, causing the Twiss parameters to
differ significantly from their steady state values, which, in turn, may result
in beam losses downstream. For a modest beam perveance, there is an alternative
solution, in which the beam is kept un-neutralized in the portion of the LEBT
that contains the chopper. The emittance can be nearly preserved if the
transition to the un-neutralized section occurs where the beam exhibits low
transverse tails. This report introduces the rationale for the proposed scheme
and formulates the physical arguments for it as well as its limitations. An
experimental realization of the scheme was carried out at Fermilab's PIP2IT
where low beam emittance dilution was demonstrated for a 5 mA, 30 keV $H^{-}$
beam.
","[{""version"":""v1"",""created"":""Fri, 4 May 2018 19:37:07 GMT""}]","2018-05-08"
"1805.01921","Yejun Feng","Yishu Wang, T. F. Rosenbaum, A. Palmer, Y. Ren, J.-W. Kim, D. Mandrus,
  and Yejun Feng","Strongly-coupled quantum critical point in an all-in-all-out
  antiferromagnet",,"Nature Communications 9, 2953 (2018)","10.1038/s41467-018-05435-7",,"cond-mat.str-el","http://arxiv.org/licenses/nonexclusive-distrib/1.0/","  Dimensionality and symmetry play deterministic roles in the laws of Nature.
They are important tools to characterize and understand quantum phase
transitions, especially in the limit of strong correlations between spin,
orbit, charge, and structural degrees of freedom. Using newly-developed,
high-pressure resonant x-ray magnetic and charge diffraction techniques, we
have discovered a quantum critical point in Cd2Os2O7 as the all-in-all-out
(AIAO) antiferromagnetic order is continuously suppressed to zero temperature
and, concomitantly, the cubic lattice structure continuously changes from space
group Fd-3m to F-43m. Surrounded by three phases of different time reversal and
spatial inversion symmetries, the quantum critical region anchors two phase
lines of opposite curvature, with striking departures from a mean-field form at
high pressure. As spin fluctuations, lattice breathing modes, and quasiparticle
excitations interact in the quantum critical region, we argue that they present
the necessary components for strongly-coupled quantum criticality in this
three-dimensional compound.
","[{""version"":""v1"",""created"":""Fri, 4 May 2018 19:43:35 GMT""}]","2019-04-02"
"1805.01922","Gaurav Mittal Mr","Gaurav Mittal and Ankik Kumar Giri","Iteratively regularized landweber iteration method: Convergence analysis
  via H\""older Stability","This paper consists of 25 pages","Volume 392, 1 March 2021, 125744, Applied Mathematics and
  Computation","10.1016/j.amc.2020.125744",,"math.NA cs.NA","http://creativecommons.org/licenses/by/4.0/","  In this paper, the local convergence of Iteratively regularized Landweber
iteration method is investigated for solving non-linear inverse problems in
Banach spaces. Our analysis mainly relies on the assumption that the inverse
mapping satisfies the H\""older stability estimate locally. We consider both
noisy as well as non-noisy data in our analysis. Under the a-priori choice of
stopping index for noisy data, we show that the iterates remain in a certain
ball around exact solution and obtain the convergence rates. The convergence of
the Iteratively regularized Landweber iterates to the exact solution is shown
under certain assumptions in the case of non-noisy data and as a by-product,
under different conditions, two different convergence rates are obtained.
","[{""version"":""v1"",""created"":""Fri, 4 May 2018 19:45:58 GMT""},{""version"":""v2"",""created"":""Mon, 25 Jun 2018 14:57:06 GMT""},{""version"":""v3"",""created"":""Sat, 16 Feb 2019 16:59:33 GMT""},{""version"":""v4"",""created"":""Sun, 15 Nov 2020 15:43:14 GMT""}]","2020-11-17"
"1805.01923","Enrico Santus","Enrico Santus, Hongmin Wang, Emmanuele Chersoni and Yue Zhang","A Rank-Based Similarity Metric for Word Embeddings","5 pages, 1 figure, 4 tables, ACL, ACL2018",,,,"cs.CL","http://arxiv.org/licenses/nonexclusive-distrib/1.0/","  Word Embeddings have recently imposed themselves as a standard for
representing word meaning in NLP. Semantic similarity between word pairs has
become the most common evaluation benchmark for these representations, with
vector cosine being typically used as the only similarity metric. In this
paper, we report experiments with a rank-based metric for WE, which performs
comparably to vector cosine in similarity estimation and outperforms it in the
recently-introduced and challenging task of outlier detection, thus suggesting
that rank-based measures can improve clustering quality.
","[{""version"":""v1"",""created"":""Fri, 4 May 2018 19:48:36 GMT""}]","2018-05-08"
"1805.01924","Saeed Shaebani","Saeed Shaebani","A note on b-coloring of Kneser graphs",,,,,"math.CO","http://arxiv.org/licenses/nonexclusive-distrib/1.0/","  In this short note, the purpose is to provide an upper bound for the
b-chromatic number of Kneser graphs. Our bound improves the upper bound that
was presented by Balakrishnan and Kavaskar in [b-coloring of Kneser graphs,
Discrete Appl. Math. 160 (2012), 9-14].
","[{""version"":""v1"",""created"":""Fri, 4 May 2018 19:55:39 GMT""},{""version"":""v2"",""created"":""Sun, 16 Sep 2018 20:19:55 GMT""}]","2018-09-18"
"1805.01925","Susanne Claus","Susanne Claus, Samuel Bigot, Pierre Kerfriden","A CutFEM method for Stefan-Signorini problems with application in pulsed
  laser ablation",,,,,"math.NA","http://creativecommons.org/licenses/by/4.0/","  In this article, we develop a cut finite element method for one-phase Stefan
problems, with applications in laser manufacturing. The geometry of the
workpiece is represented implicitly via a level set function. Material above
the melting/vaporisation temperature is represented by a fictitious gas phase.
The moving interface between the workpiece and the fictitious gas phase may cut
arbitrarily through the elements of the finite element mesh, which remains
fixed throughout the simulation, thereby circumventing the need for cumbersome
re-meshing operations. The primal/dual formulation of the linear one-phase
Stefan problem is recast into a primal non-linear formulation using a
Nitsche-type approach, which avoids the difficulty of constructing inf-sup
stable primal/dual pairs. Through the careful derivation of stabilisation
terms, we show that the proposed Stefan-Signorini-Nitsche CutFEM method remains
stable independently of the cut location. In addition, we obtain optimal
convergence with respect to space and time refinement. Several 2D and 3D
examples are proposed, highlighting the robustness and flexibility of the
algorithm, together with its relevance to the field of micro-manufacturing.
","[{""version"":""v1"",""created"":""Fri, 4 May 2018 19:57:13 GMT""},{""version"":""v2"",""created"":""Tue, 14 Aug 2018 12:14:31 GMT""}]","2018-08-15"
"1805.01926","Charles A. Poteet","Charles A. Poteet, Christine H. Chen, Dean C. Hines, Marshall D.
  Perrin, John H. Debes, Laurent Pueyo, Glenn Schneider, Johan Mazoyer, and
  Ludmilla Kolokolova","Space-Based Coronagraphic Imaging Polarimetry of the TW Hydrae Disk:
  Shedding New Light on Self-Shadowing Effects","Accepted for publication in the Astrophysical Journal, 2018 May 3: 17
  pages, 9 figures, 2 tables",,"10.3847/1538-4357/aac2e4",,"astro-ph.SR astro-ph.EP","http://arxiv.org/licenses/nonexclusive-distrib/1.0/","  We present Hubble Space Telescope Near-Infrared Camera and Multi-Object
Spectrometer coronagraphic imaging polarimetry of the TW Hydrae protoplanetary
disk. These observations simultaneously measure the total and polarized
intensity, allowing direct measurement of the polarization fraction across the
disk. In accord with the self-shadowing hypothesis recently proposed by Debes
et al., we find that the total and polarized intensity of the disk exhibits
strong azimuthal asymmetries at projected distances consistent with the
previously reported bright and dark ring-shaped structures (~45-99 au). The
sinusoidal-like variations possess a maximum brightness at position angles near
~268-300 degrees and are up to ~28% stronger in total intensity. Furthermore,
significant radial and azimuthal variations are also detected in the
polarization fraction of the disk. In particular, we find that regions of lower
polarization fraction are associated with annuli of increased surface
brightness, suggesting that the relative proportion of multiple-to-single
scattering is greater along the ring and gap structures. Moreover, we find
strong (~20%) azimuthal variation in the polarization fraction along the
shadowed region of the disk. Further investigation reveals that the azimuthal
variation is not the result of disk flaring effects, but instead from a
decrease in the relative contribution of multiple-to-single scattering within
the shadowed region. Employing a two-layer scattering surface, we hypothesize
that the diminished contribution in multiple scattering may result from
shadowing by an inclined inner disk, which prevents direct stellar light from
reaching the optically thick underlying surface component.
","[{""version"":""v1"",""created"":""Fri, 4 May 2018 20:00:00 GMT""}]","2018-07-04"
"1805.01927","Renaud  Detcherry","Renaud Detcherry","Growth of Turaev-Viro invariants and cabling",,,,,"math.GT","http://arxiv.org/licenses/nonexclusive-distrib/1.0/","  The Chen-Yang volume conjecture states that the growth rate of the
Turaev-Viro invariants of a compact oriented $3$-manifold determines its
simplicial volume. In this paper we prove that the Chen-Yang conjecture is
stable under $(2n+1,2)$-cabling.
","[{""version"":""v1"",""created"":""Fri, 4 May 2018 20:05:12 GMT""}]","2018-05-08"
"1805.01928","Wei Zhang","Tony Leli\`evre, Wei Zhang","Pathwise estimates for effective dynamics: the case of nonlinear
  vectorial reaction coordinates",,,,,"math.PR","http://arxiv.org/licenses/nonexclusive-distrib/1.0/","  Effective dynamics using conditional expectation was proposed in [F. Legoll
and T. Leli\`evre, Nonlinearity, 2010] to approximate the essential dynamics of
high-dimensional diffusion processes along a given reaction coordinate. The
approximation error of the effective dynamics when it is used to approximate
the behavior of the original dynamics has been considered in recent years. As a
continuation of the previous work [F. Legoll, T. Leli\`evre, and S. Olla,
Stoch. Process. Appl, 2017], in this paper we obtain pathwise estimates for
effective dynamics when the reaction coordinate function is either nonlinear or
vector-valued.
","[{""version"":""v1"",""created"":""Fri, 4 May 2018 20:08:32 GMT""}]","2018-05-08"
