"1805.01834","Steffen Unkel PD Dr.","Steffen Unkel, Marjan Amiri, Norbert Benda, Jan Beyersmann, Dietrich
  Knoerzer, Katrin Kupas, Frank Langer, Friedhelm Leverkus, Anja Loos, Claudia
  Ose, Tanja Proctor, Claudia Schmoor, Carsten Schwenke, Guido Skipka, Kristina
  Unnebrink, Florian Voss, Tim Friede","On estimands and the analysis of adverse events in the presence of
  varying follow-up times within the benefit assessment of therapies",,,,,"stat.OT","http://arxiv.org/licenses/nonexclusive-distrib/1.0/","  The analysis of adverse events (AEs) is a key component in the assessment of
a drug's safety profile. Inappropriate analysis methods may result in
misleading conclusions about a therapy's safety and consequently its
benefit-risk ratio. The statistical analysis of AEs is complicated by the fact
that the follow-up times can vary between the patients included in a clinical
trial. This paper takes as its focus the analysis of AE data in the presence of
varying follow-up times within the benefit assessment of therapeutic
interventions. Instead of approaching this issue directly and solely from an
analysis point of view, we first discuss what should be estimated in the
context of safety data, leading to the concept of estimands. Although the
current discussion on estimands is mainly related to efficacy evaluation, the
concept is applicable to safety endpoints as well. Within the framework of
estimands, we present statistical methods for analysing AEs with the focus
being on the time to the occurrence of the first AE of a specific type. We give
recommendations which estimators should be used for the estimands described.
Furthermore, we state practical implications of the analysis of AEs in clinical
trials and give an overview of examples across different indications. We also
provide a review of current practices of health technology assessment (HTA)
agencies with respect to the evaluation of safety data. Finally, we describe
problems with meta-analyses of AE data and sketch possible solutions.
","[{""version"":""v1"",""created"":""Fri, 4 May 2018 16:03:37 GMT""},{""version"":""v2"",""created"":""Fri, 21 Sep 2018 08:28:51 GMT""}]","2018-09-24"
"1805.01835","Fabrizio M. E. Catanese","Fabrizio Catanese, Andreas Demleitner (Universitaet Bayreuth)","Hyperelliptic Threefolds with group $D_4$, the Dihedral group of order 8","4 pages",,,,"math.AG math.CV","http://arxiv.org/licenses/nonexclusive-distrib/1.0/","  We give a simple construction for the hyperelliptic threefolds with group
$D_4$, thus completing the classification of hyperelliptic threefolds.
","[{""version"":""v1"",""created"":""Fri, 4 May 2018 16:05:47 GMT""}]","2018-05-07"
"1805.01836","Aleksander Kubica","Aleksander Kubica, Beni Yoshida","Ungauging quantum error-correcting codes","32 pages, 8 figures",,,,"quant-ph cond-mat.stat-mech cond-mat.str-el","http://arxiv.org/licenses/nonexclusive-distrib/1.0/","  We develop the procedures of gauging and ungauging, reveal their operational
meaning and propose their generalization in a systematic manner within the
framework of quantum error-correcting codes. We demonstrate with an example of
the subsystem Bacon-Shor code that the ungauging procedure can result in models
with unusual symmetry operators constrained to live on lower-dimensional
structures. We apply our formalism to the three-dimensional gauge color code
(GCC) and show that its codeword space is equivalent to the Hilbert space of
six copies of $\mathbb{Z}_2$ lattice gauge theory with $1$-form symmetries. We
find that three different stabilizer Hamiltonians associated with the GCC
correspond to distinct thermal symmetry-protected topological (SPT) phases in
the presence of the stabilizer symmetries of the GCC. One of the considered
Hamiltonians describes the Raussendorf-Bravyi-Harrington model, which is
universal for measurement-based quantum computation at non-zero temperature. We
also propose a general procedure of creating $D$-dimensional SPT Hamiltonians
from $(D+1)$-dimensional CSS stabilizer Hamiltonians by exploiting a relation
between gapped domain walls and transversal logical gates. As a result, we find
an explicit two-dimensional realization of a non-trivial fracton SPT phase
protected by fractal-like symmetries.
","[{""version"":""v1"",""created"":""Fri, 4 May 2018 16:11:14 GMT""}]","2018-05-07"
"1805.01837","Mathias Niepert","Mathias Niepert and Alberto Garcia-Duran","Towards a Spectrum of Graph Convolutional Networks",,,,,"cs.LG cs.AI cs.CV cs.NE stat.ML","http://arxiv.org/licenses/nonexclusive-distrib/1.0/","  We present our ongoing work on understanding the limitations of graph
convolutional networks (GCNs) as well as our work on generalizations of graph
convolutions for representing more complex node attribute dependencies. Based
on an analysis of GCNs with the help of the corresponding computation graphs,
we propose a generalization of existing GCNs where the aggregation operations
are (a) determined by structural properties of the local neighborhood graphs
and (b) not restricted to weighted averages. We show that the proposed approach
is strictly more expressive while requiring only a modest increase in the
number of parameters and computations. We also show that the proposed
generalization is identical to standard convolutional layers when applied to
regular grid graphs.
","[{""version"":""v1"",""created"":""Fri, 4 May 2018 16:13:36 GMT""}]","2018-05-07"
"1805.01838","Eduard V. Deviatov","A. Kononov, O. O. Shvetsov, A. V. Timonina, N. N. Kolesnikov, E. V.
  Deviatov","Spin wave effects in transport between a ferromagnet and a Weyl
  semimetal surface",,"JETP Letters, 109, 180 (2019)","10.1134/S0021364019030020",,"cond-mat.mes-hall","http://arxiv.org/licenses/nonexclusive-distrib/1.0/","  We experimentally investigate spin-polarized transport between a
ferromagnetic Ni electrode and a surface of Weyl semimetal, realized in a thick
WTe$_2$ single crystal. For highly-transparent Ni-WTe$_2$ planar junctions, we
observe non-Ohmic $dV/dI(I)$ behavior with an overall increase of differential
resistance $dV/dI$ with current bias, which is accomplished by current-induced
switchings. This behavior is inconsistent with trivial interface scattering,
but it is well known for spin-polarized transport with magnon emission. Thus,
we interpret the experimental results in terms of spin wave excitation in spin
textures in the WTe$_2$ topological surface states, which is supported by the
obtained magnetic field and temperature $dV/dI(I)$ dependencies.
","[{""version"":""v1"",""created"":""Fri, 4 May 2018 16:18:22 GMT""},{""version"":""v2"",""created"":""Tue, 10 Jul 2018 11:59:09 GMT""}]","2019-04-03"
"1805.01839","Davide Massari","Davide Massari, Amina Helmi","With and without spectroscopy: Gaia DR2 proper motions of seven
  Ultra-Faint Dwarf Galaxies","6 pages, 5 figures, 2 tables. Revised version, accepted for
  publication by A&A","A&A 620, A155 (2018)","10.1051/0004-6361/201833367",,"astro-ph.GA","http://arxiv.org/licenses/nonexclusive-distrib/1.0/","  We present mean absolute proper motion measurements for seven ultra-faint
dwarf galaxies orbiting the Milky Way, namely Bo\""{o}tes III, Carina II, Grus
II, Reticulum II, Sagittarius II, Segue 2 and Tucana IV. For four of these
dwarfs our proper motion estimate is the first ever provided. The adopted
astrometric data come from the second data release of the Gaia mission. We
determine the mean proper motion for each galaxy starting from an initial guess
of likely members, based either on radial velocity measurements or using stars
on the Horizontal Branch identified in the Gaia ($G_{\rm BP}$-$G_{\rm RP}$,$G$)
colour-magnitude diagram in the field of view towards the UFD. We then refine
their membership iteratively using both astrometry and photometry. We take into
account the full covariance matrix among the astrometric parameters when
deriving the mean proper motions for these systems. Our procedure provides mean
proper motions with typical uncertainties of $\sim0.1$ mas/yr, even for
galaxies without prior spectroscopic information. In the case of Segue 2 we
find that using radial velocity members only leads to biased results,
presumably because of the small number of stars with measured radial
velocities. Our procedure allows to maximize the number of member stars per
galaxy regardless of the existence of prior spectroscopic information, and can
therefore be applied on any faint or distant stellar system within reach of
Gaia.
","[{""version"":""v1"",""created"":""Fri, 4 May 2018 16:21:47 GMT""},{""version"":""v2"",""created"":""Tue, 16 Oct 2018 15:29:54 GMT""}]","2018-12-12"
"1805.01840","Shaochuang Huang","Shaochuang Huang","A note on existence of exhaustion functions and its applications","11 pages",,,,"math.DG","http://arxiv.org/licenses/nonexclusive-distrib/1.0/","  In this note, we prove an existence result on exhaustion functions adapting
the method by L.-F. Tam. Then we apply it to prove short-time existence of
Ricci flow and study Yau's uniformization conjecture using similar method as
Fei He and Lee-Tam.
","[{""version"":""v1"",""created"":""Fri, 4 May 2018 16:29:11 GMT""}]","2018-05-07"
"1805.01841","Matthieu Jamet","C. Zucchetti, M.-T Dau, F. Bottegoni, C. Vergnaud, T. Guillet, A.
  Marty, C. Beign\'e, S. Gambarelli, A. Picone, A. Calloni, G. Bussetti, A.
  Brambilla, L. Du\`o, F. Ciccacci, P. K. Das, J. Fujii, I. Vobornik, M.
  Finazzi and M. Jamet","Tuning spin-charge interconversion with quantum confinement in ultrathin
  Bi/Ge(111) films","18 pages, 5 figures","Phys. Rev. B 98, 184418 (2018)","10.1103/PhysRevB.98.184418",,"cond-mat.mtrl-sci","http://arxiv.org/licenses/nonexclusive-distrib/1.0/","  Spin-charge interconversion (SCI) phenomena have attracted a growing interest
in the field of spintronics as means to detect spin currents or manipulate the
magnetization of ferromagnets. The key ingredients to exploit these assets are
a large conversion efficiency, the scalability down to the nanometer scale and
the integrability with opto-electronic and spintronic devices. Here we show
that, when an ultrathin Bi film is epitaxially grown on top of a Ge(111)
substrate, quantum size effects arising in nanometric Bi islands drastically
boost the SCI efficiency, even at room temperature. Using x-ray diffraction
(XRD), scanning tunneling microscopy (STM) and spin- and angle-resolved
photoemission (S-ARPES) we obtain a clear picture of the film morphology,
crystallography and electronic structure. We then exploit the Rashba-Edelstein
effect (REE) and inverse Rashba-Edelstein effect (IREE) to directly quantify
the SCI efficiency using optical and electrical spin injection.
","[{""version"":""v1"",""created"":""Fri, 4 May 2018 16:29:21 GMT""}]","2020-11-26"
"1805.01842","Nurgissa Yessirkegenov","Michael Ruzhansky, Durvudkhan Suragan and Nurgissa Yessirkegenov","Euler semigroup, Hardy-Sobolev and Gagliardo-Nirenberg type inequalities
  on homogeneous groups","26 pages",,,,"math.FA","http://arxiv.org/licenses/nonexclusive-distrib/1.0/","  In this paper we describe the Euler semigroup
$\{e^{-t\mathbb{E}^{*}\mathbb{E}}\}_{t>0}$ on homogeneous Lie groups, which
allows us to obtain various types of the Hardy-Sobolev and Gagliardo-Nirenberg
type inequalities for the Euler operator $\mathbb{E}$. Moreover, the sharp
remainder terms of the Sobolev type inequality, maximal Hardy inequality and
$|\cdot|$-radial weighted Hardy-Sobolev type inequality are established.
","[{""version"":""v1"",""created"":""Fri, 4 May 2018 16:35:02 GMT""}]","2018-05-07"
"1805.01843","Swaraj Bandhu Mahato","Swaraj Bandhu Mahato, Joris De Ridder, Guy Meynants, Gert Raskin, and
  Hans Van Winckel","Measuring Intra-pixel Sensitivity Variations of a CMOS Image Sensor",,,,,"astro-ph.IM","http://arxiv.org/licenses/nonexclusive-distrib/1.0/","  Some applications in scientific imaging, like space-based high-precision
photometry, benefit from a detailed characterization of the sensitivity
variation within a pixel. A detailed map of the intra-pixel sensitivity (IPS)
allows to increase the photometric accuracy by correcting for the impact of the
tiny sub-pixel movements of the image sensor during integration. This paper
reports the measurement of the sub-pixel sensitivity variation and the
extraction of the IPS map of a front-side illuminated CMOS image sensor with a
pixel pitch of 6 \boldmath$\mu m$. Our optical measurement setup focuses a
collimated beam onto the imaging surface with a microscope objective. The spot
was scanned in a raster over a single pixel to probe the pixel response at each
(sub-pixel) scan position. We model the optical setup in ZEMAX to
cross-validate the optical spot profile described by an Airy diffraction
pattern. In this work we introduce a forward modeling technique to derive the
variation of the IPS. We model the optical spot scanning system and discretize
the CMOS pixel response. Fitting this model to the measured data allows us to
quantify the spatial sensitivity variation within a single pixel. Finally, we
compare our results to those obtained from the more commonly used Wiener
deconvolution.
","[{""version"":""v1"",""created"":""Fri, 4 May 2018 16:35:58 GMT""}]","2018-05-07"
"1805.01845","The ATLAS Collaboration","ATLAS Collaboration","Measurements of $b$-jet tagging efficiency with the ATLAS detector using
  $t\bar{t}$ events at $\sqrt{s}=13$ TeV","49 pages in total, author list starting page 33, 12 figures, 6
  tables, published in JHEP. All figures including auxiliary figures are
  available at
  http://atlas.web.cern.ch/Atlas/GROUPS/PHYSICS/PAPERS/PERF-2016-05/","JHEP 08 (2018) 89","10.1007/JHEP08(2018)089","CERN-EP-2018-047","hep-ex","http://creativecommons.org/licenses/by/4.0/","  The efficiency to identify jets containing $b$-hadrons ($b$-jets) is measured
using a high purity sample of dileptonic top quark-antiquark pairs ($t\bar{t}$)
selected from the 36.1 fb$^{-1}$ of data collected by the ATLAS detector in
2015 and 2016 from proton-proton collisions produced by the Large Hadron
Collider at a centre-of-mass energy $\sqrt{s}=13$ TeV. Two methods are used to
extract the efficiency from $t\bar{t}$ events, a combinatorial likelihood
approach and a tag-and-probe method. A boosted decision tree, not using
$b$-tagging information, is used to select events in which two $b$-jets are
present, which reduces the dominant uncertainty in the modelling of the flavour
of the jets. The efficiency is extracted for jets in a transverse momentum
range from 20 to 300 GeV, with data-to-simulation scale factors calculated by
comparing the efficiency measured using collision data to that predicted by the
simulation. The two methods give compatible results, and achieve a similar
level of precision, measuring data-to-simulation scale factors close to unity
with uncertainties ranging from 2% to 12% depending on the jet transverse
momentum.
","[{""version"":""v1"",""created"":""Fri, 4 May 2018 16:37:41 GMT""},{""version"":""v2"",""created"":""Mon, 3 Sep 2018 11:35:18 GMT""}]","2018-09-05"
"1805.01846","Qianjun He","Qianjun He and Dunyan Yan","Bilinear fractional integral operators on Morrey spaces",,,,,"math.CA","http://arxiv.org/licenses/nonexclusive-distrib/1.0/","  We prove a plethora of boundedness property of the Adams type for bilinear
fractional integral operators of the form
  $$B_{\alpha}(f,g)(x)=\int_{\mathbb{R}^{n}}\frac{f(x-y)g(x+y)}{|y|^{n-\alpha}}dy,\qquad
0<\alpha<n.$$
  For $1<t\leq s<\infty$, we prove the non-weighted case through the known
Adams type result. And we show that these results of Adams type is optimal. For
$0<t\leq s<\infty$ and $0<t\leq1$, we obtain new result of a weighted theory
describing Morrey boundedness of above form operators if two weights
$(v,\vec{w})$ satisfy
  $$
  [v,\vec{w}]_{t,\vec{q}/{a}}^{r,as}=\mathop{\sup_{Q,Q^{\prime}\in\mathscr{D}}}_{Q\subset
Q^{\prime}}\left(\frac{|Q|}{|Q^{\prime}|}\right)^{\frac{1-s}{as}}|Q^{\prime}|^{\frac{1}{r}}\left(\fint_{Q}v^{\frac{t}{1-t}}\right)^{\frac{1-t}{t}}\prod_{i=1}^{2}\left(\fint_{Q^{\prime}}w_{i}^{-(q_{i}/a)^{\prime}}\right)^{\frac{1}{(q_{i}/a)^{\prime}}}<\infty,\,\,\,
0<t<s<1
  $$
  and
  $$
  [v,\vec{w}]_{t,\vec{q}/{a}}^{r,as}:=\mathop{\sup_{Q,Q^{\prime}\in\mathscr{D}}}_{Q\subset
Q^{\prime}}\left(\frac{|Q|}{|Q^{\prime}|}\right)^{\frac{1-as}{as}}|Q^{\prime}|^{\frac{1}{r}}\left(\fint_{Q}v^{\frac{t}{1-t}}\right)^{\frac{1-t}{t}}\prod_{i=1}^{2}\left(\fint_{Q^{\prime}}w_{i}^{-(q_{i}/a)^{\prime}}\right)^{\frac{1}{(q_{i}/a)^{\prime}}}<\infty,
\,\,\,s\geq1
  $$
  where $\|v\|_{L^{\infty}(Q)}=\sup_{Q}v$ when $t=1$, $a$, $r$, $s$, $t$ and
$\vec{q}$ satisfy proper conditions. As some applications we formulate a
bilinear version of the Olsen inequality, the Fefferman-Stein type dual
inequality and the Stein-Weiss inequality on Morrey spaces for fractional
integrals.
","[{""version"":""v1"",""created"":""Fri, 4 May 2018 16:40:16 GMT""},{""version"":""v2"",""created"":""Wed, 16 May 2018 12:33:27 GMT""},{""version"":""v3"",""created"":""Mon, 27 May 2019 02:40:59 GMT""}]","2019-05-28"
"1805.01847","Zigfried Hampel-Arias","A.U. Abeysekara, R. Alfaro, C. Alvarez, J.D. Alvarez, R. Arceo, J.C.
  Arteaga-Vel\'azquez, D. Avila Rojas, H.A. Ayala Solares, A. Becerril, E.
  Belmont-Moreno, S.Y. BenZvi, A. Bernal, J. Braun, K.S. Caballero-Mora, T.
  Capistr\'an, A. Carrami\~nana, S. Casanova, M. Castillo, U. Cotti, J.
  Cotzomi, C. De Le\'on, E. De la Fuente, R. Diaz Hernandez, S. Dichiara, B.L.
  Dingus, M.A. DuVernois, J.C. D\'iaz-V\'elez, K. Engel, D.W. Fiorino, N.
  Fraija, J.A. Garc\'ia-Gonz\'alez, F. Garfias, A. Gonz\'alez Mu\~noz, M.M.
  Gonz\'alez, J.A. Goodman, Z. Hampel-Arias, J.P. Harding, S. Hernandez, B.
  Hona, F. Hueyotl-Zahuantitla, C.M. Hui, P. H\""untemeyer, A. Iriarte, A.
  Jardin-Blicq, V. Joshi, S. Kaufmann, A. Lara, R.J. Lauer, W.H. Lee, H. Le\'on
  Vargas, A.L. Longinotti, G. Luis-Raya, R. Luna-Garc\'ia, D. L\'opez-C\'amara,
  R. L\'opez-Coto, D. L\'opez-C\'amara, R. L\'opez-Coto, K. Malone, S.S.
  Marinelli, O. Martinez, I. Martinez-Castellanos, J. Mart\'inez-Castro, H.
  Mart\'inez-Huerta, J.A. Matthews, P. Miranda-Romagnoli, E. Moreno, M.
  Mostaf\'a, A. Nayerhoda, L. Nellen, M. Newbold, M.U. Nisa, R.
  Noriega-Papaqui, R. Pelayo, J. Pretz, E.G. P\'erez-P\'erez, Z. Ren, C.D. Rho,
  C. Rivi\`ere, D. Rosa-Gonz\'alez, M. Rosenberg, E. Ruiz-Velasco, F. Salesa
  Greus, A. Sandoval, M. Schneider, H. Schoorlemmer, M. Seglar Arroyo, G.
  Sinnis, A.J. Smith, R.W. Springer, P. Surajbali, I. Taboada, O. Tibolla, K.
  Tollefson, I. Torres, G. Vianello, L. Villase\~nor, T. Weisgarber, F. Werner,
  S. Westerhoff, J. Wood, T. Yapici, A. Zepeda, H. Zhou","Observation of Anisotropy of TeV Cosmic Rays with Two Years of HAWC","22 pages, 14 figures, 2 tables, submission to ApJ",,"10.3847/1538-4357/aad90c",,"astro-ph.HE","http://arxiv.org/licenses/nonexclusive-distrib/1.0/","  After two years of operation, the High-Altitude Water Cherenkov (HAWC)
Observatory has analyzed the TeV cosmic-ray sky over an energy range between
$2.0$ and $72.8$ TeV. The HAWC detector is a ground-based air-shower array
located at high altitude in the state of Puebla, Mexico. Using 300 light-tight
water tanks, it collects the Cherenkov light from the particles of extensive
air showers from primary gamma rays and cosmic rays. This detection method
allows for uninterrupted observation of the entire overhead sky (2~sr
instantaneous, 8.5~sr integrated) in the energy range from a few TeV to
hundreds of TeV. Like other detectors in the northern and southern hemisphere,
HAWC observes an energy-dependent anisotropy in the arrival direction
distribution of cosmic rays. The observed cosmic-ray anisotropy is dominated by
a dipole moment with phase $\alpha\approx40^{\circ}$ and amplitude that slowly
rises in relative intensity from $8\times10^{-4}$ at 2 TeV to $14\times10^{-4}$
around 30.3 TeV, above which the dipole decreases in strength. A significant
large-scale ($>60^{\circ}$ in angular extent) signal is also observed in the
quadrupole and octupole moments, and significant small-scale features are also
present, with locations and shapes consistent with previous observations.
Compared to previous measurements in this energy range, the HAWC cosmic-ray sky
maps improve on the energy resolution and fit precision of the anisotropy.
These data can be used in an effort to better constrain local cosmic-ray
accelerators and the intervening magnetic fields.
","[{""version"":""v1"",""created"":""Fri, 4 May 2018 16:43:50 GMT""},{""version"":""v2"",""created"":""Mon, 7 May 2018 07:46:21 GMT""},{""version"":""v3"",""created"":""Fri, 20 Jul 2018 21:56:54 GMT""}]","2018-09-24"
"1805.01848","Dipyaman Pramanik","Sandhya Choubey, Debajyoti Dutta and Dipyaman Pramanik","Invisible neutrino decay in the light of NOvA and T2K data","7 pages, 6 figures",,"10.1007/JHEP08(2018)141",,"hep-ph","http://arxiv.org/licenses/nonexclusive-distrib/1.0/","  We probe for evidence of invisible neutrino decay in the latest NOvA and T2K
data. It is seen that both NOvA and T2K data sets are better fitted when one
allows for invisible neutrino decay. We consider a scenario where only the
third neutrino mass eigenstate $\nu_3$ is unstable and decays into invisible
components. The best-fit value for the $\nu_3$ lifetime is obtained as
$\tau_{3}/m_{3} = 3.16\times 10^{-12}$ s/eV from the analysis of the NOvA
neutrino data and $\tau_{3}/m_{3} = 1.0\times 10^{-11}$ s/eV from the analysis
of the T2K neutrino and anti-neutrino data. The combined analysis of NOvA and
T2K gives $\tau_{3}/m_{3} = 5.01\times 10^{-12}$ s/eV as the best-fit lifetime.
However, the statistical significance for this preference is weak with the
no-decay hypothesis still allowed at close to 1.5$\sigma$ C.L. from the
combined data sets, while the two experiment individually are consistent with
no-decay even at the 1$\sigma$ C.L. At 3$\sigma$ C.L., the NOvA and T2K data
give a lower limit on the neutrino lifetime of $\tau_{3}/m_{3}$ is
$\tau_{3}/m_{3} \geq 7.22 \times 10^{-13}$ s/eV and $\tau_{3}/m_{3} \geq 1.41
\times 10^{-12}$ s/eV, respectively, while NOvA and T2K combined constrain
$\tau_{3}/m_{3} \geq 1.50 \times 10^{-12}$ s/eV. We also show that in presence
of decay the best-fit value in the $\sin^{2}\theta_{23}$ vs $\Delta m^{2}_{32}$
plane changes significantly and the allowed regions increase significantly
towards higher $\sin^{2}\theta_{23}$.
","[{""version"":""v1"",""created"":""Fri, 4 May 2018 16:44:36 GMT""}]","2018-09-26"
"1805.01849","Michele Reticcioli","Michele Reticcioli, Martin Setvin, Michael Schmid, Ulrike Diebold,
  Cesare Franchini","Formation and dynamics of small polarons on the rutile TiO$_2$(110)
  surface",,"Phys. Rev. B 98, 045306 (2018)","10.1103/PhysRevB.98.045306",,"cond-mat.mtrl-sci physics.chem-ph physics.comp-ph","http://arxiv.org/licenses/nonexclusive-distrib/1.0/","  Charge trapping and formation of polarons is a pervasive phenomenon in
transition metal oxide compounds, in particular at the surface, affecting
fundamental physical properties and functionalities of the hosting materials.
Here we investigate via first-principle techniques the formation and dynamics
of small polarons on the reduced surface of titanium dioxide, an archetypal
system for polarons, for a wide range of oxygen vacancy concentrations. We
report how the essential features of polarons can be adequately accounted in
terms of few quantities: the local structural and chemical environment, the
attractive interaction between negatively charged polarons and positively
charged oxygen vacancies, and the spin-dependent polaron-polaron Coulomb
repulsion. We combined molecular dynamics simulations on realistic samples
derived from experimental observations with simplified static models, aiming to
disentangle the various variables at play. We find that depending on the
specific trapping site, different types of polarons can be formed, with
distinct orbital symmetries and different degree of localization and structural
distortion. The energetically most stable polaron site is the subsurface Ti
atom below the undercoordinated surface Ti atom, owing to a small energy cost
to distort the lattice and a suitable electrostatic potential. Polaron-polaron
repulsion and polaron-vacancy attraction determine the spatial distribution of
polarons as well as the energy of the polaronic in-gap state. In the range of
experimentally reachable oxygen vacancy concentrations the calculated data are
in excellent agreement with observations, thus validating the overall
interpretation.
","[{""version"":""v1"",""created"":""Fri, 4 May 2018 16:46:47 GMT""}]","2018-07-25"
"1805.01850","Oct\'avio Junqueira","O. C. Junqueira, A. D. Pereira, G. Sadovski, R. F. Sobreiro, A. A.
  Tomaz","Absence of radiative corrections in 4-dimensional topological Yang-Mills
  theories","8 pages. Final version to appear in the Physical Review D (Rapid
  communications)","Phys. Rev. D 98, 021701 (2018)","10.1103/PhysRevD.98.021701",,"hep-th","http://arxiv.org/licenses/nonexclusive-distrib/1.0/","  We prove that all connected n-point Green functions of four-dimensional
topological Yang-Mills theories quantized in the (anti-)self-dual Landau gauges
are tree-level exact, i.e. there are no radiative corrections in this gauge
choice.
","[{""version"":""v1"",""created"":""Fri, 4 May 2018 16:48:01 GMT""},{""version"":""v2"",""created"":""Wed, 4 Jul 2018 14:52:05 GMT""}]","2018-07-25"
