"1806.02989","Ulrich Kolb","Ulrich Kolb, Marcus Brodeur, Nick Braithwaite, Shailey Minocha","A Robotic Telescope For University-Level Distance Teaching","Accepted for publication in the proceeding of the Robotic Telescopes,
  Student Research, and Education Conference, June 2017 (RTSRE 2017)",,,,"physics.ed-ph astro-ph.IM","http://arxiv.org/licenses/nonexclusive-distrib/1.0/","  We present aspects of the deployment of a remotely operable telescope for
teaching practical science to distance learning undergraduate students. We
briefly describe the technical realization of the facility, PIRATE, in Mallorca
and elaborate on how it is embedded in the Open University curriculum. The
PIRATE teaching activities were studied as part of a wider research project
into the importance of realism, sociability and meta-functionality for the
effectiveness of virtual and remote laboratories in teaching practical science.
We find that students accept virtual experiments (e.g. a telescope simulator)
when they deliver genuine, 'messy' data, clarify how they differ from a
realistic portrayal, and are flagged as training tools. A robotic telescope is
accepted in place of on-site practical work when realistic activities are
included, the internet connection is stable, and when there is at least one
live video feed. The robotic telescope activity should include group work and
facilitate social modes of learning. Virtual experiments, though normally
considered as asynchronous tools, should also include social interaction. To
improve student engagement and learning outcomes a greater situational
awareness for the robotic telescope setting should be devised. We conclude this
report with a short account of the current status of PIRATE after its
relocation from Mallorca to Tenerife, and its integration into the OpenScience
Observatories.
","[{""version"":""v1"",""created"":""Fri, 8 Jun 2018 07:04:11 GMT""}]","2018-06-11"
"1806.02990","Thanja Lamberts","T Lamberts","From interstellar carbon monosulfide to methyl mercaptan: paths of least
  resistance","Accepted for publication in A&A Lett",,"10.1051/0004-6361/201832830",,"astro-ph.GA","http://arxiv.org/licenses/nonexclusive-distrib/1.0/","  The 29 reactions linking carbon monosulfide (CS) to methyl mercaptan (CH3SH)
via ten intermediate radicals and molecules have been characterized with
relevance to surface chemistry in cold interstellar ices. More intermediate
species than previously considered are found likely to be present in these
ices, such as trans- and cis-HCSH. Both activation and reaction energies have
been calculated, along with low-temperature (T > 45~K) rate constants for the
radical-neutral reactions. For barrierless radical-radical reactions on the
other hand, branching ratios have been determined. The combination of these two
sets of information provides, for the first time, quantitative information on
the full H + CS reaction network. Early on in this network, that is, early on
in the lifetime of an interstellar cloud, HCS is the main radical, while later
on this becomes first CH2SH and finally CH3S.
","[{""version"":""v1"",""created"":""Fri, 8 Jun 2018 07:04:36 GMT""}]","2018-06-11"
"1806.02991","Po-Keng Cheng","Po-Keng Cheng (SAF), Fr\'ed\'eric Planchet (SAF)","Stochastic Deflator for an Economic Scenario Generator with Five Factors",,,,,"q-fin.RM","http://arxiv.org/licenses/nonexclusive-distrib/1.0/","  In this paper, we implement a stochastic deflator with five economic and
financial risk factors: interest rates, market price of risk, stock prices,
default intensities, and convenience yields. We examine the deflator with
different financial assets, such as stocks, zero-coupon bonds, vanilla options,
and corporate coupon bonds. We find required regularity conditions to implement
our stochastic deflator. Our numerical results show the reliability of the
deflator approach in pricing financial derivatives.
","[{""version"":""v1"",""created"":""Fri, 8 Jun 2018 07:07:54 GMT""},{""version"":""v2"",""created"":""Wed, 29 Aug 2018 12:11:23 GMT""},{""version"":""v3"",""created"":""Fri, 15 Feb 2019 02:17:43 GMT""}]","2019-02-18"
"1806.02992","Christian Wuthrich","Christian Wuthrich","When the actual world is not even possible","19 pages, 1 figure, 2018 revision",,,,"physics.hist-ph gr-qc","http://arxiv.org/licenses/nonexclusive-distrib/1.0/","  Approaches to quantum gravity often involve the disappearance of space and
time at the fundamental level. The metaphysical consequences of this
disappearance are profound, as is illustrated with David Lewis's analysis of
modality. As Lewis's possible worlds are unified by the spatiotemporal
relations among their parts, the non-fundamentality of spacetime---if borne
out---suggests a serious problem for his analysis: his pluriverse, for all its
ontological abundance, does not contain our world. Although the mere
existence---as opposed to the fundamentality---of spacetime must be recovered
from the fundamental structure in order to guarantee the empirical coherence of
the non-spatiotemporal fundamental theory, it does not suffice to salvage
Lewis's theory of modality from the charge of rendering our actual world
impossible.
","[{""version"":""v1"",""created"":""Fri, 8 Jun 2018 07:08:19 GMT""},{""version"":""v2"",""created"":""Mon, 11 Jun 2018 05:46:47 GMT""},{""version"":""v3"",""created"":""Tue, 12 Jun 2018 15:15:53 GMT""}]","2018-06-13"
"1806.02993","Seyed Akbar Jafari","Alireza Habibi, S. A. Jafari, S. Rouhani","Resilience of Majorana Fermions in the face of Disorder","please compile with included .bbl file","Phys. Rev. B 98, 035142 (2018)","10.1103/PhysRevB.98.035142",,"cond-mat.str-el cond-mat.dis-nn cond-mat.supr-con","http://arxiv.org/licenses/nonexclusive-distrib/1.0/","  We elucidate the reduction of the winding number (WN) caused by the onsite
disorder in a higher WN next nearest neighbor XY model. When disorder becomes
strong enough, Majorana edge modes become critically extended, beyond which
they collapse into Anderson localized (AL) states in the bulk, resulting in a
topological Anderson insulating state (TAI). We identify a resilience threshold
$W_t$ for every pair of Majorana fermions (MFs). In response to increasing
disorder every pair of MFs collapse into AL bulk at their resilience threshold.
For very strong disorder, all Majorana fermions collapse and a topologically
trivial state is obtained. We show that the threshold values are deeply related
to the localization length of Majorana fermions, which can be efficiently
calculated by an appropriate modification of the transfer matrix method. At the
topological transition point, localization length of the zero modes diverges
and the system becomes scale invariant. The number of peaks in the localization
length as the function of disorder strength determines the number of zero modes
in the clean state before disorder is introduced. This finding elevates the
transfer matrix method to the level of a tool for determination of the
topological index of both clean and disordered systems.
","[{""version"":""v1"",""created"":""Fri, 8 Jun 2018 07:17:18 GMT""}]","2018-08-14"
"1806.02994","Xu Yang","Robert (Xu) Yang","Existence of Large Independent-Like Sets",,,,,"math.FA","http://arxiv.org/licenses/nonexclusive-distrib/1.0/","  Let $G$ be a compact abelian group and $\Gamma$ be its discrete dual group.
For $N \in \mathbb{N}$, we define a class of independent-like sets, $N$-PR
sets, as a set in $\Gamma$ such that every $\mathbb{Z}_N$-valued function
defined on the set can be interpolated by a character in $G$.
  These sets are examples of $\varepsilon$-Kronecker sets and Sidon sets. In
this paper we study various properties of $N$-PR sets. We give a
characterization of $N$-PR sets, describe their structures and prove the
existence of large $N$-PR sets.
","[{""version"":""v1"",""created"":""Fri, 8 Jun 2018 07:20:13 GMT""}]","2018-06-11"
"1806.02995","Harshitha Shankar Kotian","Harshitha S. Kotian, Shalini Harkar, Shubham Joge, Ayushi Mishra,
  Amith Zafal, Varsha Singh, Manoj M. Varma","Spatial Awareness of a Bacterial Swarm",,,,,"physics.bio-ph","http://arxiv.org/licenses/nonexclusive-distrib/1.0/","  Bacteria are perhaps the simplest living systems capable of complex behaviour
involving sensing and coherent, collective behaviour an example of which is the
phenomena of swarming on agar surfaces. Two fundamental questions in bacterial
swarming is how the information gathered by individual members of the swarm is
shared across the swarm leading to coordinated swarm behaviour and what
specific advantages does membership of the swarm provide its members in
learning about their environment. In this article, we show a remarkable example
of the collective advantage of a bacterial swarm which enables it to sense
inert obstacles along its path. Agent based computational model of swarming
revealed that independent individual behaviour in response to a two-component
signalling mechanism could produce such behaviour. This is striking because
independent individual behaviour without any explicit communication between
agents was found to be sufficient for the swarm to effectively compute the
gradient of signalling molecule concentration across the swarm and respond to
it.
","[{""version"":""v1"",""created"":""Fri, 8 Jun 2018 07:25:48 GMT""}]","2018-06-11"
"1806.02996","Anupam Bhardwaj","S. M. Kanbur, M. Marconi, A. Bhardwaj, R. Kundu and H. P. Singh","The Role of Opacities in Stellar Pulsation","6 pages, 3 Figures, Proceeding for the ""Workshop on Astrophysical
  Opacities""","ASP Conf. Ser. (2018), 515, 189",,,"astro-ph.SR","http://arxiv.org/licenses/nonexclusive-distrib/1.0/","  We examine the role of opacities in stellar pulsation with reference to
Cepheids and RR Lyraes, and examine the effect of augmented opacities on the
theoretical pulsation light curves in key temperature ranges. The temperature
ranges are provided by recent experimental and theoretical work that have
suggested that the iron opacities have been considerably underestimated. For
Cepheids, we find that the augmented opacities have noticeable effects in
certain period ranges (around $\log P \approx 1$) even though there is a
degeneracy with mixing length. We also find significant effects in theoretical
models of B-star pulsators.
","[{""version"":""v1"",""created"":""Fri, 8 Jun 2018 07:26:23 GMT""}]","2018-06-11"
"1806.02997","Aleksei Vasilev","Aleksei Vasilev, Vladimir Golkov, Marc Meissner, Ilona Lipp, Eleonora
  Sgarlata, Valentina Tomassini, Derek K. Jones, Daniel Cremers","q-Space Novelty Detection with Variational Autoencoders","11 pages, 2 figures",,,,"stat.ML cs.AI cs.CV cs.LG cs.NE","http://arxiv.org/licenses/nonexclusive-distrib/1.0/","  In machine learning, novelty detection is the task of identifying novel
unseen data. During training, only samples from the normal class are available.
Test samples are classified as normal or abnormal by assignment of a novelty
score. Here we propose novelty detection methods based on training variational
autoencoders (VAEs) on normal data. Since abnormal samples are not used during
training, we define novelty metrics based on the (partially complementary)
assumptions that the VAE is less capable of reconstructing abnormal samples
well; that abnormal samples more strongly violate the VAE regularizer; and that
abnormal samples differ from normal samples not only in input-feature space,
but also in the VAE latent space and VAE output. These approaches, combined
with various possibilities of using (e.g. sampling) the probabilistic VAE to
obtain scalar novelty scores, yield a large family of methods. We apply these
methods to magnetic resonance imaging, namely to the detection of
diffusion-space (q-space) abnormalities in diffusion MRI scans of multiple
sclerosis patients, i.e. to detect multiple sclerosis lesions without using any
lesion labels for training. Many of our methods outperform previously proposed
q-space novelty detection methods. We also evaluate the proposed methods on the
MNIST handwritten digits dataset and show that many of them are able to
outperform the state of the art.
","[{""version"":""v1"",""created"":""Fri, 8 Jun 2018 07:28:36 GMT""},{""version"":""v2"",""created"":""Thu, 25 Oct 2018 17:34:51 GMT""}]","2018-10-26"
"1806.02998","Guillaume Noyel","Guillaume Noyel (CMM)","Logarithmic mathematical morphology: a new framework adaptive to
  illumination changes",,"23rd Iberoamerican Congress on Pattern Recognition (CIARP 2018),
  Nov 2018, Madrid, Spain. Springer International Publishing, Lecture Notes in
  Computer Science, 11401, pp.453-461, 2019, Progress in Pattern Recognition,
  Image Analysis, Computer Vision, and Applications.
  https://atvs.ii.uam.es/ciarp2018/","10.1007/978-3-030-13469-3_53",,"cs.CV math.GN math.NA","http://arxiv.org/licenses/nonexclusive-distrib/1.0/","  A new set of mathematical morphology (MM) operators adaptive to illumination
changes caused by variation of exposure time or light intensity is defined
thanks to the Logarithmic Image Processing (LIP) model. This model based on the
physics of acquisition is consistent with human vision. The fundamental
operators, the logarithmic-dilation and the logarithmic-erosion, are defined
with the LIP-addition of a structuring function. The combination of these two
adjunct operators gives morphological filters, namely the logarithmic-opening
and closing, useful for pattern recognition. The mathematical relation existing
between ``classical'' dilation and erosion and their logarithmic-versions is
established facilitating their implementation. Results on simulated and real
images show that logarithmic-MM is more efficient on low-contrasted information
than ``classical'' MM.
","[{""version"":""v1"",""created"":""Fri, 8 Jun 2018 07:28:42 GMT""},{""version"":""v2"",""created"":""Mon, 26 Nov 2018 09:51:12 GMT""},{""version"":""v3"",""created"":""Mon, 25 Mar 2019 15:51:21 GMT""}]","2019-04-22"
"1806.02999","Stephan Roche","Kenan Song, David Soriano, Aron W. Cummings, Roberto Robles, Pablo
  Ordejon, and Stephan Roche","Spin Proximity Effects in Graphene/Topological Insulator
  Heterostructures",,"Nano Letters 18(3), 2033 (2018)","10.1021/acs.nanolett.7b05482",,"cond-mat.mes-hall","http://arxiv.org/licenses/nonexclusive-distrib/1.0/","  Enhancing the spin-orbit interaction in graphene, via proximity effects with
topological insulators, could create a novel 2D system that combines nontrivial
spin textures with high electron mobility. In order to engineer practical
spintronics applications with such graphene/topological insulator (Gr/TI)
heterostructures, an understanding of the hybrid spin-dependent properties is
essential. {However to date, despite the large number of experimental studies
on Gr/TI heterostructures reporting a great variety of remarkable (spin)
transport phenomena, little is known about the true nature of the spin texture
of the interface states as well as their role on the measured properties. Here
we use {\it ab initio} simulations and tight-binding models to determine the
precise spin texture of electronic states in graphene interfaced with a
Bi$_2$Se$_3$ topological insulator. Our calculations predict the emergence of a
giant spin lifetime anisotropy in the graphene layer, which should be a
measurable hallmark of spin transport in Gr/TI heterostructures, and suggest
novel types of spin devices
","[{""version"":""v1"",""created"":""Fri, 8 Jun 2018 07:37:41 GMT""}]","2018-06-11"
"1806.03000","Taegyun Jeon","Junghoon Seo, Jeongyeol Choe, Jamyoung Koo, Seunghyeon Jeon, Beomsu
  Kim, Taegyun Jeon","Noise-adding Methods of Saliency Map as Series of Higher Order Partial
  Derivative","presented at 2018 ICML Workshop on Human Interpretability in Machine
  Learning (WHI 2018), Stockholm, Sweden",,,,"cs.LG stat.ML","http://arxiv.org/licenses/nonexclusive-distrib/1.0/","  SmoothGrad and VarGrad are techniques that enhance the empirical quality of
standard saliency maps by adding noise to input. However, there were few works
that provide a rigorous theoretical interpretation of those methods. We
analytically formalize the result of these noise-adding methods. As a result,
we observe two interesting results from the existing noise-adding methods.
First, SmoothGrad does not make the gradient of the score function smooth.
Second, VarGrad is independent of the gradient of the score function. We
believe that our findings provide a clue to reveal the relationship between
local explanation methods of deep neural networks and higher-order partial
derivatives of the score function.
","[{""version"":""v1"",""created"":""Fri, 8 Jun 2018 07:41:41 GMT""}]","2018-06-11"
"1806.03001","Renaud Papoular","Renaud Papoular","A new interpretation of Serkowski's polarization law","10 pages, 10 figures; to appear in MNRAS 2018",,"10.1093/mnras/sty1530",,"astro-ph.GA","http://arxiv.org/licenses/nonexclusive-distrib/1.0/","  The basic tenets of the alternative interpretation to be presented here are
that the spectral profiles of the star light polarization peaks observed in the
visible and near IR are a result of the optical properties of silicate grains
in the same spectral range, not of the grain size, provided it remains within
the range of Rayleigh's approximation. The silicate properties are those
obtained experimentally by Scott and Duley \cite{sco} for the non-iron bearing
\bf amorphous \rm forsterite and enstatite. The whole range of observed
Serkowski polarization profiles can be simulated with mixtures made of
forsterite plus an increasing fraction (0 to 0.5) of enstatite as the spectral
peak shifts from 0.8 to 0.3 $\mu$m. Fits to individual observed polarization
spectra are also demonstrated. The optical extinction of silicates in the
vis/IR (the ""transparency range"") can be understood by analogy with the
thoroughly studied amorphous hydrogenated carbons and amorphous silica. It is
due to structural disorder (dangling bonds and coordination defects) and
impurities, which give rise to electronic states in the forbidden gap of
semi-conductors. Because they are partially localized, their extinction power
is dramatically reduced and has been ignored or simply described by a low, flat
plateau. As their number density depends on the environment, one expects
variations in the ratio of optical extinction coefficients in the visible and
mid-IR.
","[{""version"":""v1"",""created"":""Fri, 8 Jun 2018 07:44:42 GMT""}]","2018-06-27"
"1806.03002","Taegyun Jeon","Junghoon Seo, Seunghyun Jeon, Taegyun Jeon","Domain Adaptive Generation of Aircraft on Satellite Imagery via
  Simulated and Unsupervised Learning","presented at the International Workshop on Machine Learning for
  Artificial Intelligence Platforms held in 2017 Asian Conference on Machine
  Learning (MLAIP@ACML)",,,,"cs.CV","http://arxiv.org/licenses/nonexclusive-distrib/1.0/","  Object detection and classification for aircraft are the most important tasks
in the satellite image analysis. The success of modern detection and
classification methods has been based on machine learning and deep learning.
One of the key requirements for those learning processes is huge data to train.
However, there is an insufficient portion of aircraft since the targets are on
military action and oper- ation. Considering the characteristics of satellite
imagery, this paper attempts to provide a framework of the simulated and
unsupervised methodology without any additional su- pervision or physical
assumptions. Finally, the qualitative and quantitative analysis revealed a
potential to replenish insufficient data for machine learning platform for
satellite image analysis.
","[{""version"":""v1"",""created"":""Fri, 8 Jun 2018 07:46:34 GMT""}]","2018-06-11"
"1806.03003","Oscar Jarrin","Diego Chamorro (LaMME), Oscar Jarrin (LaMME), Pierre-Gilles
  Lemari\'e-Rieusset (LaMME)","Some Liouville theorems for stationary Navier-Stokes equations in
  Lebesgue and Morrey spaces",,,,,"math.AP","http://arxiv.org/licenses/nonexclusive-distrib/1.0/","  Uniqueness of Leray solutions of the 3D Navier-Stokes equations is a
challenging open problem. In this article we will study this problem for the 3D
stationary Navier-Stokes equations and under some additional hypotheses, stated
in terms of Lebesgue and Morrey spaces, we will show that the trivial solution
U = 0 is the unique solution. This type of results are known as Liouville
theorems.
","[{""version"":""v1"",""created"":""Fri, 8 Jun 2018 07:46:37 GMT""}]","2018-06-11"
"1806.03004","Bal\'azs Szab\'o","Balazs Szabo, Zsolt Kovacs, Sandra Wegner, Ahmed Ashour, David
  Fischer, Ralf Stannarius, Tamas Borzsonyi","Flow of anisometric particles in a quasi-2D hopper","6 pages, 6 figures, submitted to Phys. Rev. E",,"10.1103/PhysRevE.97.062904",,"cond-mat.soft","http://arxiv.org/licenses/nonexclusive-distrib/1.0/","  The stationary flow field in a quasi-two-dimensional hopper is investigated
experimentally. The behavior of materials consisting of beads and elongated
particles with different aspect ratio is compared. We show, that while the
vertical velocity in the flowing region can be fitted with a Gaussian function
for beads, in the case of elongated grains the flowing channel is narrower and
is bordered with sharper velocity gradient. For this case, we quantify
deviations from the Gaussian velocity profile. Relative velocity fluctuations
are considerably larger and slower for elongated grains.
","[{""version"":""v1"",""created"":""Fri, 8 Jun 2018 07:52:36 GMT""}]","2018-08-01"
"1806.03005","Lidia Stoppino Prof","Miguel \'Angel Barja, Rita Pardini, Lidia Stoppino","Higher dimensional Clifford-Severi equalities","14 pages; this is an expanded version of the final section of
  arXiv:1606.03290v4 [math.AG]",,,,"math.AG","http://arxiv.org/licenses/nonexclusive-distrib/1.0/","  Let $X$ be a smooth complex projective variety, $a\colon X\rightarrow A$ a
morphism to an abelian variety such that $\mathrm{Pic}^0(A)$ injects into
$\mathrm{Pic}^0(X)$ and let $L$ be a line bundle on $X$; denote by $h^0_a(X,L)$
the minimum of $h^0(X,L\otimes a^*\alpha)$ for $\alpha\in \mathrm{Pic}^0(A)$.
  The so-called Clifford-Severi inequalities have been proven in
arXiv:1303.3045 [math.AG] and arXiv:1606.03290 [math.AG]}; in particular, for
any $L$ there is a lower bound for the volume given by:
  $$\mathrm{vol}(L)\ge n! h^0_a(X,L),$$
  and, if $K_X-L$ is pseudoeffective,
  $$\mathrm{vol}(L)\ge 2n! h^0_a(X,L).$$ In this paper we characterize
varieties and line bundles for which the above Clifford-Severi inequalities are
equalities.
","[{""version"":""v1"",""created"":""Fri, 8 Jun 2018 07:59:43 GMT""}]","2018-06-11"
"1806.03006","Geoffroy Horel","Joana Cirici and Geoffroy Horel","\'Etale cohomology, purity and formality with torsion coefficients","27 pages",,,,"math.AT","http://arxiv.org/licenses/nonexclusive-distrib/1.0/","  We use Galois group actions on \'etale cohomology to prove results of
formality for dg-operads and dg-algebras with torsion coefficients. Our theory
applies, among other related constructions, to the dg-operad of singular chains
on the operad of little disks and to the dg-algebra of singular cochains on the
configuration space of points in the complex space. The formality that we
obtain is only up to a certain degree, which depends on the cardinality of the
field of coefficients.
","[{""version"":""v1"",""created"":""Fri, 8 Jun 2018 08:00:22 GMT""}]","2018-06-11"
"1806.03007","Motohiko Ezawa","Motohiko Ezawa","Topological switch between second-order topological insulators and
  topological crystalline insulators","5 pages, 5 figures","Phys. Rev. Lett. 121, 116801 (2018)","10.1103/PhysRevLett.121.116801",,"cond-mat.mes-hall","http://arxiv.org/licenses/nonexclusive-distrib/1.0/","  We investigate a topological switch between second-order topological
insulators (SOTIs) and topological crystalline insulators (TCIs). Both the SOTI
and the TCI are protected by the mirror and inversion symmetries, for which we
define the bulk topological numbers of the same type. We take examples of
square nanodisks on the square lattice and hexagonal nanodisks on the
triangular lattice. When inplane magnetic field is introduced parallel to one
of the helical edges, the system becomes a TCI. The conductance along the edge
is 1 in the unit of the conductance quantum $e^2/h$. As the inplane field is
rotated, the conductance decreases as the gap of the edge states opens. When it
becomes orthogonal to a diagonal line, two topological corner states emerge on
its vertices and the system becomes a SOTI. When it becomes parallel to another
edge, the system becomes again a TCI and the conductance along the original
edge becomes 0 but 1 along a new edge. This may be used as a basis of a
topological circuit changing switch. Alternatively, the device may be used as a
sensor to measure local magnetization on a sample surface with a resolution of
10 nm.
","[{""version"":""v1"",""created"":""Fri, 8 Jun 2018 08:04:51 GMT""}]","2018-09-19"
