"1806.02867","Guy Lorberbom","Guy Lorberbom (Technion), Andreea Gane (MIT), Tommi Jaakkola (MIT),
  Tamir Hazan (Technion)","Direct Optimization through $\arg \max$ for Discrete Variational
  Auto-Encoder","Accepted by Neural Information Processing Systems (NeurIPS 2019)",,,,"cs.LG stat.ML","http://arxiv.org/licenses/nonexclusive-distrib/1.0/","  Reparameterization of variational auto-encoders with continuous random
variables is an effective method for reducing the variance of their gradient
estimates. In the discrete case, one can perform reparametrization using the
Gumbel-Max trick, but the resulting objective relies on an $\arg \max$
operation and is non-differentiable. In contrast to previous works which resort
to softmax-based relaxations, we propose to optimize it directly by applying
the direct loss minimization approach. Our proposal extends naturally to
structured discrete latent variable models when evaluating the $\arg \max$
operation is tractable. We demonstrate empirically the effectiveness of the
direct loss minimization technique in variational autoencoders with both
unstructured and structured discrete latent variables.
","[{""version"":""v1"",""created"":""Thu, 7 Jun 2018 19:09:21 GMT""},{""version"":""v2"",""created"":""Thu, 11 Oct 2018 17:07:53 GMT""},{""version"":""v3"",""created"":""Sat, 9 Feb 2019 19:34:43 GMT""},{""version"":""v4"",""created"":""Thu, 30 May 2019 13:49:37 GMT""},{""version"":""v5"",""created"":""Sun, 8 Dec 2019 08:59:53 GMT""}]","2019-12-10"
"1806.02868","Taras Banakh","Taras Banakh, Serhii Bardyla, Alex Ravsky","The closedness of complete subsemilattices in functionally Hausdorff
  semitopological semilattices","6 pages","Topology Appl. 267 (2019) 106874","10.1016/j.topol.2019.106874",,"math.GN","http://arxiv.org/licenses/nonexclusive-distrib/1.0/","  A topologized semilattice $X$ is complete if each non-empty chain $C\subset
X$ has $\inf C\in\bar C$ and $\sup C\in\bar C$. It is proved that for any
complete subsemilattice $X$ of a functionally Hausdorff semitopological
semilattice $Y$ the partial order $P=\{(x,y)\in X\times X:xy=x\}$ of $X$ is
closed in $Y\times Y$ and hence $X$ is closed in $Y$. This implies that for any
continuous homomorphism $h:X\to Y$ from a compete topologized semilattice $X$
to a functionally Hausdorff semitopological semilattice $Y$ the image $h(X)$ is
closed in $Y$. The functional Hausdorffness of $Y$ in these two results can be
replaced by the weaker separation axiom $\vec T_{2\delta}$, defined in this
paper.
","[{""version"":""v1"",""created"":""Thu, 7 Jun 2018 19:10:39 GMT""},{""version"":""v2"",""created"":""Sun, 3 Mar 2019 22:26:45 GMT""}]","2020-04-09"
"1806.02869","Taras Banakh","Taras Banakh, Serhii Bardyla","Complete topologized posets and semilattices","14 pages","Topology Proc. 57 (2021) 177-196",,,"math.GN","http://arxiv.org/licenses/nonexclusive-distrib/1.0/","  In this paper we discuss the notion of completeness of topologized posets and
survey some recent results on closedness properties of complete topologized
semilattices.
","[{""version"":""v1"",""created"":""Thu, 7 Jun 2018 19:14:47 GMT""},{""version"":""v2"",""created"":""Sun, 3 Mar 2019 22:22:47 GMT""},{""version"":""v3"",""created"":""Mon, 7 Feb 2022 10:14:32 GMT""}]","2022-02-08"
"1806.02870","Yuri Kovalev","M.H. Cohen (Caltech), H.D. Aller (U Michigan), M.F. Aller (U
  Michigan), T. Hovatta (U Turku), P. Kharb (NCRA-TIFR), Y.Y. Kovalev (ASC
  Lebedev, MPIPT, MPIfR), M.L. Lister (Purdue U), D.L. Meier (Caltech), A.B.
  Pushkarev (CrAO, ASC Lebedev), T. Savolainen (Aalto U, MPIfR)","Reversals in the Direction of Polarization Rotation in OJ 287","16 pages, 12 figures, 3 tables; electronic tables are available from
  the preprint source; accepted by ApJ","ApJ 862 (2018) 1","10.3847/1538-4357/aacb31",,"astro-ph.GA astro-ph.HE","http://arxiv.org/licenses/nonexclusive-distrib/1.0/","  We have obtained a smooth time series for the Electric Vector Position Angle
(EVPA) of the blazar OJ 287 at centimeter wavelengths, by making $\pm n\pi$
adjustments to archival values from 1974 to 2016. The data display rotation
reversals in which the EVPA rotates counter-clockwise (CCW) for 180 deg and
then rotates clockwise (CW) by a similar amount. The time scale of the
rotations is a few weeks to a year, and the scale for a double rotation,
including the reversal, is one to three years. We have seen four of these
events in 40 years. A model consisting of two successive outbursts in polarized
flux density, with EVPAs counter-rotating, superposed on a steady polarized
jet, can explain many of the details of the observations. Polarization images
support this interpretation. The model can also help to explain similar events
seen at optical wavelengths. The outbursts needed for the model can be
generated by the super-magnetosonic jet model of Nakamura et al. (2010) and
Nakamura and Meier (2014), which requires a strong helical magnetic field. This
model produces forward and reverse pairs of fast and slow MHD waves, and the
plasma inside the two fast/slow pairs rotates around the jet axis, but in
opposite directions.
","[{""version"":""v1"",""created"":""Thu, 7 Jun 2018 19:15:36 GMT""}]","2018-07-24"
"1806.02871","G\'abor S\'arosi","Vijay Balasubramanian, Ben Craps, Tim De Jonckheere, G\'abor S\'arosi","Entanglement versus entwinement in symmetric product orbifolds","21 pages, v2: short entwinement review section added, and prev.
  section 2 rewritten to increase clarity. Matches published version",,"10.1007/JHEP01(2019)190",,"hep-th quant-ph","http://arxiv.org/licenses/nonexclusive-distrib/1.0/","  We study the entanglement entropy of gauged internal degrees of freedom in a
two dimensional symmetric product orbifold CFT, whose configurations consist of
$N$ strands sewn together into ""long"" strings, with wavefunctions symmetrized
under permutations. In earlier work a related notion of ""entwinement"" was
introduced. Here we treat this system analogously to a system of $N$ identical
particles. From an algebraic point of view, we point out that the reduced
density matrix on $k$ out of $N$ particles is not associated with a subalgebra
of operators, but rather with a linear subspace, which we explain is
sufficient. In the orbifold CFT, we compute the entropy of a single strand in
states holographically dual in the D1/D5 system to a conical defect geometry or
a massless BTZ black hole and find a result identical to entwinement. We also
calculate the entropy of two strands in the state that represents the conical
defect; the result differs from entwinement. In this case, matching entwinement
would require finding a gauge-invariant way to impose continuity across
strands.
","[{""version"":""v1"",""created"":""Thu, 7 Jun 2018 19:15:53 GMT""},{""version"":""v2"",""created"":""Wed, 30 Jan 2019 16:14:33 GMT""}]","2019-02-20"
"1806.02872","Muhammad Arslan Shehzad","Bilal Abbas Naqvi, Muhammad Arslan Shehzad, Janghwan Cha, Kyung Ah
  Min, M. Farooq Khan, Sajjad Hussain, Seo Yongho, Suklyun Hong, Eom Jonghwa,
  Jung Jongwan","Idiosyncratic Approach to Visualize Degradation of Black Phosphorus",,"https://www.nature.com/articles/s41598-018-31067-4 2018","10.1038/s41598-018-31067-4","12966","cond-mat.mtrl-sci","http://arxiv.org/licenses/nonexclusive-distrib/1.0/","  Black Phosphorus (BP) is an excellent material for post graphene era due to
its layer dependent band gap, high mobility and high Ion/Ioff. However, its
poor stability in ambient poses a great challenge in its practical and
long-term usage. Optical visualization of oxidized BP is the key and foremost
step for its successful passivation from the ambience. Here, we have done a
systematic study of the oxidation of BP and developed a technique to optically
identify the oxidation of BP using Liquid Crystal (LC). Interestingly we found
that rapid oxidation of thin layers of BP makes them disappear and can be
envisaged by using the alignment of LC. The molecular dynamics simulations also
proved the preferential alignment of LC on oxidized BP. We believe that this
simple technique will be effective in passivation efforts of BP and will enable
it for exploitation of its properties in the field of electronics.
","[{""version"":""v1"",""created"":""Thu, 7 Jun 2018 19:18:32 GMT""}]","2018-08-30"
"1806.02874","Raul Santos","Raul A. Santos and Benjamin B\'eri","Fractional topological insulator precursors in spin-orbit fermion
  ladders","45 pages, 21 figures. New appendices added, accepted version","Phys. Rev. B 100, 235122 (2019)","10.1103/PhysRevB.100.235122",,"cond-mat.str-el cond-mat.mes-hall cond-mat.quant-gas","http://arxiv.org/licenses/nonexclusive-distrib/1.0/","  We study precursor states of fractional topological insulators (FTIs) in
interacting fermionic ladders with spin-orbit coupling. Within a
microscopically motivated bosonization approach, we investigate different
competing phases depending on same-spin and interspin interactions at
fractional effective filling $\nu=1/3$ per spin. In the spin-decoupled limit,
we find that strong repulsive interactions of already moderate range may lead
to a partially gapped state with two time-reversed copies of a quasi-one
dimensional Laughlin phase. This FTI precursor competes with an interleg
partially gapped phase displaying quasi long-range density wave order, however
it may be stabilized if interactions have suitable anisotropy, or are
sufficiently near SU($2$) symmetry, in leg space. When the FTI phase is
present, it is moderately robust to small interspin interactions; these
introduce competing partially gapped phases of orbital antiferromagnetic and
bond density wave character. Performing a strong coupling analysis of the FTI
precursor regime, we find that the main effect of interspin interactions is to
induce correlated quasiparticle backscattering between the precursor FTI edge
modes. Although this process competes with the topological phase, we show, by
considering an array of ladders, that its influence may disappear upon
approaching the two dimensional case. Considering time-reversal symmetry
breaking perturbations, we also describe a protocol that adiabatically pumps
$1/6$ charge per half-cycle, thus providing a quantized FTI signature arising
already in the single ladder regime.
","[{""version"":""v1"",""created"":""Thu, 7 Jun 2018 19:25:09 GMT""},{""version"":""v2"",""created"":""Tue, 5 Nov 2019 16:48:07 GMT""},{""version"":""v3"",""created"":""Wed, 20 Nov 2019 16:26:14 GMT""}]","2019-12-25"
"1806.02875","Benjamin Horne","Mauricio Gruppi, Benjamin D. Horne, Sibel Adali","An Exploration of Unreliable News Classification in Brazil and The U.S","Presented and Peer-Reviewed at NECO 2018",,,,"cs.CL","http://arxiv.org/licenses/nonexclusive-distrib/1.0/","  The propagation of unreliable information is on the rise in many places
around the world. This expansion is facilitated by the rapid spread of
information and anonymity granted by the Internet. The spread of unreliable
information is a wellstudied issue and it is associated with negative social
impacts. In a previous work, we have identified significant differences in the
structure of news articles from reliable and unreliable sources in the US
media. Our goal in this work was to explore such differences in the Brazilian
media. We found significant features in two data sets: one with Brazilian news
in Portuguese and another one with US news in English. Our results show that
features related to the writing style were prominent in both data sets and,
despite the language difference, some features have a universal behavior, being
significant to both US and Brazilian news articles. Finally, we combined both
data sets and used the universal features to build a machine learning
classifier to predict the source type of a news article as reliable or
unreliable.
","[{""version"":""v1"",""created"":""Thu, 7 Jun 2018 19:28:35 GMT""}]","2018-06-11"
"1806.02877","Siwei Lyu","Yuezun Li, Ming-Ching Chang, Siwei Lyu","In Ictu Oculi: Exposing AI Generated Fake Face Videos by Detecting Eye
  Blinking",,,,,"cs.CV","http://arxiv.org/licenses/nonexclusive-distrib/1.0/","  The new developments in deep generative networks have significantly improve
the quality and efficiency in generating realistically-looking fake face
videos. In this work, we describe a new method to expose fake face videos
generated with neural networks. Our method is based on detection of eye
blinking in the videos, which is a physiological signal that is not well
presented in the synthesized fake videos. Our method is tested over benchmarks
of eye-blinking detection datasets and also show promising performance on
detecting videos generated with DeepFake.
","[{""version"":""v1"",""created"":""Thu, 7 Jun 2018 19:36:09 GMT""},{""version"":""v2"",""created"":""Mon, 11 Jun 2018 19:28:49 GMT""}]","2018-06-13"
"1806.02878","Harini Suresh","Harini Suresh, Jen J. Gong and John Guttag","Learning Tasks for Multitask Learning: Heterogenous Patient Populations
  in the ICU","KDD 2018",,"10.1145/3219819.3219930",,"cs.LG stat.ML","http://arxiv.org/licenses/nonexclusive-distrib/1.0/","  Machine learning approaches have been effective in predicting adverse
outcomes in different clinical settings. These models are often developed and
evaluated on datasets with heterogeneous patient populations. However, good
predictive performance on the aggregate population does not imply good
performance for specific groups.
  In this work, we present a two-step framework to 1) learn relevant patient
subgroups, and 2) predict an outcome for separate patient populations in a
multi-task framework, where each population is a separate task. We demonstrate
how to discover relevant groups in an unsupervised way with a
sequence-to-sequence autoencoder. We show that using these groups in a
multi-task framework leads to better predictive performance of in-hospital
mortality both across groups and overall. We also highlight the need for more
granular evaluation of performance when dealing with heterogeneous populations.
","[{""version"":""v1"",""created"":""Thu, 7 Jun 2018 19:36:19 GMT""}]","2018-06-11"
"1806.02879","Krzysztof Gofryk","K. Shrestha, D. Antonio, J-C. Griveau, K. Proke\v{s}, P. Gaczy\'nski,
  E. Colineau, R. Caciuffo, and K. Gofryk","On the magnetic and electronic properties of NpPdSn","Accepted for publication in Physical Review Materials (June 7, 2018)","Phys. Rev. Materials 2, 074401 (2018)","10.1103/PhysRevMaterials.2.074401",,"cond-mat.str-el cond-mat.mtrl-sci","http://arxiv.org/licenses/nonexclusive-distrib/1.0/","  We have studied NpPdSn by means of the heat capacity, electrical resistivity,
Seebeck and Hall effect, $^{237}$Np M\""{o}ssbauer spectroscopy, and neutron
diffraction measurements in the temperature range 2-300 K and under magnetic
fields up to 14 T. NpPdSn orders antiferromagnetically below the N\'eel
temperature $T_N$ = 19 K and shows localized magnetism of Np$^{3+}$ ion with a
a doubly degenerate ground state. In the magnetic state the electrical
resistivity and heat capacity are characterized by electron-magnon scattering
with spin-waves spectrum typical of anisotropic antiferromagnets. An enhanced
Sommerfeld coefficient and typical behavior of magnetorestistivity, Seebeck and
Hall coefficients are all characteristic of systems with strong electronic
correlations. The low temperature antiferromagnetic state of NpPdSn is verified
by neutron diffraction and $^{237}$Np M\""{o}ssbauer spectroscopy and possible
magnetic structures are discussed.
","[{""version"":""v1"",""created"":""Thu, 7 Jun 2018 19:36:37 GMT""}]","2018-07-11"
"1806.02880","Andon Kostov Mr","Z. Donchev, E. Vchkova Bebekovska, A. Kostov and G. Apostolovska","Lightcurve and rotation period determination for asteroid 3634 Iwan","7 pages, 7 figures, accepted for publication in BlgAJ",,,,"astro-ph.EP","http://arxiv.org/licenses/nonexclusive-distrib/1.0/","  Lightcurve of the asteroid 3634 Iwan observed at the Bulgarian National
Astronomical Observatory Rozhen in 2017 is presented. The asteroid was observed
only one night, on 22 March 2017 accidentally in the field of view in which our
target for shape modeling asteroid 289 Nenetta was positioned. The Asteroid
Lightcurve Database (LCDB; Warner et al. 2009) did not contain any previously
reported results for 3634 Iwan. If we accept that the ligtcurve of the asteroid
is typical with two maxima and minima, a single night observations covers the
whole rotational cycle. The lightcurve plotted by MPO Canopus provides a best
fit to synodic period of $4.72\pm 0.06$ h with amplitude of $0.15\pm 0.02$ mag.
Our assessment is that for the uniqueness of the period solution we need longer
observational span which will reveal the number of extrema of the lightcurve
and confirm the quality code U=3.
","[{""version"":""v1"",""created"":""Thu, 7 Jun 2018 19:36:51 GMT""}]","2018-06-11"
"1806.02881","Benjamin Gerard","Benjamin L. Gerard, Christian Marois, Rapha\""el Galicher","Fast Coherent Differential Imaging on Ground-Based Telescopes using the
  Self-Coherent Camera",,,"10.3847/1538-3881/aad23e",,"astro-ph.IM astro-ph.EP","http://arxiv.org/licenses/nonexclusive-distrib/1.0/","  Direct imaging and spectral characterization of exoplanets using extreme
adaptive optics (ExAO) is a key science goal of future extremely large
telescopes and space observatories. However, quasi-static wavefront errors will
limit the sensitivity of this endeavor. Additional limitations for ground-based
telescopes arise from residual AO-corrected atmospheric wavefront errors,
generating millisecond-lifetime speckles that average into a halo over a long
exposure. A solution to both of these problems is to use the science camera of
an ExAO system as a wavefront sensor to perform a fast measurement and
correction method to minimize these aberrations as soon as they are detected.
We develop the framework for one such method based on the self-coherent camera
(SCC) to be applied to ground-based telescopes, called Fast Atmospheric SCC
Technique (FAST). We show that with the use of a specially designed coronagraph
and coherent differential imaging algorithm, recording images every few
milliseconds allows for a subtraction of atmospheric and static speckles while
maintaining a close to unity algorithmic exoplanet throughput. Detailed
simulations reach a contrast close to the photon noise limit after 30 seconds
for a 1 % bandpass in H band on both 0$^\text{th}$ and 5$^\text{th}$ magnitude
stars. For the 5th magnitude case, this is about 110 times better in raw
contrast than what is currently achieved from ExAO instruments if we
extrapolate for an hour of observing time, illustrating that sensitivity
improvement from this method could play an essential role in the future
detection and characterization of lower mass exoplanets.
","[{""version"":""v1"",""created"":""Thu, 7 Jun 2018 19:39:14 GMT""},{""version"":""v2"",""created"":""Fri, 6 Jul 2018 21:33:16 GMT""}]","2018-08-29"
"1806.02882","Qingyuan Yang","Qingyuan Yang, Marcus Bursik, E Bruce Pitman","A new method to identify the source vent location of tephra fall
  deposits: development and testing, and application to key Quaternary
  eruptions of Western North America",,,,,"physics.geo-ph","http://creativecommons.org/licenses/by-nc-sa/4.0/","  A new method to identify the source vent location of tephra fall deposits
based on thickness or maximum clast size measurements is presented in this
work. It couples a first-order gradient descent method with either one of two
commonly-used semi-empirical models of tephra thickness distribution. The
method is successfully applied to three tephra thickness and one maximum clast
size datasets of the North Mono and Fogo A tephra deposits. Randomly selected
and localized subsets of these datasets are used as input to evaluate its
performance in cases of sparse observations. The results suggest that
estimating the dispersal axis is a more robust way to constrain the source vent
location with sparse observations. Bootstrap aggregating and examining the
surface of the cost function are proposed to characterize the uncertainty of
the method. Distinctions between the two adopted semi-empirical models of
tephra thickness distribution are discussed. Results from applying the method
to thickness datasets of the Trego Hot Springs and Rockland tephras are
consistent with previous studies, which also provide new estimates on their
total volume. The method is then applied to a series of well-correlated tephra
sub-units preserved within the Wilson Creek Formation to estimate their vent
location and total volume. The simplicity and flexibility of the method make it
a potentially useful and powerful tool for the study of tephra fall deposits of
different characteristics.
","[{""version"":""v1"",""created"":""Thu, 7 Jun 2018 19:42:14 GMT""}]","2018-06-11"
"1806.02883","Hjalte Frellesvig Dr.","Hjalte Frellesvig","Generalized Polylogarithms in Maple","28 pages",,,,"hep-th cs.MS","http://arxiv.org/licenses/nonexclusive-distrib/1.0/","  This paper describes generalized polylogarithms, multiple polylogarithms, and
multiple zeta values, along with their implementation in Maple 2018. This set
of related functions is of interest in high energy physics as well as in number
theory. Algorithms for the analytical manipulation and numerical evaluation of
these functions are described, along with the way these features are
implemented in Maple.
","[{""version"":""v1"",""created"":""Thu, 7 Jun 2018 19:42:58 GMT""}]","2018-06-11"
"1806.02884","Andrew Norris","Andrew N. Norris","Integral identities for reflection, transmission and scattering
  coefficients","7 pages","J. Acoust. Soc. Am., 144(4), 2109-2115, 2018","10.1121/1.5058681",,"physics.class-ph","http://arxiv.org/licenses/nonexclusive-distrib/1.0/","  Several integral identities related to acoustic scattering are presented. In
each case the identity involves the integral over frequency of a physical
quantity. For instance, the integrated transmission loss, a measure of the
transmitted acoustic energy through an inhomogeneous layer, is shown to have a
simple expression in terms of spatially averaged physical quantities. Known
identities for the extinction cross section and for the acoustic energy loss in
a slab with a rigid backing, are shown to be special cases of a general
procedure for finding such integral identities.
","[{""version"":""v1"",""created"":""Thu, 7 Jun 2018 19:44:44 GMT""},{""version"":""v2"",""created"":""Sat, 25 Aug 2018 23:16:27 GMT""}]","2018-10-15"
"1806.02885","James P. Eisenstein","J.P. Eisenstein, L.N. Pfeiffer, and K.W. West","Interlayer Interactions and the Fermi Energy of Bilayer Composite
  Fermion Metals","5 pages, 3 postscript figures. Final published version","Phys. Rev. B 98, 201406 (2018)","10.1103/PhysRevB.98.201406",,"cond-mat.mes-hall cond-mat.str-el","http://arxiv.org/licenses/nonexclusive-distrib/1.0/","  When two 2D electron gas layers, each at Landau level filling factor
$\nu=1/2$, are close together a condensate of interlayer excitons emerges at
low temperature. Although the excitonic phase is qualitatively well understood,
the incoherent phase just above the critical layer separation is not. Using a
combination of interlayer tunneling spectroscopy and conventional transport, we
explore the incoherent phase in samples both near the phase boundary and
further from it. In the more closely spaced bilayers we find the electronic
spectral functions narrower and the Fermi energy of the $\nu = 1/2$ composite
fermion metal smaller than in the more widely separated bilayers. We attribute
these effects to a softening of the intralayer Coulomb interaction due to
interlayer screening.
","[{""version"":""v1"",""created"":""Thu, 7 Jun 2018 19:58:19 GMT""},{""version"":""v2"",""created"":""Tue, 27 Nov 2018 21:23:00 GMT""}]","2018-12-05"
