"1806.03128","Christoph Kriegler","Luc Deleaval (LAMA), Mikko Kemppainen, Christoph Kriegler (LMBP)","H\""ormander functional calculus on UMD lattice valued $L^p$ spaces under
  generalised Gaussian estimates","accepted for publication in Journal d'Analyse Math\'ematique",,,,"math.FA math.CA","http://arxiv.org/licenses/nonexclusive-distrib/1.0/","  We consider self-adjoint semigroups $T_t = \exp(-tA)$ acting on $L^2(\Omega)$
and satisfying (generalised) Gaussian estimates, where $\Omega$ is a metric
measure space of homogeneous type of dimension $d$. The aim of the article is
to show that $A \otimes \mathrm{Id}_Y$ admits a H\""ormander type
$\mathcal{H}^\beta_2$ functional calculus on $L^p(\Omega;Y)$ where $Y$ is a UMD
lattice, thus extending the well-known H\""ormander calculus of $A$ on
$L^p(\Omega)$. We show that if $T_t$ is lattice positive (or merely admits an
$H^\infty$ calculus on $L^p(\Omega;Y)$) then this is indeed the case. Here the
derivation exponent has to satisfy $\beta > \alpha \cdot d + \frac12$, where
$\alpha \in (0,1)$ depends on $p$, and on convexity and concavity exponents of
$Y$. A part of the proof is the new result that the Hardy-Littlewood maximal
operator is bounded on $L^p(\Omega;Y)$. Moreover, our spectral multipliers
satisfy square function estimates in $L^p(\Omega;Y)$. In a variant, we show
that if $e^{itA}$ satisfies a dispersive $L^1(\Omega) \to L^\infty(\Omega)$
estimate, then $\beta > \frac{d+1}{2}$ above is admissible independent of
convexity and concavity of $Y$. Finally, we illustrate these results in a
variety of examples.
","[{""version"":""v1"",""created"":""Fri, 8 Jun 2018 12:57:23 GMT""},{""version"":""v2"",""created"":""Fri, 22 Nov 2019 14:26:09 GMT""}]","2019-11-25"
"1806.03129","Enrica Uggetti","Dulce Mar\'ia Arias, Enrica Uggetti, Mar\'ia Jes\'us Garc\'ia-Gal\'an
  and Joan Garc\'ia","Production of polyhydroxybutyrates and carbohydrates in a mixed
  cyanobacterial culture: effect of nutrients limitation and photoperiods",,,"10.1016/j.nbt.2018.01.001",,"q-bio.PE physics.bio-ph","http://arxiv.org/licenses/nonexclusive-distrib/1.0/","  In the present study, different photoperiods and nutritional conditions were
applied to a mixed wastewater-borne cyanobacterial culture in order to enhance
the intracellular accumulation of polyhydroxybutyrates (PHBs) and
carbohydrates. Two different experimental set-ups were used. In the first, the
culture was permanently exposed to illumination, while in the second; it was
submitted to light/dark alternation (12h cycles). In both cases, two different
nutritional regimes were also evaluated, N-limitation and P-limitation. Results
showed that the highest PHB concentration (104 mg L-1) was achieved under P
limited conditions and permanent illumination, whereas the highest carbohydrate
concentration (838 mg L-1) was obtained under N limited condition and
light/dark alternation. With regard to bioplastics and biofuel generation, this
study demonstrates that the accumulation of PHBs (bioplastics) and
carbohydrates (potential biofuel substrate) is favored in wastewater-borne
cyanobacteria under conditions where nutrients are limited.
","[{""version"":""v1"",""created"":""Fri, 8 Jun 2018 12:59:14 GMT""},{""version"":""v2"",""created"":""Mon, 11 Jun 2018 09:02:53 GMT""}]","2018-06-12"
"1806.03130","Fabian Eickhoff","Fabian Eickhoff, Benedikt Lechtenberg and Frithjof B. Anders","Effective low-energy description of the two impurity Anderson model:
  RKKY interaction and quantum criticality",,,"10.1103/PhysRevB.98.115103",,"cond-mat.str-el","http://arxiv.org/licenses/nonexclusive-distrib/1.0/","  We show that the RKKY interaction in the two-impurity Anderson model comprise
two contributions: a ferromagnetic part stemming from the symmetrized
hybridization functions and an anti-ferromagnetic part. We demonstrate that
this anti-ferromagnetic contribution can also be generated by an effective
local tunneling term between the two impurities. This tunneling can be
analytically calculated for particle-hole symmetric impurities. Replacing the
full hybridization functions by the symmetric part and this tunneling term
leads to the identical low-temperature fixed point spectrum in the numerical
renormalization group. Compensating this tunneling term is used to restore the
Varma-Jones quantum critical point between a strong coupling phase and a local
singlet phase even in the absence of particle-hole symmetry in the
hybridization functions. We analytically investigate the spatial frequencies of
the effective tunneling term based on the combination of the band dispersion
and the shape of the Fermi surface. Numerical renormalization group
calculations provide a comparison of the distance dependent tunneling term and
the local spin-spin correlation function. Derivations between the spatial
dependency of the full spin-spin correlation function and the textbook RKKY
interaction are reported.
","[{""version"":""v1"",""created"":""Fri, 8 Jun 2018 13:04:25 GMT""}]","2018-09-26"
"1806.03131","Kun Huang","Kun Huang, Jie Deng, Hai Sheng Leong, Sherry Lee Koon Yap, Ren Bin
  Yang, Jinghua Teng, Hong Liu","High-Efficiency Ultra-Violet Dielectric Meta-Holograms with
  Antiferromagnetic Resonances","14 pages , 4 figures. Comments on our manuscript are welcome",,,,"physics.optics","http://arxiv.org/licenses/nonexclusive-distrib/1.0/","  Metasurfaces with spatially varying subwavelength structures enable full
control of electromagnetic waves over a wide spectrum. High-efficiency
metasurfaces, especially in a transmission mode, are of practical significance
in optical elements and systems, hitherto their operating frequencies have been
expanded down to visible-wavelength ranges. Challenges of developing
shorter-wavelength metasurfaces originate from electromagnetic loss caused by
strong absorption for most high-refractive-index materials. Here we introduce a
large-bandgap semiconductor material-niobium pentoxide (Nb2O5)-to engineer a
ultraviolet meta-hologram with a total efficiency of 81% at 355nm wavelength.
This meta-hologram modulates the geometric phase of transmitted
circular-polarization light via orientation-varying high-aspect-ratio
nano-bricks that are elaborately designed to excite antiferromagnetic
resonances. We reveal that the induced antiferromagnetic modes maintain one
component (e.g., Ex-component) of incident light through even-numbered
antiparallel magnetic dipoles (AMDs) but reverse the other component (e.g.,
Ey-component) via odd-numbered AMDs, thus realizing high-efficiency
polarization conversion. Our approach might open the door towards
high-performance ultraviolet-light nanophotonics and meta-optics.
","[{""version"":""v1"",""created"":""Fri, 8 Jun 2018 13:07:27 GMT""}]","2018-06-11"
"1806.03132","Algimantas Cerniauskas","A. \v{C}erniauskas, A.Ku\v{c}inskas, J.Klevas, P.Bonifacio, H.-G.
  Ludwig, E.Caffau, M. Steffen","Abundance of zinc in the red giants of Galactic globular cluster 47
  Tucanae","8 pages, 8 figures. Accepted to A&A",,"10.1051/0004-6361/201833255",,"astro-ph.SR astro-ph.GA","http://arxiv.org/licenses/nonexclusive-distrib/1.0/","  We investigate possible relations between the abundances of zinc and the
light elements sodium, magnesium, and potassium in the atmospheres ofred giant
branch (RGB) stars of the Galactic globular cluster 47~Tuc and study
connections between the chemical composition and dynamical properties of the
cluster RGB stars. The abundance of zinc was determined in 27 RGB stars of
47~Tuc using 1D local thermal equilibrium (LTE) synthetic line profile fitting
to the high-resolution 2dF spectra obtained with the Anglo-Australian Telescope
(AAT). Synthetic spectra used in the fitting procedure were computed with the
SYNTHE code and 1D ATLAS9 stellar model atmospheres. The average 1D~LTE
zinc-to-iron abundance ratio and its RMS variations due to star-to-star
abundance spread determined in the sample of 27 RGB stars is
$\langle{\rm[Zn/Fe]}\rangle^{\rm 1D~LTE}=0.11\pm0.09$. We did not detect any
statistically significant relations between the abundances of zinc and those of
light elements. Neither did we find any significant correlation or
anticorrelation between the zinc abundance in individual stars and their
projected distance from the cluster center. Finally, no statistically
significant relation between the absolute radial velocities of individual stars
and the abundance of zinc in their atmospheres was detected. The determined
average [Zn/Fe]$^{\rm~1DLTE}$ ratio agrees well with those determined in this
cluster in earlier studies and nearly coincides with that of Galactic field
stars at this metallicity. All these results suggest that nucleosynthesis of
zinc and light elements proceeded in separate, unrelated pathways in 47~Tuc.
","[{""version"":""v1"",""created"":""Fri, 8 Jun 2018 13:09:37 GMT""}]","2018-06-11"
"1806.03133","Cyril Banderier","Cyril Banderier (LIPN), Philippe Marchal (LRGP), Michael Wallner (TU
  WIEN)","Periodic P\'olya urns and an application to Young tableaux",,"Leibniz International Proceedings in Informatics (LIPIcs), 29th
  International Conference on Probabilistic, Combinatorial and Asymptotic
  Methods for the Analysis of Algorithms (AofA 2018), pp.1-12","10.4230/LIPIcs.AofA.2018.11",,"cs.DM math.CO math.PR","http://arxiv.org/licenses/nonexclusive-distrib/1.0/","  P{\'o}lya urns are urns where at each unit of time a ball is drawn and is
replaced with some other balls according to its colour. We introduce a more
general model: The replacement rule depends on the colour of the drawn ball and
the value of the time (mod p). We discuss some intriguing properties of the
differential operators associated to the generating functions encoding the
evolution of these urns. The initial partial differential equation indeed leads
to ordinary linear differential equations and we prove that the moment
generating functions are D-finite. For a subclass, we exhibit a closed form for
the corresponding generating functions (giving the exact state of the urns at
time n). When the time goes to infinity, we show that these periodic P{\'o}lya
urns follow a rich variety of behaviours: their asymptotic fluctuations are
described by a family of distributions, the generalized Gamma distributions,
which can also be seen as powers of Gamma distributions. En passant, we
establish some enumerative links with other combinatorial objects, and we give
an application for a new result on the asymptotics of Young tableaux: This
approach allows us to prove that the law of the lower right corner in a
triangular Young tableau follows asymptotically a product of generalized Gamma
distributions.
","[{""version"":""v1"",""created"":""Fri, 8 Jun 2018 13:11:56 GMT""}]","2018-06-22"
"1806.03134","Hinnerk Christian Schmidt","Christian Schmidt, Henry D. Pfister, Lenka Zdeborov\'a","On Minimal Sets to Destroy the $k$-Core in Random Networks","17 pages, 2 figures, 3 tables","Phys. Rev. E 99, 022310 (2019)","10.1103/PhysRevE.99.022310",,"physics.soc-ph cond-mat.dis-nn cs.SI math.PR","http://arxiv.org/licenses/nonexclusive-distrib/1.0/","  We study the problem of finding the smallest set of nodes in a network whose
removal results in an empty $k$-core; where the $k$-core is the sub-network
obtained after the iterative removal of all nodes of degree smaller than $k$.
This problem is also known in the literature as finding the minimal contagious
set. The main contribution of our work is an analysis of the performance of the
recently introduced corehd algorithm [Scientific Reports, 6, 37954 (2016)] on
random networks taken from the configuration model via a set of deterministic
differential equations. Our analyses provides upper bounds on the size of the
minimal contagious set that improve over previously known bounds. Our second
contribution is a new heuristic called the weak-neighbor algorithm that
outperforms all currently known local methods in the regimes considered.
","[{""version"":""v1"",""created"":""Fri, 8 Jun 2018 13:12:04 GMT""}]","2019-02-27"
"1806.03135","Agnes Lagnoux","Jean-Marc Aza\""is (IMT), Fran\c{c}ois Bachoc (IMT), Agn\`es Lagnoux
  (IMT), Thi Mong Ngoc Nguyen (VNU-HCM)","Semi-parametric estimation of the variogram of a Gaussian process with
  stationary increments",,,,,"math.ST stat.TH","http://arxiv.org/licenses/nonexclusive-distrib/1.0/","  We consider the semi-parametric estimation of a scale parameter of a
one-dimensional Gaussian process with known smoothness. We suggest an estimator
based on quadratic variations and on the moment method. We provide asymptotic
approximations of the mean and variance of this estimator, together with
asymptotic normality results, for a large class of Gaussian processes. We allow
for general mean functions and study the aggregation of several estimators
based on various variation sequences. In extensive simulation studies, we show
that the asymptotic results accurately depict thefinite-sample situations
already for small to moderate sample sizes. We also compare various variation
sequences and highlight the efficiency of the aggregation procedure.
","[{""version"":""v1"",""created"":""Fri, 8 Jun 2018 13:12:13 GMT""},{""version"":""v2"",""created"":""Mon, 20 Jan 2020 15:40:22 GMT""}]","2020-01-22"
"1806.03136","Alessandra Corsi","Alessandra Corsi (TTU), Gregg W. Hallinan (Caltech), Davide Lazzati
  (Oregon State Univ.), Kunal P. Mooley (NRAO, Caltech), Eric J. Murphy (NRAO),
  Dale A. Frail (NRAO), Dario Carbone (TTU), David L. Kaplan (UWM), Tara Murphy
  (Univ. of Sydney), Shrinivas R. Kulkarni (Caltech), Kenta Hotokezaka
  (Princeton Univ.)","An upper-limit on the linear polarization fraction of the GW170817 radio
  continuum","5 pages, 2 figures, 1 table",,"10.3847/2041-8213/aacdfd",,"astro-ph.HE","http://arxiv.org/licenses/nonexclusive-distrib/1.0/","  We present late-time radio observations of GW170817, the first binary neutron
star merger discovered through gravitational waves by the advanced LIGO and
Virgo detectors. Our observations, carried out with the Karl G. Jansky Very
Large Array, were optimized to detect polarized radio emission, and thus to
constrain the linear polarization fraction of GW170817. At an epoch of ~244
days after the merger, we rule out linearly polarized emission above a fraction
of ~12% at a frequency of 2.8 GHz (99% confidence). Within the structured jet
scenario (a.k.a. successful jet plus cocoon system) for GW170817, the derived
upper-limit on the radio continuum linear polarization fraction strongly
constrains the magnetic field configuration in the shocked ejecta. We show that
our results for GW170817 are compatible with the low level of linear
polarization found in afterglows of cosmological long gamma-ray bursts.
Finally, we discuss our findings in the context of future expectations for the
study of radio counterparts of binary neutron star mergers identified by
ground-based gravitational-wave detectors.
","[{""version"":""v1"",""created"":""Fri, 8 Jun 2018 13:13:55 GMT""}]","2018-07-18"
"1806.03137","Georges Gras","Georges Gras","Annihilation of tor\_p(G\_S^ab) for real abelian extensions","Analyse (by means of PARI programs) of the annihilations of ""real
  classes"" given by the Solomon elements and a new annihilator. Communications
  in Advanced Mathematical Sciences, Emrah Evren Kara, In press","Communications in Advanced Mathematical Sciences Vol. I, No. 1,
  5-34, 2018","10.33434/cams.441035",,"math.NT","http://arxiv.org/licenses/nonexclusive-distrib/1.0/","  Preprint of a paper to appear in ""Communications in Advanced Mathematical
Sciences"". Let K be a real abelian extension of Q. Let p be a prime number, S
the set of p-places of K and G\_K,S the Galois group of the maximal S-ramified
pro-p-extension of K (i.e., unramified outside p and infinity). We revisit the
problem of annihilation of the p-torsion group T\_K:=tor\_Z\_p(G\_K,S^ab)
initiated by us and Oriat then systematized in our paper on the construction of
p-adic L-functions in which we obtained a canonical ideal annihilator of T\_K
in full generality (1978--1981). Afterwards (1992--2014) some annihilators,
using cyclotomic units, were proposed by Solomon, Belliard--Nguyen Quang Do,
Nguyen Quang Do--Nicolas, All, Belliard--Martin.In this text, we improve our
original papers and show that, in general, the Solomon elements are not optimal
and/or partly degenerated. We obtain, whatever K and p, an universal
non-degenerated annihilator in terms of p-adic logarithms of cyclotomic numbers
related to L\_p-functions at s=1 of its primitive characters of K (Theorem
9.4). Some computations are given with PARI programs; the case p=2 is analyzed
and illustrated in degrees 2, 3, 4 to test a conjecture.
","[{""version"":""v1"",""created"":""Fri, 8 Jun 2018 13:20:51 GMT""},{""version"":""v2"",""created"":""Fri, 5 Oct 2018 07:12:51 GMT""}]","2021-08-09"
"1806.03138","Ljubica Davidovic","Lj. Davidovi\'c and B. Sazdovi\'c","The T-dual symmetries of a bosonic string",,"Eur. Phys. J. C (2018) 78:600","10.1140/epjc/s10052-018-6076-6",,"hep-th","http://arxiv.org/licenses/nonexclusive-distrib/1.0/","  We investigate whether the symmetry transformations of a bosonic string are
connected by T-duality. We start with a standard closed string theory. We
continue with a modified open string theory, modified to preserve the symmetry
transformations possessed by the closed string theory. Because the string
theory is conformally invariant world sheet field theory, in order to find the
transformations which preserve the physics, one has to demand the isomorphism
between the conformal field theories corresponding to the initial and the
transformed field configurations. We find the symmetry transformations
corresponding to the similarity transformation of the energy-momentum tensor,
and find that their generators are T-dual. Particularly, we find that the
general coordinate and local gauge transformations are T-dual, so we conclude
that T-duality in addition to the well known exchanges, transforms symmetries
of the initial and its T-dual theory into each other.
","[{""version"":""v1"",""created"":""Fri, 8 Jun 2018 13:21:10 GMT""}]","2018-10-09"
"1806.03139","Seung-Woo Lee","Seung-Woo Lee and Jaewan Kim","Single-photon characteristics of superposed weak coherent states","8 pages, 5 figures, title and abstract changed, published version","Phys. Rev. A 99, 013847 (2019)","10.1103/PhysRevA.99.013847",,"quant-ph","http://arxiv.org/licenses/nonexclusive-distrib/1.0/","  We study a superposed weak coherent state that can fundamentally mimic an
ideal single photon not only with respect to the number of photons but also in
terms of an indeterminate phase. It is close to the single-photon state with
high fidelity and exhibits fundamental features of single photons such as
antibunching and Hong-Ou-Mandel interference. The emergence and vanishing of
single-photon characteristics can be directly observed by changing two
parameters, i.e., the mean photon number and number of phases. Our result shows
that the uncertainty between the photon number and phase indeed constitutes the
characteristics of single photons. Finally, we apply the superposed weak
coherent state to quantum key distribution and demonstrate that it outperforms
the typical approach using phase-randomized weak coherent states.
","[{""version"":""v1"",""created"":""Fri, 8 Jun 2018 13:23:01 GMT""},{""version"":""v2"",""created"":""Thu, 6 Sep 2018 06:17:47 GMT""},{""version"":""v3"",""created"":""Fri, 25 Jan 2019 01:47:52 GMT""}]","2019-01-28"
"1806.03140","Enrico Gavagnin","Enrico Gavagnin, Matthew J. Ford, Richard L. Mort, Tim Rogers and
  Christian A. Yates","The invasion speed of cell migration models with realistic cell cycle
  time distributions",,,,,"q-bio.CB math.AP","http://arxiv.org/licenses/nonexclusive-distrib/1.0/","  Cell proliferation is typically incorporated into stochastic mathematical
models of cell migration by assuming that cell divisions occur after an
exponentially distributed waiting time. Experimental observations, however,
show that this assumption is often far from the real cell cycle time
distribution (CCTD). Recent studies have suggested an alternative approach to
modelling cell proliferation based on a multi-stage representation of the CCTD.
In order to validate and parametrise these models, it is important to connect
them to experimentally measurable quantities. In this paper we investigate the
connection between the CCTD and the speed of the collective invasion. We first
state a result for a general CCTD, which allows the computation of the invasion
speed using the Laplace transform of the CCTD. We use this to deduce the range
of speeds for the general case. We then focus on the more realistic case of
multi-stage models, using both a stochastic agent-based model and a set of
reaction-diffusion equations for the cells' average density. By studying the
corresponding travelling wave solutions, we obtain an analytical expression for
the speed of invasion for a general N-stage model with identical transition
rates, in which case the resulting cell cycle times are Erlang distributed. We
show that, for a general N-stage model, the Erlang distribution and the
exponential distribution lead to the minimum and maximum invasion speed,
respectively. This result allows us to determine the range of possible invasion
speeds in terms of the average proliferation time for any multi-stage model.
","[{""version"":""v1"",""created"":""Fri, 8 Jun 2018 13:23:16 GMT""}]","2018-06-11"
"1806.03141","Frederic De Geuser","Huan Zhao (MPIE), Baptiste Gault (MPIE), Dirk Ponge (MPIE), Dierk
  Raabe (MPIE), Fr\'ed\'eric De Geuser (SIMaP)","Parameter free quantitative analysis of atom probe data by correlation
  functions: Application to the precipitation in Al-Zn-Mg-Cu",,"Scripta Materialia, Elsevier, 2018, 154, pp.106 - 110","10.1016/j.scriptamat.2018.05.024",,"cond-mat.mtrl-sci","http://arxiv.org/licenses/nonexclusive-distrib/1.0/","  Atom probe tomography enables precise quantification of the composition of
second phase particles from their early stages, leading to improved
understanding of the thermodynamic and kinetic mechanisms of phase formation
and quantify structure-property relationships. Here we demonstrate how
approaches developed for small-angle scattering can be adapted to atom probe
tomography. By exploiting nearest-neighbor distributions and radial
distribution function, we introduce a parameter free methodology to efficiently
extract information such as particle size, composition, volume fraction, number
density and inter-particle distance. We demonstrate the strength of this
approach in the analysis of a precipitation-hardened model Al-Zn-Mg-Cu
high-strength lightweight alloy.
","[{""version"":""v1"",""created"":""Fri, 8 Jun 2018 13:25:08 GMT""}]","2018-06-11"
"1806.03142","Logan Walker","Logan A Walker, Michael G Sovic, Chi-Ling Chiang, Eileen Hu, Jiyeon K
  Denninger, Xi Chen, Elizabeth D Kirby, John C Byrd, Natarajan Muthusamy, Ralf
  Bundschuh, and Pearlly Yan","CLEAR: Coverage-based Limiting-cell Experiment Analysis for RNA-seq","20 pages, 4 figures, 1 table, 4 pages supplemental",,,,"q-bio.GN q-bio.QM","http://arxiv.org/licenses/nonexclusive-distrib/1.0/","  Direct cDNA preamplification protocols developed for single-cell RNA-seq have
enabled transcriptome profiling of precious clinical samples and rare cells
without sample pooling or RNA extraction. Currently, there is no algorithm
optimized to reveal and remove noisy transcripts in limiting-cell RNA-seq
(lcRNA-seq) data for downstream analyses. Herein, we present CLEAR, a workflow
that identifies reliably quantifiable transcripts in lcRNA-seq data for
differentially expressed gene (DEG) analysis. Libraries at three input amounts
of FACS-derived CD5+ and CD5- cells from a chronic lymphocytic leukemia patient
were used to develop CLEAR. When using CLEAR transcripts vs. using all
transcripts, downstream analyses revealed more shared transcripts across
different input RNA amounts, improved Principal Component Analysis (PCA)
separation, and yielded more DEGs between cell types. As proof-of-principle,
CLEAR was applied to an in-house lcRNA-seq dataset and two public datasets.
When imputation is used, CLEAR is also adaptable to large clinical studies and
for single cell analyses.
","[{""version"":""v1"",""created"":""Fri, 8 Jun 2018 13:25:49 GMT""},{""version"":""v2"",""created"":""Thu, 23 May 2019 02:39:07 GMT""}]","2019-05-24"
"1806.03143","Wesley Tansey","Wesley Tansey, Yixin Wang, David M. Blei, Raul Rabadan","Black Box FDR","To appear at ICML'18; code available at
  https://github.com/tansey/bb-fdr",,,,"stat.ML cs.LG","http://arxiv.org/licenses/nonexclusive-distrib/1.0/","  Analyzing large-scale, multi-experiment studies requires scientists to test
each experimental outcome for statistical significance and then assess the
results as a whole. We present Black Box FDR (BB-FDR), an empirical-Bayes
method for analyzing multi-experiment studies when many covariates are gathered
per experiment. BB-FDR learns a series of black box predictive models to boost
power and control the false discovery rate (FDR) at two stages of study
analysis. In Stage 1, it uses a deep neural network prior to report which
experiments yielded significant outcomes. In Stage 2, a separate black box
model of each covariate is used to select features that have significant
predictive power across all experiments. In benchmarks, BB-FDR outperforms
competing state-of-the-art methods in both stages of analysis. We apply BB-FDR
to two real studies on cancer drug efficacy. For both studies, BB-FDR increases
the proportion of significant outcomes discovered and selects variables that
reveal key genomic drivers of drug sensitivity and resistance in cancer.
","[{""version"":""v1"",""created"":""Fri, 8 Jun 2018 13:29:08 GMT""}]","2018-06-11"
