"1806.04079","Melody Ravonel Salzgeber Dr","LHCb collaboration: R. Aaij, B. Adeva, M. Adinolfi, C.A. Aidala, Z.
  Ajaltouni, S. Akar, P. Albicocco, J. Albrecht, F. Alessio, M. Alexander, A.
  Alfonso Albero, S. Ali, G. Alkhazov, P. Alvarez Cartelle, A.A. Alves Jr, S.
  Amato, S. Amerio, Y. Amhis, L. An, L. Anderlini, G. Andreassi, M. Andreotti,
  J.E. Andrews, R.B. Appleby, F. Archilli, P. d'Argent, J. Arnau Romeu, A.
  Artamonov, M. Artuso, K. Arzymatov, E. Aslanides, M. Atzeni, S. Bachmann,
  J.J. Back, S. Baker, V. Balagura, W. Baldini, A. Baranov, R.J. Barlow, S.
  Barsuk, W. Barter, F. Baryshnikov, V. Batozskaya, B. Batsukh, V. Battista, A.
  Bay, J. Beddow, F. Bedeschi, I. Bediaga, A. Beiter, L.J. Bel, N. Beliy, V.
  Bellee, N. Belloli, K. Belous, I. Belyaev, E. Ben-Haim, G. Bencivenni, S.
  Benson, S. Beranek, A. Berezhnoy, R. Bernet, D. Berninghoff, E. Bertholet, A.
  Bertolin, C. Betancourt, F. Betti, M.O. Bettler, M. van Beuzekom, Ia.
  Bezshyiko, L. Bian, S. Bifani, P. Billoir, A. Birnkraut, A. Bizzeti, M.
  Bj{\o}rn, T. Blake, F. Blanc, S. Blusk, D. Bobulska, V. Bocci, O. Boente
  Garcia, T. Boettcher, A. Bondar, N. Bondar, S. Borghi, M. Borisyak, M.
  Borsato, F. Bossu, M. Boubdir, T.J.V. Bowcock, C. Bozzi, S. Braun, M.
  Brodski, J. Brodzicka, D. Brundu, E. Buchanan, A. Buonaura, C. Burr, A.
  Bursche, J. Buytaert, W. Byczynski, S. Cadeddu, H. Cai, R. Calabrese, R.
  Calladine, M. Calvi, M. Calvo Gomez, A. Camboni, P. Campana, D.H. Campora
  Perez, L. Capriotti, A. Carbone, G. Carboni, R. Cardinale, A. Cardini, P.
  Carniti, L. Carson, K. Carvalho Akiba, G. Casse, L. Cassina, M. Cattaneo, G.
  Cavallero, R. Cenci, D. Chamont, M.G. Chapman, M. Charles, Ph. Charpentier,
  G. Chatzikonstantinidis, M. Chefdeville, V. Chekalina, C. Chen, S. Chen,
  S.-G. Chitic, V. Chobanova, M. Chrzaszcz, A. Chubykin, P. Ciambrone, X. Cid
  Vidal, G. Ciezarek, P.E.L. Clarke, M. Clemencic, H.V. Cliff, J. Closier, V.
  Coco, J. Cogan, E. Cogneras, L. Cojocariu, P. Collins, T. Colombo, A.
  Comerma-Montells, A. Contu, G. Coombs, S. Coquereau, G. Corti, M. Corvo, C.M.
  Costa Sobral, B. Couturier, G.A. Cowan, D.C. Craik, A. Crocombe, M. Cruz
  Torres, R. Currie, C. D'Ambrosio, F. Da Cunha Marinho, C.L. Da Silva, E.
  Dall'Occo, J. Dalseno, A. Danilina, A. Davis, O. De Aguiar Francisco, K. De
  Bruyn, S. De Capua, M. De Cian, J.M. De Miranda, L. De Paula, M. De Serio, P.
  De Simone, C.T. Dean, D. Decamp, L. Del Buono, B. Delaney, H.-P. Dembinski,
  M. Demmer, A. Dendek, D. Derkach, O. Deschamps, F. Dettori, B. Dey, A. Di
  Canto, P. Di Nezza, S. Didenko, H. Dijkstra, F. Dordei, M. Dorigo, A. Dosil
  Su\'arez, L. Douglas, A. Dovbnya, K. Dreimanis, L. Dufour, G. Dujany, P.
  Durante, J.M. Durham, D. Dutta, R. Dzhelyadin, M. Dziewiecki, A. Dziurda, A.
  Dzyuba, S. Easo, U. Egede, V. Egorychev, S. Eidelman, S. Eisenhardt, U.
  Eitschberger, R. Ekelhof, L. Eklund, S. Ely, A. Ene, S. Escher, S. Esen, H.M.
  Evans, T. Evans, A. Falabella, N. Farley, S. Farry, D. Fazzini, L. Federici,
  G. Fernandez, P. Fernandez Declara, A. Fernandez Prieto, F. Ferrari, L.
  Ferreira Lopes, F. Ferreira Rodrigues, M. Ferro-Luzzi, S. Filippov, R.A.
  Fini, M. Fiorini, M. Firlej, C. Fitzpatrick, T. Fiutowski, F. Fleuret, M.
  Fontana, F. Fontanelli, R. Forty, V. Franco Lima, M. Frank, C. Frei, J. Fu,
  W. Funk, C. F\""arber, M. F\'eo Pereira Rivello Carvalho, E. Gabriel, A.
  Gallas Torreira, D. Galli, S. Gallorini, S. Gambetta, M. Gandelman, P.
  Gandini, Y. Gao, L.M. Garcia Martin, B. Garcia Plana, J. Garc\'ia Pardi\~nas,
  J. Garra Tico, L. Garrido, D. Gascon, C. Gaspar, L. Gavardi, G. Gazzoni, D.
  Gerick, E. Gersabeck, M. Gersabeck, T. Gershon, Ph. Ghez, S. Gian\`i, V.
  Gibson, O.G. Girard, L. Giubega, K. Gizdov, V.V. Gligorov, D. Golubkov, A.
  Golutvin, A. Gomes, I.V. Gorelov, C. Gotti, E. Govorkova, J.P. Grabowski, R.
  Graciani Diaz, L.A. Granado Cardoso, E. Graug\'es, E. Graverini, G. Graziani,
  A. Grecu, R. Greim, P. Griffith, L. Grillo, L. Gruber, B.R. Gruberg Cazon, O.
  Gr\""unberg, C. Gu, E. Gushchin, Yu. Guz, T. Gys, C. G\""obel, T. Hadavizadeh,
  C. Hadjivasiliou, G. Haefeli, C. Haen, S.C. Haines, B. Hamilton, X. Han, T.H.
  Hancock, S. Hansmann-Menzemer, N. Harnew, S.T. Harnew, C. Hasse, M. Hatch, J.
  He, M. Hecker, K. Heinicke, A. Heister, K. Hennessy, L. Henry, E. van
  Herwijnen, M. He{\ss}, A. Hicheur, D. Hill, M. Hilton, P.H. Hopchev, W. Hu,
  W. Huang, Z.C. Huard, W. Hulsbergen, T. Humair, M. Hushchyn, D. Hutchcroft,
  D. Hynds, P. Ibis, M. Idzik, P. Ilten, K. Ivshin, R. Jacobsson, J. Jalocha,
  E. Jans, A. Jawahery, F. Jiang, M. John, D. Johnson, C.R. Jones, C. Joram, B.
  Jost, N. Jurik, S. Kandybei, M. Karacson, J.M. Kariuki, S. Karodia, N.
  Kazeev, M. Kecke, F. Keizer, M. Kelsey, M. Kenzie, T. Ketel, E. Khairullin,
  B. Khanji, C. Khurewathanakul, K.E. Kim, T. Kirn, S. Klaver, K. Klimaszewski,
  T. Klimkovich, S. Koliiev, M. Kolpin, R. Kopecna, P. Koppenburg, S.
  Kotriakhova, M. Kozeiha, L. Kravchuk, M. Kreps, F. Kress, P. Krokovny, W.
  Krupa, W. Krzemien, W. Kucewicz, M. Kucharczyk, V. Kudryavtsev, A.K. Kuonen,
  T. Kvaratskheliya, D. Lacarrere, G. Lafferty, A. Lai, D. Lancierini, G.
  Lanfranchi, C. Langenbruch, T. Latham, C. Lazzeroni, R. Le Gac, A. Leflat, J.
  Lefran\c{c}ois, R. Lef\`evre, F. Lemaitre, O. Leroy, T. Lesiak, B.
  Leverington, P.-R. Li, T. Li, Z. Li, X. Liang, T. Likhomanenko, R. Lindner,
  F. Lionetto, V. Lisovskyi, X. Liu, D. Loh, A. Loi, I. Longstaff, J.H. Lopes,
  D. Lucchesi, M. Lucio Martinez, A. Lupato, E. Luppi, O. Lupton, A. Lusiani,
  X. Lyu, F. Machefert, F. Maciuc, V. Macko, P. Mackowiak, S. Maddrell-Mander,
  O. Maev, K. Maguire, D. Maisuzenko, M.W. Majewski, S. Malde, B. Malecki, A.
  Malinin, T. Maltsev, G. Manca, G. Mancinelli, D. Marangotto, J. Maratas, J.F.
  Marchand, U. Marconi, C. Marin Benito, M. Marinangeli, P. Marino, J. Marks,
  G. Martellotti, M. Martin, M. Martinelli, D. Martinez Santos, F. Martinez
  Vidal, A. Massafferri, R. Matev, A. Mathad, Z. Mathe, C. Matteuzzi, A. Mauri,
  E. Maurice, B. Maurin, A. Mazurov, M. McCann, A. McNab, R. McNulty, J.V.
  Mead, B. Meadows, C. Meaux, F. Meier, N. Meinert, D. Melnychuk, M. Merk, A.
  Merli, E. Michielin, D.A. Milanes, E. Millard, M.-N. Minard, L. Minzoni, D.S.
  Mitzel, A. Mogini, J. Molina Rodriguez, T. Momb\""acher, I.A. Monroy, S.
  Monteil, M. Morandin, G. Morello, M.J. Morello, O. Morgunova, J. Moron, A.B.
  Morris, R. Mountain, F. Muheim, M. Mulder, D. M\""uller, J. M\""uller, K.
  M\""uller, V. M\""uller, P. Naik, T. Nakada, R. Nandakumar, A. Nandi, T. Nanut,
  I. Nasteva, M. Needham, N. Neri, S. Neubert, N. Neufeld, M. Neuner, T.D.
  Nguyen, C. Nguyen-Mau, S. Nieswand, R. Niet, N. Nikitin, A. Nogay, D.P.
  O'Hanlon, A. Oblakowska-Mucha, V. Obraztsov, S. Ogilvy, R. Oldeman, C.J.G.
  Onderwater, A. Ossowska, J.M. Otalora Goicochea, P. Owen, A. Oyanguren, P.R.
  Pais, A. Palano, M. Palutan, G. Panshin, A. Papanestis, M. Pappagallo, L.L.
  Pappalardo, W. Parker, C. Parkes, G. Passaleva, A. Pastore, M. Patel, C.
  Patrignani, A. Pearce, A. Pellegrino, G. Penso, M. Pepe Altarelli, S.
  Perazzini, D. Pereima, P. Perret, L. Pescatore, K. Petridis, A. Petrolini, A.
  Petrov, M. Petruzzo, B. Pietrzyk, G. Pietrzyk, M. Pikies, D. Pinci, J.
  Pinzino, F. Pisani, A. Pistone, A. Piucci, V. Placinta, S. Playfer, J. Plews,
  M. Plo Casasus, F. Polci, M. Poli Lener, A. Poluektov, N. Polukhina, I.
  Polyakov, E. Polycarpo, G.J. Pomery, S. Ponce, A. Popov, D. Popov, S.
  Poslavskii, C. Potterat, E. Price, J. Prisciandaro, C. Prouve, V. Pugatch, A.
  Puig Navarro, H. Pullen, G. Punzi, W. Qian, J. Qin, R. Quagliani, B.
  Quintana, B. Rachwal, J.H. Rademacker, M. Rama, M. Ramos Pernas, M.S. Rangel,
  F. Ratnikov, G. Raven, M. Ravonel Salzgeber, M. Reboud, F. Redi, S. Reichert,
  A.C. dos Reis, F. Reiss, C. Remon Alepuz, Z. Ren, V. Renaudin, S. Ricciardi,
  S. Richards, K. Rinnert, P. Robbe, A. Robert, A.B. Rodrigues, E. Rodrigues,
  J.A. Rodriguez Lopez, A. Rogozhnikov, S. Roiser, A. Rollings, V. Romanovskiy,
  A. Romero Vidal, M. Rotondo, M.S. Rudolph, T. Ruf, J. Ruiz Vidal, J.J.
  Saborido Silva, N. Sagidova, B. Saitta, V. Salustino Guimaraes, C. Sanchez
  Gras, C. Sanchez Mayordomo, B. Sanmartin Sedes, R. Santacesaria, C.
  Santamarina Rios, M. Santimaria, E. Santovetti, G. Sarpis, A. Sarti, C.
  Satriano, A. Satta, M. Saur, D. Savrina, S. Schael, M. Schellenberg, M.
  Schiller, H. Schindler, M. Schmelling, T. Schmelzer, B. Schmidt, O.
  Schneider, A. Schopper, H.F. Schreiner, M. Schubiger, M.H. Schune, R.
  Schwemmer, B. Sciascia, A. Sciubba, A. Semennikov, E.S. Sepulveda, A. Sergi,
  N. Serra, J. Serrano, L. Sestini, P. Seyfert, M. Shapkin, Y. Shcheglov, T.
  Shears, L. Shekhtman, V. Shevchenko, E. Shmanin, B.G. Siddi, R. Silva
  Coutinho, L. Silva de Oliveira, G. Simi, S. Simone, N. Skidmore, T.
  Skwarnicki, E. Smith, I.T. Smith, M. Smith, M. Soares, l. Soares Lavra, M.D.
  Sokoloff, F.J.P. Soler, B. Souza De Paula, B. Spaan, P. Spradlin, F. Stagni,
  M. Stahl, S. Stahl, P. Stefko, S. Stefkova, O. Steinkamp, S. Stemmle, O.
  Stenyakin, M. Stepanova, H. Stevens, S. Stone, B. Storaci, S. Stracka, M.E.
  Stramaglia, M. Straticiuc, U. Straumann, S. Strokov, J. Sun, L. Sun, K.
  Swientek, V. Syropoulos, T. Szumlak, M. Szymanski, S. T'Jampens, Z. Tang, A.
  Tayduganov, T. Tekampe, G. Tellarini, F. Teubert, E. Thomas, J. van Tilburg,
  M.J. Tilley, V. Tisserand, M. Tobin, S. Tolk, L. Tomassetti, D. Tonelli, D.Y.
  Tou, R. Tourinho Jadallah Aoude, E. Tournefier, M. Traill, M.T. Tran, A.
  Trisovic, A. Tsaregorodtsev, A. Tully, N. Tuning, A. Ukleja, A. Usachov, A.
  Ustyuzhanin, U. Uwer, C. Vacca, A. Vagner, V. Vagnoni, A. Valassi, S. Valat,
  G. Valenti, R. Vazquez Gomez, P. Vazquez Regueiro, S. Vecchi, M. van Veghel,
  J.J. Velthuis, M. Veltri, G. Veneziano, A. Venkateswaran, T.A. Verlage, M.
  Vernet, M. Vesterinen, J.V. Viana Barbosa, D. Vieira, M. Vieites Diaz, H.
  Viemann, X. Vilasis-Cardona, A. Vitkovskiy, M. Vitti, V. Volkov, A.
  Vollhardt, B. Voneki, A. Vorobyev, V. Vorobyev, C. Vo{\ss}, J.A. de Vries, C.
  V\'azquez Sierra, R. Waldi, J. Walsh, J. Wang, M. Wang, Y. Wang, Z. Wang,
  D.R. Ward, H.M. Wark, N.K. Watson, D. Websdale, A. Weiden, C. Weisser, M.
  Whitehead, J. Wicht, G. Wilkinson, M. Wilkinson, M.R.J. Williams, M.
  Williams, T. Williams, F.F. Wilson, J. Wimberley, M. Winn, J. Wishahi, W.
  Wislicki, M. Witek, G. Wormser, S.A. Wotton, K. Wyllie, D. Xiao, Y. Xie, A.
  Xu, M. Xu, Q. Xu, Z. Xu, Z. Xu, Z. Yang, Z. Yang, Y. Yao, H. Yin, J. Yu, X.
  Yuan, O. Yushchenko, K.A. Zarebski, M. Zavertyaev, D. Zhang, L. Zhang, W.C.
  Zhang, Y. Zhang, A. Zhelezov, Y. Zheng, X. Zhu, V. Zhukov, J.B. Zonneveld, S.
  Zucchelli","Central exclusive production of $J/\psi$ and $\psi(2S)$ mesons in $pp$
  collisions at $\sqrt{s}=13~$TeV","All figures and tables, and additional information, are available at
  https://lhcbproject.web.cern.ch/lhcbproject/Publications/p/LHCb-PAPER-2018-011.html","JHEP 10 (2018) 167","10.1007/JHEP10(2018)167","LHCb-PAPER-2018-011, CERN-EP-2018-152","hep-ex","http://creativecommons.org/licenses/by/4.0/","  Measurements are reported of the central exclusive production of \jpsi and
\psitwos mesons in $pp$ collisions at a centre-of-mass energy of 13 TeV.
Backgrounds are significantly reduced compared to previous measurements made at
lower energies through the use of new forward shower counters. The products of
the cross-sections and the branching fractions for the decays to dimuons, where
both muons are within the pseudorapidity range $2.0<\eta<4.5$, are measured to
be $$
  \begin{array}{rcl} \sigma_{J/\psi\rightarrow\mu^+\mu^-}&=&435 \pm 18 \pm 17
\pm 16 {\rm \ pb},\\ \sigma_{\psi(2S)\rightarrow\mu^+\mu^-}&=&11.1 \pm 1.1 \pm
0.3 \pm 0.4 {\rm \ pb}.\\ \end{array} $$ The first uncertainties are
statistical, the second are systematic, and the third are due to the luminosity
determination. The cross-sections are also measured differentially for meson
rapidities between 2.0 and 4.5. Good agreement is observed with theoretical
predictions. Photoproduction cross-sections are derived and compared to
previous experiments, and a deviation from a pure power-law extrapolation of
lower energy data is observed.
","[{""version"":""v1"",""created"":""Mon, 11 Jun 2018 16:01:30 GMT""},{""version"":""v2"",""created"":""Wed, 13 Jun 2018 08:08:24 GMT""},{""version"":""v3"",""created"":""Tue, 30 Oct 2018 09:26:39 GMT""}]","2018-10-31"
"1806.04080","Oded Regev","Ishay Haviv and Oded Regev and Amnon Ta-Shma","On the Hardness of Satisfiability with Bounded Occurrences in the
  Polynomial-Time Hierarchy","Published in Theory of Computing, Volume 3 (2007), Article 3;
  Received: July 28, 2006, Published: March 28, 2007","Theory of Computing 3(3):45-60, 2007","10.4086/toc.2007.v003a003",,"cs.CC","http://creativecommons.org/licenses/by/4.0/","  $ \newcommand{\eps}{\epsilon} \newcommand{\NP}{\mathsf{NP}}
\newcommand{\YES}{\mathsf{YES}} \newcommand{\NO}{\mathsf{NO}}
\newcommand{\myminus}{\text{-}}\newcommand{\Bsat}{{\mathsf{B}}}
\newcommand{\threesat}{\rm{3}\myminus\mathsf{SAT}}
\newcommand{\gapthreesat}{\mathsf{\forall\exists}\myminus{\rm{3}}\myminus\mathsf{SAT}}
$In 1991, Papadimitriou and Yannakakis gave a reduction implying the
$\NP$-hardness of approximating the problem $\threesat$ with bounded
occurrences. Their reduction is based on expander graphs. We present an
analogue of this result for the second level of the polynomial-time hierarchy
based on superconcentrator graphs. This resolves an open question of Ko and Lin
(1995) and should be useful in deriving inapproximability results in the
polynomial-time hierarchy.
  More precisely, we show that given an instance of $\gapthreesat$ in which
every variable occurs at most $\Bsat$ times (for some absolute constant
$\Bsat$), it is $\Pi_2$-hard to distinguish between the following two cases:
$\YES$ instances, in which for any assignment to the universal variables there
exists an assignment to the existential variables that satisfies all the
clauses, and $\NO$ instances in which there exists an assignment to the
universal variables such that any assignment to the existential variables
satisfies at most a $1-\eps$ fraction of the clauses. We also generalize this
result to any level of the polynomial-time hierarchy.
","[{""version"":""v1"",""created"":""Mon, 11 Jun 2018 16:02:43 GMT""}]","2018-06-12"
"1806.04081","Zhiling Dun","Zhiling Dun, Xiaojian Bai, Joseph A. M. Paddison, Nicholas P. Butch,
  Clarina D. Cruz, Matthew B. Stone, Tao Hong, Martin Mourigal, Haidong Zhou","Quantum Spin Fragmentation in Kagome Ice Ho3Mg2Sb3O14","15 pages, 5 figures in the main text, 4 figures in the Appendix","Please see [arXiv: 1912.11229] for an updated version",,,"cond-mat.str-el","http://arxiv.org/licenses/nonexclusive-distrib/1.0/","  A promising route to realize entangled magnetic states combines geometrical
frustration with quantum-tunneling effects. Spin-ice materials are canonical
examples of frustration, and Ising spins in a transverse magnetic field are the
simplest many-body model of quantum tunneling. Here, we show that the tripod
kagome lattice material Ho3Mg2Sb3O14 unites an ice-like magnetic degeneracy
with quantum-tunneling terms generated by an intrinsic splitting of the Ho3+
ground-state doublet, realizing a frustrated transverse Ising model. Using
neutron scattering and thermodynamic experiments, we observe a
symmetry-breaking transition at T*~0.32 K to a remarkable quantum state with
three peculiarities: a continuous magnetic excitation spectrum down to T~0.12K;
a macroscopic degeneracy of ice-like states; and a fragmentation of the spin
into periodic and aperiodic components strongly affected by quantum
fluctuations. Our results establish that Ho3Mg2Sb3O14 realizes a
spin-fragmented state on the kagome lattice, with intrinsic quantum dynamics
generated by a homogeneous transverse field.
","[{""version"":""v1"",""created"":""Mon, 11 Jun 2018 16:06:03 GMT""}]","2021-11-18"
"1806.04082","Salva Bruno","Salvatore Bruno, Roberto Cardarelli, Giulio Aielli, davide Badoni,
  Paolo Camarri, Anna Di Ciaccio, Eelio Alunno Camelia, Alessandro Caltabiano,
  Lorenzo Massa, Lorenzo Paolozzi, Luca Pizzimento, Alessandro Rocchi","Design a TDC in SiGe for RPC's electronics Front-end for the use in a
  high-rate experiment","7 pages, 11 figures, RPC conference 2018, JINST 2018",,,,"physics.ins-det","http://arxiv.org/licenses/nonexclusive-distrib/1.0/","  With the new generation of the RPC, it is possible to work with induced
signals of hundreds $\mu V$, hence the front-end electronics is an important
and delicate part of the detector in order to get a detectable signal. The
electronic chain is made up of an amplifier, a discriminator, a TDC. The new
front-end is realized with the use of silicon-germanium (SiGe) components,
provided by IHP microelectronics. With this technology we can implement BJT and
CMOS transistors on the same chip. The benefit of this improvement is to
minimize: power consumption of the channels ($2 \div 3$ $ \frac{mW}{ch}$),
noise (500 $e^-$ r.m.s), radiation hardness (10 kGy,$10^3$ $\frac{n}{cm}$) and
it maximizes the speed of response electronics. In this work I will highlight
the first TDC prototypes' results. The TDC uses a local oscillator, that has an
oscillation range between $0.6 \div 3 $ GHz, and a the temporal jitter of 15
ps. The data output from the TDC are presented in binary in order to lighten
data processing to the acquisition system. Moreover, we are studying a way to
minimize system latency. This optimization involves the addition of a
serializer (PISO) that sends the TDC data output to the acquisition system at 2
GHz.
","[{""version"":""v1"",""created"":""Mon, 11 Jun 2018 16:07:12 GMT""},{""version"":""v2"",""created"":""Thu, 21 Jun 2018 09:03:32 GMT""}]","2018-06-22"
"1806.04083","Riccardo Borsato","Riccardo Borsato and Linus Wulff","Non-abelian T-duality and Yang-Baxter deformations of Green-Schwarz
  strings","26 pages. References added, plus other minor changes. Example of NATD
  with isotropy added in appendix. Published version",,"10.1007/JHEP08(2018)027","NORDITA 2018-041","hep-th","http://arxiv.org/licenses/nonexclusive-distrib/1.0/","  We perform non-abelian T-duality for a generic Green-Schwarz string with
respect to an isometry (super)group G, and we derive the transformation rules
for the supergravity background fields. Specializing to G bosonic, or G
fermionic but abelian, our results reproduce those available in the literature.
We discuss also continuous deformations of the T-dual models, obtained by
adding a closed B-field before the dualization. This idea can also be used to
generate deformations of the original (un-dualized) model, when the 2-cocycle
identified from the closed B is invertible. The latter construction is the
natural generalization of the so-called Yang-Baxter deformations, based on
solutions of the classical Yang-Baxter equation on the Lie algebra of G and
originally constructed for group manifolds and (super)coset sigma models. We
find that the deformed metric and B-field are obtained through a generalization
of the Seiberg-Witten map. When applied to integrable sigma models these
deformations preserve the integrability.
","[{""version"":""v1"",""created"":""Mon, 11 Jun 2018 16:09:51 GMT""},{""version"":""v2"",""created"":""Wed, 8 Aug 2018 08:57:52 GMT""}]","2018-08-29"
"1806.04084","Arif Shaikh Md","Md Arif Shaikh, Susovan Maity, Sankhasubhra Nag and Tapas Kumar Das","Effective sound speed in relativistic accretion discs around
  Schwarzschild black holes","20 pages, 1 figure, updated to match the published version","New Astronomy, Volume 69, pp. 48-57 (2019)","10.1016/j.newast.2018.12.001",,"astro-ph.HE gr-qc","http://arxiv.org/licenses/nonexclusive-distrib/1.0/","  For low angular momentum axially symmetric accretion flow maintained in
hydrostatic equilibrium along the vertical direction, the value of the Mach
number at the critical points deviates from unity, resulting in the
non-isomorphism of the critical and the sonic points. This introduces several
undesirable complexities while analytically dealing with the stationary
integral accretion solutions and the corresponding phase portraits. We propose
that introduction of an effective dynamical sound speed may resolve the issue
in an elegant way. We linear perturb the full spacetime-dependent general
relativistic Euler and the continuity equations governing the structure and the
dynamics of accretion disc in vertical equilibrium around Schwarzschild black
holes and identify the sonic metric embedded within the stationary background
flow. Such metric describes the propagation of the linear acoustic perturbation
inside the accretion flow. We construct the wave equation corresponding to that
acoustic perturbation and find the speed of propagation of such perturbation.
We finally show that the ordinary thermodynamic sound speed should be
substituted by the speed of propagation of the linear acoustic wave which has
been obtained through the dynamical perturbation. Such substitution will make
the value of Mach number at the critical point to be equal to unity. Use of the
aforementioned effective sound speed will lead to a modified stationary disc
structure where the critical and the sonic points will be identical.
","[{""version"":""v1"",""created"":""Mon, 11 Jun 2018 16:09:59 GMT""},{""version"":""v2"",""created"":""Sat, 8 Dec 2018 12:32:35 GMT""}]","2018-12-11"
"1806.04085","Peter Kalberla MW","P.M.W. Kalberla, U. Haud","Properties of cold and warm HI gas phases derived from a Gaussian
  decomposition of HI4PI data","20 pages 22 figures, A&A in press","A&A 619, A58 (2018)","10.1051/0004-6361/201833146",,"astro-ph.GA","http://arxiv.org/licenses/nonexclusive-distrib/1.0/","  Context. A large fraction of the interstellar medium can be characterized as
a multiphase medium. The neutral hydrogen gas is bistable with a cold and warm
neutral medium (CNM and WNM respectively) but there is evidence for an
additional phase at intermediate temperatures, a lukewarm neutral medium (LNM)
that is thermally unstable. Aims. We use all sky data from the HI4PI survey to
separate these neutral HI phases with the aim to determine their distribution
and phase fractions in the local interstellar medium. Methods. HI4PI
observations, gridded on an nside = 1024 HEALPix grid, were decomposed into
Gaussian components. From the frequency distribution of the velocity
dispersions we infer three separate linewidth regimes. Accordingly we extract
the HI line emission corresponding to the CNM, LNM, and WNM. We generated
all-sky maps of these phases in the local HI gas with -8 < v_LSR < 8 km/s.
Results. Each of the HI phases shows distinct structures on all scales. The LNM
never exists as a single phase but contributes on average 41% of the HI. The
CNM is prominent only for 22% of the sky, contributes there on average 34% but
locally up to 60% of the HI and is associated with dust at temperatures T_dust
~ 18.6 K. Embedded cold filaments show a clear anti-correlation between CNM and
LNM. Also the smoothly distributed WNM is anti-correlated with the CNM. It
contributes for the rest of the sky 39% with dust associated at temperatures
T_dust ~ 19.4 K. Conclusions. The CNM in filaments exists on small scales. Here
the observed anti-correlation between LNM and CNM implies that both, filaments
and the surrounding more extended LNM, must have a common origin.
","[{""version"":""v1"",""created"":""Mon, 11 Jun 2018 16:13:42 GMT""},{""version"":""v2"",""created"":""Wed, 5 Sep 2018 09:48:36 GMT""}]","2018-11-07"
"1806.04086","Sudan Hansraj","Sudan Hansraj","Spherically symmetric isothermal fluids in $f(R,T)$ gravity",,,"10.1140/epjc/s10052-018-6194-1",,"gr-qc","http://arxiv.org/licenses/nonexclusive-distrib/1.0/","  We analyze the isothermal property in static fluid spheres within the
framework of the modified $f(R, T)$ theory of gravitation. The equation of
pressure isotropy of the standard Einstein theory is preserved however, the
energy density and pressure are expressed in terms of both gravitational
potentials. Invoking the isothermal prescription requires that the isotropy
condition assumes the role of a consistency condition and an exact model
generalizing that of general relativity is found. Moreover it is found that the
Einstein model is unstable and acausal while the $f(R, T)$ counterpart is well
behaved on account of the freedom available through an additional coupling
constant. The case of a constant spatial gravitational potential is considered
and the complete model is determined. This model is markedly different from its
Einstein counterpart which is known to be isothermal. Dropping the restriction
on the density and imposing a linear barotropic equation of state generates an
exact solution and consequently a stellar distribution as the vanishing of the
pressure is possible and a boundary hypersurface exists. Finally we comment on
the case of relaxing the equation of state but demanding an inverse square
fall-off of the density - this case proves intractable.
","[{""version"":""v1"",""created"":""Mon, 11 Jun 2018 16:15:37 GMT""}]","2018-09-26"
