"1806.04461","Stephen Lovesey","S. W. Lovesey, D. D. Khalyavin and G. van der Laan","Field-induced magnetic charge in a cubic Laves compound UAl2",,,"10.1088/1742-6596/1316/1/012004",,"cond-mat.str-el","http://arxiv.org/licenses/nonexclusive-distrib/1.0/","  Magnetic diffraction of polarized neutrons by the cubic Laves compound UAl2
in a magnetic field has unveiled weak Bragg spots that are nominally forbidden.
On the one hand, they can be viewed as magnetic analogues of the
basis-forbidden (2, 2, 2) reflection in diamond-type structures that has been
painstakingly and frequently investigated over almost a century. Alternatively,
the pattern of weak intensities can be assigned to Dirac multipoles imbedded in
field-induced magnetic charge. To this end, a published diffraction pattern is
successfully confronted with intensities calculated from the appropriate
magnetic space-group that includes Dirac dipoles (anapoles) to describe the
basis-forbidden magnetic reflections, and conventional (axial) dipole and
octupole multipoles to describe basis-allowed magnetic reflections.
","[{""version"":""v1"",""created"":""Tue, 12 Jun 2018 12:21:25 GMT""},{""version"":""v2"",""created"":""Wed, 4 Jul 2018 09:54:19 GMT""},{""version"":""v3"",""created"":""Thu, 15 Nov 2018 12:13:53 GMT""},{""version"":""v4"",""created"":""Thu, 20 Dec 2018 12:12:04 GMT""}]","2020-01-08"
"1806.04462","Matias Vestberg","Thomas Singer and Matias Vestberg","Local Boundedness of Weak Solutions to the Diffusive Wave Approximation
  of the Shallow Water Equations","Corrected typos",,,,"math.AP","http://arxiv.org/licenses/nonexclusive-distrib/1.0/","  In this paper we prove that weak solutions to the Diffusive Wave
Approximation of the Shallow Water equations $$ \partial_t u - \nabla\cdot
((u-z)^\alpha|\nabla u|^{\gamma-1}\nabla u) = f $$ are locally bounded. Here,
$u$ describes the height of the water, $z$ is a given function that represents
the land elevation and $f$ is a source term accounting for evaporation,
infiltration or rainfall.
","[{""version"":""v1"",""created"":""Tue, 12 Jun 2018 12:23:22 GMT""},{""version"":""v2"",""created"":""Tue, 21 Aug 2018 09:58:52 GMT""}]","2018-08-22"
"1806.04463","Jader Santos Mr","Jader P. Santos and Lucas C. C\'eleri and Frederico Brito and Gabriel
  T. Landi and Mauro Paternostro","Spin-phase-space-entropy production","12 pages, 16 figures","Phys. Rev. A 97, 052123 (2018)","10.1103/PhysRevA.97.052123",,"quant-ph","http://arxiv.org/licenses/nonexclusive-distrib/1.0/","  Quantifying the degree of irreversibility of an open system dynamics
represents a problem of both fundamental and applied relevance. Even though a
well-known framework exists for thermal baths, the results give diverging
results in the limit of zero temperature and are also not readily extended to
nonequilibrium reservoirs, such as dephasing baths. Aimed at filling this gap,
in this paper we introduce a phase-space-entropy production framework for
quantifying the irreversibility of spin systems undergoing Lindblad dynamics.
The theory is based on the spin Husimi-Q function and its corresponding
phase-space entropy, known as Wehrl entropy. Unlike the von Neumann entropy
production rate, we show that in our framework, the Wehrl entropy roduction
rate remains valid at any temperature and is also readily extended to arbitrary
nonequilibrium baths. As an application, we discuss the irreversibility
associated with the interaction of a two-level system with a single-photon
pulse, a problem which cannot be treated using the conventional approach.
","[{""version"":""v1"",""created"":""Tue, 12 Jun 2018 12:27:19 GMT""}]","2018-06-13"
"1806.04464","Zhuan Ye","Dehua Wang, Zhuan Ye","Global existence and exponential decay of strong solutions for the
  inhomogeneous incompressible Navier-Stokes equations with vacuum","31 pages",,,,"math.AP","http://arxiv.org/licenses/nonexclusive-distrib/1.0/","  The inhomogeneous incompressible Navier-Stokes equations with fractional
Laplacian dissipations in the multi-dimensional whole space are considered. The
existence and uniqueness of global strong solution with vacuum are established
for large initial data. The exponential decay-in-time of the strong solution is
also obtained, which is different from the homogeneous case. The initial
density may have vacuum and even compact support.
","[{""version"":""v1"",""created"":""Tue, 12 Jun 2018 12:34:41 GMT""}]","2018-06-13"
"1806.04465","Ilya Feige","Benoit Gaujac, Ilya Feige, David Barber","Gaussian mixture models with Wasserstein distance","8 pages, 5 figures",,,,"stat.ML cs.LG","http://arxiv.org/licenses/nonexclusive-distrib/1.0/","  Generative models with both discrete and continuous latent variables are
highly motivated by the structure of many real-world data sets. They present,
however, subtleties in training often manifesting in the discrete latent being
under leveraged. In this paper, we show that such models are more amenable to
training when using the Optimal Transport framework of Wasserstein
Autoencoders. We find our discrete latent variable to be fully leveraged by the
model when trained, without any modifications to the objective function or
significant fine tuning. Our model generates comparable samples to other
approaches while using relatively simple neural networks, since the discrete
latent variable carries much of the descriptive burden. Furthermore, the
discrete latent provides significant control over generation.
","[{""version"":""v1"",""created"":""Tue, 12 Jun 2018 12:35:10 GMT""}]","2018-06-13"
"1806.04466","Shaohui Kuang","Shaohui Kuang, Deyi Xiong","Fusing Recency into Neural Machine Translation with an Inter-Sentence
  Gate Model","Accepted by COLING2018.11 pages,4 figures. arXiv admin note: text
  overlap with arXiv:1711.11221",,,,"cs.CL","http://arxiv.org/licenses/nonexclusive-distrib/1.0/","  Neural machine translation (NMT) systems are usually trained on a large
amount of bilingual sentence pairs and translate one sentence at a time,
ignoring inter-sentence information. This may make the translation of a
sentence ambiguous or even inconsistent with the translations of neighboring
sentences. In order to handle this issue, we propose an inter-sentence gate
model that uses the same encoder to encode two adjacent sentences and controls
the amount of information flowing from the preceding sentence to the
translation of the current sentence with an inter-sentence gate. In this way,
our proposed model can capture the connection between sentences and fuse
recency from neighboring sentences into neural machine translation. On several
NIST Chinese-English translation tasks, our experiments demonstrate that the
proposed inter-sentence gate model achieves substantial improvements over the
baseline.
","[{""version"":""v1"",""created"":""Tue, 12 Jun 2018 12:37:20 GMT""}]","2018-06-13"
"1806.04467","Loic Baron","Lo\""ic Baron (NPA, CNRS), Radomir Klacza (UPMC, NPA), Pauline
  Gaudet-Chardonnet (NPA, UPMC), Amira Bradai (UPMC, NPA), Ciro Scognamiglio
  (UPMC, NPA), Serge Fdida (NPA, LINCS)","Next generation portal for federated testbeds MySlice v2: from prototype
  to production",,,,,"cs.NI cs.CY cs.DB","http://arxiv.org/licenses/nonexclusive-distrib/1.0/","  A number of projects in computer science around the world have contributed to
build federated experimental facilities providing access to a large set of
distributed compute, storage and network resources for the research community.
Several tools have been developed to provide users an easy access to the
federated testbeds. This paper presents the architecture of the new version of
the MySlice web portal, that has evolved from a prototype to a production ready
software.
","[{""version"":""v1"",""created"":""Tue, 12 Jun 2018 12:39:00 GMT""}]","2018-06-16"
"1806.04468","Hiroyuki Ishida","Jung Chang, Kingman Cheung, Hiroyuki Ishida, Chih-Ting Lu, Martin
  Spinrath, Yue-Lin Sming Tsai","Sneutrino Dark Matter via pseudoscalar X-funnel meets Inverse Seesaw","24 pages, 8 figures, and 2 tables.
  https://sarah.hepforge.org/trac/wiki/inverse-Seesaw-SUSY-EW, v2: correspond
  to published version","JHEP09(2018)071","10.1007/JHEP09(2018)071","NCTS-PH/1808","hep-ph astro-ph.HE","http://arxiv.org/licenses/nonexclusive-distrib/1.0/","  In this paper we study sneutrino dark matter in a recently proposed
supersymmetric electroweak-scale inverse seesaw model, in which the majority of
the sneutrino dark matter particle is a mixture of the right-handed sneutrino
$\tilde{N}^c$ and the singlet field $\tilde{S}$. The scalar field $X$
responsible for the generation of neutrino masses can simultaneously play a
crucial role for sneutrino annihilation in the early Universe via the
pseudoscalar mediator $A_X$ into neutrinos. We focus here on the dominant
annihilation channels and provide all the formulas together with analytic
estimates in order to identify the relevant parameters. Furthermore, we show
that the direct detection scattering cross section is many orders of magnitude
below the current limits, and estimate the indirect detection annihilation
rate, which is only a few orders of magnitude below the current limits.
","[{""version"":""v1"",""created"":""Tue, 12 Jun 2018 12:42:20 GMT""},{""version"":""v2"",""created"":""Sun, 16 Sep 2018 09:36:27 GMT""}]","2018-09-18"
"1806.04469","Elmo Tempel","Elmo Tempel, Maarja Kruuse, Rain Kipper, Taavi Tuvikene, Jenny G.
  Sorce and Radu S. Stoica","Bayesian group finder based on marked point processes. Method and
  feasibility study using the 2MRS data set","19 pages, 14 figures, accepted by A&A","A&A 618, A81 (2018)","10.1051/0004-6361/201833217",,"astro-ph.CO","http://arxiv.org/licenses/nonexclusive-distrib/1.0/","  Galaxy groups and clusters are formidable cosmological probes. They permit
the studying of the environmental effects on galaxy formation. A reliable
detection of galaxy groups is an open problem and is important for ongoing and
future cosmological surveys.
  We propose a probabilistic galaxy group detection algorithm based on marked
point processes with interactions.
  The pattern of galaxy groups in a catalogue is seen as a random set of
interacting objects. The positions and the interactions of these objects are
governed by a probability density. The estimator of the unknown cluster pattern
is given by the configuration of objects maximising the proposed probability
density. Adopting the Bayesian framework, the proposed probability density is
maximised using a simulated annealing algorithm. The method provides ""for free""
additional information such as the probabilities that a point or two points in
the observation domain belong to the cluster pattern, respectively. These
supplementary tools allow the construction of tests and techniques to validate
and to refine the detection result.
  To test the feasibility of the proposed methodology, we applied it to the
well-studied 2MRS data set. Compared to previously published Friends-of-Friends
(FoF) group finders, the proposed Bayesian group finder gives overall similar
results.
  The proposed Bayesian group finder is tested on a galaxy redshift survey, but
more detailed analyses are needed to understand the actual capabilities of the
algorithm regarding upcoming cosmological surveys. The presented mathematical
framework permits adapting it easily for other data sets (in astronomy and in
other fields of sciences). In cosmology, one promising application is the
detection of galaxy groups in photometric galaxy redshift surveys, while taking
into account the full photometric redshift posteriors. (abridged)
","[{""version"":""v1"",""created"":""Tue, 12 Jun 2018 12:42:32 GMT""},{""version"":""v2"",""created"":""Thu, 12 Jul 2018 15:07:42 GMT""}]","2018-10-17"
"1806.04470","Jie Yang","Jie Yang, Shuailong Liang, Yue Zhang","Design Challenges and Misconceptions in Neural Sequence Labeling","Accepted by COLING 2018 (Best Paper Award)",,,,"cs.CL","http://arxiv.org/licenses/nonexclusive-distrib/1.0/","  We investigate the design challenges of constructing effective and efficient
neural sequence labeling systems, by reproducing twelve neural sequence
labeling models, which include most of the state-of-the-art structures, and
conduct a systematic model comparison on three benchmarks (i.e. NER, Chunking,
and POS tagging). Misconceptions and inconsistent conclusions in existing
literature are examined and clarified under statistical experiments. In the
comparison and analysis process, we reach several practical conclusions which
can be useful to practitioners.
","[{""version"":""v1"",""created"":""Tue, 12 Jun 2018 12:43:42 GMT""},{""version"":""v2"",""created"":""Thu, 12 Jul 2018 09:31:10 GMT""}]","2018-07-13"
"1806.04471","Frank Glavin","Anthony M. Colwell and Frank G. Glavin","Colwell's Castle Defence: A Custom Game Using Dynamic Difficulty
  Adjustment to Increase Player Enjoyment","25th Irish Conference on Artificial Intelligence and Cognitive
  Science At: Dublin Institute of Technology (http://ceur-ws.org/Vol-2086/)","In proceedings of AICS, Dublin Institute of Technology, pp.
  275-282 (2017)",,,"cs.HC cs.AI","http://arxiv.org/licenses/nonexclusive-distrib/1.0/","  Dynamic Difficulty Adjustment (DDA) is a mechanism used in video games that
automatically tailors the individual gaming experience to match an appropriate
difficulty setting. This is generally achieved by removing pre-defined
difficulty tiers such as Easy, Medium and Hard; and instead concentrates on
balancing the gameplay to match the challenge to the individual's abilities.
The work presented in this paper examines the implementation of DDA in a custom
survival game developed by the author, namely Colwell's Castle Defence. The
premise of this arcade-style game is to defend a castle from hordes of oncoming
enemies. The AI system that we developed adjusts the enemy spawn rate based on
the current performance of the player. Specifically, we read the Player Health
and Gate Health at the end of each level and then assign the player with an
appropriate difficulty tier for the proceeding level. We tested the impact of
our technique on thirty human players and concluded, based on questionnaire
feedback, that enabling the technique led to more enjoyable gameplay.
","[{""version"":""v1"",""created"":""Tue, 12 Jun 2018 12:46:18 GMT""}]","2018-06-13"
"1806.04472","Sebastian Jaimungal","Philippe Casgrain, Sebastian Jaimungal","Trading algorithms with learning in latent alpha models","42 pages, 5 figures","Mathematical Finance, Forthcoming, 2018",,,"q-fin.MF q-fin.ST q-fin.TR stat.ML","http://arxiv.org/licenses/nonexclusive-distrib/1.0/","  Alpha signals for statistical arbitrage strategies are often driven by latent
factors. This paper analyses how to optimally trade with latent factors that
cause prices to jump and diffuse. Moreover, we account for the effect of the
trader's actions on quoted prices and the prices they receive from trading.
Under fairly general assumptions, we demonstrate how the trader can learn the
posterior distribution over the latent states, and explicitly solve the latent
optimal trading problem. We provide a verification theorem, and a methodology
for calibrating the model by deriving a variation of the
expectation-maximization algorithm. To illustrate the efficacy of the optimal
strategy, we demonstrate its performance through simulations and compare it to
strategies which ignore learning in the latent factors. We also provide
calibration results for a particular model using Intel Corporation stock as an
example.
","[{""version"":""v1"",""created"":""Tue, 12 Jun 2018 12:46:30 GMT""}]","2018-06-13"
"1806.04473","Minh Loc Bui","Bui Minh Loc, Naftali Auerbach, and G. Col\`o","Isospin mixing and Coulomb mixing in ground states of even-even nuclei","14 pages, 2 figures","Phys. Rev. C 99, 014311 (2019)","10.1103/PhysRevC.99.014311",,"nucl-th","http://arxiv.org/licenses/nonexclusive-distrib/1.0/","  In this work, the Coulomb mixing and the isospin mixing in the ground states
of even-even nuclei are evaluated in perturbation theory. The calculation of
the isospin mixing is performed by using the connection to isovector monopole
resonance properties. The uncertainty in the results that depends on different
choices of the Skyrme interactions is shown. While Coulomb mixing turns out to
be large in the ground states of heavy nuclei, isospin mixing is very small.
","[{""version"":""v1"",""created"":""Tue, 12 Jun 2018 12:48:20 GMT""}]","2019-01-16"
"1806.04474","S. B. Balaji","S.B. Balaji and P. Vijay Kumar","Erasure Codes for Distributed Storage: Tight Bounds and Matching
  Constructions","My PhD Thesis",,,,"cs.IT math.IT","http://arxiv.org/licenses/nonexclusive-distrib/1.0/","  This thesis makes several significant contributions to the theory of both
Regenerating (RG) and Locally Recoverable (LR) codes. The two principal
contributions are characterizing the optimal rate of an LR code designed to
recover from $t$ erased symbols sequentially, for any $t$ and the development
of a tight bound on the sub-packetization level (length of a vector code
symbol) of a sub-class of RG codes called optimal-access RG codes. There are
however, several other notable contributions as well such as deriving the
tightest-known bounds on the performance metrics such as minimum distance and
rate of a sub-class of LR codes known as availability codes. The thesis also
presents some low field size constructions of Maximal Recoverable codes.
","[{""version"":""v1"",""created"":""Tue, 12 Jun 2018 12:49:21 GMT""}]","2018-06-13"
"1806.04475","Alexander Dranishnikov","Alexander Dranishnikov","An upper bound on the LS-category in presence of the fundamental group",,"Algebr. Geom. Topol. 19 (2019) 3601-3614","10.2140/agt.2019.19.3601",,"math.AT","http://arxiv.org/licenses/nonexclusive-distrib/1.0/","  We prove that $$ \cat X\le \frac{\cd(\pi_1(X))+\dim X}{2}$$ for every CW
complex $X$ where $\cd(\pi_1(X))$ denotes the cohomological dimension of the
fundamental group of $X$. We obtain this as a corollary of the inequality $$
\cat X\le\frac{\cat (u_X)+\dim X}{2} $$ where $u_X:X\to B\pi_1(X)$ is a
classifying map for the universal covering of $X$.
","[{""version"":""v1"",""created"":""Tue, 12 Jun 2018 12:55:12 GMT""},{""version"":""v2"",""created"":""Tue, 15 Jan 2019 23:16:51 GMT""}]","2019-12-25"
"1806.04476","Lei Wei","Lei Wei, Anatoly V. Zayats and Francisco J. Rodr\'iguez-Fortu\~no","Interferometric evanescent wave excitation of nano-antenna for
  ultra-sensitive displacement and phase metrology",,"Phys. Rev. Lett. 121, 193901 (2018)","10.1103/PhysRevLett.121.193901",,"physics.optics","http://arxiv.org/licenses/nonexclusive-distrib/1.0/","  We propose a method for ultra-sensitive displacement and phase metrology
based on the interferometric evanescent wave excitation of nano-antennas. We
show that with a proper choice of nano-antenna, tiny displacements or relative
phase variations can be converted into sensitive scattering direction changes
in the Fourier $k$-space. These changes stem from the strong position
dependence of the imaginary Poynting vector orientation within interfering
evanescent waves. Using strongly-evanescent standing waves, high sensitivity is
achieved in the nano-antenna's zero scattering direction, which varies linearly
with displacement over a long range. With weakly-evanescent wave interference,
even higher sensitivity to tiny displacement or phase changes can be reached
around chosen location. The high sensitivity of the proposed method can form
the basis for many applications.
","[{""version"":""v1"",""created"":""Tue, 12 Jun 2018 12:59:30 GMT""}]","2018-11-14"
"1806.04477","Yasumitsu Suzuki","Yasumitsu Suzuki, Satoshi Hagiwara, Kazuyuki Watanabe","Time-Dependent Multi-Component Density Functional Theory for Coupled
  Electron-Positron Dynamics","6 pages, 3 figures","Phys. Rev. Lett. 121, 133001 (2018)","10.1103/PhysRevLett.121.133001",,"physics.chem-ph cond-mat.other physics.comp-ph quant-ph","http://arxiv.org/licenses/nonexclusive-distrib/1.0/","  Electron-positron interactions have been utilized in various fields of
science. Here we develop time-dependent multi-component density functional
theory to study the coupled electron-positron dynamics from first principles.
We prove that there are coupled time-dependent single-particle equations that
can provide the electron and positron density dynamics, and derive the formally
exact expression for their effective potentials. Introducing the adiabatic
local density approximation to time dependent electron-positron correlation, we
apply the theory to the dynamics of a positronic lithium hydride molecule under
a laser field. We demonstrate the significance of electron-positron dynamical
correlation by revealing the complex positron detachment mechanism and the
suppression of electronic resonant excitation by the screening effect of the
positron.
","[{""version"":""v1"",""created"":""Tue, 12 Jun 2018 13:01:24 GMT""}]","2018-10-03"
"1806.04478","Erez Nesharim","Faustin Adiceam, Erez Nesharim and Fred Lunnon","On the $t$-adic Littlewood Conjecture","36 pages",,,,"math.NT cs.DM cs.FL math.CO math.DS","http://arxiv.org/licenses/nonexclusive-distrib/1.0/","  The $p$-adic Littlewood Conjecture due to De Mathan and Teuli\'e asserts that
for any prime number $p$ and any real number $\alpha$, the equation
$$\inf_{|m|\ge 1} |m|\cdot |m|_p\cdot |\langle m\alpha \rangle|\, =\, 0 $$
holds. Here, $|m|$ is the usual absolute value of the integer $m$, $|m|_p$ its
$p$-adic absolute value and $ |\langle x\rangle|$ denotes the distance from a
real number $x$ to the set of integers. This still open conjecture stands as a
variant of the well-known Littlewood Conjecture. In the same way as the latter,
it admits a natural counterpart over the field of formal Laurent series
$\mathbb{K}\left(\left(t^{-1}\right)\right)$ of a ground field $\mathbb{K}$.
This is the so-called \emph{$t$-adic Littlewood Conjecture} ($t$-LC).
  It is known that $t$--LC fails when the ground field $\mathbb{K}$ is
infinite. This article is concerned with the much more difficult case when the
latter field is finite. More precisely, a \emph{fully explicit} counterexample
is provided to show that $t$-LC does not hold in the case that $\mathbb{K}$ is
a finite field with characteristic 3. Generalizations to fields with
characteristics different from 3 are also discussed.
  The proof is computer assisted. It reduces to showing that an infinite matrix
encoding Hankel determinants of the Paper-Folding sequence over $\mathbb{F}_3$,
the so-called Number Wall of this sequence, can be obtained as a
two-dimensional automatic tiling satisfying a finite number of suitable local
constraints.
","[{""version"":""v1"",""created"":""Tue, 12 Jun 2018 13:01:26 GMT""},{""version"":""v2"",""created"":""Sun, 11 Oct 2020 08:11:07 GMT""}]","2020-10-13"
"1806.04479","Imtak Jeon","Imtak Jeon and Sameer Murthy","Twisting and localization in supergravity: equivariant cohomology of BPS
  black holes","V2: subsection 4.3 added, typo corrected, accepted version in JHEP;
  V3: typos corrected; V4: minor typos corrected",,"10.1007/JHEP03(2019)140",,"hep-th","http://arxiv.org/licenses/nonexclusive-distrib/1.0/","  We develop the formalism of supersymmetric localization in supergravity using
the deformed BRST algebra defined in the presence of a supersymmetric
background as recently formulated in arxiv:1806.03690. The gravitational
functional integral localizes onto the cohomology of a global supercharge
$Q_\text{eq}$, obeying $Q_\text{eq}^2=H$, where $H$ is a global symmetry of the
background. Our construction naturally produces a twisted version of
supergravity whenever supersymmetry can be realized off-shell. We present the
details of the twisted graviton multiplet and ghost fields for the
superconformal formulation of four-dimensional N=2 supergravity. As an
application of our formalism, we systematize the computation of the exact
quantum entropy of supersymmetric black holes. In particular, we compute the
one-loop determinant of the $Q_\text{eq} \mathcal{V}$ deformation operator for
the off-shell fluctuations of the Weyl multiplet around the $AdS_2 \times S^2$
saddle. This result, which is consistent with the corresponding large-charge
on-shell analysis, is needed to complete the first-principles computation of
the quantum entropy.
","[{""version"":""v1"",""created"":""Tue, 12 Jun 2018 13:01:49 GMT""},{""version"":""v2"",""created"":""Wed, 3 Apr 2019 15:19:07 GMT""},{""version"":""v3"",""created"":""Tue, 28 Apr 2020 12:44:36 GMT""},{""version"":""v4"",""created"":""Thu, 6 Oct 2022 12:56:31 GMT""}]","2022-10-07"
"1806.04480","Ilya Feige","Alex Mansbridge, Roberto Fierimonte, Ilya Feige, David Barber","Improving latent variable descriptiveness with AutoGen","8 pages, 2 figures, 5 tables",,,,"stat.ML cs.LG","http://arxiv.org/licenses/nonexclusive-distrib/1.0/","  Powerful generative models, particularly in Natural Language Modelling, are
commonly trained by maximizing a variational lower bound on the data log
likelihood. These models often suffer from poor use of their latent variable,
with ad-hoc annealing factors used to encourage retention of information in the
latent variable. We discuss an alternative and general approach to latent
variable modelling, based on an objective that combines the data log likelihood
as well as the likelihood of a perfect reconstruction through an autoencoder.
Tying these together ensures by design that the latent variable captures
information about the observations, whilst retaining the ability to generate
well. Interestingly, though this approach is a priori unrelated to VAEs, the
lower bound attained is identical to the standard VAE bound but with the
addition of a simple pre-factor; thus, providing a formal interpretation of the
commonly used, ad-hoc pre-factors in training VAEs.
","[{""version"":""v1"",""created"":""Tue, 12 Jun 2018 13:02:19 GMT""}]","2018-06-13"
