"1806.04212","Lasya Venneti","Lasya Venneti and Aniket Alam","How Curiosity can be modeled for a Clickbait Detector","This work was presented at 1st Workshop on Humanizing AI (HAI) at
  IJCAI'18 in Stockholm, Sweden",,,,"cs.AI cs.HC","http://arxiv.org/licenses/nonexclusive-distrib/1.0/","  The impact of continually evolving digital technologies and the proliferation
of communications and content has now been widely acknowledged to be central to
understanding our world. What is less acknowledged is that this is based on the
successful arousing of curiosity both at the collective and individual levels.
Advertisers, communication professionals and news editors are in constant
competition to capture attention of the digital population perennially shifty
and distracted. This paper, tries to understand how curiosity works in the
digital world by attempting the first ever work done on quantifying human
curiosity, basing itself on various theories drawn from humanities and social
sciences. Curious communication pushes people to spot, read and click the
message from their social feed or any other form of online presentation. Our
approach focuses on measuring the strength of the stimulus to generate reader
curiosity by using unsupervised and supervised machine learning algorithms, but
is also informed by philosophical, psychological, neural and cognitive studies
on this topic. Manually annotated news headlines - clickbaits - have been
selected for the study, which are known to have drawn huge reader response. A
binary classifier was developed based on human curiosity (unlike the work done
so far using words and other linguistic features). Our classifier shows an
accuracy of 97% . This work is part of the research in computational humanities
on digital politics quantifying the emotions of curiosity and outrage on
digital media.
","[{""version"":""v1"",""created"":""Mon, 11 Jun 2018 19:39:42 GMT""}]","2018-06-13"
"1806.04213","The CMS Collaboration","CMS Collaboration","Observation of the Z $\to\psi\ell^+\ell^-$ decay in pp collisions at
  $\sqrt{s}=$ 13 TeV","Replaced with the published version. Added the journal reference and
  the DOI. All the figures and tables can be found at
  http://cms-results.web.cern.ch/cms-results/public-results/publications/BPH-16-001
  (CMS Public Pages)","Phys. Rev. Lett. 121, 141801 (2018)","10.1103/PhysRevLett.121.141801","CMS-BPH-16-001, CERN-EP-2018-131","hep-ex","http://creativecommons.org/licenses/by/4.0/","  This Letter presents the observation of the rare Z boson decay Z
$\to\psi\ell^+\ell^-$. Here, $\psi$ represents contributions from direct
J/$\psi$ and $\psi$(2S) $\to$ J/$\psi X$, $\ell^+\ell^-$ is a pair of electrons
or muons, and the J/$\psi$ meson is detected via its decay to $\mu^+\mu^-$. The
sample of proton-proton collision data, collected by the CMS experiment at the
LHC at a center-of-mass energy of 13 TeV, corresponds to an integrated
luminosity of 35.9 fb$^{-1}$. The signal is observed with a significance in
excess of 5 standard deviations. After subtraction of the $\psi$(2S) $\to$
J/$\psi X$ contribution, the ratio of the branching fraction of the exclusive
decay Z $\to\psi\ell^+\ell^-$ to the decay Z $\to\mu^+\mu^-\mu^+\mu^-$ within a
fiducial phase space is measured to be $\mathcal{B}($Z $\to\psi\ell^+\ell^-) /
\mathcal{B}($Z $\to\mu^+\mu^-\mu^+\mu^-) =$ 0.67 $\pm$ 0.18 (stat) $\pm$ 0.05
(syst).
","[{""version"":""v1"",""created"":""Mon, 11 Jun 2018 19:43:02 GMT""},{""version"":""v2"",""created"":""Fri, 5 Oct 2018 16:34:13 GMT""}]","2018-10-10"
"1806.04214","Jean-Gabriel Young","Jean-Gabriel Young, Guillaume St-Onge, Patrick Desrosiers, Louis J.
  Dub\'e","Universality of the stochastic block model","13 pages, 4 figures","Phys. Rev. E 98, 032309 (2018)","10.1103/PhysRevE.98.032309",,"physics.soc-ph stat.ML","http://arxiv.org/licenses/nonexclusive-distrib/1.0/","  Mesoscopic pattern extraction (MPE) is the problem of finding a partition of
the nodes of a complex network that maximizes some objective function. Many
well-known network inference problems fall in this category, including, for
instance, community detection, core-periphery identification, and imperfect
graph coloring. In this paper, we show that the most popular algorithms
designed to solve MPE problems can in fact be understood as special cases of
the maximum likelihood formulation of the stochastic block model (SBM), or one
of its direct generalizations. These equivalence relations show that the SBM is
nearly universal with respect to MPE problems.
","[{""version"":""v1"",""created"":""Mon, 11 Jun 2018 19:43:59 GMT""},{""version"":""v2"",""created"":""Mon, 24 Sep 2018 18:59:08 GMT""}]","2018-10-03"
"1806.04215","Wei Zhao","Zhongmin Shen and Wei Zhao","Dimension-like functions and spectrums of Finsler manifolds","A new co-author joins in this work and helps to improve this paper.
  So this paper should be withdraw in order to exclude any confusion",,,,"math.DG","http://arxiv.org/licenses/nonexclusive-distrib/1.0/","  In this paper, we study the spectral problem on a compact Finsler manifold
with or without boundary. More precisely, given a certain collection of sets in
Sobolev space $H^{1,2}(M)$ and a dimension-like function, we can define a
corresponding spectrum. Such a spectrum satisfies nice properties. In
particular, the eigenfunction corresponding to each eigenvalue always exists.
And a Cheng type upper bound estimate for eigenvalues is obtained. Moreover,
some interesting examples are constructed and investigated in this paper.
","[{""version"":""v1"",""created"":""Mon, 11 Jun 2018 19:44:37 GMT""},{""version"":""v2"",""created"":""Wed, 12 Sep 2018 03:19:54 GMT""},{""version"":""v3"",""created"":""Mon, 1 Jul 2019 11:56:25 GMT""}]","2019-07-02"
"1806.04216","Hang Ma","Hang Ma, Glenn Wagner, Ariel Felner, Jiaoyang Li, T. K. Satish Kumar,
  Sven Koenig","Multi-Agent Path Finding with Deadlines","IJCAI 2018, to appear",,,,"cs.AI cs.MA cs.RO","http://arxiv.org/licenses/nonexclusive-distrib/1.0/","  We formalize Multi-Agent Path Finding with Deadlines (MAPF-DL). The objective
is to maximize the number of agents that can reach their given goal vertices
from their given start vertices within the deadline, without colliding with
each other. We first show that MAPF-DL is NP-hard to solve optimally. We then
present two classes of optimal algorithms, one based on a reduction of MAPF-DL
to a flow problem and a subsequent compact integer linear programming
formulation of the resulting reduced abstracted multi-commodity flow network
and the other one based on novel combinatorial search algorithms. Our empirical
results demonstrate that these MAPF-DL solvers scale well and each one
dominates the other ones in different scenarios.
","[{""version"":""v1"",""created"":""Mon, 11 Jun 2018 19:54:38 GMT""}]","2018-06-13"
"1806.04217","Bal\'azs Keszegh","Bal\'azs Keszegh and D\""om\""ot\""or P\'alv\""olgyi","Aligned plane drawings of the generalized Delaunay-graphs for
  pseudo-disks",,"Journal of Computational Geometry 11(1) (2020), 354-370",,,"cs.CG math.CO","http://arxiv.org/licenses/nonexclusive-distrib/1.0/","  We study general Delaunay-graphs, which are natural generalizations of
Delaunay triangulations to arbitrary families, in particular to pseudo-disks.
We prove that for any finite pseudo-disk family and point set, there is a plane
drawing of their Delaunay-graph such that every edge lies inside every
pseudo-disk that contains its endpoints.
","[{""version"":""v1"",""created"":""Mon, 11 Jun 2018 19:57:51 GMT""},{""version"":""v2"",""created"":""Mon, 24 Aug 2020 12:35:32 GMT""}]","2020-08-25"
"1806.04218","Colin Guillarmou","Colin Guillarmou, Thibault Lefeuvre","The marked length spectrum of Anosov manifolds","18 pages; minor corrections in the proof and some references added",,,,"math.DG math.DS","http://arxiv.org/licenses/nonexclusive-distrib/1.0/","  In all dimensions, we prove that the marked length spectrum of a Riemannian
manifold $(M,g)$ with Anosov geodesic flow and non-positive curvature locally
determines the metric in the sense that two close enough metrics with the same
marked length spectrum are isometric. In addition, we provide a completely new
stability estimate quantifying how the marked length spectrum control the
distance between the metrics. In dimension $2$ we obtain similar results for
general metrics with Anosov geodesic flows. We also solve locally a rigidity
conjecture of Croke relating volume and marked length spectrum for the same
category of metrics. Finally, by a compactness argument, we show that the set
of negatively curved metrics (up to isometry) with the same marked length
spectrum and with curvature in a bounded set of $C^\infty$ is finite.
","[{""version"":""v1"",""created"":""Mon, 11 Jun 2018 19:59:36 GMT""},{""version"":""v2"",""created"":""Tue, 23 Oct 2018 09:35:48 GMT""}]","2018-10-24"
"1806.04219","Ahmed Khorshid","Ahmed E. Khorshid, Ibrahim N. Alquaydheb, Ahmed M. Eltawil, and Fadi
  J. Kurdahi","Physical Multi-Layer Phantoms for Intra-Body Communications",,,,,"eess.SP","http://arxiv.org/licenses/nonexclusive-distrib/1.0/","  This paper presents approaches to creating tissue mimicking materials that
can be used as phantoms for evaluating the performance of Body Area Networks
(BAN). The main goal of the paper is to describe a methodology to create a
repeatable experimental BAN platform that can be customized depending on the
BAN scenario under test. Comparisons between different material compositions
and percentages are shown, along with the resulting electrical properties of
each mixture over the frequency range of interest for intra-body
communications; 100 KHz to 100 MHz. Test results on a composite multi-layer
sample are presented confirming the efficacy of the proposed methodology. To
date, this is the first paper that provides guidance on how to decide on
concentration levels of ingredients, depending on the exact frequency range of
operation, and the desired matched electrical characteristics (conductivity vs.
permittivity), to create multi-layer phantoms for intra-body communication
applications.
","[{""version"":""v1"",""created"":""Mon, 11 Jun 2018 20:02:25 GMT""}]","2018-06-13"
"1806.04220","Sourav Chatterjee","Sourav Chatterjee","Proof of the path localization conjecture for directed polymers","16 pages, 1 figure. To appear in Comm. Math. Phys",,"10.1007/s00220-019-03533-1",,"math.PR math-ph math.MP","http://arxiv.org/licenses/nonexclusive-distrib/1.0/","  It is a well-known open problem in the literature on random polymers to show
that a directed polymer in random environment localizes around a favorite path
at low temperature. A precise statement of this conjecture is formulated and
proved in this article.
","[{""version"":""v1"",""created"":""Mon, 11 Jun 2018 20:10:16 GMT""},{""version"":""v2"",""created"":""Thu, 27 Jun 2019 15:02:41 GMT""}]","2019-09-04"
"1806.04221","Robert Strausbaugh","Robert Strausbaugh, Rebecca Jackson, Nat Butler","Night Vision for Small Telescopes","13 pages, 7 figures, accepted PASP May 2018",,"10.1088/1538-3873/aaca2a",,"astro-ph.IM","http://arxiv.org/licenses/nonexclusive-distrib/1.0/","  We explore the feasibility of using current generation, off-the-shelf, indium
gallium arsenide (InGaAs) near-infrared (NIR) detectors for astronomical
observations. Light-weight InGaAs cameras, developed for the night vision
industry and operated at or near room temperature, enable cost-effective new
paths for observing the NIR sky, particularly when paired with small
telescopes. We have tested an InGaAs camera in the laboratory and on the sky
using 12 and 18-inch telescopes. The camera is a small-format, 320x240 pixels
of 40$\mu$m pitch, Short Wave Infra-Red (SWIR) device from Sensors Unlimited.
Although the device exhibits a room-temperature dark current of $5.7 \times
10^4$ $e^-s^{-1}$ per pixel, we find observations of bright sources and
low-positional-resolution observations of faint sources remain feasible. We can
record unsaturated images of bright ($J=3.9$) sources due to the large pixel
well-depth and resulting high dynamic range. When mounted on an 18-inch
telescope, the sensor is capable of achieving milli-magnitude precision for
sources brighter than $J=8$. Faint sources can be sky-background-limited with
modest thermoelectric cooling. We can detect faint sources ($J=16.4$ at
$10\sigma$) in a one-minute exposure when mounted to an 18-inch telescope. From
laboratory testing, we characterize the noise properties, sensitivity, and
stability of the camera in a variety of different operational modes and at
different operating temperatures. Through sky testing, we show that the
(unfiltered) camera can enable precise and accurate photometry, operating like
a filtered $J$-band detector, with small color corrections. In the course of
our sky testing, we successfully measured sub-percent flux variations in an
exoplanet transit. We have demonstrated an ability to detect transient sources
in dense fields using image subtraction of existing reference catalogs.
","[{""version"":""v1"",""created"":""Mon, 11 Jun 2018 20:12:08 GMT""}]","2018-07-16"
"1806.04222","Andr\'e Silva","R. Bruce Richter, Andr\'e C. Silva, Orlando Lee","Bounding the number of non-duplicates of the $q$-side in simple drawings
  of $K_{p,q}$",,,"10.1007/s00373-021-02394-7",,"math.CO","http://arxiv.org/licenses/nonexclusive-distrib/1.0/","  The number $Z(n):=\lfloor n/2\rfloor\lfloor (n-1)/2\rfloor$ is the smallest
number of crossings in a simple planar drawing of $K_{2,n}$ in which both
vertices on the 2-side have the same clockwise rotation. For two vertices $u,v$
on the $q$-side of a simple drawing of $K_{p,q}$, let
$\operatorname{cr}_D(u,v)$ denote the total number of crossings that edges
incident with $u$ have with edges incident with $v$.
  We show that in any simple drawing $D$ of $K_{p,q}$ in a surface $\Sigma$ the
number of pairs of vertices on the $q$-side of $K_{p,q}$ having
$\operatorname{cr}_D(u,v)<Z(p)$ is bounded as a function of $p$ and $\Sigma$.
As a consequence, we also show that, for a fixed integer $p$ and surface
$\Sigma$, there exists a finite set of drawings $\mathcal{D}(p,\Sigma)$ of
complete bipartite graphs such that, for each $q$, a crossing-minimal drawing
of $K_{p,q}$ can be obtained by ""duplicating vertices"" in some drawing from
$\mathcal D(p,\Sigma)$.
","[{""version"":""v1"",""created"":""Mon, 11 Jun 2018 20:16:31 GMT""},{""version"":""v2"",""created"":""Mon, 23 Aug 2021 12:41:25 GMT""}]","2021-08-24"
"1806.04223","Harun Siljak","Harun Siljak","Reversibility in space, time, and computation: the case of underwater
  acoustic communications","7 pages, RC 2018 Work in Progress paper",,,,"nlin.CG cs.ET eess.SP","http://arxiv.org/licenses/nonexclusive-distrib/1.0/","  Time reversal of waves has been successfully used in communications, sensing
and imaging for decades. The application in underwater acoustic communications
is of our special interest, as it puts together a reversible process (allowing
a reversible software or hardware realisation) and a reversible medium
(allowing a reversible model of the environment). This work in progress report
addresses the issues of modelling, analysis and implementation of acoustic time
reversal from the reversible computation perspective. We show the potential of
using reversible cellular automata for modelling and quantification of
reversibility in the time reversal communication process. Then we present an
implementation of time reversal hardware based on reversible circuits.
","[{""version"":""v1"",""created"":""Mon, 11 Jun 2018 20:21:03 GMT""}]","2018-06-13"
"1806.04224","Martin Rajchl PhD","Martin Rajchl and Nick Pawlowski and Daniel Rueckert and Paul M.
  Matthews and Ben Glocker","NeuroNet: Fast and Robust Reproduction of Multiple Brain Image
  Segmentation Pipelines","International conference on Medical Imaging with Deep Learning (MIDL)
  2018",,,,"cs.CV cs.LG","http://arxiv.org/licenses/nonexclusive-distrib/1.0/","  NeuroNet is a deep convolutional neural network mimicking multiple popular
and state-of-the-art brain segmentation tools including FSL, SPM, and MALPEM.
The network is trained on 5,000 T1-weighted brain MRI scans from the UK Biobank
Imaging Study that have been automatically segmented into brain tissue and
cortical and sub-cortical structures using the standard neuroimaging pipelines.
Training a single model from these complementary and partially overlapping
label maps yields a new powerful ""all-in-one"", multi-output segmentation tool.
The processing time for a single subject is reduced by an order of magnitude
compared to running each individual software package. We demonstrate very good
reproducibility of the original outputs while increasing robustness to
variations in the input data. We believe NeuroNet could be an important tool in
large-scale population imaging studies and serve as a new standard in
neuroscience by reducing the risk of introducing bias when choosing a specific
software package.
","[{""version"":""v1"",""created"":""Mon, 11 Jun 2018 20:21:23 GMT""}]","2018-06-13"
"1806.04225","Anirudha Majumdar","Anirudha Majumdar, Alec Farid, Anoopkumar Sonar","PAC-Bayes Control: Learning Policies that Provably Generalize to Novel
  Environments","Extended version of paper presented at the 2018 Conference on Robot
  Learning (CoRL)",,,,"cs.RO cs.AI cs.LG cs.SY math.OC","http://arxiv.org/licenses/nonexclusive-distrib/1.0/","  Our goal is to learn control policies for robots that provably generalize
well to novel environments given a dataset of example environments. The key
technical idea behind our approach is to leverage tools from generalization
theory in machine learning by exploiting a precise analogy (which we present in
the form of a reduction) between generalization of control policies to novel
environments and generalization of hypotheses in the supervised learning
setting. In particular, we utilize the Probably Approximately Correct
(PAC)-Bayes framework, which allows us to obtain upper bounds that hold with
high probability on the expected cost of (stochastic) control policies across
novel environments. We propose policy learning algorithms that explicitly seek
to minimize this upper bound. The corresponding optimization problem can be
solved using convex optimization (Relative Entropy Programming in particular)
in the setting where we are optimizing over a finite policy space. In the more
general setting of continuously parameterized policies (e.g., neural network
policies), we minimize this upper bound using stochastic gradient descent. We
present simulated results of our approach applied to learning (1) reactive
obstacle avoidance policies and (2) neural network-based grasping policies. We
also present hardware results for the Parrot Swing drone navigating through
different obstacle environments. Our examples demonstrate the potential of our
approach to provide strong generalization guarantees for robotic systems with
continuous state and action spaces, complicated (e.g., nonlinear) dynamics,
rich sensory inputs (e.g., depth images), and neural network-based policies.
","[{""version"":""v1"",""created"":""Mon, 11 Jun 2018 20:23:25 GMT""},{""version"":""v2"",""created"":""Thu, 14 Jun 2018 22:42:12 GMT""},{""version"":""v3"",""created"":""Wed, 17 Jul 2019 21:43:11 GMT""},{""version"":""v4"",""created"":""Sat, 22 Feb 2020 22:22:25 GMT""},{""version"":""v5"",""created"":""Tue, 25 Aug 2020 21:54:26 GMT""}]","2020-08-27"
"1806.04226","Michael Anderson","Michael R. Anderson, Michael Cafarella, German Ros, Thomas F. Wenisch","Physical Representation-based Predicate Optimization for a Visual
  Analytics Database","Camera-ready version of the paper submitted to ICDE 2019, In
  Proceedings of the 35th IEEE International Conference on Data Engineering
  (ICDE 2019)","Proceedings of the 35th IEEE International Conference on Data
  Engineering (ICDE 2019), 1466-1477","10.1109/ICDE.2019.00132",,"cs.DB cs.CV","http://arxiv.org/licenses/nonexclusive-distrib/1.0/","  Querying the content of images, video, and other non-textual data sources
requires expensive content extraction methods. Modern extraction techniques are
based on deep convolutional neural networks (CNNs) and can classify objects
within images with astounding accuracy. Unfortunately, these methods are slow:
processing a single image can take about 10 milliseconds on modern GPU-based
hardware. As massive video libraries become ubiquitous, running a content-based
query over millions of video frames is prohibitive.
  One promising approach to reduce the runtime cost of queries of visual
content is to use a hierarchical model, such as a cascade, where simple cases
are handled by an inexpensive classifier. Prior work has sought to design
cascades that optimize the computational cost of inference by, for example,
using smaller CNNs. However, we observe that there are critical factors besides
the inference time that dramatically impact the overall query time. Notably, by
treating the physical representation of the input image as part of our query
optimization---that is, by including image transforms, such as resolution
scaling or color-depth reduction, within the cascade---we can optimize data
handling costs and enable drastically more efficient classifier cascades.
  In this paper, we propose Tahoma, which generates and evaluates many
potential classifier cascades that jointly optimize the CNN architecture and
input data representation. Our experiments on a subset of ImageNet show that
Tahoma's input transformations speed up cascades by up to 35 times. We also
find up to a 98x speedup over the ResNet50 classifier with no loss in accuracy,
and a 280x speedup if some accuracy is sacrificed.
","[{""version"":""v1"",""created"":""Mon, 11 Jun 2018 20:28:12 GMT""},{""version"":""v2"",""created"":""Mon, 10 Sep 2018 21:36:12 GMT""},{""version"":""v3"",""created"":""Wed, 27 Feb 2019 18:08:09 GMT""}]","2019-04-23"
"1806.04227","Qingxiang Xu","Wei Luo, Chuanning Song and Qingxiang Xu","The parallel sum for adjointable operators on Hilbert $C^*$-modules","20 pages. Accepted for publication in ACTA Mathematica Sinica
  (Chinese Series). Proposition 4.6 is improved",,,,"math.OA math.FA","http://arxiv.org/licenses/nonexclusive-distrib/1.0/","  The parallel sum for adjoinable operators on Hilbert $C^*$-modules is
introduced and studied. Some results known for matrices and bounded linear
operators on Hilbert spaces are generalized to the case of adjointable
operators on Hilbert $C^*$-modules. It is shown that there exist a Hilbert
$C^*$-module $H$ and two positive operators $A, B\in\mathcal{L}(H)$ such that
the operator equation $A^{1/2}=(A+B)^{1/2}X, X\in \cal{L}(H)$ has no solution,
where $\mathcal{L}(H)$ denotes the set of all adjointable operators on $H$.
","[{""version"":""v1"",""created"":""Mon, 11 Jun 2018 20:28:21 GMT""},{""version"":""v2"",""created"":""Mon, 2 Jul 2018 01:58:06 GMT""},{""version"":""v3"",""created"":""Thu, 12 Jul 2018 23:13:21 GMT""}]","2018-07-16"
"1806.04228","Mina Mahmoudi","Mina Mahmoudi, Mark Pingle","A Growth Model with Unemployment","Northeast Business & Economics Association, 2016 Conference
  Proceedings, P. 158-162",,,,"econ.EM","http://arxiv.org/licenses/nonexclusive-distrib/1.0/","  A standard growth model is modified in a straightforward way to incorporate
what Keynes (1936) suggests in the ""essence"" of his general theory. The
theoretical essence is the idea that exogenous changes in investment cause
changes in employment and unemployment. We implement this idea by assuming the
path for capital growth rate is exogenous in the growth model. The result is a
growth model that can explain both long term trends and fluctuations around the
trend. The modified growth model was tested using the U.S. economic data from
1947 to 2014. The hypothesized inverse relationship between the capital growth
and changes in unemployment was confirmed, and the structurally estimated model
fits fluctuations in unemployment reasonably well.
","[{""version"":""v1"",""created"":""Mon, 11 Jun 2018 20:29:04 GMT""}]","2018-06-13"
"1806.04229","Aming Li","Aming Li, Long Wang, Frank Schweitzer","The optimal trajectory to control complex networks","15 pages, 4 figures",,,,"math.OC nlin.AO","http://arxiv.org/licenses/nonexclusive-distrib/1.0/","  Controllability, a basic property of various networked systems, has gained
profound theoretical applications in complex social, technological, biological,
and brain networks. Yet, little attention has been given to the control
trajectory (route), along which a controllable system can be controlled from
any initial to any final state, hampering the implementation of practical
control. Here we systematically uncover the fundamental relations between
control trajectory and several other key factors, such as the control distance
between initial and final states ($\delta$), number of driver nodes, and the
control time. The length ($\mathcal{L}$) and maximum distance to the initial
state ($\mathcal{R}$) are employed to quantify the locality and globality of
control trajectories. We analyze how the scaling behavior of the averaged
$\mathcal{L}$ and $\mathcal{R}$ changes with increasing $\delta$ for different
initial states. After showing the scaling behavior for each trajectory, we also
provide the distributions of $\mathcal{L}$ and $\mathcal{R}$. Further attention
is given to the control time $t_{f}$ and its influence on $\mathcal{L}$ and
$\mathcal{R}$. Our results provide comprehensive insights in understanding
control trajectories for complex networks, and pave the way to achieve
practical control in various real systems.
","[{""version"":""v1"",""created"":""Mon, 11 Jun 2018 20:35:39 GMT""}]","2018-06-13"
