"1806.04336","Seho Yi","Sang-Min Jeong, Seho Yi, Hyun-Jung Kim, Gustav Bihlmayer, and
  Jun-Hyung Cho","Competing edge structures of Sb and Bi bilayers by trivial and
  nontrivial band topologies","7 pages, 8 figures","Phys. Rev. B 98, 075402 (2018)","10.1103/PhysRevB.98.075402",,"cond-mat.mtrl-sci","http://arxiv.org/licenses/nonexclusive-distrib/1.0/","  One-dimensional (1D) edge states formed at the boundaries of 2D normal and
topological insulators have shown intriguing quantum phases such as charge
density wave and quantum spin Hall effect. Based on first-principles
density-functional theory calculations including spin-orbit coupling (SOC), we
show that the edge states of zigzag Sb(111) and Bi(111) nanoribbons drastically
change the stability of their edge structures. For zigzag Sb(111) nanoribbon,
the Peierls-distorted or reconstructed edge structure is stabilized by a
band-gap opening. However, for zigzag Bi(111) nanoribbon, such two insulating
structures are destabilized due to the presence of topologically protected
gapless edge states, resulting in the stabilization of a metallic,
shear-distorted edge structure. We also show that the edge states of the
Bi(111) nanoribbon exhibit a larger Rashba-type spin splitting at the boundary
of Brillouin zone, compared to those of the Sb(111) nanoribbon. Interestingly,
the spin textures of edge states in the Peierls-distorted Sb edge structure and
the shear-distorted Bi edge structure have all three spin components
perpendicular and parallel to the edges, due to their broken mirror-plane
symmetry. The present findings demonstrate that the topologically trivial and
nontrivial edge states play crucial roles in determining the edge structures of
normal and topological insulators.
","[{""version"":""v1"",""created"":""Tue, 12 Jun 2018 05:32:55 GMT""}]","2018-08-08"
"1806.04337","Igor Protasov","Igor Protasov","A note on bornologies","Bornology, uniformity, vector topology, Stone-$\check{C}$ech
  compactification, antitall ideal",,,,"math.GN","http://arxiv.org/licenses/nonexclusive-distrib/1.0/","  A bornology on a set $X$ is a family $\mathcal{B}$ of subsets of $X$ closed
under taking subsets, finite unions and such that $\cup \mathcal{B}=X$. We
prove that, for a bornology $\mathcal{B}$ on $X$, the following statements are
equivalent:
  (1) there exists a vector topology $\tau$ on the vector space $\mathbb{V} (X)
$ over $\mathbb{R}$ such that $\mathcal{B}$ is the family of all subsets of $X$
bounded in $\tau$;
  (2) there exists a uniformity $\mathcal{U}$ on $X$ such that $\mathcal{B}$ is
the family of all subsets of $X$ totally bounded in $\mathcal{U}$;
  (3) for every $Y \subseteq X$, $Y \notin \mathcal{B}$, there exists a metric
$d$ on $X$ such that $\mathcal{B}\subseteq \mathcal{B}_d$, $Y\notin
\mathcal{B}_d$, where $\mathcal{B}_d$ is the family of all closed discrete
subsets of $(X, d)$;
  (4) for every $Y \subseteq X$, $Y \notin \mathcal{B}$, there exists
$Z\subseteq Y$ such that $Z^{\prime} \notin \mathcal{B}$ for each infinite
subset $Z^{\prime}$ of $Z$.
  A bornology $\mathcal{B}$ satisfying $(4)$ is called antitall. We give
topological and functional characterizations of antitall bornologies.
","[{""version"":""v1"",""created"":""Tue, 12 Jun 2018 05:36:25 GMT""},{""version"":""v2"",""created"":""Sat, 23 Jun 2018 17:34:25 GMT""}]","2018-06-26"
"1806.04338","Vipul Joshi","V. Joshi, J. Karmakar, N. Kumar, B. Karmakar, S. Tripathi, S. Ghosh,
  R. K. Bhandari, and D. Kanjilal (Inter University Accelerator Centre (IUAC)),
  Aruna Asaf Ali Marg (U. Lehnert Helmholtz Zentrum Rossendorf Dresden (HZDR)),
  A. Aryshev, J. Urakawa (High Energy Accelerator Research Organization)","Theoretical and Simulation Study of 'Comb' Electron beam and THz
  generation",,,"10.1016/j.nima.2018.10.072",,"physics.acc-ph","http://arxiv.org/licenses/nonexclusive-distrib/1.0/","  A compact accelerator based super-radiant THz source is under development at
Inter University Accelerator Centre (IUAC), New Delhi. The facility is based on
the principle of pre-bunched Free Electron Laser (FEL) which will produce THz
radiation in the range of ~0.18 to 3 THz from a modulated electron beam. A
photocathode electron gun will generate a short train of microbunches (a ""comb""
beam) driven by a fiber laser system capable of producing multi micro-pulse
laser beam with variable separation ( ""comb"" laser pulse). Upon acceleration,
the electron beam will be injected in to a compact undulator magnet tuned to
the same frequency as the separation of the electron micro-bunches. The paper
discusses the process of enhancement of super-radiant emission of radiation due
to modulation in the comb beam and the conditions required to achieve maximum
enhancement of the radiation power. The feasibility study of generating a comb
beam at the photocathode and its transport through the beamline while
preserving its temporal structure has been reported. To evaluate the
characteristics of the radiation emitted from the comb beam, a C++ based
particle tracker and Lienard-Wiechert field solver has been developed. The
conceptual understanding of the emission of radiation from comb beam is shown
to conform with the numerical results. The code has been used to calculate the
radiation pulse energy emitted into the central cone of undulator for various
comb beam configurations.
","[{""version"":""v1"",""created"":""Tue, 12 Jun 2018 05:45:42 GMT""}]","2018-11-14"
"1806.04339","Tengyu Xu","Tengyu Xu, Yi Zhou, Kaiyi Ji, Yingbin Liang","When Will Gradient Methods Converge to Max-margin Classifier under ReLU
  Models?",,,,,"cs.LG stat.ML","http://arxiv.org/licenses/nonexclusive-distrib/1.0/","  We study the implicit bias of gradient descent methods in solving a binary
classification problem over a linearly separable dataset. The classifier is
described by a nonlinear ReLU model and the objective function adopts the
exponential loss function. We first characterize the landscape of the loss
function and show that there can exist spurious asymptotic local minima besides
asymptotic global minima. We then show that gradient descent (GD) can converge
to either a global or a local max-margin direction, or may diverge from the
desired max-margin direction in a general context. For stochastic gradient
descent (SGD), we show that it converges in expectation to either the global or
the local max-margin direction if SGD converges. We further explore the
implicit bias of these algorithms in learning a multi-neuron network under
certain stationary conditions, and show that the learned classifier maximizes
the margins of each sample pattern partition under the ReLU activation.
","[{""version"":""v1"",""created"":""Tue, 12 Jun 2018 05:46:09 GMT""},{""version"":""v2"",""created"":""Mon, 15 Oct 2018 21:34:16 GMT""}]","2018-10-17"
"1806.04340","Lei Zhang","Dihua Jiang and Lei Zhang","On the Non-vanishing of the Central Value of Certain L-functions:
  Unitary Groups","25 pages",,,,"math.NT math.RT","http://arxiv.org/licenses/nonexclusive-distrib/1.0/","  Let $\pi$ be an irreducible cuspidal automorphic representation of a
quasi-split unitary group ${\rm U}_{\mathfrak n}$ defined over a number field
$F$. Under the assumption that $\pi$ has a generic global Arthur parameter, we
establish the non-vanishing of the central value of $L$-functions,
$L(\frac{1}{2},\pi\times\chi)$, with a certain automorphic character $\chi$ of
${\rm U}_1$, for the case of ${\mathfrak n}=2,3,4$, and for the general
${\mathfrak n}\geq 5$ by assuming a conjecture on certain refined properties of
global Arthur packets. In consequence, we obtain some simultaneous
non-vanishing results for the central $L$-values by means of the theory of
endoscopy.
","[{""version"":""v1"",""created"":""Tue, 12 Jun 2018 05:52:10 GMT""}]","2018-06-13"
"1806.04341","Michael Pan","Michael Pan, Peter J. Gawthrop, Kenneth Tran, Joseph Cursons and
  Edmund J. Crampin","A thermodynamic framework for modelling membrane transporters",,"Journal of Theoretical Biology, Available online 28 September 2018","10.1016/j.jtbi.2018.09.034",,"q-bio.BM","http://arxiv.org/licenses/nonexclusive-distrib/1.0/","  Membrane transporters contribute to the regulation of the internal
environment of cells by translocating substrates across cell membranes. Like
all physical systems, the behaviour of membrane transporters is constrained by
the laws of thermodynamics. However, many mathematical models of transporters,
especially those incorporated into whole-cell models, are not thermodynamically
consistent, leading to unrealistic behaviour. In this paper we use a
physics-based modelling framework, in which the transfer of energy is
explicitly accounted for, to develop thermodynamically consistent models of
transporters. We then apply this methodology to model two specific
transporters: the cardiac sarcoplasmic/endoplasmic Ca$^{2+}$ ATPase (SERCA) and
the cardiac Na$^+$/K$^+$ ATPase.
","[{""version"":""v1"",""created"":""Tue, 12 Jun 2018 05:53:53 GMT""}]","2019-07-04"
"1806.04342","Nan Rosemary Ke","Nan Rosemary Ke, Konrad Zolna, Alessandro Sordoni, Zhouhan Lin, Adam
  Trischler, Yoshua Bengio, Joelle Pineau, Laurent Charlin, Chris Pal","Focused Hierarchical RNNs for Conditional Sequence Processing","To appear at ICML 2018",,,,"stat.ML cs.LG","http://arxiv.org/licenses/nonexclusive-distrib/1.0/","  Recurrent Neural Networks (RNNs) with attention mechanisms have obtained
state-of-the-art results for many sequence processing tasks. Most of these
models use a simple form of encoder with attention that looks over the entire
sequence and assigns a weight to each token independently. We present a
mechanism for focusing RNN encoders for sequence modelling tasks which allows
them to attend to key parts of the input as needed. We formulate this using a
multi-layer conditional sequence encoder that reads in one token at a time and
makes a discrete decision on whether the token is relevant to the context or
question being asked. The discrete gating mechanism takes in the context
embedding and the current hidden state as inputs and controls information flow
into the layer above. We train it using policy gradient methods. We evaluate
this method on several types of tasks with different attributes. First, we
evaluate the method on synthetic tasks which allow us to evaluate the model for
its generalization ability and probe the behavior of the gates in more
controlled settings. We then evaluate this approach on large scale Question
Answering tasks including the challenging MS MARCO and SearchQA tasks. Our
models shows consistent improvements for both tasks over prior work and our
baselines. It has also shown to generalize significantly better on synthetic
tasks as compared to the baselines.
","[{""version"":""v1"",""created"":""Tue, 12 Jun 2018 05:54:37 GMT""}]","2018-06-13"
"1806.04343","L\'eo Miolane","L\'eo Miolane","Phase transitions in spiked matrix estimation: information-theoretic
  analysis","These notes present in a unified manner recent results (as well as
  new developments) on the information-theoretic limits in spiked matrix
  estimation",,,,"math.PR cs.IT math.IT math.ST stat.TH","http://arxiv.org/licenses/nonexclusive-distrib/1.0/","  We study here the so-called spiked Wigner and Wishart models, where one
observes a low-rank matrix perturbed by some Gaussian noise. These models
encompass many classical statistical tasks such as sparse PCA, submatrix
localization, community detection or Gaussian mixture clustering. The goal of
these notes is to present in a unified manner recent results (as well as new
developments) on the information-theoretic limits of these spiked matrix
models. We compute the minimal mean squared error for the estimation of the
low-rank signal and compare it to the performance of spectral estimators and
message passing algorithms. Phase transition phenomena are observed: depending
on the noise level it is either impossible, easy (i.e. using polynomial-time
estimators) or hard (information-theoretically possible, but no efficient
algorithm is known to succeed) to recover the signal.
","[{""version"":""v1"",""created"":""Tue, 12 Jun 2018 05:56:46 GMT""},{""version"":""v2"",""created"":""Mon, 24 Sep 2018 14:53:58 GMT""},{""version"":""v3"",""created"":""Mon, 24 Jun 2019 09:44:37 GMT""}]","2019-06-25"
"1806.04344","Johannes Otterbach","Johannes S. Otterbach","Optimizing Variational Quantum Circuits using Evolution Strategies","This version withdrawn by arXiv administrators because the submitter
  did not have the right to agree to our license at the time of submission",,,,"quant-ph cs.NE stat.ML","http://arxiv.org/licenses/nonexclusive-distrib/1.0/","  This version withdrawn by arXiv administrators because the submitter did not
have the right to agree to our license at the time of submission.
","[{""version"":""v1"",""created"":""Tue, 12 Jun 2018 05:57:14 GMT""}]","2018-06-13"
"1806.04345","Yanki Lekili","Yanki Lekili, Kazushi Ueda","Homological mirror symmetry for Milnor fibers via moduli of
  $A_\infty$-structures","49 pages. Accepted for publication by the Journal of Topology",,,,"math.AG math.RT math.SG","http://creativecommons.org/licenses/by-sa/4.0/","  We show that the base spaces of the semiuniversal unfoldings of some weighted
homogeneous singularities can be identified with moduli spaces of
$A_\infty$-structures on the trivial extension algebras of the endomorphism
algebras of the tilting objects. The same algebras also appear in the Fukaya
categories of their mirrors. Based on these identifications, we discuss
applications to homological mirror symmetry for Milnor fibers, and give a proof
of homological mirror symmetry for an $n$-dimensional affine hypersurface of
degree $n + 2$ and the double cover of the $n$-dimensional affine space
branched along a degree $2n + 2$ hypersurface. Along the way, we also give a
proof of a conjecture of Seidel from math/0206155 which may be of independent
interest.
","[{""version"":""v1"",""created"":""Tue, 12 Jun 2018 06:03:08 GMT""},{""version"":""v2"",""created"":""Mon, 24 Feb 2020 06:31:51 GMT""},{""version"":""v3"",""created"":""Sat, 22 Aug 2020 21:36:38 GMT""},{""version"":""v4"",""created"":""Sun, 7 Nov 2021 10:06:10 GMT""},{""version"":""v5"",""created"":""Fri, 18 Mar 2022 05:58:14 GMT""}]","2022-03-21"
"1806.04346","Ruidan He","Ruidan He and Wee Sun Lee and Hwee Tou Ng and Daniel Dahlmeier","Exploiting Document Knowledge for Aspect-level Sentiment Classification","Accepted to ACL 2018 (short paper)",,,,"cs.CL","http://arxiv.org/licenses/nonexclusive-distrib/1.0/","  Attention-based long short-term memory (LSTM) networks have proven to be
useful in aspect-level sentiment classification. However, due to the
difficulties in annotating aspect-level data, existing public datasets for this
task are all relatively small, which largely limits the effectiveness of those
neural models. In this paper, we explore two approaches that transfer knowledge
from document- level data, which is much less expensive to obtain, to improve
the performance of aspect-level sentiment classification. We demonstrate the
effectiveness of our approaches on 4 public datasets from SemEval 2014, 2015,
and 2016, and we show that attention-based LSTM benefits from document-level
knowledge in multiple ways.
","[{""version"":""v1"",""created"":""Tue, 12 Jun 2018 06:04:11 GMT""}]","2018-06-13"
"1806.04347","Yingli Wang","Yingli Wang and Xiaoguang Yang","Asymmetric response to PMI announcements in China's stock returns",,,,,"q-fin.ST econ.EM","http://arxiv.org/licenses/nonexclusive-distrib/1.0/","  Considered an important macroeconomic indicator, the Purchasing Managers'
Index (PMI) on Manufacturing generally assumes that PMI announcements will
produce an impact on stock markets. International experience suggests that
stock markets react to negative PMI news. In this research, we empirically
investigate the stock market reaction towards PMI in China. The asymmetric
effects of PMI announcements on the stock market are observed: no market
reaction is generated towards negative PMI announcements, while a positive
reaction is generally generated for positive PMI news. We further find that the
positive reaction towards the positive PMI news occurs 1 day before the
announcement and lasts for nearly 3 days, and the positive reaction is observed
in the context of expanding economic conditions. By contrast, the negative
reaction towards negative PMI news is prevalent during downward economic
conditions for stocks with low market value, low institutional shareholding
ratios or high price earnings. Our study implies that China's stock market
favors risk to a certain extent given the vast number of individual investors
in the country, and there may exist information leakage in the market.
","[{""version"":""v1"",""created"":""Tue, 12 Jun 2018 06:15:35 GMT""}]","2018-06-13"
"1806.04348","Dun Qiu","Dun Qiu, Jeffrey Remmel","Schur Function Expansions and the Rational Shuffle Theorem","35 pages, 18 figures",,,,"math.CO","http://arxiv.org/licenses/nonexclusive-distrib/1.0/","  Gorsky and Negut introduced operators $Q_{m,n}$ on symmetric functions and
conjectured that, in the case where $m$ and $n$ are relatively prime, the
expression ${Q}_{m,n}(1)$ is given by the Hikita polynomial ${H}_{m,n}[X;q,t]$.
Later, Bergeron-Garsia-Leven-Xin extended and refined the conjectures of
${Q}_{m,n}(1)$ for arbitrary $m$ and $n$ which we call the Extended Rational
Shuffle Conjecture. In the special case ${Q}_{n+1,n}(1)$, the Rational Shuffle
Conjecture becomes the Shuffle Conjecture of
Haglund-Haiman-Loehr-Remmel-Ulyanov, which was proved in 2015 by Carlsson and
Mellit as the Shuffle Theorem. The Extended Rational Shuffle Conjecture was
later proved by Mellit as the Extended Rational Shuffle Theorem. The main goal
of this paper is to study the combinatorics of the coefficients that arise in
the Schur function expansion of ${Q}_{m,n}(1)$ in certain special cases. Leven
gave a combinatorial proof of the Schur function expansion of ${Q}_{2,2n+1}(1)$
and ${Q}_{2n+1,2}(1)$. In this paper, we explore several symmetries in the
combinatorics of the coefficients that arise in the Schur function expansion of
${Q}_{m,n}(1)$. Especially, we study the hook-shaped Schur function
coefficients, and the Schur function expansion of ${Q}_{m,n}(1)$ in the case
where $m$ or $n$ equals $3$.
","[{""version"":""v1"",""created"":""Tue, 12 Jun 2018 06:20:05 GMT""},{""version"":""v2"",""created"":""Wed, 13 Jun 2018 04:44:22 GMT""},{""version"":""v3"",""created"":""Mon, 13 Apr 2020 02:16:03 GMT""}]","2020-04-14"
"1806.04349","Junfei Li","Junfei Li, Ana D\'iaz-Rubio, Chen Shen, Zhetao Jia, Sergei Tretyakov,
  and Steven Cummer","Perfect Generation of Angular Momentum with Cylindrical Bianisotropic
  Metasurfaces","7 pages, 4 figures","Phys. Rev. Applied 11, 024016 (2019)","10.1103/PhysRevApplied.11.024016",,"physics.app-ph","http://arxiv.org/licenses/nonexclusive-distrib/1.0/","  Recent advances in metasurfaces have shown the importance of controlling the
bianisotropic response of the constituent meta-atoms for maximum efficiency
wavefront transformation. Under the paradigm of a bianisotropic metasurface,
full control of the local scattering properties is allowed opening new design
avenues for creating reciprocal metasurfaces. Despite recent advances in the
perfect transformation of both electromagnetic and acoustic plane waves, the
importance of bianisotropic metasurfaces for transforming cylindrical waves is
still unexplored. Motivated by the possibility of arbitrarily controlling the
angular momentum of cylindrical waves, we develop a design methodology for a
bianisotropic cylindrical metasurface that enables perfect transformation of
cylindrical waves. This formalism is applied to the acoustic scenario and the
first experimental demonstration of perfect angular momentum transformation is
shown.
","[{""version"":""v1"",""created"":""Tue, 12 Jun 2018 06:20:28 GMT""}]","2019-02-13"
"1806.04350","Taylor Haar","Taylor Haar, Waseem Kamleh, James Zanotti, Yoshifumi Nakamura","Single flavour optimisations to Hybrid Monte Carlo","14 pages, 17 figures, 20 tables; to be submitted to Computer Physics
  Communications",,"10.1016/j.cpc.2018.12.009","ADP-18-13/T1061","hep-lat","http://arxiv.org/licenses/nonexclusive-distrib/1.0/","  It has become increasingly important to include one or more individual
flavours of dynamical fermion in lattice QCD simulations. This is due in part
to the advent of QCD+QED calculations, where isospin symmetry breaking means
that the up, down, and strange quarks must be treated separately. These
single-flavour pseudofermions are typically implemented as rational
approximations to the inverse of the fermion matrix, using the technique known
as Rational Hybrid Monte Carlo (RHMC). Over the years, a wide range of methods
have been developed for accelerating simulations of two degenerate flavours of
pseudofermion, while there are comparatively fewer such techniques for
single-flavour pseudofermions. Here, we investigate two different filtering
methods that can be applied to RHMC for simulating single-flavour
pseudofermions, namely polynomial filtering (PF-RHMC), and filtering via
truncations of the ordered product (tRHMC). A novel integration step-size
tuning technique based on the characteristic scale is also introduced. Studies
are performed on two different lattice volumes, demonstrating that one can
achieve significant reductions in the computational cost of single-flavour
simulations with these filtering techniques.
","[{""version"":""v1"",""created"":""Tue, 12 Jun 2018 06:20:41 GMT""}]","2019-03-27"
"1806.04351","Yingli Wang","Yingli Wang, Qingpeng Zhang, and Xiaoguang Yang","Network Subgraphs of the heterogeneous Chinese credit system",,,,,"cs.CE q-fin.GN","http://arxiv.org/licenses/nonexclusive-distrib/1.0/","  In this study, we investigate the evolution of Chinese guarantee networks
from the angle of sub-patterns. First, we find that the mutual, 2-out-stars and
triangle sub-patterns are motifs in 2- and 3-node subgraphs. Considering the
heterogeneous financial characteristics of nodes, we find that small firms tend
to form a mutual guarantee relationship and large firms are likely to be the
guarantors in 2-out-stars sub-patterns.
","[{""version"":""v1"",""created"":""Tue, 12 Jun 2018 06:22:44 GMT""},{""version"":""v2"",""created"":""Sat, 14 Dec 2019 01:25:05 GMT""}]","2019-12-17"
"1806.04352","Yuya Kusuki","Yuya Kusuki","Large $c$ Virasoro Blocks from Monodromy Method beyond Known Limits","20 pages, 2 figures",,"10.1007/JHEP08(2018)161","YITP-1863","hep-th","http://arxiv.org/licenses/nonexclusive-distrib/1.0/","  In this paper, we study large $c$ Virasoro blocks by using the Zamolodchikov
monodromy method beyond its known limits. We give an analytic proof of our
recent conjectur, which implied that the asymptotics of the large $c$ conformal
blocks can be expressed in very simple forms, even if outside its known limits,
namely the semiclassical limit or the heavy-light limit. In particular, we
analytically discuss the fact that the asymptotic behavior of large $c$
conformal blocks drastically changes when the dimensions of external primary
states reach the value $\frac{c}{32}$, which is conjectured by our numerical
studies. The results presented in this work imply that the general solutions to
the Zamolodchikov recursion relation are given by Cardy-like formula, which is
an important conclusion that can be numerically drawn from our recent works.
Mathematical derivations and analytical results imply that, in the bulk, the
collision behavior between two heavy particles may undergo a remarkable
transition associated with their masses.
","[{""version"":""v1"",""created"":""Tue, 12 Jun 2018 06:25:22 GMT""},{""version"":""v2"",""created"":""Tue, 26 Jun 2018 05:44:33 GMT""},{""version"":""v3"",""created"":""Sun, 5 May 2019 02:16:16 GMT""}]","2019-05-07"
"1806.04353","Eunbin Kim","Eunbin Kim, Sungsoo S. Kim, Yun-Young Choi, Gwang-Ho Lee, Richard de
  Grijs, Myung Gyoon Lee and Ho Seong Hwang","Nuclear starburst activity induced by elongated bulges in spiral
  galaxies","9 pages, 7 figures, accepted for publication in MNRAS",,"10.1093/mnras/sty1451",,"astro-ph.GA","http://arxiv.org/licenses/nonexclusive-distrib/1.0/","  We study the effects of bulge elongation on the star formation activity in
the centers of spiral galaxies using the data from the Sloan Digital Sky Survey
Data Release 7. We construct a volume-limited sample of face-on spiral galaxies
with $M_r < -$19.5 mag at 0.02 $\leq z <$ 0.055 by excluding barred galaxies,
where the aperture of the SDSS spectroscopic fibre covers the bulges of the
galaxies. We adopt the ellipticity of bulges measured by Simard et al. (2011)
who performed two-dimensional bulge+disc decompositions using the SDSS images
of galaxies, and identify nuclear starbursts using the fibre specific star
formation rates derived from the SDSS spectra. We find a statistically
significant correlation between bulge elongation and nuclear starbursts in the
sense that the fraction of nuclear starbursts increases with bulge elongation.
This correlation is more prominent for fainter and redder galaxies, which
exhibit higher ratios of elongated bulges. We find no significant environmental
dependence of the correlation between bulge elongation and nuclear starbursts.
These results suggest that non-axisymmetric bulges can efficiently feed the gas
into the centre of galaxies to trigger nuclear starburst activity.
","[{""version"":""v1"",""created"":""Tue, 12 Jun 2018 06:29:16 GMT""}]","2018-06-20"
