"1801.00641","Xiao-Pu Han","Pan Liu, Xiao-Pu Han, Linyuan L\""u","Triangle-mapping Analysis on Spatial Competition and Cooperation of
  Chinese Cities","The 43rd Annual Conference of the IEEE Industrial Electronics Society",,,,"physics.soc-ph cs.CY stat.AP","http://arxiv.org/licenses/nonexclusive-distrib/1.0/","  In this paper, we empirically analyze the spatial distribution of Chinese
cities using a method based on triangle transition. This method uses a regular
triangle mapping from the observed cities and its three neighboring cities to
analyze their distribution of mapping positions. We find that obvious
center-gathering tendency for the relationship between cities and its nearest
three cities, indicating the spatial competition between cities. Moreover, we
observed the competitive trends between neighboring cities with similar
economic volume, and the remarkable cooperative tendency between neighboring
cities with large difference on economy. The threshold of the ratio of the two
cities' economic volume on the transition from competition to cooperation is
about 1.2. These findings are helpful in the understanding of the cities
economic relationship, especially in the study of competition and cooperation
between cities.
","[{""version"":""v1"",""created"":""Tue, 2 Jan 2018 13:38:00 GMT""}]","2018-01-03"
"1801.00642","Abdulla Rakhimov","Abdulla Rakhimov, Zabardast Narzikulov and Andreas Schilling","Gr{\""u}neisen parameter of quantum magnets with spin gap","Extended by comparision of HFB and HFP approximations","Phys. Rev. B 98, 144416 (2018)","10.1103/PhysRevB.98.144416",,"cond-mat.quant-gas","http://arxiv.org/licenses/nonexclusive-distrib/1.0/","  Using Hartree-Fock-Bogoliubov (HFB) approach we obtained analytical
expressions for thermodynamic quantities of the system of triplons in spin
gapped quantum magnets such as magnetization, heat capacity and the magnetic
Gr{\""u}neisen parameter $\Gamma_H$. Near the critical temperature, $\Gamma_H$
is discontinuous and changes its sign upon the Bose-Einstein condensation (BEC)
of triplons. On the other hand, in the widely used Hartree-Fock-Popov (HFP)
approach there is no discontinuity neither in the heat capacity nor in the
Gr{\""u}neisen parameter. We predict that in the low-temperature limit and near
the critical magnetic field $H_c$, $\Gamma_H$ diverges as $\Gamma_H\sim
1/T^{2}$, while it scales as $\Gamma_H\sim 1/(H-H_c)$ as the magnetic field
approaches the quantum critical point at $H_c$.
","[{""version"":""v1"",""created"":""Tue, 2 Jan 2018 13:39:43 GMT""},{""version"":""v2"",""created"":""Thu, 11 Jan 2018 13:20:44 GMT""},{""version"":""v3"",""created"":""Tue, 17 Jul 2018 08:35:44 GMT""}]","2018-11-14"
"1801.00643","J. A. Fernandez-Roldan","Jose A. Fernandez-Roldan, Rafael P. del Real, Cristina Bran, Manuel
  Vazquez and Oksana Chubykalo-Fesenko","Magnetization pinning in modulated nanowires: from topological
  protection to the ""corkscrew"" mechanism",,,"10.1039/C8NR00024G",,"cond-mat.mes-hall cond-mat.mtrl-sci","http://arxiv.org/licenses/nonexclusive-distrib/1.0/","  Diameter-modulated nanowires offer an important paradigm to design the
magnetization response of 3D magnetic nanostructures by engineering the domain
wall pinning. With the aim to understand its nature and to control the process,
we analyze the magnetization response in FeCo modulated polycrystalline
two-segment nanowires varying the minor diameter. Our modelling indicates a
very complex behavior with a strong dependence on the disorder distribution and
an important role of topologically non-trivial magnetization structures. We
demonstrate that modulated nanowires with a small diameter difference are
characterized by an increased coercive field in comparison to the straight ones
which is explained by a formation of topologically protected walls formed by
two 3D skyrmions with opposite chiralities. For a large diameter difference we
report the occurrence of a novel pinning type called here the ""corkscrew"": the
magnetization of the large diameter segment forms a skyrmion tube with a core
position in a helical modulation along the nanowire. This structure is pinned
at the constriction and in order to penetrate the narrow segments the
vortex/skyrmion core size should be reduced.
","[{""version"":""v1"",""created"":""Tue, 2 Jan 2018 13:42:44 GMT""}]","2022-06-16"
"1801.00644","Reagan Mozer","Reagan Mozer, Luke Miratrix, Aaron Russell Kaufman, L. Jason
  Anastasopoulos","Matching with Text Data: An Experimental Evaluation of Methods for
  Matching Documents and of Measuring Match Quality",,,,,"stat.ME cs.CL","http://arxiv.org/licenses/nonexclusive-distrib/1.0/","  Matching for causal inference is a well-studied problem, but standard methods
fail when the units to match are text documents: the high-dimensional and rich
nature of the data renders exact matching infeasible, causes propensity scores
to produce incomparable matches, and makes assessing match quality difficult.
In this paper, we characterize a framework for matching text documents that
decomposes existing methods into: (1) the choice of text representation, and
(2) the choice of distance metric. We investigate how different choices within
this framework affect both the quantity and quality of matches identified
through a systematic multifactor evaluation experiment using human subjects.
Altogether we evaluate over 100 unique text matching methods along with 5
comparison methods taken from the literature. Our experimental results identify
methods that generate matches with higher subjective match quality than current
state-of-the-art techniques. We enhance the precision of these results by
developing a predictive model to estimate the match quality of pairs of text
documents as a function of our various distance scores. This model, which we
find successfully mimics human judgment, also allows for approximate and
unsupervised evaluation of new procedures. We then employ the identified best
method to illustrate the utility of text matching in two applications. First,
we engage with a substantive debate in the study of media bias by using text
matching to control for topic selection when comparing news articles from
thirteen news sources. We then show how conditioning on text data leads to more
precise causal inferences in an observational study examining the effects of a
medical intervention.
","[{""version"":""v1"",""created"":""Tue, 2 Jan 2018 13:47:43 GMT""},{""version"":""v2"",""created"":""Fri, 12 Jan 2018 17:14:00 GMT""},{""version"":""v3"",""created"":""Sun, 15 Apr 2018 20:13:44 GMT""},{""version"":""v4"",""created"":""Mon, 11 Jun 2018 19:40:04 GMT""},{""version"":""v5"",""created"":""Fri, 29 Jun 2018 09:17:43 GMT""},{""version"":""v6"",""created"":""Wed, 3 Oct 2018 20:57:57 GMT""},{""version"":""v7"",""created"":""Wed, 13 Mar 2019 19:50:07 GMT""}]","2019-03-15"
"1801.00645","Demian Slobinsky","D. Slobinsky and G. Baglietto and R. A. Borzi","Charge and spin correlations in the Monopole Liquid",,"Phys. Rev. B 97, 174422 (2018)","10.1103/PhysRevB.97.174422",,"cond-mat.stat-mech","http://arxiv.org/licenses/nonexclusive-distrib/1.0/","  A \emph{monopole liquid} is a magnetic charge-disordered spin system defined
over an Ising pyrochlore lattice, with one single topological charge or
\emph{monopole} in each tetrahedron. We define a simple model Hamiltonian for
this system and compare its thermodynamics at zero magnetic field with that of
spin ice ---a phase free of these charges. In spite of the liquid-like
correlations between charges, we find that spins in the charged phase are
uncorrelated at all temperatures, like in a perfect paramagnet. The addition of
nearest neighbors interactions favoring neutral `2in-2out' excitations as a
perturbation has a peculiar effect. While they decrease charge-charge
correlations, new spin correlations resembling those in spin ice appear on
increasing temperature. This helps us understand why dipolar correlations are
observed in spin ices at unexpectedly high temperatures, and the major role of
double excitations in erasing the Coulomb phase correlations. Ferromagnetic
interactions strengthen the charges short range order and its associated spin
correlations. Finally, we discuss how the monopole liquid can be related to
other systems and materials where different phases of \emph{monopole matter}
have been observed.
","[{""version"":""v1"",""created"":""Tue, 2 Jan 2018 13:53:44 GMT""},{""version"":""v2"",""created"":""Mon, 14 May 2018 17:34:21 GMT""}]","2018-05-24"
"1801.00646","Marcelo Ciappina","E. Neyra, F. Videla, M. F. Ciappina, J. A. P\'erez-Hern\'andez, L.
  Roso, M. Lewenstein and G. A. Torchia","High-order harmonic generation driven by inhomogeneous plasmonics fields
  spatially bounded: influence on the cut-off law","16 pages, 7 figures",,"10.1088/2040-8986/aaa6f7",,"physics.atom-ph","http://arxiv.org/licenses/nonexclusive-distrib/1.0/","  We study high-order harmonic generation (HHG) in model atoms driven by
plasmonic-enhanced fields. These fields result from the illumination of
plasmonic nanostructures by few-cycle laser pulses. We demonstrate that the
spatial inhomogeneous character of the laser electric field, in a form of
Gaussian-shaped functions, leads to an unexpected relationship between the HHG
cutoff and the laser wavelength. Precise description of the spatial form of the
plasmonic-enhanced field allows us to predict this relationship. We combine the
numerical solutions of the time-dependent Schr\""odinger equation (TDSE) with
the plasmonic-enhanced electric fields obtained from 3D finite element
simulations. We additionally employ classical simulations to supplement the
TDSE outcomes and characterize the extended HHG spectra by means of their
associated electron trajectories. A proper definition of the spatially
inhomogeneous laser electric field is instrumental to accurately describe the
underlying physics of HHG driven by plasmonic-enhanced fields. This
characterization opens new perspectives for HHG control with various
experimental nano-setups
","[{""version"":""v1"",""created"":""Tue, 2 Jan 2018 13:56:14 GMT""}]","2018-02-14"
"1801.00647","Huanshui Zhang","Qingyuan Qi, Huanshui Zhang and Peijun Ju","Distributed Control and Stabilization for Discrete-time Large Scale
  Systems With Imposed Constraints",,,,,"math.OC","http://arxiv.org/licenses/nonexclusive-distrib/1.0/","  This paper is concerned with the distributed control and stabilization
problems for linear discrete-time large scale systems with imposed constraints.
The main contributions of this paper are: Firstly, by using the maximum
principle (necessary condition) for the finite horizon optimal control
developed in this paper, the optimal distributed controller is thus derived,
which can be easily calculated; Secondly, by defining the Lyapunov function
with the optimal cost function, we show that the systems with imposed
constraints can be stabilized by the optimal distributed controller for the
infinite horizon case. The main techniques adopted in this paper are the
maximum principle and the solution to the forward and backward difference
equations (FBDE), which are the basis in solving distributed control and
stabilization problems for linear systems with constraints.
","[{""version"":""v1"",""created"":""Tue, 2 Jan 2018 13:57:15 GMT""}]","2018-01-03"
"1801.00650","Arun Kumar Pandey","Sampurn Anand, Jitesh R. Bhatt, Arun Kumar Pandey","Chiral plasma instability and primordial Gravitational wave","8 pages, 2 figures","The European Physical Journal C (EPJ C) 2019","10.1140/epjc/s10052-019-6619-5",,"astro-ph.CO gr-qc hep-ph physics.plasm-ph","http://arxiv.org/licenses/nonexclusive-distrib/1.0/","  It is known that cosmic magnetic field, if present, can generate anisotropic
stress in the plasma and hence, can act as a source of gravitational waves.
These cosmic magnetic fields can be generated at very high temperature, much
above electroweak scale, due to the gravitational anomaly in presence of the
chiral asymmetry. The chiral asymmetry leads to instability in the plasma which
ultimately leads to the generation of magnetic fields. In this article, we
discuss the generation of gravitational waves, during the period of
instability, in the chiral plasma sourced by the magnetic field created due to
the gravitational anomaly. We have shown that such gravitational wave will have
a unique spectrum. Moreover, depending on the temperature of the universe at
the time of its generation, such gravitational waves can have a wide range of
frequencies. We also estimate the amplitude and frequency of the gravitational
waves and delineate the possibility of its detection by future experiments like
eLISA.
","[{""version"":""v1"",""created"":""Tue, 2 Jan 2018 14:01:42 GMT""},{""version"":""v2"",""created"":""Thu, 24 Jan 2019 09:50:09 GMT""}]","2019-01-25"
"1801.00651","Euaggelos E. Zotos","Euaggelos E. Zotos and Christof Jung","Orbital and escape dynamics in barred galaxies - III. The 3D system:
  Correlations between the basins of escape and the NHIMs","Published in Monthly Notices of the Royal Astronomical Society
  (MNRAS) journal",,"10.1093/mnras/stx2398","MNRAS, vol. 473, 806-825 (2018)","astro-ph.GA","http://arxiv.org/licenses/nonexclusive-distrib/1.0/","  The escape dynamics of the stars in a barred galaxy composed of a spherically
symmetric central nucleus, a bar, a flat thin disk and a dark matter halo
component is investigated by using a realistic three degrees of freedom (3-dof)
dynamical model. Modern colour-coded diagrams are used for distinguishing
between bounded and escaping motion. In addition, the smaller alignment index
(SALI) method is deployed for determining the regular, sticky or chaotic nature
of bounded orbits. We reveal the basins of escape corresponding to the escape
through the two symmetrical escape channels around the Lagrange points $L_2$
and $L_3$ and also we relate them with the corresponding distribution of the
escape times of the orbits. Furthermore, we demonstrate how the stable
manifolds, around the index-1 saddle points, accurately define the fractal
basin boundaries observed in the colour-coded diagrams. The development
scenario of the fundamental vertical Lyapunov periodic orbit is thoroughly
explored for obtaining a more complete view of the unfolding of the singular
behaviour of the dynamics at the cusp values of the parameters. Finally, we
examine how the combination of the most important parameters of the bar (such
as the semi-major axis and the angular velocity) influences the observed
stellar structures (rings and spirals) which are formed by escaping stars
guided by the invariant manifolds near the saddle points.
","[{""version"":""v1"",""created"":""Tue, 2 Jan 2018 14:02:01 GMT""}]","2018-01-03"
"1801.00652","Henrik Melin","Henrik Melin, L.N. Fletcher, P.T. Donnelly, T. Greathouse, J. Lacy,
  G.S. Orton, R. Giles, J. Sinclair, P.G.J. Irwin","Assessing the long-term variability of acetylene and ethane in the
  stratosphere of Jupiter","39 pages, 9 Figures, 2 tables, in press","Icarus, 2018","10.1016/j.icarus.2017.12.041",,"astro-ph.EP","http://creativecommons.org/licenses/by/4.0/","  Acetylene (C$_2$H$_2$) and ethane (C$_2$H$_6$) are both produced in the
stratosphere of Jupiter via photolysis of methane (CH$_4$). Despite this common
source, the latitudinal distribution of the two species is radically different,
with acetylene decreasing in abundance towards the pole, and ethane increasing
towards the pole. We present six years of NASA IRTF TEXES mid-infrared
observations of the zonally-averaged emission of methane, acetylene and ethane.
We confirm that the latitudinal distributions of ethane and acetylene are
decoupled, and that this is a persistent feature over multiple years. The
acetylene distribution falls off towards the pole, peaking at
$\sim$30$^{\circ}$N with a volume mixing ratio (VMR) of $\sim$0.8 parts per
million (ppm) at 1 mbar and still falling off at $\pm70^\circ$ with a VMR of
$\sim$0.3 ppm. The acetylene distributions are asymmetric on average, but as we
move from 2013 to 2017, the zonally-averaged abundance becomes more symmetric
about the equator. We suggest that both the short term changes in acetylene and
its latitudinal asymmetry is driven by changes to the vertical stratospheric
mixing, potentially related to propagating wave phenomena. Unlike acetylene,
ethane has a symmetric distribution about the equator that increases toward the
pole, with a peak mole fraction of $\sim$18 ppm at about $\pm50^{\circ}$
latitude, with a minimum at the equator of $\sim$10 ppm at 1 mbar. [...] The
equator-to-pole distributions of acetylene and ethane are consistent with
acetylene having a shorter lifetime than ethane that is not sensitive to longer
advective timescales, but is augmented by short-term dynamics, such as vertical
mixing. Conversely, the long lifetime of ethane allows it to be transported to
higher latitudes faster than it can be chemically depleted.
","[{""version"":""v1"",""created"":""Tue, 2 Jan 2018 14:05:01 GMT""}]","2018-01-03"
"1801.00653","Askar Tuganbaev","Victor Markov, Askar Tuganbaev","Rings which are Essential over their Centers, II",,,,,"math.RA","http://arxiv.org/licenses/nonexclusive-distrib/1.0/","  A ring $R$ with center $C$ is said to be\textit{centrally essential} if the
module $R_C$ is an essential extension of the module $C_C$. We describe
centrally essential exterior algebras of finitely generated free modules over
not necessary commutative rings and study properties of semi-Artinian centrally
essential rings. V.T.Markov is supported by the Russian Foundation for Basic
Research, project 17-01-00895-A.~ A.A. Tuganbaev is supported by Russian
Scientific Foundation, project 16-11-10013.
","[{""version"":""v1"",""created"":""Tue, 2 Jan 2018 14:12:57 GMT""}]","2018-01-03"
"1801.00654","Volodymyr Mazorchuk","Chih-Whi Chen and Volodymyr Mazorchuk","Simple supermodules over Lie superalgebras","v2: a few typos from v1 fixed",,,,"math.RT","http://arxiv.org/licenses/nonexclusive-distrib/1.0/","  We show that, for many Lie superalgebras admitting a compatible
$\mathbb{Z}$-grading, Kac induction functor gives rise to a bijection between
simple supermodules over a Lie superalgebra and simple supermodules over the
even part of this Lie superalgebra. This reduces the classification problem for
the former to the one for the latter. Our result applies to all classical Lie
superalgebra of type $I$, in particular, to the general linear Lie superalgebra
$\gl(m|n)$. In the latter case we also show that the rough structure of simple
$\gl(m|n)$-supermodules and also that of Kac supermodules depends only on the
annihilator of the $\mf{gl}(m)\oplus \mf{gl}(n)$-input and hence can be
computed using the combinatorics of BGG category $\mathcal{O}$.
","[{""version"":""v1"",""created"":""Tue, 2 Jan 2018 14:15:36 GMT""},{""version"":""v2"",""created"":""Thu, 8 Feb 2018 16:18:55 GMT""}]","2018-02-09"
"1801.00655","Dario Beraldo","Dario Beraldo, David Kazhdan, Tomer M. Schlank","Contractibility of the space of generic opers for classical groups",,,,,"math.RT","http://arxiv.org/licenses/nonexclusive-distrib/1.0/","  Let $G$ be a reductive group and $X$ a smooth projective curve. We prove
that, for $G$ classical and $\sigma$ an arbitrary $G$-local system on $X$, the
space $\overline{\operatorname{Op}}^{gen}_{G,\sigma}$ of generic extended oper
structures on $\sigma$ is homologically contractible. This contractibility
result is crucial for the proof of the geometric Langlands conjecture.
","[{""version"":""v1"",""created"":""Tue, 2 Jan 2018 14:16:15 GMT""},{""version"":""v2"",""created"":""Mon, 28 Nov 2022 18:46:48 GMT""}]","2022-11-29"
"1801.00656","Jingrui Cheng","Xiuxiong Chen and Jingrui Cheng","On the constant scalar curvature K\""ahler metrics, existence results",,,,,"math.DG math.AP","http://arxiv.org/licenses/nonexclusive-distrib/1.0/","  In this paper, we generalize our apriori estimates on cscK(constant scalar
curvature K\""ahler) metric equation to more general scalar curvature type
equations (e.g., twisted cscK metric equation). As applications, under the
assumption that the automorphism group is discrete, we prove the celebrated
Donaldson's conjecture that the non-existence of cscK metric is equivalent to
the existence of a destabilized geodesic ray where the $K$-energy is
non-increasing. Moreover, we prove that the properness of $K$-energy in terms
of $L^1$ geodesic distance $d_1$ in the space of K\""ahler potentials implies
the existence of cscK metric. Finally, we prove that weak minimizers of the
$K$-energy in $(\mathcal{E}^1, d_1)$ are smooth.
","[{""version"":""v1"",""created"":""Tue, 2 Jan 2018 14:19:03 GMT""}]","2018-01-04"
"1801.00657","Istv\'an Mez\H{o} PhD","Istv\'an Mez\H{o}","The $p$-adic Lambert $W$ function",,,,,"math.CA","http://arxiv.org/licenses/nonexclusive-distrib/1.0/","  In this paper we introduce the $p$-adic analogue of the Lambert $W$ function,
and study its main properties.
","[{""version"":""v1"",""created"":""Tue, 2 Jan 2018 14:20:50 GMT""}]","2018-01-03"
"1801.00658","Jonathan Demaeyer","Jonathan Demaeyer and St\'ephane Vannitsem","Comparison of stochastic parameterizations in the framework of a coupled
  ocean-atmosphere model","44 pages, 12 figures, 4 tables",,"10.5194/npg-25-605-2018",,"physics.ao-ph cond-mat.stat-mech nlin.CD","http://arxiv.org/licenses/nonexclusive-distrib/1.0/","  A new framework is proposed for the evaluation of stochastic subgrid-scale
parameterizations in the context of MAOOAM, a coupled ocean-atmosphere model of
intermediate complexity. Two physically-based parameterizations are
investigated, the first one based on the singular perturbation of Markov
operator, also known as homogenization. The second one is a recently proposed
parameterization based on the Ruelle's response theory. The two
parameterization are implemented in a rigorous way, assuming however that the
unresolved scale relevant statistics are Gaussian. They are extensively tested
for a low-order version known to exhibit low-frequency variability, and some
preliminary results are obtained for an intermediate-order version. Several
different configurations of the resolved-unresolved scale separations are then
considered. Both parameterizations show remarkable performances in correcting
the impact of model errors, being even able to change the modality of the
probability distributions. Their respective limitations are also discussed.
","[{""version"":""v1"",""created"":""Tue, 2 Jan 2018 14:23:21 GMT""}]","2018-09-26"
"1801.00659","Yining Xu","Yining Xu and Dao-Xin Yao","Spin Glass in the Bond-Diluted J1-J2 Ising Model on the Square Lattice",,"Phys. Rev. B 97, 224419 (2018)","10.1103/PhysRevB.97.224419",,"cond-mat.stat-mech","http://arxiv.org/licenses/nonexclusive-distrib/1.0/","  We use Monte Carlo (MC) methods to simulate a two-dimensional (2D)
bond-diluted Ising model on the square lattice which has frustration between
the nearest-neighbor interaction J1 and the next-nearest-neighbor interaction
J2. In this paper, we use the parallel tempering algorithm to study the
thermodynamics for different diluted ratio x and give the phase diagram. The
presence of both frustration and disorder results in a spin-glass phase, which
exists between the stripe antiferromagnetic phase and the Neel phase. We
present the ground-state energy of T -> 0 and the size-dependence of
Edwards-Anderson (EA) order parameter for the spin glass phase. By scaling the
mean energy and the EA order parameter from the simulated annealing with the
Kibble-Zurek (KZ) mechanism, we obtain two different dynamic exponents z_E and
z_q for the spin glass phase. Experimentally, this model has close implication
with the FeAs plane of the iron-based superconductor BaFe2(As(1-x)P(x))2, where
a spin-glass like phase was found.
","[{""version"":""v1"",""created"":""Tue, 2 Jan 2018 14:25:30 GMT""}]","2018-06-27"
"1801.00660","Zhun Lu","Xiaoyu Wang and Zhun Lu","Sivers Asymmetry in the pion induced Drell-Yan process at COMPASS within
  TMD factorization","11 pages, 2 figures,version published in PRD","Phys. Rev. D 97, 054005 (2018)","10.1103/PhysRevD.97.054005",,"hep-ph hep-ex","http://arxiv.org/licenses/nonexclusive-distrib/1.0/","  We investigate the Sivers asymmetry in the pion-induced single polarized
Drell-Yan process in the theoretical framework of the transverse momentum
dependent factorization up to next-to-leading logarithmic order of QCD. Within
the TMD evolution formalism of parton distribution functions, the recently
extracted nonperturbative Sudakov form factor for the pion distribution
functions as well as the one for the Sivers function of the proton are applied
to numerically estimate the Sivers asymmetry in the $\pi^- p$ Drell-Yan at the
kinematics of the COMPASS at CERN. In the low $b$ region, the Sivers function
in $b$-space can be expressed as the convolution of the perturbatively
calculable hard coefficients and the corresponding collinear correlation
function, of which the Qiu-Sterman function is the most relevant one. The
effect of the energy-scale dependence of the Qiu-Sterman function to the
asymmetry is also studied. We find that our prediction on the Sivers
asymmetries as functions of $x_p$, $x_\pi$, $x_F$ and $q_\perp$ is consistent
with the recent COMPASS measurement.
","[{""version"":""v1"",""created"":""Tue, 2 Jan 2018 14:25:38 GMT""},{""version"":""v2"",""created"":""Thu, 12 Jul 2018 01:39:19 GMT""}]","2018-07-13"
