"1801.00465","Alexandre Anan'in","Sasha Anan'in, Carlos H. Grossi, Jaejeong Lee, Jo\~ao dos Reis jr","Hyperbolic 2-spheres with cone singularities","21 pages","Topology and its Applications, Volume 272, 1 March 2020, 107073","10.1016/j.topol.2020.107073",,"math.GT","http://arxiv.org/licenses/nonexclusive-distrib/1.0/","  We study the space $C(a_0,a_1,\dots,a_n)$ of hyperbolic 2-spheres with cone
points of prescribed apex curvatures $2a_0,2a_1,\dots,2a_n\in]0,2\pi[$ and some
related spaces. For $n=3$, we get a detailed description of such spaces. The
euclidean 2-spheres were considered by W. P. Thurston: for $n=4$, the
corresponding spaces provide the famous 7 examples of nonarithmetic compact
holomorphic 2-ball quotients previously constructed by Deligne-Mostow.
","[{""version"":""v1"",""created"":""Mon, 1 Jan 2018 16:01:39 GMT""},{""version"":""v2"",""created"":""Thu, 26 Mar 2020 15:25:50 GMT""}]","2020-03-27"
"1801.00466","Franck Ramaharo","Franck Ramaharo","An approximate Jerusalem square whose side equals a Pell number","5 pages, 3 figures",,,,"math.CO","http://arxiv.org/licenses/nonexclusive-distrib/1.0/","  We take advantage of the properties of the Pell numbers to construct an
integer version of the Jerusalem square fractal.
","[{""version"":""v1"",""created"":""Mon, 1 Jan 2018 16:05:52 GMT""}]","2018-01-03"
"1801.00467","Fei Yan","Fei Yan, Dan Campbell, Philip Krantz, Morten Kjaergaard, David Kim,
  Jonilyn L. Yoder, David Hover, Adam Sears, Andrew J. Kerman, Terry P.
  Orlando, Simon Gustavsson, William D. Oliver","Distinguishing coherent and thermal photon noise in a circuit QED system",,"Phys. Rev. Lett. 120, 260504 (2018)","10.1103/PhysRevLett.120.260504",,"quant-ph","http://arxiv.org/licenses/nonexclusive-distrib/1.0/","  In the cavity-QED architecture, photon number fluctuations from residual
cavity photons cause qubit dephasing due to the AC Stark effect. These unwanted
photons originate from a variety of sources, such as thermal radiation,
leftover measurement photons, and crosstalk. Using a capacitively-shunted flux
qubit coupled to a transmission line cavity, we demonstrate a method that
identifies and distinguishes coherent and thermal photons based on
noise-spectral reconstruction from time-domain spin-locking relaxometry. Using
these measurements, we attribute the limiting dephasing source in our system to
thermal photons, rather than coherent photons. By improving the cryogenic
attenuation on lines leading to the cavity, we successfully suppress residual
thermal photons and achieve $T_1$-limited spin-echo decay time. The
spin-locking noise spectroscopy technique can readily be applied to other qubit
modalities for identifying general asymmetric non-classical noise spectra.
","[{""version"":""v1"",""created"":""Mon, 1 Jan 2018 16:15:33 GMT""}]","2018-07-04"
"1801.00468","Naduvath Sudev","K.P.Chithra, E.A. Shiny and N.K. Sudev","On Equitable Coloring Parameters of Certain Cycle Related Graphs","12 pages","Contemporary Studies in Discrete Mathematics, Vol. 1, Issue 1,
  2017",,,"math.GM","http://arxiv.org/licenses/nonexclusive-distrib/1.0/","  Coloring the vertices of a graph G subject to given conditions can be
considered as a random experiment and corresponding to this experiment, a
discrete random variable X can be defined as the colour of a vertex chosen at
random, with respect to the given type of colouring of G and a probability mass
function for this random variable can be defined accordingly. A proper coloring
C of a graph G, which assigns colors to the vertices of G such that the numbers
of vertices in any two colour classes differ by at most one, is called an
equitable colouring of G. In this paper, we study two statistical parameters of
certain cycle related graphs, with respect to their equitable colorings.
","[{""version"":""v1"",""created"":""Mon, 1 Jan 2018 16:26:22 GMT""}]","2018-01-03"
"1801.00469","Rositsa Miteva","Rositsa Miteva, Susan W. Samwel, Marcus V. Costa-Duarte","The Wind/EPACT proton event catalog (1996-2016)","Accepted at Solar Physics Journal",,"10.1007/s11207-018-1241-5",,"astro-ph.SR","http://arxiv.org/licenses/nonexclusive-distrib/1.0/","  We present the finalized catalog of solar energetic proton events detected by
Wind/EPACT instrument over the period 1996-2016. Onset times, peak times, peak
proton intensity and onset-to-peak proton fluence are evaluated for the two
available energy channels, at about 25 and 50 MeV. We describe the procedure
utilized to identify the proton events and to relate them to their solar origin
(in terms of flares and coronal mass ejections). The statistical relationships
between the energetic protons and their origin (linear and partial correlation
analysis) are reported and discussed in view of earlier findings. Finally, the
different trends found in the first eight years of solar cycles 23 and 24 are
discussed.
","[{""version"":""v1"",""created"":""Mon, 1 Jan 2018 16:38:30 GMT""}]","2018-02-21"
"1801.00470","Aishik Konwer","Ankan Kumar Bhunia, Aishik Konwer, Ayan Kumar Bhunia, Abir Bhowmick,
  Partha P. Roy, Umapada Pal","Script Identification in Natural Scene Image and Video Frame using
  Attention based Convolutional-LSTM Network","The first and second authors contributed equally. Accepted in Pattern
  Recognition Journal",,"10.1016/j.patcog.2018.07.034",,"cs.CV","http://arxiv.org/licenses/nonexclusive-distrib/1.0/","  Script identification plays a significant role in analysing documents and
videos. In this paper, we focus on the problem of script identification in
scene text images and video scripts. Because of low image quality, complex
background and similar layout of characters shared by some scripts like Greek,
Latin, etc., text recognition in those cases become challenging. In this paper,
we propose a novel method that involves extraction of local and global features
using CNN-LSTM framework and weighting them dynamically for script
identification. First, we convert the images into patches and feed them into a
CNN-LSTM framework. Attention-based patch weights are calculated applying
softmax layer after LSTM. Next, we do patch-wise multiplication of these
weights with corresponding CNN to yield local features. Global features are
also extracted from last cell state of LSTM. We employ a fusion technique which
dynamically weights the local and global features for an individual patch.
Experiments have been done in four public script identification datasets:
SIW-13, CVSI2015, ICDAR-17 and MLe2e. The proposed framework achieves superior
results in comparison to conventional methods.
","[{""version"":""v1"",""created"":""Mon, 1 Jan 2018 16:42:50 GMT""},{""version"":""v2"",""created"":""Sun, 4 Feb 2018 07:53:38 GMT""},{""version"":""v3"",""created"":""Mon, 23 Jul 2018 16:20:08 GMT""},{""version"":""v4"",""created"":""Tue, 7 Aug 2018 17:37:58 GMT""}]","2018-08-08"
"1801.00471","Rose Bohrer","Rose Bohrer and Karl Crary","TWAM: A Certifying Abstract Machine for Logic Programs","41 pages, under submission to ACM Transactions on Computational Logic",,,,"cs.PL cs.LO","http://arxiv.org/licenses/nonexclusive-distrib/1.0/","  Type-preserving (or typed) compilation uses typing derivations to certify
correctness properties of compilation. We have designed and implemented a
type-preserving compiler for a simply-typed dialect of Prolog we call T-Prolog.
The crux of our approach is a new certifying abstract machine which we call the
Typed Warren Abstract Machine (TWAM). The TWAM has a dependent type system
strong enough to specify the semantics of a logic program in the logical
framework LF. We present a soundness metatheorem which constitutes a partial
correctness guarantee: well-typed programs implement the logic program
specified by their type. This metatheorem justifies our design and
implementation of a certifying compiler from T-Prolog to TWAM.
","[{""version"":""v1"",""created"":""Mon, 1 Jan 2018 16:46:28 GMT""}]","2022-06-29"
"1801.00472","Chuan Zhang","Zhiwei Zhong (1 and 2), Xiaohu You (2), Chuan Zhang (1 and 2) ((1) Lab
  of Efficient Architectures for Digital-communication and Signal-processing
  (LEADS), (2) National Mobile Communications Research Laboratory, Southeast
  University, Nanjing, China)","Auto-Generation of Pipelined Hardware Designs for Polar Encoder",,,,,"cs.AR","http://arxiv.org/licenses/nonexclusive-distrib/1.0/","  This paper presents a general framework for auto-generation of pipelined
polar encoder architectures. The proposed framework could be well represented
by a general formula. Given arbitrary code length $N$ and the level of
parallelism $M$, the formula could specify the corresponding hardware
architecture. We have written a compiler which could read the formula and then
automatically generate its register-transfer level (RTL) description suitable
for FPGA or ASIC implementation. With this hardware generation system, one
could explore the design space and make a trade-off between cost and
performance. Our experimental results have demonstrated the efficiency of this
auto-generator for polar encoder architectures.
","[{""version"":""v1"",""created"":""Mon, 1 Jan 2018 16:50:09 GMT""}]","2018-01-03"
"1801.00473","Ranadeep Sarkar","Ranadeep Sarkar, Nandita Srivastava","A Comparative Study of the Eruptive and Non-Eruptive Flares Produced by
  the Largest Active Region of Solar Cycle 24","25 pages, 14 figures, Accepted for publication in Solar Physics
  Journal",,"10.1007/s11207-017-1235-8",,"astro-ph.SR","http://arxiv.org/licenses/nonexclusive-distrib/1.0/","  We investigate the morphological and magnetic characteristics of solar active
region (AR) NOAA 12192. AR 12192 was the largest region of Solar Cycle 24; it
underwent noticeable growth and produced 6 X-class flares, 22 M-class flares,
and 53 C-class flares in the course of its disc passage. However, the most
peculiar fact of this AR is that it was associated with only one CME in spite
of producing several X-class flares. In this work, we carry out a comparative
study between the eruptive and non-eruptive flares produced by AR 12192. We
find that the magnitude of abrupt and permanent changes in the horizontal
magnetic field and Lorentz force are significantly smaller in the case of the
confined flares compared to the eruptive one. We present the areal evolution of
AR 12192 during its disc passage. We find the flare-related morphological
changes to be weaker during the confined flares, whereas the eruptive flare
exhibits a rapid and permanent disappearance of penumbral area away from the
magnetic neutral line after the flare. Furthermore, from the extrapolated
nonlinear force-free magnetic field, we examine the overlying coronal magnetic
environment over the eruptive and non-eruptive zones of the AR. We find that
the critical decay index for the onset of torus instability was achieved at a
lower height over the eruptive flaring region, than for the non-eruptive core
area. These results suggest that the decay rate of the gradient of overlying
magnetic field strength may play a decisive role to determine the CME
productivity of the AR. In addition, the magnitude of changes in the
flare-related magnetic characteristics are found to be well correlated with the
nature of solar eruptions.
","[{""version"":""v1"",""created"":""Mon, 1 Jan 2018 16:54:37 GMT""}]","2018-02-14"
"1801.00474","Jessica De Silva","Jessica De Silva, Xiang Si, Michael Tait, Yunus Tun\c{c}bilek, Ruifan
  Yang, Michael Young","Anti-Ramsey Multiplicities","14 pages, 2 figures",,,,"math.CO","http://arxiv.org/licenses/nonexclusive-distrib/1.0/","  The Ramsey multiplicity constant of a graph $H$ is the minimum proportion of
copies of $H$ in the complete graph which are monochromatic under an
edge-coloring of $K_n$ as $n$ goes to infinity. Graphs for which this minimum
is asymptotically achieved by taking a random coloring are called {\em common},
and common graphs have been studied extensively, leading to the Burr-Rosta
conjecture and Sidorenko's conjecture. Erd\H{o}s and S\'os asked what the
maximum number of rainbow triangles is in a $3$-coloring of the edge set of
$K_n$, a rainbow version of the Ramsey multiplicity question. A graph $H$ is
called $r$-anti-common if the maximum proportion of rainbow copies of $H$ in
any $r$-coloring of $E(K_n)$ is asymptotically achieved by taking a random
coloring. In this paper, we investigate anti-Ramsey multiplicity for several
families of graphs. We determine classes of graphs which are either anti-common
or not. Some of these classes follow the same behavior as the monochromatic
case, but some of them do not. In particular the rainbow equivalent of
Sidorenko's conjecture, that all bipartite graphs are anti-common, is false.
","[{""version"":""v1"",""created"":""Mon, 1 Jan 2018 16:55:10 GMT""},{""version"":""v2"",""created"":""Wed, 28 Mar 2018 02:43:54 GMT""}]","2018-03-29"
"1801.00475","M Rule","M. E. Rule and G. Sanguinetti","Autoregressive Point-Processes as Latent State-Space Models: a
  Moment-Closure Approach to Fluctuations and Autocorrelations",,,"10.1162/neco_a_01121",,"q-bio.NC","http://arxiv.org/licenses/nonexclusive-distrib/1.0/","  Modeling and interpreting spike train data is a task of central importance in
computational neuroscience, with significant translational implications. Two
popular classes of data-driven models for this task are autoregressive Point
Process Generalized Linear models (PPGLM) and latent State-Space models (SSM)
with point-process observations. In this letter, we derive a mathematical
connection between these two classes of models. By introducing an auxiliary
history process, we represent exactly a PPGLM in terms of a latent, infinite
dimensional dynamical system, which can then be mapped onto an SSM by basis
function projections and moment closure. This representation provides a new
perspective on widely used methods for modeling spike data, and also suggests
novel algorithmic approaches to fitting such models. We illustrate our results
on a phasic bursting neuron model, showing that our proposed approach provides
an accurate and efficient way to capture neural dynamics.
","[{""version"":""v1"",""created"":""Mon, 1 Jan 2018 16:56:15 GMT""},{""version"":""v2"",""created"":""Wed, 28 Feb 2018 13:30:41 GMT""}]","2020-06-30"
"1801.00476","Farzin Ghorban","Farzin Ghorban, Javier Mar\'in, Yu Su, Alessandro Colombo, Anton
  Kummert","Aggregated Channels Network for Real-Time Pedestrian Detection",,,,,"cs.CV","http://arxiv.org/licenses/nonexclusive-distrib/1.0/","  Convolutional neural networks (CNNs) have demonstrated their superiority in
numerous computer vision tasks, yet their computational cost results
prohibitive for many real-time applications such as pedestrian detection which
is usually performed on low-consumption hardware. In order to alleviate this
drawback, most strategies focus on using a two-stage cascade approach.
Essentially, in the first stage a fast method generates a significant but
reduced amount of high quality proposals that later, in the second stage, are
evaluated by the CNN. In this work, we propose a novel detection pipeline that
further benefits from the two-stage cascade strategy. More concretely, the
enriched and subsequently compressed features used in the first stage are
reused as the CNN input. As a consequence, a simpler network architecture,
adapted for such small input sizes, allows to achieve real-time performance and
obtain results close to the state-of-the-art while running significantly faster
without the use of GPU. In particular, considering that the proposed pipeline
runs in frame rate, the achieved performance is highly competitive. We
furthermore demonstrate that the proposed pipeline on itself can serve as an
effective proposal generator.
","[{""version"":""v1"",""created"":""Mon, 1 Jan 2018 16:58:25 GMT""}]","2018-01-03"
"1801.00477","Hanan Dery","Dinh Van Tuan, Min Yang, Hanan Dery","The Coulomb interaction in monolayer transition-metal dichalcogenides","A longer version","Phys. Rev. B 98, 125308 (2018)","10.1103/PhysRevB.98.125308",,"cond-mat.mtrl-sci cond-mat.mes-hall","http://arxiv.org/licenses/nonexclusive-distrib/1.0/","  Recently, the celebrated Keldysh potential has been widely used to describe
the Coulomb interaction of few-body complexes in monolayer transition-metal
dichalcogenides. Using this potential to model charged excitons (trions), one
finds a strong dependence of the binding energy on whether the monolayer is
suspended in air, supported on SiO$_2$, or encapsulated in hexagonal
boron-nitride. However, empirical values of the trion binding energies show
weak dependence on the monolayer configuration. This deficiency indicates that
the description of the Coulomb potential is still lacking in this important
class of materials. We address this problem and derive a new potential form,
which takes into account the three atomic sheets that compose a monolayer of
transition-metal dichalcogenides. The new potential self-consistently supports
(i) the non-hydrogenic Rydberg series of neutral excitons, and (ii) the weak
dependence of the trion binding energy on the environment. Furthermore, we
identify an important trion-lattice coupling due to the phonon cloud in the
vicinity of charged complexes. Neutral excitons, on the other hand, have weaker
coupling to the lattice due to the confluence of their charge neutrality and
small Bohr radius.
","[{""version"":""v1"",""created"":""Mon, 1 Jan 2018 17:11:47 GMT""},{""version"":""v2"",""created"":""Tue, 25 Sep 2018 18:36:52 GMT""}]","2018-10-03"
"1801.00478","Javad Taghizadeh Firouzjaee","Alireza Allahyari, Javad T. Firouzjaee and Reza Mansouri","Nonlinear phenomena in general relativity","8 pages, 2 figures","Eur.Phys.J.Plus 133 (2018) no.4, 147","10.1140/epjp/i2018-12000-8",,"gr-qc astro-ph.CO","http://creativecommons.org/licenses/by/4.0/","  The perturbation theory plays an important role in studying structure
formation in cosmology and post-Newtonian physics, but not all phenomena can be
described by the linear perturbation theory. Thus, It is necessary to study
exact solutions or higher order perturbations. Specifically, we study black
hole (apparent) horizons and the cosmological event horizon formation in the
perturbation theory. We emphasize that in the perturbative regime of the
gravitational potential these horizons cannot form in the lower order. Studying
the infinite plane metric, we show that to capture the cosmological constant
effect we need at least a second order expansion.
","[{""version"":""v1"",""created"":""Mon, 1 Jan 2018 17:15:26 GMT""}]","2018-07-17"
"1801.00479","Charlotta Bengtson","Charlotta Bengtson, Michael Sahlin and Marie Ericsson","Environmental design principles for efficient excitation energy transfer
  in dimer and trimer pigment-protein molecular aggregates and the relation to
  non-Markovianity",,,,,"quant-ph","http://arxiv.org/licenses/nonexclusive-distrib/1.0/","  In this study, we explore optimal environments for efficient EET between end
sites in a number of dimer and trimer model pigment-protein molecular
aggregates when the EET dynamics is modeled by the HEOM-method. For these
optimal environmental parameters, we further quantify the non-Markovianity by
the BLP-measure to elucidate its possible connection to efficient EET. We also
quantify coherence in the pigment systems by means of the measure l1-norm of
coherence to analyze its interplay with environmental effects when EET
efficiency is maximal. Our aim is to investigate possible environmental design
principles for achieving efficient EET in model pigment-protein molecular
aggregates and to determine whether non-Markovianity is a possible underlying
resource in such systems. We find that the structure of the system Hamiltonian
(i.e., the pigment Hamiltonian parameter space) and especially, the
relationship between the site excitation energies, determines whether one of
two specific environmental regimes is the most beneficial in promoting
efficient EET in these model systems. In the first regime, optimal
environmental conditions are such that the EET dynamics in the system is left
as coherent as possible. In the second regime, the most advantageous role of
the environment is to drive the system towards equilibrium as fast as possible.
In reality, optimal environmental conditions may involve a combination of these
two effects. We cannot establish a relation between efficient EET and
non-Markovianity, i.e., non-Markovianity cannot be regarded as a resource in
the systems investigated in this study.
","[{""version"":""v1"",""created"":""Mon, 1 Jan 2018 17:20:31 GMT""}]","2018-01-03"
"1801.00480","Aviv Gibali","Francisco J. Arag\'on Artacho, Yair Censor and Aviv Gibali","The Cyclic Douglas-Rachford Algorithm with r-sets-Douglas-Rachford
  Operators","Accepted for publication in Optimization Methods and Software (OMS)
  July 17, 2018",,,,"math.OC","http://arxiv.org/licenses/nonexclusive-distrib/1.0/","  The Douglas-Rachford (DR) algorithm is an iterative procedure that uses
sequential reflections onto convex sets and which has become popular for convex
feasibility problems. In this paper we propose a structural generalization that
allows to use $r$-sets-DR operators in a cyclic fashion. We prove convergence
and present numerical illustrations of the potential advantage of such
operators with $r>2$ over the classical $2$-sets-DR operators in a cyclic
algorithm.
","[{""version"":""v1"",""created"":""Mon, 1 Jan 2018 17:21:14 GMT""},{""version"":""v2"",""created"":""Tue, 17 Jul 2018 10:35:01 GMT""}]","2018-07-18"
"1801.00481","Vitaly Svetovoy","Ilia V. Uvarov, Mikhail V. Lokhanin, Alexander V. Postnikov, Artem E.
  Melenev, Vitaly B. Svetovoy","Electrochemical membrane microactuator with a millisecond response time","author's version, 8 pages, 9 figures (to appear in Sensors and
  Actuators B: Chemical)",,"10.1016/j.snb.2017.12.159",,"physics.app-ph physics.flu-dyn","http://arxiv.org/licenses/nonexclusive-distrib/1.0/","  Lack of fast and strong actuators to drive microsystems is well recognized.
Electrochemical actuators are considered attractive for many applications but
they have long response time (minutes) due to slow gas termination. Here an
electrochemical actuator is presented for which the response time can be as
short as 1 ms. The alternating polarity water electrolysis is used to drive the
device. In this process only nanobubbles are formed. The gas in nanobubbles can
be terminated fast due to surface assisted reaction between hydrogen and oxygen
that happens at room temperature. The working chamber of the actuator contains
concentric titanium electrodes; it has a diameter of 500 um and a height of 8
um. The chamber is sealed by a polydimethylsiloxane (PDMS) membrane of 30 um
thick. The device is characterized by an interferometer and a fast camera.
Cyclic operation at frequency up to 667 Hz with a stroke of about 30% of the
chamber volume is demonstrated. The cycles repeat themselves with high
precision providing the volume strokes in picoliter range. Controlled
explosions in the chamber can push the membrane up to 90 um.
","[{""version"":""v1"",""created"":""Mon, 1 Jan 2018 17:22:34 GMT""}]","2018-01-03"
"1801.00482","Igor Kuzmenko","Igor Kuzmenko, Tanya Kuzmenko and Yshai Avishai","Optical Control of Exchange Interaction and Kondo Temperature in cold
  Atom Gas","6 pages, 3 eps figures",,,,"cond-mat.quant-gas cond-mat.str-el physics.atom-ph","http://arxiv.org/licenses/nonexclusive-distrib/1.0/","  The relevance of magnetic impurity problems in cold atom systems depends
crucially on the nature of exchange interaction between itinerant fermionic
atoms and a localized impurity atom. In particular, Kondo physics occurs only
if the exchange interaction is anti-ferromagnetic, and strong enough to yield
high enough Kondo temperature ($T_K/T_F \ge 0.1$). Focusing, as an example, on
the experimentally accessible system of ultra-cold $^{173}$Yb atoms, it is
shown that the sign and strength of an exchange interaction between an
itinerant Yb($^{1}$S$_{0}$) atom and a trapped Yb($^{3}$P$_{0}$) atom can be
optically controlled. Explicitly, as the light intensity increases (from zero),
the exchange interaction changes from ferromagnetic to anti-ferromagnetic. When
the light intensity is just below a singlet Feshbach resonance, the singlet
scattering length $a_S$ is large and negative, and the Kondo temperature
increases sharply.
","[{""version"":""v1"",""created"":""Mon, 1 Jan 2018 17:25:15 GMT""},{""version"":""v2"",""created"":""Fri, 21 Sep 2018 14:54:05 GMT""},{""version"":""v3"",""created"":""Sat, 2 Feb 2019 15:26:38 GMT""}]","2019-02-05"
