"1801.00519","Marius Solberg","M. Aa. Solberg","Conditions for the custodial symmetry in multi-Higgs-doublet models","37 pages, 1 figure. A section on spontaneous breaking of the
  custodial SO(4) symmetry is added, in addition to a section on the
  Ivanov-Silva model and a discussion of theorem 1 in the case N=2. Equivalent
  to the version published in JHEP","J. High Energ. Phys. (2018) 2018: 163","10.1007/JHEP05(2018)163",,"hep-ph hep-th math-ph math.MP","http://arxiv.org/licenses/nonexclusive-distrib/1.0/","  We derive basis-independent, necessary and sufficient conditions for the
custodial symmetry in N-Higgs-doublet models (NHDM) for N > 2, and apply them
on some 3HDM examples.
","[{""version"":""v1"",""created"":""Mon, 1 Jan 2018 22:12:15 GMT""},{""version"":""v2"",""created"":""Sat, 26 May 2018 17:46:25 GMT""}]","2018-05-29"
"1801.00520","Angelo Bongiorno","Yang Gao, Tengfei Cao, Filippo Cellini, Claire Berger, Walt de Heer,
  Erio Tosatti, Elisa Riedo and Angelo Bongiorno","Ultrahard carbon film from epitaxial two-layer graphene","Published online on Nature Nanotechnology on December 18, 2017",,"10.1038/s41565-017-0023-9",,"cond-mat.mtrl-sci physics.comp-ph","http://arxiv.org/licenses/nonexclusive-distrib/1.0/","  Atomically thin graphene exhibits fascinating mechanical properties, although
its hardness and transverse stiffness are inferior to those of diamond. To
date, there hasn't been any practical demonstration of the transformation of
multi-layer graphene into diamond-like ultra-hard structures. Here we show that
at room temperature and after nano-indentation, two-layer graphene on SiC(0001)
exhibits a transverse stiffness and hardness comparable to diamond, resisting
to perforation with a diamond indenter, and showing a reversible drop in
electrical conductivity upon indentation. Density functional theory
calculations suggest that upon compression, the two-layer graphene film
transforms into a diamond-like film, producing both elastic deformations and
sp2-to-sp3 chemical changes. Experiments and calculations show that this
reversible phase change is not observed for a single buffer layer on SiC or
graphene films thicker than 3 to 5 layers. Indeed, calculations show that
whereas in two-layer graphene layer-stacking configuration controls the
conformation of the diamond-like film, in a multilayer film it hinders the
phase transformation.
","[{""version"":""v1"",""created"":""Mon, 1 Jan 2018 22:16:35 GMT""}]","2018-01-03"
"1801.00521","Engui Fan","Shulin Lyu, Yang Chen and Engui Fan","Asymptotic Gap Probability Distributions of the Gaussian Unitary
  Ensembles and Jacobi Unitary Ensembles","38 pages","Nuclear Phys B, 926(2018), 639-670","10.1016/j.nuclphysb.2017.11.018",,"math-ph math.MP","http://creativecommons.org/licenses/by/4.0/","  In this paper, we address a class of problems in unitary ensembles.
Specifically, we study the probability that a gap symmetric about 0, i.e.
$(-a,a)$ is found in the Gaussian unitary ensembles (GUE) and the Jacobi
unitary ensembles (JUE) (where in the JUE, we take the parameters
$\alpha=\beta$). By exploiting the even parity of the weight, a doubling of the
interval to $(a^2,\infty)$ for the GUE, and $(a^2,1)$, for the (symmetric) JUE,
shows that the gap probabilities maybe determined as the product of the
smallest eigenvalue distributions of the LUE with parameter $\alpha=-1/2,$ and
$\alpha=1/2$ and the (shifted) JUE with weights $x^{1/2}(1-x)^{\beta}$ and
$x^{-1/2}(1-x)^{\beta}$ The $\sigma$ function, namely, the derivative of the
log of the smallest eigenvalue distributions of the finite-$n$ LUE or the JUE,
satisfies the Jimbo-Miwa-Okamoto $\sigma$ form of $P_{V}$ and $P_{VI}$,
although in the shift Jacobi case, with the weight $x^{\alpha}(1-x)^{\beta},$
the $\beta$ parameter does not show up in the equation. We also obtain the
asymptotic expansions for the smallest eigenvalue distributions of the Laguerre
unitary and Jacobi unitary ensembles after appropriate double scalings, and
obtained the constants in the asymptotic expansion of the gap probablities,
expressed in term of the Barnes $G-$ function valuated at special point.
","[{""version"":""v1"",""created"":""Mon, 1 Jan 2018 22:21:41 GMT""}]","2018-03-14"
"1801.00522","Khaled Abdelfadeel","Khaled Q. Abdelfadeel, Victor Cionca, Dirk Pesch","A Fair Adaptive Data Rate Algorithm for LoRaWAN","2 pages, 6 figures and 1 algorithm",,,,"cs.NI","http://arxiv.org/licenses/nonexclusive-distrib/1.0/","  LoRaWAN exhibits several characteristics that can lead to an unfair
distribution of the Data Extracted Rate (DER) among nodes. Firstly, the capture
effect leads to a strong signal suppressing a weaker signal at the gateway and
secondly, the spreading codes used are not perfectly orthogonal, causing packet
loss if an interfering signal is strong enough. In these conditions, nodes
experiencing higher attenuation are less likely to see their packets received
correctly. We develop FADR, a Fair Adaptive Data Rate algorithm for LoRaWAN
that exploits the different Spreading Factors (SFs) and Transmission Powers
(TPs) settings available in LoRa to achieve a fair Data Extraction Rate among
all nodes while at the same time avoiding excessively high TPs. Simulations
show that FADR, in highly congested cells, achieves 300% higher fairness than
the minimum airtime allocation approach and 22% higher fairness than Brechts
approach, while consuming almost 22% lower energy.
","[{""version"":""v1"",""created"":""Mon, 1 Jan 2018 22:24:03 GMT""}]","2018-01-03"
"1801.00523","Luke Prendergast","Chandima N. P. G. Arachchige, Maxwell Cairns and Luke A. Prendergast","Interval estimators for ratios of independent quantiles and
  interquantile ranges",,,,,"math.ST stat.TH","http://arxiv.org/licenses/nonexclusive-distrib/1.0/","  Recent research has shown that interval estimators with good coverage
properties are achievable for some functions of quantiles, even when sample
sizes are not large. Motivated by this, we consider interval estimators for the
ratios of independent quantiles and interquantile ranges that will be useful
when comparing location and scale for two samples. Simulations show that the
intervals have excellent coverage properties for a wide range of distributions,
including those that are heavily skewed. Examples are also considered that
highlight the usefulness of using these approaches to compare location and
scale.
","[{""version"":""v1"",""created"":""Mon, 1 Jan 2018 22:40:07 GMT""},{""version"":""v2"",""created"":""Sun, 19 May 2019 23:06:35 GMT""}]","2019-05-21"
"1801.00524","Dan Xu","Dan Xu and Wanli Ouyang and Xavier Alameda-Pineda and Elisa Ricci and
  Xiaogang Wang and Nicu Sebe","Learning Deep Structured Multi-Scale Features using Attention-Gated CRFs
  for Contour Prediction","Accepted at NIPS 2017",,,,"cs.CV","http://arxiv.org/licenses/nonexclusive-distrib/1.0/","  Recent works have shown that exploiting multi-scale representations deeply
learned via convolutional neural networks (CNN) is of tremendous importance for
accurate contour detection. This paper presents a novel approach for predicting
contours which advances the state of the art in two fundamental aspects, i.e.
multi-scale feature generation and fusion. Different from previous works
directly consider- ing multi-scale feature maps obtained from the inner layers
of a primary CNN architecture, we introduce a hierarchical deep model which
produces more rich and complementary representations. Furthermore, to refine
and robustly fuse the representations learned at different scales, the novel
Attention-Gated Conditional Random Fields (AG-CRFs) are proposed. The
experiments ran on two publicly available datasets (BSDS500 and NYUDv2)
demonstrate the effectiveness of the latent AG-CRF model and of the overall
hierarchical framework.
","[{""version"":""v1"",""created"":""Mon, 1 Jan 2018 22:48:44 GMT""}]","2018-01-03"
"1801.00525","Atsushi Moriwaki","Atsushi Moriwaki","Note on lower estimates of multiplicities",,,,,"math.AG","http://arxiv.org/licenses/nonexclusive-distrib/1.0/","  In this note we would like to give an explicit lower bound by using a lower
saturated subset of \mathbb{R}_{\geq 0}^n.
","[{""version"":""v1"",""created"":""Mon, 1 Jan 2018 23:16:15 GMT""}]","2018-01-03"
"1801.00526","Shunzo Kumano","S. Kumano, Qin-Tao Song, O. V. Teryaev","Tomography and gravitational radii for hadrons by three-dimensional
  structure functions","10 pages, LaTeX, 2 style files, 10 figure files, Proceedings of the
  International Conference on Exotic Atoms and Related Topics (EXA2017),
  September 10-15, 2017, Vienna, Austria",,"10.1051/epjconf/201818101025","KEK-TH-2020, J-PARC-TH-0116","hep-ph hep-ex hep-th nucl-th","http://arxiv.org/licenses/nonexclusive-distrib/1.0/","  Three-dimensional tomography of hadrons can be investigated by generalized
parton distributions (GPDs), transverse-momentum-dependent parton distributions
(TMDs), and generalized distribution amplitudes (GDAs). The GDA studies had
been only theoretical for a long time because there was no experimental
measurement until recently, whereas the GPDs and TMDs have been investigated
extensively by deeply virtual Compton scattering and semi-inclusive deep
inelastic scattering. Here, we report our studies to determine pion GDAs from
recent KEKB measurements on the differential cross section of $\gamma^* \gamma
\to \pi^0 \pi^0$. Since an exotic-hadron pair can be produced in the final
state, the GDAs can be used also for probing internal structure of exotic
hadron candidates in future. The other important feature of the GDAs is that
the GDAs contain information on form factors of the energy-momentum tensor for
quarks and gluons, so that gravitational form factors and radii can be
calculated from the determined GDAs. We show the mass (energy) and the
mechanical (pressure, shear force) form factors and radii for the pion. Our
analysis should be the first attempt for obtaining gravitational form factors
and radii of hadrons by analysis of actual experimental measurements. We
believe that a new field of gravitational physics is created from the
microscopic level in terms of elementary quarks and gluons.
","[{""version"":""v1"",""created"":""Mon, 1 Jan 2018 23:41:43 GMT""}]","2018-08-01"
"1801.00527","Matthew Gelber","Matthew K. Gelber, Greg Hurst, Rohit Bhargava","Freeform Assembly Planning","Submitted to IEEE Transactions on Automation Science and Engineering",,,,"cs.CE cs.CC cs.DS cs.RO","http://creativecommons.org/licenses/by-nc-sa/4.0/","  3D printing enables the fabrication of complex architectures by automating
long sequences of additive steps. The increasing sophistication of printers,
materials, and generative design promises to make geometric complexity a
non-issue in manufacturing; however, this complexity can only be realized if a
design can be translated into a physically executable sequence of printing
operations. We investigate this planning problem for freeform direct-write
assembly, in which filaments of material are deposited through a nozzle
translating along a 3D path to create sparse, frame-like structures. We
enumerate the process constraints for different variants of the freeform
assembly process and show that, in the case where material stiffens via a glass
transition, determining whether a feasible sequence exists is NP-complete.
Nonetheless, for topologies typically encountered in real-world applications,
finding a feasible or even optimal sequence is a tractable problem. We develop
a sequencing algorithm that maximizes the fidelity of the printed part and
minimizes the probability of print failure by modeling the assembly as a
linear, elastic frame. We implement the algorithm and validate our approach
experimentally, printing objects composed of thousands of sugar alcohol
filaments with diameters of 100-200 microns. The assembly planner allows the
freeform process to be applied to arbitrarily complex parts, from tissue
engineering and microfluidics at the micrometer scale, to vascularized
functional materials and soft robots at the millimeter scale, to structural
components at the meter scale, thus opening a variety of assembly
possibilities.
","[{""version"":""v1"",""created"":""Mon, 1 Jan 2018 23:41:50 GMT""},{""version"":""v2"",""created"":""Thu, 4 Jan 2018 05:53:04 GMT""},{""version"":""v3"",""created"":""Mon, 28 May 2018 21:26:37 GMT""}]","2018-05-30"
"1801.00528","Ronald Rivest","Ronald L. Rivest","Bayesian Tabulation Audits: Explained and Extended","49 pages, 3 figures Version 2 of the paper replaces use of the bare
  Dirichlet model with the Dirichlet-multinomial, which is more standard and
  works better in edge cases, such as when the sample is very large",,,,"cs.CR cs.CY stat.AP","http://arxiv.org/licenses/nonexclusive-distrib/1.0/","  Tabulation audits for an election provide statistical evidence that a
reported contest outcome is ""correct"" (meaning that the tabulation of votes was
properly performed), or else the tabulation audit determines the correct
outcome.
  Stark proposed risk-limiting tabulation audits for this purpose; such audits
are effective and are beginning to be used in practice.
  We expand the study of election audits based on Bayesian methods, first
introduced by Rivest and Shen in 2012. (The risk-limiting audits proposed by
Stark are ""frequentist"" rather than Bayesian in character.)
  We first provide a simplified presentation of Bayesian tabulation audits. A
Bayesian tabulation audit begins by drawing a random sample of the votes in
that contest, and tallying those votes. It then considers what effect
statistical variations of this tally have on the contest outcome. If such
variations almost always yield the previously-reported outcome, the audit
terminates, accepting the reported outcome. Otherwise the audit is repeated
with an enlarged sample.
  Bayesian audits are attractive because they work with any method for
determining the winner (such as ranked-choice voting).
  We then show how Bayesian audits may be extended to handle more complex
situations, such as auditing contests that \emph{span multiple jurisdictions},
or are otherwise ""stratified.""
  We highlight the auditing of such multiple-jurisdiction contests where some
of the jurisdictions have an electronic cast vote record (CVR) for each cast
paper vote, while the others do not. Complex situations such as this may arise
naturally when some counties in a state have upgraded to new equipment, while
others have not. Bayesian audits are able to handle such situations in a
straightforward manner.
  We also discuss the benefits and relevant considerations for using Bayesian
audits in practice.
","[{""version"":""v1"",""created"":""Tue, 2 Jan 2018 00:00:15 GMT""},{""version"":""v2"",""created"":""Sun, 11 Feb 2018 23:41:18 GMT""}]","2018-02-13"
"1801.00529","John Krueger","Thomas Gilton and John Krueger","The Harrington-Shelah Model with Large Continuum",,,"10.1017/jsl.2018.74",,"math.LO","http://arxiv.org/licenses/nonexclusive-distrib/1.0/","  We prove from the existence of a Mahlo cardinal the consistency of the
statement that $2^\omega = \omega_3$ holds and every stationary subset of
$\omega_2 \cap \mathrm{cof}(\omega)$ reflects to an ordinal less than
$\omega_2$ with cofinality $\omega_1$.
","[{""version"":""v1"",""created"":""Tue, 2 Jan 2018 00:02:04 GMT""},{""version"":""v2"",""created"":""Sun, 21 Jul 2019 18:04:16 GMT""}]","2019-07-23"
"1801.00530","Feng Miao","Miao Wang, Songhua Cai, Chen Pan, Chenyu Wang, Xiaojuan Lian, Ye Zhuo,
  Kang Xu, Tianjun Cao, Xiaoqing Pan, Baigeng Wang, Shijun Liang, J. Joshua
  Yang, Peng Wang, Feng Miao","Robust memristors based on layered two-dimensional materials","To appear on Nature Electronics; 31 pages, 6 figures, 8 supplementary
  figures","Nature Electronics 1, 130 (2018)","10.1038/s41928-018-0021-4",,"cond-mat.mtrl-sci cond-mat.mes-hall physics.app-ph","http://arxiv.org/licenses/nonexclusive-distrib/1.0/","  Van der Waals heterostructure based on layered two-dimensional (2D) materials
offers unprecedented opportunities to create materials with atomic precision by
design. By combining superior properties of each component, such
heterostructure also provides possible solutions to address various challenges
of the electronic devices, especially those with vertical multilayered
structures. Here, we report the realization of robust memristors for the first
time based on van der Waals heterostructure of fully layered 2D materials
(graphene/MoS2-xOx/graphene) and demonstrate a good thermal stability lacking
in traditional memristors. Such devices have shown excellent switching
performance with endurance up to 107 and a record-high operating temperature up
to 340oC. By combining in situ high-resolution TEM and STEM studies, we have
shown that the MoS2-xOx switching layer, together with the graphene electrodes
and their atomically sharp interfaces, are responsible for the observed thermal
stability at elevated temperatures. A well-defined conduction channel and a
switching mechanism based on the migration of oxygen ions were also revealed.
In addition, the fully layered 2D materials offer a good mechanical flexibility
for flexible electronic applications, manifested by our experimental
demonstration of a good endurance against over 1000 bending cycles. Our results
showcase a general and encouraging pathway toward engineering desired device
properties by using 2D van der Waals heterostructures.
","[{""version"":""v1"",""created"":""Tue, 2 Jan 2018 00:02:56 GMT""}]","2018-06-05"
"1801.00531","Ryo Higuchi","Ryo Higuchi, Masami Ouchi, Yoshiaki Ono, Takatoshi Shibuya, Jun
  Toshikawa, Yuichi Harikane, Takashi Kojima, Yi-Kuan Chiang, Eiichi Egami,
  Nobunari Kashikawa, Roderik Overzier, Akira Konno, Akio K. Inoue, Kenji
  Hasegawa, Seiji Fujimoto, Tomotsugu Goto, Shogo Ishikawa, Kei Ito, Yutaka
  Komiyama, and Masayuki Tanaka","SILVERRUSH. VII. Subaru/HSC Identifications of 42 Protocluster
  Candidates at z~6-7 with the Spectroscopic Redshifts up to z=6.574:
  Implications for Cosmic Reionization",,,"10.3847/1538-4357/ab2192",,"astro-ph.GA","http://arxiv.org/licenses/nonexclusive-distrib/1.0/","  We report fourteen and twenty-eight protocluster candidates at z=5.7 and 6.6
over 14 and 19 deg^2 areas, respectively, selected from 2,230 (259) Lya
emitters (LAEs) photometrically (spectroscopically) identified with
Subaru/Hyper Suprime-Cam (HSC) deep images (Keck, Subaru, and Magellan spectra
and the literature data). Six out of the 42 protocluster candidates include
1-12 spectroscopically confirmed LAEs at redshifts up to z=6.574. By the
comparisons with the cosmological Lya radiative transfer (RT) model reproducing
LAEs with the reionization effects, we find that more than a half of these
protocluster candidates are progenitors of the present-day clusters with a mass
of > 10^14 M_sun. We then investigate the correlation between LAE overdensity
delta and Lya rest-frame equivalent width EW_Lya^rest, because the cosmological
Lya RT model suggests that a slope of EW_Lya^rest-delta relation is steepened
towards the epoch of cosmic reionization (EoR), due to the existence of the
ionized bubbles around galaxy overdensities easing the escape of Lya emission
from the partly neutral intergalactic medium (IGM). The available HSC data
suggest that the slope of the EW_Lya^rest-delta correlation does not evolve
from the post-reionization epoch z=5.7 to the EoR z=6.6 beyond the moderately
large statistical errors. There is a possibility that we would detect the
evolution of the EW_Lya^rest - delta relation from z=5.7 to 7.3 by the upcoming
HSC observations providing large samples of LAEs at z=6.6-7.3.
","[{""version"":""v1"",""created"":""Tue, 2 Jan 2018 00:18:27 GMT""},{""version"":""v2"",""created"":""Wed, 10 Jan 2018 07:55:35 GMT""}]","2019-07-10"
"1801.00532","Shaonan Wang","Shaonan Wang, Jiajun Zhang, Chengqing Zong","Learning Multimodal Word Representation via Dynamic Fusion Methods","To be appear in AAAI-18",,,,"cs.CL","http://arxiv.org/licenses/nonexclusive-distrib/1.0/","  Multimodal models have been proven to outperform text-based models on
learning semantic word representations. Almost all previous multimodal models
typically treat the representations from different modalities equally. However,
it is obvious that information from different modalities contributes
differently to the meaning of words. This motivates us to build a multimodal
model that can dynamically fuse the semantic representations from different
modalities according to different types of words. To that end, we propose three
novel dynamic fusion methods to assign importance weights to each modality, in
which weights are learned under the weak supervision of word association pairs.
The extensive experiments have demonstrated that the proposed methods
outperform strong unimodal baselines and state-of-the-art multimodal models.
","[{""version"":""v1"",""created"":""Tue, 2 Jan 2018 00:32:29 GMT""}]","2018-01-03"
"1801.00533","Michael Pitt","M. Pitt, P. M. M. Correia, S. Bressler, A. E. C. Coimbra, D. Shaked
  Renous, C. D. R. Azevedo, J. F. C. A. Veloso and A. Breskin","Measurements of charging-up processes in THGEM-based particle detectors",,,"10.1088/1748-0221/13/03/P03009",,"physics.ins-det hep-ex","http://arxiv.org/licenses/nonexclusive-distrib/1.0/","  The time-dependent gain variation of detectors incorporating Thick Gas
Electron Multipliers (THGEM) electrodes was studied in the context of
charging-up processes of the electrode's insulating surfaces. An experimental
study was performed to examine model-simulation results of the aforementioned
phenomena, under various experimental conditions. The results indicate that in
a stable detector's environment, the gain stabilization process is mainly
affected by the charging-up of the detector's insulating surfaces caused by the
avalanche charges. The charging-up is a transient effect, occurring during the
detector's initial operation period; it does not affect its long-term
operation. The experimental results are consistent with the outcome of
model-simulations.
","[{""version"":""v1"",""created"":""Tue, 2 Jan 2018 01:15:57 GMT""},{""version"":""v2"",""created"":""Tue, 9 Jan 2018 09:28:56 GMT""}]","2018-03-28"
"1801.00534","Mulin Li","Mu-Lin Li","Virtual residue and generalized Cayley- Bacharach Theorem",,,,,"math.AG math.CV","http://arxiv.org/licenses/nonexclusive-distrib/1.0/","  Using virtual residue, which is a generalization of Grothendieck residue, we
generalized Cayley- Bacharach Theorem to the cases with positive dimensions.
","[{""version"":""v1"",""created"":""Tue, 2 Jan 2018 02:36:34 GMT""},{""version"":""v2"",""created"":""Thu, 4 Jan 2018 02:02:05 GMT""}]","2018-01-08"
"1801.00535","Yuhao Yi","Yuhao Yi, Zhongzhi Zhang and Stacy Patterson","Scale-free Loopy Structure is Resistant to Noise in Consensus Dynamics
  in Complex Networks","10 pages, 4 figures",,,,"cs.SY cs.SI","http://arxiv.org/licenses/nonexclusive-distrib/1.0/","  The vast majority of real-world networks are scale-free, loopy, and sparse,
with a power-law degree distribution and a constant average degree. In this
paper, we study first-order consensus dynamics in binary scale-free networks,
where vertices are subject to white noise. We focus on the coherence of
networks characterized in terms of the $H_2$-norm, which quantifies how closely
agents track the consensus value. We first provide a lower bound of coherence
of a network in terms of its average degree, which is independent of the
network order. We then study the coherence of some sparse, scale-free
real-world networks, which approaches a constant. We also study numerically the
coherence of Barab\'asi-Albert networks and high-dimensional random Apollonian
networks, which also converges to a constant when the networks grow. Finally,
based on the connection of coherence and the Kirchhoff index, we study
analytically the coherence of two deterministically-growing sparse networks and
obtain the exact expressions, which tend to small constants. Our results
indicate that the effect of noise on the consensus dynamics in power-law
networks is negligible. We argue that scale-free topology, together with loopy
structure, is responsible for the strong robustness with respect to noisy
consensus dynamics in power-law networks.
","[{""version"":""v1"",""created"":""Tue, 2 Jan 2018 02:51:33 GMT""}]","2018-01-03"
