"1801.00569","Jeremie Houssineau","Jeremie Houssineau","Parameter estimation with a class of outer probability measures",,,,,"stat.ME","http://arxiv.org/licenses/nonexclusive-distrib/1.0/","  We explore the interplay between random and deterministic phenomena using a
representation of uncertainty based on the measure-theoretic concept of outer
measure. The meaning of the analogues of different probabilistic concepts is
investigated and examples of application are given. The novelty of this article
lies mainly in the suitability of the tools introduced for jointly representing
random and deterministic uncertainty. These tools are shown to yield intuitive
results in simple situations and to generalise easily to more complex cases.
Connections with Dempster-Shafer theory, the empirical Bayes methods and
generalised Bayesian inference are also highlighted.
","[{""version"":""v1"",""created"":""Tue, 2 Jan 2018 07:51:56 GMT""},{""version"":""v2"",""created"":""Thu, 14 Mar 2019 09:29:16 GMT""},{""version"":""v3"",""created"":""Mon, 11 Nov 2019 15:58:36 GMT""},{""version"":""v4"",""created"":""Sun, 19 Apr 2020 19:32:19 GMT""}]","2020-04-21"
"1801.00570","Qiang Li","Qiang Li, Yongxiang Li, Huanhuan Zhang","Periodic solutions for neutral evolution equations with delays",,,,,"math.FA math.AP","http://arxiv.org/licenses/nonexclusive-distrib/1.0/","  The aim is to study the periodic solution problem for neutral evolution
equation
  $$(u(t)-G(t,u(t-\xi)))'+Au(t)=F(t,u(t),u(t-\tau)),\ \ \ \ t\in\R$$in Banach
space $X$, where $A:D(A)\subset X\rightarrow X$ is a closed linear operator,
and $-A$ generates a compact analytic operator semigroup $T(t)(t\geq0)$.
  With the aid of the analytic operator semigroup theories and some fixed point
theorems, we obtain the existence and uniqueness of periodic mild solution for
neutral evolution equations. The regularity of periodic mild solution for
evolution equation with delay is studied, and some the existence results of the
classical and strong solutions are obtained. In the end, we give an example to
illustrate the applicability of abstract results. Our works greatly improve and
generalize the relevant results of existing literatures.
","[{""version"":""v1"",""created"":""Tue, 2 Jan 2018 07:57:54 GMT""}]","2018-01-03"
"1801.00571","Jeremie Houssineau","Jeremie Houssineau","A linear algorithm for multi-target tracking in the context of
  possibility theory",,,,,"stat.ME","http://arxiv.org/licenses/nonexclusive-distrib/1.0/","  We present a modelling framework for multi-target tracking based on
possibility theory and illustrate its ability to account for the general lack
of knowledge that the target-tracking practitioner must deal with when working
with real data. We also introduce and study variants of the notions of point
process and intensity function, which lead to the derivation of an analogue of
the probability hypothesis density (PHD) filter. The gains provided by the
considered modelling framework in terms of flexibility lead to the loss of some
of the abilities that the PHD filter possesses; in particular the estimation of
the number of targets by integration of the intensity function. Yet, the
proposed recursion displays a number of advantages such as facilitating the
introduction of observation-driven birth schemes and the modelling the absence
of information on the initial number of targets in the scene. The performance
of the proposed approach is demonstrated on simulated data.
","[{""version"":""v1"",""created"":""Tue, 2 Jan 2018 08:03:42 GMT""},{""version"":""v2"",""created"":""Tue, 14 Apr 2020 11:37:31 GMT""},{""version"":""v3"",""created"":""Mon, 8 Mar 2021 20:29:05 GMT""}]","2021-03-10"
"1801.00572","Abdelhakim Necir","Brahim Brahimi, Djamel Meraghni, Abdelhakim Necir, Louiza Soltane","Tail empirical process and weighted extreme value index estimator for
  randomly right-censored data",,,,,"math.ST stat.TH","http://creativecommons.org/licenses/by/4.0/","  A tail empirical process for heavy-tailed and right-censored data is
introduced and its Gaussian approximation is established. In this context, a
(weighted) new Hill-type estimator for positive extreme value index is proposed
and its consistency and asymptotic normality are proved by means of the
aforementioned process in the framework of second-order conditions of regular
variation. In a comparative simulation study, the newly defined estimator is
seen to perform better than the already existing ones in terms of both bias and
mean squared error. As a real data example, we apply our estimation procedure
to evaluate the tail index of the survival time of Australian male Aids
patients. It is noteworthy that our approach may also serve to develop other
statistics related to the distribution tail such as second-order parameter and
reduced-bias tail index estimators. Furthermore, the proposed tail empirical
process provides a goodness-of-fit test for Pareto-like models under
censorship.
","[{""version"":""v1"",""created"":""Tue, 2 Jan 2018 08:08:42 GMT""},{""version"":""v2"",""created"":""Fri, 12 Jan 2018 20:00:31 GMT""},{""version"":""v3"",""created"":""Tue, 16 Jan 2018 06:06:55 GMT""},{""version"":""v4"",""created"":""Sat, 3 Feb 2018 21:44:23 GMT""}]","2018-02-06"
"1801.00573","Qiang Li","Qiang Li, Yongxiang Li, Mei Wei","Positive periodic solutions for abstract evolution equations with delay",,,,,"math.FA math.AP","http://arxiv.org/licenses/nonexclusive-distrib/1.0/","  In this paper, we discuss the existence and asymptotic stability of the
positive periodic mild solutions for the abstract evolution equation with delay
in an ordered Banach space $E$, $$u'(t)+Au(t)=F(t,u(t),u(t-\tau)),\ \ \ \
t\in\R,$$ where $A:D(A)\subset E\rightarrow E$ is a closed linear operator and
$-A$ generates a positive $C_{0}$-semigroup $T(t)(t\geq0)$, $F:\R\times E\times
E\rightarrow E$ is a continuous mapping which is $\omega$-periodic in $t$.
  Under order conditions on the nonlinearity $F$ concerning the growth exponent
of the semigroup $T(t)(t\geq0)$ or the first eigenvalue of the operator $A$, we
obtain the existence and asymptotic stability results of the positive
$\omega$-periodic mild solutions by applying operator semigroup theory. In the
end, an example is given to illustrate the applicability of our abstract
results.
","[{""version"":""v1"",""created"":""Tue, 2 Jan 2018 08:09:37 GMT""}]","2018-01-03"
"1801.00574","Qiang Li","Qiang Li","Monotone iterative technique for delayed evolution equation periodic
  problems in Banach spaces",,,,,"math.FA math.AP","http://arxiv.org/licenses/nonexclusive-distrib/1.0/","  In this paper, we deal with the existence of $\omega$-periodic mild solutions
for the abstract evolution equation with delay in an ordered Banach space $E$
$$u'(t)+Au(t)=F(t,u(t),u(t-\tau)),\ \ \ \ t\in\R,$$ where $A:D(A)\subset
E\rightarrow E$ is a closed linear operator and $-A$ generates a positive
$C_{0}$-semigroup $T(t)(t\geq0)$, $F:\R\times E\times E\rightarrow E$ is a
continuous mapping which is $\omega$-periodic in $t$, and $\tau\geq0$ is a
constant. Under some weaker assumptions, we construct monotone iterative method
for the delayed evolution equation periodic problems, and obtain the existence
of maximal and minimal periodic mild solutions.
  The results obtained generalize the recent conclusions on this topic.
Finally, we present two applications to illustrate the feasibility of our
abstract results.
","[{""version"":""v1"",""created"":""Tue, 2 Jan 2018 08:13:10 GMT""}]","2018-01-03"
"1801.00575","Qiang Li","Qiang Li, Mei Wei","Existence and Asymptotic Stability of Periodic Solutions for Impulsive
  Delay Evolution Equations",,,,,"math.FA math.AP","http://arxiv.org/licenses/nonexclusive-distrib/1.0/","  In this paper, we are devoted to consider the periodic problem for the
impulsive evolution equations with delay in Banach space. By using operator
semigroups theory and fixed point theorem, we establish some new existence
theorems of periodic mild solutions for the equations. In addition, with the
aid of an integral inequality with impulsive and delay, we present essential
conditions on the nonlinear and impulse functions to guarantee that the
equations have an asymptotically stable $\omega$-periodic mild solution.
","[{""version"":""v1"",""created"":""Tue, 2 Jan 2018 08:18:13 GMT""}]","2018-01-03"
"1801.00576","Ulla Karhum\""aki","Ulla Karhum\""aki","Definably simple stable groups with finitary groups of automorphisms",,"J. symb. log. 84 (2019) 704-712","10.1017/jsl.2019.29",,"math.LO","http://arxiv.org/licenses/nonexclusive-distrib/1.0/","  We prove that infinite definably simple locally finite groups of finite
centraliser dimension are simple groups of Lie type over locally finite fields.
Then, we identify conditions on automorphisms of a stable group that make it
resemble the Frobenius maps, and allow us to classify definably simple stable
groups in the specific case when they admit such automorphisms.
","[{""version"":""v1"",""created"":""Tue, 2 Jan 2018 08:27:02 GMT""},{""version"":""v2"",""created"":""Mon, 12 Feb 2018 12:24:30 GMT""},{""version"":""v3"",""created"":""Sun, 15 Apr 2018 09:39:28 GMT""},{""version"":""v4"",""created"":""Wed, 16 May 2018 12:44:52 GMT""},{""version"":""v5"",""created"":""Thu, 28 Mar 2019 16:45:41 GMT""}]","2019-06-12"
"1801.00577","Leonardo Colombo","Anthony Bloch, Leonardo Colombo, Fernando Jim\'enez","The variational discretization of the constrained higher-order
  Lagrange-Poincar\'e equations","To appear in DCDS-A",,,,"math.DS cs.DM cs.SY math.NA math.OC","http://arxiv.org/licenses/nonexclusive-distrib/1.0/","  In this paper we investigate a variational discretization for the class of
mechanical systems in presence of symmetries described by the action of a Lie
group which reduces the phase space to a (non-trivial) principal bundle. By
introducing a discrete connection we are able to obtain the discrete
constrained higher-order Lagrange-Poincar\'e equations. These equations
describe the dynamics of a constrained Lagrangian system when the Lagrangian
function and the constraints depend on higher-order derivatives such as the
acceleration, jerk or jounces. The equations, under some mild regularity
conditions, determine a well defined (local) flow which can be used to define a
numerical scheme to integrate the constrained higher-order Lagrange-Poincar\'e
equations.
  Optimal control problems for underactuated mechanical systems can be viewed
as higher-order constrained variational problems. We study how a variational
discretization can be used in the construction of variational integrators for
optimal control of underactuated mechanical systems where control inputs act
soley on the base manifold of a principal bundle (the shape space). Examples
include the energy minimum control of an electron in a magnetic field and two
coupled rigid bodies attached at a common center of mass.
","[{""version"":""v1"",""created"":""Tue, 2 Jan 2018 08:29:16 GMT""},{""version"":""v2"",""created"":""Mon, 16 Jul 2018 13:28:30 GMT""}]","2018-07-17"
"1801.00578","Lorenzo Mascotto","Lorenzo Mascotto, Ilaria Perugia, Alexander Pichler","Non-conforming harmonic virtual element method: $h$- and $p$-versions",,,,,"math.NA","http://arxiv.org/licenses/nonexclusive-distrib/1.0/","  We study the $h$- and $p$-versions of non-conforming harmonic virtual element
methods (VEM) for the approximation of the Dirichlet-Laplace problem on a 2D
polygonal domain, providing quasi-optimal error bounds. Harmonic VEM do not
make use of internal degrees of freedom. This leads to a faster convergence, in
terms of the number of degrees of freedom, as compared to standard VEM.
Importantly, the technical tools used in our $p$-analysis can be employed as
well in the analysis of more general non-conforming finite element methods and
VEM. The theoretical results are validated in a series of numerical
experiments. The $hp$-version of the method is numerically tested,
demonstrating exponential convergence with rate given by the square root of the
number of degrees of freedom.
","[{""version"":""v1"",""created"":""Tue, 2 Jan 2018 08:32:19 GMT""},{""version"":""v2"",""created"":""Fri, 27 Jul 2018 08:27:48 GMT""}]","2018-07-30"
"1801.00579","Mu Chengfu","Dali Zhang, Chengfu Mu","Shape coexistence close to $N=50$ in the neutron-rich isotope $^{80}$Ge
  investigated by IBM-2","13 pages, 1 figure, accepted by Chinese Physics C","Chinese Physics C Vol. 42 (3), 034101 (2018)","10.1088/1674-1137/42/3/034101",,"nucl-th","http://arxiv.org/licenses/nonexclusive-distrib/1.0/","  The properties of the low-lying states, especially the relevant shape
coexistence in $^{80}$Ge close to one of most neutron-rich doubly magic nuclei
at $N=50$ and $Z=28$ have been investigated within the framework of the
proton-neutron interacting model (IBM-2). Based on the fact that the relative
energy of the $d$ neutron boson is different from proton bosons', the
calculated energy levels of low-lying states, $E2$ transition strengths can
reproduce the experimental data very well. Particularly, the first excited
state 0$^+_2$ is reproduced quite nicely, which is intimately related with the
shape coexistence phenomenon. And the $\rho^2(E0, 0^+_2\rightarrow0^+_1)$
transition strength has been predicted. The experimental data and theoretical
results indicate that both collective spherical and $\gamma$-soft vibration
structures coexist in $^{80}$Ge. Key words: $^{80}$Ge, low-lying states, $E0$
transition strengths, shape coexistence, IBM-2.
","[{""version"":""v1"",""created"":""Tue, 2 Jan 2018 08:44:47 GMT""}]","2018-03-14"
"1801.00580","Shunsuke Tsuji","Shunsuke Tsuji","A formula for the action of Dehn twists on HOMFLY-PT skein modules and
  its applications","63 pages, 66 figures",,,,"math.GT","http://arxiv.org/licenses/nonexclusive-distrib/1.0/","  We introduce a formula for the action of Dehn twists on the HOMFLY-PT type
skein module of a surface. As an application of the formula to mapping class
group, we give an embedding from the Torelli group of a surface $\Sigma_{g,1}$
of genus $g$ with non-empty connected boundary into the completed HOMFLY-PT
type skein algebra. As an application of the formula to integral homology
$3$-spheres, we construct an invariant $z(M) \in \mathbb{Q} [\rho ] [[h]]$ for
an integral homology $3$-sphere $M$. The invariant $z(M) \mod (h^{n+1})$ is a
finite type invariant of order $n$.
","[{""version"":""v1"",""created"":""Tue, 2 Jan 2018 08:46:55 GMT""}]","2018-01-03"
"1801.00581","Mohammed Bachir","Mohammed Bachir (UP1)","The space of probabilistic 1-lipschitz maps",,,,,"math.FA","http://arxiv.org/licenses/nonexclusive-distrib/1.0/","  We introduce and study a natural notion of probabilistic 1-Lipschitz maps. We
prove that the space of all probabilistic 1-Lipschitz maps defined on a
probabilistic metric space G is also a probabilistic metric space. Moreover,
when G is a group, then the space of all prob-abilistic 1-Lipschitz maps
defined on G can be endowed with a monoid structure. Then, we caracterize the
probabilistic invariant complete Menger groups by the space of all
probabilistic 1-Lipschitz maps in the sprit of the classical Banach-Stone
theorem.
","[{""version"":""v1"",""created"":""Tue, 2 Jan 2018 08:50:04 GMT""},{""version"":""v2"",""created"":""Wed, 17 Jan 2018 08:58:30 GMT""}]","2018-01-18"
"1801.00582","Emmanuel Royer","Youngju Choie, Fran\c{c}ois Dumas (LMBP), Fran\c{c}ois Martin (LMBP),
  Emmanuel Royer (LMBP)","Formal deformations of the algebra of Jacobi forms and Rankin-Cohen
  brackets",,,,,"math.NT math.RA","http://arxiv.org/licenses/nonexclusive-distrib/1.0/","  This work is devoted to the algebraic and arithmetic properties of
Rankin-Cohen brackets allowing to define and study them in several natural
situations of number theory. It focuses on the property of these brackets to be
formal deformations of the algebras on which they are defined, with related
questions on restriction-extension methods. The general algebraic results
developed here are applied to the study of formal deformations of the algebra
of weak Jacobi forms and their relation with the Rankin-Cohen brackets on
modular and quasimodular forms.
","[{""version"":""v1"",""created"":""Tue, 2 Jan 2018 08:54:05 GMT""},{""version"":""v2"",""created"":""Tue, 9 Feb 2021 08:27:50 GMT""}]","2021-02-10"
"1801.00583","Gechun Liang","Shuo Huang, Gechun Liang, Thaleia Zariphopoulou","An approximation scheme for semilinear parabolic PDEs with convex and
  coercive Hamiltonians","24 pages",,,,"math.OC cs.NA math.NA","http://arxiv.org/licenses/nonexclusive-distrib/1.0/","  We propose an approximation scheme for a class of semilinear parabolic
equations that are convex and coercive in their gradients. Such equations arise
often in pricing and portfolio management in incomplete markets and, more
broadly, are directly connected to the representation of solutions to backward
stochastic differential equations. The proposed scheme is based on splitting
the equation in two parts, the first corresponding to a linear parabolic
equation and the second to a Hamilton-Jacobi equation. The solutions of these
two equations are approximated using, respectively, the Feynman-Kac and the
Hopf-Lax formulae. We establish the convergence of the scheme and determine the
convergence rate, combining Krylov's shaking coefficients technique and
Barles-Jakobsen's optimal switching approximation.
","[{""version"":""v1"",""created"":""Tue, 2 Jan 2018 09:00:38 GMT""},{""version"":""v2"",""created"":""Thu, 5 Jul 2018 00:01:49 GMT""},{""version"":""v3"",""created"":""Mon, 4 Nov 2019 22:04:24 GMT""}]","2019-11-06"
"1801.00584","Bernhard C. Geiger","Clemens Bloechl, Rana Ali Amjad, Bernhard C. Geiger","Co-Clustering via Information-Theoretic Markov Aggregation","accepted for publication in IEEE Trans. on Knowledge and Data
  Engineering; (c) 2018 IEEE",,"10.1109/TKDE.2018.2846252",,"cs.LG cs.IT math.IT","http://arxiv.org/licenses/nonexclusive-distrib/1.0/","  We present an information-theoretic cost function for co-clustering, i.e.,
for simultaneous clustering of two sets based on similarities between their
elements. By constructing a simple random walk on the corresponding bipartite
graph, our cost function is derived from a recently proposed generalized
framework for information-theoretic Markov chain aggregation. The goal of our
cost function is to minimize relevant information loss, hence it connects to
the information bottleneck formalism. Moreover, via the connection to Markov
aggregation, our cost function is not ad hoc, but inherits its justification
from the operational qualities associated with the corresponding Markov
aggregation problem. We furthermore show that, for appropriate parameter
settings, our cost function is identical to well-known approaches from the
literature, such as Information-Theoretic Co-Clustering of Dhillon et al.
Hence, understanding the influence of this parameter admits a deeper
understanding of the relationship between previously proposed
information-theoretic cost functions. We highlight some strengths and
weaknesses of the cost function for different parameters. We also illustrate
the performance of our cost function, optimized with a simple sequential
heuristic, on several synthetic and real-world data sets, including the
Newsgroup20 and the MovieLens100k data sets.
","[{""version"":""v1"",""created"":""Tue, 2 Jan 2018 09:00:41 GMT""},{""version"":""v2"",""created"":""Fri, 15 Jun 2018 07:48:51 GMT""}]","2018-06-18"
"1801.00585","Hiroshi Okada","Kingman Cheung, Hiroshi Okada","A generalized one-loop neutrino mass model with charged particles","24 pages, 8 figures, 1 table; version accepted for publication in
  Physical Review D","Phys. Rev. D 97, 075027 (2018)","10.1103/PhysRevD.97.075027",,"hep-ph","http://arxiv.org/licenses/nonexclusive-distrib/1.0/","  We propose a radiative neutrino-mass model by introducing 3 generations of
fermion pairs $E^{-(N+1)/2} E^{+(N+1)/2}$ and a couple of multi-charged bosonic
doublet fields $\Phi_{N/2}, \Phi_{N/2+1}$, where $N=1,3,5,7,9$. We show that
the models can satisfy the neutrino masses and oscillation data, and are
consistent with lepton-flavor violations, the muon anomalous magnetic moment,
the oblique parameters, and the beta function of the $U(1)_Y$ hypercharge gauge
coupling. We also discuss the collider signals for various $N$, namely,
multi-charged leptons in the final state from the Drell-Yan production of
$E^{-(N+1)/2} E^{+(N+1)/2}$. In general, the larger the $N$ the more charged
leptons will appear in the final state.
","[{""version"":""v1"",""created"":""Tue, 2 Jan 2018 09:05:57 GMT""},{""version"":""v2"",""created"":""Sat, 31 Mar 2018 13:20:55 GMT""}]","2018-04-25"
"1801.00586","H M Bharath","H. M. Bharath, Matthew Boguslawski, Maryrose Barrios, Lin Xin and M.
  S. Chapman","Exploring Non-Abelian Geometric Phases in Spin-1 Ultracold Atoms","13 pages, 7 figures","Phys. Rev. Lett. 123, 173202 (2019)","10.1103/PhysRevLett.123.173202",,"cond-mat.quant-gas physics.atom-ph quant-ph","http://arxiv.org/licenses/nonexclusive-distrib/1.0/","  Non-Abelian and non-adiabatic variants of Berry's geometric phase have been
pivotal in the recent advances in fault tolerant quantum computation gates,
while Berry's phase itself is at the heart of the study of topological phases
of matter. The geometrical and topological properties of the phase space of
spin$-1$ quantum states is richer than that of spin$-1/2$ quantum states and is
relatively unexplored. For instance, the spin vector of a spin-1 system, unlike
that of a spin$-1/2$ system, can lie anywhere on or inside the Bloch sphere
representing the phase space. Recently, a generalization of Berry's phase that
encapsulates the topology of spin-1 quantum states has been formulated in J.
Math. Phys., 59(6), 062105. This geometric phase includes loops that go inside
the Bloch sphere and is carried by the tensor of spin fluctuations, unlike
Berry's phase which is carried by the global phase of the quantum state.
Furthermore, due to a mathematical singularity at the center of the Bloch
sphere, the class of loops that pass through the center are called singular
loops and are significant because their geometric phase is non-Abelian. In
contrast with Berry's phase for spin$-1/2$ systems, whose properties come from
the topology of a sphere, the properties of singular loop geometric phases come
from the topology of the real projective plane $\mathbb{RP}^2$, which is more
non-trivial. Here we use coherent control of ultracold $^{87}$Rb atoms in an
optical trap to experimentally explore this geometric phase for singular loops
in a spin-1 quantum system.
","[{""version"":""v1"",""created"":""Tue, 2 Jan 2018 09:24:34 GMT""},{""version"":""v2"",""created"":""Wed, 10 Apr 2019 12:02:49 GMT""}]","2019-10-30"
"1801.00587","Qian Yue","Jian-Ping Cheng, Ke-Jun Kang, Jian-Min Li, Jin Li, Yuan-Jing Li, Qian
  Yue, Zhi Zeng, Yun-Hua Chen, Shi-Yong Wu, Xiang-Dong Ji, Henry T. Wong","The China Jinping Underground Laboratory and its Early Science","19 pages, 11 figures","Annual Review of Nuclear and Particle Science 67, 231-251 (2017)","10.1146/annurev-nucl-102115-044842",,"hep-ex physics.ins-det","http://arxiv.org/licenses/nonexclusive-distrib/1.0/","  The China Jinping Underground Laboratory, inaugurated in 2010, is an
underground research facility with the deepest rock overburden and largest
space by volume in the world. The first-generation science programs include
dark matter searches conducted by the CDEX and PandaX experiments. These
activities are complemented by measurements of ambient radioactivity and
installation of low-background counting systems. Phase II of the facility is
being constructed, and its potential research projects are being formulated. In
this review, we discuss the history, key features, results, and status of this
facility and its experimental programs, as well as their future evolution and
plans.
","[{""version"":""v1"",""created"":""Tue, 2 Jan 2018 09:24:57 GMT""}]","2018-01-03"
