"1801.02182","Yajun Zhou","Yajun Zhou","On Laporta's 4-loop sunrise formulae","i+28 pages","Ramanujan J. (2019) 50:465--503","10.1007/s11139-018-0090-z",,"math.CA hep-th","http://arxiv.org/licenses/nonexclusive-distrib/1.0/","  We prove Laporta's conjecture\begin{align*}&\int_0^\infty\frac{\mathrm d\,
x_1}{x_1}\int_0^\infty\frac{\mathrm d\, x_2}{x_2}\int_0^\infty\frac{\mathrm d\,
x_3}{x_3}\int_0^\infty\frac{\mathrm d\,
x_4}{x_4}\frac{1}{\left(1+\sum^4_{k=1}x_k\right)\left(1+\sum^4_{k=1}\frac{1}{x_{k}}
\right)-1}\\={}&\frac43 \int_{0}^\pi\mathrm d\, \phi_1 \int_{0}^\pi\mathrm d\,
\phi_2\int_{0}^\pi\mathrm d\, \phi_3 \int_{0}^\pi\mathrm d\,
\phi_4\frac{1}{4-\sum_{k=1}^4\cos \phi_k}, \end{align*} which relates the
4-loop sunrise diagram in 2-dimensional quantum field theory to Watson's
integral for 4-dimensional hypercubic lattice. We also establish several
related integral identities proposed by Laporta, including a reduction of the
4-loop sunrise diagram to special values of Euler's gamma function and
generalized hypergeometric series:\begin{align*} \frac{4 \pi
^{5/2}}{\sqrt{3}}\left\{ \frac{\sqrt{3} }{2^6 }\left[\frac{\Gamma
\left(\frac{1}{3}\right)}{\sqrt{\pi}}\right]^9\, _4F_3\left(\left.
\begin{array}{c}\frac{1}{6},\frac{1}{3},\frac{1}{3},\frac{1}{2}\\[4pt]\frac{2}{3},\frac{5}{6},\frac{5}{6}\end{array}
\right|1\right)-\frac{2^{4}}{3}\left[\frac{\sqrt{\pi}}{\Gamma
\left(\frac{1}{3}\right)}\right]^9\, _4F_3\left(\left.
\begin{array}{c}\frac{1}{2},\frac{2}{3},\frac{2}{3},\frac{5}{6}\\[4pt]\frac{7}{6},\frac{7}{6},\frac{4}{3}\end{array}
\right|1\right) \right\}. \end{align*}
","[{""version"":""v1"",""created"":""Sun, 7 Jan 2018 12:50:15 GMT""}]","2019-11-14"
"1801.02183","Stefan Steinerberger","Stefan Steinerberger","Varadhan Asymptotics for the Heat Kernel on Finite Graphs",,,,,"math.AP math.SP","http://arxiv.org/licenses/nonexclusive-distrib/1.0/","  Let $G$ be a simple, finite graph and let $p_t(x,y)$ denote the heat kernel
on $G$. The purpose of this short note is to show that for $t \rightarrow 0^+$
$$ p_t(x,y) = \# \left\{\mbox{paths of
length}~d(x,y)~\mbox{between}~x~\mbox{and}~y\right\} \frac{t^{d(x,y)}}{d(x,y)!}
+ \mathcal{O}(t^{d(x,y)+1}),$$ where $d(x,y)$ is the usual Graph distance. This
is the discrete analogue of the classical Varadhan asymptotic for the heat
kernel on manifolds and refines a result of Keller, Lenz, M\""unch, Schmidt and
Telcs. The asymptotic behavior encapsulates additional geometric information:
if the Graph is bipartite, then the next term in the expansion is negative.
","[{""version"":""v1"",""created"":""Sun, 7 Jan 2018 12:55:13 GMT""},{""version"":""v2"",""created"":""Sun, 27 May 2018 15:49:59 GMT""},{""version"":""v3"",""created"":""Sat, 18 May 2019 18:34:46 GMT""}]","2019-05-21"
"1801.02184","Marlon  Ramos","Vivian Dornelas and Marlon Ramos and Celia Anteneodo","Impact of network randomness on multiple opinion dynamics",,,"10.1016/j.physa.2018.04.037",,"physics.soc-ph cs.SI","http://arxiv.org/licenses/nonexclusive-distrib/1.0/","  People often face the challenge of choosing among different options with
similar attractiveness. To study the distribution of preferences that emerge in
such situations, a useful approach is to simulate opinion dynamics on top of
complex networks, composed by nodes (individuals) and their connections
(edges), where the state of each node can be one amongst several opinions
including the undecided state. We use two different dynamics rules: the one
proposed by Travieso-Fontoura (TF) and the plurality rule (PR), which are
paradigmatic of outflow and inflow dynamics, respectively. We are specially
interested in the impact of the network randomness on the final distribution of
opinions. For that purpose, we consider Watts-Strogatz networks, which possess
the small-world property, and where randomness is controlled by a probability
$p$ of adding random shortcuts to an initially regular network. Depending on
the value of $p$, the average connectivity $\langle k \rangle$, and the initial
conditions, the final distribution can be basically (i) consensus, (ii)
coexistence of different options, or (iii) predominance of indecision. We find
that, in both dynamics, the predominance of a winning opinion is favored by
increasing the number of reconnections (shortcuts), promoting consensus. In
contrast to the TF case, in the PR dynamics, a fraction of undecided nodes can
persist in the final state. In such cases, a maximum number of undecided nodes
occurs within the small-world region, due to ties in the decision group.
","[{""version"":""v1"",""created"":""Sun, 7 Jan 2018 13:05:56 GMT""}]","2018-04-27"
"1801.02185","Naomi van der Kolk","Naomi van der Kolk (for the ALICE FoCal Collaboration)","Detailed Measurements of Shower Properties in a High Granularity Digital
  Electromagnetic Calorimeter","Proceedings of CHEF 2017, 2-6 October 2017, Lyon, France",,"10.1088/1748-0221/13/03/C03030",,"physics.ins-det","http://arxiv.org/licenses/nonexclusive-distrib/1.0/","  The MAPS prototype of the proposed ALICE Forward Calorimeter (FoCal) is the
highest granularity electromagnetic calorimeter, with 39 million pixels of $30
\times 30 \mu$m$^{2}$. Particle showers can be studied with unprecedented
detail with this prototype. Electromagnetic showers at energies between 2 GeV
and 244 GeV have been studied and compared to Geant4 simulations. Simulation
models can be tested in more detail than ever before and the differences
observed between FoCal data and Geant4 simulations illustrates that
improvements in electromagnetic models are still possible.
","[{""version"":""v1"",""created"":""Sun, 7 Jan 2018 13:06:51 GMT""}]","2018-07-01"
"1801.02186","Behnaz Omoomi","Behnaz Omoomi and Maryam Taleb","Clique-coloring of $K_{3,3}$-minor free graphs","13 pages, 2 figures",,,,"math.CO cs.DM","http://arxiv.org/licenses/nonexclusive-distrib/1.0/","  A clique-coloring of a given graph $G$ is a coloring of the vertices of $G$
such that no maximal clique of size at least two is monocolored. The
clique-chromatic number of $G$ is the least number of colors for which $G$
admits a clique-coloring. It has been proved that every planar graph is
$3$-clique colorable and every claw-free planar graph, different from an odd
cycle, is $2$-clique colorable. In this paper, we generalize these results to
$K_{3,3}$-minor free ($K_{3,3}$-subdivision free) graphs.
","[{""version"":""v1"",""created"":""Sun, 7 Jan 2018 13:11:19 GMT""},{""version"":""v2"",""created"":""Sun, 15 Sep 2019 10:54:15 GMT""}]","2019-09-17"
"1801.02187","Xin Zhang","Rui-Yun Guo, Lei Zhang, Jing-Fei Zhang, Xin Zhang","Constraints on brane inflation after Planck 2015: Impacts of the latest
  local measurement of the Hubble constant","9 pages, 4 figures","Sci. China Phys. Mech. Astron. 62 (2019) no.3, 30411","10.1007/s11433-018-9278-1",,"astro-ph.CO gr-qc hep-ph","http://arxiv.org/licenses/nonexclusive-distrib/1.0/","  We investigate the observational constraints on three typical brane inflation
models by considering the latest local measurement of the Hubble constant in
the global fit. We also employ other observational data, including the Planck
2015 CMB data, the BICEP2/Keck Array B-mode data, and the baryon acoustic
oscillations data, in our analysis. Previous studies have shown that the
addition of the latest local $H_{0}$ measurement favors a larger spectral
index, and can exert a significant influence on the model selection of
inflation. In this work, we investigate its impacts on the status of brane
inflation models. We find that, when the direct $H_{0}$ measurement is
considered, the prototype model of brane inflation is still in good agreement
with the current observational data within the $2\sigma$ level range. For the
KKLMMT model, the consideration of the $H_{0}$ measurement allows the range of
the parameter $\beta$ to be amplified to ${\cal O}(10^{-2})$, which slightly
alleviates the fine-tuning problem. For the IR DBI model, the addition of the
$H_{0}$ measurement does not provide a better fit. These results show that the
consideration of the new $H_{0}$ prior can exert a considerable influence on
the brane inflation models. At last, we show that, when $\beta \lesssim 1.1$,
the equilateral non-Gaussianity in the IR DBI inflation model is compatible
with the current CMB data at the 1$\sigma$ level.
","[{""version"":""v1"",""created"":""Sun, 7 Jan 2018 13:15:12 GMT""},{""version"":""v2"",""created"":""Wed, 11 Jul 2018 08:04:39 GMT""}]","2018-11-30"
"1801.02188","Anil K. Pradhan","Lianshui Zhao, Werner Eissner, Sultana N. Nahar and Anil K. Pradhan","Converged Close-Coupling R-Matrix calculations of Photoionization of Fe
  XVII in Astrophysical Plasmas: from Convergence to Completeness","5 pages, 2 figures, Proc. Workshop on Astrophysical Opacities 2017,
  PASP",,,,"astro-ph.SR physics.atm-clus physics.atom-ph","http://arxiv.org/licenses/nonexclusive-distrib/1.0/","  Extensive resonance structures are manifest in R-Matrix (RM) calculations.
However, there exist a large number of highly excited electronic configurations
that may contribute to background non-resonant bound-free opacity in
high-temperature plasmas. Since RM calculations are very complex, and not
essential for background contributions, the Relativistic Distorted Wave (RDW)
method is utilized to complement (""top-up"") photoionization cross sections of
Fe XVII obtained using Close-Coupling Breit-Pauli R-Matrix (CC-BPRM) method.
There is good agreement between RDW and BPRM for background cross sections
where resonances are not present, and individual fine structure levels can be
correctly matched spectroscopically, though resonances are neglected in the
RDW. To ensure completeness, a high energy range up to 500 Ry above the
ionization threshold for each level is considered. Interestingly, the
hydrogenic Kramer's approximation also shows the same energy behavior as the
RDW. Grouping separately, the BPRM configurations consist of 454 bound levels
with resonances corresponding to configurations $1s^22s^22p^4nln'l'$ (n $\leq$
3, n' $\leq$ 10); including RDW configurations there are 51,558 levels in
total. The topup contribution results in $\sim$20\% increment, in addition to
the 35\% enhancement from BPRM calculations over the Opacity Project value for
the Rosseland Mean Opacity at the Z-temperature of 2.11 $\times 10^6$K (Pradhan
and Nahar 2017).
","[{""version"":""v1"",""created"":""Sun, 7 Jan 2018 13:27:39 GMT""}]","2018-01-09"
"1801.02189","Yann Apertet","Y. Apertet","Comment on ""Optical Imaging of Light-Induced Thermopower in
  Semiconductor"" [Phys. Rev. Applied 5, 024005 (2016)]",,"Phys. Rev. Applied 9, 038001 (2018)","10.1103/PhysRevApplied.9.038001",,"cond-mat.mtrl-sci","http://arxiv.org/licenses/nonexclusive-distrib/1.0/","  In a recent article [Phys. Rev. Applied 5, 024005 (2016)], Gibelli and
coworkers proposed a method to determine the thermopower, i.e. the Seebeck
coefficient, using photoluminescence measurements. The photoluminescence
spectra are used to obtain the local gradients of both the electrochemical
potential difference between electron and holes and the temperature of the
electron-hole plasma. However, the definition of the thermopower given in that
article seems erroneous due to a confusion between the different physical
quantities needed to derive this parameter.
","[{""version"":""v1"",""created"":""Sun, 7 Jan 2018 13:34:18 GMT""}]","2018-03-20"
"1801.02190","Stylianos Venieris","Michalis Rizakis, Stylianos I. Venieris, Alexandros Kouris and
  Christos-Savvas Bouganis","Approximate FPGA-based LSTMs under Computation Time Constraints","Accepted at the 14th International Symposium in Applied
  Reconfigurable Computing (ARC) 2018",,,,"cs.CV cs.AR cs.LG","http://arxiv.org/licenses/nonexclusive-distrib/1.0/","  Recurrent Neural Networks and in particular Long Short-Term Memory (LSTM)
networks have demonstrated state-of-the-art accuracy in several emerging
Artificial Intelligence tasks. However, the models are becoming increasingly
demanding in terms of computational and memory load. Emerging latency-sensitive
applications including mobile robots and autonomous vehicles often operate
under stringent computation time constraints. In this paper, we address the
challenge of deploying computationally demanding LSTMs at a constrained time
budget by introducing an approximate computing scheme that combines iterative
low-rank compression and pruning, along with a novel FPGA-based LSTM
architecture. Combined in an end-to-end framework, the approximation method's
parameters are optimised and the architecture is configured to address the
problem of high-performance LSTM execution in time-constrained applications.
Quantitative evaluation on a real-life image captioning application indicates
that the proposed methods required up to 6.5x less time to achieve the same
application-level accuracy compared to a baseline method, while achieving an
average of 25x higher accuracy under the same computation time constraints.
","[{""version"":""v1"",""created"":""Sun, 7 Jan 2018 13:46:03 GMT""}]","2018-01-10"
"1801.02191","Gregory Adkins","Gregory S. Adkins","The hydrogen atom in $D=3-2\epsilon$ dimensions","5 pages",,"10.1016/j.physleta.2018.03.048",,"quant-ph hep-ph","http://arxiv.org/licenses/nonexclusive-distrib/1.0/","  The nonrelativistic hydrogen atom in $D=3-2\epsilon$ dimensions is the
reference system for perturbative schemes used in dimensionally regularized
nonrelativistic effective field theories to describe hydrogen-like atoms.
Solutions to the $D$-dimensional Schr\""odinger-Coulomb equation are given in
the form of a double power series. Energies and normalization integrals are
obtained numerically and also perturbatively in terms of $\epsilon$. The
utility of the series expansion is demonstrated by the calculation of the
divergent expectation value $\langle (V')^2 \rangle$.
","[{""version"":""v1"",""created"":""Sun, 7 Jan 2018 14:05:02 GMT""}]","2018-05-09"
"1801.02192","Chun-Wang Ma","Chun-Wang Ma, Yu-Gang Ma","Shannon Information Entropy in Heavy-ion Collisions","56 pages, 19 figures.Version accepted by Progress in Particle and
  Nuclear Physics. To be published in 2018","Progress in Particle and Nuclear Physics, 99 (2018) 120","10.1016/j.ppnp.2018.01.002",,"nucl-th cs.IT math.IT","http://arxiv.org/licenses/nonexclusive-distrib/1.0/","  The general idea of information entropy provided by C.E. Shannon ""hangs over
everything we do"" and can be applied to a great variety of problems once the
connection between a distribution and the quantities of interest is found. The
Shannon information entropy essentially quantify the information of a quantity
with its specific distribution, for which the information entropy based methods
have been deeply developed in many scientific areas including physics. The
dynamical properties of heavy-ion collisions (HICs) process make it difficult
and complex to study the nuclear matter and its evolution, for which Shannon
information entropy theory can provide new methods and observables to
understand the physical phenomena both theoretically and experimentally. To
better understand the processes of HICs, the main characteristics of typical
models, including the quantum molecular dynamics models, thermodynamics models,
and statistical models, etc, are briefly introduced. The typical applications
of Shannon information theory in HICs are collected, which cover the chaotic
behavior in branching process of hadron collisions, the liquid-gas phase
transition in HICs, and the isobaric difference scaling phenomenon for
intermediate mass fragments produced in HICs of neutron-rich systems. Even
though the present applications in heavy-ion collision physics are still
relatively simple, it would shed light on key questions we are seeking for. It
is suggested to further develop the information entropy methods in nuclear
reactions models, as well as to develop new analysis methods to study the
properties of nuclear matters in HICs, especially the evolution of dynamics
system.
","[{""version"":""v1"",""created"":""Sun, 7 Jan 2018 14:06:02 GMT""}]","2018-02-20"
"1801.02193","Michal \v{C}ertick\'y","Michal \v{S}ustr, Jan Mal\'y, Michal \v{C}ertick\'y","Multi-platform Version of StarCraft: Brood War in a Docker Container:
  Technical Report",,,,,"cs.AI","http://arxiv.org/licenses/nonexclusive-distrib/1.0/","  We present a dockerized version of a real-time strategy game StarCraft: Brood
War, commonly used as a domain for AI research, with a pre-installed collection
of AI developement tools supporting all the major types of StarCraft bots. This
provides a convenient way to deploy StarCraft AIs on numerous hosts at once and
across multiple platforms despite limited OS support of StarCraft. In this
technical report, we describe the design of our Docker images and present a few
use cases.
","[{""version"":""v1"",""created"":""Sun, 7 Jan 2018 14:16:59 GMT""}]","2018-01-09"
"1801.02194","David Karpuk","David Karpuk","Private Computation of Systematically Encoded Data with Colluding
  Servers","Submitted to IEEE International Symposium on Information Theory 2018.
  Version 2 fixes some typos and adds some clarifying remarks",,,,"cs.IT math.IT","http://arxiv.org/licenses/nonexclusive-distrib/1.0/","  Private Computation (PC), recently introduced by Sun and Jafar, is a
generalization of Private Information Retrieval (PIR) in which a user wishes to
privately compute an arbitrary function of data stored across several servers.
We construct a PC scheme which accounts for server collusion, coded data, and
non-linear functions. For data replicated over several possibly colluding
servers, our scheme computes arbitrary functions of the data with rate equal to
the asymptotic capacity of PIR for this setup. For systematically encoded data
stored over colluding servers, we privately compute arbitrary functions of the
columns of the data matrix and calculate the rate explicitly for polynomial
functions. The scheme is a generalization of previously studied star-product
PIR schemes.
","[{""version"":""v1"",""created"":""Sun, 7 Jan 2018 14:21:58 GMT""},{""version"":""v2"",""created"":""Sat, 13 Jan 2018 13:37:38 GMT""}]","2018-01-16"
"1801.02195","Christian Scheuerlein","Christian Scheuerlein, Marco Di Michiel","X-ray studies: Phase transformations and microstructure changes","16 pages, 12 figures, to appear in: Handbook of Superconducting
  Materials, Second Edition, eds. D. Cardwell and D.C. Larbalestier. (Boca
  Raton: CRC Press/Taylor & Francis Group, Forthcoming 2018)",,,,"physics.app-ph cond-mat.mtrl-sci","http://arxiv.org/licenses/nonexclusive-distrib/1.0/","  The goal of this chapter is to illustrate the potential of high energy
synchrotron radiation experiments for in situ studies of the processing of
superconductors. We present case studies describing the Nb3Sn wire diffusion
HT, the transformation HT of Nb3Al precursor wires, and the melt processing HT
of Bi 2212 wires.
","[{""version"":""v1"",""created"":""Sun, 7 Jan 2018 14:43:27 GMT""}]","2018-01-09"
"1801.02196","Victor Kashevarov","V.L. Kashevarov, L. Tiator, M. Ostrick","$\eta$ and $\eta'$ photoproduction with EtaMAID including Regge
  phenomenology","5 pages, 5 figures, talk presented at the Mini-Workshop ""Advances in
  Hadronic Resonances"", Bled, Slovenia, July 2-9, 2017","Bled Workshops in Physics, Vol. 18, No. 1 (2017) p. 1-5",,,"hep-ph nucl-ex nucl-th","http://arxiv.org/licenses/nonexclusive-distrib/1.0/","  We present a new version of the EtaMAID model for $\eta$ and $\eta'$
photoproduction on nucleons. The model includes 23 nucleon resonances
parameterized with Breit-Wigner shapes. The background is described by vector
and axial-vector meson exchanges in the $t$ channel using the Regge cut
phenomenology. Parameters of the resonances were obtained from a fit to
available experimental data for $\eta$ and $\eta'$ photoproduction on protons
and neutrons. The nature of the most interesting observations in the data is
discussed.
","[{""version"":""v1"",""created"":""Sun, 7 Jan 2018 14:44:56 GMT""}]","2018-01-09"
"1801.02197","Alexander Braun","Christian Wittpahl, Hatem Ben Zakour, Matthias Lehmann, Alexander
  Braun","Realistic Image Degradation with Measured PSF","5 pages, 12 figures, submitted and accepted for IS&T Electronic
  Imaging, Autonomous Vehicles and Machines 2018",,,,"eess.IV astro-ph.IM","http://arxiv.org/licenses/nonexclusive-distrib/1.0/","  Training autonomous vehicles requires lots of driving sequences in all
situations\cite{zhao2016}. Typically a simulation environment
(software-in-the-loop, SiL) accompanies real-world test drives to
systematically vary environmental parameters. A missing piece in the optical
model of those SiL simulations is the sharpness, given in linear system theory
by the point-spread function (PSF) of the optical system. We present a novel
numerical model for the PSF of an optical system that can efficiently model
both experimental measurements and lens design simulations of the PSF. The
numerical basis for this model is a non-linear regression of the PSF with an
artificial neural network (ANN). The novelty lies in the portability and the
parameterization of this model, which allows to apply this model in basically
any conceivable optical simulation scenario, e.g. inserting a measured lens
into a computer game to train autonomous vehicles. We present a lens
measurement series, yielding a numerical function for the PSF that depends only
on the parameters defocus, field and azimuth. By convolving existing images and
videos with this PSF model we apply the measured lens as a transfer function,
therefore generating an image as if it were seen with the measured lens itself.
Applications of this method are in any optical scenario, but we focus on the
context of autonomous driving, where quality of the detection algorithms
depends directly on the optical quality of the used camera system. With the
parameterization of the optical model we present a method to validate the
functional and safety limits of camera-based ADAS based on the real, measured
lens actually used in the product.
","[{""version"":""v1"",""created"":""Sun, 7 Jan 2018 15:04:52 GMT""}]","2018-01-09"
"1801.02198","Kaan Bing\""ol","Kaan Bing\""ol, Bahaeddin Eravc{\i}, \c{C}a\u{g}r{\i} \""Ozgen\c{c}
  Etemo\u{g}lu, Hakan Ferhatosmano\u{g}lu, Bu\u{g}ra Gedik","Topic-Based Influence Computation in Social Networks under Resource
  Constraints",,,"10.1109/TSC.2016.2619688",,"cs.SI physics.soc-ph","http://arxiv.org/licenses/nonexclusive-distrib/1.0/","  As social networks are constantly changing and evolving, methods to analyze
dynamic social networks are becoming more important in understanding social
trends. However, due to the restrictions imposed by the social network service
providers, the resources available to fetch the entire contents of a social
network are typically very limited. As a result, analysis of dynamic social
network data requires maintaining an approximate copy of the social network for
each time period, locally. In this paper, we study the problem of dynamic
network and text fetching with limited probing capacities, for identifying and
maintaining influential users as the social network evolves. We propose an
algorithm to probe the relationships (required for global influence
computation) as well as posts (required for topic-based influence computation)
of a limited number of users during each probing period, based on the influence
trends and activities of the users. We infer the current network based on the
newly probed user data and the last known version of the network maintained
locally. Additionally, we propose to use link prediction methods to further
increase the accuracy of our network inference. We employ PageRank as the
metric for influence computation. We illustrate how the proposed solution
maintains accurate PageRank scores for computing global influence, and
topic-sensitive weighted PageRank scores for topic-based influence. The latter
relies on a topic-based network constructed via weights determined by semantic
analysis of posts and their sharing statistics. We evaluate the effectiveness
of our algorithms by comparing them with the true influence scores of the full
and up-to-date version of the network, using data from the micro-blogging
service Twitter. Results show that our techniques significantly outperform
baseline methods and are superior to state-of-the-art techniques from the
literature.
","[{""version"":""v1"",""created"":""Sun, 7 Jan 2018 15:20:34 GMT""}]","2018-01-09"
