"1801.02129","Chao Luo","Chao Luo, Yih-Fang Huang, and Vijay Gupta","Placement of EV Charging Stations --- Balancing Benefits among Multiple
  Entities","10 pages, 10 figures","IEEE Transactions on Smart Grid, vol. 8, no. 2, pp. 759 - 768,
  2015","10.1109/TSG.2015.2508740",,"eess.SP cs.GT econ.EM math.OC","http://creativecommons.org/licenses/by/4.0/","  This paper studies the problem of multi-stage placement of electric vehicle
(EV) charging stations with incremental EV penetration rates. A nested logit
model is employed to analyze the charging preference of the individual consumer
(EV owner), and predict the aggregated charging demand at the charging
stations. The EV charging industry is modeled as an oligopoly where the entire
market is dominated by a few charging service providers (oligopolists). At the
beginning of each planning stage, an optimal placement policy for each service
provider is obtained through analyzing strategic interactions in a Bayesian
game. To derive the optimal placement policy, we consider both the
transportation network graph and the electric power network graph. A simulation
software --- The EV Virtual City 1.0 --- is developed using Java to investigate
the interactions among the consumers (EV owner), the transportation network
graph, the electric power network graph, and the charging stations. Through a
series of experiments using the geographic and demographic data from the city
of San Pedro District of Los Angeles, we show that the charging station
placement is highly consistent with the heatmap of the traffic flow. In
addition, we observe a spatial economic phenomenon that service providers
prefer clustering instead of separation in the EV charging market.
","[{""version"":""v1"",""created"":""Sun, 7 Jan 2018 04:57:27 GMT""}]","2018-01-09"
"1801.02130","Rafegh Aghamohammadi","Rafegh Aghamohammadi, Jorge A. Laval","Dynamic Traffic Assignment using the Macroscopic Fundamental Diagram: A
  Review of Vehicular and Pedestrian Flow Models",,,"10.1016/j.trb.2018.10.017",,"math.AP","http://arxiv.org/licenses/nonexclusive-distrib/1.0/","  Traditional DTA models of large cities suffer from prohibitive computation
times and calibration/validation can become major challenges faced by
practitioners. The empirical evidence in 2008 in support of the existence of a
Macroscopic Fundamental Diagram (MFD) on urban networks led to the formulation
of discrete-space models, where the city is divided into a collection of
reservoirs. Prior to 2008, a large body of DTA models based on pedestrian flow
models had been formulated in continuum space as 2-dimensional conservation
laws where the speed-density relationship can now be interpreted as the MFD.
Perhaps surprisingly, we found that this continuum-space literature has been
mostly unaware of MFD theory, and no attempts exist to verify the assumptions
of MFD theory. This has the potential to create significant inconsistencies,
and research is needed to analyze their extent and ways to resolve them. We
also find that further research is needed to (i) incorporate departure time
choice, (ii) improve existing numerical methods, possibly extending recent
advances on the one-dimensional kinematic wave (LWR) model, (iii) study the
properties of system optimum solutions, (iv) examine the real-time
applicability of current continuum-space models compared to traditional DTA
methods, and (v) formulate anisotropic models for the interaction of
intersecting flows.
","[{""version"":""v1"",""created"":""Sun, 7 Jan 2018 05:11:36 GMT""}]","2018-12-04"
"1801.02131","Tim Byrnes","Sergi Ortiz, Yilun Song, June Wu, Valentin Ivannikov, Tim Byrnes","Adiabatic entangling gate of Bose-Einstein condensates based on the
  minimum function",,"Phys. Rev. A 98, 043616 (2018)","10.1103/PhysRevA.98.043616",,"cond-mat.quant-gas physics.atom-ph quant-ph","http://arxiv.org/licenses/nonexclusive-distrib/1.0/","  A scheme is presented to perform an entangling gate between two atomic
ensembles or Bose-Einstein condensates in a optical cavity with a common
optical mode. The method involves using a generalized Stimulated Raman
Adiabatic Passage (STIRAP) to adiabatically evolve the ground state. We show
that dark states exist for any atom number within the cavities, and find that
the operation produces an unusual type of evolution where the minimum of the
number of atoms between two levels transitions to another state. This produces
a unconventional type of entangling Hamiltonian which creates a phase depending
on the minimum operation. We analyze its reliability under a variety of
conditions ranging from the ideal decoherence-free case to that including
photon loss and spontaneous emission. Ways of combating decoherence are
analyzed and the amount of entanglement that is generated is calculated.
","[{""version"":""v1"",""created"":""Sun, 7 Jan 2018 05:16:22 GMT""},{""version"":""v2"",""created"":""Sat, 27 Oct 2018 03:58:52 GMT""}]","2018-10-30"
"1801.02132","Derek Frydel","Derek Frydel and Yan Levin","Two-component Gaussian core model: strong-coupling limit, Bjerrum pairs,
  and gas-liquid phase transition",,"J. Chem. Phys. (2018)","10.1063/1.5006947",,"cond-mat.soft","http://arxiv.org/licenses/nonexclusive-distrib/1.0/","  In the present work we investigate a gas-liquid transition in a two-component
Gaussian core model, where particles of the same species repel and those of
different species attract. Unlike a similar transition in a one-component
system with particles having attractive interactions at long separations, and
repulsive interactions at short separations, a transition in the two-component
system is not driven solely by interactions, but by a specific feature of the
interactions, the correlations. This leads to extremely low critical
temperature, as correlations are dominant in the strong-coupling limit. By
carrying out various approximations based on standard liquid-state methods, we
show that a gas-liquid transition of the two-component system posses a
challenging theoretical problem.
","[{""version"":""v1"",""created"":""Sun, 7 Jan 2018 05:23:35 GMT""}]","2018-02-14"
"1801.02133","Jinhee Lee","Jinhee Lee and Inseok Song","Bayesian assessment of moving group membership: importance of models and
  prior knowledge","18 pages, 17 figures; MNRAS, in press",,"10.1093/mnras/stx3195",,"astro-ph.SR","http://arxiv.org/licenses/nonexclusive-distrib/1.0/","  Young nearby moving groups are important and useful in many fields of
astronomy such as studying exoplanets, low-mass stars, and the stellar
evolution of the early planetary systems over tens of millions of years, which
has led to intensive searches for their members. Identification of members
depends on the used models sensitively, therefore, careful examination of the
models is required. In this study, we investigate the effects of the models
used in moving group membership calculations based on a Bayesian framework
(e.g., BANYAN II) focusing on the beta-Pictoris moving group (BPMG). Three
improvements for building models are suggested: (1) updating a list of accepted
members by re-assessing memberships in terms of position, motion, and age, (2)
investigating member distribution functions in $XYZ$, and (3) exploring field
star distribution functions in $XYZ$ and $UVW$. The effect of each change is
investigated, and we suggest using all of these improvements simultaneously in
future membership probability calculations. Using this improved MG membership
calculation and the careful examination of the age, 57 bona fide members of
BPMG are confirmed including 12 new members. We additionally suggest 17 highly
probable members.
","[{""version"":""v1"",""created"":""Sun, 7 Jan 2018 05:25:12 GMT""}]","2018-02-21"
"1801.02134","Somayeh Kafaie","Somayeh Kafaie, Yuanzhu Chen, Mohamed Hossam Ahmed, Octavia A. Dobre","FlexONC: Joint Cooperative Forwarding and Network Coding with Precise
  Encoding Conditions","15 pages, 27 figures","IEEE Transactions on Vehicular Technology, Vol. 66, No. 8, pp.
  7262-7277, Aug. 2017",,,"cs.NI","http://arxiv.org/licenses/nonexclusive-distrib/1.0/","  In recent years, network coding has emerged as an innovative method that
helps a wireless network approach its maximum capacity, by combining multiple
unicasts in one broadcast. However, the majority of research conducted in this
area is yet to fully utilize the broadcasting nature of wireless networks, and
still assumes fixed route between the source and destination that every packet
should travel through. This assumption not only limits coding opportunities,
but can also cause buffer overflow in some specific intermediate nodes.
Although some studies considered scattering of the flows dynamically in the
network, they still face some limitations. This paper explains pros and cons of
some prominent research in network coding and proposes a Flexible and
Opportunistic Network Coding scheme (FlexONC) as a solution to such issues.
Furthermore, this research discovers that the conditions used in previous
studies to combine packets of different flows are overly optimistic and would
affect the network performance adversarially. Therefore, we provide a more
accurate set of rules for packet encoding. The experimental results show that
FlexONC outperforms previous methods especially in networks with high bit error
rate, by better utilizing redundant packets spread in the network.
","[{""version"":""v1"",""created"":""Sun, 7 Jan 2018 05:28:09 GMT""}]","2018-01-09"
"1801.02135","Chao Luo","Chao Luo, Yih-Fang Huang, and Vijay Gupta","A Consumer Behavior Based Approach to Multi-Stage EV Charging Station
  Placement","7 pages, 5 figures, Vehicular Technology Conference (VTC Spring),
  2015 IEEE 81st. arXiv admin note: text overlap with arXiv:1801.02129",,"10.1109/VTCSpring.2015.7145593",,"eess.SP cs.GT econ.EM math.OC","http://creativecommons.org/licenses/by/4.0/","  This paper presents a multi-stage approach to the placement of charging
stations under the scenarios of different electric vehicle (EV) penetration
rates. The EV charging market is modeled as the oligopoly. A consumer behavior
based approach is applied to forecast the charging demand of the charging
stations using a nested logit model. The impacts of both the urban road network
and the power grid network on charging station planning are also considered. At
each planning stage, the optimal station placement strategy is derived through
solving a Bayesian game among the service providers. To investigate the
interplay of the travel pattern, the consumer behavior, urban road network,
power grid network, and the charging station placement, a simulation platform
(The EV Virtual City 1.0) is developed using Java on Repast.We conduct a case
study in the San Pedro District of Los Angeles by importing the geographic and
demographic data of that region into the platform. The simulation results
demonstrate a strong consistency between the charging station placement and the
traffic flow of EVs. The results also reveal an interesting phenomenon that
service providers prefer clustering instead of spatial separation in this
oligopoly market.
","[{""version"":""v1"",""created"":""Sun, 7 Jan 2018 05:29:06 GMT""}]","2018-01-10"
"1801.02136","Ambrish Kumar Srivastava","Ambrish Kumar Srivastava","Organic Superalkalis with Closed-Shell Structure and Aromaticity",,,"10.1080/00268976.2018.1438678",,"physics.chem-ph","http://arxiv.org/licenses/nonexclusive-distrib/1.0/","  Benzene (C6H6) and polycyclic hydrocarbons such as naphthalene (C10H8),
anthracene (C14H10) and coronene (C24H12) are well known aromatic organic
compounds. We study the substitution of Li replacing all H atoms in these
hydrocarbons using density functional method. The vertical ionization energy
(VIE) of such lithiated species, i.e., C6Li6, C10Li8, C14Li10 and C24Li12
ranges 4.24-4.50 eV, which is lower than the IE of Li atom. Thus, these species
may behave as superalkalis, due to their lower IE than alkali metal. However,
these lithiated species possess planar and closed-shell structure, unlike
typical superalkalis. Furthermore, all Li-substituted species are aromatic
although their degree of aromaticity is reduced as compared to corresponding
hydrocarbon analogues. We have further explored the structure of C6Li6 as
star-like, unlike its inorganic analogue B3N3Li6, which appears as fan-like
structure. We have also demonstrated that the interaction of C6Li6 with a
superhalogen (such as BF4) is similar to that of a typical superalkali (such as
OLi3). This may further suggest that the proposed lithiated species may form a
new class of closed-shell organic superalkalis with aromaticity.
","[{""version"":""v1"",""created"":""Sun, 7 Jan 2018 05:50:32 GMT""}]","2018-05-23"
"1801.02137","Chao Luo","Chao Luo, Xuanli Wu, and Yang Cao","Multipath interference analysis of IR-UWB systems in indoor office LOS
  environment","5 pages, 2 figures, Communications and Networking in China
  (CHINACOM), 2011 6th International ICST Conference on",,"10.1109/ChinaCom.2011.6158272",,"eess.SP","http://creativecommons.org/licenses/by/4.0/","  Bit error rate (BER) performance of impulse radio Ultra-Wideband (UWB)
systems in the presence of intrasymbol interference, inter-symbol interference,
multiuser interference and addictive white Gaussian noise (AWGN) is presented
in this paper. By analyzing the indoor office LOS channel model defined by IEEE
802.15.4a Task Group and deducing the variance for intra-symbol interference
(IASI), inter-symbol interference (ISI) and multiuser interference (MUI), the
system BER expression is obtained and verified by MATLAB simulations. Through
comparing the simulation results with and without intra-symbol interference,
the conclusion that intra-symbol interference cannot be neglected is
drawn-moreover, such interference will significantly decrease performance of
UWB based wireless sensor networks (WSN). Then, the BER performance of UWB
systems in multiuser environment is also analyzed and analysis results show
that multiuser interference will further worsen the transmission performance of
UWB systems.
","[{""version"":""v1"",""created"":""Sun, 7 Jan 2018 05:54:24 GMT""}]","2018-01-09"
"1801.02138","Chao Luo","Yang Cao, Chao Luo, and Xuanli Wu","Partial Template Based Receiver in Impulse Radio Ultra-Wideband
  Communication Systems","4 pages, 5 figures, Communications and Networking in China
  (CHINACOM), 2011 6th International ICST Conference on",,"10.1109/ChinaCom.2011.6158273",,"eess.SP","http://creativecommons.org/licenses/by/4.0/","  For high speed ultra-wideband (UWB) communication systems, the multipath
interference exhibits a primary obstacle to improve transmission performance.
In order to enhance the signal to interference plus noise ratio (SINR) in the
receiver, a partial template receiver is proposed in this paper. Instead of
using the conventional template, the model in this paper adopts a partial
template to demodulate signals. To analyze the performance of the proposed
receiver, bit error rate (BER) formulation of IR-UWB systems in the presence of
multipath interference, multiuser interference and addictive white Gaussian
noise (AWGN) is derived in IEEE 802.15.4a channel models. Simulation results
show that, compared with the conventional correlation receiver, the proposed
receiver can achieve a better BER performance for high Eb/N0, which falls in
the conventional used Eb/N0 range.
","[{""version"":""v1"",""created"":""Sun, 7 Jan 2018 05:58:44 GMT""}]","2018-01-09"
"1801.02139","Insun Jo","Insun Jo, Hao Deng, Yang Liu, L. N. Pfeiffer, K. W. West, K. W.
  Baldwin, and M. Shayegan","Cyclotron Orbits of Composite Fermions in the Fractional Quantum Hall
  Regime","5 paages, 3 figures","Phys. Rev. Lett. 120, 016802 (2018)","10.1103/PhysRevLett.120.016802",,"cond-mat.mes-hall","http://arxiv.org/licenses/nonexclusive-distrib/1.0/","  We study a bilayer GaAs hole system that hosts two distinct many-body phases
at low temperatures and high perpendicular magnetic fields. The higher-density
(top) layer develops a Fermi sea of composite fermions (CFs) in its half-filled
lowest Landau level, while the lower-density (bottom) layer forms a Wigner
crystal (WC) as its filling becomes very small. Owing to the inter-layer
interaction, the CFs in the top-layer feel the periodic Coulomb potential of
the WC in the bottom-layer. We measure the magnetoresistance of the top-layer
while changing the bottom-layer density. As the WC layer density increases, the
resistance peaks separating the adjacent fractional quantum Hall states in the
top-layer change nonmonotonically and attain maximum values when the cyclotron
orbit of the CFs encloses one WC lattice point. These features disappear at T =
275 mK when the WC melts. The observation of such geometric resonance features
is unprecedented and surprising as it implies that the CFs retain a
well-defined cyclotron orbit and Fermi wave vector even deep in the fractional
quantum Hall regime, far from half-filling.
","[{""version"":""v1"",""created"":""Sun, 7 Jan 2018 05:58:53 GMT""}]","2018-02-14"
"1801.02140","Chao Luo","Xuanli Wu, Yang Cao, Xiaozong Yang, and Chao Luo","Performance Analysis of UWB Based Wireless Sensor Networks in Indoor
  Office LOS Environment","5 pages, 6 figures, Cross Strait Quad-Regional Radio Science and
  Wireless Technology Conference (CSQRWC), 2011",,"10.1109/CSQRWC.2011.6037125",,"eess.SP","http://creativecommons.org/licenses/by/4.0/","  With the fast development of wireless sensor networks (WSN), more attentions
are paid to high data rate transmission of WSN, and hence, in IEEE 802.15.4a
standard, ultra-wideband (UWB) is introduced as one of the physical layer
technique to support high transmission data rate and precisie locationing
applications. In order to analyze the bit error rate (BER) performance of UWB
based WSN, a system model considering intra-symbol interference (IASI),
inter-symbol interference (ISI), multiuser interference (MUI) and addictive
white Gaussian noise (AWGN) is proposed in this paper, and then verified using
simulation results. Moreover, the pulse waveforms complying with the spectrum
requirement of IEEE 802.15.4a standard are given, and based on such obtained
pulses, the effect of transmission data rate and user number is also shown.
Results show that with the increase of SNR, the intra-symbol interference will
decrease the system performance significantly, and system performance can be
improve by using pulse waveforms with little intra-symbol interference.
","[{""version"":""v1"",""created"":""Sun, 7 Jan 2018 06:03:03 GMT""}]","2018-01-09"
"1801.02141","Todd Hunter","T. R. Hunter, C. L. Brogan, G. C. MacLeod, C. J. Cyganowski, J. O.
  Chibueze, R. Friesen, T. Hirota, D. P. Smits, C. J. Chandler, R. Indebetouw","The Extraordinary Outburst in the Massive Protostellar System
  NGC6334I-MM1: Emergence of Strong 6.7 GHz Methanol Masers","Accepted for publication in The Astrophysical Journal; 17 pages, 9
  figures, 8 tables",,"10.3847/1538-4357/aaa962",,"astro-ph.SR astro-ph.GA","http://arxiv.org/licenses/nonexclusive-distrib/1.0/","  We report the first sub-arcsecond VLA imaging of 6 GHz continuum, methanol
maser, and excited-state hydroxyl maser emission toward the massive
protostellar cluster NGC6334I following the recent 2015 outburst in
(sub)millimeter continuum toward MM1, the strongest (sub)millimeter source in
the protocluster. In addition to detections toward the previously known 6.7 GHz
Class II methanol maser sites in the hot core MM2 and the UCHII region MM3
(NGC6334F), we find new maser features toward several components of MM1, along
with weaker features $\sim1''$ north, west, and southwest of MM1, and toward
the non-thermal radio continuum source CM2. None of these areas have heretofore
exhibited Class II methanol maser emission in three decades of observations.
The strongest MM1 masers trace a dust cavity, while no masers are seen toward
the strongest dust sources MM1A, 1B and 1D. The locations of the masers are
consistent with a combination of increased radiative pumping due to elevated
dust grain temperature following the outburst, the presence of infrared photon
propagation cavities, and the presence of high methanol column densities as
indicated by ALMA images of thermal transitions. The non-thermal radio emission
source CM2 ($2''$ north of MM1) also exhibits new maser emission from the
excited 6.035 and 6.030 GHz OH lines. Using the Zeeman effect, we measure a
line-of-sight magnetic field of +0.5 to +3.7 mG toward CM2. In agreement with
previous studies, we also detect numerous methanol and excited OH maser spots
toward the UCHII region MM3, with predominantly negative line-of-sight magnetic
field strengths of -2 to -5 mG and an intriguing south-north field reversal.
","[{""version"":""v1"",""created"":""Sun, 7 Jan 2018 06:03:07 GMT""}]","2018-03-14"
"1801.02142","Shimon Garti","Shimon Garti","Tiltan","Typos and references","Comptes Rendus Mathematique, Acad. Sci. Paris, Ser. I, vol. 356,
  April 2018, pp. 351-359","10.1016/j.crma.2018.02.001",,"math.LO","http://arxiv.org/licenses/nonexclusive-distrib/1.0/","  We prove that tiltan is consistent with the negation of Galvin's property. On
the other hand, superclub implies Galvin's property. We also show that tiltan
is consistent with a large value of the splitting number at kappa, where kappa
is supercompact.
","[{""version"":""v1"",""created"":""Sun, 7 Jan 2018 06:03:58 GMT""},{""version"":""v2"",""created"":""Mon, 6 Feb 2023 14:46:48 GMT""}]","2023-02-07"
"1801.02143","Zhiyong Cui","Zhiyong Cui, Ruimin Ke, Ziyuan Pu, and Yinhai Wang","Deep Bidirectional and Unidirectional LSTM Recurrent Neural Network for
  Network-wide Traffic Speed Prediction","International Workshop on Urban Computing (UrbComp) 2017, Held in
  conjunction with the ACM SIGKDD 2017",,,,"cs.LG","http://arxiv.org/licenses/nonexclusive-distrib/1.0/","  Short-term traffic forecasting based on deep learning methods, especially
long short-term memory (LSTM) neural networks, has received much attention in
recent years. However, the potential of deep learning methods in traffic
forecasting has not yet fully been exploited in terms of the depth of the model
architecture, the spatial scale of the prediction area, and the predictive
power of spatial-temporal data. In this paper, a deep stacked bidirectional and
unidirectional LSTM (SBU- LSTM) neural network architecture is proposed, which
considers both forward and backward dependencies in time series data, to
predict network-wide traffic speed. A bidirectional LSTM (BDLSM) layer is
exploited to capture spatial features and bidirectional temporal dependencies
from historical data. To the best of our knowledge, this is the first time that
BDLSTMs have been applied as building blocks for a deep architecture model to
measure the backward dependency of traffic data for prediction. The proposed
model can handle missing values in input data by using a masking mechanism.
Further, this scalable model can predict traffic speed for both freeway and
complex urban traffic networks. Comparisons with other classical and
state-of-the-art models indicate that the proposed SBU-LSTM neural network
achieves superior prediction performance for the whole traffic network in both
accuracy and robustness.
","[{""version"":""v1"",""created"":""Sun, 7 Jan 2018 06:06:31 GMT""},{""version"":""v2"",""created"":""Sat, 23 Nov 2019 08:36:48 GMT""}]","2019-11-26"
"1801.02144","Truong Son Hy","Risi Kondor, Hy Truong Son, Horace Pan, Brandon Anderson, Shubhendu
  Trivedi","Covariant Compositional Networks For Learning Graphs",,,,,"cs.LG","http://arxiv.org/licenses/nonexclusive-distrib/1.0/","  Most existing neural networks for learning graphs address permutation
invariance by conceiving of the network as a message passing scheme, where each
node sums the feature vectors coming from its neighbors. We argue that this
imposes a limitation on their representation power, and instead propose a new
general architecture for representing objects consisting of a hierarchy of
parts, which we call Covariant Compositional Networks (CCNs). Here, covariance
means that the activation of each neuron must transform in a specific way under
permutations, similarly to steerability in CNNs. We achieve covariance by
making each activation transform according to a tensor representation of the
permutation group, and derive the corresponding tensor aggregation rules that
each neuron must implement. Experiments show that CCNs can outperform competing
methods on standard graph learning benchmarks.
","[{""version"":""v1"",""created"":""Sun, 7 Jan 2018 06:14:55 GMT""}]","2018-01-09"
"1801.02145","Jiangtao Li","Jiangtao Li","Depth-graded motivic Lie algebra","13 pages",,,,"math.NT math.AG","http://arxiv.org/licenses/nonexclusive-distrib/1.0/","  Consider the neutral Tannakian category mixed Tate motives over Z, in this
paper we suggest a way to understand the structure of depth-graded motivic Lie
subalgebra generated by the depth one part. We will show that from an
isomorphism conjecture proposed by K. Tasaka we can deduce the F. Brown matrix
conjecture and the non-degenerated conjecture about depth-graded motivic Lie
subalgebra generated by the depth one part.
","[{""version"":""v1"",""created"":""Sun, 7 Jan 2018 06:16:19 GMT""},{""version"":""v2"",""created"":""Wed, 28 Feb 2018 23:49:54 GMT""}]","2018-03-02"
