"1801.02040","Davide Lombardo","Davide Lombardo and Andrea Maffei","Abelian varieties as automorphism groups of smooth projective varieties","9 pages. Comments are very welcome!",,,,"math.AG","http://arxiv.org/licenses/nonexclusive-distrib/1.0/","  We determine which complex abelian varieties can be realized as the
automorphism group of a smooth projective variety.
","[{""version"":""v1"",""created"":""Sat, 6 Jan 2018 16:11:22 GMT""}]","2018-01-09"
"1801.02041","Jean-Christophe Pain","Jean-Christophe Pain","Recursive determination of phase shifts for screened Coulomb potentials","submitted to Journal of Physics Communications",,"10.1088/2399-6528/aaa4e4",,"physics.atom-ph","http://arxiv.org/licenses/nonexclusive-distrib/1.0/","  In the calculation of hot-plasma atomic structure, the continuum
wavefunctions are characterized by phase shifts, which therefore determine the
scattering cross-sections. In this short paper, we propose a recurrence
relation for the phase shifts in the case of a particular type of parametric
potentials widely used in atomic-structure codes. These potentials have to be
linear combinations of static screened Coulomb potentials (Yukawa-type
potentials) multiplied by polynomial functions.
","[{""version"":""v1"",""created"":""Sat, 6 Jan 2018 16:12:46 GMT""}]","2019-04-30"
"1801.02042","Benjamin Golub","Krishna Dasaratha, Benjamin Golub, Nir Hak","Learning from Neighbors about a Changing State","final manuscript submitted to journal -- revised exposition
  throughout, corrected details in Section 3.1",,"10.1093/restud/rdac077",,"econ.TH cs.GT cs.SI","http://arxiv.org/licenses/nonexclusive-distrib/1.0/","  Agents learn about a changing state using private signals and their
neighbors' past estimates of the state. We present a model in which Bayesian
agents in equilibrium use neighbors' estimates simply by taking weighted sums
with time-invariant weights. The dynamics thus parallel those of the tractable
DeGroot model of learning in networks, but arise as an equilibrium outcome
rather than a behavioral assumption. We examine whether information aggregation
is nearly optimal as neighborhoods grow large. A key condition for this is
signal diversity: each individual's neighbors have private signals that not
only contain independent information, but also have sufficiently different
distributions. Without signal diversity $\unicode{x2013}$ e.g., if private
signals are i.i.d. $\unicode{x2013}$ learning is suboptimal in all networks and
highly inefficient in some. Turning to social influence, we find it is much
more sensitive to one's signal quality than to one's number of neighbors, in
contrast to standard models with exogenous updating rules.
","[{""version"":""v1"",""created"":""Sat, 6 Jan 2018 16:14:47 GMT""},{""version"":""v2"",""created"":""Tue, 24 Jul 2018 13:14:41 GMT""},{""version"":""v3"",""created"":""Wed, 22 Aug 2018 19:48:58 GMT""},{""version"":""v4"",""created"":""Wed, 6 Feb 2019 00:40:01 GMT""},{""version"":""v5"",""created"":""Fri, 17 Jan 2020 01:35:56 GMT""},{""version"":""v6"",""created"":""Mon, 20 Jan 2020 20:35:05 GMT""},{""version"":""v7"",""created"":""Wed, 15 Dec 2021 14:41:55 GMT""},{""version"":""v8"",""created"":""Thu, 24 Nov 2022 04:28:49 GMT""}]","2022-11-28"
"1801.02043","Viswambhara Makam","Harm Derksen and Visu Makam","Algorithms for orbit closure separation for invariants and
  semi-invariants of matrices","Better bounds for separating invariants and improved exposition in
  some sections","Alg. Number Th. 14 (2020) 2791-2813","10.2140/ant.2020.14.2791",,"math.RA cs.CC math.AC","http://arxiv.org/licenses/nonexclusive-distrib/1.0/","  We consider two group actions on $m$-tuples of $n \times n$ matrices. The
first is simultaneous conjugation by $\operatorname{GL}_n$ and the second is
the left-right action of $\operatorname{SL}_n \times \operatorname{SL}_n$. We
give efficient algorithms to decide if the orbit closures of two points
intersect. We also improve the known bounds for the degree of separating
invariants in these cases.
","[{""version"":""v1"",""created"":""Sat, 6 Jan 2018 16:18:38 GMT""},{""version"":""v2"",""created"":""Wed, 24 Jul 2019 16:47:19 GMT""}]","2020-11-25"
"1801.02044","Francis Su","Fr\'ed\'eric Meunier and Francis Edward Su","Multilabeled versions of Sperner's and Fan's lemmas and applications","21 pages, 2 figures",,,,"math.CO cs.GT math.AT","http://arxiv.org/licenses/nonexclusive-distrib/1.0/","  We propose a general technique related to the polytopal Sperner lemma for
proving old and new multilabeled versions of Sperner's lemma. A notable
application of this technique yields a cake-cutting theorem where the number of
players and the number of pieces can be independently chosen. We also prove
multilabeled versions of Fan's lemma, a combinatorial analogue of the
Borsuk-Ulam theorem, and exhibit applications to fair division and graph
coloring.
","[{""version"":""v1"",""created"":""Sat, 6 Jan 2018 16:20:10 GMT""},{""version"":""v2"",""created"":""Mon, 5 Mar 2018 22:29:20 GMT""},{""version"":""v3"",""created"":""Thu, 9 May 2019 17:31:22 GMT""}]","2019-05-10"
"1801.02045","Davide Campagnari","Davide Campagnari and Hugo Reinhardt","Variational and Dyson--Schwinger Equations of Hamiltonian Quantum
  Chromodynamics",,"Phys. Rev. D 97, 054027 (2018)","10.1103/PhysRevD.97.054027",,"hep-th hep-ph","http://arxiv.org/licenses/nonexclusive-distrib/1.0/","  The variational Hamiltonian approach to Quantum Chromodynamics in Coulomb
gauge is investigated within the framework of the canonical recursive
Dyson--Schwinger equations. The dressing of the quark propagator arising from
the variationally determined non-perturbative kernels is expanded and
renormalized at one-loop order, yielding a chiral condensate compatible with
the observations.
","[{""version"":""v1"",""created"":""Sat, 6 Jan 2018 16:23:25 GMT""}]","2018-03-28"
"1801.02046","Leonardo Cabrer","Leonardo M. Cabrer, Benjamin Freisberg, George Metcalfe, Hilary A.
  Priestley","Checking Admissibility Using Natural Dualities",,,,,"math.LO","http://arxiv.org/licenses/nonexclusive-distrib/1.0/","  This paper presents a new method for obtaining small algebras to check the
admissibility-equivalently, validity in free algebras-of quasi-identities in a
finitely generated quasivariety. Unlike a previous algebraic approach of
Metcalfe and Rothlisberger that is feasible only when the relevant free algebra
is not too large, this method exploits natural dualities for quasivarieties to
work with structures of smaller cardinality and surjective rather than
injective morphisms. A number of case studies are described here that could not
be be solved using the algebraic approach, including (quasi)varieties of
MS-algebras, double Stone algebras, and involutive Stone algebras.
","[{""version"":""v1"",""created"":""Sat, 6 Jan 2018 16:25:33 GMT""},{""version"":""v2"",""created"":""Thu, 13 Dec 2018 07:28:10 GMT""}]","2018-12-14"
"1801.02047","Joanna Zielinska","Joanna A. Zielinska and Morgan W. Mitchell","Atom-resonant squeezed light from a tunable monolithic ppRKTP parametric
  amplifier",,,"10.1364/OL.43.000643",,"quant-ph","http://arxiv.org/licenses/nonexclusive-distrib/1.0/","  We demonstrate vacuum squeezing at the D1 line of atomic rubidium (795 nm)
with a tunable, doubly-resonant, monolithic sub-threshold optical parametric
oscillator in periodically-poled Rb-doped potassium titanyl phosphate. The
squeezing appears to be undiminished by a strong dispersive optical
nonlinearity recently observed in this material.
","[{""version"":""v1"",""created"":""Sat, 6 Jan 2018 16:25:42 GMT""}]","2018-03-14"
"1801.02048","Sumith Yesudasan","Sumith Yesudasan and Rodney D. Averett","Recent Advances in Computational Modeling of Thrombosis",,"2019","10.1016/j.compbiolchem.2019.107148",,"physics.med-ph physics.bio-ph physics.chem-ph","http://arxiv.org/licenses/nonexclusive-distrib/1.0/","  The study of thrombosis is crucial to understand and develop new therapies
for diseases like deep vein thrombosis, diabetes related strokes, pulmonary
embolism etc. The last two decades have seen an exponential growth in studies
related to the blood clot formation using computational tools and through
experiments. Despite of this growth, the complete mechanism behind thrombus
formation and hemostasis is not known yet. The computational models and methods
used in this context are diversified into different spatiotemporal scales, yet
there is no single model which can predict both physiological and mechanical
properties of the blood clots. In this review, we will attempt to list out all
major strategies attempted by researchers so far to model the blood clot
formation using existing computational techniques. This review classifies them
into continuum level, system level, discrete particles and multi-scale methods.
We will also discuss the strength and weakness of various methods and possible
future directions in which the computational blood clot research can thrive.
","[{""version"":""v1"",""created"":""Sat, 6 Jan 2018 16:55:43 GMT""}]","2019-11-28"
"1801.02049","Maxim Kurkov","Maxim Kurkov and Dmitri Vassilevich","Gravitational parity anomaly with and without boundaries","16 pages, final version, accepted for publication in JHEP","JHEP 1803 (2018) 072","10.1007/JHEP03(2018)072",,"hep-th gr-qc math-ph math.MP","http://arxiv.org/licenses/nonexclusive-distrib/1.0/","  In this paper we consider gravitational parity anomaly in three and four
dimensions. We start with a re-computation of this anomaly on a 3D manifold
without boundaries and with a critical comparison of our results to the
previous calculations. Then we compute the anomaly on 4D manifolds with
boundaries with local bag boundary conditions. We find, that gravitational
parity anomaly is localized on the boundary and contains a gravitational
Chern-Simons terms together with a term depending of the extrinsic curvature.
We also discuss the main properties of the anomaly, as the conformal
invariance, relations between 3D and 4D anomalies, etc.
","[{""version"":""v1"",""created"":""Sat, 6 Jan 2018 16:57:51 GMT""},{""version"":""v2"",""created"":""Fri, 12 Jan 2018 17:11:17 GMT""},{""version"":""v3"",""created"":""Fri, 9 Mar 2018 12:09:43 GMT""}]","2018-11-22"
"1801.02050","Alexander Bulinski","Alexander Bulinski, Denis Dimitrov","Statistical estimation of the Shannon entropy",,,,,"math.ST stat.TH","http://arxiv.org/licenses/nonexclusive-distrib/1.0/","  The behavior of the Kozachenko - Leonenko estimates for the (differential)
Shannon entropy is studied when the number of i.i.d. vector-valued observations
tends to infinity. The asymptotic unbiasedness and L^2-consistency of the
estimates are established. The conditions employed involve the analogues of the
Hardy - Littlewood maximal function. It is shown that the results are valid in
particular for the entropy estimation of any nondegenerate Gaussian vector.
","[{""version"":""v1"",""created"":""Sat, 6 Jan 2018 16:57:54 GMT""}]","2018-01-09"
"1801.02051","Kristian Debrabant","Alemayehu Adugna Arara and Kristian Debrabant and Anne Kv{\ae}rn{\o}","Stochastic B-series and order conditions for exponential integrators",,"Numerical Mathematics and Advanced Applications, ENUMATH 2017,
  Lecture Notes in Computational Science and Engineering, Springer, 2019, pp.
  419-427","10.1007/978-3-319-96415-7_37",,"math.NA","http://arxiv.org/licenses/nonexclusive-distrib/1.0/","  We discuss stochastic differential equations with a stiff linear part and
their approximation by stochastic exponential integrators. Representing the
exact and approximate solutions using B-series and rooted trees, we derive the
order conditions for stochastic exponential integrators. The resulting general
order theory covers both It\^{o} and Stratonovich integration.
","[{""version"":""v1"",""created"":""Sat, 6 Jan 2018 17:01:07 GMT""}]","2019-07-18"
"1801.02052","The ATLAS Collaboration","ATLAS Collaboration","Measurements of $t\bar{t}$ differential cross-sections of highly boosted
  top quarks decaying to all-hadronic final states in $pp$ collisions at
  $\sqrt{s}=13\,$ TeV using the ATLAS detector","57 pages in total, author list starting page 41, 18 figures, 5
  tables, submitted to PRD. All figures including auxiliary figures are
  available at
  https://atlas.web.cern.ch/Atlas/GROUPS/PHYSICS/PAPERS/TOPQ-2016-09/","Phys. Rev. D 98, 012003 (2018)","10.1103/PhysRevD.98.012003","CERN-EP-2017-226","hep-ex","http://creativecommons.org/licenses/by/4.0/","  Measurements are made of differential cross-sections of highly boosted
pair-produced top quarks as a function of top-quark and $t\bar{t}$ system
kinematic observables using proton--proton collisions at a center-of-mass
energy of $\sqrt{s} = 13$ TeV. The data set corresponds to an integrated
luminosity of $36.1$ fb$^{-1}$, recorded in 2015 and 2016 with the ATLAS
detector at the CERN Large Hadron Collider. Events with two large-radius jets
in the final state, one with transverse momentum $p_{\rm T} > 500$ GeV and a
second with $p_{\rm T}>350$ GeV, are used for the measurement. The top-quark
candidates are separated from the multijet background using jet substructure
information and association with a $b$-tagged jet. The measured spectra are
corrected for detector effects to a particle-level fiducial phase space and a
parton-level limited phase space, and are compared to several Monte Carlo
simulations by means of calculated $\chi^2$ values. The cross-section for
$t\bar{t}$ production in the fiducial phase-space region is $292 \pm 7 \
\rm{(stat)} \pm 76 \rm{(syst)}$ fb, to be compared to the theoretical
prediction of $384 \pm 36$ fb.
","[{""version"":""v1"",""created"":""Sat, 6 Jan 2018 17:10:33 GMT""}]","2018-08-31"
"1801.02053","Faisal Khan","Faisal Shah Khan, Travis S. Humble","Nash embedding and equilibrium in pure quantum states","7 pages, 1 figure. arXiv admin note: text overlap with
  arXiv:1609.08360","Quantum Technology and Optimization Problems 2019, Lecture Notes
  in Computer Science 11413","10.1007/978-3-030-14082-3_5",,"quant-ph math-ph math.MP","http://arxiv.org/licenses/nonexclusive-distrib/1.0/","  With respect to probabilistic mixtures of the strategies in non-cooperative
games, quantum game theory provides guarantee of fixed-point stability, the
so-called Nash equilibrium. This permits players to choose mixed quantum
strategies that prepare mixed quantum states optimally under constraints. In
this letter, we show that fixed-point stability of Nash equilibrium can also be
guaranteed for pure quantum strategies via an application of the Nash embedding
theorem, permitting players to prepare pure quantum states optimally under
constraints.
","[{""version"":""v1"",""created"":""Sat, 6 Jan 2018 17:15:31 GMT""},{""version"":""v2"",""created"":""Thu, 16 Aug 2018 18:21:56 GMT""}]","2019-02-01"
"1801.02054","Arthur Jacobs M","Arthur M. Jacobs","Explorations in an English Poetry Corpus: A Neurocognitive Poetics
  Perspective","27 pages, 4 figures",,,,"cs.CL","http://arxiv.org/licenses/nonexclusive-distrib/1.0/","  This paper describes a corpus of about 3000 English literary texts with about
250 million words extracted from the Gutenberg project that span a range of
genres from both fiction and non-fiction written by more than 130 authors
(e.g., Darwin, Dickens, Shakespeare). Quantitative Narrative Analysis (QNA) is
used to explore a cleaned subcorpus, the Gutenberg English Poetry Corpus (GEPC)
which comprises over 100 poetic texts with around 2 million words from about 50
authors (e.g., Keats, Joyce, Wordsworth). Some exemplary QNA studies show
author similarities based on latent semantic analysis, significant topics for
each author or various text-analytic metrics for George Eliot's poem 'How Lisa
Loved the King' and James Joyce's 'Chamber Music', concerning e.g. lexical
diversity or sentiment analysis. The GEPC is particularly suited for research
in Digital Humanities, Natural Language Processing or Neurocognitive Poetics,
e.g. as training and test corpus, or for stimulus development and control.
","[{""version"":""v1"",""created"":""Sat, 6 Jan 2018 17:28:21 GMT""}]","2018-01-09"
"1801.02055","Yuke Li","Yuke Li, A. Stephen Morse","The Power Allocation Game on A Network: Balanced Equilibrium",,,,,"cs.GT cs.SI","http://arxiv.org/licenses/nonexclusive-distrib/1.0/","  This paper studies a special kind of equilibrium termed as ""balanced
equilibrium"" which arises in the power allocation game defined in
\cite{allocation}. In equilibrium, each country in antagonism has to use all of
its own power to counteract received threats, and the ""threats"" made to each
adversary just balance out the threats received from that adversary. This paper
establishes conditions on different types of networked international
environments in order for this equilibrium to exist. The paper also links the
existence of this type of equilibrium on structurally balanced graphs to the
Hall's Maximum Matching problem and the Max Flow problem.
","[{""version"":""v1"",""created"":""Sat, 6 Jan 2018 17:35:56 GMT""},{""version"":""v2"",""created"":""Sat, 10 Mar 2018 23:00:42 GMT""}]","2018-03-13"
"1801.02056","Luc Dessart","Luc Dessart, Sung-Chul Yoon, Eli Livne, and Roni Waldman","Supernovae from massive stars with extended tenuous envelopes","Accepted for publication in A&A",,"10.1051/0004-6361/201732363",,"astro-ph.HE astro-ph.SR","http://arxiv.org/licenses/nonexclusive-distrib/1.0/","  Massive stars with a core-halo structure are interesting objects for stellar
physics and hydrodynamics. Using simulations for stellar evolution, radiation
hydrodynamics, and radiative transfer, we study the explosion of stars with an
extended and tenuous envelope (i.e., stars in which 95% of the mass is
contained within 10% of the surface radius or less). We consider both H-rich
supergiant and He-giant progenitors resulting from close-binary evolution and
dying with a final mass of 2.8-5Msun. An extended envelope causes the supernova
(SN) shock to brake and a reverse shock to form, sweeping core material into a
dense shell. The shock deposited energy, which suffers little degradation from
expansion, is trapped in ejecta layers of moderate optical depth, thereby
enhancing the SN luminosity at early times. With the delayed 56Ni heating, we
find that the resulting optical and near-IR light curves all exhibit a
double-peak morphology. We show how an extended progenitor can explain the blue
and featureless optical spectra of some Type IIb and Ib SNe. The dense shell
formed by the reverse shock leads to line profiles with a smaller and
near-constant width. This ejecta property can explain the statistically
narrower profiles of Type IIb compared to Type Ib SNe, as well as the peculiar
Halpha profile seen in SN1993J. At early times, our He-giant star explosion
model shows a high luminosity, a blue color, and featureless spectra
reminiscent of the Type Ib SN2008D, suggesting a low-mass progenitor.
","[{""version"":""v1"",""created"":""Sat, 6 Jan 2018 17:49:31 GMT""}]","2018-05-02"
"1801.02057","Marco Barbieri","Federico Centrone, Marco Barbieri, Alessio Serafini","Quantum Coherence in Noisy Cellular Automata",,,,,"quant-ph","http://arxiv.org/licenses/nonexclusive-distrib/1.0/","  Quantum cellular automata are important tools in understanding quantum
dynamics, thanks to their simple and effective list of rules. Here we
investigate explicitly how coherence is built and lost in the evolution of
one-dimensional automata subject to noise. Our analysis illustrates the
interplay between unitary and noisy dynamics, and draws considerations on their
behaviour in the pseudo-frequency domain.
","[{""version"":""v1"",""created"":""Sat, 6 Jan 2018 17:49:40 GMT""}]","2018-01-09"
"1801.02058","Maximilian Harr","Maximilian Harr, Christoph Schaefer","Robust Dead Reckoning: Calibration, Covariance Estimation, Fusion and
  Integrity Monitoring",,"Automatisiertes Fahren und vernetzte Mobilitaet (AutoReg), 2017
  VDI VDE Conference, Year 2017, Pages 91--102, Volume 8",,,"cs.RO","http://arxiv.org/licenses/nonexclusive-distrib/1.0/","  To measure system states and local environment directly with high precision,
expensive sensors are required. However, highly accurate system states and
environmental perception can also be achieved using data fusion techniques and
digital maps. One crucial task of multi-sensor state estimation is to project
different sensor measurements into the same temporal, spatial and physical
domain, estimate their covariance matrices as well as the exclusion of
erroneous measurements. This paper presents a generic approach for robust
estimation of vehicle movement (odometry). We will shortly present our
calibration procedure, including the estimation of sensor alignments, offset /
scaling errors, covariances / correlations and time delays. An improved
algorithm for wheel diameter estimation is presented. Additionally an approach
for robust odometry will be shown as odometry estimations are fused under known
covariances, while outliers are detected using a chi-squared test. Utilizing
our robust odometry, local environmental views can be associated and fused.
Furthermore our robust odometry can be used to detect and exclude erroneous
position estimates.
","[{""version"":""v1"",""created"":""Sat, 6 Jan 2018 17:50:02 GMT""}]","2018-01-09"
"1801.02059","Swarnendu Sarkar","Swarnendu Sarkar, Varun Sethi","Intersecting D-brane Stacks and Tachyons at Finite Temperature","41 pages, minor corrections, matches with published version","Nucl.Phys. B936: 118-150, 2018","10.1016/j.nuclphysb.2018.09.010",,"hep-th","http://arxiv.org/licenses/nonexclusive-distrib/1.0/","  In arXiv:1403.0389 and arXiv:1610.07140 intersecting $D$-branes in flat space
were studied at finite temperature in the Yang-Mills approximation. The
one-loop correction to the tachyon mass was computed and the critical
temperature at which the tachyon becomes massless was obtained numerically. In
this paper we extend the computation of one-loop two-point amplitude to the
case of intersecting stacks of $D3$-branes in flat space. The motivation for
this calculation is to study the strong coupling holographic BCS model proposed
in arXiv:1104.2843 at finite temperature. We show that the analytical results
of arXiv:1403.0389 and arXiv:1610.07140 can be embedded into this more general
setup. The main technicality involved here is keeping track of the extra color
factors coming from the unbroken gauge groups. We further discuss the issues
involved in the computation of two point amplitude for case of multiple
intersecting stacks of branes.
","[{""version"":""v1"",""created"":""Sat, 6 Jan 2018 17:51:36 GMT""},{""version"":""v2"",""created"":""Sun, 14 Oct 2018 14:41:37 GMT""}]","2018-10-16"
"1801.02060","Marco Barbieri","Federico Centrone, Camillo Tassi, Alessio Serafini, Marco Barbieri","Reversibility in one-dimensional quantum cellular automata in the
  presence of noise",,,,,"quant-ph","http://arxiv.org/licenses/nonexclusive-distrib/1.0/","  We consider a class of noisy, one-dimensional quantum cellular automata that
allow one to shift from unitary dynamics to completely positive maps, and
investigate the notion of reversibility in such a setting. To this aim, we
associate an approximate reverse automaton to each noisy automaton, and assess
its effect, and we define an irreversibility time based on the distance from
the maximally mixed state, which is shown to be the only attractor of the
automaton map in the presence of dephasing.
","[{""version"":""v1"",""created"":""Sat, 6 Jan 2018 17:56:25 GMT""}]","2018-01-09"
"1801.02061","B.Sundar Rajan","Nujoom Sageer Karat, Anoop Thomas and B. Sundar Rajan","Optimal Error Correcting Delivery Scheme for an Optimal Coded Caching
  Scheme with Small Buffers","7 pages",,,,"cs.IT math.IT","http://arxiv.org/licenses/nonexclusive-distrib/1.0/","  Optimal delivery scheme for coded caching problems with small buffer sizes
and the number of users no less than the amount of files in the server was
proposed by Chen, Fan and Letaief [""Fundamental limits of caching: improved
bounds for users with small buffers,"" (IET Communications), 2016]. This scheme
is referred to as the CFL scheme. In this paper, the link between the server
and the users is assumed to be error prone only during the delivery phase.
Closed form expressions for average rate and peak rate of error correcting
delivery scheme for CFL prefetching scheme is obtained. An optimal error
correcting delivery scheme for caching problems employing CFL prefetching is
proposed.
","[{""version"":""v1"",""created"":""Sat, 6 Jan 2018 17:57:06 GMT""}]","2018-01-09"
"1801.02062","Sadegh Momeni Milajerdi","Md Nahid Hossain, Sadegh M Milajerdi, Junao Wang, Birhanu Eshete,
  Rigel Gjomemo, R Sekar, Scott Stoller, VN Venkatakrishnan","SLEUTH: Real-time Attack Scenario Reconstruction from COTS Audit Data","26th USENIX Security Symposium (USENIX Security 2017)",,,,"cs.CR","http://arxiv.org/licenses/nonexclusive-distrib/1.0/","  We present an approach and system for real-time reconstruction of attack
scenarios on an enterprise host. To meet the scalability and real-time needs of
the problem, we develop a platform-neutral, main-memory based, dependency graph
abstraction of audit-log data. We then present efficient, tag-based techniques
for attack detection and reconstruction, including source identification and
impact analysis. We also develop methods to reveal the big picture of attacks
by construction of compact, visual graphs of attack steps. Our system
participated in a red team evaluation organized by DARPA and was able to
successfully detect and reconstruct the details of the red team's attacks on
hosts running Windows, FreeBSD and Linux.
","[{""version"":""v1"",""created"":""Sat, 6 Jan 2018 18:00:27 GMT""}]","2018-01-09"
