"1801.02081","Younes El bassem PhD","Younes El Bassem and Mustapha Oulne","Nuclear structure investigation of even-even and odd Pb isotopes by
  using the Hartree-Fock-Bogoliubov method","16 pages, 7 figures. arXiv admin note: text overlap with
  arXiv:1607.06941; text overlap with arXiv:1210.1825 by other authors","Int. J. Mod. Phys. E 26, 1750084 (2017)","10.1142/S0218301317500847",,"nucl-th","http://arxiv.org/licenses/nonexclusive-distrib/1.0/","  The nuclear structure of even-even and odd lead isotopes (178-236 Pb) is
investigated within the Hartree-Fock-Bogoliubov theory. Calculations are
performed for a wide range of neutron numbers, starting from the proton-rich
side up to the neutron-rich side, by using the SLy4 Skyrme interaction and a
new proposed formula for the pairing strength which is more precise for this
region of nuclei as we did in previous works in the regions of Neodymium (Nd,
Z=60) [Int. J. Mod. Phys. E 24, 1550073 (2015)] and Molybdenum (Mo, Z=42) [Nuc.
Phys. A 957 22-32 (2017)]. Such a new pairing strength formula allows reaching
exotic nuclei region where the experimental data are not available. Calculated
values of various physical quantities such as binding energy, two-neutron
separation energy, quadrupole deformation, and rms-radii for protons and
neutrons are discussed and compared with experimental data and some estimates
of other nuclear models like Finite Range Droplet Model (FRDM), Relativistic
Mean Field (RMF) model with NL3 functional (NL3), Density-Dependent
Meson-Exchange Relativistic Energy Functional (DD-ME2) and results of
Hartree-Fock-Bogoliubov calculations based on the D1S Gogny effective
nucleon-nucleon interaction (Gogny D1S).
","[{""version"":""v1"",""created"":""Sat, 6 Jan 2018 20:13:52 GMT""}]","2018-01-10"
"1801.02082","Costas Alissandrakis","C. E. Alissandrakis, J.-C. Vial, A. Koukras, E. Buchlin, and M.
  Chane-Yook","IRIS Observations of Spicules and Structures Near the Solar Limb","Accepted for publication in Solar Physics",,"10.1007/s11207-018-1242-4",,"astro-ph.SR","http://arxiv.org/licenses/nonexclusive-distrib/1.0/","  We have analyzed IRIS spectral and slit-jaw observations of a quiet region
near the South Pole. In this article we present an overview of the
observations, the corrections, and the absolute calibration of the intensity.
We focus on the average profiles of strong (Mg ii h and k, C ii and Si iv), as
well as of weak spectral lines in the near ultraviolet (NUV) and the far
ultraviolet (FUV), including the Mg ii triplet, thus probing the solar
atmosphere from the low chromosphere to the transition region. We give the
radial variation of bulk spectral parameters as well as line ratios and
turbulent velocities. We present measurements of the formation height in lines
and in the NUV continuum, from which we find a linear relationship between the
position of the limb and the intensity scale height. We also find that low
forming lines, such as the Mg ii triplet, show no temporal variations above the
limb associated with spicules, suggesting that such lines are formed in a
homogeneous atmospheric layer and, possibly, that spicules are formed above the
height of 2 arc sec. We discuss the spatio-temporal structure near the limb
from images of intensity as a function of position and time. In these images,
we identify p-mode oscillations in the cores of lines formed at low heights
above the photosphere, slow moving bright features in O i and fast moving
bright features in C ii. Finally, we compare the Mg ii k and h line profiles,
together with intensity values of the Balmer lines from the literature, with
computations from the PROM57Mg non-LTE model developed at the Institut
d'Astrophysique Spatiale and estimated values of the physical parameters. We
obtain electron temperatures in the range of $\sim8000$ K at small heights to
$\sim20000$ K at large heights, electron densities from $1.1 \times 10^{11}$ to
$4 \times 10^{10}$ cm$^{-3}$ and a turbulent velocity of $\sim24$km/s.
","[{""version"":""v1"",""created"":""Sat, 6 Jan 2018 20:20:31 GMT""}]","2018-01-09"
"1801.02083","Mikhail Dolgopolov","I.N. Rodionova, V.M. Dolgopolov and M.V. Dolgopolov","Delta-problems for the generalized Euler-Darboux equation","5 pages, 1 figure, Uzbek-Israel Scientific Conference Contemporary
  Problems in Mathematics and Physics (October 6-10, 2017), International
  Conference Actual problems of differential equations and their applications.
  TASHKENT. UZBEKISTAN. December 15-17, 2017 and J. Samara State Tech. Univ.,
  Ser. Phys. Math. Sci., Forthcoming paper (Mi vsgtu1557)","Vestn. Samar. Gos. Tekhn. Univ., Ser. Fiz.-Mat. Nauki [J. Samara
  State Tech. Univ., Ser. Phys. Math. Sci.], 21:3 (2017), 417-422","10.14498/vsgtu1557",,"math.AP","http://creativecommons.org/licenses/by/4.0/","  Degenerate hyperbolic equations are dealing with many important issues for
applied nature. While a variety of degenerate equations and boundary
conditions, successfully matched to these differential equation, most in the
characteristic coordinates reduced to Euler-Darboux one. Some boundary value
problems, in particular Cauchy problem, for the specified equation demanded the
introduction of special classes in which formulae are simple and can be used to
meet the new challenges, including Delta-problems in squares that contain
singularity line for equation coefficients with data on adjacent or parallel
sides of the square. In this short communication the generalized Euler-Darboux
equation with negative parameters in the rectangular region is considered.
","[{""version"":""v1"",""created"":""Sat, 6 Jan 2018 20:26:19 GMT""}]","2018-01-11"
"1801.02084","Mahmoud M. Asmar","Mahmoud M. Asmar, Daniel E. Sheehy and Ilya Vekhter","Topological phases of topological insulator thin films",,"Phys. Rev. B 97, 075419 (2018)","10.1103/PhysRevB.97.075419",,"cond-mat.mes-hall","http://arxiv.org/licenses/nonexclusive-distrib/1.0/","  We study the properties of a thin film of topological insulator material. We
treat the coupling between helical states at opposite surfaces of the film in
the properly-adapted tunneling approximation, and show that the tunneling
matrix element oscillates as function of both the film thickness and the
momentum in the plane of the film for Bi$_2$Se$_3$ and Bi$_2$Te$_3$. As a
result, while the magnitude of the matrix element at the center of the surface
Brillouin Zone gives the gap in the energy spectrum, the sign of the matrix
element uniquely determines the topological properties of the film, as
demonstrated by explicitly computing the pseudospin textures and the Chern
number. We find a sequence of transitions between topological and
non-topological phases, separated by semimetallic states, as the film thickness
varies. In the topological phase the edge states of the film always exist but
only carry a spin current if the edge potentials break particle-hole symmetry.
The edge states decay very slowly away from the boundary in Bi$_2$Se$_3$,
making Bi$_{2}$Te$_{3}$, where this scale is shorter, a more promising
candidate for the observation of these states. Our results hold for
free-standing films as well as heterostructures with large-gap insulators.
","[{""version"":""v1"",""created"":""Sat, 6 Jan 2018 20:30:57 GMT""}]","2018-02-21"
"1801.02085","Anil K. Pradhan","Anil K. Pradhan and Sultana N. Nahar","Recalculation of Astrophysical Opacities: Overview, Methodology and
  Atomic Calculations","10 pages, 4 figures, Review, Proc. Workshop on Astrophysical
  Opacities 2017, PASP",,,,"astro-ph.SR physics.atom-ph","http://arxiv.org/licenses/nonexclusive-distrib/1.0/","  A review of a renewed effort to recalculate astrophysical opacities using the
R-Matrix method is presented. The computational methods and new extensions are
described. Resulting enhancements found in test calculations under stellar
interior conditions compared to the Opacity Project could potentially lead to
the resolution of the solar abundances problem, as well as discrepancies
between recent experimental measurements at the Sandia Z-pinch inertial
confinement fusion device and theoretical opacity models. Outstanding issues
also discussed are: (i) accuracy, convergence, and completeness of atomic
calculations, (ii) improvements in the Equation-of-State of
high-temperature-density plasmas, and (iii) redistribution of resonant
oscillator strength in the bound-free continuum, and (iv) plasma broadening of
auotionizing resonances.
","[{""version"":""v1"",""created"":""Sat, 6 Jan 2018 20:31:26 GMT""}]","2018-01-09"
"1801.02086","Hiroki Sayama","Hiroki Sayama","Complexity, Development, and Evolution in Morphogenetic Collective
  Systems","13 pages, 8 figures, 1 table; submitted to ""Evolution, Development,
  and Complexity: Multiscale Models in Complex Adaptive Systems"" (Springer
  Proceedings in Complexity Series)",,,,"nlin.AO cs.MA q-bio.PE","http://arxiv.org/licenses/nonexclusive-distrib/1.0/","  Many living and non-living complex systems can be modeled and understood as
collective systems made of heterogeneous components that self-organize and
generate nontrivial morphological structures and behaviors. This chapter
presents a brief overview of our recent effort that investigated various
aspects of such morphogenetic collective systems. We first propose a
theoretical classification scheme that distinguishes four complexity levels of
morphogenetic collective systems based on the nature of their components and
interactions. We conducted a series of computational experiments using a
self-propelled particle swarm model to investigate the effects of (1)
heterogeneity of components, (2) differentiation/re-differentiation of
components, and (3) local information sharing among components, on the
self-organization of a collective system. Results showed that (a) heterogeneity
of components had a strong impact on the system's structure and behavior, (b)
dynamic differentiation/re-differentiation of components and local information
sharing helped the system maintain spatially adjacent, coherent organization,
(c) dynamic differentiation/re-differentiation contributed to the development
of more diverse structures and behaviors, and (d) stochastic re-differentiation
of components naturally realized a self-repair capability of self-organizing
morphologies. We also explored evolutionary methods to design novel
self-organizing patterns, using interactive evolutionary computation and
spontaneous evolution within an artificial ecosystem. These self-organizing
patterns were found to be remarkably robust against dimensional changes from 2D
to 3D, although evolution worked efficiently only in 2D settings.
","[{""version"":""v1"",""created"":""Sat, 6 Jan 2018 20:41:08 GMT""}]","2018-01-09"
"1801.02087","Duanduan Wan","Duanduan Wan and Sharon C. Glotzer","Shapes within shapes: how particles arrange inside a cavity","6 pages, 8 figures","Soft Matter, 14, 3012 (2018)","10.1039/C8SM00048D",,"cond-mat.soft cond-mat.stat-mech","http://arxiv.org/licenses/nonexclusive-distrib/1.0/","  We calculate the configurational entropy of hard particles confined in a
cavity using Monte Carlo integration. Multiple combinations of particle and
cavity shapes are considered. For small numbers of particles $N$, we show that
the entropy decreases monotonically with increasing cavity aspect ratio,
regardless of particle shape. As $N$ increases, we find ordered regions of high
and low particle density, with the highest density near the boundary for all
particle and cavity shape combinations. Our findings provide insights relevant
to engineering particles in confined spaces, entropic barriers, and systems
with depletion interactions.
","[{""version"":""v1"",""created"":""Sat, 6 Jan 2018 20:47:37 GMT""}]","2018-04-26"
"1801.02088","Nelson Martins-Ferreira","J. P. Fatelo and N. Martins-Ferreira","Mobi algebra as an abstraction to the unit interval and its comparison
  to rings","This paper is the continuation of ""Internal monoids and groups in the
  category of commutative cancellative medial magmas"", Portugaliae Mathematica,
  Vol. 73, Fasc. 3 (2016) 219-245; by the same authors",,,,"math.RA","http://arxiv.org/licenses/nonexclusive-distrib/1.0/","  We begin by introducing an algebraic structure with three constants and one
ternary operation to which we call mobi algebra. This structure has been
designed to capture the most relevant properties of the unit interval that are
needed in the study of geodesic paths. Another algebraic structure, called
involutive medial monoid (IMM), can be derived from a mobi algebra. We prove
several results on the interplay between mobi algebras, IMM algebras and
unitary rings. It turns out that every unitary ring with one half uniquely
determines and is uniquely determined by a mobi algebra with one double. This
paper is the second of a planned series of papers dedicated to the study of
geodesic paths from an algebraic point of view.
","[{""version"":""v1"",""created"":""Sat, 6 Jan 2018 20:50:21 GMT""}]","2018-01-09"
"1801.02089","Mateusz Skomra","Xavier Allamigeon, St\'ephane Gaubert, Mateusz Skomra","The tropical analogue of the Helton-Nie conjecture is true","20 pages, 7 figures, this is an extended version of the preprint
  presented at MEGA 2017","Journal of Symbolic Computation, 91:129 --148, 2019","10.1016/j.jsc.2018.06.017",,"math.AG","http://arxiv.org/licenses/nonexclusive-distrib/1.0/","  Helton and Nie conjectured that every convex semialgebraic set over the field
of real numbers can be written as the projection of a spectrahedron. Recently,
Scheiderer disproved this conjecture. We show, however, that the following
result, which may be thought of as a tropical analogue of this conjecture, is
true: over a real closed nonarchimedean field of Puiseux series, the convex
semialgebraic sets and the projections of spectrahedra have precisely the same
images by the nonarchimedean valuation. The proof relies on game theory
methods.
","[{""version"":""v1"",""created"":""Sat, 6 Jan 2018 20:57:16 GMT""}]","2019-12-30"
"1801.02090","Kate\v{r}ina Helisov\'a","Vesna Gotovac, Kate\v{r}ina Helisov\'a","Testing equality in distribution of random convex compact sets via
  theory of N-distances and its application to assessing similarity of general
  random sets","24 pages, 6 figures",,,,"math.ST stat.TH","http://arxiv.org/licenses/nonexclusive-distrib/1.0/","  This paper concerns a method of testing equality of distribution of random
convex compact sets and the way how to use the test to distinguish between two
realisations of general random sets. The family of metrics on the space of
distributions of random convex compact sets is constructed using the theory of
N-distances and characteristic functions of random convex compact sets.
Further, the approximation of the metrics through its finite dimensional
counterparts is proposed, which lead to a new statistical test for testing
equality in distribution of two random convex compact sets. Then, it is
described how to approximate a realisation of a general random set by a union
of convex compact sets, and it is shown how to determine whether two
realisations of general random sets come from the same process using the
constructed test. The procedure is justified by an extensive simulation study.
","[{""version"":""v1"",""created"":""Sat, 6 Jan 2018 21:04:59 GMT""}]","2018-01-09"
"1801.02091","Zachary Feinstein","Tathagata Banerjee, Alex Bernstein, Zachary Feinstein","Dynamic Clearing and Contagion in Financial Networks",,,,,"q-fin.MF q-fin.RM","http://arxiv.org/licenses/nonexclusive-distrib/1.0/","  In this paper we introduce a generalized extension of the Eisenberg-Noe model
of financial contagion to allow for time dynamics of the interbank liabilities,
including a dynamic examination of default risk. This framework separates the
cash account and long-term capital account to more accurately model the health
of a financial institution. In doing so, such a system allows us to distinguish
between delinquency and default as well as between defaults resulting from
either insolvency or illiquidity.
","[{""version"":""v1"",""created"":""Sat, 6 Jan 2018 21:08:05 GMT""},{""version"":""v2"",""created"":""Fri, 25 May 2018 21:52:01 GMT""},{""version"":""v3"",""created"":""Mon, 8 Jun 2020 15:37:07 GMT""},{""version"":""v4"",""created"":""Tue, 20 Jul 2021 19:28:27 GMT""},{""version"":""v5"",""created"":""Fri, 18 Mar 2022 19:41:58 GMT""},{""version"":""v6"",""created"":""Mon, 21 Nov 2022 22:08:27 GMT""}]","2022-11-23"
"1801.02092","Taoufik Hmidi","David Gerard Dritschel, Taoufik Hmidi and Coralie Renault","Imperfect bifurcation for the quasi-geostrophic shallow-water equations","50 pages",,"10.1007/s00205-018-1312-7",,"math.AP","http://arxiv.org/licenses/nonexclusive-distrib/1.0/","  We study analytical and numerical aspects of the bifurcation diagram of
simply-connected rotating vortex patch equilibria for the quasi-geostrophic
shallow-water (QGSW) equations. The QGSW equations are a generalisation of the
Euler equations and contain an additional parameter, the Rossby deformation
length $\EE^{-1}$, which enters in the relation between streamfunction and
(potential) vorticity. The Euler equations are recovered in the limit $\EE\to
0$. We prove, close to circular (Rankine) vortices, the persistence of the
bifurcation diagram for arbitrary Rossby deformation length. However we show
that the two-fold branch, corresponding to Kirchhoff ellipses for the Euler
equations, is never connected even for small values $\EE$, and indeed is split
into a countable set of disjoint connected branches. Accurate numerical
calculations of the global structure of the bifurcation diagram and of the
limiting equilibrium states are also presented to complement the mathematical
analysis.
","[{""version"":""v1"",""created"":""Sat, 6 Jan 2018 21:12:47 GMT""}]","2018-11-14"
"1801.02093","Petros Ioannou","Marios-Andreas Nikolaidis, Brian F. Farrell and Petros J. Ioannou","The mechanism by which nonlinearity sustains turbulence in plane Couette
  flow","work done in the COTURB Summer Workshop 2017, submitted to J. Phys.:
  Conf. Series","J. Phys.: Conf. Ser., 2018, 1001, 012014","10.1088/1742-6596/1001/1/012014",,"physics.flu-dyn","http://arxiv.org/licenses/nonexclusive-distrib/1.0/","  Turbulence in wall-bounded shear flow results from a synergistic interaction
between linear non-normality and nonlinearity in which non-normal growth of a
subset of perturbations configured to transfer energy from the externally
forced component of the turbulent state to the perturbation component maintains
the perturbation energy, while the subset of energy-transferring perturbations
is replenished by nonlinearity. Although it is accepted that both linear
non-normality mediated energy transfer from the forced component of the mean
flow and nonlinear interactions among perturbations are required to maintain
the turbulent state, the detailed physical mechanism by which these processes
interact in maintaining turbulence has not been determined. In this work a
statistical state dynamics based analysis is performed on turbulent Couette
flow at $R=600$ and a comparison to DNS is used to demonstrate that the
perturbation component in Couette flow turbulence is replenished by a
non-normality mediated parametric growth process in which the fluctuating
streamwise mean flow has been adjusted to marginal Lyapunov stability. It is
further shown that the alternative mechanism in which the subspace of
non-normally growing perturbations is maintained directly by
perturbation-perturbation nonlinearity does not contribute to maintaining the
turbulent state. This work identifies parametric interaction between the
fluctuating streamwise mean flow and the streamwise varying perturbations to be
the mechanism of the nonlinear interaction maintaining the perturbation
component of the turbulent state, and identifies the associated Lyapunov
vectors with positive energetics as the structures of the perturbation subspace
supporting the turbulence.
","[{""version"":""v1"",""created"":""Sat, 6 Jan 2018 21:21:19 GMT""},{""version"":""v2"",""created"":""Fri, 26 Jan 2018 16:35:05 GMT""}]","2018-05-08"
"1801.02094","Alice Allen","Alice Allen, Peter J. Teuben, and P. Wesley Ryan","Schroedinger's code: A preliminary study on research source code
  availability and link persistence in astrophysics","Accepted to ApJS",,"10.3847/1538-4365/aab764",,"astro-ph.IM cs.DL","http://arxiv.org/licenses/nonexclusive-distrib/1.0/","  We examined software usage in a sample set of astrophysics research articles
published in 2015 and searched for source code for the software mentioned in
these research papers. We categorized the software to indicate whether source
code is available for download and whether there are restrictions to accessing
it, and if source code is not available, whether some other form of the
software, such as a binary, is. We also extracted hyperlinks from one journal's
2015 research articles, as links in articles can serve as an acknowledgment of
software use and lead to data used in the research, and tested them to
determine which of these URLs are still accessible. For our sample of 715
software instances in the 166 articles we examined, we were able to categorize
418 records as to availability of source code and found that 285 unique codes
were used, 58% of which offer source code available online for download. Of the
2,558 hyperlinks extracted from 1,669 research articles, at best, 90% of them
were available over our testing period.
","[{""version"":""v1"",""created"":""Sat, 6 Jan 2018 21:27:32 GMT""},{""version"":""v2"",""created"":""Fri, 9 Feb 2018 08:45:09 GMT""}]","2018-05-23"
"1801.02095","Sebastiano Pilati","S. Pilati, I. Zintchenko, M. Troyer, F. Ancilotto","Density functional theory versus quantum Monte Carlo simulations of
  Fermi gases in the optical-lattice arena","8 pages, 7 figures, plus supplemental material (1 page). Typos
  corrected","The European Physical Journal B 91 (4), 70 (2018)","10.1140/epjb/e2018-90021-1",,"cond-mat.quant-gas","http://arxiv.org/licenses/nonexclusive-distrib/1.0/","  We benchmark the ground state energies and the density profiles of atomic
repulsive Fermi gases in optical lattices computed via Density Functional
Theory (DFT) against the results of diffusion Monte Carlo (DMC) simulations.
The main focus is on a half-filled one-dimensional optical lattices, for which
the DMC simulations performed within the fixed-node approach provide unbiased
results. This allows us to demonstrate that the local spin-density
approximation (LSDA) to the exchange-correlation functional of DFT is very
accurate in the weak and intermediate interactions regime, and also to
underline its limitations close to the strongly-interacting Tonks-Girardeau
limit and in very deep optical lattices. We also consider a three dimensional
optical lattice at quarter filling, showing also in this case the high accuracy
of the LSDA in the moderate interaction regime. The one-dimensional data
provided in this study may represent a useful benchmark to further develop DFT
methods beyond the LSDA and they will hopefully motivate experimental studies
to accurately measure the equation of state of Fermi gases in
higher-dimensional geometries.
","[{""version"":""v1"",""created"":""Sat, 6 Jan 2018 21:34:14 GMT""},{""version"":""v2"",""created"":""Mon, 11 Jun 2018 12:37:24 GMT""}]","2018-06-12"
"1801.02096","Eduardo Sergio Santini","E. Sergio Santini (CNEN & CBPF), Germ\'an M. Chiappe (UBA/FFyB & CBC)
  and Rafael Gonz\'alez (UNGS/IDH & DF/FCEyN-UBA)","On a new prediction of Causal Quantum Mechanics for the two-slit
  interference experiment with electrons","15 pages, 8 figures and 1 Table. The general formula obtained, Eq.
  (22), is valid independently of the interpretation. The approximation given
  in figure 6 has been improved and with it the values in table I. Conclusions
  have been improved",,,,"quant-ph","http://arxiv.org/licenses/nonexclusive-distrib/1.0/","  The causal quantum mechanics (i.e. Bohmian or de Broglie-Bohm or Bohm-de
Broglie quantum mechanics) has made possible to calculate the trajectories of
electrons in a typical double-slit experiment [C. Philippidis et al., Il Nuovo
Cimento, 52 B, 15-28 (1979)]. The trajectories do not correspond to an uniform
movement but to an accelerated one. The acceleration is caused by the quantum
potential. From the quantum theoretical point of view, there is a probability
for the electron to emit photons, with a certain emission power, during its
movement from the slits to the screen. We find a quantum general formula for
the emission power of photons, valid independently of the interpretation. Then,
according to the Copenhagen interpretation, this formula gives a strictly zero
value for the emission power because the electron moves as a free particle
after it leaves the slit and before reach the screen. Then, there is no
emission of photons. In the case of the causal interpretation, the emission
power results, for a concrete real experiment, in a very tiny but not a zero
value, driven by the square of the quantum potential gradient. We give an idea
of the type of spectrum that could be measured. A brief idea of a possible
experimental arrangement in order to detect this effect, is given.
","[{""version"":""v1"",""created"":""Sat, 6 Jan 2018 21:50:17 GMT""},{""version"":""v2"",""created"":""Sat, 7 Apr 2018 16:01:18 GMT""},{""version"":""v3"",""created"":""Fri, 25 Oct 2019 20:54:02 GMT""},{""version"":""v4"",""created"":""Wed, 20 Apr 2022 17:12:29 GMT""},{""version"":""v5"",""created"":""Fri, 22 Apr 2022 00:52:23 GMT""}]","2022-04-25"
