"1810.07897","Nabarun Deb","Nabarun Deb, Sujayam Saha, Adityanand Guntuboyina and Bodhisattva Sen","Two-component Mixture Model in the Presence of Covariates","88 pages, 15 figures",,,,"stat.ME","http://arxiv.org/licenses/nonexclusive-distrib/1.0/","  In this paper, we study a generalization of the two-groups model in the
presence of covariates --- a problem that has recently received much attention
in the statistical literature due to its applicability in multiple hypotheses
testing problems. The model we consider allows for infinite dimensional
parameters and offers flexibility in modeling the dependence of the response on
the covariates. We discuss the identifiability issues arising in this model and
systematically study several estimation strategies. We propose a tuning
parameter-free nonparametric maximum likelihood method, implementable via the
EM algorithm, to estimate the unknown parameters. Further, we derive the rate
of convergence of the proposed estimators --- in particular, we show that the
finite sample Hellinger risk for every `approximate' nonparametric maximum
likelihood estimator achieves a near-parametric rate (up to logarithmic
multiplicative factors). In addition, we propose and theoretically study two
`marginal' methods that are more scalable and easily implementable. We
demonstrate the efficacy of our procedures through extensive simulation studies
and relevant data analyses --- one arising from neuroscience and the other from
astronomy. We also outline the application of our methods to multiple testing.
The companion R package $\texttt{NPMLEmix}$ implements all the procedures
proposed in this paper.
","[{""version"":""v1"",""created"":""Thu, 18 Oct 2018 04:46:25 GMT""},{""version"":""v2"",""created"":""Thu, 31 Jan 2019 17:40:25 GMT""}]","2019-02-01"
"1810.07898","Matthias Ludewig","Matthias Ludewig","Heat Kernels as Path Integrals","This is an expanded version of an article in: Bei, Francesco;
  Br\""uning, Jochen; G\""uneysu, Batu; Ludewig, Matthias, Geometric analysis on
  singular spaces. Space--time--matter, 349-416, De Gruyter, Berlin, 2018",,,,"math.DG","http://arxiv.org/licenses/nonexclusive-distrib/1.0/","  In this survey article, we review the relation between heat kernels and path
integrals. In particular, we review recent results on the approximation of the
Wiener measure on compact manifold by measures on (finite-dimensional) spaces
of piece-wise geodesics.
","[{""version"":""v1"",""created"":""Thu, 18 Oct 2018 04:53:20 GMT""}]","2018-10-19"
"1810.07899","Thomas Howard","Michelle Esponda and Thomas M. Howard","Adaptive Grasp Control through Multi-Modal Interactions for Assistive
  Prosthetic Devices","Presented at AI-HRI AAAI-FSS, 2018 (arXiv:1809.06606)",,,"AI-HRI/2018/11","cs.RO","http://arxiv.org/licenses/nonexclusive-distrib/1.0/","  The hand is one of the most complex and important parts of the human body.
The dexterity provided by its multiple degrees of freedom enables us to perform
many of the tasks of daily living which involve grasping and manipulating
objects of interest. Contemporary prosthetic devices for people with
transradial amputations or wrist disarticulation vary in complexity, from
passive prosthetics to complex devices that are body or electrically driven.
One of the important challenges in developing smart prosthetic hands is to
create devices which are able to mimic all activities that a person might
perform and address the needs of a wide variety of users. The approach explored
here is to develop algorithms that permit a device to adapt its behavior to the
preferences of the operator through interactions with the wearer. This device
uses multiple sensing modalities including muscle activity from a myoelectric
armband, visual information from an on-board camera, tactile input through a
touchscreen interface, and speech input from an embedded microphone. Presented
within this paper are the design, software and controls of a platform used to
evaluate this architecture as well as results from experiments deigned to
quantify the performance.
","[{""version"":""v1"",""created"":""Thu, 18 Oct 2018 05:06:00 GMT""}]","2018-10-19"
"1810.07900","Kamyar Azizzadenesheli Ph.D.","Kamyar Azizzadenesheli, Yisong Yue, Animashree Anandkumar","Policy Gradient in Partially Observable Environments: Approximation and
  Convergence",,,,,"cs.LG stat.ML","http://arxiv.org/licenses/nonexclusive-distrib/1.0/","  Policy gradient is a generic and flexible reinforcement learning approach
that generally enjoys simplicity in analysis, implementation, and deployment.
In the last few decades, this approach has been extensively advanced for fully
observable environments. In this paper, we generalize a variety of these
advances to partially observable settings, and similar to the fully observable
case, we keep our focus on the class of Markovian policies. We propose a series
of technical tools, including a novel notion of advantage function, to develop
policy gradient algorithms and study their convergence properties in such
environments. Deploying these tools, we generalize a variety of existing
theoretical guarantees, such as policy gradient and convergence theorems, to
partially observable domains, those which also could be carried to more
settings of interest. This study also sheds light on the understanding of
policy gradient approaches in real-world applications which tend to be
partially observable.
","[{""version"":""v1"",""created"":""Thu, 18 Oct 2018 05:25:11 GMT""},{""version"":""v2"",""created"":""Thu, 24 Jan 2019 23:34:04 GMT""},{""version"":""v3"",""created"":""Sun, 24 May 2020 21:30:54 GMT""}]","2020-05-26"
"1810.07901","Vishal Keshav","Vishal Keshav, Tej Pratap GVSL","Decoupling Semantic Context and Color Correlation with multi-class cross
  branch regularization","In submission",,,,"cs.CV","http://arxiv.org/licenses/nonexclusive-distrib/1.0/","  This paper presents a novel design methodology for architecting a
light-weight and faster DNN architecture for vision applications. The
effectiveness of the architecture is demonstrated on Color-Constancy use case
an inherent block in camera and imaging pipelines. Specifically, we present a
multi-branch architecture that disassembles the contextual features and color
properties from an image, and later combines them to predict a global property
(e.g. Global Illumination). We also propose an implicit regularization
technique by designing cross-branch regularization block that enables the
network to retain high generalization accuracy. With a conservative use of best
computational operators, the proposed architecture achieves state-of-the-art
accuracy with 30X lesser model parameters and 70X faster inference time for
color constancy. It is also shown that the proposed architecture is generic and
achieves similar efficiency in other vision applications such as Low-Light
photography.
","[{""version"":""v1"",""created"":""Thu, 18 Oct 2018 05:25:13 GMT""},{""version"":""v2"",""created"":""Sun, 9 Dec 2018 10:00:15 GMT""}]","2020-08-09"
"1810.07902","Mengyun Wu","Mengyun Wu, Qingzhao Zhang, Shuangge Ma","Structured gene-environment interaction analysis",,,,,"stat.ME","http://arxiv.org/licenses/nonexclusive-distrib/1.0/","  For the etiology, progression, and treatment of complex diseases,
gene-environment (G-E) interactions have important implications beyond the main
G and E effects. G-E interaction analysis can be more challenging with the
higher dimensionality and need for accommodating the ""main effects,
interactions"" hierarchy. In the recent literature, an array of novel methods,
many of which are based on the penalization technique, have been developed. In
most of these studies, however, the structures of G measurements, for example
the adjacency structure of SNPs (attributable to their physical adjacency on
the chromosomes) and network structure of gene expressions (attributable to
their coordinated biological functions and correlated measurements), have not
been well accommodated. In this study, we develop the structured G-E
interaction analysis, where such structures are accommodated using penalization
for both the main G effects and interactions. Penalization is also applied for
regularized estimation and selection. The proposed structured interaction
analysis can be effectively realized. It is shown to have the consistency
properties under high dimensional settings. Simulations and the analysis of
GENEVA diabetes data with SNP measurements and TCGA melanoma data with gene
expression measurements demonstrate its competitive practical performance.
","[{""version"":""v1"",""created"":""Thu, 18 Oct 2018 05:30:29 GMT""}]","2018-10-19"
"1810.07903","Zhihao Gavin Tang","Zhiyi Huang, Binghui Peng, Zhihao Gavin Tang, Runzhou Tao, Xiaowei Wu
  and Yuhao Zhang","Tight Competitive Ratios of Classic Matching Algorithms in the Fully
  Online Model","To appear SODA 2019",,,,"cs.DS","http://arxiv.org/licenses/nonexclusive-distrib/1.0/","  Huang et al.~(STOC 2018) introduced the fully online matching problem, a
generalization of the classic online bipartite matching problem in that it
allows all vertices to arrive online and considers general graphs. They showed
that the ranking algorithm by Karp et al.~(STOC 1990) is strictly better than
$0.5$-competitive and the problem is strictly harder than the online bipartite
matching problem in that no algorithms can be $(1-1/e)$-competitive.
  This paper pins down two tight competitive ratios of classic algorithms for
the fully online matching problem. For the fractional version of the problem,
we show that a natural instantiation of the water-filling algorithm is
$2-\sqrt{2} \approx 0.585$-competitive, together with a matching hardness
result. Interestingly, our hardness result applies to arbitrary algorithms in
the edge-arrival models of the online matching problem, improving the
state-of-art $\frac{1}{1+\ln 2} \approx 0.5906$ upper bound. For integral
algorithms, we show a tight competitive ratio of $\approx 0.567$ for the
ranking algorithm on bipartite graphs, matching a hardness result by Huang et
al. (STOC 2018).
","[{""version"":""v1"",""created"":""Thu, 18 Oct 2018 05:30:48 GMT""}]","2018-10-19"
"1810.07904","Kuranosuke Nishimura","Takahisa Inui, Nobu Kishimoto and Kuranosuke Nishimura","Scattering for a mass critical NLS system below the ground state with
  and without mass-resonance condition","49 pages",,,,"math.AP","http://arxiv.org/licenses/nonexclusive-distrib/1.0/","  We consider a mass-critical system of nonlinear Sch\""{o}dinger equations
\begin{align*} \begin{cases} i\partial_t u +\Delta u =\bar{u}v,\\ i\partial_t v
+\kappa \Delta v =u^2, \end{cases} (t,x)\in \mathbb{R}\times \mathbb{R}^4,
\end{align*} where $(u,v)$ is a $\mathbb{C}^2$-valued unknown function and
$\kappa >0$ is a constant. If $\kappa =1/2$, we say the equation satisfies
mass-resonance condition. We are interested in the scattering problem of this
equation under the condition $M(u,v)<M(\phi ,\psi)$, where $M(u,v)$ denotes the
mass and $(\phi ,\psi)$ is a ground state. In the mass-resonance case, we prove
scattering by the argument of Dodson \cite{MR3406535}. Scattering is also
obtained without mass-resonance condition under the restriction that $(u,v)$ is
radially symmetric.
","[{""version"":""v1"",""created"":""Thu, 18 Oct 2018 05:31:14 GMT""},{""version"":""v2"",""created"":""Mon, 22 Oct 2018 10:29:36 GMT""},{""version"":""v3"",""created"":""Fri, 2 Nov 2018 02:46:54 GMT""}]","2018-11-05"
"1810.07905","Yunlan Ji","Yunlan Ji, Ji Bian, Min Jiang, Domenico D'Alessandro, and Xinhua Peng","Time-optimal Control of Independent Spin-1/2 Systems under Simultaneous
  Control",,"Phys. Rev. A 98, 062108 (2018)","10.1103/PhysRevA.98.062108",,"quant-ph","http://arxiv.org/licenses/nonexclusive-distrib/1.0/","  We derive the explicit solution of the problem of time-optimal control by a
common magnetic fields for two independent spin-$\frac{1}{2}$ particles. Our
approach is based on the Pontryagin Maximum Principle and a novel symmetry
reduction technique. We experimentally implement the optimal control using
zero-field nuclear magnetic resonance. This reveals an average gate error of
$1\%$ and a $70 \%$ to $80$ $\%$ decrease in the experiment duration as
compared to existing methods. This is the first analytical solution and
experimental demonstration of time-optimal control in such a system and it
provides a route to achieve time optimal control in more general quantum
systems.
","[{""version"":""v1"",""created"":""Thu, 18 Oct 2018 05:48:02 GMT""}]","2018-12-12"
"1810.07906","Shahbaz Rezaei","Shahbaz Rezaei and Xin Liu","Deep Learning for Encrypted Traffic Classification: An Overview",,"IEEE Communications Magazine 57 (2019) 76-81","10.1109/MCOM.2019.1800819",,"cs.NI","http://arxiv.org/licenses/nonexclusive-distrib/1.0/","  Traffic classification has been studied for two decades and applied to a wide
range of applications from QoS provisioning and billing in ISPs to
security-related applications in firewalls and intrusion detection systems.
Port-based, data packet inspection, and classical machine learning methods have
been used extensively in the past, but their accuracy have been declined due to
the dramatic changes in the Internet traffic, particularly the increase in
encrypted traffic. With the proliferation of deep learning methods, researchers
have recently investigated these methods for traffic classification task and
reported high accuracy. In this article, we introduce a general framework for
deep-learning-based traffic classification. We present commonly used deep
learning methods and their application in traffic classification tasks. Then,
we discuss open problems and their challenges, as well as opportunities for
traffic classification.
","[{""version"":""v1"",""created"":""Thu, 18 Oct 2018 05:55:05 GMT""},{""version"":""v2"",""created"":""Sat, 26 Jan 2019 01:18:30 GMT""},{""version"":""v3"",""created"":""Sat, 9 Mar 2019 16:59:20 GMT""}]","2019-05-15"
