"1810.07757","Alexander Burgers","A. P. Burgers, L. S. Peng, J. A. Muniz, A. C. McClung, M. J. Martin,
  H. J. Kimble","Clocked Atom Delivery to a Photonic Crystal Waveguide",,,"10.1073/pnas.1817249115",,"quant-ph physics.atom-ph","http://arxiv.org/licenses/nonexclusive-distrib/1.0/","  Experiments and numerical simulations are described that develop quantitative
understanding of atomic motion near the surfaces of nanoscopic photonic crystal
waveguides (PCWs). Ultracold atoms are delivered from a moving optical lattice
into the PCW. Synchronous with the moving lattice, transmission spectra for a
guided-mode probe field are recorded as functions of lattice transport time and
frequency detuning of the probe beam. By way of measurements such as these, we
have been able to validate quantitatively our numerical simulations, which are
based upon detailed understanding of atomic trajectories that pass around and
through nanoscopic regions of the PCW under the influence of optical and
surface forces. The resolution for mapping atomic motion is roughly 50 nm in
space and 100 ns in time. By introducing auxiliary guided mode (GM) fields that
provide spatially varying AC-Stark shifts, we have, to some degree, begun to
control atomic trajectories, such as to enhance the flux into to the central
vacuum gap of the PCW at predetermined times and with known AC-Stark shifts.
Applications of these capabilities include enabling high fractional filling of
optical trap sites within PCWs, calibration of optical fields within PCWs, and
utilization of the time-dependent, optically dense atomic medium for novel
nonlinear optical experiments.
","[{""version"":""v1"",""created"":""Wed, 17 Oct 2018 20:00:36 GMT""}]","2019-03-06"
"1810.07758","Hoang Anh Dau","Hoang Anh Dau, Anthony Bagnall, Kaveh Kamgar, Chin-Chia Michael Yeh,
  Yan Zhu, Shaghayegh Gharghabi, Chotirat Ann Ratanamahatana, Eamonn Keogh","The UCR Time Series Archive",,,,,"cs.LG stat.ML","http://arxiv.org/licenses/nonexclusive-distrib/1.0/","  The UCR Time Series Archive - introduced in 2002, has become an important
resource in the time series data mining community, with at least one thousand
published papers making use of at least one data set from the archive. The
original incarnation of the archive had sixteen data sets but since that time,
it has gone through periodic expansions. The last expansion took place in the
summer of 2015 when the archive grew from 45 to 85 data sets. This paper
introduces and will focus on the new data expansion from 85 to 128 data sets.
Beyond expanding this valuable resource, this paper offers pragmatic advice to
anyone who may wish to evaluate a new algorithm on the archive. Finally, this
paper makes a novel and yet actionable claim: of the hundreds of papers that
show an improvement over the standard baseline (1-nearest neighbor
classification), a large fraction may be mis-attributing the reasons for their
improvement. Moreover, they may have been able to achieve the same improvement
with a much simpler modification, requiring just a single line of code.
","[{""version"":""v1"",""created"":""Wed, 17 Oct 2018 20:00:40 GMT""},{""version"":""v2"",""created"":""Mon, 9 Sep 2019 01:48:03 GMT""}]","2019-09-10"
"1810.07759","Hovan Lee","Hovan Lee, Evgeny Plekhanov, David Blackbourn, Swagata Acharya, and
  Cedric Weber","Self-assembly of correlated Kondo lattices: The Mott to Kondo transition
  in diluted superlattices",,,,,"cond-mat.str-el","http://arxiv.org/licenses/nonexclusive-distrib/1.0/","  In the field of condensed matter, the quest to obtain an experimental
realization of a Kondo lattice has generated a tremendous effort of the
community, from both standpoints of experiments and theory. The pursuit of
obtaining independent magnetic moments, via charge localization through Coulomb
interactions, is paramount for applications in nanotechnology. In particular,
systems with simultaneous charge and spin degrees of freedom can manifest both
Kondo spin quenching and Mott-Hubbard charge localization. A unified
experimental framework illuminating the pathway between the two phenomena is of
physical and technological interest, and is (as of yet) hardly observed in real
condensed matter systems. Recent developments in the ability to control
densities and temperatures of strongly correlated Fermionic impurities on
surfaces and substrates has opened up a new paradigm of possibilities for this
pathway. In particular, a milestone was recently surpassed through the
observation of self-assembled superlattices of f band adatoms on metallic
surfaces, such as the deposition of Ce on Ag(111). Such lattices have
introduced a mechanism of diluted correlated lattices where the interaction
between Kondo and Mott physics can be methodically studied. However, it remains
difficult to control the adatom distances and substrate densities in these
systems, and the interplay between Kondo physics and charge localization
remains elusive. In this work, we systematically investigate the phase diagram
of superlattice structures of heavy f elements deposited on metallic
substrates, and assess the required conditions to obtain Kondo lattices in
superlattices. We unveil a unique pathway between Kondo quenching and Mott
localization, and identify a non-trivial charge density wave phase emerging
from the competition of charge localization and Kondo physics.
","[{""version"":""v1"",""created"":""Wed, 17 Oct 2018 20:01:01 GMT""},{""version"":""v2"",""created"":""Sun, 21 Oct 2018 18:03:54 GMT""},{""version"":""v3"",""created"":""Wed, 24 Oct 2018 11:19:39 GMT""},{""version"":""v4"",""created"":""Fri, 2 Nov 2018 09:16:13 GMT""}]","2018-11-05"
"1810.07760","Horacio Castellini","Horacio Castellini and Bibiana Riquelme","Study of non-linear viscoelastic behavior of the human red blood cell",,,,,"q-bio.CB cond-mat.soft physics.bio-ph","http://creativecommons.org/licenses/by/4.0/","  The non-linear behavior of human erythrocytes subjected to shear stress was
analyzed using data series from the Erythrocyte Rheometer and a theoretical
model was developed. Linear behavior was eliminated by means of a slot filter
and a sixth order Savisky-Golay filter was applied to the resulting time series
that allows the elimination of any possible white noise in the data. A fast
Fourier transform was performed on the processed data, which resulted in a
series of frequency dominant peaks. Results suggest the presence of a
non-linear quadratic term in the Kelvin-Voigt phenomenological model. The
correlation dimension studied through recurrence quantification analysis gave
C2=2.58. Results suggest that the underlying dynamics is the same in each RBC
sample corresponding to healthy donors.
","[{""version"":""v1"",""created"":""Wed, 17 Oct 2018 20:04:47 GMT""}]","2018-10-19"
"1810.07761","Benedikt Jahnel","Codina Cotar, Benedikt Jahnel and Christof K\""ulske","Extremal decomposition for random Gibbs measures: From general
  metastates to metastates on extremal random Gibbs measures","12 pages","Electronic Communications in Probability 2018, Vol. 23, paper no.
  95, 1-12","10.1214/18-ECP200",,"math.PR","http://creativecommons.org/licenses/by-sa/4.0/","  The concept of metastate measures on the states of a random spin system was
introduced to be able to treat the large-volume asymptotics for complex
quenched random systems, like spin glasses, which may exhibit chaotic volume
dependence in the strong-coupling regime. We consider the general issue of the
extremal decomposition for Gibbsian specifications which depend measurably on a
parameter that may describe a whole random environment in the infinite volume.
Given a random Gibbs measure, as a measurable map from the environment space,
we prove measurability of its decomposition measure on pure states at fixed
environment, with respect to the environment. As a general corollary we obtain
that, for any metastate, there is an associated decomposition metastate, which
is supported on the extremes for almost all environments, and which has the
same barycenter.
","[{""version"":""v1"",""created"":""Wed, 17 Oct 2018 20:06:55 GMT""},{""version"":""v2"",""created"":""Tue, 18 Dec 2018 11:35:01 GMT""}]","2018-12-19"
"1810.07762","Jianguo Chen","Jianguo Chen, Kenli Li, Huigui Rong, Kashif Bilal, Nan Yang, Keqin Li","A Disease Diagnosis and Treatment Recommendation System Based on Big
  Data Mining and Cloud Computing",,"Information Sciences, 2018, 435:124-149","10.1016/j.ins.2018.01.001",,"cs.LG stat.ML","http://arxiv.org/licenses/nonexclusive-distrib/1.0/","  It is crucial to provide compatible treatment schemes for a disease according
to various symptoms at different stages. However, most classification methods
might be ineffective in accurately classifying a disease that holds the
characteristics of multiple treatment stages, various symptoms, and
multi-pathogenesis. Moreover, there are limited exchanges and cooperative
actions in disease diagnoses and treatments between different departments and
hospitals. Thus, when new diseases occur with atypical symptoms, inexperienced
doctors might have difficulty in identifying them promptly and accurately.
Therefore, to maximize the utilization of the advanced medical technology of
developed hospitals and the rich medical knowledge of experienced doctors, a
Disease Diagnosis and Treatment Recommendation System (DDTRS) is proposed in
this paper. First, to effectively identify disease symptoms more accurately, a
Density-Peaked Clustering Analysis (DPCA) algorithm is introduced for
disease-symptom clustering. In addition, association analyses on
Disease-Diagnosis (D-D) rules and Disease-Treatment (D-T) rules are conducted
by the Apriori algorithm separately. The appropriate diagnosis and treatment
schemes are recommended for patients and inexperienced doctors, even if they
are in a limited therapeutic environment. Moreover, to reach the goals of high
performance and low latency response, we implement a parallel solution for
DDTRS using the Apache Spark cloud platform. Extensive experimental results
demonstrate that the proposed DDTRS realizes disease-symptom clustering
effectively and derives disease treatment recommendations intelligently and
accurately.
","[{""version"":""v1"",""created"":""Wed, 17 Oct 2018 20:07:08 GMT""}]","2019-11-26"
"1810.07763","Pavol Severa","Pavol \v{S}evera, Fridrich Valach","Courant algebroids, Poisson-Lie T-duality, and type II supergravities","33 pages; v2 - references added",,,,"math.DG hep-th","http://arxiv.org/licenses/nonexclusive-distrib/1.0/","  We reexamine the notions of generalized Ricci tensor and scalar curvature on
a general Courant algebroid, reformulate them using objects natural w.r.t.
pull-backs and reductions, and obtain them from the variation of a natural
action functional. This allows us to prove, in a very general setup, the
compatibility of the Poisson-Lie T-duality with the renormalization group flow
and with string background equations. We thus extend the known results to a
much wider class of dualities, including the cases with gauging (so called
dressing cosets, or equivariant Poisson-Lie T-duality). As an illustration, we
use the formalism to provide new classes of solutions of modified supergravity
equations on symmetric spaces.
","[{""version"":""v1"",""created"":""Wed, 17 Oct 2018 20:07:26 GMT""},{""version"":""v2"",""created"":""Fri, 26 Oct 2018 20:31:45 GMT""}]","2018-10-30"
"1810.07764","Jake Scoggin","Jake Scoggin, Zachary Woods, Helena Silva, and Ali Gokirmak","Modeling Heterogeneous Melting in Phase Change Memory Devices",,,"10.1063/1.5067397",,"cond-mat.mtrl-sci","http://arxiv.org/licenses/nonexclusive-distrib/1.0/","  We present thermodynamic crystallization and melting models and calculate
phase change velocities in $Ge_2 Sb_2 Te_5$ based on kinetic and thermodynamic
parameters. The calculated phase change velocities are strong functions of
grain size, with smaller grains beginning to melt at lower temperatures. Phase
change velocities are continuous functions of temperature which determine
crystallization and melting rates. Hence, set and reset times as well as power
and peak current requirements for switching are strong functions of grain size.
Grain boundary amorphization can lead to a sufficient increase in cell
resistance for small-grain phase change materials even if the whole active
region does not completely amorphize. Isolated grains left in the amorphous
regions, the quenched-in nuclei, facilitate templated crystal growth and
significantly reduce set times for phase change memory cells. We demonstrate
the significance of heterogeneous melting through 2-D electrothermal
simulations coupled with a dynamic materials phase change model. Our results
show reset and set times on the order of ~1 ns for 30 nm wide confined
nanocrystalline (7.5 nm - 25 nm radius crystals) phase change memory cells.
","[{""version"":""v1"",""created"":""Wed, 17 Oct 2018 20:09:33 GMT""}]","2019-02-20"
"1810.07766","Chen Yu","Chen Yu, Hanlin Tang, Cedric Renggli, Simon Kassing, Ankit Singla, Dan
  Alistarh, Ce Zhang, Ji Liu","Distributed Learning over Unreliable Networks",,,,,"cs.DC cs.LG","http://arxiv.org/licenses/nonexclusive-distrib/1.0/","  Most of today's distributed machine learning systems assume {\em reliable
networks}: whenever two machines exchange information (e.g., gradients or
models), the network should guarantee the delivery of the message. At the same
time, recent work exhibits the impressive tolerance of machine learning
algorithms to errors or noise arising from relaxed communication or
synchronization. In this paper, we connect these two trends, and consider the
following question: {\em Can we design machine learning systems that are
tolerant to network unreliability during training?} With this motivation, we
focus on a theoretical problem of independent interest---given a standard
distributed parameter server architecture, if every communication between the
worker and the server has a non-zero probability $p$ of being dropped, does
there exist an algorithm that still converges, and at what speed? The technical
contribution of this paper is a novel theoretical analysis proving that
distributed learning over unreliable network can achieve comparable convergence
rate to centralized or distributed learning over reliable networks. Further, we
prove that the influence of the packet drop rate diminishes with the growth of
the number of \textcolor{black}{parameter servers}. We map this theoretical
result onto a real-world scenario, training deep neural networks over an
unreliable network layer, and conduct network simulation to validate the system
improvement by allowing the networks to be unreliable.
","[{""version"":""v1"",""created"":""Wed, 17 Oct 2018 20:13:05 GMT""},{""version"":""v2"",""created"":""Thu, 22 Nov 2018 06:03:49 GMT""},{""version"":""v3"",""created"":""Wed, 6 Feb 2019 15:18:11 GMT""},{""version"":""v4"",""created"":""Thu, 16 May 2019 03:59:32 GMT""}]","2019-05-17"
"1810.07768","David Droeschel","Nicola Krombach and David Droeschel and Sebastian Houben and Sven
  Behnke","Feature-based visual odometry prior for real-time semi-dense stereo SLAM",,,"10.1016/j.robot.2018.08.002",,"cs.RO","http://arxiv.org/licenses/nonexclusive-distrib/1.0/","  Robust and fast motion estimation and mapping is a key prerequisite for
autonomous operation of mobile robots. The goal of performing this task solely
on a stereo pair of video cameras is highly demanding and bears conflicting
objectives: on one hand, the motion has to be tracked fast and reliably, on the
other hand, high-level functions like navigation and obstacle avoidance depend
crucially on a complete and accurate environment representation. In this work,
we propose a two-layer approach for visual odometry and SLAM with stereo
cameras that runs in real-time and combines feature-based matching with
semi-dense direct image alignment. Our method initializes semi-dense depth
estimation, which is computationally expensive, from motion that is tracked by
a fast but robust keypoint-based method. Experiments on public benchmark and
proprietary datasets show that our approach is faster than state-of-the-art
methods without losing accuracy and yields comparable map building
capabilities. Moreover, our approach is shown to handle large inter-frame
motion and illumination changes much more robustly than its direct
counterparts.
","[{""version"":""v1"",""created"":""Wed, 17 Oct 2018 20:18:20 GMT""}]","2018-10-19"
"1810.07769","Norman Lippok","Norman Lippok, Meena Siddiqui, Benjamin J. Vakoc, Brett E. Bouma","Extended coherence length and depth ranging using a Fourier domain
  mode-locked frequency comb and circular interferometric ranging","8 pages, 9 figures","Phys. Rev. Applied 11, 014018 (2019)","10.1103/PhysRevApplied.11.014018",,"physics.optics","http://arxiv.org/licenses/nonexclusive-distrib/1.0/","  Fourier domain mode-locking (FDML) has been a popular laser design for high
speed optical frequency domain imaging (OFDI) but achieving long coherence
lengths, and therefore imaging range, has been challenging. The narrow
instantaneous linewidth of a frequency comb (FC) FDML laser could provide an
attractive platform for high speed as well as long range OFDI. Unfortunately,
aliasing artifacts arising from signals beyond the principle measurement depth
of the free spectral range have prohibited the use of a FC FDML for imaging so
far. To make the enhanced coherence length of FC FDML laser available, methods
to manage such artifacts are required. Recently, coherent circular ranging has
been demonstrated that uses frequency combs for imaging in much reduced RF
bandwidths. Here, we revisit circular ranging as a tool of making the long
coherence length of an FDML frequency comb laser as well as its use for tissue
imaging accessible. Using an acousto-optic frequency shifter (AOFS), we
describe an active method to mitigate signal aliasing that is both stable and
wavelength independent. We show that an FC FDML laser offers an order of
magnitude improved coherence length compared to traditional FDML laser designs
without requiring precise dispersion engineering. We discuss design parameters
of a frequency stepping laser resonator as well as aliasing from a frequency
comb and AOFS in OFDI with numerical simulations. The use of circular ranging
additionally reduced acquisition bandwidths 15-fold compared with traditional
OFDI methods. The FC FDML/AOFS design offers a convenient platform for long
range and high speed imaging as well as exploring signal and image processing
methods in circular ranging.
","[{""version"":""v1"",""created"":""Wed, 17 Oct 2018 20:18:57 GMT""}]","2019-01-16"
"1810.07770","Chulhee Yun","Chulhee Yun, Suvrit Sra, Ali Jadbabaie","Small ReLU networks are powerful memorizers: a tight analysis of
  memorization capacity","28 pages, 2 figures. NeurIPS 2019 Camera-ready version",,,,"cs.LG stat.ML","http://arxiv.org/licenses/nonexclusive-distrib/1.0/","  We study finite sample expressivity, i.e., memorization power of ReLU
networks. Recent results require $N$ hidden nodes to memorize/interpolate
arbitrary $N$ data points. In contrast, by exploiting depth, we show that
3-layer ReLU networks with $\Omega(\sqrt{N})$ hidden nodes can perfectly
memorize most datasets with $N$ points. We also prove that width
$\Theta(\sqrt{N})$ is necessary and sufficient for memorizing $N$ data points,
proving tight bounds on memorization capacity. The sufficiency result can be
extended to deeper networks; we show that an $L$-layer network with $W$
parameters in the hidden layers can memorize $N$ data points if $W =
\Omega(N)$. Combined with a recent upper bound $O(WL\log W)$ on VC dimension,
our construction is nearly tight for any fixed $L$. Subsequently, we analyze
memorization capacity of residual networks under a general position assumption;
we prove results that substantially reduce the known requirement of $N$ hidden
nodes. Finally, we study the dynamics of stochastic gradient descent (SGD), and
show that when initialized near a memorizing global minimum of the empirical
risk, SGD quickly finds a nearby point with much smaller empirical risk.
","[{""version"":""v1"",""created"":""Wed, 17 Oct 2018 20:21:43 GMT""},{""version"":""v2"",""created"":""Wed, 29 May 2019 00:35:32 GMT""},{""version"":""v3"",""created"":""Tue, 29 Oct 2019 05:22:58 GMT""}]","2019-10-30"
"1810.07771","Sergey Porsev","S.G. Porsev, M.S. Safronova, U.I. Safronova, V.A. Dzuba, and V.V.
  Flambaum","Nobelium energy levels and hyperfine structure constants","5 pages","Phys. Rev. A 98, 052512 (2018)","10.1103/PhysRevA.98.052512",,"physics.atom-ph","http://arxiv.org/licenses/nonexclusive-distrib/1.0/","  Advances in laser spectroscopy of superheavy ($Z>100$) elements enabled
determination of the nuclear moments of the heaviest nuclei, which requires
high-precision atomic calculations of the relevant hyperfine structure (HFS)
constants. Here, we calculated the HFS constants and energy levels for a number
of nobelium (Z=102) states using the hybrid approach, combining linearized
coupled-cluster and configuration interaction methods. We also carried out an
extensive study of the No energies using 16-electron configuration interaction
method to determine the position of the (5f^{13}7s^2 6d) and (5f^{13}7s^2 7p)
levels with a hole in the 5f shell to evaluate their potential effect on the
hyperfine structure calculations of the low-lying (5f^{14}7s6d) and
(5f^{14}7s7p) levels. We find that unlike the case of Yb, the mixing of the
low-lying levels with filled and unfilled f shell is small and does not
significantly influence their properties. The resulting HFS constants for the
5f^{14}7s7p 1P1 level, combined with laser-spectroscopy measurement, were used
to extract nobelium nuclear properties [S. Raeder et al., Phys. Rev. Lett. 120,
232503 (2018)]
","[{""version"":""v1"",""created"":""Wed, 17 Oct 2018 20:22:56 GMT""}]","2018-12-05"
"1810.07772","Minjung Kim","Minjung Kim, Subhasish Mandal, Eric Mikida, Kavitha Chandrasekar, Eric
  Bohm, Nikhil Jain, Qi Li, Glenn J. Martyna, Laxmikant Kale, Sohrab
  Ismail-Beigi","Scalable GW software for quasiparticle properties using OpenAtom","48 pages, 10 figures",,"10.1016/j.cpc.2019.05.020",,"physics.comp-ph cond-mat.mtrl-sci","http://arxiv.org/licenses/nonexclusive-distrib/1.0/","  The GW method, which can describe accurately electronic excitations, is one
of the most widely used ab initio electronic structure technique and allows the
physics of both molecular and condensed phase materials to be studied. However,
the applications of the GW method to large systems require supercomputers and
highly parallelized software to overcome the high computational complexity of
the method scaling as $O(N^4)$. Here, we develop efficient massively-parallel
GW software for the plane-wave basis set by revisiting the standard GW formulae
in order to discern the optimal approaches for each phase of the GW calculation
for massively parallel computation. These best numerical practices are
implemented into the OpenAtom software which is written on top of charm++
parallel framework. We then evaluate the performance of our new software using
range of system sizes. Our GW software shows significantly improved parallel
scaling compared to publically available GW software on the Mira and Blue
Waters supercomputers, two of largest most powerful platforms in the world.
","[{""version"":""v1"",""created"":""Wed, 17 Oct 2018 20:23:55 GMT""}]","2019-10-02"
"1810.07773","Matthew Porter","Matthew Porter, Arnav Joshi, Pedro Hespanhol, Anil Aswani, Matthew
  Johnson-Roberson, Ram Vasudevan","Simulation and Real-World Evaluation of Attack Detection Schemes",,,,,"cs.SY","http://arxiv.org/licenses/nonexclusive-distrib/1.0/","  A variety of anomaly detection schemes have been proposed to detect malicious
attacks to Cyber-Physical Systems. Among these schemes, Dynamic Watermarking
methods have been proven highly effective at detecting a wide range of attacks.
Unfortunately, in contrast to other anomaly detectors, no method has been
presented to design a Dynamic Watermarking detector to achieve a user-specified
false alarm rate, or subsequently evaluate the capabilities of an attacker
under such a selection. This paper describes methods to measure the capability
of an attacker, to numerically approximate this metric, and to design a Dynamic
Watermarking detector that can achieve a user-specified rate of false alarms.
The performance of the Dynamic Watermarking detector is compared to three
classical anomaly detectors in simulation and on a real-world platform. These
experiments illustrate that the attack capability under the Dynamic
Watermarking detector is comparable to those of classic anomaly detectors.
Importantly, these experiments also make clear that the Dynamic Watermarking
detector is consistently able to detect attacks that the other class of
detectors are unable to identify.
","[{""version"":""v1"",""created"":""Wed, 17 Oct 2018 20:25:05 GMT""}]","2018-10-19"
