"1810.08008","Esther Galby","Nicolas Champseix, Esther Galby, Bernard Ries","Planar CPG graphs",,,,,"cs.CG","http://arxiv.org/licenses/nonexclusive-distrib/1.0/","  We show that for any $k \geq 0$, there exists a planar graph which is
$B_{k+1}$-CPG but not $B_k$-CPG. As a consequence, we obtain that $B_k$-CPG is
a strict subclass of $B_{k+1}$-CPG.
","[{""version"":""v1"",""created"":""Thu, 18 Oct 2018 12:26:03 GMT""}]","2018-10-19"
"1810.08009","Paola Dom\'inguez Fern\'andez","Paola Dom\'inguez Fern\'andez, Franco Vazza and Marcus Br\""uggen","Spectral analysis of magnetic fields in simulated galaxy clusters","2 pages, 2 figures","Proceedings of Focus Meeting 8: New Insights in Extragalactic
  Magnetic Fields, XXXth IAU General Assembly, Vienna, August 29-31, 2018",,,"astro-ph.CO","http://arxiv.org/licenses/nonexclusive-distrib/1.0/","  We introduce a new sample of galaxy clusters obtained from a cosmological
simulation covering an unprecedented dynamical range. All the clusters in our
sample show a clear signature of small-scale dynamo amplification. We show that
it is possible to use dynamo theory for studying the magnetic spectrum in the
intracluster medium. We study if the intrinsic variations on the spectra depend
on the dynamical history of each cluster or on some host cluster properties.
","[{""version"":""v1"",""created"":""Thu, 18 Oct 2018 12:26:40 GMT""}]","2018-10-19"
"1810.08010","Benjamin Rhodes","Benjamin Rhodes, Michael Gutmann","Variational Noise-Contrastive Estimation",,,,,"stat.ML cs.LG","http://arxiv.org/licenses/nonexclusive-distrib/1.0/","  Unnormalised latent variable models are a broad and flexible class of
statistical models. However, learning their parameters from data is
intractable, and few estimation techniques are currently available for such
models. To increase the number of techniques in our arsenal, we propose
variational noise-contrastive estimation (VNCE), building on NCE which is a
method that only applies to unnormalised models. The core idea is to use a
variational lower bound to the NCE objective function, which can be optimised
in the same fashion as the evidence lower bound (ELBO) in standard variational
inference (VI). We prove that VNCE can be used for both parameter estimation of
unnormalised models and posterior inference of latent variables. The developed
theory shows that VNCE has the same level of generality as standard VI, meaning
that advances made there can be directly imported to the unnormalised setting.
We validate VNCE on toy models and apply it to a realistic problem of
estimating an undirected graphical model from incomplete data.
","[{""version"":""v1"",""created"":""Thu, 18 Oct 2018 12:32:11 GMT""},{""version"":""v2"",""created"":""Fri, 19 Oct 2018 08:14:56 GMT""},{""version"":""v3"",""created"":""Sun, 24 Feb 2019 14:07:40 GMT""}]","2019-02-26"
"1810.08011","Anal\'ia Fern\'andez Herrero","Anal\'ia Fern\'andez Herrero, Mika Pfl\""uger, Frank Scholze, Victor
  Soltwisch","Characteristic diffuse scattering from distinct line roughnesses",,,"10.1107/S1600576717014455",,"physics.app-ph","http://arxiv.org/licenses/nonexclusive-distrib/1.0/","  Lamellar gratings are widely used diffractive optical elements; gratings
etched into Si can be used as structural elements or prototypes of structural
elements in integrated electronic circuits. For the control of the lithographic
manufacturing process, a rapid in-line characterization of nanostructures is
indispensable. Numerous studies on the determination of regular geometry
parameters of lamellar gratings from optical and extreme ultraviolet (EUV)
scattering highlight the impact of roughness on the optical performance as well
as on the reconstruction of these structures. Thus, a set of nine lamellar Si
gratings with a well defined line edge roughness or line width roughness were
designed. The investigation of these structures using EUV small-angle
scattering reveals a strong correlation between the type of line roughness and
the angular scattering distribution. These distinct scattering patterns open
new paths for the unequivocal characterization of such structures by EUV
scatterometry.
","[{""version"":""v1"",""created"":""Thu, 18 Oct 2018 12:32:24 GMT""}]","2018-10-19"
"1810.08012","Konstantin Borodianskiy","Arcady Finkelstein, Eugene Furman, Dmitry Husnullin, Borodianskiy
  Konstantin","Sound Absorption in Replicated Aluminum Foam",,,,,"physics.app-ph cond-mat.mtrl-sci","http://arxiv.org/licenses/nonexclusive-distrib/1.0/","  Sound absorption is an important technological task in machine-building and
civil engineering. Porous materials are traditionally used for these purposes,
as they are neither ignitable nor hygroscopic and thus suitable for noise
oppression, first of all in means of transportation. Absorption of acoustic
oscillation energy in porous metals occurs mainly due to viscous friction. A
theoretical description of the process of energy viscous dissipation in a
porous media on basis of Rayleigh classical model is given in paper [1],
whereas the modern level of theory is set forth in Johnson-Champoux-Allard
model [2]. Attempts of utilizing aluminum foam as the cheapest porous metal for
sound absorption are related to forming of the open porous structure by rolling
[3] or by heat treatment [4]. However, the sound absorption ratio of metal foam
presented in these papers does not rise over 80%, whereas it reaches 99.9% in a
wide frequency range when we take conventional sound-absorption materials (i.e.
glass-wool). The problem of foamed metal consists of considerable reflection of
acoustic waves from the surface.
","[{""version"":""v1"",""created"":""Thu, 18 Oct 2018 12:36:33 GMT""}]","2018-10-22"
"1810.08013","Taesoo Song","Taesoo Song, Pierre Moreau","Low-energy Bremsstrahlung photon in relativistic nucleon+nucleon
  collisions","11 pages, 5 figures","Phys. Rev. D 98, 116007 (2018)","10.1103/PhysRevD.98.116007",,"nucl-th nucl-ex","http://arxiv.org/licenses/nonexclusive-distrib/1.0/","  We study the production of Bremsstrahlung photon in relativistic
nucleon+nucleon collisions by introducing a deceleration time of
electromagnetic currents. It is found that Bremsstrahlung photon spectrum at
low energy does not depend on the deceleration time but solely on the amount of
reduced electromagnetic current in collision. On the other hand, the photon
spectrum becomes soft with increasing deceleration time. We also find that
Bremsstrahlung photon spectrum in p+n collisions is considerably different from
that in p+p collisions at low energy.
","[{""version"":""v1"",""created"":""Thu, 18 Oct 2018 12:37:51 GMT""}]","2018-12-26"
"1810.08014","H. R. Jauslin","V. Dorier, J. Lampart, S. Gu\'erin, H. R. Jauslin","Canonical quantization for quantum plasmonics with finite nanostructures",,"Phys. Rev. A 100, 042111 (2019)","10.1103/PhysRevA.100.042111",,"quant-ph","http://arxiv.org/licenses/nonexclusive-distrib/1.0/","  The quantization of plasmons has been analyzed mostly under the assumption of
an infinite-sized bulk medium interacting with the electromagnetic field. We
reformulate it for finite-size media, such as metallic or dielectric
nano-structures, highlighting sharp differences. By diagonalizing the
Hamiltonian by means of a Lippmann-Schwinger equation, we show the contribution
of two sets of bosonic operators, one stemming from medium fluctuations, and
one from the electromagnetic field. The results apply to general models
including dissipative and dispersive responses.
","[{""version"":""v1"",""created"":""Thu, 18 Oct 2018 12:41:09 GMT""},{""version"":""v2"",""created"":""Wed, 2 Oct 2019 14:49:25 GMT""}]","2019-10-23"
"1810.08015","Boudhayan Paul","Vinay Malvimat, Sayid Mondal, Boudhayan Paul, Gautam Sengupta","Holographic entanglement negativity for disjoint intervals in
  $AdS_3/CFT_2$","17 pages, 4 figures","Eur. Phys. J. C (2019) 79: 191","10.1140/epjc/s10052-019-6693-8",,"hep-th","http://arxiv.org/licenses/nonexclusive-distrib/1.0/","  We advance a holographic construction for the entanglement negativity of
bipartite mixed state configurations of two disjoint intervals in $(1+1)$
dimensional conformal field theories ($CFT_{1+1}$) through the $AdS_3/CFT_2$
correspondence. Our construction constitutes the large central charge analysis
of the entanglement negativity for mixed states under consideration and
involves a specific algebraic sum of bulk space like geodesics anchored on
appropriate intervals in the dual $CFT_{1+1}$. The construction is utilized to
compute the holographic entanglement negativity for such mixed states in
$CFT_{1+1}$s dual to bulk pure $AdS_3$ geometries and BTZ black holes
respectively. Our analysis exactly reproduces the universal features of
corresponding replica technique results in the large central charge limit which
serves as a consistency check.
","[{""version"":""v1"",""created"":""Thu, 18 Oct 2018 12:42:54 GMT""},{""version"":""v2"",""created"":""Sat, 9 Mar 2019 13:32:47 GMT""}]","2019-03-12"
"1810.08016","Mikhail Aliev","Yulia S. Chernyshova, Mikhail A. Aliev, Ekaterina S. Gushchanskaia and
  Alexander V. Sheshkus","Optical Font Recognition in Smartphone-Captured Images, and its
  Applicability for ID Forgery Detection",,,"10.1117/12.2522955",,"cs.CV","http://arxiv.org/licenses/nonexclusive-distrib/1.0/","  In this paper, we consider the problem of detecting counterfeit identity
documents in images captured with smartphones. As the number of documents
contain special fonts, we study the applicability of convolutional neural
networks (CNNs) for detection of the conformance of the fonts used with the
ones, corresponding to the government standards. Here, we use multi-task
learning to differentiate samples by both fonts and characters and compare the
resulting classifier with its analogue trained for binary font classification.
We train neural networks for authenticity estimation of the fonts used in
machine-readable zones and ID numbers of the Russian national passport and test
them on samples of individual characters acquired from 3238 images of the
Russian national passport. Our results show that the usage of multi-task
learning increases sensitivity and specificity of the classifier. Moreover, the
resulting CNNs demonstrate high generalization ability as they correctly
classify fonts which were not present in the training set. We conclude that the
proposed method is sufficient for authentication of the fonts and can be used
as a part of the forgery detection system for images acquired with a smartphone
camera.
","[{""version"":""v1"",""created"":""Thu, 18 Oct 2018 12:44:05 GMT""}]","2019-03-26"
"1810.08017","Tom Sgouros","Tom Sgouros","A mathematical theory of imperfect communication: Energy efficiency
  considerations in multi-level coding","22 pages, 5 figures",,,,"cs.IT math.IT","http://arxiv.org/licenses/nonexclusive-distrib/1.0/","  Is perfect error correction always worth the trouble? A framework is
presented for the analysis of error detection and correction in multi-level
systems of communication that takes into account degrees of freedom attended
and ignored by different levels of analysis. It follows from this analysis that
for a multi-level coding system, skipped or incomplete error correction at many
levels can save energy and provide equally good results to perfect correction.
This has relevance to approximate computing, and to questions of the robustness
of machine learning applications. The finding also has significance in natural
systems, such as neuronal signaling, vision, and molecular genetics, which are
readily characterized as relying on multiple layers of inadequate error
correction.
","[{""version"":""v1"",""created"":""Thu, 18 Oct 2018 12:44:34 GMT""},{""version"":""v2"",""created"":""Fri, 2 Nov 2018 22:04:06 GMT""},{""version"":""v3"",""created"":""Fri, 15 Feb 2019 15:44:36 GMT""},{""version"":""v4"",""created"":""Tue, 14 Jan 2020 16:18:30 GMT""}]","2020-01-15"
"1810.08018","Konstantin Borodianskiy","Alexander Sobolev, Alexey Kossenko, Michael Zinigrad, Konstantin
  Borodianskiy","Coating of Aluminum Alloys by Micro Arc Oxidation in Nitrate Salt",,"The Seventeenth Israeli - Russian Bi-National Workshop 2018. The
  optimization of composition, structure and properties of metals, oxides,
  composites, nano and amorphous materials, Ariel, Israel, (2018), 190-198",,,"physics.app-ph cond-mat.mtrl-sci","http://arxiv.org/licenses/nonexclusive-distrib/1.0/","  Plasma electrolytic oxidation (PEO) is a process for obtaining oxide coatings
on valve metals. Mostly PEO is done in an aqueous solution electrolyte which
limits the size of treated parts due to the system heating up. In presented
work an alternative method of PEO processing applied in aluminum 1050 alloy in
nitrate molten salt was investigated. The morphology, phase and chemical
compositions, micro-hardness, and corrosion resistance were examined using. The
obtained results showed that formed coating contains from two sub-layers, outer
soft layer with the thickness of 4 micrometer and inner, denser layer with the
thickness of 5 micrometer. The formed coating consists of corundum, {\gamma} -
Al2O3, {\theta} - Al2O3 and is free of any contaminants originated from the
electrolyte.
","[{""version"":""v1"",""created"":""Thu, 18 Oct 2018 12:44:40 GMT""}]","2018-10-22"
"1810.08019","Konstantin Borodianskiy","Konstantin Borodianskiy","Strengthening of copper by carbon nanotubes",,"The Seventeenth Israeli - Russian Bi-National Workshop 2018. The
  optimization of composition, structure and properties of metals, oxides,
  composites, nano and amorphous materials. Ariel, Israel, (2018) 9-16",,,"cond-mat.mtrl-sci","http://arxiv.org/licenses/nonexclusive-distrib/1.0/","  The influence of a modifier based on multi walled carbon nanotubes (MWCNT) is
investigated using C11000 copper alloy. The influence of the modifier addition
into the melt was investigated using tensile test, hardness measurements, X-ray
diffraction method and microstructural investigations. It was evaluated that
the yield and tensile strengths of the metal increased due to the
microstructural changes in the formed metal after addition of 0.01wt.% of the
MWCNTs. It was also evaluated that the addition of mentioned amount of MWCNT
into alloy has no influence to the phase composition of the formed metal.
","[{""version"":""v1"",""created"":""Thu, 18 Oct 2018 12:50:38 GMT""}]","2018-10-19"
"1810.08020","Alexey Gavrilov","A.V. Gavrilov","A steady Euler flow with compact support","Comments: 7 pages, to appear in Geometric and Functional Analysis",,,,"math.DG","http://arxiv.org/licenses/nonexclusive-distrib/1.0/","  A nontrivial smooth steady incompressible Euler flow in three dimensions with
compact support is constructed. Another uncommon property of this solution is
the dependence between the Bernoulli function and the pressure.
","[{""version"":""v1"",""created"":""Thu, 18 Oct 2018 12:51:20 GMT""}]","2018-10-19"
"1810.08021","Manu Kumar Gupta","Manu K. Gupta and N. Hemachandra","On a Conjecture for Dynamic Priority Queues and Nash Equilibrium for
  Quality of Service Sensitive Markets",,,,,"math.OC","http://arxiv.org/licenses/nonexclusive-distrib/1.0/","  Many economic transactions, including those of online markets, have a time
lag between the start and end times of transactions. Customers need to wait for
completion of their transaction (order fulfillment) and hence are also
interested in their waiting time as a Quality of Service (QoS) attribute. So,
they factor this QoS in the demand they offer to the firm (service-provider)
and some customers (user-set) would be willing to pay for shorter waiting
times. On the other hand, such waiting times depend on the demand user-set
offers to the service-provider. We model the above economic-QoS strategic
interaction between service-provider and user-set under a fairly generic
scheduling framework as a non-cooperative constrained game. We use an existing
joint pricing and scheduling model. An optimal solution to this joint pricing
and scheduling problem was guaranteed by a finite step algorithm subject to a
conjecture. We first settle this conjecture based on queuing and optimization
arguments and discuss its implications on the above game. We show that a
continuum of Nash equilibria (NE) exists and it can be computed easily using
constrained best response dynamics. Revenue maximal NE is identified by above
finite step algorithm. We illustrate how both players can benefit at such
revenue maximal NE by identifying suitable operational decisions, i.e., by
choosing an appropriate game along the theme of pricing and revenue management.
","[{""version"":""v1"",""created"":""Thu, 18 Oct 2018 12:51:25 GMT""}]","2018-10-19"
"1810.08022","Florian Aigner","Florian Aigner","A new determinant for the $Q$-enumeration of alternating sign matrices","replaced with revised version","J. Combin. Theory Ser. A 180 (2021)","10.1016/j.jcta.2021.105412",,"math.CO","http://creativecommons.org/licenses/by-nc-nd/4.0/","  Fischer provided a new type of binomial determinant for the number of
alternating sign matrices involving the third root of unity. In this paper we
prove that her formula, when replacing the third root of unity by an
indeterminate $q$, is actually the $(2+q+q^{-1})$-enumeration of alternating
sign matrices. By evaluating a generalisation of this determinant we are able
to reprove a conjecture of Mills, Robbins and Rumsey stating that the
$Q$-enumeration is a product of two polynomials in $Q$. Further we provide a
closed product formula for the generalised determinant in the 0-,1- 2- and
3-enumeration case, leading to a new proof of the $1$-,$2$- and $3$-enumeration
of alternating sign matrices, and a factorisation in the $4$-enumeration case.
Finally we relate the $1$-enumeration of our generalised determinant to the
determinant evaluations of Ciucu, Eisenk\""olbl, Krattenthaler and Zare, which
counts weighted cyclically symmetric lozenge tilings of a hexagon with a
triangular hole and is a generalisation of a famous result by Andrews.
","[{""version"":""v1"",""created"":""Thu, 18 Oct 2018 13:00:50 GMT""},{""version"":""v2"",""created"":""Wed, 27 Jan 2021 13:56:53 GMT""}]","2021-01-28"
"1810.08023","Olivier Lai","Olivier Lai, William Guerin, Farrokh Vakili, Robin Kaiser, Jean Pierre
  Rivet, Mathilde Fouch\'e, Guillaume Labeyrie, Julien Chab\'e, Cl\'ement
  Courde, Etienne Samain, David Vernet","Intensity Interferometry revival on the C\^ote d'Azur","SPIE Conference proceedings, 12 pages","Proceedings of the SPIE, Volume 10701, id. 1070121 12 pp. (2018)","10.1117/12.2309491",,"astro-ph.IM","http://arxiv.org/licenses/nonexclusive-distrib/1.0/","  Recent advances in photonics have revived the interest in intensity
interferometry for astronomical applications. The success of amplitude
interferometry in the early 1970s, which is now mature and producing
spectacular astrophysical results (e.g. GRAVITY, MATISSE, CHARA, etc.), coupled
with the limited sensitivity of intensity interferometry stalled any progress
on this technique for the past 50 years. However, the precise control of the
optical path difference in amplitude interferometry is constraining for very
long baselines and at shorter wavelengths. Polarization measurements are also
challenging in amplitude interferometry due to instrumental effects. The
fortuitous presence of strong groups in astronomical interferometry and quantum
optics at Universite Cote d'Azur led to the development of a prototype
experiment at Calern Observatory, allowing the measure of the temporal
correlation g(2)(\tau, r=0) in 2016 and of the spatial correlation g^(2)(r) in
2017 with a gain in sensitivity (normalized in observing time and collecting
area) of a factor ~100 compared to Hanbury Brown and Twiss's original Narrabri
Interferometer. We present possible ways to further develop this technique and
point to possible implementations on existing facilities, such as CTA, the VLTI
ATs or the summit of Maunakea, which offer a unique scientific niche.
","[{""version"":""v1"",""created"":""Thu, 18 Oct 2018 13:01:03 GMT""}]","2018-10-19"
"1810.08024","Tomasz Kazimierczuk","Tomasz Kazimierczuk, Aleksander Bogucki, Tomasz Smole\'nski, Mateusz
  Goryca, Cl\'ement Faugeras, Pawe{\l} Machnikowski, Marek Potemski, Piotr
  Kossacki","Time-resolved magneto-Raman study of carrier dynamics in low Landau
  levels of graphene",,"Phys. Rev. B 100, 075401 (2019)","10.1103/PhysRevB.100.075401",,"cond-mat.mes-hall","http://arxiv.org/licenses/nonexclusive-distrib/1.0/","  We study the relaxation dynamics of the electron system in graphene flakes
under Landau quantization regime using a novel approach of time-resolved Raman
scattering. The non-resonant character of the experiment allows us to analyze
the field dependence of the relaxation rate. Our results clearly evidence sharp
increase in the relaxation rate upon the resonance between the energy of the
Landau transition and the G-band and shed new light on relaxation mechanism of
the Landau-quantized electrons in graphene beyond the previously studied Auger
scattering.
","[{""version"":""v1"",""created"":""Thu, 18 Oct 2018 13:01:16 GMT""}]","2019-08-07"
"1810.08025","Konstantin Borodianskiy","A Titlov, G Krushenko, C Reshetnikova, K Borodianskiy","Nanomodification of aluminum alloys",,"The Tenth International Conference on Material Technologies and
  Modeling MMT-2018, Ariel (2018), vol. 4, 76-82",,,"cond-mat.mtrl-sci","http://arxiv.org/licenses/nonexclusive-distrib/1.0/","  NPs are ultrafine-grain crystal or amorphous substances which are as small as
100nm. They have unique physical, chemical and mechanical properties, which are
very different from those of large scale materials. This uniqueness is
attributed to the fact that the number of atoms in the surface layer and in the
bulk is commensurable. As the atoms in the surface layer of nanoparticles have
their counterparts from one side only, their balance is impaired, and the
resulting structure relaxation leads to the displacement of atomic spacing in a
2-3nm layer. Therefore the surface layers expand while internal layers
compressed, as these are exposed to an excessive Laplace pressure of up to
hundreds kilobars. Nanoparticles have a highly distorted lattice that has an
effect on activation energy of most of the processes they are involved in, by
changing their nature and sequence. Nanoscale implies absolutely new effects,
properties and processes which are defined by the laws of quantum mechanics,
size quantization in small-scale structures, surface-bulk ratio, and other
factors. Due to exceptionally small sizes and good reactivity of NP particles,
it looks promising to use them in metal melts as crystallization centers to
enable structure refinement of cast products. As well known, the grains are
finer, the better are mechanical properties of cast products produced from
these alloys. After considering a number of options, an efficient method of
nanopowder introduction into a liquid metal was proposed. This method avoids
all of the above problems and consists in pressing of 5-9.5mm diameter rods or
wires that contain aluminum particles (granules and nanopowder). Nanopowder
contents in rods added NP to alloys being no more than 0.05%, and sometimes
even thousandths of one percent.
","[{""version"":""v1"",""created"":""Thu, 18 Oct 2018 13:01:46 GMT""}]","2018-10-19"
"1810.08026","Nicolina Chrysaphi","Nicolina Chrysaphi, Eduard P. Kontar, Gordon D. Holman, Manuela Temmer","CME-driven Shock and Type II Solar Radio Burst Band Splitting","Published by ApJ, 13 pages, 7 figures",,"10.3847/1538-4357/aae9e5",,"astro-ph.SR astro-ph.HE physics.plasm-ph","http://arxiv.org/licenses/nonexclusive-distrib/1.0/","  Coronal Mass Ejections (CMEs) are believed to be effective in producing
shocks in the solar corona and the interplanetary space. One of the important
signatures of shocks and shock acceleration are Type II solar radio bursts that
drift with the shock speed and produce bands of fundamental and higher harmonic
plasma radio emission. An intriguing aspect of Type II radio bursts is the
occasional split of a harmonic band into thinner lanes, known as
band-splitting. Here, we report a detailed imaging and spectroscopic
observation of a CME-driven shock producing band-splitting in a Type II burst.
Using the Low Frequency Array (LOFAR), we examine the spatial and temporal
relation of the Type II burst to the associated CME event, use source imaging
to calculate the apparent coronal density, and demonstrate how source imaging
can be used to estimate projection effects. We consider two widely accepted
band-splitting models that make opposing predictions regarding the locations of
the true emission sources with respect to the shock front. Our observations
suggest that the locations of the upper and lower sub-band sources are
spatially separated by $\sim 0.2 \pm 0.05 \, \mathrm{R_\odot}$. However, we
quantitatively show, for the first time, that such separation is consistent
with radio-wave scattering of plasma radio emission from a single region,
implying that the split-band Type II sources could originate from nearly
co-spatial locations. Considering the effects of scattering, the observations
provide supporting evidence for the model that interprets the band-splitting as
emission originating in the upstream and downstream regions of the shock front,
two virtually co-spatial areas.
","[{""version"":""v1"",""created"":""Thu, 18 Oct 2018 13:02:23 GMT""},{""version"":""v2"",""created"":""Wed, 31 Oct 2018 16:16:07 GMT""},{""version"":""v3"",""created"":""Tue, 27 Nov 2018 12:23:02 GMT""}]","2018-11-28"
