"1810.11551","Arman Rahimzamani","Arman Rahimzamani, Himanshu Asnani, Pramod Viswanath, Sreeram Kannan","Estimators for Multivariate Information Measures in General Probability
  Spaces","34 pages, 4 figures; To appear in the thirty-second Conference on
  Neural Information Processing Systems 2018",,,,"cs.IT math.IT","http://arxiv.org/licenses/nonexclusive-distrib/1.0/","  Information theoretic quantities play an important role in various settings
in machine learning, including causality testing, structure inference in
graphical models, time-series problems, feature selection as well as in
providing privacy guarantees. A key quantity of interest is the mutual
information and generalizations thereof, including conditional mutual
information, multivariate mutual information, total correlation and directed
information. While the aforementioned information quantities are well defined
in arbitrary probability spaces, existing estimators add or subtract entropies
(we term them $\Sigma H$ methods). These methods work only in purely discrete
space or purely continuous case since entropy (or differential entropy) is well
defined only in that regime.
  In this paper, we define a general graph divergence measure ($\mathbb{GDM}$),
as a measure of incompatibility between the observed distribution and a given
graphical model structure. This generalizes the aforementioned information
measures and we construct a novel estimator via a coupling trick that directly
estimates these multivariate information measures using the Radon-Nikodym
derivative. These estimators are proven to be consistent in a general setting
which includes several cases where the existing estimators fail, thus providing
the only known estimators for the following settings: (1) the data has some
discrete and some continuous-valued components (2) some (or all) of the
components themselves are discrete-continuous mixtures (3) the data is
real-valued but does not have a joint density on the entire space, rather is
supported on a low-dimensional manifold. We show that our proposed estimators
significantly outperform known estimators on synthetic and real datasets.
","[{""version"":""v1"",""created"":""Fri, 26 Oct 2018 23:14:47 GMT""}]","2018-10-30"
"1810.11552","Jeremy Usatine","Max Kutler and Jeremy Usatine","Motivic zeta functions of hyperplane arrangements","25 pages",,,,"math.AG","http://arxiv.org/licenses/nonexclusive-distrib/1.0/","  For each central essential hyperplane arrangement $\mathcal{A}$ over an
algebraically closed field, let $Z_\mathcal{A}^{\hat\mu}(T)$ denote the
Denef-Loeser motivic zeta function of $\mathcal{A}$. We prove a formula
expressing $Z_\mathcal{A}^{\hat\mu}(T)$ in terms of the Milnor fibers of
related hyperplane arrangements. We use this formula to show that the map
taking each complex arrangement $\mathcal{A}$ to the Hodge-Deligne
specialization of $Z_{\mathcal{A}}^{\hat\mu}(T)$ is locally constant on the
realization space of any loop-free matroid. We also prove a combinatorial
formula expressing the motivic Igusa zeta function of $\mathcal{A}$ in terms of
the characteristic polynomials of related arrangements.
","[{""version"":""v1"",""created"":""Fri, 26 Oct 2018 23:24:25 GMT""}]","2018-10-30"
"1810.11553","Krystal Taylor","Kyle Hambrook, Krystal Taylor","Measure and Dimension of Sums and Products",,,,,"math.CA","http://arxiv.org/licenses/nonexclusive-distrib/1.0/","  We investigate the Lebesgue measure, Hausdorff dimension, and Fourier
dimension of sets of the form $RY + Z, $ where $R \subseteq (0,\infty)$ and $Y,
Z \subseteq \mathbb{R}^d$. We prove a theorem on the Lebesgue measure and
Hausdorff dimension of $RY+Z$; The theorem is a generalized variant of some
theorems of Wolff and Oberlin in which $Y$ is the unit sphere, but its proof is
much simpler. We also prove a deeper existence theorem: For each $\alpha \in
[0,1]$ and for each non-empty compact set $R \subseteq (0,\infty)$, there
exists a compact set $Y \subseteq [1,2]$ such that $\dim_F(Y) = \dim_H(Y) =
\overline{\dim_M}(Y) = \alpha$ and $\dim_F(RY) \geq \min\{ 1, \dim_F(R) +
\dim_F(Y)\}$. This theorem verifies a weak form of a more general conjecture,
and it can be used to produce new Salem sets from old ones.
","[{""version"":""v1"",""created"":""Fri, 26 Oct 2018 23:33:25 GMT""},{""version"":""v2"",""created"":""Sat, 6 Feb 2021 17:13:33 GMT""}]","2021-02-09"
"1810.11554","Andrea Giorgini","Andrea Giorgini, Alain Miranville and Roger Temam","Uniqueness and regularity for the Navier-Stokes-Cahn-Hilliard system",,,,,"math.AP","http://arxiv.org/licenses/nonexclusive-distrib/1.0/","  The motion of two contiguous incompressible and viscous fluids is described
within the diffuse interface theory by the so-called Model H. The system
consists of the Navier-Stokes equations, which are coupled with the
Cahn-Hilliard equation associated to the Ginzburg-Landau free energy with
physically relevant logarithmic potential. This model is studied in bounded
smooth domain in R^d, d=2 and d=3, and is supplemented with a no-slip condition
for the velocity, homogeneous Neumann boundary conditions for the order
parameter and the chemical potential, and suitable initial conditions. We study
uniqueness and regularity of weak and strong solutions. In a two-dimensional
domain, we show the uniqueness of weak solutions and the existence and
uniqueness of global strong solutions originating from an initial velocity u_0
in V, namely u_0 in H_0^1 such that div u_0=0. In addition, we prove further
regularity properties and the validity of the instantaneous separation
property. In a three-dimensional domain, we show the existence and uniqueness
of local strong solutions with initial velocity u_0 in V.
","[{""version"":""v1"",""created"":""Fri, 26 Oct 2018 23:36:02 GMT""}]","2018-10-30"
"1810.11555","Henry Kvinge","Henry Kvinge","Coherent systems of probability measures on graphs for representations
  of free Frobenius towers","24 pages",,,,"math.RT math.CO math.PR","http://arxiv.org/licenses/nonexclusive-distrib/1.0/","  First formally defined by Borodin and Olshanski, a coherent system on a
graded graph is a sequence of probability measures which respect the action of
certain down/up transition functions between graded components. In one common
example of such a construction, each measure is the Plancherel measure for the
symmetric group $S_{n}$ and the down transition function is induced from the
inclusions $S_{n} \hookrightarrow S_{n+1}$.
  In this paper we generalize the above framework to the case where $\{A_n\}_{n
\geq 0}$ is any free Frobenius tower and $A_n$ is no longer assumed to be
semisimple. In particular, we describe two coherent systems on graded graphs
defined by the representation theory of $\{A_n\}_{n \geq 0}$ and connect one of
these systems to a family of central elements of $\{A_n\}_{n \geq 0}$. When the
algebras $\{A_n\}_{n \geq 0}$ are not semisimple, the resulting coherent
systems reflect the duality between simple $A_n$-modules and indecomposable
projective $A_n$-modules.
","[{""version"":""v1"",""created"":""Fri, 26 Oct 2018 23:37:20 GMT""}]","2018-10-30"
"1810.11556","Yuhang Che","Yuhang Che, Allison M. Okamura, Dorsa Sadigh","Efficient and Trustworthy Social Navigation Via Explicit and Implicit
  Robot-Human Communication",,"IEEETransactionsonRobotics,pp(99):1-16,2020","10.1109/TRO.2020.2964824",,"cs.RO","http://arxiv.org/licenses/nonexclusive-distrib/1.0/","  In this paper, we present a planning framework that uses a combination of
implicit (robot motion) and explicit (visual/audio/haptic feedback)
communication during mobile robot navigation. First, we developed a model that
approximates both continuous movements and discrete behavior modes in human
navigation, considering the effects of implicit and explicit communication on
human decision making. The model approximates the human as an optimal agent,
with a reward function obtained through inverse reinforcement learning. Second,
a planner uses this model to generate communicative actions that maximize the
robot's transparency and efficiency. We implemented the planner on a mobile
robot, using a wearable haptic device for explicit communication. In a user
study of an indoor human-robot pair of orthogonal crossing situation, the robot
was able to actively communicate its intent to users in order to avoid
collisions and facilitate efficient trajectories. Results showed that the
planner generated plans that were easier to understand, reduced users' effort,
and increased users' trust of the robot, compared to simply performing
collision avoidance. The key contribution of this work is the integration and
analysis of explicit communication (together with implicit communication) for
social navigation.
","[{""version"":""v1"",""created"":""Fri, 26 Oct 2018 23:38:20 GMT""},{""version"":""v2"",""created"":""Mon, 24 Feb 2020 00:04:24 GMT""}]","2020-02-25"
"1810.11557","Simon Demers","Simon Demers","The Duration of Optimal Stopping Problems","37 pages, 2 figures, 4 tables. This version contains important
  corrections and additional extensions",,,,"stat.AP stat.CO","http://creativecommons.org/licenses/by/4.0/","  Optimal stopping problems give rise to random distributions describing how
many applicants the decision-maker will sample or interview before choosing
one, a quantity sometimes referred to as the search time or process duration.
This research note surveys several variants of optimal stopping problems,
extends earlier results in various directions, and shows how many interviews
are expected to be conducted in various settings. The focus is on problems that
require a decision-maker to choose a candidate from a pool of sequential
applicants with no recall, in the vein of previously studied Cayley-Moser,
Secretary and Sultan's Dowry problems.
","[{""version"":""v1"",""created"":""Fri, 26 Oct 2018 23:49:34 GMT""},{""version"":""v2"",""created"":""Mon, 5 Aug 2019 04:21:30 GMT""},{""version"":""v3"",""created"":""Wed, 11 Dec 2019 21:44:04 GMT""}]","2019-12-13"
"1810.11558","Humberto Gonzalez","Qingzhu Gao, Humberto Gonzalez, and Parvez Ahammad","MCA-based Rule Mining Enables Interpretable Inference in Clinical
  Psychiatry",,,"10.1007/978-3-030-24409-5_3",,"cs.LG stat.ML","http://arxiv.org/licenses/nonexclusive-distrib/1.0/","  Development of interpretable machine learning models for clinical healthcare
applications has the potential of changing the way we understand, treat, and
ultimately cure, diseases and disorders in many areas of medicine. These models
can serve not only as sources of predictions and estimates, but also as
discovery tools for clinicians and researchers to reveal new knowledge from the
data. High dimensionality of patient information (e.g., phenotype, genotype,
and medical history), lack of objective measurements, and the heterogeneity in
patient populations often create significant challenges in developing
interpretable machine learning models for clinical psychiatry in practice. In
this paper we take a step towards the development of such interpretable models.
First, by developing a novel categorical rule mining method based on
Multivariate Correspondence Analysis (MCA) capable of handling datasets with
large numbers of features, and second, by applying this method to build
transdiagnostic Bayesian Rule List models to screen for psychiatric disorders
using the Consortium for Neuropsychiatric Phenomics dataset. We show that our
method is not only at least 100 times faster than state-of-the-art rule mining
techniques for datasets with 50 features, but also provides interpretability
and comparable prediction accuracy across several benchmark datasets.
","[{""version"":""v1"",""created"":""Fri, 26 Oct 2018 23:51:08 GMT""},{""version"":""v2"",""created"":""Sun, 16 Dec 2018 22:44:07 GMT""}]","2019-08-06"
"1810.11559","Zeinab Sanjabi Eznaveh","Z. Sanjabieznaveh, M. A. Eftekhar, J. E. Antonio Lopez, H. Lopez
  Aviles, M. Kolesik, F. W. Wise, D. N. Christodoulides, and R. Amezcua Correa","Blue-enhanced Supercontinuum Generation in a Fluorine-doped Graded-index
  Multimode Fiber",,,,,"physics.optics","http://arxiv.org/licenses/nonexclusive-distrib/1.0/","  Blue-enhanced, broadband supercontinuum generation in a 50 um core
fluorine-doped graded-index multimode fiber is demonstrated by pumping with a
1064 nm picosecond source. Multi-octave supercontinuum spectrum extending from
~400 nm to 2,400 nm is achieved in a relatively short fiber. The measured
spectrum and multimode nonlinear properties are compared to those of a
germanium-doped graded-index multimode fiber. It is shown that engineering the
glass composition and thus its chromatic dispersion and absorption
characteristics, provides a novel and effective approach to further controlling
the nonlinear dynamics in highly multimoded parabolic-index fibers.
","[{""version"":""v1"",""created"":""Sat, 27 Oct 2018 00:04:25 GMT""}]","2018-10-30"
"1810.11560","Dan-Wei Zhang","Xue-Ying Mai, Yan-Qing Zhu, Zhi Li, Dan-Wei Zhang, and Shi-Liang Zhu","Topological metal bands with double-triple-point fermions in optical
  lattices","11 pages, 9 figures; accepted in PRA","Phys. Rev. A 98, 053619 (2018)","10.1103/PhysRevA.98.053619",,"cond-mat.quant-gas cond-mat.mes-hall quant-ph","http://arxiv.org/licenses/nonexclusive-distrib/1.0/","  Novel fermionic quasiparticles with integer pseudospins in some energy bands,
such as pseudospin-1 triple-point fermions, recently attract increasing
interest since they are beyond the conventional spin-$1/2$ Dirac and Weyl
counterparts. In this paper, we propose a class of pseudospin-1 fermioic
excitations emerging in topological metal bands, dubbed double-triple-point
(DTP) fermions. We first present a general three-band continuum model with
$C_4$ symmetry in three dimensions, which has three types of threefold
degenerate points in the bands classified by their topological charges
$C=\pm4,\pm2,0$, respectively. They are dubbed DTPs as spin-1 generalization of
double-Weyl points. We then construct two-dimensional and three-dimensional
tight-binding lattice models of topological metal bands with exotic DTP
fermions near the DTPs. In two dimensions, the band gaps close at a trivial DTP
with zero Berry phase, which occurs at the transition between the normal and
topological insulator phases. In three dimensions, the topological properties
of three different DTP fermions in lattice systems are further investigated,
and the effects of breaking $C_4$ symmetry are also studied, which generally
leads to splitting each quadratic DTP into two linear triple points and gives
topological phase diagrams. Using ultracold fermionic atoms in optical
lattices, the proposed models can be realized and the topological properties of
the DTP fermions can be detected.
","[{""version"":""v1"",""created"":""Sat, 27 Oct 2018 00:06:42 GMT""}]","2018-11-27"
"1810.11561","M. P. Reiter","M.P. Reiter, S. Ayet San Andr\'es, S. Nikas, J. Lippuner, C. Andreoiu,
  C. Babcock, B.R. Barquest, J. Bollig, T. Brunner, T. Dickel, J. Dilling, I.
  Dillmann, E. Dunling, G. Gwinner, L. Graham, C. Hornung, R. Klawitter, B.
  Kootte, A.A. Kwiatkowski, Y. Lan, D. Lascar, K.G. Leach, E. Leistenschneider,
  G. Mart\'inez-Pinedo, J.E. McKay, S.F. Paul, W.R. Pla\ss, L. Roberts, H.
  Schatz, C. Scheidenberger, A. Sieverding, R. Steinbr\""ugge, R. Thompson, M.E.
  Wieser, C. Will, D. Welch","Mass Measurements of Neutron-Rich Gallium Isotopes Refine Production of
  Nuclei of the First r-Process Abundance Peak in Neutron Star Merger
  Calculations",,"Phys. Rev. C 101, 025803 (2020)","10.1103/PhysRevC.101.025803",,"nucl-ex astro-ph.HE nucl-th","http://creativecommons.org/licenses/by-nc-sa/4.0/","  We report mass measurements of neutron-rich Ga isotopes $^{80-85}$Ga with
TRIUMF's Ion Trap for Atomic and Nuclear science (TITAN). The measurements
determine the masses of $^{80-83}$Ga in good agreement with previous
measurements. The masses of $^{84}$Ga and $^{85}$Ga were measured for the first
time. Uncertainties between $25-48$ keV were reached. The new mass values
reduce the nuclear uncertainties associated with the production of A $\approx$
84 isotopes by the \emph{r}-process for astrophysical conditions that might be
consistent with a binary neutron star (BNS) merger producing a blue kilonova.
Our nucleosynthesis simulations confirm that BNS merger may contribute to the
first abundance peak under moderate neutron-rich conditions with electron
fractions $Y_e=0.35-0.38$.
","[{""version"":""v1"",""created"":""Sat, 27 Oct 2018 00:13:14 GMT""},{""version"":""v2"",""created"":""Thu, 30 Jan 2020 13:58:42 GMT""}]","2020-02-19"
"1810.11562","Henry Kvinge","Henry Kvinge, Elin Farnell, Michael Kirby, Chris Peterson","Monitoring the shape of weather, soundscapes, and dynamical systems: a
  new statistic for dimension-driven data analysis on large data sets","Accepted to the 2018 IEEE International Conference on BIG DATA, 9
  pages",,,,"cs.LG cs.CV physics.data-an stat.ML","http://arxiv.org/licenses/nonexclusive-distrib/1.0/","  Dimensionality-reduction methods are a fundamental tool in the analysis of
large data sets. These algorithms work on the assumption that the ""intrinsic
dimension"" of the data is generally much smaller than the ambient dimension in
which it is collected. Alongside their usual purpose of mapping data into a
smaller dimension with minimal information loss, dimensionality-reduction
techniques implicitly or explicitly provide information about the dimension of
the data set.
  In this paper, we propose a new statistic that we call the $\kappa$-profile
for analysis of large data sets. The $\kappa$-profile arises from a
dimensionality-reduction optimization problem: namely that of finding a
projection into $k$-dimensions that optimally preserves the secants between
points in the data set. From this optimal projection we extract $\kappa,$ the
norm of the shortest projected secant from among the set of all normalized
secants. This $\kappa$ can be computed for any $k$; thus the tuple of $\kappa$
values (indexed by dimension) becomes a $\kappa$-profile. Algorithms such as
the Secant-Avoidance Projection algorithm and the Hierarchical Secant-Avoidance
Projection algorithm, provide a computationally feasible means of estimating
the $\kappa$-profile for large data sets, and thus a method of understanding
and monitoring their behavior. As we demonstrate in this paper, the
$\kappa$-profile serves as a useful statistic in several representative
settings: weather data, soundscape data, and dynamical systems data.
","[{""version"":""v1"",""created"":""Sat, 27 Oct 2018 00:15:34 GMT""}]","2018-10-30"
"1810.11563","Leonard Susskind","Leonard Susskind","Three Lectures on Complexity and Black Holes","83 pages, 42 figures. This is the written version of three lectures
  on complexity and black holes",,,,"hep-th","http://arxiv.org/licenses/nonexclusive-distrib/1.0/","  Given at PiTP 2018 summer program entitled ""From Qubits to Spacetime."" The
first lecture describes the meaning of quantum complexity, the analogy between
entropy and complexity, and the second law of complexity.
  Lecture two reviews the connection between the second law of complexity and
the interior of black holes. I discuss how firewalls are related to periods of
non-increasing complexity which typically only occur after an exponentially
long time.
  The final lecture is about the thermodynamics of complexity, and
""uncomplexity"" as a resource for doing computational work. I explain the
remarkable power of ""one clean qubit,"" in both computational terms and in
space-time terms.
  The lectures can also be found online at
\url{https://static.ias.edu/pitp/2018/node/1796.html} .
","[{""version"":""v1"",""created"":""Sat, 27 Oct 2018 00:18:27 GMT""}]","2018-10-30"
"1810.11564","Yueke Hu","Yueke Hu and Paul D.Nelson","New test vector for Waldspurger's period integral, relative trace
  formula, and hybrid subconvexity bounds","Updated version contains application to relative trace formula
  computations and hybrid subconvexity bounds",,,,"math.NT","http://arxiv.org/licenses/nonexclusive-distrib/1.0/","  In this paper we give quantitative local test vectors for Waldspurger's
period integral (i.e., a toric period on $\text{GL}_2$) in new cases with joint
ramifications. The construction involves minimal vectors, rather than newforms
and their variants. This paper gives a uniform treatment for the matrix algebra
and division algebra cases under mild assumptions, and establishes an explicit
relation between the size of the local integral and the finite conductor
$C(\pi\times\pi_{\chi^{-1}})$. As an application, we combine the test vector
results with the relative trace formula, and prove a hybrid type subconvexity
bound which can be as strong as the Weyl bound in proper range.
","[{""version"":""v1"",""created"":""Sat, 27 Oct 2018 00:19:35 GMT""},{""version"":""v2"",""created"":""Thu, 6 Aug 2020 06:24:09 GMT""}]","2020-08-07"
"1810.11565","Aaron Hurst","A.M. Hurst, A. Sweet, B.L. Goldblum, R.B. Firestone, M.S. Basunia,
  L.A. Bernstein, Zs. Revay, L. Szentmiklosi, T. Belgya, J.E. Escher, I.
  Harsanyi, M. Krticka, B.W. Sleaford, and J. Vujic","Radiative-capture cross sections for the $^{139}$La($n,\gamma$)
  reactionusing thermal neutrons and structural properties of $^{140}$La","37 pages, 11 figures, 8 tables","Phys. Rev. C 99, 024310 (2019)","10.1103/PhysRevC.99.024310",,"nucl-ex","http://arxiv.org/licenses/nonexclusive-distrib/1.0/","  A set of prompt partial $\gamma$-ray production cross sections from thermal
neutron-capture were measured for the $^{139}$La($n,\gamma$) reaction using a
guided beam of subthermal (thermal and cold) neutrons incident upon a $^{\rm
nat}$La$_{2}$O$_{3}$ target at the Prompt Gamma Activation Analysis facility of
the Budapest Research Reactor. Absolute $^{140}$La cross sections were
determined relative to the well-known comparator $^{35}$Cl($n,\gamma$) cross
sections from the irradiation of a stoichiometric $^{\rm nat}$LaCl$_{3}$
sample. The total cross section for radiative thermal neutron-capture on
$^{139}$La from the sum of experimentally measured cross sections observed to
directly feed the $^{140}$La ground state was determined to be $\sigma_{0}^{\rm
expt} = 8.58(50)$ b. To assess completeness of the decay scheme and as a
consistency check, the measured cross sections for transitions feeding the
ground state from levels below a critical energy of $E_{c} = 285$ keV were
combined with a modeled contribution accounting for ground-state feeding from
the quasicontinuum to arrive at a total cross section of $\sigma_{0} =
9.36(74)$ b. In addition, a neutron-separation energy of $S_{n} = 5161.005(21)$
keV was determined from a least-squares fit of the measured primary
$\gamma$-ray energies to the low-lying levels of the $^{140}$La decay scheme.
Furthermore, several nuclear structure improvements are proposed for the decay
scheme. The measured cross-section and separation-energy results are comparable
to earlier measurements of these quantities.
","[{""version"":""v1"",""created"":""Sat, 27 Oct 2018 00:21:19 GMT""}]","2019-02-20"
"1810.11566","Brian Mastracci","Brian Mastracci and Wei Guo","Characterizing vortex tangle properties in steady-state He II
  counterflow using particle tracking velocimetry","Submitted to Physical Review Fluids","Phys. Rev. Fluids 4, 023301 (2019)","10.1103/PhysRevFluids.4.023301",,"cond-mat.other","http://arxiv.org/licenses/nonexclusive-distrib/1.0/","  Historically, there is little faith in particle tracking velocimetry (PTV) as
a tool to make quantitative measurements of thermal counterflow in He II, since
tracer particle motion is complicated by influences from the normal fluid,
superfluid, and quantized vortex lines, or a combination thereof. Recently, we
introduced a scheme for differentiating particles trapped on vortices (G1) from
particles entrained by the normal fluid (G2). In this paper, we apply this
scheme to demonstrate the utility of PTV for quantitative measurements of
vortex dynamics in He II counterflow. We estimate $\ell$, the mean vortex line
spacing, using G2 velocity data, and $c_2$, a parameter related to the mean
curvature radius of vortices and energy dissipation in quantum turbulence,
using G1 velocity data. We find that both estimations show good agreement with
existing measurements that were obtained using traditional experimental
methods. This is of particular consequence since these parameters likely vary
in space, and PTV offers the advantage of spatial resolution. We also show a
direct link between power-law tails in transverse particle velocity probability
density functions (PDFs) and reconnection of vortex lines on which G1 particles
are trapped.
","[{""version"":""v1"",""created"":""Sat, 27 Oct 2018 00:23:05 GMT""}]","2019-02-13"
