"1810.11617","Francisco Silva","Abderrahim Jourani and Francisco J. Silva","Metric regularity under G\^ateaux differentiability with applications to
  optimization and stochastic optimal control problems","24 pages, 1 figure",,,,"math.OC","http://arxiv.org/licenses/nonexclusive-distrib/1.0/","  The main objective of this work is to study the existence of Lagrange
multipliers for infinite dimensional problems under G\^ateux differentiability
assumptions on the data. Our investigation follows two main steps: the proof of
the existence of Lagrange multipliers under a calmness assumption on the
constraints and the study of sufficient conditions, which only use the
G\^ateaux derivative of the function defining the constraint, that ensure this
assumption.
","[{""version"":""v1"",""created"":""Sat, 27 Oct 2018 08:36:47 GMT""}]","2018-10-30"
"1810.11618","Bernd Baumann","Said El-Busaidy and Bernd Baumann and Marcus Wolff and Lars Duggen","Photoacoustics Modelling using Amplitude Mode Expansion Method in a
  Multiscale T-cell Resonator","Comsol Conference 2018",,,,"physics.comp-ph","http://arxiv.org/licenses/nonexclusive-distrib/1.0/","  The photoacoustic (PA) effect consisting of the generation of an acoustic
signal based on the absorption of light has already demonstrated its potential
for various spectroscopic applications for both gaseous and solid samples. The
signal produced during photoacoustic spectroscopy (PAS) measurement is,
however, usually weak and needs to be amplified. This is achieved by using a
photoacoustic cell resonator where acoustic resonances are utilized to
significantly boost the signal. Therefore, a PA resonator has a significant
role in PAS measurement set-ups. When designing or optimizing a new PA
resonator, numerical methods are generally used to simulate the photoacoustic
signal generation. In this paper, the amplitude mode expansion (AME) method is
presented as a quick and accurate simulation tool. The method is used to
simulate the photoacoustic signal in a multi-scale T-cell resonator over a wide
frequency range. The AME method is based on eigenmode expansion and
introduction of losses by quality factors. The AME simulation results are
compared and analyzed against the results from the viscothermal method.
Reasonably good agreement is obtained between the two methods. However, small
frequency shifts in the resonances of the AME method are noted. The shifts are
attributed to the location of the dominant mode within the T-cell. The
viscothermal method is considered the most accurate method for simulating the
photoacoustic signal in small resonators. However, it is computationally very
demanding. The AME method provides a much faster simulation alternative. This
is particularly useful in the design and optimization of photoacoustic
resonators where numerical methods are preferred over experimental measurements
due to their speed and low cost.
","[{""version"":""v1"",""created"":""Sat, 27 Oct 2018 08:39:32 GMT""}]","2018-10-30"
"1810.11619","Daniel Sevcovic","Sona Kilianova, Daniel Sevcovic","Expected Utility Maximization and Conditional Value-at-Risk
  Deviation-based Sharpe Ratio in Dynamic Stochastic Portfolio Optimization",,,,,"q-fin.PM","http://arxiv.org/licenses/nonexclusive-distrib/1.0/","  In this paper we investigate the expected terminal utility maximization
approach for a dynamic stochastic portfolio optimization problem. We solve it
numerically by solving an evolutionary Hamilton-Jacobi-Bellman equation which
is transformed by means of the Riccati transformation. We examine the
dependence of the results on the shape of a chosen utility function in regard
to the associated risk aversion level. We define the
  Conditional value-at-risk deviation ($CVaRD$) based Sharpe ratio for
measuring risk-adjusted performance of a dynamic portfolio. We compute optimal
strategies for a portfolio investment problem motivated by the German DAX 30
Index and we evaluate and analyze the dependence of the $CVaRD$-based Sharpe
ratio on the utility function and the associated risk aversion level.
","[{""version"":""v1"",""created"":""Sat, 27 Oct 2018 08:47:36 GMT""}]","2018-10-30"
"1810.11620","Minki Kim","Ilkyoo Choi, Jinha Kim, and Minki Kim","On operations preserving semi-transitive orientability of graphs",,,"10.1007/s10878-018-0358-7",,"math.CO","http://arxiv.org/licenses/nonexclusive-distrib/1.0/","  We consider the class of semi-transitively orientable graphs, which is a much
larger class of graphs compared to transitively orientable graphs, in other
words, comparability graphs. Ever since the concept of a semi-transitive
orientation was defined as a crucial ingredient of the characterization of
alternation graphs, also knownas word-representable graphs, it has sparked
independent interest.
  In this paper, we investigate graph operations and graph products that
preserve semitransitive orientability of graphs. The main theme of this paper
is to determine which graph operations satisfy the following statement: if a
graph operation is possible on a semitransitively orientable graph, then the
same graph operation can be executed on the graph while preserving the
semi-transitive orientability. We were able to prove that this statement is
true for edge-deletions, edge-additions, and edge-liftings. Moreover, for all
three graph operations,we showthat the initial semi-transitive orientation can
be extended to the new graph obtained by the graph operation.
  Also, Kitaev and Lozin explicitly asked if certain graph products preserve
the semitransitive orientability. We answer their question in the negative for
the tensor product, lexicographic product, and strong product.We also push the
investigation further and initiate the study of sufficient conditions that
guarantee a certain graph operation to preserve the semi-transitive
orientability.
","[{""version"":""v1"",""created"":""Sat, 27 Oct 2018 08:49:23 GMT""}]","2019-07-04"
"1810.11621","Przemyslaw Malkiewicz","Przemys{\l}aw Ma{\l}kiewicz","Hamiltonian formalism and gauge-fixing conditions for cosmological
  perturbation theory","38 pages, 1 figure, includes a discussion of the relation between the
  Dirac observables and the gauge-invariant variables such as the Bardeen
  potentials or the Mukhanov-Sasaki variable","Class. Quantum Grav. 36 (2019) 215003","10.1088/1361-6382/ab45aa",,"gr-qc","http://arxiv.org/licenses/nonexclusive-distrib/1.0/","  We apply the Dirac procedure for constrained systems to the
Arnowitt-Deser-Misner formalism linearized around the Friedmann-Lemaitre
universe. We explain and employ some basic concepts such as Dirac observables,
Dirac brackets, gauge-fixing conditions, reduced phase space, physical
Hamiltonian and physical dynamics. In particular, we elaborate on the key
concept which is the canonical isomorphism between different gauge-fixing
surfaces. We apply our formalism to describe the reduced phase space of
cosmological perturbations in some popular in the literature gauges. Our
formalism is first developed for the universe with a single fluid and then
extended to the multi-fluid case. The obtained results are a starting point for
complete quantization of the cosmological perturbations and the cosmological
background. Our approach may be used in future to derive the reduced phase
space of higher order perturbations and in more generic cosmological
spacetimes.
","[{""version"":""v1"",""created"":""Sat, 27 Oct 2018 08:57:35 GMT""},{""version"":""v2"",""created"":""Mon, 3 Dec 2018 09:36:48 GMT""},{""version"":""v3"",""created"":""Tue, 29 Oct 2019 09:09:12 GMT""}]","2019-10-30"
"1810.11622","Myoung Jin Nam","Myoung Jin Nam, Periklis Akritidis, David J Greaves","FRAMER: A Software-based Capability Model","15 pages, 10 figures",,,,"cs.CR","http://arxiv.org/licenses/nonexclusive-distrib/1.0/","  Fine-grained memory protection for C and C++ programs must track individual
objects (or pointers), and store bounds information per object (pointer). Its
cost is dominated by metadata updates and lookups, making efficient metadata
management the key for minimizing performance impact. Existing approaches
reduce metadata management overheads by sacrificing precision, breaking binary
compatibility by changing object memory layout, or wasting space by excessive
alignment or large shadow memory spaces. We propose FRAMER, a software
capability model for object-granularity memory protection. Its efficient
per-object metadata management mechanism enables direct access to metadata by
calculating their location from a tagged pointer to the object and, for large
objects, a compact supplementary table. The number of bits in this tag and the
size of the supplementary table are balanced to minimize both using a novel
technique. FRAMER is a general proposal for object metadata management with
potential applications in memory safety, type safety, thread safety and garbage
collection that improves over previous solutions by (1) increasing locality of
reference by having objects carry their metadata, (2) streamlining expensive
metadata lookups, (3) saving space by avoiding superfluous alignment and
padding, (4) avoiding internal object memory layout changes.
","[{""version"":""v1"",""created"":""Sat, 27 Oct 2018 09:21:56 GMT""},{""version"":""v2"",""created"":""Fri, 1 Mar 2019 23:31:32 GMT""}]","2019-03-05"
"1810.11623","Santosh Kumar","Santosh Kumar, Girish Kumar, Rohit S. Chandramouli, and Shashank Anand","Efficient implementation of the Wang-Landau algorithm for systems with
  length-scalable potential energy functions","Published version, 7 Figures, Figures 1, 2, 3, 5 and 6 are with grid
  lines","Phys. Rev. E 98, 063301 (2018)","10.1103/PhysRevE.98.063301",,"cond-mat.stat-mech physics.comp-ph","http://arxiv.org/licenses/nonexclusive-distrib/1.0/","  We consider a class of systems where $N$ identical particles with positions
${\bf q}_1,...,{\bf q}_N$ and momenta ${\bf p}_1,...,{\bf p}_N$ are enclosed in
a box of size $L$, and exhibit the scaling $\mathcal{U}(L{\bf r}_1,...,L{\bf
r}_N)=\alpha(L)\, \mathcal{U}({\bf r}_1,...,{\bf r}_N)$ for the associated
potential energy function $\mathcal{U}({\bf q}_1,...,{\bf q}_N)$. For these
systems, we propose an efficient implementation of the Wang-Landau algorithm
for evaluating thermodynamic observables involving energy and volume
fluctuations in the microcanonical description, and temperature and volume
fluctuations in the canonical description. This requires performing the
Wang-Landau simulation in a scaled box of unit size and evaluating the density
of states corresponding to the potential energy part only. To demonstrate the
efficacy of our approach, as example systems, we consider Padmanabhan's binary
star model and an ideal gas trapped in a harmonic potential within the box.
","[{""version"":""v1"",""created"":""Sat, 27 Oct 2018 09:40:43 GMT""},{""version"":""v2"",""created"":""Wed, 20 Feb 2019 19:24:27 GMT""}]","2019-02-22"
"1810.11624","David Guijo-Rubio","David Guijo-Rubio, Antonio Manuel Dur\'an-Rosal, Pedro Antonio
  Guti\'errez, Alicia Troncoso and C\'esar Herv\'as-Mart\'inez","Time series clustering based on the characterisation of segment
  typologies","13 pages, 7 figures, 4 tables, 57 refs",,,,"cs.LG stat.ML","http://arxiv.org/licenses/nonexclusive-distrib/1.0/","  Time series clustering is the process of grouping time series with respect to
their similarity or characteristics. Previous approaches usually combine a
specific distance measure for time series and a standard clustering method.
However, these approaches do not take the similarity of the different
subsequences of each time series into account, which can be used to better
compare the time series objects of the dataset. In this paper, we propose a
novel technique of time series clustering based on two clustering stages. In a
first step, a least squares polynomial segmentation procedure is applied to
each time series, which is based on a growing window technique that returns
different-length segments. Then, all the segments are projected into same
dimensional space, based on the coefficients of the model that approximates the
segment and a set of statistical features. After mapping, a first hierarchical
clustering phase is applied to all mapped segments, returning groups of
segments for each time series. These clusters are used to represent all time
series in the same dimensional space, after defining another specific mapping
process. In a second and final clustering stage, all the time series objects
are grouped. We consider internal clustering quality to automatically adjust
the main parameter of the algorithm, which is an error threshold for the
segmenta- tion. The results obtained on 84 datasets from the UCR Time Series
Classification Archive have been compared against two state-of-the-art methods,
showing that the performance of this methodology is very promising.
","[{""version"":""v1"",""created"":""Sat, 27 Oct 2018 10:01:46 GMT""}]","2018-10-30"
"1810.11625","Aijin Lin","Aijin Lin, Xiaoxiao Zhang","Combinatorial $p$-th Calabi flows on surfaces","24 pages",,,,"math.DG","http://arxiv.org/licenses/nonexclusive-distrib/1.0/","  For triangulated surfaces and any $p>1$, we introduce the combinatorial
$p$-th Calabi flow which precisely equals the combinatorial Calabi flows first
introduced in H. Ge's thesis when $p=2$. The difficulties for the
generalizations come from the nonlinearity of the $p$-th flow equation when
$p\neq 2$. Adopting different approaches, we show that the solution to the
combinatorial $p$-th Calabi flow exists for all time and converges if and only
if there exists a circle packing metric of constant (zero resp.) curvature in
Euclidean (hyperbolic resp.) background geometry. Our results generalize the
work of H. Ge, Ge-Xu and Ge-Hua on the combinatorial Calabi flow from $p=2$ to
any $p>1$.
","[{""version"":""v1"",""created"":""Sat, 27 Oct 2018 10:12:21 GMT""}]","2018-10-30"
"1810.11626","Sergey Victor Ludkovski","S.V. Ludkowski","Analytic extensions of functions of Cayley-Dickson variables","21 pages",,,,"math.CV","http://arxiv.org/licenses/nonexclusive-distrib/1.0/","  Analytic approximations of functions of Cayley-Dickson variables are
investigated. The case of functions of complexified Cayley-Dickson variables is
also encompassed. Moreover, extensions of functions of Cayley-Dickson variables
are studied.
","[{""version"":""v1"",""created"":""Sat, 27 Oct 2018 10:19:31 GMT""}]","2018-10-30"
"1810.11627","Pietro Gatti","Pietro Gatti","An Algebraic Description of the Monodromy of Log Curves",,,,,"math.AG","http://arxiv.org/licenses/nonexclusive-distrib/1.0/","  Let $k$ be an algebraically closed field of characteristic $0$. For a log
curve $X/k^{\times}$ over the standard log point, we define (algebraically) a
combinatorial monodromy operator on its log-de Rham cohomology group. The
invariant part of this action has a cohomological description, it is the Du
Bois cohomology of $X$. This can be seen as an analogue of the invariant cycles
exact sequence for a semistable family (as in the complex, \'etale and $p$-adic
settings). In the specific case in which $k=\mathbb C$ and $X$ is the central
fiber of a semistable degeneration over the complex disc, our construction
recovers the topological monodromy and the classical local invariant cycles
theorem. In particular, our description allows an explicit computation of the
monodromy operator in this setting.
","[{""version"":""v1"",""created"":""Sat, 27 Oct 2018 10:24:32 GMT""}]","2018-10-30"
"1810.11628","Mahdi Imanparast","Mahdi Imanparast, Seyed Naser Hashemi","Better approximation algorithm for point-set diameter","arXiv admin note: substantial text overlap with arXiv:1610.08543","IAENG International Journal of Computer Science 46 (4), 594-598,
  2019",,,"cs.CG","http://arxiv.org/licenses/nonexclusive-distrib/1.0/","  We propose a new $(1+O(\varepsilon))$-approximation algorithm with $O(n+
1/\varepsilon^{\frac{(d-1)}{2}})$ running time for computing the diameter of a
set of $n$ points in the $d$-dimensional Euclidean space for a fixed dimension
$d$, where $0 < \varepsilon\leqslant 1$. This result provides some improvements
in the running time of this problem in comparison with previous algorithms.
","[{""version"":""v1"",""created"":""Sat, 27 Oct 2018 10:46:04 GMT""}]","2020-11-11"
"1810.11629","Dileep Bapatla","Dileep Bapatla and Shankar Prakriya","Performance of Energy-Buffer Aided Incremental Relaying in Cooperative
  Networks",,,,,"cs.IT math.IT","http://arxiv.org/licenses/nonexclusive-distrib/1.0/","  In this paper, we consider a two-hop cooperative network with a direct link
based on an energy harvesting (EH) decode-and-forward relay. The energy-buffer
equipped relay harvests energy from the ambience, and uses the
harvest-store-use (HSU) architecture. Since it is known that using a
discrete-state Markov chain to model the energy buffer is inaccurate even for
moderate number of states, we use a discrete-time continuous-state space Markov
chain instead. We derive the limiting distribution of energy for both
incremental on-off policy (IOFP) and the incremental best-effort policy (IBEF),
and use them to obtain expressions for outage probability and throughput. The
corresponding expressions for non-incremental signalling follow as a special
case. We show that stable buffers using IBEP harness a diversity of two as
compared to those using IOFP, which attain a diversity of one. However, while
buffers using IBEF are consequently more reliable than those with IOFP, their
throughput performance is only marginally superior. Simulation results are
presented to validate the derived analytical expressions.
","[{""version"":""v1"",""created"":""Sat, 27 Oct 2018 10:54:18 GMT""}]","2018-10-30"
"1810.11630","Wittawat Jitkrittum","Wittawat Jitkrittum, Heishiro Kanagawa, Patsorn Sangkloy, James Hays,
  Bernhard Sch\""olkopf, Arthur Gretton","Informative Features for Model Comparison","Accepted to NIPS 2018",,,,"stat.ML cs.LG","http://arxiv.org/licenses/nonexclusive-distrib/1.0/","  Given two candidate models, and a set of target observations, we address the
problem of measuring the relative goodness of fit of the two models. We propose
two new statistical tests which are nonparametric, computationally efficient
(runtime complexity is linear in the sample size), and interpretable. As a
unique advantage, our tests can produce a set of examples (informative
features) indicating the regions in the data domain where one model fits
significantly better than the other. In a real-world problem of comparing GAN
models, the test power of our new test matches that of the state-of-the-art
test of relative goodness of fit, while being one order of magnitude faster.
","[{""version"":""v1"",""created"":""Sat, 27 Oct 2018 10:55:34 GMT""}]","2018-10-30"
"1810.11631","Olena Karlova Dr","Olena Karlova and Volodymyr Mykhaylyuk","Extension of bounded Baire-one functions vs Extension of unbounded
  Baire-one functions",,,,,"math.GN","http://arxiv.org/licenses/nonexclusive-distrib/1.0/","  We compare possibilities of extension of bounded and unbounded Baire-one
functions from subspaces of topological spaces.
","[{""version"":""v1"",""created"":""Sat, 27 Oct 2018 10:56:58 GMT""}]","2018-10-30"
"1810.11632","Ivan Borzenets","Anne W. Draelos, Ming-Tso Wei, Andrew Seredinski, Hengming Li, Yash
  Mehta, Kenji Watanabe, Takashi Taniguchi, Ivan V. Borzenets, Francois Amet,
  and Gleb Finkelstein","Supercurrent Flow in Multi-Terminal Graphene Josephson Junctions","3 Figures, 6 pages",,"10.1021/acs.nanolett.8b04330",,"cond-mat.mes-hall","http://arxiv.org/licenses/nonexclusive-distrib/1.0/","  We investigate the electronic properties of ballistic planar Josephson
junctions with multiple superconducting terminals. Our devices consist of
monolayer graphene encapsulated in boron nitride with molybdenum-rhenium
contacts. Resistance measurements yield multiple resonant features, which are
attributed to supercurrent flow among adjacent and non-adjacent Josephson
junctions. In particular, we find that superconducting and dissipative currents
coexist within the same region of graphene. We show that the presence of
dissipative currents primarily results in electron heating and estimate the
associated temperature rise. We find that the electrons in encapsulated
graphene are efficiently cooled through the electron-phonon coupling.
","[{""version"":""v1"",""created"":""Sat, 27 Oct 2018 10:57:00 GMT""}]","2019-03-27"
"1810.11633","Juli\'an Tachella Mr","Juli\'an Tachella, Yoann Altmann, Ximing Ren, Aongus McCarthy, Gerald
  S. Buller, Jean-Yves Tourneret and Steve McLaughlin","Bayesian 3D Reconstruction of Complex Scenes from Single-Photon Lidar
  Data",,"SIAM Journal on Imaging Sciences 2019 12:1, 521-550","10.1137/18M1183972",,"eess.IV","http://arxiv.org/licenses/nonexclusive-distrib/1.0/","  Light detection and ranging (Lidar) data can be used to capture the depth and
intensity profile of a 3D scene. This modality relies on constructing, for each
pixel, a histogram of time delays between emitted light pulses and detected
photon arrivals. In a general setting, more than one surface can be observed in
a single pixel. The problem of estimating the number of surfaces, their
reflectivity and position becomes very challenging in the low-photon regime
(which equates to short acquisition times) or relatively high background levels
(i.e., strong ambient illumination). This paper presents a new approach to 3D
reconstruction using single-photon, single-wavelength Lidar data, which is
capable of identifying multiple surfaces in each pixel. Adopting a Bayesian
approach, the 3D structure to be recovered is modelled as a marked point
process and reversible jump Markov chain Monte Carlo (RJ-MCMC) moves are
proposed to sample the posterior distribution of interest. In order to promote
spatial correlation between points belonging to the same surface, we propose a
prior that combines an area interaction process and a Strauss process. New
RJ-MCMC dilation and erosion updates are presented to achieve an efficient
exploration of the configuration space. To further reduce the computational
load, we adopt a multiresolution approach, processing the data from a coarse to
the finest scale. The experiments performed with synthetic and real data show
that the algorithm obtains better reconstructions than other recently published
optimization algorithms for lower execution times.
","[{""version"":""v1"",""created"":""Sat, 27 Oct 2018 11:03:31 GMT""}]","2019-09-13"
"1810.11634","Jose Fontanari","Sandro M. Reia, Andr\'e C. Amado and Jos\'e F. Fontanari","Agent-based models of collective intelligence",,"Phys. Life Rev. 31 (2019) 320-331","10.1016/j.plrev.2018.10.004",,"cs.MA cs.SI nlin.AO","http://arxiv.org/licenses/nonexclusive-distrib/1.0/","  Collective or group intelligence is manifested in the fact that a team of
cooperating agents can solve problems more efficiently than when those agents
work in isolation. Although cooperation is, in general, a successful problem
solving strategy, it is not clear whether it merely speeds up the time to find
the solution, or whether it alters qualitatively the statistical signature of
the search for the solution. Here we review and offer insights on two
agent-based models of distributed cooperative problem-solving systems, whose
task is to solve a cryptarithmetic puzzle. The first model is the imitative
learning search in which the agents exchange information on the quality of
their partial solutions to the puzzle and imitate the most successful agent in
the group. This scenario predicts a very poor performance in the case imitation
is too frequent or the group is too large, a phenomenon akin to Groupthink of
social psychology. The second model is the blackboard organization in which
agents read and post hints on a public blackboard. This brainstorming scenario
performs the best when there is a stringent limit to the amount of information
that is exhibited on the board. Both cooperative scenarios produce a
substantial speed up of the time to solve the puzzle as compared with the
situation where the agents work in isolation. The statistical signature of the
search, however, is the same as that of the independent search.
","[{""version"":""v1"",""created"":""Sat, 27 Oct 2018 12:33:03 GMT""}]","2019-12-19"
"1810.11635","Claudiu Raicu","Marian Aprodu, Gavril Farkas, Stefan Papadima, Claudiu Raicu, Jerzy
  Weyman","Koszul modules and Green's conjecture","minor edits, 42 pages, to appear in Invent. Math",,"10.1007/s00222-019-00894-1",,"math.AG math.AC","http://arxiv.org/licenses/nonexclusive-distrib/1.0/","  We prove a strong vanishing result for finite length Koszul modules, and use
it to derive Green's conjecture for every g-cuspidal rational curve over an
algebraically closed field k with char(k) = 0 or char(k) >= (g+2)/2. As a
consequence, we deduce that the general canonical curve of genus g satisfies
Green's conjecture in this range. Our results are new in positive
characteristic, whereas in characteristic zero they provide a different proof
for theorems first obtained in two landmark papers by Voisin. Our strategy
involves establishing two key results of independent interest: (1) we describe
an explicit, characteristic-independent version of Hermite reciprocity for
sl_2-representations; (2) we completely characterize, in arbitrary
characteristics, the (non-)vanishing behavior of the syzygies of the tangential
variety to a rational normal curve.
","[{""version"":""v1"",""created"":""Sat, 27 Oct 2018 12:38:52 GMT""},{""version"":""v2"",""created"":""Fri, 23 Nov 2018 17:40:09 GMT""},{""version"":""v3"",""created"":""Wed, 29 May 2019 14:19:19 GMT""}]","2020-01-08"
