"1810.11483","Lacey West","Lacey A. West, Bret D. Lehmer, Daniel Wik, Jun Yang, Dominic J.
  Walton, Vallia Antoniou, Frank Haberl, Ann Hornschemeier, Thomas J.
  Maccarone, Paul P. Plucinsky, Andrew Ptak, Benjamin F. Williams, Neven Vulic,
  Mihoko Yukita and Andreas Zezas","On the Nature of the X-ray Emission from the Ultraluminous X-ray Source,
  M33 X-8: New Constraints from NuSTAR and XMM-Newton","Accepted for publication in ApJ (15 pages, 4 tables, 6 figures)",,"10.3847/1538-4357/aaec6b",,"astro-ph.HE","http://arxiv.org/licenses/nonexclusive-distrib/1.0/","  We present nearly simultaneous NuSTAR and XMM-Newton observations of the
nearby (832 kpc) ultraluminous X-ray source (ULX) M33 X-8. M33 X-8 has a 0.3-10
keV luminosity of LX ~ 1.4 x 10^39 erg/s, near the boundary of the
""ultraluminous"" classification, making it an important source for understanding
the link between typical Galactic X-ray binaries and ULXs. Past studies have
shown that the 0.3-10 keV spectrum of X-8 can be characterized using an
advection-dominated accretion disk model. We find that when fitting to our
NuSTAR and XMM-Newton observations, an additional high-energy (>10 keV)
Comptonization component is required, which allows us to rule out single
advection-dominated disk and classical sub-Eddington models. With our new
constraints, we analyze XMM-Newton data taken over the last 17 years to show
that small (~30%) variations in the 0.3-10 keV flux of M33 X-8 result in
spectral changes similar to those observed for other ULXs. The two most likely
phenomenological scenarios suggested by the data are degenerate in terms of
constraining the nature of the accreting compact object (i.e., black hole
versus neutron star). We further present a search for pulsations using our
suite of data; however, no clear pulsations are detected. Future observations
designed to observe M33 X-8 at different flux levels across the full 0.3-30 keV
range would significantly improve our constraints on the nature of this
important source.
","[{""version"":""v1"",""created"":""Fri, 26 Oct 2018 18:26:18 GMT""}]","2018-12-26"
"1810.11484","Sunghwan Jung","Ehsan Esmaili, Pranav Shukla, Joseph D. Eifert, and Sunghwan Jung","Bubble impact on a tilted wall; removing bacteria using bubbles",,,,,"physics.flu-dyn","http://arxiv.org/licenses/nonexclusive-distrib/1.0/","  Dynamics of a bubble impacting and sliding a tilted surface has been
investigated through experimental and computational methods.
\textcolor{blue}{Specifically, shear stress generated on the wall has been
calculated and compared with bacterium adhesion force in order to evaluate a
potential sanitization function. In experiments, the bubble-wall interaction
has been characterized for several different wall angles. We numerically solved
a force balance including buoyancy, hydrodynamic inertia \& drag, lift and thin
film force to determine the bubble motion. Results showed that the shear stress
increases with the wall inclination. The maximum shear stress goes up to more
than 300 Pa as a single bubble impacts and scrubs a tilted wall. We found that
such a high shear stress is attributed to a rapid change in thin film curvature
(flipping bubble/water interface) during the bouncing stage. Later, during the
sliding stage, a smaller shear stress up to around 45 Pa is generated for a
longer period of time. We also showed that the shear stress generated during
the bouncing and sliding stages is high enough to remove bacteria from a
surface as a potential method for removing bacteria from tilted surfaces.
","[{""version"":""v1"",""created"":""Fri, 26 Oct 2018 18:26:33 GMT""}]","2018-10-30"
"1810.11485","Grzegorz Andrzejczak","Grzegorz Andrzejczak","A note on product of measures",,,,,"math.FA","http://arxiv.org/licenses/nonexclusive-distrib/1.0/","  A slight modification to Halmos' definition of product of measures yields a
uniquely characterized associative product. The operation applies to arbitrary
(not necessarily $\sigma-$finite) measures and is consistent with the
Fubini--Tonelli theorem.
","[{""version"":""v1"",""created"":""Fri, 26 Oct 2018 18:26:50 GMT""}]","2018-10-30"
"1810.11486","Seramika Ariwahjoedi","S. Ariwahjoedi, I. Husin, I. Sebastian, F. P. Zen","Hermiticity of the Volume Operators in Loop Quantum Gravity","15 pages, no figure","Gen. Rel. Grav. 51, 58 (2019)","10.1007/s10714-019-2541-2",,"gr-qc","http://arxiv.org/licenses/nonexclusive-distrib/1.0/","  The aim of this article is to provide a rigorous-but-simple steps to prove
the hermiticity of the volume operator of Rovelli-Smolin and
Ashtekar-Lewandowski using the angular momentum approach, as well as pointing
out some subleties which have not been given a lot of attention previously.
Besides of being hermitian, we also prove that both volume operators are real,
symmetric, and positive semi-definite, with respect to the inner product
defined on the Hilbert space over SU(2). Other special properties follows from
this fact, such as the possibility to obtain real orthonormal eigenvectors.
Moreover, the matrix representation of the volume operators are degenerate,
such that the real positive eigenvalues always come in pairs for even
dimension, with an additional zero if the dimension is odd. As a consequence,
one has a freedom in choosing the orthonormal eigenvectors for each
2-dimensional eigensubspaces. Furthermore, we provide a formal procedure to
obtain the spectrum and matrix representation of the volume operators. In order
to compare our procedure with the earlier ones existing in the literature, we
give explicit computational examples for the case of monochromatic quantum
tetrahedron, where the eigenvalues agrees with the standard earlier procedure.
","[{""version"":""v1"",""created"":""Fri, 26 Oct 2018 18:26:53 GMT""},{""version"":""v2"",""created"":""Tue, 6 Nov 2018 15:32:15 GMT""}]","2021-03-30"
"1810.11487","Fan Yang","Fan Yang, Paloma A. Huidobro, and John B. Pendry","A transformation optics approach to singular metasurfaces","38 pages, 13 figures","Physical Review B 98.12 (2018): 125409","10.1103/PhysRevB.98.125409",,"cond-mat.mes-hall","http://arxiv.org/licenses/nonexclusive-distrib/1.0/","  Surface plasmons dominate the optical response of metal surfaces, and their
nature is controlled by surface geometry. Here we study metasurfaces containing
singularities in the form of sharp edges and characterized by three quantum
numbers despite the two-dimensional nature of the surface. We explore the
nature of the plasmonic excitations, their ability to generate large
concentrations of optical energy, and the transition from the discrete
excitation spectrum of a non-singular surface to the continuous spectrum of a
singular metasurface.
","[{""version"":""v1"",""created"":""Fri, 26 Oct 2018 18:27:56 GMT""}]","2018-11-07"
"1810.11488","Sankalp Garg","Aniket Bajpai, Sankalp Garg, Mausam","Transfer of Deep Reactive Policies for MDP Planning","To appear at NIPS 2018",,,,"cs.AI","http://arxiv.org/licenses/nonexclusive-distrib/1.0/","  Domain-independent probabilistic planners input an MDP description in a
factored representation language such as PPDDL or RDDL, and exploit the
specifics of the representation for faster planning. Traditional algorithms
operate on each problem instance independently, and good methods for
transferring experience from policies of other instances of a domain to a new
instance do not exist. Recently, researchers have begun exploring the use of
deep reactive policies, trained via deep reinforcement learning (RL), for MDP
planning domains. One advantage of deep reactive policies is that they are more
amenable to transfer learning.
  In this paper, we present the first domain-independent transfer algorithm for
MDP planning domains expressed in an RDDL representation. Our architecture
exploits the symbolic state configuration and transition function of the domain
(available via RDDL) to learn a shared embedding space for states and
state-action pairs for all problem instances of a domain. We then learn an RL
agent in the embedding space, making a near zero-shot transfer possible, i.e.,
without much training on the new instance, and without using the domain
simulator at all. Experiments on three different benchmark domains underscore
the value of our transfer algorithm. Compared against planning from scratch,
and a state-of-the-art RL transfer algorithm, our transfer solution has
significantly superior learning curves.
","[{""version"":""v1"",""created"":""Fri, 26 Oct 2018 18:28:42 GMT""}]","2018-10-30"
"1810.11489","Alexander Siegenfeld","Alexander Siegenfeld and Yaneer Bar-Yam","Negative Representation and Instability in Democratic Elections",,"Nature Physics 16, 186-190 (2020)","10.1038/s41567-019-0739-6",,"physics.soc-ph cond-mat.stat-mech cs.MA cs.SI nlin.AO","http://arxiv.org/licenses/nonexclusive-distrib/1.0/","  The challenge of understanding the collective behaviors of social systems can
benefit from methods and concepts from physics [1-6], not because humans are
similar to electrons, but because certain large-scale behaviors can be
understood without an understanding of the small-scale details [7], in much the
same way that sound waves can be understood without an understanding of atoms.
Democratic elections are one such behavior. Over the past few decades,
physicists have explored scaling patterns in voting and the dynamics of
political opinion formation, e.g. [8-13]. Here, we define the concepts of
negative representation, in which a shift in electorate opinions produces a
shift in the election outcome in the opposite direction, and electoral
instability, in which an arbitrarily small change in electorate opinions can
dramatically swing the election outcome, and prove that unstable elections
necessarily contain negatively represented opinions. Furthermore, in the
presence of low voter turnout, increasing polarization of the electorate can
drive elections through a transition from a stable to an unstable regime,
analogous to the phase transition by which some materials become ferromagnetic
below their critical temperatures. Empirical data suggest that United States
presidential elections underwent such a phase transition in the 1970s and have
since become increasingly unstable.
","[{""version"":""v1"",""created"":""Fri, 26 Oct 2018 18:31:35 GMT""},{""version"":""v2"",""created"":""Wed, 19 Aug 2020 01:43:42 GMT""}]","2020-08-20"
"1810.11490","Shmuel Bialy","Shmuel Bialy and Abraham Loeb","Could Solar Radiation Pressure Explain 'Oumuamua's Peculiar
  Acceleration?","To be published in ""The Astrophysical Journal Letters"" on November
  12, 2018",,"10.3847/2041-8213/aaeda8",,"astro-ph.EP astro-ph.GA","http://arxiv.org/licenses/nonexclusive-distrib/1.0/","  `Oumuamua (1I/2017 U1) is the first object of interstellar origin observed in
the Solar System. Recently, \citet{Micheli2018} reported that `Oumuamua showed
deviations from a Keplerian orbit at a high statistical significance. The
observed trajectory is best explained by an excess radial acceleration $\Delta
a \propto r^{-2}$, where $r$ is the distance of `Oumuamua from the Sun. Such an
acceleration is naturally expected for comets, driven by the evaporating
material. However, recent observational and theoretical studies imply that
`Oumuamua is not an active comet. We explore the possibility that the excess
acceleration results from Solar radiation pressure. The required mass-to-area
ratio is $(m/A)\approx 0.1$ g cm$^{-2}$. For a thin sheet this requires a
thickness of $\approx 0.3-0.9$ mm. We find that although extremely thin, such
an object would survive an interstellar travel over Galactic distances of $\sim
5$ kpc, withstanding collisions with gas and dust-grains as well as stresses
from rotation and tidal forces. We discuss the possible origins of such an
object. Our general results apply to any light probes designed for interstellar
travel.
","[{""version"":""v1"",""created"":""Fri, 26 Oct 2018 18:33:15 GMT""},{""version"":""v2"",""created"":""Tue, 30 Oct 2018 22:54:48 GMT""},{""version"":""v3"",""created"":""Tue, 6 Nov 2018 19:42:32 GMT""},{""version"":""v4"",""created"":""Thu, 8 Nov 2018 20:27:38 GMT""}]","2018-11-28"
"1810.11491","Alexander Fabisch","Alexander Fabisch","Empirical Evaluation of Contextual Policy Search with a Comparison-based
  Surrogate Model and Active Covariance Matrix Adaptation","Supplementary material for poster paper accepted at GECCO 2019;
  https://doi.org/10.1145/3319619.3321935",,"10.1145/3319619.3321935",,"cs.LG cs.NE stat.ML","http://arxiv.org/licenses/nonexclusive-distrib/1.0/","  Contextual policy search (CPS) is a class of multi-task reinforcement
learning algorithms that is particularly useful for robotic applications. A
recent state-of-the-art method is Contextual Covariance Matrix Adaptation
Evolution Strategies (C-CMA-ES). It is based on the standard black-box
optimization algorithm CMA-ES. There are two useful extensions of CMA-ES that
we will transfer to C-CMA-ES and evaluate empirically: ACM-ES, which uses a
comparison-based surrogate model, and aCMA-ES, which uses an active update of
the covariance matrix. We will show that improvements with these methods can be
impressive in terms of sample-efficiency, although this is not relevant any
more for the robotic domain.
","[{""version"":""v1"",""created"":""Fri, 26 Oct 2018 18:35:27 GMT""},{""version"":""v2"",""created"":""Sun, 14 Apr 2019 21:20:16 GMT""}]","2019-04-16"
"1810.11492","Juan Maldacena","Juan Maldacena","Black hole entropy and quantum mechanics","10 pages, 1 figure. Contribution to the Jacob Bekenstein memorial
  volume",,,,"hep-th","http://arxiv.org/licenses/nonexclusive-distrib/1.0/","  We give a brief overview of black hole entropy, covering a few main
developments since Bekenstein's original proposal
","[{""version"":""v1"",""created"":""Fri, 26 Oct 2018 18:37:31 GMT""}]","2018-10-30"
"1810.11493","Benjamin Pope","Benjamin J. S. Pope, Paul Withers, Joseph R. Callingham, and Marissa
  F. Vogt","Exoplanet Transits with Next-Generation Radio Telescopes","11 pages, 2 figures. Under review at MNRAS",,"10.1093/mnras/sty3512",,"astro-ph.EP astro-ph.IM astro-ph.SR","http://arxiv.org/licenses/nonexclusive-distrib/1.0/","  Nearly everything we know about extrasolar planets to date comes from optical
astronomy. While exoplanetary aurorae are predicted to be bright at low radio
frequencies (< 1 GHz), we consider the effect of an exoplanet transit on radio
emission from the host star. As radio emission from solar-like stars is
concentrated in active regions, a planet occulting a starspot can cause a
disproportionately deep transit which should be detectable with major radio
arrays currently under development, such as the Square Kilometre Array (SKA).
We calculate the radiometric sensitivity of the SKA stages and components,
finding that SKA2-Mid can expect to detect transits around the very nearest
solar-like stars and many cool dwarfs. The shape of this radiometric light
curve will be affected by scintillation and lensing from the planet's
magnetosphere and thereby encode magnetospheric parameters. Furthermore, these
transits will also probe the distribution of stellar activity across a star's
surface, and will help scrub out contamination from stellar activity on
exoplanet transmission spectra and radial velocity spectra. This radio window
on exoplanets and their host stars is therefore a valuable complement to
existing optical tools.
","[{""version"":""v1"",""created"":""Fri, 26 Oct 2018 18:39:56 GMT""}]","2019-01-16"
"1810.11494","Xiangyu Ma","Xiangyu Ma, Yuejing Wang, Joshua Zide, Matthew Doty","Charging of a Single InAs QD with Electrically-Injected Holes using a
  Lateral Electric Field",,"Phys. Rev. Applied 13, 064029 (2020)","10.1103/PhysRevApplied.13.064029",,"cond-mat.mes-hall","http://creativecommons.org/licenses/by/4.0/","  InAs/GaAs quantum dots (QDs) and quantum dot molecules (QDMs) are
self-assembled semiconductor nanostructures that can trap a single electron or
hole with well-defined spin projections. QDs and QDMs have excellent optical
properties and have long been of interest for incorporation into quantum
optoelectronic devices ranging from single photon sources to multi-bit quantum
computers. The properties of single QDs, or carriers confined within those QDs,
can be tuned by external electric fields, which provides an important tool for
the development of scalable and tunable devices. Deterministic charging of a QD
with a single electron or hole is an important tool for quantum devices and is
well-established under the application of growth-direction electric fields in a
diode structure. Here, we report a new charging mechanism for a single QD in a
3-electrode device that does not contain a vertical diode and can be used to
control electric field profiles in two dimensions. We fabricate the device with
E-beam lithography and characterize photoluminescence from single QDs under
different bias configurations. Using a combination of experimental data and
COMSOL band structure calculations, we explain how the charging originates in
the electrical-injection of holes induced by lateral electric fields. We
discuss the applications for this device and the potential for full 2-D
electric field control of a single QD and QDM.
","[{""version"":""v1"",""created"":""Fri, 26 Oct 2018 18:40:53 GMT""},{""version"":""v2"",""created"":""Wed, 12 Dec 2018 19:27:49 GMT""}]","2020-07-01"
"1810.11495","Luis Miguel Anguas","Luis Miguel Anguas, Mar\'ia Isabel Bueno, Froil\'an M. Dopico","Conditioning and backward errors of eigenvalues of homogeneous matrix
  polynomials under M\""{o}bius transformations","33 pages, 3 figures",,,,"math.NA","http://arxiv.org/licenses/nonexclusive-distrib/1.0/","  M\""{o}bius transformations have been used in numerical algorithms for
computing eigenvalues and invariant subspaces of structured generalized and
polynomial eigenvalue problems (PEPs). These transformations convert problems
with certain structures arising in applications into problems with other
structures and whose eigenvalues and invariant subspaces are easily related to
the ones of the original problem. Thus, an algorithm that is efficient and
stable for some particular structure can be used for solving efficiently
another type of structured problem via an adequate M\""{o}bius transformation. A
key question in this context is whether these transformations may change
significantly the conditioning of the problem and the backward errors of the
computed solutions, since, in that case, their use may lead to unreliable
results. We present the first general study on the effect of M\""{o}bius
transformations on the eigenvalue condition numbers and backward errors of
approximate eigenpairs of PEPs. By using the homogeneous formulation of PEPs,
we are able to obtain two clear and simple results. First, we show that, if the
matrix inducing the M\""{o}bius transformation is well conditioned, then such
transformation approximately preserves the eigenvalue condition numbers and
backward errors when they are defined with respect to perturbations of the
matrix polynomial which are small relative to the norm of the polynomial.
However, if the perturbations in each coefficient of the matrix polynomial are
small relative to the norm of that coefficient, then the corresponding
eigenvalue condition numbers and backward errors are preserved approximately by
the M\""{o}bius transformations induced by well-conditioned matrices only if a
penalty factor, depending on those coefficients, is moderate. It is important
to note that these simple results are no longer true if a non-homogeneous
formulation is used.
","[{""version"":""v1"",""created"":""Fri, 26 Oct 2018 18:41:22 GMT""}]","2018-10-30"
"1810.11496","Florian Stecker","Florian Stecker","Balanced ideals and domains of discontinuity of Anosov representations","27 pages, 2 figures",,,,"math.GT math.DG","http://arxiv.org/licenses/nonexclusive-distrib/1.0/","  We consider the action of Anosov subgroups of a semi-simple Lie group on the
associated flag manifolds. A systematic approach to construct cocompact domains
of discontinuity for this action was given by Kapovich, Leeb and Porti in
arXiv:1306.3837. For $\Delta$-Anosov representations, we prove that every
cocompact domain of discontinuity arises from this construction, up to a few
exceptions in low rank. Then we compute which flag manifolds admit these
domains and, in some cases, the number of domains. We also find a new
compactification for locally symmetric spaces arising from maximal
representations into $\mathrm{Sp}(4n+2, \mathbb{R})$.
","[{""version"":""v1"",""created"":""Fri, 26 Oct 2018 18:43:01 GMT""}]","2018-10-30"
"1810.11497","Sanchit Agarwal","Sanchit Agarwal, Rahul Goel, Tagyoung Chung, Abhishek Sethi, Arindam
  Mandal, Spyros Matsoukas","Parsing Coordination for Spoken Language Understanding","The paper was published in SLT 2018 conference",,,,"cs.CL cs.LG stat.ML","http://arxiv.org/licenses/nonexclusive-distrib/1.0/","  Typical spoken language understanding systems provide narrow semantic parses
using a domain-specific ontology. The parses contain intents and slots that are
directly consumed by downstream domain applications. In this work we discuss
expanding such systems to handle compound entities and intents by introducing a
domain-agnostic shallow parser that handles linguistic coordination. We show
that our model for parsing coordination learns domain-independent and
slot-independent features and is able to segment conjunct boundaries of many
different phrasal categories. We also show that using adversarial training can
be effective for improving generalization across different slot types for
coordination parsing.
","[{""version"":""v1"",""created"":""Fri, 26 Oct 2018 18:44:52 GMT""}]","2018-10-30"
"1810.11498","Bhaskar Gautam","Bhaskar Gautam and Annappa Basava","Automatic Identification and Ranking of Emergency Aids in Social Media
  Macro Community","Working notes of IRMiDis Track {FIRE} 2017 - Forum for Information
  Retrieval Evaluation, Bangalore, India, December 8-10, 2017,
  http://ceur-ws.org/Vol-2036",,,,"cs.IR cs.SI","http://creativecommons.org/publicdomain/zero/1.0/","  Online social microblogging platforms including Twitter are increasingly used
for aiding relief operations during disaster events. During most of the
calamities that can be natural disasters or even armed attacks,
non-governmental organizations look for critical information about resources to
support effected people. Despite the recent advancement of natural language
processing with deep neural networks, retrieval and ranking of short text
becomes a challenging task because a lot of conversational and sympathy content
merged with the critical information. In this paper, we address the problem of
categorical information retrieval and ranking of most relevance information
while considering the presence of short-text and multilingual languages that
arise during such events. Our proposed model is based on the formation of
embedding vector with the help of textual and statistical preprocessing, and
finally, entire training 2,100,000 vectors were normalized using feed-forward
neural network for need and availability tweets. Another important contribution
of this paper lies in novel weighted Ranking Key algorithm based on top five
general terms to rank the classified tweets in most relevance with
classification. Lastly, we test our model on Nepal Earthquake dataset (contains
short text and multilingual language tweets) and achieved 6.81% of mean average
precision on 5,250,000 unlabeled embedding vectors of disaster relief tweets.
","[{""version"":""v1"",""created"":""Fri, 26 Oct 2018 18:45:12 GMT""}]","2018-10-30"
"1810.11499","Parinaz Farajiparvar","Parinaz Farajiparvar, Ahmad Beirami, Matthew Nokleby","Information Bottleneck Methods for Distributed Learning",,,,,"cs.IT cs.LG math.IT","http://creativecommons.org/licenses/by/4.0/","  We study a distributed learning problem in which Alice sends a compressed
distillation of a set of training data to Bob, who uses the distilled version
to best solve an associated learning problem. We formalize this as a
rate-distortion problem in which the training set is the source and Bob's
cross-entropy loss is the distortion measure. We consider this problem for
unsupervised learning for batch and sequential data. In the batch data, this
problem is equivalent to the information bottleneck (IB), and we show that
reduced-complexity versions of standard IB methods solve the associated
rate-distortion problem. For the streaming data, we present a new algorithm,
which may be of independent interest, that solves the rate-distortion problem
for Gaussian sources. Furthermore, to improve the results of the iterative
algorithm for sequential data we introduce a two-pass version of this
algorithm. Finally, we show the dependency of the rate on the number of samples
$k$ required for Gaussian sources to ensure cross-entropy loss that scales
optimally with the growth of the training set.
","[{""version"":""v1"",""created"":""Fri, 26 Oct 2018 18:48:24 GMT""}]","2018-10-30"
