"1808.01165","Bj{\o}rn Jensen","Bolaji James Adesokan, Bj{\o}rn Jensen, Bangti Jin and Kim Knudsen","Acousto-Electric Tomography with Total Variation Regularization","22 pages, 30 figures",,"10.1088/1361-6420/aaece5",,"math.OC","http://arxiv.org/licenses/nonexclusive-distrib/1.0/","  We study the numerical reconstruction problem in acousto-electric tomography
of recovering the conductivity distribution in a bounded domain from interior
power density data. We propose a numerical method for recovering discontinuous
conductivity distributions, by reformulating it as an optimization problem with
$ L^1 $ fitting and total variation penalty subject to PDE constraints. We
establish continuity and differentiability results for the forward map, the
well-posedness of the optimization problem, and present an easy-to-implement
and robust numerical method based on successive linearization, smoothing and
iterative reweighing. Extensive numerical experiments are presented to
illustrate the feasibility of the proposed approach.
","[{""version"":""v1"",""created"":""Fri, 3 Aug 2018 11:50:13 GMT""}]","2019-02-20"
"1808.01166","Erich Schikuta","Erich Schikuta, Helmut Wanek, Heinz Stockinger, Kurt Stockinger,
  Thomas F\""urle, Oliver Jorns, Christoph L\""offelhardt, Peter Brezany, Minh
  Dang, Thomas M\""uck","ViPIOS - VIenna Parallel Input Output System: Language, Compiler and
  Advanced Data Structure Support for Parallel I/O Operations","210 pages",,,,"cs.DC","http://arxiv.org/licenses/nonexclusive-distrib/1.0/","  For an increasing number of data intensive scientific applications, parallel
I/O concepts are a major performance issue. Tackling this issue, we develop an
input/output system designed for highly efficient, scalable and conveniently
usable parallel I/O on distributed memory systems. The main focus of this
research is the parallel I/O runtime system support provided for
software-generated programs produced by parallelizing compilers in the context
of High Performance FORTRAN efforts. Specifically, our design aims for the
Vienna Fortran Compilation System.
  In our research project we investigate the I/O problem from a runtime system
support perspective. We focus on the design of an advanced parallel I/O
support, called ViPIOS (VIenna Parallel I/O System), to be targeted by language
compilers supporting the same programming model like High Performance Fortran
(HPF). The ViPIOS design is partly influenced by the concepts of parallel
database technology.
  At the beginning of the project we developed a formal model, which forms a
theoretical framework on which the ViPIOS design is based. This model describes
the mapping of the problem specific data space starting from the application
program data structures down to the physical layout on disk across several
intermediate representation levels.
  Based on this formal model we designed and developed an I/O runtime system,
ViPIOS, which provides support for several issues, as - parallel access to
files for read/write operations, - optimization of data-layout on disks, -
redistribution of data stored on disks, - communication of out-of-core (OOC)
data, and - many optimizations including data prefetching from disks based on
the access pattern knowledge extracted from the program by the compiler or
provided by a user specification.
","[{""version"":""v1"",""created"":""Fri, 3 Aug 2018 11:52:17 GMT""}]","2018-08-06"
"1808.01167","Ritam Mallick","Ritam Mallick","Magnetized taub adiabat and the PT of magnetic neutron stars","7 pages, 7 figures. Comments are welcome","Phys. Rev. C 100, 015801 (2019)","10.1103/PhysRevC.100.015801",,"astro-ph.HE","http://arxiv.org/licenses/nonexclusive-distrib/1.0/","  In this study we derive the magnetized Taub adiabat equations from the
hydrodynamic conservation conditions. We employ the magnetized taub adiabat
equations to study the evolution of a magnetized neutron star to magnetized
quark star. The pressure of the burnt quark matter has a maximum which
indicates a bound on the maximum mass of the quark star. The central density of
the neutron star and the angle between the rotation axis and the magnetic axis
(defined as the tilt angle) are seen to be significant in determining the
magnetic field, and the tilt of the quark star. The magnetic field and the tilt
of the quark star can have a observational significance and can help in
understanding the physics at high density and strong magnetic field.
","[{""version"":""v1"",""created"":""Fri, 3 Aug 2018 11:55:52 GMT""}]","2019-07-17"
"1808.01168","Tim Albrecht","Amelia Y.Y. Loh, Claire H. Burgess, Diana A. Tanase, Giorgio Ferrari,
  Martyn A. McLachlan, Anthony E.G. Cass, Tim Albrecht","An All-Electric Single-Molecule Hybridisation Detector for short DNA
  Fragments",,,,,"cond-mat.soft physics.bio-ph q-bio.BM","http://arxiv.org/licenses/nonexclusive-distrib/1.0/","  In combining DNA nanotechnology and high-bandwidth single-molecule detection
in nanopipettes, we demonstrate an all-electric, label-free hybridisation
sensor for short DNA sequences (< 100 nt). Such short fragments are known to
occur as circulating cell-free DNA in various bodily fluids, such as blood
plasma and saliva, and have been identified as disease markers for cancer and
infectious diseases. To this end, we use as a model system a 88-mer target from
the RV1910c gene in Mycobacterium tuberculosis that is associated with
antibiotic (isoniazid) resistance in TB. Upon binding to short probes attached
to long carrier DNA, we show that resistive pulse sensing in nanopipettes is
capable of identifying rather subtle structural differences, such as the
hybridisation state of the probes, in a statistically robust manner. With
significant potential towards multiplexing and high-throughput analysis, our
study points towards a new, single-molecule DNA assay technology that is fast,
easy to use and compatible with point of care environments.
","[{""version"":""v1"",""created"":""Fri, 3 Aug 2018 11:56:35 GMT""}]","2018-08-06"
"1808.01169","Ovidiu Banias","Alex Doboli, Daniel Curiac, Dan Pescaru, Simona Doboli, Wendy Tang,
  Costantin Volosencu, Michael Gilberti, Ovidiu Banias, Codruta Istin","Cities of the Future: Employing Wireless Sensor Networks for Efficient
  Decision Making in Complex Environments",,,,"University at Stony Brook, CEAS Technical Report Nr. 831","cs.MA cs.NI","http://arxiv.org/licenses/nonexclusive-distrib/1.0/","  Decision making in large scale urban environments is critical for many
applications involving continuous distribution of resources and utilization of
infrastructure, such as ambient lighting control and traffic management.
Traditional decision making methods involve extensive human participation, are
expensive, and inefficient and unreliable for hard-to-predict situations.
Modern technology, including ubiquitous data collection though sensors,
automated analysis and prognosis, and online optimization, offers new
capabilities for developing flexible, autonomous, scalable, efficient, and
predictable control methods. This paper presents a new decision making concept
in which a hierarchy of semantically more abstract models are utilized to
perform online scalable and predictable control. The lower semantic levels
perform localized decisions based on sampled data from the environment, while
the higher semantic levels provide more global, time invariant results based on
aggregated data from the lower levels. There is a continuous feedback between
the levels of the semantic hierarchy, in which the upper levels set performance
guaranteeing constraints for the lower levels, while the lower levels indicate
whether these constraints are feasible or not. Even though the semantic
hierarchy is not tied to a particular set of description models, the paper
illustrates a hierarchy used for traffic management applications and composed
of Finite State Machines, Conditional Task Graphs, Markov Decision Processes,
and functional graphs. The paper also summarizes some of the main research
problems that must be addressed as part of the proposed concept
","[{""version"":""v1"",""created"":""Fri, 3 Aug 2018 12:03:12 GMT""}]","2018-08-06"
"1808.01170","Emmanuil Saridakis","Shreya Banerjee, Yi-Fu Cai and Emmanuel N. Saridakis","Evading the theoretical no-go theorem for nonsingular bounces in
  Horndeski/Galileon cosmology","9 pages, 5 figures, version published in Class.Quant.Grav",,"10.1088/1361-6382/ab256a",,"gr-qc astro-ph.CO hep-th","http://arxiv.org/licenses/nonexclusive-distrib/1.0/","  We show that a nonsingular bounce, free of ghosts and gradient instabilities,
can be realized in the framework of Horndeski or generalized Galileon
cosmology. In particular, we first review that the theoretical no-go theorem,
which states that the above is impossible, is based on two very strong
assumptions, namely that a particular quantity cannot be discontinuous during
the bounce, and that there is only one bounce. However, as we show in the
present work, the first assumption not only can be violated in a general
Horndeski/Galileon scenario, but also it is necessarily violated at the bounce
point within the subclass of Horndeski/Galileon gravity in which $K(\phi,X)$
becomes zero at $X=0$. Additionally, concerning the second assumption, which is
crucial in improved versions of the theorem which claim that even if a
nonlinear free of pathologies can be realized it will lead to pathologies in
the infinite past or infinite future, we show that if needed it can be evaded
by considering cyclic cosmology, with an infinite sequence of nonsingular
bounces free of pathologies, which forbids the universe to reach the
""problematic"" regime at infinite past or infinite future. Finally, in order to
make the analysis more transparent we provide explicit examples where
nonsingular bounces without theoretical pathologies can be achieved.
","[{""version"":""v1"",""created"":""Fri, 3 Aug 2018 12:09:33 GMT""},{""version"":""v2"",""created"":""Sat, 20 Oct 2018 10:10:17 GMT""},{""version"":""v3"",""created"":""Fri, 28 Jun 2019 01:03:37 GMT""}]","2019-09-04"
"1808.01171","Max Winkler","Max Winkler","Error estimates for variational normal derivatives and Dirichlet control
  problems with energy regularization","30 pages, 1 figure",,,,"math.NA math.AP math.OC","http://arxiv.org/licenses/nonexclusive-distrib/1.0/","  This article deals with error estimates for the finite element approximation
of variational normal derivatives and, as a consequence, error estimates for
the finite element approximation of Dirichlet boundary control problems with
energy regularization. The regularity of the solution is carefully carved out
exploiting weighted Sobolev and H\""older spaces. This allows to derive a sharp
relation between the convergence rates for the approximation and the structure
of the geometry, more precisely, the largest opening angle at the vertices of
polygonal domains. Numerical experiments confirm that the derived convergence
rates are sharp.
","[{""version"":""v1"",""created"":""Fri, 3 Aug 2018 12:11:12 GMT""}]","2018-08-06"
"1808.01172","Jan Korbel","Petr Jizba and Jan Korbel","Maximum Entropy Principle in statistical inference: case for
  non-Shannonian entropies","to appear in Phys. Rev. Lett., 6 pages, 6 pages of Supplementary
  material","Phys. Rev. Lett. 122, 120601 (2019)","10.1103/PhysRevLett.122.120601",,"cond-mat.stat-mech math-ph math.MP","http://arxiv.org/licenses/nonexclusive-distrib/1.0/","  In this letter we show that the Shore--Johnson axioms for Maximum Entropy
Principle in statistical estimation theory account for a considerably wider
class of entropic functional than previously thought. Apart from a formal side
of the proof, we substantiate our point by analyzing the effect of weak
correlations and discuss two pertinent examples: $2$-qubit quantum system and
strongly interacting nuclear systems.
","[{""version"":""v1"",""created"":""Fri, 3 Aug 2018 12:16:18 GMT""},{""version"":""v2"",""created"":""Mon, 20 Aug 2018 10:14:41 GMT""},{""version"":""v3"",""created"":""Fri, 15 Mar 2019 14:22:37 GMT""}]","2019-04-03"
"1808.01173","Chen Hajaj","Chen Hajaj, Sixie Yu, Zlatko Joveski, Yevgeniy Vorobeychik","Adversarial Coordination on Social Networks",,,,,"cs.SI physics.soc-ph","http://arxiv.org/licenses/nonexclusive-distrib/1.0/","  Decentralized coordination is one of the fundamental challenges for societies
and organizations. While extensively explored from a variety of perspectives,
one issue which has received limited attention is human coordination in the
presence of adversarial agents. We study this problem by situating human
subjects as nodes on a network, and endowing each with a role, either regular
(with the goal of achieving consensus among all regular players), or
adversarial (aiming to prevent consensus among regular players). We show that
adversarial nodes are, indeed, quite successful in preventing consensus.
However, we demonstrate that having the ability to communicate among network
neighbors can considerably improve coordination success, as well as resilience
to adversarial nodes. Our analysis of communication suggests that adversarial
nodes attempt to exploit this capability for their ends, but do so in a
somewhat limited way, perhaps to prevent regular nodes from recognizing their
intent. In addition, we show that the presence of trusted nodes generally has
limited value, but does help when many adversarial nodes are present and
players can communicate. Finally, we use experimental data to develop a
computational model of human behavior, and explore a number of additional
parametric variations, such as features of network topologies, using the
resulting data-driven agent-based model.
","[{""version"":""v1"",""created"":""Fri, 3 Aug 2018 12:45:27 GMT""}]","2018-08-06"
"1808.01174","Daniel Jakubovitz","Daniel Jakubovitz, Raja Giryes, Miguel R. D. Rodrigues","Generalization Error in Deep Learning",,,,,"cs.LG cs.AI stat.ML","http://arxiv.org/licenses/nonexclusive-distrib/1.0/","  Deep learning models have lately shown great performance in various fields
such as computer vision, speech recognition, speech translation, and natural
language processing. However, alongside their state-of-the-art performance, it
is still generally unclear what is the source of their generalization ability.
Thus, an important question is what makes deep neural networks able to
generalize well from the training set to new data. In this article, we provide
an overview of the existing theory and bounds for the characterization of the
generalization error of deep neural networks, combining both classical and more
recent theoretical and empirical results.
","[{""version"":""v1"",""created"":""Fri, 3 Aug 2018 12:57:12 GMT""},{""version"":""v2"",""created"":""Thu, 20 Dec 2018 13:34:09 GMT""},{""version"":""v3"",""created"":""Sat, 6 Apr 2019 15:25:50 GMT""}]","2019-04-09"
"1808.01175","Muhammed Tarik Altuncu","M. Tarik Altuncu, Sophia N. Yaliraki, Mauricio Barahona","Content-driven, unsupervised clustering of news articles through
  multiscale graph partitioning","8 pages; 5 figures; To present at KDD 2018: Data Science, Journalism
  & Media workshop",,,,"cs.CL cs.IR cs.LG math.SP","http://arxiv.org/licenses/nonexclusive-distrib/1.0/","  The explosion in the amount of news and journalistic content being generated
across the globe, coupled with extended and instantaneous access to information
through online media, makes it difficult and time-consuming to monitor news
developments and opinion formation in real time. There is an increasing need
for tools that can pre-process, analyse and classify raw text to extract
interpretable content; specifically, identifying topics and content-driven
groupings of articles. We present here such a methodology that brings together
powerful vector embeddings from Natural Language Processing with tools from
Graph Theory that exploit diffusive dynamics on graphs to reveal natural
partitions across scales. Our framework uses a recent deep neural network text
analysis methodology (Doc2vec) to represent text in vector form and then
applies a multi-scale community detection method (Markov Stability) to
partition a similarity graph of document vectors. The method allows us to
obtain clusters of documents with similar content, at different levels of
resolution, in an unsupervised manner. We showcase our approach with the
analysis of a corpus of 9,000 news articles published by Vox Media over one
year. Our results show consistent groupings of documents according to content
without a priori assumptions about the number or type of clusters to be found.
The multilevel clustering reveals a quasi-hierarchy of topics and subtopics
with increased intelligibility and improved topic coherence as compared to
external taxonomy services and standard topic detection methods.
","[{""version"":""v1"",""created"":""Fri, 3 Aug 2018 12:57:15 GMT""}]","2018-08-06"
"1808.01176","Riccardo Campana","R. Campana, E. Massaro, E. Bernieri","A MST catalogue of gamma-ray source candidates above 10 GeV and at
  Galactic latitudes higher than 20 degrees","18 pages, 10 figures. Accepted for publication in Astronomy &
  Astrophysics","A&A 619, A23 (2018)","10.1051/0004-6361/201833360",,"astro-ph.HE astro-ph.GA","http://arxiv.org/licenses/nonexclusive-distrib/1.0/","  We describe a catalogue of gamma-ray source candidates, selected using the
Minimum Spanning Tree (MST) algorithm on the 9-years Fermi-LAT sky (Pass 8) at
energies higher than 10 GeV. The extragalactic sky at absolute Galactic
latitudes above 20 degrees has been investigated using rather restrictive
selection criteria, resulting in a total sample of 1342 sources. Of these, 249
are new detections, not previously associated with gamma-ray catalogues. A
large fraction of them have interesting counterparts, most likely blazars. In
this paper the main results on the catalogue selection and search of
counterparts are reported.
","[{""version"":""v1"",""created"":""Fri, 3 Aug 2018 12:58:04 GMT""}]","2018-10-31"
"1808.01177","Thomas Lukaseder Mr","Thomas Lukaseder, Kevin St\""olzle, Stephan Kleber, Benjamin Erb, Frank
  Kargl","An SDN-based Approach For Defending Against Reflective DDoS Attacks",,,,,"cs.CR","http://arxiv.org/licenses/nonexclusive-distrib/1.0/","  Distributed Reflective Denial of Service (DRDoS) attacks are an immanent
threat to Internet services. The potential scale of such attacks became
apparent in March 2018 when a memcached-based attack peaked at 1.7 Tbps. Novel
services built upon UDP increase the need for automated mitigation mechanisms
that react to attacks without prior knowledge of the actual application
protocols used. With the flexibility that software-defined networks offer, we
developed a new approach for defending against DRDoS attacks; it not only
protects against arbitrary DRDoS attacks but is also transparent for the attack
target and can be used without assistance of the target host operator. The
approach provides a robust mitigation system which is protocol-agnostic and
effective in the defense against DRDoS attacks.
","[{""version"":""v1"",""created"":""Fri, 3 Aug 2018 13:07:11 GMT""}]","2018-08-06"
"1808.01178","Dan Lucas","Dan Lucas, C.P. Caulfield and Rich R. Kerswell","Layer formation and relaminarisation in plane Couette flow with spanwise
  stratification","Accepted for publication at JFM",,"10.1017/jfm.2019.192",,"physics.flu-dyn","http://arxiv.org/licenses/nonexclusive-distrib/1.0/","  Recent research has shed light on the role of coherent structures in forming
layers when stably stratified turbulence is forced with horizontal shear
(Lucas, Caulfield & Kerswell, J. Fluid Mech., vol. 832, 2017, pp. 409-437).
Here we extend our previous work to investigate the effect of rigid boundaries
on the dynamics by studying stably-stratified plane Couette flow with gravity
oriented in the spanwise direction. We observe near-wall layering and
associated new mean flows in the form of large scale spanwise-flattened
streamwise rolls. The layers exhibit the expected buoyancy scaling $l_z\sim
U/N$ where $U$ is a typical horizontal velocity scale and $N$ the buoyancy
frequency. We associate the new coherent structures with a stratified
modification of the well-known large scale secondary flow in plane Couette and
find that the possibility of the transition to sustained turbulence is
controlled by the relative size of this buoyancy scale to the spanwise spacing
of the streaks. We also investigate the influence on the transition to
turbulence of the newly discovered linear instability in this system (Facchini
et. al. 2018 arXiv:1711.11312).
","[{""version"":""v1"",""created"":""Fri, 3 Aug 2018 13:07:49 GMT""},{""version"":""v2"",""created"":""Wed, 27 Feb 2019 17:16:45 GMT""},{""version"":""v3"",""created"":""Tue, 19 Mar 2019 10:20:39 GMT""}]","2019-05-01"
"1808.01179","Emma Brakkee","Emma Brakkee","Two polarized K3 surfaces associated to the same cubic fourfold","More precise statement of Theorem 2, better definition of associated
  K3 surfaces (def. 2.4), proper proof of Cor. 4.4 using the new Lemma 4.3",,,,"math.AG","http://arxiv.org/licenses/nonexclusive-distrib/1.0/","  For infinitely many $d$, Hassett showed that special cubic fourfolds of
discriminant $d$ are related to polarized K3 surfaces of degree $d$ via their
Hodge structures. For half of the $d$, each associated K3 surface $(S,L)$
canonically yields another one, $(S^{\tau},L^{\tau})$. We prove that $S^{\tau}$
is isomorphic to the moduli space of stable coherent sheaves on $S$ with Mukai
vector $(3,L,d/6)$. We also explain for which $d$ the Hilbert schemes
$\text{Hilb}^n(S)$ and $\text{Hilb}^n(S^{\tau})$ are birational.
","[{""version"":""v1"",""created"":""Fri, 3 Aug 2018 13:10:45 GMT""},{""version"":""v2"",""created"":""Thu, 11 Oct 2018 14:38:34 GMT""},{""version"":""v3"",""created"":""Tue, 4 Dec 2018 17:01:25 GMT""}]","2018-12-05"
"1808.01180","Bjorn Berntson","Guilherme Volpe Bossa, Bjorn K. Berntson, and Sylvio May","Curvature Elasticity of the Electric Double Layer","5 pages, 4 figures. Published in Physical Review Letters. Copyright
  2018 by the American Physical Society","Phys. Rev. Lett. 120, 215502 (2018)","10.1103/PhysRevLett.120.215502",,"cond-mat.soft","http://arxiv.org/licenses/nonexclusive-distrib/1.0/","  Mean-field electrostatics is used to calculate the bending moduli of an
electric double layer for fixed surface charge density of a macroion in a
symmetric 1:1 electrolyte. The resulting expressions for bending stiffness,
Gaussian modulus, and spontaneous curvature refer to a general underlying
equation of state of the electrolyte, subject to a local density approximation
and the absence of dipole and higher-order fields. We present results for
selected applications: the lattice-gas Poisson-Fermi model with and without
asymmetric ion sizes, and the Poisson-Carnahan-Starling model.
","[{""version"":""v1"",""created"":""Fri, 3 Aug 2018 13:17:48 GMT""}]","2018-08-06"
"1808.01181","Jakub Mare\v{c}ek","Jakub Marecek and Tigran Tchrakian","Robust Spectral Filtering and Anomaly Detection",,,,,"cs.LG math.OC stat.ML","http://arxiv.org/licenses/nonexclusive-distrib/1.0/","  We consider a setting, where the output of a linear dynamical system (LDS)
is, with an unknown but fixed probability, replaced by noise. There, we present
a robust method for the prediction of the outputs of the LDS and identification
of the samples of noise, and prove guarantees on its statistical performance.
One application lies in anomaly detection: the samples of noise, unlikely to
have been generated by the dynamics, can be flagged to operators of the system
for further study.
","[{""version"":""v1"",""created"":""Fri, 3 Aug 2018 13:25:39 GMT""}]","2018-08-06"
"1808.01182","Aalok Misra","Vikas Yadav and Aalok Misra","M-Theory Exotic Scalar Glueball Decays to Mesons at Finite Coupling","v3:49 pages, LaTeX, 2 Figures, accepted journal (JHEP) version",,"10.1007/JHEP09(2018)133",,"hep-th hep-ph nucl-th","http://arxiv.org/licenses/nonexclusive-distrib/1.0/","  Using the pull-back of the perturbed type IIA metric corresponding to the
perturbation of arXiv:hep-th/1306.4339's M-theory uplift of
arXiv:hep-th/0902.1540's UV-complete top-down type IIB holographic dual of
large-$N$ thermal QCD, at finite coupling, we obtain the interaction Lagrangian
corresponding to exotic scalar glueball($G_E$)-$\rho/\pi$-meson interaction,
linear in the exotic scalar glueball and up to quartic order in the $\pi$
mesons. In the Lagrangian, the coupling constants are determined as (radial
integrals of) arXiv:hep-th/1306.4339's M-theory uplift's metric components and
six radial functions appearing in the M-theory metric perturbations. Assuming
$M_G>2M_\rho$, we then compute $\rho\rightarrow2\pi, G_E\rightarrow2\pi, 2\rho,
\rho+2\pi$ decay widths as well as the direct and indirect (mediated via $\rho$
mesons) $G_E\rightarrow4\pi$ decays. For numerics, we choose $f0[1710]$ and
compare with previous calculations. We emphasize that our results can be made
to match PDG data (and improvements thereof) exactly by appropriate tuning of
some constants of integration appearing in the solution of the M-theory metric
perturbations and the $\rho$ and $\pi$ meson radial profile functions - a
flexibility that our calculations permits.
","[{""version"":""v1"",""created"":""Thu, 2 Aug 2018 17:40:47 GMT""},{""version"":""v2"",""created"":""Wed, 8 Aug 2018 17:34:44 GMT""},{""version"":""v3"",""created"":""Wed, 5 Sep 2018 06:23:53 GMT""}]","2018-10-17"
