"1808.00985","Peng Sun","Peng Sun","Minimality and Gluing Orbit Property","15 pages. Results hold for both discrete-time and continuous-time
  cases, and noninvertible cases as well",,,,"math.DS","http://arxiv.org/licenses/nonexclusive-distrib/1.0/","  We show that a topological dynamical system is either minimal or have
positive topological entropy. Moreover, for equicontinuous systems, we show
that topological transitivity, minimality and orbit gluing property are
equivalent. These facts reflect the similarity and dissimilarity of gluing
orbit property with specification property.
","[{""version"":""v1"",""created"":""Thu, 2 Aug 2018 18:42:19 GMT""},{""version"":""v2"",""created"":""Fri, 10 Aug 2018 12:32:25 GMT""},{""version"":""v3"",""created"":""Tue, 21 Aug 2018 16:30:38 GMT""}]","2018-08-22"
"1808.00986","Hongzhi Wang","Meifan Zhang and Hongzhi Wang and Jianzhong Li and Hong Gao","Diversification on Big Data in Query Processing",,,,,"cs.DB","http://arxiv.org/licenses/nonexclusive-distrib/1.0/","  Recently, in the area of big data, some popular applications such as web
search engines and recommendation systems, face the problem to diversify
results during query processing. In this sense, it is both significant and
essential to propose methods to deal with big data in order to increase the
diversity of the result set. In this paper, we firstly define a set's diversity
and an element's ability to improve the set's overall diversity. Based on these
definitions, we propose a diversification framework which has good performance
in terms of effectiveness and efficiency. Also, this framework has theoretical
guarantee on probability of success. Secondly, we design implementation
algorithms based on this framework for both numerical and string data. Thirdly,
for numerical and string data respectively, we carry out extensive experiments
on real data to verify the performance of our proposed framework, and also
perform scalability experiments on synthetic data.
","[{""version"":""v1"",""created"":""Thu, 2 Aug 2018 18:47:27 GMT""}]","2018-08-06"
"1808.00987","Gregory B. Cook","Gregory B. Cook and Luke S. Annichiarico and Daniel J. Vickers","An unknown branch of the total-transmission modes for the Kerr-geometry","12 pages, 12 figures","Phys. Rev. D 99, 024008 (2019)","10.1103/PhysRevD.99.024008",,"gr-qc","http://arxiv.org/licenses/nonexclusive-distrib/1.0/","  The gravitational modes of the Kerr geometry include both quasinormal modes
and total-transmission modes. Sequences of these modes are parameterized by the
angular momentum of the black hole. The quasinormal and total-transmission
modes are usually distinct, having mode frequencies that are different at any
given value of the angular momentum. But a discrete and countably infinite
subset of the left-total-transmission modes are simultaneously quasinormal
modes. Most of these special modes exist along previously unknown branches of
the gravitational total-transmission modes. In this paper, we give detailed
plots of the total-transmission modes for harmonic indices $\ell=[2,7]$, with
special emphasis given to the $m=0$ modes which all contain previously unknown
branches. All of these unknown branches have purely imaginary mode frequencies.
We find that as we approach the Schwarzschild limit along these new branches,
the mode frequencies approach $-i\infty$ in stark contrast to the finite mode
frequency obtained in the Schwarzschild limit along the previously known
branches. We explain when and why, at certain frequencies, the
left-total-transmission modes are simultaneously quasinormal modes. At these
same frequencies, the right-total-transmission modes are missing. We also
derive analytic expressions for the asymptotic behavior of the
total-transmission mode frequencies, and for the values of the angular momentum
at which the modes are simultaneously quasinormal modes.
","[{""version"":""v1"",""created"":""Thu, 2 Aug 2018 18:57:17 GMT""},{""version"":""v2"",""created"":""Wed, 9 Jan 2019 21:16:01 GMT""}]","2019-01-11"
"1808.00988","Soyoung Jekal","S.-Y. Jekal","Exchange interactions and Curie temperature of Ce-substituted SmCo5","Here we provide calculation details of mean-field approximation for
  exchange energy and Curie temperatrure which are submitted recently in
  [arXiv:1807.09257] 'Pushing the limits of magnetic anisotropy in the Sm-Co
  system'",,,,"cond-mat.mtrl-sci","http://arxiv.org/licenses/nonexclusive-distrib/1.0/","  A partial substitution of Sm by Ce can have drastic effects on the magnetic
performance, because it will introduce strain in the structure and breaks the
lattice symmetry in a way that enhances the contribution of the Co atoms to
magnetocrystalline anisotropy. However, Ce substitutions, which are benefit to
improve the magnetocrystalline anisotropy, are detrimental to enhance the Curie
temperature (TC). With the requirements of wide operating temperature range of
magnetic devices, it is important to quantitatively explore the relationship
between the TC and ferromagnetic exchange energy. In this paper we show, based
on mean-field approximation, that Ce substitution-induced tensile strain in
SmCo5 leads to enhanced effective ferromagnetic exchange energy and TC while Ce
atom itself reduces TC.
","[{""version"":""v1"",""created"":""Thu, 2 Aug 2018 18:59:10 GMT""}]","2018-08-06"
"1808.00989","Rafal Goebel","Rafal Goebel and Ricardo Sanfelice","A unifying convex analysis and switching system approach to consensus
  with undirected communication graphs",,,,,"math.OC","http://arxiv.org/licenses/nonexclusive-distrib/1.0/","  Switching between finitely many continuous-time autonomous steepest descent
dynamics for convex functions is considered. Convergence of complete solutions
to common minimizers of the convex functions, if such minimizers exist, is
shown. The convex functions need not be smooth and may be subject to
constraints. Since the common minimizers may represent consensus in a
multi-agent system modeled by an undirected communication graph, several known
results about asymptotic consensus are deduced as special cases. Extensions to
time-varying convex functions and to dynamics given by set-valued mappings more
general than subdifferentials of convex functions are included.
","[{""version"":""v1"",""created"":""Thu, 2 Aug 2018 18:59:18 GMT""}]","2018-08-06"
"1808.00990","Saraceno Marcos","Marcos Saraceno and Alfredo M. Ozorio de Almeida","Translations and reflections on the torus: Identities for discrete
  Wigner functions and transforms","22 pages, 4 figures",,"10.1088/1751-8121/aafdc2",,"quant-ph","http://arxiv.org/licenses/nonexclusive-distrib/1.0/","  A finite Hilbert space can be associated to a periodic phase space, that is,
a torus. A finite subgroup of operators corresponding to reflections and
translations on the torus form respectively the basis for the discrete Weyl
representation, including the Wigner function, and for its Fourier conjugate,
the chord representation. They are invariant under Clifford transformations and
obey analogous product rules to the continuous representations, so allowing for
the calculation of expectations and correlations for observables. We here
import new identities from the continuum for products of pure state Wigner and
chord functions, involving, for instance the inverse phase space participation
ratio and correlations of a state with its translate. New identities are
derived involving {\it transition} Wigner or chord functions of transition
operators $\ket{\psi_1}\bra{\psi_2}$. Extension of the reflection and
translation operators to a doubled torus phase space leads to the
representation of superoperators and so to the construction of the propagator
of Wigner functions from the Weyl representation of the evolution operator.
","[{""version"":""v1"",""created"":""Thu, 2 Aug 2018 19:00:41 GMT""}]","2019-02-20"
"1808.00991","Nathan Smith","Nathan Smith, Armin Rest, Jennifer E. Andrews, Tom Matheson, Federica
  B. Bianco, Jose L. Prieto, David J. James, R. Chris Smith, Giovanni Maria
  Strampelli, and A. Zenteno","Exceptionally fast ejecta seen in light echoes of Eta Carinae's Great
  Eruption","Accepted by MNRAS. 10 pages, 6 figures",,"10.1093/mnras/sty1479",,"astro-ph.SR astro-ph.HE","http://arxiv.org/licenses/nonexclusive-distrib/1.0/","  In our ongoing study of eta Carinae's light echoes, there is a relatively
bright echo that has been fading slowly, reflecting the 1845-1858 plateau of
the eruption. A separate paper discusses its detailed evolution, but here we
highlight one important result: the H-alpha line shows extremely broad emission
wings that reach -10,000km/s to the blue and +20,000km/s to the red. The line
profile shape is inconsistent with electron scattering wings, indicating
high-velocity outflowing material. These are the fastest outflow speeds ever
seen in a non-terminal massive star eruption. The broad wings are absent in
early phases of the eruption, but strengthen in the 1850s. These speeds are two
orders of magnitude faster than the escape speed from a warm supergiant, and
5-10 times faster than winds from O-type or Wolf-Rayet stars. Instead, they are
reminiscent of fast supernova ejecta or outflows from accreting compact
objects, profoundly impacting our understanding of eta Car and related
transients. This echo views eta Car from latitudes near the equator, so the
high speed does not trace a collimated polar jet aligned with the Homunculus.
Combined with fast material in the Outer Ejecta, it indicates a wide-angle
explosive outflow. The fast material may constitute a small fraction of the
total outflowing mass, most of which expands at 600 km/s. This is reminiscent
of fast material revealed by broad absorption during the presupernova eruptions
of SN2009ip.
","[{""version"":""v1"",""created"":""Thu, 2 Aug 2018 19:05:32 GMT""}]","2018-08-15"
"1808.00992","Nathan Smith","Nathan Smith, Jennifer E. Andrews, Armin Rest, Federica B. Bianco,
  Jose L. Prieto, Tom Matheson, David J. James, R. Chris Smith, Giovanni Maria
  Strampelli, and A. Zenteno","Light-echoes from the plateau in Eta Carinae's Great Eruption reveal a
  two-stage shock-powered event","Accepted by MNRAS. 36 pages, 17 figures",,"10.1093/mnras/sty1500",,"astro-ph.SR astro-ph.HE","http://arxiv.org/licenses/nonexclusive-distrib/1.0/","  We present multi-epoch photometry and spectroscopy of a light echo from eta
Carinae's 19th century Great Eruption. This echo shows a steady decline over a
decade, sampling the 1850s plateau of the eruption. Spectra show the bulk
outflow speed increasing from 150 km/s at early times, up to 600 km/s in the
plateau. Later phases also develop remarkably broad emission wings indicating
mass accelerated to more than 10,000 km/s. Together with other clues, this
provides direct evidence for an explosive ejection. This is accompanied by a
transition from narrow absorption lines to emission lines, often with broad P
Cygni profiles. These changes imply that the pre-1845 luminosity spikes are
distinct from the 1850s plateau. The key reason for this change may be that
shock interaction dominates the plateau. The spectral evolution of eta Car
closely resembles that of UGC2773-OT, which had clear signatures of shock
interaction. We propose a 2-stage scenario for eta Car's eruption: (1) a slow
outflow in the decades before the eruption, driven by binary interaction that
produced a dense equatorial outflow, followed by (2) explosive energy injection
that drove CSM interaction, powering the plateau and sweeping slower CSM into a
fast shell that became the Homunculus. We discuss how this sequence could arise
from a stellar merger in a triple system, leaving the eccentric binary seen
today. This gives a self-consistent scenario that may explain interacting
transients across a wide range of initial mass.
","[{""version"":""v1"",""created"":""Thu, 2 Aug 2018 19:05:37 GMT""}]","2018-08-15"
"1808.00993","Zachary Polonsky","Zachary Polonsky, Alex Flournoy","Thermodynamic phase transitions from dynamical compact dimensions","15 pages, 5 figures. arXiv admin note: text overlap with
  arXiv:1808.00867",,,,"hep-th","http://arxiv.org/licenses/nonexclusive-distrib/1.0/","  We perform a double quotient of global AdS$_4$ and study its thermal
properties. We find that a double quotient yields a spacetime with an expanding
compact dimension. Studying the entanglement of the dual CFT we find that, at
early times, the spacetime has thermal properties which disappear after a
critical time. For slow expansion, this critical time depends on the expansion
rate as expected, but becomes much more sensitive with more rapid expansion
rates.
","[{""version"":""v1"",""created"":""Thu, 2 Aug 2018 19:11:47 GMT""},{""version"":""v2"",""created"":""Sat, 9 Mar 2019 15:26:10 GMT""}]","2019-03-13"
"1808.00994","Anael Lema\^itre","Ana\""el Lema\^itre","Stress correlations in glasses",,,,,"cond-mat.soft","http://arxiv.org/licenses/nonexclusive-distrib/1.0/","  We rigorously establish that, in disordered three-dimensional (3D) isotropic
solids, the stress autocorrelation function presents anisotropic terms that
decay as $1/r^3$ at long-range, with $r$ the distance, as soon as either
pressure or shear stress fluctuations are normal. By normal, we mean that the
fluctuations of stress, as averaged over spherical domains, decay as the
inverse domain volume. Since this property is required for macroscopic stress
to be self-averaging, it is expected to hold generically in all glasses and we
thus conclude that the presence of $1/r^3$ stress correlation tails is the rule
in these systems. Our proof follows from the observation that, in an infinite
medium, when both material isotropy and mechanical balance hold, (i) the stress
autocorrelation matrix is completely fixed by just two radial functions: the
pressure autocorrelation and the trace of the autocorrelation of stress
deviators; furthermore, these two functions (ii) fix the decay of the
fluctuations of sphere-averaged pressure and deviatoric stresses for windows of
increasing volume. Our conclusion is reached because, due to the precise
analytic relation (i) fixed by isotropy and mechanical balance, the constraints
arising via (ii) from the normality of stress fluctuations demand the spatially
anisotropic stress correlation terms to decay as $1/r^3$ at long-range. For the
sake of generality, we also examine situations when stress fluctuations are not
normal.
","[{""version"":""v1"",""created"":""Thu, 2 Aug 2018 19:18:25 GMT""}]","2018-08-06"
"1808.00995","Connor Greenwell","Connor Greenwell, Scott Workman, Nathan Jacobs","What Goes Where: Predicting Object Distributions from Above","4 pages, 5 figures, IGARSS 2018",,,,"cs.CV","http://arxiv.org/licenses/nonexclusive-distrib/1.0/","  In this work, we propose a cross-view learning approach, in which images
captured from a ground-level view are used as weakly supervised annotations for
interpreting overhead imagery. The outcome is a convolutional neural network
for overhead imagery that is capable of predicting the type and count of
objects that are likely to be seen from a ground-level perspective. We
demonstrate our approach on a large dataset of geotagged ground-level and
overhead imagery and find that our network captures semantically meaningful
features, despite being trained without manual annotations.
","[{""version"":""v1"",""created"":""Thu, 2 Aug 2018 19:20:30 GMT""}]","2018-08-06"
"1808.00996","Jiaoping Zhang","Jiaoping Zhang and Asheesh K. Singh","Genetic control and geo-climate adaptation of pod dehiscence provide
  novel insights into the soybean domestication and expansion","17 pages 8 figures",,,,"q-bio.PE","http://arxiv.org/licenses/nonexclusive-distrib/1.0/","  Loss of pod dehiscence is a key step during soybean [Glycine max (L.) Merr.]
domestication. Genome-wide association analysis for soybean shattering
identified loci harboring Pdh1, NST1A and SHAT1-5. Pairwise epistatic
interactions were observed, and the dehiscent Pdh1 overcomes the resistance
conferred by NST1A or SHAT1-5 locus, indicating that Pdh1 predominates pod
dehiscence expression. Further candidate gene association analysis identified a
nonsense mutation in NST1A associated with pod dehiscence. Allele composition
and population differential analyses unraveled that Pdh1 and NST1A, but not
SHAT1-5, underwent domestication and modern breeding selections. Geographic
analysis showed that in Northeast China (NEC), indehiscence at both Pdh1 and
NST1A were required by cultivated soybean; while indehiscent Pdh1 alone is
capable of coping shattering in Huang-Huai-Hai (HHH) valleys where it
originated; and no specific indehiscence was required in Southern China (SC).
Geo-climatic investigation revealed strong correlation between relative
humidity and frequency of indehiscent Pdh1 across China. This study
demonstrates that the epistatic interaction between Pdh1 and NST1A fulfills a
pivotal role in determining the level of resistance against pod dehiscence.
Humidity shapes the distribution of indehiscent alleles. Our results also
suggest that HHH valleys, not NEC, was at least one of the origin centers of
cultivated soybean.
","[{""version"":""v1"",""created"":""Thu, 2 Aug 2018 19:27:54 GMT""}]","2018-08-06"
"1808.00997","Micha Wasem","Norbert Hungerb\""uhler, Micha Wasem","Non-integer valued winding numbers and a generalized Residue Theorem","Final version, 19 pages, 7 figures","Journal of Mathematics, vol. 2019, Article ID 6130464, 9 pages,
  2019","10.1155/2019/6130464",,"math.CA","http://arxiv.org/licenses/nonexclusive-distrib/1.0/","  We define a generalization of the winding number of a piecewise $C^1$ cycle
in the complex plane which has a geometric meaning also for points which lie on
the cycle. The computation of this winding number relies on the Cauchy
principal value, but is also possible in a real version via an integral with
bounded integrand. The new winding number allows to establish a generalized
residue theorem which covers also the situation where singularities lie on the
cycle. This residue theorem can be used to calculate the value of improper
integrals for which the standard technique with the classical residue theorem
does not apply.
","[{""version"":""v1"",""created"":""Thu, 2 Aug 2018 19:29:29 GMT""},{""version"":""v2"",""created"":""Wed, 13 Mar 2019 06:53:52 GMT""}]","2019-03-14"
"1808.00998","Laura Ellwein Fix","Laura Ellwein Fix","Parameter identifiability of a respiratory mechanics model in an
  idealized preterm infant","15 figures (6 in main body, 9 in appendix). Changes to content and
  format based on reviewer comments. 26 pages, p.27 is extraneous",,,,"q-bio.TO","http://arxiv.org/licenses/nonexclusive-distrib/1.0/","  The complexity of mathematical models describing respiratory mechanics has
grown in recent years to integrate with cardiovascular models and incorporate
nonlinear dynamics. However, additional model complexity has rarely been
studied in the context of patient-specific observable data. This study
investigates parameter identification of a previously developed nonlinear
respiratory mechanics model (Ellwein Fix, PLoS ONE 2018) tuned to the
physiology of 1 kg preterm infant, using local deterministic sensitivity
analysis, subset selection, and gradient-based optimization. The model consists
of 4 differential state equations with 31 parameters to predict airflow and
dynamic pulmonary volumes and pressures generated under six simulation
conditions. The relative sensitivity solutions of the model state equations
with respect to each of the parameters were calculated with finite differences
and a sensitivity ranking was created for each parameter and simulation. Subset
selection identified a set of independent parameters that could be estimated
for all six simulations. The combination of these analyses produced a subset of
6 independent sensitive parameters that could be estimated given idealized
clinical data. All optimizations performed using pseudo-data with perturbed
nominal parameters converged within 40 iterations and estimated parameters
within ~8% of nominal values on average. This analysis indicates the
feasibility of performing parameter estimation on real patient-specific data
set described by a nonlinear respiratory mechanics model for studying dynamics
in preterm infants.
","[{""version"":""v1"",""created"":""Thu, 2 Aug 2018 19:30:01 GMT""},{""version"":""v2"",""created"":""Wed, 15 Jan 2020 19:57:28 GMT""}]","2020-01-17"
"1808.00999","Ali Irfan Mahmutogullari","Ali Irfan Mahmutogullari, Shabbir Ahmed, Ozlem Cavus and M. Selim
  Akturk","The Value of Multi-stage Stochastic Programming in Risk-averse Unit
  Commitment under Uncertainty","8 pages, 5 figures",,,,"math.OC","http://arxiv.org/licenses/nonexclusive-distrib/1.0/","  Day-ahead scheduling of electricity generation or unit commitment is an
important and challenging optimization problem in power systems. Variability in
net load arising from the increasing penetration of renewable technologies have
motivated study of various classes of stochastic unit commitment models. In
two-stage models, the generation schedule for the entire day is fixed while the
dispatch is adapted to the uncertainty, whereas in multi-stage models the
generation schedule is also allowed to dynamically adapt to the uncertainty
realization. Multi-stage models provide more flexibility in the generation
schedule, however, they require significantly higher computational effort than
two-stage models. To justify this additional computational effort, we provide
theoretical and empirical analyses of the value of multi-stage solution for
risk-averse multi-stage stochastic unit commitment models. The value of
multi-stage solution measures the relative advantage of multi-stage solutions
over their two-stage counterparts. Our results indicate that, for unit
commitment models, value of multi-stage solution increases with the level of
uncertainty and number of periods, and decreases with the degree of risk
aversion of the decision maker.
","[{""version"":""v1"",""created"":""Thu, 2 Aug 2018 19:37:50 GMT""}]","2018-08-06"
"1808.01000","Jeremy Boger-Lombard","Jeremy Boger-Lombard and Ori Katz","Passive optical time-of-flight for Non line-of-sight localization","Article: 20 pages, 5 figures. Supplementary materials: 14 pages, 8
  figures",,"10.1038/s41467-019-11279-6",,"physics.optics","http://arxiv.org/licenses/nonexclusive-distrib/1.0/","  Optical imaging through diffusive, visually-opaque barriers, and around
corners is an important challenge in many fields, ranging from defense to
medical applications. Recently, novel techniques that combine time-of-flight
(TOF) measurements with computational reconstruction, have allowed breakthrough
imaging and tracking of objects hidden from view. These light detection and
ranging (LiDAR)-based approaches, however, require active short-pulsed
illumination and ultrafast time-resolved detection. Here, bringing notions from
passive RADAR and passive geophysical mapping approaches, we present an optical
TOF technique that allows to passively localize light sources and reflective
objects through diffusive barriers and around corners. Our approach retrieves
TOF information from temporal cross-correlations of scattered light, providing
temporal resolution that surpasses the state-of-the-art ultrafast detectors by
three orders of magnitude. We demonstrate passive localization of multiple
white-light sources and reflective objects hidden from view, using a simple
setup, with interesting potential for covert imaging.
","[{""version"":""v1"",""created"":""Thu, 2 Aug 2018 19:40:46 GMT""},{""version"":""v2"",""created"":""Tue, 6 Nov 2018 18:32:06 GMT""}]","2023-05-12"
"1808.01001","Chethan Kumar Anjinappa","Chethan Kumar Anjinappa and Ismail Guvenc","Millimeter-Wave V2X Channels: PropagationStatistics, Beamforming, and
  Blockage","6 Pages. To appear in VTC2018-Fall - Chicago",,,,"eess.SP","http://arxiv.org/licenses/nonexclusive-distrib/1.0/","  5G millimeter wave (mmWave) technology is envisioned to be an integral part
of next-generation vehicle-to-everything (V2X) networks and autonomous vehicles
due to its broad bandwidth, wide field of view sensing, and precise
localization capabilities. The reliability of mmWave links may be compromised
due to difficulties in beam alignment for mobile channels and due to blocking
effects between a mmWave transmitter and a receiver. In this paper, we study
the channel characteristics for mmWave and sub-6 GHz V2X communications using
ray-tracing simulations. We present results for time-varying path-loss, delay
spread, and angular spreads in the presence of a moving vehicle for
line-of-sight (LOS) and non-LOS (NLOS) trajectory, respectively. Additionally,
we study the effect of delay spread and angular spread when the base station
(BS) and user equipment (UE) are capable of adjusting the beam directions and
beamwidths dynamically. Finally, we explore the impact of blockage effects on
the quality of receive beams at 28 GHz for the considered vehicle trajectories.
","[{""version"":""v1"",""created"":""Thu, 2 Aug 2018 19:46:05 GMT""}]","2018-08-06"
