"1808.01077","Tatyana Gavrilchenko","Tatyana Gavrilchenko and Eleni Katifori","Resilience in Hierarchical Fluid Flow Networks","16 pages, 14 figures","Phys. Rev. E 99, 012321 (2019)","10.1103/PhysRevE.99.012321",,"cond-mat.dis-nn q-bio.TO","http://arxiv.org/licenses/nonexclusive-distrib/1.0/","  The structure of flow networks determines their function under normal
conditions as well as their response to perturbative damage. Brain vasculature
often experiences transient or permanent occlusions in the finest vessels, but
it is not clear how these micro-clots affect the large scale blood flow or to
what extent they decrease functionality. Motivated by this, we investigate how
flow is rerouted after the occlusion of a single edge in networks with a
hierarchy in edge conductivities. We find that in 2D networks, vessels formed
by highly conductive edges serve as barriers to contain the displacement of
flow due to a localized perturbation. In this way, the vein provides shielding
from damage to surrounding edges. We show that once the conductivity of the
vein surpasses an initial minimal value, further increasing the conductivity
can no longer extend the shielding provided by the vein. Rather, the length
scale of the shielding is set by the network topology. Upon understanding the
effects of a single vein, we investigate the global resilience of networks with
complex hierarchical order. We find that a system of veins arranged in a grid
is able to modestly increase the overall network resilience, outperforming a
parallel vein pattern.
","[{""version"":""v1"",""created"":""Fri, 3 Aug 2018 03:32:42 GMT""},{""version"":""v2"",""created"":""Mon, 4 Feb 2019 19:26:56 GMT""}]","2019-02-06"
"1808.01078","Javier P\'erez \'Alvaro","Javier P\'erez","The conditioning of block Kronecker $\ell$-ifications of matrix
  polynomials",,,,,"math.NA","http://arxiv.org/licenses/nonexclusive-distrib/1.0/","  A strong $\ell$-ification of a matrix polynomial $P(\lambda)=\sum
A_i\lambda^i$ of degree $d$ is a matrix polynomial $\mathcal{L}(\lambda)$ of
degree $\ell$ having the same finite and infinite elementary divisors, and the
same numbers of left and right minimal indices as $P(\lambda)$. Strong
$\ell$-ifications can be used to transform the polynomial eigenvalue problem
associated with $P(\lambda)$ into an equivalent polynomial eigenvalue problem
associated with a larger matrix polynomial $\mathcal{L}(\lambda)$ of lower
degree. Typically $\ell=1$ and, in this case, $\mathcal{L}(\lambda)$ receives
the name of strong linearization. However, there exist some situations, e.g.,
the preservation of algebraic structures, in which it is more convenient to
replace strong linearizations by other low degree matrix polynomials. In this
work, we investigate the eigenvalue conditioning of $\ell$-ifications from a
family of matrix polynomials recently identified and studied by Dopico, P\'erez
and Van Dooren, the so-called block Kronecker companion forms. We compare the
conditioning of these $\ell$-ifications with that of the matrix polynomial
$P(\lambda)$, and show that they are about as well conditioned as the original
polynomial, provided we scale $P(\lambda)$ so that $\max\{\|A_i\|_2\}=1$, and
the quantity $\min\{\|A_0\|_2,\|A_d\|_2\}$ is not too small. Moreover, under
the scaling assumption $\max\{\|A_i\|_2\}=1$, we show that any block Kronecker
companion form, regardless of its degree or block structure, is about as
well-conditioned as the well-known Frobenius companion forms. Our theory is
illustrated by numerical examples.
","[{""version"":""v1"",""created"":""Fri, 3 Aug 2018 03:40:45 GMT""},{""version"":""v2"",""created"":""Wed, 8 Aug 2018 23:32:50 GMT""}]","2018-08-10"
"1808.01079","Henry Adams","Henry Adams, Manuchehr Aminian, Elin Farnell, Michael Kirby, Chris
  Peterson, Joshua Mirth, Rachel Neville, Patrick Shipman, Clayton Shonkwiler","A fractal dimension for measures via persistent homology",,"In: Baas N., Carlsson G., Quick G., Szymik M., Thaule M. (eds),
  Topological Data Analysis. Abel Symposia, vol 15. Springer (2020)","10.1007/978-3-030-43408-3_1",,"math.DS math.AT math.PR","http://arxiv.org/licenses/nonexclusive-distrib/1.0/","  We use persistent homology in order to define a family of fractal dimensions,
denoted $\mathrm{dim}_{\mathrm{PH}}^i(\mu)$ for each homological dimension
$i\ge 0$, assigned to a probability measure $\mu$ on a metric space. The case
of $0$-dimensional homology ($i=0$) relates to work by Michael J Steele (1988)
studying the total length of a minimal spanning tree on a random sampling of
points. Indeed, if $\mu$ is supported on a compact subset of Euclidean space
$\mathbb{R}^m$ for $m\ge2$, then Steele's work implies that
$\mathrm{dim}_{\mathrm{PH}}^0(\mu)=m$ if the absolutely continuous part of
$\mu$ has positive mass, and otherwise $\mathrm{dim}_{\mathrm{PH}}^0(\mu)<m$.
Experiments suggest that similar results may be true for higher-dimensional
homology $0<i<m$, though this is an open question. Our fractal dimension is
defined by considering a limit, as the number of points $n$ goes to infinity,
of the total sum of the $i$-dimensional persistent homology interval lengths
for $n$ random points selected from $\mu$ in an i.i.d. fashion. To some
measures $\mu,$ we are able to assign a finer invariant, a curve measuring the
limiting distribution of persistent homology interval lengths as the number of
points goes to infinity. We prove this limiting curve exists in the case of
$0$-dimensional homology when $\mu$ is the uniform distribution over the unit
interval, and conjecture that it exists when $\mu$ is the rescaled probability
measure for a compact set in Euclidean space with positive Lebesgue measure.
","[{""version"":""v1"",""created"":""Fri, 3 Aug 2018 03:45:22 GMT""},{""version"":""v2"",""created"":""Mon, 6 Aug 2018 17:23:52 GMT""},{""version"":""v3"",""created"":""Wed, 19 Sep 2018 17:16:35 GMT""},{""version"":""v4"",""created"":""Wed, 30 Jan 2019 22:14:05 GMT""}]","2020-07-14"
"1808.01080","Anisse Ismaili","Anisse Ismaili","The Complexity of Sequential Routing Games","Submitted to WINE2018 on July 28th, 2018. Rejected (reviews included
  here). No major flaws are known. Additional (positive) results would be
  welcome",,,,"cs.GT","http://arxiv.org/licenses/nonexclusive-distrib/1.0/","  We study routing games where every agent sequentially decides her next edge
when she obtains the green light at each vertex. Because every edge only has
capacity to let out one agent per round, an edge acts as a FIFO waiting queue
that causes congestion on agents who enter. Given $n$ agents over $|V|$
vertices, we show that for one agent, approximating a winning strategy within
$n^{1-\varepsilon}$ of the optimum for any $\varepsilon>0$, or within any
polynomial of $|V|$, are PSPACE-hard. Under perfect information, computing a
subgame perfect equilibrium (SPE) is PSPACE-hard and in FPSPACE. Under
imperfect information, deciding SPE existence is PSPACE-complete.
","[{""version"":""v1"",""created"":""Fri, 3 Aug 2018 03:52:42 GMT""},{""version"":""v2"",""created"":""Fri, 26 Oct 2018 05:30:59 GMT""}]","2018-10-29"
"1808.01081","Shengli Zhang","Dongyan Huang, Xiaoli Ma, and Shengli Zhang","Performance Analysis of the Raft Consensus Algorithm for Private
  Blockchains",,,,,"cs.NI cs.DC","http://arxiv.org/licenses/nonexclusive-distrib/1.0/","  Consensus is one of the key problems in blockchains. There are many articles
analyzing the performance of threat models for blockchains. But the network
stability seems lack of attention, which in fact affects the blockchain
performance. This paper studies the performance of a well adopted consensus
algorithm, Raft, in networks with non-negligible packet loss rate. In
particular, we propose a simple but accurate analytical model to analyze the
distributed network split probability. At a given time, we explicitly present
the network split probability as a function of the network size, the packet
loss rate, and the election timeout period. To validate our analysis, we
implement a Raft simulator and the simulation results coincide with the
analytical results. With the proposed model, one can predict the network split
time and probability in theory and optimize the parameters in Raft consensus
algorithm.
","[{""version"":""v1"",""created"":""Fri, 3 Aug 2018 03:57:06 GMT""}]","2018-08-06"
"1808.01082","Michel Rached Zamboni","Michel Zamboni-Rached","A simple and analytical method for controlling the trajectory and
  multifurcation of optical beams","17 pages, 9 figures",,,,"physics.optics","http://arxiv.org/licenses/nonexclusive-distrib/1.0/","  In this paper it is developed a simple, analytical and very efficient method
capable to provide control of optical beam's intensity over an arbitrary
curvilinear (planar) trajectory. The same method also provides the possibility
of managing multifurcations of the optical beam. The results presented here can
have valuable applications in fields like optical tweezers, optical
lithography, atom optical guiding, structured light, etc..
","[{""version"":""v1"",""created"":""Fri, 3 Aug 2018 04:15:23 GMT""},{""version"":""v2"",""created"":""Mon, 13 Aug 2018 03:29:19 GMT""}]","2018-08-14"
"1808.01083","Robert Warnock","Robert Warnock and Karl Bane","Improved Numerical Method for Solution of the Ha\""issinski Equation","23 pages, 12 figures",,,,"physics.acc-ph","http://arxiv.org/licenses/nonexclusive-distrib/1.0/","  The longitudinal charge density of an electron beam in its equilibrium state
is given by the solution of the Ha\""issinski equation, which provides a
stationary solution of the Vlasov-Fokker-Planck equation. The physical input is
the longitudinal wake potential. We formulate the Ha\""issinski equation as a
nonlinear integral equation with the normalization integral stated as a
functional of the solution. This equation can be solved in a simple way by the
matrix version of Newtons's iteration, beginning with the Gaussian as a first
guess. We illustrate for several quasi-realistic wake potentials. Convergence
is extremely robust, even at currents much higher than nominal for the storage
rings considered. The method overcomes limitations of earlier procedures, and
provides the convenience of automatic normalization of the solution.
","[{""version"":""v1"",""created"":""Fri, 3 Aug 2018 04:16:51 GMT""}]","2018-08-06"
"1808.01084","Justin Krometis","Jeff Borggaard, Nathan E. Glatt-Holtz, Justin A. Krometis","A Bayesian Approach to Estimating Background Flows from a Passive Scalar","Streamlined, moved IS & MALA to appendix, and added appendix on
  fluids observables",,,,"math.NA cs.NA","http://arxiv.org/licenses/nonexclusive-distrib/1.0/","  We consider the statistical inverse problem of estimating a background flow
field (e.g., of air or water) from the partial and noisy observation of a
passive scalar (e.g., the concentration of a solute), a common experimental
approach to visualizing complex fluid flows. Here the unknown is a vector field
that is specified by a large or infinite number of degrees of freedom. Since
the inverse problem is ill-posed, i.e., there may be many or no background
flows that match a given set of observations, we adopt a Bayesian approach to
regularize it. In doing so, we leverage frameworks developed in recent years
for infinite-dimensional Bayesian inference. The contributions in this work are
threefold. First, we lay out a functional analytic and Bayesian framework for
approaching this problem. Second, we define an adjoint method for efficient
computation of the gradient of the log likelihood, a key ingredient in many
numerical methods. Finally, we identify interesting example problems that
exhibit posterior measures with simple and complex structure. We use these
examples to conduct a large-scale benchmark of Markov Chain Monte Carlo methods
developed in recent years for infinite-dimensional settings. Our results
indicate that these methods are capable of resolving complex multimodal
posteriors in high dimensions.
","[{""version"":""v1"",""created"":""Fri, 3 Aug 2018 04:41:36 GMT""},{""version"":""v2"",""created"":""Tue, 18 Sep 2018 15:30:14 GMT""},{""version"":""v3"",""created"":""Mon, 10 Jun 2019 19:08:49 GMT""}]","2019-06-12"
"1808.01085","Da Wang","Qiang Wang, Da Wang and Qiang-Hua Wang","Entanglement in a second order topological insulator on a square lattice","5 pages, 3 figures","EPL 124, 50005 (2018)","10.1209/0295-5075/124/50005",,"cond-mat.mes-hall","http://arxiv.org/licenses/nonexclusive-distrib/1.0/","  In a $d$-dimensional topological insulator of order $d$, there are zero
energy states on its corners which have close relationship with its
entanglement behaviors. We studied the bipartite entanglement spectra for
different subsystem shapes and found that only when the entanglement boundary
has corners matching the lattice, exact zero modes exist in the entanglement
spectrum corresponding to the zero energy states caused by the same physical
corners. We then considered finite size systems in which case these corner
states are coupled together by long range hybridizations to form a multipartite
entangled state. We proposed a scheme to calculate the quadripartite
entanglement entropy on the square lattice, which is well described by a
four-sites toy model and thus provides another way to identify the higher order
topological insulators from the multipartite entanglement point of view.
","[{""version"":""v1"",""created"":""Fri, 3 Aug 2018 04:47:34 GMT""}]","2019-07-04"
"1808.01086","Ritam Mallick","Ritam Mallick and Mohammad Irfan","Combustion adiabat and the maximum mass of a quark star","10 pages, 8 figures (updated according to the online published
  version)","Monthly Notices of the Royal astronomical society 00,1 (2019)","10.1093/mnras/stz454",,"astro-ph.HE","http://arxiv.org/licenses/nonexclusive-distrib/1.0/","  We solve the Combustion adiabat (CA) or the Chapman-Jouget adiabat equation
to study the phase transition (PT) of a neutron star (NS) to a quark star (QS).
The hadronic matter and quark matter equation of states are used to calculate
the matter velocities on either side of the shock front. The CA with the
hadronic matter as an input is solved to obtain the corresponding quark matter
values. The maximum of the quark pressure is reflected in the retracing of the
path in the CA curve. The downstream quark pressure maximum implies towards a
maximum mass limit of a phase transformed QS which is different from the
regular mass limit of an ordinary QS. Further, the characterization of
velocities suggest that the PT from NS to QS is not always feasible from the
center of the star. The possible mode of combustion in NSs is likely to be a
slow deflagration in most of the low and intermediate density range. The result
is crucial and emphasizes on the fact that PT in NSs does not always starts
from the center and sometimes a NS does not suffers a PT at all.
","[{""version"":""v1"",""created"":""Fri, 3 Aug 2018 04:47:54 GMT""},{""version"":""v2"",""created"":""Tue, 16 Apr 2019 06:30:57 GMT""}]","2019-04-17"
"1808.01087","Masayuki Ochi","Masayuki Ochi, Hitoshi Mori, Daichi Kato, Hidetomo Usui, and Kazuhiko
  Kuroki","Thermoelectric performance of materials with Cu$Ch_4$ ($Ch=$ S, Se)
  tetrahedra: Similarities and differences among their low-dimensional
  electronic structure from first principles","16 pages, 15 figures","Phys. Rev. Materials 2, 085401 (2018)","10.1103/PhysRevMaterials.2.085401",,"cond-mat.mtrl-sci","http://arxiv.org/licenses/nonexclusive-distrib/1.0/","  In this study, we perform a comparative theoretical study on the
thermoelectric performance of materials with Cu$Ch_4$ ($Ch=$ S, Se) tetrahedra,
including famous thermoelectric materials BiCuSeO and tetrahedrite
Cu$_{12}$Sb$_4$S$_{13}$, by means of first-principles calculations. By
comparing these electronic band structures, we find that many of these
materials possess a Cu-$t_{2g}$ band structure consisting of
quasi-one-dimensional band dispersions and the isotropic (two-dimensional for
layered compounds) band dispersion near the valence-band edge. Therefore, the
key factors for the thermoelectric performance are the anisotropy of the former
band dispersion and the degeneracy of these two kinds of band dispersions. We
also find that a large extension of the chalcogen orbitals often improves their
thermoelectric performance by improving these two factors or by going beyond
such a basic band structure through a large alternation of its shape. Such a
large extension of the chalcogen orbitals might partially originate from the
anisotropic Cu-$Ch$ bond geometry of a tetrahedron. Our study reveals
interesting similarities and differences of materials with Cu$Ch_4$, which
provides important knowledge for a future search of high-performance
thermoelectric materials.
","[{""version"":""v1"",""created"":""Fri, 3 Aug 2018 04:52:19 GMT""}]","2018-08-06"
"1808.01088","Jayanta Roy Dr.","Jayanta Roy, Jayaram N. Chengalur and Ue-Li Pen","Post-correlation beamformer for time-domain studies of pulsars and
  transients","24 pages, 9 figures, accepted for publication in The Astrophysical
  Journal",,"10.3847/1538-4357/aad815",,"astro-ph.IM astro-ph.HE","http://arxiv.org/licenses/nonexclusive-distrib/1.0/","  We present a detailed analysis of post-correlation beamforming (i.e.
beamforming which involves only phased sums of the correlation of the voltages
of different antennas in an array), and compare it with the traditionally used
incoherent and phased beamforming techniques. Using data from the GMRT we show
that post-correlation beamformation results in a many-folds increase in the
signal-to-noise for periodic signals from pulsars and several order of
magnitude reduction in the number of false triggers from single pulse events
like fast radio bursts (FRBs). This difference arises primarily because the
post-correlation beam contains less red-noise, as well as less radio frequency
interference. The post-correlation beam can also be more easily calibrated than
the incoherent or phased array beams. We also discuss two different modes of
post-correlation beamformation, viz. (1) by subtracting the incoherent beam
from the coherent beam and (2) by phased addition of the visibilities. The
computational costs for both these beamformation techniques as well as their
suitability for studies of pulsars and FRBs are discussed. Techniques discussed
here would be of interest for all upcoming surveys with interferometric arrays.
Finally, we describe a time-domain survey with the GMRT using the
post-correlation beamformation as a case study. We find that post-correlation
beamforming will improve the current GMRT time-domain survey sensitivity by ~ 2
times for pulsars with periods of few 100s of millisecond and by many-folds for
even slower pulsars, making it one of the most sensitive surveys for pulsars
and FRBs at low and mid radio frequencies.
","[{""version"":""v1"",""created"":""Fri, 3 Aug 2018 04:54:24 GMT""}]","2018-09-19"
"1808.01089","Yang Gao","Horace Zhang, Yang Gao, Chung K. Law","Magnetic reconnection detonation in supernova remnants","Accepted for publication in ApJ",,"10.3847/1538-4357/aad819",,"astro-ph.HE","http://arxiv.org/licenses/nonexclusive-distrib/1.0/","  As a key process that refreshes the interstellar medium, the dynamics and
radiative properties of the supernova remnant (SNR) expansion front not only
reflect the physical environment of the old interstellar medium (ISM)
surrounding the supernova, but they also provide information about the
refreshed ISM. However the expansion dynamics of SNRs cannot be simply
explained by the conventional law of spherical shock wave propagation; on the
other hand, the high energy radiation requires an additional electron
acceleration mechanism in the shock front beyond thermal collision. We consider
herein the detonation wave description of the SNR expansion, in which magnetic
reconnection follows the shock front and transfers the SNR magnetic field
energy to both fluid thermal energy and particle kinetic energy. The structure
of the magnetic reconnection detonation (MRD) is identified based on scaling
analysis in this paper. By applying the MRD description of the SNR expansion
shock to the example of the Crab Nebula, this paper shows that the MRD
description can explain both the accelerative expansion of the nebula as well
as the origin of the luminous expanding shell.
","[{""version"":""v1"",""created"":""Fri, 3 Aug 2018 05:10:45 GMT""}]","2018-09-19"
"1808.01090","Kiyomi Okamoto","Takashi Tonegawa, Toshiya Hikihara, Kiyomi Okamoto, Shunsuke C.
  Furuya, and T\^oru Sakai","Ground-State Phase Diagram of an Anisotropic S=1/2 Ladder with Different
  Leg Interactions",,"J. Phys. Soc. Jpn. 87, 104002 (2018)","10.7566/JPSJ.87.104002",,"cond-mat.str-el","http://creativecommons.org/licenses/by/4.0/","  We explore the ground-state phase diagram of the $S=1/2$ two-leg ladder with
different leg interactions. The $xy$ and $z$ components of the leg interactions
between nearest-neighbor spins in the $a$ ($b$) leg are respectively denoted by
$J_{{\rm l},a}$ and $\Delta_{\rm l} J_{{\rm l},a}$ ($J_{{\rm l},b}$ and
$\Delta_{\rm l} J_{{\rm l},b}$). On the other hand, the $xy$ and $z$ components
of the uniform rung interactions are respectively denoted by $\Gamma_{\rm r}
J_{{\rm r}}$ and $J_{{\rm r}}$. In the above, $\Delta_{\rm l}$ and $\Gamma_{\rm
r}$ are the $XXZ$-type anisotropy parameters for the leg and rung interactions,
respectively. This system has a frustration when $J_{{\rm l},a} J_{{\rm
l},b}<0$ irrespective of the sign of $J_{\rm r}$. The phase diagram on the
$\Delta_{\rm l}$ ($|\Delta_{\rm l}| \leq 1.0$) versus $J_{{\rm l},b}$
($-2.0\leq J_{{\rm l},b}\leq 3.0$) plane in the case where $J_{{\rm l},a}=0.2$,
$J_{{\rm r}}=-1.0$, and $\Gamma_{\rm r} = 0.5$ is determined numerically. We
employ the physical consideration, and the level spectroscopy and
phenomenological renormalization-group analyses of the numerical date obtained
by the exact diagonalization method. The resultant phase diagram contains the
ferromagnetic, Haldane, N{\'e}el, nematic Tomonaga-Luttinger liquid (TLL),
partial ferrimagnetic, and $XY1$ phases. Interestingly enough, the nematic TLL
phase appears in the strong-rung unfrustrated region as well as in the
strong-rung frustrated one. We perform the first-order perturbational
calculations from the strong rung coupling limit to elucidate the
characteristic features of the phase diagram. Furthermore, we make the
density-matrix renormalization-group calculations for some physical quantities
such as the energy gaps, the local magnetization, and the spin correlation
functions to supplement the reliability of the phase diagram.
","[{""version"":""v1"",""created"":""Fri, 3 Aug 2018 05:27:28 GMT""},{""version"":""v2"",""created"":""Fri, 14 Sep 2018 14:13:44 GMT""}]","2018-09-17"
"1808.01091","Lyndon White","Lyndon White, Roberto Togneri, Wei Liu, Mohammed Bennamoun","DataDeps.jl: Repeatable Data Setup for Replicable Data Science","Source code: https://github.com/oxinabox/DataDeps.jl/",,,,"cs.SE","http://arxiv.org/licenses/nonexclusive-distrib/1.0/","  We present DataDeps.jl: a julia package for the reproducible handling of
static datasets to enhance the repeatability of scripts used in the data and
computational sciences. It is used to automate the data setup part of running
software which accompanies a paper to replicate a result. This step is commonly
done manually, which expends time and allows for confusion. This functionality
is also useful for other packages which require data to function (e.g. a
trained machine learning based model). DataDeps.jl simplifies extending
research software by automatically managing the dependencies and makes it
easier to run another author's code, thus enhancing the reproducibility of data
science research.
","[{""version"":""v1"",""created"":""Fri, 3 Aug 2018 05:51:46 GMT""}]","2018-08-06"
"1808.01092","Chaoran Huang","Chaoran Huang, Lina Yao, Xianzhi Wang, Boualem Benatallah, Shuai
  Zhang, and Manqing Dong","Expert Recommendation via Tensor Factorization with Regularizing
  Hierarchical Topical Relationships","16th International Conference on Service Oriented Computing (ICSOC
  2018). Hanzhou, China, Nov 12 - Nov. 15, 2018",,,,"cs.IR","http://creativecommons.org/licenses/by-nc-sa/4.0/","  Knowledge acquisition and exchange are generally crucial yet costly for both
businesses and individuals, especially when the knowledge concerns various
areas. Question Answering Communities offer an opportunity for sharing
knowledge at a low cost, where communities users, many of whom are domain
experts, can potentially provide high-quality solutions to a given problem. In
this paper, we propose a framework for finding experts across multiple
collaborative networks. We employ the recent techniques of tree-guided learning
(via tensor decomposition), and matrix factorization to explore user expertise
from past voted posts. Tensor decomposition enables to leverage the latent
expertise of users, and the posts and related tags help identify the related
areas. The final result is an expertise score for every user on every knowledge
area. We experiment on Stack Exchange Networks, a set of question answering
websites on different topics with a huge group of users and posts. Experiments
show our proposed approach produces steady and premium outputs.
","[{""version"":""v1"",""created"":""Fri, 3 Aug 2018 05:55:21 GMT""},{""version"":""v2"",""created"":""Tue, 7 Aug 2018 02:10:36 GMT""}]","2018-08-08"
