"1808.00878","Hazrat Ali","Hazrat Ali, Adnan Ali Awan, Sanaullah Khan, Omer Shafique, Atiq ur
  Rahman, Shahid Khan","Supervised classification for object identification in urban areas using
  satellite imagery","2018 International Conference on Computing, Mathematics and
  Engineering Technologies (iCoMET)","H. Ali et al., 2018 International Conference on Computing,
  Mathematics and Engineering Technologies (iCoMET), Sukkur, 2018, pp. 1-4","10.1109/ICOMET.2018.8346383",,"cs.LG cs.CV eess.SP stat.ML","http://creativecommons.org/licenses/by-nc-sa/4.0/","  This paper presents a useful method to achieve classification in satellite
imagery. The approach is based on pixel level study employing various features
such as correlation, homogeneity, energy and contrast. In this study gray-scale
images are used for training the classification model. For supervised
classification, two classification techniques are employed namely the Support
Vector Machine (SVM) and the Naive Bayes. With textural features used for
gray-scale images, Naive Bayes performs better with an overall accuracy of 76%
compared to 68% achieved by SVM. The computational time is evaluated while
performing the experiment with two different window sizes i.e., 50x50 and
70x70. The required computational time on a single image is found to be 27
seconds for a window size of 70x70 and 45 seconds for a window size of 50x50.
","[{""version"":""v1"",""created"":""Thu, 2 Aug 2018 16:00:32 GMT""}]","2018-08-03"
"1808.00879","Jennifer Berg","Jennifer Berg, Anthony V\'arilly-Alvarado","Odd order obstructions to the Hasse principle on general K3 surfaces","22 pages; Magma scripts included as ancillary files in the arXiv
  distribution",,,,"math.AG math.NT","http://arxiv.org/licenses/nonexclusive-distrib/1.0/","  We show that odd order transcendental elements of the Brauer group of a K3
surface can obstruct the Hasse principle. We exhibit a general K3 surface $Y$
of degree 2 over $\mathbb{Q}$ together with a three torsion Brauer class
$\alpha$ that is unramified at all primes except for 3, but ramifies at all
3-adic points of $Y$. Motivated by Hodge theory, the pair $(Y, \alpha)$ is
constructed from a cubic fourfold $X$ of discriminant 18 birational to a
fibration into sextic del Pezzo surfaces over the projective plane. Notably,
our construction does not rely on the presence of a central simple algebra
representative for $\alpha$. Instead, we prove that a sufficient condition for
such a Brauer class to obstruct the Hasse principle is insolubility of the
fourfold $X$ (and hence the fibers) over $\mathbb{Q}_3$ and local solubility at
all other primes.
","[{""version"":""v1"",""created"":""Thu, 2 Aug 2018 16:01:57 GMT""}]","2018-08-03"
"1808.00880","Luca Ciotti","L. Ciotti (1), S. Pellegrini (1) (1 University of Bologna)","Fully analytical solutions for Bondi accretion in galaxies with a
  central Black Hole","4 pages, 4 figures; proceedings of the IAUS342 ""Perseus in Sicily:
  from black hole to cluster outskirts""",,,,"astro-ph.HE astro-ph.GA","http://arxiv.org/licenses/nonexclusive-distrib/1.0/","  The fully analytical solution for isothermal Bondi accretion on a black hole
(MBH) at the center of JJ two-component Jaffe (1983) galaxy models is
presented. In JJ models the stellar and total mass density distributions are
described by the Jaffe profile, with different scale-lengths and masses, and to
which a central MBH is added; all the relevant stellar dynamical properties can
also be derived analytically. In these new accretion solutions the
hydrodynamical and stellar dynamical properties are linked by imposing that the
gas temperature is proportional to the virial temperature of the stellar
component. The formulae that are provided allow to evaluate all flow
properties, and are then useful for estimates of the accretion radius and the
mass flow rate when modeling accretion on MBHs at the center of galaxies.
","[{""version"":""v1"",""created"":""Thu, 2 Aug 2018 16:03:50 GMT""}]","2018-08-03"
"1808.00881","Daniel Elton","Daniel C. Elton","Stretched Exponential Relaxation",,,,,"cond-mat.dis-nn","http://creativecommons.org/licenses/by/4.0/","  This short report details the mathematical properties of the stretched
exponential function and some of its applications in materials science. G(tau)
distributions for different values of the stretching parameter beta are
provided.
","[{""version"":""v1"",""created"":""Thu, 2 Aug 2018 16:12:47 GMT""}]","2018-08-03"
"1808.00882","Jacques C. R. Bloch","Jacques Bloch","Anatomy of a strong residual sign problem on the thimbles","8 pages, 8 figures","Phys. Rev. D 98, 114502 (2018)","10.1103/PhysRevD.98.114502",,"hep-lat","http://arxiv.org/licenses/nonexclusive-distrib/1.0/","  Using a simple Gaussian-like Ansatz for the phase distribution of a theory
with a complex action, we show how the thimble integration for the average
phase factor can be plagued by a strong residual sign problem when the phase of
the complex integration measure conspires with the constant phase of the
integrand along the thimble. This strong sign problem prohibits the accurate
computation of the average phase factor when it becomes exponentially small,
and causes a strong sensitivity to the parameters describing the phase
distribution.
","[{""version"":""v1"",""created"":""Thu, 2 Aug 2018 16:13:38 GMT""}]","2018-12-12"
"1808.00883","Mohanad Hamid","Mohanad Farhan Hamid","On (co)pure Baer injective modules","6 pages",,,,"math.RA","http://arxiv.org/licenses/nonexclusive-distrib/1.0/","  For a given class of R-modules Q, a module M is called Q-copure Baer
injective if any map from a Q-copure left ideal of R into M can be extended to
a map from R into M. Depending on the class Q, this concept is both a
dualization and a generalization of pure Baer injectivity. We show that every
module can be embedded as Q-copure submodule of a Q-copure Baer injective
module. Certain types of rings are characterized using properties of Q-copure
Baer injective modules. For example a ring R is Q-coregular if and only if
every Q-copure Baer injective R-module is injective.
","[{""version"":""v1"",""created"":""Thu, 2 Aug 2018 16:19:12 GMT""}]","2018-08-03"
"1808.00884","Graeme J. Ackland","Graeme J.Ackland, Jack Binns, Ross Howie and Miguel Martinez-Canales","The Icosahedral (H$_2)_{13}$ Supermolecule",,"Phys. Rev. Materials 2, 093601, (2018)","10.1103/PhysRevMaterials.2.093601",,"cond-mat.mtrl-sci","http://arxiv.org/licenses/nonexclusive-distrib/1.0/","  We investigate a range of possible materials containing the supermolecular
form of hydrogen comprising 13 hydrogen molecules arranged in an icosahedral
arrangement. This supermolecule consists of freely rotating 12 hydrogen
molecules in an icosahedral arrangement, enclosing another freely rotating
molecule. To date, this supermolecule has only been observed in a compound with
Iodane (HI). The extremely high hydrogen content suggests possible application
in hydrogen storage so we examine the possibility of supermolecule formation at
ambient pressures. We show that ab initio molecular dynamics calculations give
a good description of the known properties of the HI(H2)13 material, and make
predictions of the existence of related compounds Xe(H2)1, HBr(H2)13 and
HCl(H2)13, including a symmetry-breaking phase transition at low temperature.
The icosahedral (H2)13 supermolecule, remains stable in all these compounds.
This suggests (H2)13 is a widespread feature in hydrogen compounds, and that
appropriately-sized cavities could hold hydrogen supermolecules even at low
pressure. The structure of the supermolecule network is shown to be independent
of the compound at equivalent density.
","[{""version"":""v1"",""created"":""Thu, 2 Aug 2018 16:20:08 GMT""}]","2019-05-10"
"1808.00885","Weiyi Zhang","Haojie Chen, Weiyi Zhang","Kodaira dimensions of almost complex manifolds I","35 pages, 1 appendix. The original submission is split into two
  parts. New results added, presentation improved",,,,"math.DG math.AG math.CV math.SG","http://arxiv.org/licenses/nonexclusive-distrib/1.0/","  This is the first of a series of papers, in which we study the plurigenera,
the Kodaira dimension and more generally the Iitaka dimension on compact almost
complex manifolds.
  Based on the Hodge theory on almost complex manifolds, we introduce the
plurigenera, Kodaira dimension and Iitaka dimension on compact almost complex
manifolds. We show that the plurigenera and the Kodaira dimension as well as
the irregularity are birational invariants in almost complex category, at least
in dimension $4$, where a birational morphism is defined to be a degree one
pseudoholomorphic map. However, they are no longer deformation invariants, even
in dimension $4$ or under tameness assumption. On the way to establish the
birational invariance, we prove the Hartogs extension theorem in the almost
complex setting by the foliation-by-disks technique.
  Some interesting phenomena of these invariants are shown through examples. In
particular, we construct non-integrable compact almost complex manifolds with
large Kodaira dimensions. Hodge numbers and plurigenera are computed for the
standard almost complex structure on the six sphere $S^6$, which are different
from the data of a hypothetical complex structure.
","[{""version"":""v1"",""created"":""Thu, 2 Aug 2018 16:20:35 GMT""},{""version"":""v2"",""created"":""Mon, 27 Apr 2020 13:58:27 GMT""}]","2020-04-28"
"1808.00886","Wenlong Wang","Wenlong Wang, Mats Wallin and Jack Lidmar","Chaotic temperature and bond dependence of four-dimensional Gaussian
  spin glasses with partial thermal boundary conditions","12 pages, 8 figures and 2 tables","Phys. Rev. E 98, 062122 (2018)","10.1103/PhysRevE.98.062122",,"cond-mat.dis-nn","http://arxiv.org/licenses/nonexclusive-distrib/1.0/","  Spin glasses have competing interactions and complex energy landscapes that
are highly-susceptible to perturbations, such as the temperature or the bonds.
The thermal boundary condition technique is an effective and visual approach
for characterizing chaos, and has been successfully applied to three
dimensions. In this paper, we tailor the technique to partial thermal boundary
conditions, where thermal boundary condition is applied in a subset (3 out of 4
in this work) of the dimensions for better flexibility and efficiency for a
broad range of disordered systems. We use this method to study both temperature
chaos and bond chaos of the four-dimensional Edwards-Anderson model with
Gaussian disorder to low temperatures. We compare the two forms of chaos, with
chaos of three dimensions, and also the four-dimensional $\pm J$ model. We
observe that the two forms of chaos are characterized by the same set of
scaling exponents, bond chaos is much stronger than temperature chaos, and the
exponents are also compatible with the $\pm J$ model. Finally, we discuss the
effects of chaos on the number of pure states in the thermal boundary condition
ensemble.
","[{""version"":""v1"",""created"":""Thu, 2 Aug 2018 16:21:55 GMT""},{""version"":""v2"",""created"":""Fri, 3 Aug 2018 10:59:50 GMT""},{""version"":""v3"",""created"":""Mon, 17 Dec 2018 13:02:46 GMT""}]","2018-12-26"
"1808.00887","Silvano Simula","D. Giusti, F. Sanfilippo, S. Simula","The light-quark contribution to the leading HVP term of the muon $g - 2$
  from twisted-mass fermions","34 pages, 20 figures, 7 tables. Version to appear in PRD","Phys. Rev. D 98, 114504 (2018)","10.1103/PhysRevD.98.114504",,"hep-lat hep-ex hep-ph","http://arxiv.org/licenses/nonexclusive-distrib/1.0/","  We present a lattice calculation of the leading Hadronic Vacuum Polarization
(HVP) contribution of the light u- and d-quarks to the anomalous magnetic
moment of the muon, $a_\mu^{\rm HVP}(ud)$, adopting the gauge configurations
generated by the European Twisted Mass Collaboration with $N_f = 2+1+1$
dynamical quarks at three values of the lattice spacing with pion masses in the
range 210 - 450 MeV. Thanks to several lattices at fixed values of the
light-quark mass and scale but with different sizes we perform a careful
investigation of finite-volume effects (FVEs). In order to remove FVEs we
develop an analytic representation of the vector correlator, which describes
the lattice data for time distances larger than $\simeq 0.2$ fm. The
representation is based on quark-hadron duality at small and intermediate time
distances and on the two-pion contributions in a finite box at larger time
distances. After extrapolation to the physical pion point and to the continuum
limit we obtain $a_\mu^{\rm HVP}(ud) = 619.0~(17.8) \cdot 10^{-10}$. Adding the
contribution of strange and charm quarks, obtained by ETMC, and an estimate of
the isospin-breaking corrections and quark-disconnected diagrams from the
literature we get $a_\mu^{\rm HVP}(udsc) = 683~(19) \cdot 10^{-10}$, which is
consistent with recent results based on dispersive analyses of the experimental
cross section data for $e^+ e^-$ annihilation into hadrons. Using our analytic
representation of the vector correlator, taken at the physical pion mass in the
continuum and infinite volume limits, we provide the first eleven moments of
the polarization function and we compare them with recent results of the
dispersive analysis of the $\pi^+ \pi^-$ channels. We estimate also the
light-quark contribution to the missing part of $a_\mu^{\rm HVP}$ not covered
in the MUonE experiment.
","[{""version"":""v1"",""created"":""Thu, 2 Aug 2018 16:22:33 GMT""},{""version"":""v2"",""created"":""Mon, 8 Oct 2018 16:55:43 GMT""},{""version"":""v3"",""created"":""Thu, 6 Dec 2018 11:10:19 GMT""}]","2018-12-19"
"1808.00889","Michele Collodo","Michele C. Collodo, Anton Poto\v{c}nik, Simone Gasparinetti,
  Jean-Claude Besse, Marek Pechal, Mahdi Sameti, Michael J. Hartmann, Andreas
  Wallraff, and Christopher Eichler","Observation of the Crossover from Photon Ordering to Delocalization in
  Tunably Coupled Resonators",,"Phys. Rev. Lett. 122, 183601 (2019)","10.1103/PhysRevLett.122.183601",,"quant-ph","http://arxiv.org/licenses/nonexclusive-distrib/1.0/","  Networks of nonlinear resonators offer intriguing perspectives as quantum
simulators for non-equilibrium many-body phases of driven-dissipative systems.
Here, we employ photon correlation measurements to study the radiation fields
emitted from a system of two superconducting resonators, coupled nonlinearly by
a superconducting quantum interference device (SQUID). We apply a
parametrically modulated magnetic flux to control the linear photon hopping
rate between the two resonators and its ratio with the cross-Kerr rate. When
increasing the hopping rate, we observe a crossover from an ordered to a
delocalized state of photons. The presented coupling scheme is intrinsically
robust to frequency disorder and may therefore prove useful for realizing
larger-scale resonator arrays.
","[{""version"":""v1"",""created"":""Thu, 2 Aug 2018 16:27:20 GMT""}]","2019-05-15"
"1808.00892","Hirokazu Kameoka","Hirokazu Kameoka, Li Li, Shota Inoue, Shoji Makino","Semi-blind source separation with multichannel variational autoencoder",,,,,"stat.ML cs.LG","http://arxiv.org/licenses/nonexclusive-distrib/1.0/","  This paper proposes a multichannel source separation technique called the
multichannel variational autoencoder (MVAE) method, which uses a conditional
VAE (CVAE) to model and estimate the power spectrograms of the sources in a
mixture. By training the CVAE using the spectrograms of training examples with
source-class labels, we can use the trained decoder distribution as a universal
generative model capable of generating spectrograms conditioned on a specified
class label. By treating the latent space variables and the class label as the
unknown parameters of this generative model, we can develop a
convergence-guaranteed semi-blind source separation algorithm that consists of
iteratively estimating the power spectrograms of the underlying sources as well
as the separation matrices. In experimental evaluations, our MVAE produced
better separation performance than a baseline method.
","[{""version"":""v1"",""created"":""Thu, 2 Aug 2018 16:30:51 GMT""},{""version"":""v2"",""created"":""Fri, 3 Aug 2018 23:04:04 GMT""},{""version"":""v3"",""created"":""Sun, 26 Aug 2018 07:29:03 GMT""}]","2018-08-28"
"1808.00894","Zhuohan Li","Zhuohan Li, Lars Pastewka, Izabela Szlufarska","Chemical aging of large-scale randomly rough frictional contacts","19 pages, 6 figures, 1 table","Physical Review E, 98, 023001 (2018)","10.1103/PhysRevE.98.023001",,"cond-mat.mtrl-sci","http://arxiv.org/licenses/nonexclusive-distrib/1.0/","  It has been shown that contact aging due to chemical reactions in single
asperity contacts can have a significant effect on friction. However, it is
currently unknown how chemically-induced contact aging of friction depends on
roughness that is typically encountered in macroscopic rough contacts. Here, we
develop an approach that brings together a kinetic Monte Carlo model of
chemical aging with a contact mechanics model of rough surfaces based on the
boundary element method to determine the magnitude of chemical aging in
silica/silica contacts with random roughness. Our multi-scale model predicts
that chemical aging for randomly rough contacts has a logarithmic dependence on
time. It also shows that friction aging switches from a linear to a non-linear
dependence on the applied load as the load increase. We discover that surface
roughness affects the aging behavior primarily by modifying the real contact
area and the local contact pressure, whereas the effect of contact morphology
is relatively small. Our results demonstrate how understanding of chemical
aging can be translated from studies of single asperity contacts to macroscopic
rough contacts.
","[{""version"":""v1"",""created"":""Thu, 2 Aug 2018 16:31:08 GMT""}]","2018-08-03"
"1808.00896","Christian W\""ulker","Denis-Michael Lux, Christian W\""ulker, Gregory S. Chirikjian","Parallelization of the FFT on SO(3)",,,,,"cs.DC","http://arxiv.org/licenses/nonexclusive-distrib/1.0/","  In this paper, a work-optimal parallelization of Kostelec and Rockmore's
well-known fast Fourier transform and its inverse on the three-dimensional
rotation group SO(3) is designed, implemented, and tested. To this end, the
sequential algorithms are reviewed briefly first. In the subsequent design and
implementation of the parallel algorithms, we use the well-known Forster (PCAM)
method and the OpenMP standard. The parallelization itself is based on
symmetries of the underlying basis functions and a geometric approach in which
the resulting index range is transformed in such a way that distinct work
packages can be distributed efficiently to the computation nodes. The benefit
of the parallel algorithms in practice is demonstrated in a speedup- and
efficiency-assessing benchmark test on a system with 64 cores. Here, for the
first time, we present positive results for the full transforms for the both
accuracy- and memory-critical bandwidth 512. Using all 64 available cores, the
speedup for the largest considered bandwidths 128, 256, and 512 amounted to
29.57, 36.86, and 34.36 in the forward, and 24.57, 26.69, and 24.25 in the
inverse transform, respectively.
","[{""version"":""v1"",""created"":""Thu, 2 Aug 2018 16:32:36 GMT""}]","2018-08-03"
"1808.00897","Changqian Yu","Changqian Yu, Jingbo Wang, Chao Peng, Changxin Gao, Gang Yu, Nong Sang","BiSeNet: Bilateral Segmentation Network for Real-time Semantic
  Segmentation","Accepted to ECCV 2018. 17 pages, 4 figures, 9 tables",,,,"cs.CV","http://arxiv.org/licenses/nonexclusive-distrib/1.0/","  Semantic segmentation requires both rich spatial information and sizeable
receptive field. However, modern approaches usually compromise spatial
resolution to achieve real-time inference speed, which leads to poor
performance. In this paper, we address this dilemma with a novel Bilateral
Segmentation Network (BiSeNet). We first design a Spatial Path with a small
stride to preserve the spatial information and generate high-resolution
features. Meanwhile, a Context Path with a fast downsampling strategy is
employed to obtain sufficient receptive field. On top of the two paths, we
introduce a new Feature Fusion Module to combine features efficiently. The
proposed architecture makes a right balance between the speed and segmentation
performance on Cityscapes, CamVid, and COCO-Stuff datasets. Specifically, for a
2048x1024 input, we achieve 68.4% Mean IOU on the Cityscapes test dataset with
speed of 105 FPS on one NVIDIA Titan XP card, which is significantly faster
than the existing methods with comparable performance.
","[{""version"":""v1"",""created"":""Thu, 2 Aug 2018 16:34:01 GMT""}]","2018-08-03"
"1808.00899","Mayuri Devee","Mayuri Devee","Shadowing corrections to the evolution of singlet structure function","20 pages, 19 figures",,,,"hep-ph","http://arxiv.org/licenses/nonexclusive-distrib/1.0/","  We report a semi-analytical approach for the solution of the nonlinear
Gribov-Levin-Ryskin-Mueller-Qiu (GLR-MQ) evolution equation for sea quark
distribution and investigate the effect of gluon shadowing on the small-x and
moderate-Q^2 behaviour of singlet structure function, F_2^S(x,Q^2). The
predicted values of singlet structure functions with shadowing corrections are
comparable with different experimental data as well as parametrizations. It is
very fascinating to observe signatures of gluon recombination in our
predictions. We note that, with decreasing x the the rapid growth of singlet
structure function is eventually tamed by the shadowing or nonlinear term
appeared in the QCD evolution due to gluon recombination. This taming behaviour
of shadowing singlet structure function towards small-x become significant at
the hot spots, at R=2 GeV^{-1}. Further the computed values of the ratio of
{F_2^S(x,Q^2)} with shadowing to that without shadowing clearly indicate that
towards smaller values of x and Q^2 the nonlinear effects play an increasingly
important role.
","[{""version"":""v1"",""created"":""Thu, 2 Aug 2018 16:38:50 GMT""},{""version"":""v2"",""created"":""Wed, 8 Aug 2018 15:54:30 GMT""}]","2018-08-09"
"1808.00900","Zhijie Xu","Zhijie Xu, Paul Meakin, Alexandre Tartakovsky","A diffuse-interface model for smoothed particle hydrodynamics",,"Phys. Rev. E 79, 036702, 2009","10.1103/PhysRevE.79.036702",,"physics.comp-ph physics.flu-dyn","http://arxiv.org/licenses/nonexclusive-distrib/1.0/","  Diffuse-interface theory provides a foundation for the modeling and
simulation of microstructure evolution in a very wide range of materials, and
for the tracking/capturing of dynamic interfaces between different materials on
larger scales. Smoothed particle hydrodynamics (SPH) is also widely used to
simulate fluids and solids that are subjected to large deformations and have
complex dynamic boundaries and/or interfaces, but no explicit interface
tracking/capturing is required, even when topological changes such as
fragmentation and coalescence occur, because of its Lagrangian particle nature.
Here we developed an SPH model for single-component two-phase fluids that is
based on diffuse-interface theory. In the model, the interface has a finite
thickness and a surface tension that depend on the coefficient, k, of the
gradient contribution to the Helmholtz free energy functional and the density
dependent homogeneous free energy. In this model, there is no need to locate
the surface (or interface) or to compute the curvature at and near the
interface. One- and two-dimensional SPH simulations were used to validate the
model.
","[{""version"":""v1"",""created"":""Thu, 2 Aug 2018 16:41:48 GMT""}]","2018-08-03"
"1808.00902","Javier Duarte","Javier Duarte","Fast Reconstruction and Data Scouting","8 pages, 5 figures; submitted to proceedings of Connecting the Dots
  2018",,,"FERMILAB-CONF-18-370-CMS-E-PPD","hep-ex","http://creativecommons.org/licenses/by/4.0/","  Data scouting, introduced by CMS in 2011, is the use of specialized data
streams based on reduced event content, enabling LHC experiments to record
unprecedented numbers of proton-proton collision events that would otherwise be
rejected by the usual filters. These streams were created to maintain
sensitivity to new light resonances decaying to jets or muons, while requiring
minimal online and offline resources, and taking advantage of the fast and
accurate online reconstruction algorithms of the high-level trigger. The
viability of this technique was demonstrated by CMS in 2012, when 18.8
fb$^{-1}$ of collision data at $\sqrt{s} = 8$ TeV were collected and analyzed.
For LHC Run 2, CMS, ATLAS, and LHCb implemented or expanded similar
reduced-content data streams, promoting the concept to an essential and
flexible discovery tool for the LHC.
","[{""version"":""v1"",""created"":""Thu, 2 Aug 2018 16:44:45 GMT""}]","2018-08-03"
