"1808.10020","Kiersten Ruisard","Kiersten Ruisard","Design of a nonlinear quasi-integrable lattice for resonance suppression
  at the University of Maryland Electron Ring","PhD Dissertation from University of Maryland",,,"umd18927","physics.acc-ph","http://arxiv.org/licenses/nonexclusive-distrib/1.0/","  Conventional particle accelerators use linear focusing forces for transverse
confinement. As a consequence of linearity, accelerating rings are sensitive to
myriad resonances and instabilities. At high beam intensity, uncontrolled
resonance-driven losses can deteriorate beam quality and cause damage or
radio-activation in beam line components and surrounding areas. This is
currently a major limitation of achievable current densities in
state-of-the-art accelerators. Incorporating nonlinear focusing forces into
machine design should provide immunity to resonances through nonlinear detuning
of particle orbits from driving terms. A theory of nonlinear integrable beam
optics is currently being investigated for use in accelerator rings. Such a
system has potential to overcome the limits on achievable beam intensity.
  This dissertation presents a plan for implementing a proof-of-principle
quasi-integrable octupole lattice at the University of Maryland Electron Ring
(UMER). UMER is an accelerator platform that supports the study of
high-intensity beam dynamics. In this dissertation, two designs are presented
that differ in both complexity and strength of predicted effects. A
configuration with a single, relatively long octupole magnet is expected to be
more stabilizing than an arrangement of many short, distributed octupoles.
  Preparation for this experiment required the development and characterization
of a low-intensity regime previously not operated at UMER. Additionally,
required tolerances for the control of first and second order beam moments in
the proposed experiments have been determined on the basis of simulated beam
dynamics. In order to achieve these tolerances, a new method for improved orbit
correction is developed. Finally, a study of resonance-driven losses in the
linear UMER lattice is discussed.
","[{""version"":""v1"",""created"":""Wed, 29 Aug 2018 19:40:03 GMT""}]","2018-08-31"
"1808.10021","Jukka-Pekka Humaloja","Stevan Dubljevic and Jukka-Pekka Humaloja","Model Predictive Control for Regular Linear Systems","19 pages, 4 figures",,,,"math.OC","http://arxiv.org/licenses/nonexclusive-distrib/1.0/","  The present work extends known finite-dimensional constrained optimal control
realizations to the realm of well-posed regular linear infinite-dimensional
systems modelled by partial differential equations. The structure-preserving
Cayley-Tustin transformation is utilized to approximate the continuous-time
system by a discrete-time model representation without using any spatial
discretization or model reduction. The discrete-time model is utilized in the
design of model predictive controller accounting for optimality, stabilization,
and input and output/state constraints in an explicit way. The proposed model
predictive controller is dual-mode in the sense that predictive controller
steers the state to a set where exponentially stabilizing unconstrained
feedback can be utilized without violating the constraints. The construction of
the model predictive controller leads to a finite-dimensional constrained
quadratic optimization problem easily solvable by standard numerical methods.
Two representative examples of partial differential equations are considered.
","[{""version"":""v1"",""created"":""Wed, 29 Aug 2018 19:46:15 GMT""},{""version"":""v2"",""created"":""Wed, 20 May 2020 14:24:11 GMT""}]","2020-05-21"
"1808.10022","Ian Frankel","Ian Frankel","CAT(-1)-Type Properties for Teichm\""uller Space","Reference added",,,,"math.GT","http://arxiv.org/licenses/nonexclusive-distrib/1.0/","  We show that if Teichm\""uller geodesics spend enough time in the thick part
of moduli space, they display CAT(-1)-type properties. In particular, they
exponentially contract along strongly stable leaves. As an application we prove
two closing lemmas.
","[{""version"":""v1"",""created"":""Wed, 29 Aug 2018 19:57:08 GMT""},{""version"":""v2"",""created"":""Tue, 4 Sep 2018 17:22:31 GMT""}]","2018-09-05"
"1808.10023","Hue Sun Chan","Suman Das, Alan Amin, Yi-Hsuan Lin and Hue Sun Chan","Coarse-Grained Residue-Based Models of Disordered Protein Condensates:
  Utility and Limitations of Simple Charge Pattern Parameters","44 pages, 14 figures, 2 tables, accepted for publication in Physical
  Chemistry Chemical Physics (PCCP)","Physical Chemistry Chemical Physics (PCCP) Vol.20, pp.28558-28574
  (2018)","10.1039/C8CP05095C",,"q-bio.BM cond-mat.soft","http://arxiv.org/licenses/nonexclusive-distrib/1.0/","  Biomolecular condensates undergirded by phase separations of proteins and
nucleic acids serve crucial biological functions. To gain physical insights
into their genetic basis, we study how liquid-liquid phase separation (LLPS) of
intrinsically disordered proteins (IDPs) depends on their sequence charge
patterns using a continuum Langevin chain model wherein each amino acid residue
is represented by a single bead. Charge patterns are characterized by the
`blockiness' measure $\kappa$ and the `sequence charge decoration' (SCD)
parameter. Consistent with random phase approximation (RPA) theory and lattice
simulations, LLPS propensity as characterized by critical temperature $T^*_{\rm
cr}$ increases with increasingly negative SCD for a set of sequences showing a
positive correlation between $\kappa$ and $-$SCD. Relative to RPA, the
simulated sequence-dependent variation in $T^*_{\rm cr}$ is often---though not
always---smaller, whereas the simulated critical volume fractions are higher.
However, for a set of sequences exhibiting an anti-correlation between $\kappa$
and $-$SCD, the simulated $T^*_{\rm cr}$'s are quite insensitive to either
parameters. Additionally, we find that blocky sequences that allow for strong
electrostatic repulsion can lead to coexistence curves with upward concavity as
stipulated by RPA, but the LLPS propensity of a strictly alternating charge
sequence was likely overestimated by RPA and lattice models because interchain
stabilization of this sequence requires spatial alignments that are difficult
to achieve in real space. These results help delineate the utility and
limitations of the charge pattern parameters and of RPA, pointing to further
efforts necessary for rationalizing the newly observed subtleties.
","[{""version"":""v1"",""created"":""Wed, 29 Aug 2018 19:59:07 GMT""},{""version"":""v2"",""created"":""Tue, 30 Oct 2018 02:11:49 GMT""}]","2018-12-03"
"1808.10024","Shijie Wu","Shijie Wu, Pamela Shapiro, Ryan Cotterell","Hard Non-Monotonic Attention for Character-Level Transduction","Published in EMNLP 2018",,,,"cs.CL","http://arxiv.org/licenses/nonexclusive-distrib/1.0/","  Character-level string-to-string transduction is an important component of
various NLP tasks. The goal is to map an input string to an output string,
where the strings may be of different lengths and have characters taken from
different alphabets. Recent approaches have used sequence-to-sequence models
with an attention mechanism to learn which parts of the input string the model
should focus on during the generation of the output string. Both soft attention
and hard monotonic attention have been used, but hard non-monotonic attention
has only been used in other sequence modeling tasks such as image captioning
and has required a stochastic approximation to compute the gradient. In this
work, we introduce an exact, polynomial-time algorithm for marginalizing over
the exponential number of non-monotonic alignments between two strings, showing
that hard attention models can be viewed as neural reparameterizations of the
classical IBM Model 1. We compare soft and hard non-monotonic attention
experimentally and find that the exact algorithm significantly improves
performance over the stochastic approximation and outperforms soft attention.
","[{""version"":""v1"",""created"":""Wed, 29 Aug 2018 20:00:20 GMT""},{""version"":""v2"",""created"":""Wed, 8 Jan 2020 23:59:49 GMT""}]","2020-01-10"
"1808.10025","Shirley Anugrah Hayati","Shirley Anugrah Hayati, Raphael Olivier, Pravalika Avvaru, Pengcheng
  Yin, Anthony Tomasic, Graham Neubig","Retrieval-Based Neural Code Generation","This paper is accepted in EMNLP 2018. It has 6 pages",,,,"cs.CL","http://arxiv.org/licenses/nonexclusive-distrib/1.0/","  In models to generate program source code from natural language, representing
this code in a tree structure has been a common approach. However, existing
methods often fail to generate complex code correctly due to a lack of ability
to memorize large and complex structures. We introduce ReCode, a method based
on subtree retrieval that makes it possible to explicitly reference existing
code examples within a neural code generation model. First, we retrieve
sentences that are similar to input sentences using a dynamic-programming-based
sentence similarity scoring method. Next, we extract n-grams of action
sequences that build the associated abstract syntax tree. Finally, we increase
the probability of actions that cause the retrieved n-gram action subtree to be
in the predicted code. We show that our approach improves the performance on
two code generation tasks by up to +2.6 BLEU.
","[{""version"":""v1"",""created"":""Wed, 29 Aug 2018 20:01:21 GMT""}]","2018-08-31"
"1808.10026","Andr\'es Felipe L\'opez-Lopera","Andr\'es F. L\'opez-Lopera, Nicolas Durrande and Mauricio A. Alvarez","Physically-Inspired Gaussian Process Models for Post-Transcriptional
  Regulation in Drosophila",,,"10.1109/TCBB.2019.2918774",,"stat.ML cs.LG stat.AP","http://arxiv.org/licenses/nonexclusive-distrib/1.0/","  The regulatory process of Drosophila is thoroughly studied for understanding
a great variety of biological principles. While pattern-forming gene networks
are analysed in the transcription step, post-transcriptional events (e.g.
translation, protein processing) play an important role in establishing protein
expression patterns and levels. Since the post-transcriptional regulation of
Drosophila depends on spatiotemporal interactions between mRNAs and gap
proteins, proper physically-inspired stochastic models are required to study
the link between both quantities. Previous research attempts have shown that
using Gaussian processes (GPs) and differential equations lead to promising
predictions when analysing regulatory networks. Here we aim at further
investigating two types of physically-inspired GP models based on a
reaction-diffusion equation where the main difference lies in where the prior
is placed. While one of them has been studied previously using protein data
only, the other is novel and yields a simple approach requiring only the
differentiation of kernel functions. In contrast to other stochastic
frameworks, discretising the spatial space is not required here. Both GP models
are tested under different conditions depending on the availability of gap gene
mRNA expression data. Finally, their performances are assessed on a
high-resolution dataset describing the blastoderm stage of the early embryo of
Drosophila melanogaster
","[{""version"":""v1"",""created"":""Wed, 29 Aug 2018 20:02:41 GMT""},{""version"":""v2"",""created"":""Sat, 6 Apr 2019 07:49:26 GMT""},{""version"":""v3"",""created"":""Tue, 21 May 2019 07:29:15 GMT""}]","2021-11-04"
"1808.10027","Pratik Rathore","Pratik Rathore","There are no Cube-free Descartes Numbers with Exactly Seven Distinct
  Prime Factors","8 pages",,,,"math.NT","http://arxiv.org/licenses/nonexclusive-distrib/1.0/","  We call an odd positive integer $n$ a $\textit{Descartes number}$ if there
exist positive integers $k,m$ such that $n = km$ and
  \begin{equation} \sigma(k)(m+1) = 2km \end{equation}
  Currently, $\mathcal{D} = 3^{2}7^{2}11^{2}13^{2}22021$ is the only known
Descartes number. In $2008$, Banks et al. proved that $\mathcal{D}$ is the only
cube-free Descartes number with fewer than seven distinct prime factors. In the
present paper, we extend the methods of Banks et al. to show that there is no
cube-free Descartes number with seven distinct prime factors.
","[{""version"":""v1"",""created"":""Wed, 29 Aug 2018 20:07:13 GMT""}]","2018-08-31"
"1808.10028","Benjamin Zitzer J","VERITAS Collaboration: A. Archer (7), W. Benbow (2), R. Bird (3), R.
  Brose (4 and 5), M. Buchovecky (3), J. H. Buckley (1), V. Bugaev (1), M. P.
  Connolly (6), W. Cui (7,8), Q. Feng (9), J. P. Finley (7), L. Fortson (10),
  A. Furniss (11), G. Gillanders (6) M. H\""utten (5), D. Hanna (9), O. Hervet
  (12), J. Holder (13), G. Hughes (2), T. B. Humensky (14), C. A. Johnson (12),
  P. Kaaret (15), P. Kar (16), N. Kelley-Hoskins (5), M. Kertzman (17), D.
  Kieda (16), M. Krause (5), F. Krennrich (18), S. Kumar (13), M. J. Lang (6),
  T. T.Y. Lin (9), G. Maier (5), S. McArthur (7), P. Moriarty (6), R. Mukherjee
  (19), S. O'Brien (20), R. A. Ong (3), A. N. Otte (21), A. Petrashyk (14), M.
  Pohl (4 and 5), E. Pueschel (5), J. Quinn (20), K. Ragan (9), P. T. Reynolds
  (22), G. T. Richards (21), E. Roache (2), C. Rulten (10), I. Sadeh (5), M.
  Santander (23), G. H. Sembroski (7), D. Staszak (24) I. Sushch (5), J. Tyler
  (9), S. P. Wakely (24), R. M. Wells (18), P. Wilcox (15), A. Wilhelm (4 and
  5), D. A. Williams (12), T. J Williamson (13), B. Zitzer (9) ((1) Department
  of Physics, Washington University, St. Louis, MO 63130, USA, (2) Fred
  Lawrence Whipple Observatory, Harvard-Smithsonian Center for Astrophysics,
  Amado, AZ 85645, USA, (3) Department of Physics and Astronomy, University of
  California, Los Angeles, CA 90095, USA, (4) Institute of Physics and
  Astronomy, University of Potsdam, 14476 Potsdam-Golm, Germany, (5) DESY,
  Platanenallee 6, 15738 Zeuthen, Germany, (6) School of Physics, National
  University of Ireland Galway, University Road, Galway, Ireland, (7)
  Department of Physics and Astronomy, Purdue University, West Lafayette, IN
  47907, USA, (8) Department of Physics and Center for Astrophysics, Tsinghua
  University, Beijing 100084, China., (9) Physics Department, McGill
  University, Montreal, QC H3A 2T8, Canada, (10) School of Physics and
  Astronomy, University of Minnesota, Minneapolis, MN 55455, USA, (11)
  Department of Physics, California State University - East Bay, Hayward, CA
  94542, USA, (12) Santa Cruz Institute for Particle Physics and Department of
  Physics, University of California, Santa Cruz, CA 95064, USA, (13) Department
  of Physics and Astronomy and the Bartol Research Institute, University of
  Delaware, Newark, DE 19716, USA, (14) Physics Department, Columbia
  University, New York, NY 10027, USA, (15) Department of Physics and
  Astronomy, University of Iowa, Van Allen Hall, Iowa City, IA 52242, USA, (16)
  Department of Physics and Astronomy, University of Utah, Salt Lake City, UT
  84112, USA, (17) Department of Physics and Astronomy, DePauw University,
  Greencastle, IN 46135-0037, USA, (18) Department of Physics and Astronomy,
  Iowa State University, Ames, IA 50011, USA, (19) Department of Physics and
  Astronomy, Barnard College, Columbia University, NY 10027, USA, (20) School
  of Physics, University College Dublin, Belfield, Dublin 4, Ireland, (21)
  School of Physics and Center for Relativistic Astrophysics, Georgia Institute
  of Technology, 837 State Street NW, Atlanta, GA 30332-0430, (22) Department
  of Physical Sciences, Cork Institute of Technology, Bishopstown, Cork,
  Ireland, (23) Department of Physics and Astronomy, University of Alabama,
  Tuscaloosa, AL 35487, USA, (24) Enrico Fermi Institute, University of
  Chicago, Chicago, IL 60637, USA)","Measurement of Cosmic-ray Electrons at TeV Energies by VERITAS","17 pages, 2 figures, accepted for publication in PRD",,"10.1103/PhysRevD.98.062004",,"astro-ph.HE","http://arxiv.org/licenses/nonexclusive-distrib/1.0/","  Cosmic-ray electrons and positrons (CREs) at GeV-TeV energies are a unique
probe of our local Galactic neighborhood. CREs lose energy rapidly via
synchrotron radiation and inverse-Compton scattering processes while
propagating within the Galaxy and these losses limit their propagation
distance. For electrons with TeV energies, the limit is on the order of a
kiloparsec. Within that distance there are only a few known astrophysical
objects capable of accelerating electrons to such high energies. It is also
possible that the CREs are the products of the annihilation or decay of heavy
dark matter (DM) particles. VERITAS, an array of imaging air Cherenkov
telescopes in southern Arizona, USA, is primarily utilized for gamma-ray
astronomy, but also simultaneously collects CREs during all observations. We
describe our methods of identifying CREs in VERITAS data and present an energy
spectrum, extending from 300 GeV to 5 TeV, obtained from approximately 300
hours of observations. A single power-law fit is ruled out in VERITAS data. We
find that the spectrum of CREs is consistent with a broken power law, with a
break energy at 710 $\pm$ 40$_{stat}$ $\pm$ 140$_{syst}$ GeV.
","[{""version"":""v1"",""created"":""Wed, 29 Aug 2018 20:11:32 GMT""}]","2019-02-20"
"1808.10029","Axel  Bruchhausen Dr.","V. Villafa\~ne and S. Anguiano and A. E. Bruchhausen and G. Rozas and
  J. Bloch and C. Gomez Carbonell and A. Lema\^itre and A. Fainstein","Quantum well photoelastic comb for ultra-high frequency cavity
  optomechanics","15 pages, 5 figures",,,,"physics.optics","http://arxiv.org/licenses/nonexclusive-distrib/1.0/","  Optomechanical devices operated at their quantum limit open novel
perspectives for the ultrasensitive determination of mass and displacement, and
also in the broader field of quantum technologies. The access to higher
frequencies implies operation at higher temperatures and stronger immunity to
environmental noise. We propose and demonstrate here a new concept of quantum
well photoelastic comb for the efficient coupling of light to optomechanical
resonances at hundreds of GHz in semiconductor hybrid resonators. A purposely
designed ultra-high resolution Raman spectroscopy set-up is exploited to
evidence the transfer of spectral weight from the mode at 60 GHz to modes at
190-230 GHz, corresponding to the $8^{th}$ and $10^{th}$ overtone of the
fundamental breathing mode of the light-sound cavities. The coupling to
mechanical frequencies two orders of magnitude larger than alternative
approaches is attained without reduction of the optomechanical constant $g_0$.
The wavelength dependence of the optomechanical coupling further proves the
role of resonant photoelastic interaction, highlighting the potentiality to
access strong-coupling regimes. The experimental results show that
electrostrictive forces allow for the design of devices optimized to
selectively couple to specific mechanical modes. Our proposal opens up exciting
opportunities towards the implementation of novel approaches applicable in
quantum and ultra-high frequency information technologies.
","[{""version"":""v1"",""created"":""Wed, 29 Aug 2018 20:16:32 GMT""},{""version"":""v2"",""created"":""Wed, 19 Dec 2018 14:41:12 GMT""}]","2018-12-20"
"1808.10031","Wang-Cheng Kang","Wang-Cheng Kang, Mengting Wan, Julian McAuley","Recommendation Through Mixtures of Heterogeneous Item Relationships","10 pages, 6 figures. Accepted by CIKM'18 as a long paper",,,,"cs.IR","http://arxiv.org/licenses/nonexclusive-distrib/1.0/","  Recommender Systems have proliferated as general-purpose approaches to model
a wide variety of consumer interaction data. Specific instances make use of
signals ranging from user feedback, item relationships, geographic locality,
social influence (etc.). Typically, research proceeds by showing that making
use of a specific signal (within a carefully designed model) allows for
higher-fidelity recommendations on a particular dataset. Of course, the real
situation is more nuanced, in which a combination of many signals may be at
play, or favored in different proportion by individual users. Here we seek to
develop a framework that is capable of combining such heterogeneous item
relationships by simultaneously modeling (a) what modality of recommendation is
a user likely to be susceptible to at a particular point in time; and (b) what
is the best recommendation from each modality. Our method borrows ideas from
mixtures-of-experts approaches as well as knowledge graph embeddings. We find
that our approach naturally yields more accurate recommendations than
alternatives, while also providing intuitive `explanations' behind the
recommendations it provides.
","[{""version"":""v1"",""created"":""Wed, 29 Aug 2018 20:16:57 GMT""}]","2018-08-31"
"1808.10032","Luiz Zanlorensi","Luiz A. Zanlorensi, Eduardo Luz, Rayson Laroca, Alceu S. Britto Jr.,
  Luiz S. Oliveira, David Menotti","The Impact of Preprocessing on Deep Representations for Iris Recognition
  on Unconstrained Environments","Accepted for presentation at the Conference on Graphics, Patterns and
  Images (SIBGRAPI) 2018",,"10.1109/SIBGRAPI.2018.00044",,"cs.CV","http://arxiv.org/licenses/nonexclusive-distrib/1.0/","  The use of iris as a biometric trait is widely used because of its high level
of distinction and uniqueness. Nowadays, one of the major research challenges
relies on the recognition of iris images obtained in visible spectrum under
unconstrained environments. In this scenario, the acquired iris are affected by
capture distance, rotation, blur, motion blur, low contrast and specular
reflection, creating noises that disturb the iris recognition systems. Besides
delineating the iris region, usually preprocessing techniques such as
normalization and segmentation of noisy iris images are employed to minimize
these problems. But these techniques inevitably run into some errors. In this
context, we propose the use of deep representations, more specifically,
architectures based on VGG and ResNet-50 networks, for dealing with the images
using (and not) iris segmentation and normalization. We use transfer learning
from the face domain and also propose a specific data augmentation technique
for iris images. Our results show that the approach using non-normalized and
only circle-delimited iris images reaches a new state of the art in the
official protocol of the NICE.II competition, a subset of the UBIRIS database,
one of the most challenging databases on unconstrained environments, reporting
an average Equal Error Rate (EER) of 13.98% which represents an absolute
reduction of about 5%.
","[{""version"":""v1"",""created"":""Wed, 29 Aug 2018 20:22:41 GMT""}]","2019-01-21"
"1808.10033","Ahmet Okutan Ph.D.","Ahmet Okutan","Use of Source Code Similarity Metrics in Software Defect Prediction","A novel approach that uses source code similarity metrics for
  Software Defect Prediction",,,,"cs.SE","http://arxiv.org/licenses/nonexclusive-distrib/1.0/","  In recent years, defect prediction has received a great deal of attention in
the empirical software engineering world. Predicting software defects before
the maintenance phase is very important not only to decrease the maintenance
costs but also increase the overall quality of a software product. There are
different types of product, process, and developer based software metrics
proposed so far to measure the defectiveness of a software system. This paper
suggests to use a novel set of software metrics which are based on the
similarities detected among the source code files in a software project. To
find source code similarities among different files of a software system,
plagiarism and clone detection techniques are used. Two simple similarity
metrics are calculated for each file, considering its overall similarity to the
defective and non defective files in the project. Using these similarity
metrics, we predict whether a specific file is defective or not. Our
experiments on 10 open source data sets show that depending on the amount of
detected similarity, proposed metrics could achieve significantly better
performance compared to the existing static code metrics in terms of the area
under the curve (AUC).
","[{""version"":""v1"",""created"":""Wed, 29 Aug 2018 20:23:24 GMT""}]","2018-08-31"
"1808.10034","Tien Chih PhD","Tien Chih, Demitri Plessas","The Fundamental Morphism Theorem in the Categories of Graphs & Graph
  Reconstruction","13 pages, 2 figures",,,,"math.CO","http://arxiv.org/licenses/nonexclusive-distrib/1.0/","  The Fundamental Morphism Theorem is a categorical version of the First
Noether Isomorphism Theorem for categories that do not have kernels or
cokernels. We consider two categories of graphs. Both categories will admit
graphs with multiple edges and loops, and are distinguished by allowing two
different types of homomorphisms, standard graph homomorphisms and more general
graph homomorphisms where the contraction of an edge is allowed. We establish
the Fundamental Morphism Theorem in these two categories of graphs. We then use
the result to provide an equivalent reformulation of the vertex and edge
reconstruction conjectures. This reformulation shows that reconstructability is
equivalent to the existence of a graph homomorphism satisfying an equation.
","[{""version"":""v1"",""created"":""Wed, 29 Aug 2018 20:25:44 GMT""}]","2018-08-31"
