"1808.10268","Kentarou Mawatari","Shinya Kanemura, Kentarou Mawatari, Kodai Sakurai","Single Higgs production in association with a photon at
  electron-positron colliders in extended Higgs models","31 pages, 11 figures; Version published in Phys. Rev. D. References
  and Fig.4 added","Phys. Rev. D 99, 035023 (2019)","10.1103/PhysRevD.99.035023","OU-HET 976, UT-HET 126","hep-ph","http://arxiv.org/licenses/nonexclusive-distrib/1.0/","  We study associated Higgs production with a photon at electron-positron
colliders, $e^+e^-\to h\gamma$, in various extended Higgs models, such as the
inert doublet model (IDM), the inert triplet model (ITM) and the two Higgs
doublet model (THDM). The cross section in the standard model (SM) is maximal
around $\sqrt{s}=$250 GeV, and we present how and how much the new physics can
enhance or reduce the production rate. We also discuss the correlation with the
$h\to\gamma\gamma$ and $h\to Z\gamma$ decay rates. We find that, with a sizable
coupling to a SM-like Higgs boson, charged scalars can give considerable
contributions to both the production and the decay if their masses are around
100 GeV. Under the theoretical constraints from vacuum stability and
perturbative unitarity as well as the current constraints from the Higgs
measurements at the LHC, the production rate can be enhanced from the SM
prediction at most by a factor of two in the IDM. In the ITM, in addition, we
find a particular parameter region where the $h\gamma$ production significantly
increases by a factor of about six to eight, but the $h\to\gamma\gamma$ decay
still remains as in the SM. In the THDM, possible deviations from the SM
prediction are minor in the viable parameter space.
","[{""version"":""v1"",""created"":""Thu, 30 Aug 2018 13:20:32 GMT""},{""version"":""v2"",""created"":""Fri, 15 Feb 2019 14:48:00 GMT""}]","2019-02-20"
"1808.10270","Deepak Ojha","Deepak Ojha, Andres Henao, and Thomas D K\""uhne","Nuclear Quantum Effects on the Vibrational Dynamics of Liquid Water","8 pages, 11 figures","J. Chem. Phys. 2018","10.1063/1.5005500",,"cond-mat.soft physics.chem-ph","http://arxiv.org/licenses/nonexclusive-distrib/1.0/","  Based on quantum-mechanical path-integral molecular dynamics simulations the
impact of nuclear quantum effects on the vibrational and hydrogen bond dynamics
in liquid water is investigated. The instantaneous fluctuations in the
frequencies of the O-H stretch modes are calculated using the wavelet method of
time series analysis, while the time scales of the vibrational spectral
diffusion are determined from frequency-time correlation functions, joint
probability distributions, as well as the slope of three-pulse photon echo. We
find that the inclusion of nuclear quantum effects leads not only to a redshift
of the vibrational frequency distribution by around 130~cm$^{-1}$, but also to
an acceleration of the vibrational dynamics by as much as 30$\%$. In addition,
quantum fluctuations also entail a significantly faster decay of correlation in
the initial diffusive regime, which is agreement with recent vibrational echo
experiments.
","[{""version"":""v1"",""created"":""Thu, 30 Aug 2018 13:21:20 GMT""}]","2018-09-03"
"1808.10281","Bernhard Stiftner","Johannes Kraus, Carl-Martin Pfeiler, Dirk Praetorius, Michele Ruggeri,
  Bernhard Stiftner","Iterative solution and preconditioning for the tangent plane scheme in
  computational micromagnetics",,"Journal of Computational Physics, 398 (2019), 108866","10.1016/j.jcp.2019.108866",,"math.NA","http://arxiv.org/licenses/nonexclusive-distrib/1.0/","  The tangent plane scheme is a time-marching scheme for the numerical solution
of the nonlinear parabolic Landau-Lifshitz-Gilbert equation (LLG), which
describes the time evolution of ferromagnetic configurations. Exploiting the
geometric structure of LLG, the tangent plane scheme requires only the solution
of one linear variational form per time-step, which is posed in the discrete
tangent space determined by the nodal values of the current magnetization. We
develop an effective solution strategy for the arising constrained linear
systems, which is based on appropriate Householder reflections. We derive
possible preconditioners, which are (essentially) independent of the time-step,
and prove that the preconditioned GMRES algorithm leads to linear convergence.
Numerical experiments underpin the theoretical findings.
","[{""version"":""v1"",""created"":""Thu, 30 Aug 2018 13:29:36 GMT""}]","2020-03-03"
"1808.10285","Ali Wehbe","Mohammad Akil, Mouhammad Ghader and Ali Wehbe","The influence of the coefficients of a system of coupled wave equations
  with fractional damping on its stabilization",,,,,"math.AP","http://arxiv.org/licenses/nonexclusive-distrib/1.0/","  In this work, we consider a system of two wave equations coupled by
velocities in one-dimensional space, with one boundary fractional damping.
First, we show that the system is strongly asymptotically stable if and only if
the coupling parameter b of the two equations is outside a discrete set of
exceptional real values. Next, we show that our system is not uniformly stable.
Hence, we look for a polynomial decay rate for smooth initial data. Using
frequency domain approach combining with multiplier method, we prove that the
energy decay rate is greatly influenced by the nature of the coupling parameter
b, the arithmetic property of the ratio of the wave propagation speeds a, the
order of the fractional damping. Indeed, under the equal speed propagation
condition, we establish an optimal polynomial energy decay rate. Furthermore,
when the wave propagate with different speeds, under some arithmetic conditions
on the ratio of the wave propagation speeds, we prove that the energy of our
system decays polynomially to zero.
","[{""version"":""v1"",""created"":""Thu, 30 Aug 2018 13:31:59 GMT""},{""version"":""v2"",""created"":""Fri, 31 Aug 2018 08:56:58 GMT""},{""version"":""v3"",""created"":""Tue, 4 Sep 2018 17:51:16 GMT""},{""version"":""v4"",""created"":""Sat, 29 Sep 2018 07:30:33 GMT""}]","2018-10-02"
"1808.10290","Wei Shi","Wei Shi, Frances Yung, Vera Demberg","Acquiring Annotated Data with Cross-lingual Explicitation for Implicit
  Discourse Relation Classification","to appear on DISRPT@NAACL2019",,,,"cs.CL","http://arxiv.org/licenses/nonexclusive-distrib/1.0/","  Implicit discourse relation classification is one of the most challenging and
important tasks in discourse parsing, due to the lack of connective as strong
linguistic cues. A principle bottleneck to further improvement is the shortage
of training data (ca.~16k instances in the PDTB). Shi et al. (2017) proposed to
acquire additional data by exploiting connectives in translation: human
translators mark discourse relations which are implicit in the source language
explicitly in the translation. Using back-translations of such explicitated
connectives improves discourse relation parsing performance. This paper
addresses the open question of whether the choice of the translation language
matters, and whether multiple translations into different languages can be
effectively used to improve the quality of the additional data.
","[{""version"":""v1"",""created"":""Thu, 30 Aug 2018 13:36:04 GMT""},{""version"":""v2"",""created"":""Mon, 15 Apr 2019 11:29:19 GMT""}]","2019-04-16"
"1808.10291","Jungseek Hwang","Jungseek Hwang","Analysis of optical data using extended Drude model and generalized
  Allen's formulas","19 pages, 8 figures","J. Phys.: Condens. Matter 30, 405604 (2018)","10.1088/1361-648X/aaddca",,"cond-mat.supr-con cond-mat.str-el","http://arxiv.org/licenses/nonexclusive-distrib/1.0/","  Extended Drude model formalism has been successfully utilized for analyzing
optical spectra of strongly correlated electron systems including heavy-fermion
systems and high-$T_c$ superconducting iron pnictides and cuprates.
Furthermore, generalized Allen's formulas has been developed and applied to
extract the electron-boson spectral density function from measured optical data
of high temperature superconductors including cuprates in various material
phases. Here we used a reverse process to obtain various optical quantities
starting from two typical electron-boson spectral density model functions for
three intriguing (normal, pseudogap, and $d$-wave superconducting) material
phases in cuprates. We also assigned the calculated optical results to
designated regions in the phase diagram of hole-doped cuprates and compared
them with the corresponding measured optical spectra of
Bi$_2$Sr$_2$CaCu$_2$O$_{8+\delta}$ (Bi-2212). This comparison suggested that
this way of optical data analysis can be a convincing method to study
correlated electrons in the copper oxide superconductors and other
superconducting systems as well.
","[{""version"":""v1"",""created"":""Thu, 30 Aug 2018 13:36:18 GMT""}]","2021-01-28"
"1808.10295","Liling Sun","Shu Cai, S. K. Kushwaha, Jing Guo, Vladimir A. Sidorov, Congcong Le,
  Yazhou Zhou, Honghong Wang, Gongchang Lin, Xiaodong Li, Yanchuan Li, Ke Yang,
  Aiguo Li, Qi Wu, Jiangping Hu, Robert J Cava, Liling Sun","Universal superconductivity phase diagram for pressurized tetradymite
  topological insulators","24 pages ands 4 figures","Phys. Rev. Materials 2, 114203 (2018)","10.1103/PhysRevMaterials.2.114203",,"cond-mat.supr-con","http://creativecommons.org/licenses/by/4.0/","  We show that two different superconducting phases exist at high pressures in
the optimized tetradymite topological insulators Bi2Te2Se (BTS) and
Bi1.1Sb0.9Te2S (BSTS). The superconducting phases emerge at structural phase
transitions, the first at 8.4 GPa for BTS and 12.4 GPa for BSTS, and the second
at 13.6 GPa for BTS and 20.4 GPa, for BSTS. Electronic structure calculations
show that these phases do not have topological character. Comparison of our
results with prior work on Bi2Se3, Bi2Te3 and (Bi,Sb)2(Se,Te)3 allows us to
uncover a universal phase diagram for pressure-induced superconductivity in
tetradymites, providing a basis for understanding the relationships between
topological behavior, crystal structure, and superconductivity for these
materials.
","[{""version"":""v1"",""created"":""Thu, 30 Aug 2018 13:37:27 GMT""}]","2018-11-21"
"1808.10296","Lorenzo Traldi","Daniel S. Silver, Lorenzo Traldi and Susan G. Williams","Goeritz and Seifert Matrices from Dehn Presentations","13 pages, 6 figures",,,,"math.GT","http://arxiv.org/licenses/nonexclusive-distrib/1.0/","  The Goeritz matrix of a link is obtained from the Jacobian matrix of a
modified Dehn presentation associated to a diagram using Fox's free
differential calculus. When the diagram is special the Seifert matrix can also
be determined from the presentation.
","[{""version"":""v1"",""created"":""Thu, 30 Aug 2018 13:43:01 GMT""}]","2018-08-31"
"1808.10297","Bao Tang Quoc","Quoc-Hung Nguyen, Phuoc-Tai Nguyen, Bao Quoc Tang","Energy conservation for inhomogeneous incompressible and compressible
  Euler equations","The new version deals with general pressure law for compressible
  equations. By using a new test function, we allow the density to be zero
  instead of excluding completely vacuum. Required regularities for the density
  in the compressible case are also reduced",,,,"math.AP","http://arxiv.org/licenses/nonexclusive-distrib/1.0/","  Energy conservations are studied for inhomogeneous incompressible and
compressible Euler equations with general pressure law in a torus or a bounded
domain. We provide sufficient conditions for a weak solution to conserve the
energy. By exploiting a suitable test function, the spatial regularity for the
density is only required to be of order $2/3$ in the incompressible case, and
of order $1/3$ in the compressible case. When the density is constant, we
recover the existing results for classical incompressible Euler equation.
","[{""version"":""v1"",""created"":""Thu, 30 Aug 2018 13:43:06 GMT""},{""version"":""v2"",""created"":""Sat, 23 Feb 2019 16:37:51 GMT""},{""version"":""v3"",""created"":""Fri, 20 Sep 2019 08:05:03 GMT""}]","2019-09-23"
"1808.10298","Mohamed Nait-Meziane","Mohamed Nait-Meziane, Karim Abed-Meraim, Abd-Krim Seghouane and Ammar
  Mesloub","Hybrid Joint Diagonalization Algorithms","Supplementary material (ref. [18]) is included in this file",,"10.1109/LSP.2018.2868408",,"eess.SP","http://arxiv.org/licenses/nonexclusive-distrib/1.0/","  This paper deals with a hybrid joint diagonalization (JD) problem considering
both Hermitian and transpose congruences. Such problem can be encountered in
certain non-circular signal analysis applications including blind source
separation. We introduce new Jacobi-like algorithms using Givens or a
combination of Givens and hyperbolic rotations. These algorithms are compared
with state-of-the-art methods and their performance gain, especially in the
high dimensional case, is assessed through simulation experiments including
examples related to blind separation of non-circular sources.
","[{""version"":""v1"",""created"":""Thu, 30 Aug 2018 13:49:29 GMT""},{""version"":""v2"",""created"":""Sat, 8 Sep 2018 08:23:43 GMT""}]","2018-09-11"
"1808.10300","Michael Feldmann M. Sc.","Michael Feldmann, Christina Kolb and Christian Scheideler","Self-stabilizing Overlays for high-dimensional Monotonic Searchability",,,,,"cs.DC","http://arxiv.org/licenses/nonexclusive-distrib/1.0/","  We extend the concept of monotonic searchability for self-stabilizing systems
from one to multiple dimensions. A system is self-stabilizing if it can recover
to a legitimate state from any initial illegal state. These kind of systems are
most often used in distributed applications. Monotonic searchability provides
guarantees when searching for nodes while the recovery process is going on.
More precisely, if a search request started at some node $u$ succeeds in
reaching its destination $v$, then all future search requests from $u$ to $v$
succeed as well. Although there already exists a self-stabilizing protocol for
a two-dimensional topology and an universal approach for monotonic
searchability, it is not clear how both of these concepts fit together
effectively. The latter concept even comes with some restrictive assumptions on
messages, which is not the case for our protocol. We propose a simple novel
protocol for a self-stabilizing two-dimensional quadtree that satisfies
monotonic searchability. Our protocol can easily be extended to higher
dimensions and offers routing in $\mathcal O(\log n)$ hops for any search
request.
","[{""version"":""v1"",""created"":""Thu, 30 Aug 2018 13:54:48 GMT""}]","2018-08-31"
"1808.10301","Paolo Bellingeri","Paolo Bellingeri (LMNO), Luis Paris (IMB)","Virtual braids and permutations",,,,,"math.GR","http://arxiv.org/licenses/nonexclusive-distrib/1.0/","  Let VB$_n$ be the virtual braid group on $n$ strands and let $\mathfrak{S}_n$
be the symmetric group on $n$ letters. Let $n,m \in \mathbb{N}$ such that $n
\ge 5$, $m \ge 2$ and $n \ge m$. We determine all possible homomorphisms from
VB$_n$ to $\mathfrak{S}_m$, from $\mathfrak{S}_n$ to VB$_m$ and from VB$_n$ to
VB$_m$. As corollaries we get that Out(VB$_n$) is isomorphic to
$\mathbb{Z}/2\mathbb{Z} \times \mathbb{Z}/2\mathbb{Z}$ and that VB$_n$ is both
Hopfian and co-Hofpian.
","[{""version"":""v1"",""created"":""Thu, 30 Aug 2018 13:58:09 GMT""}]","2018-08-31"
"1808.10302","Suo Tang","Suo Tang and Naveen Kumar","Ultraintense Attosecond Pulse Emission from Relativistic Laser-Plasma
  Interaction","12 pages, 7 figures",,"10.1088/1361-6587/aaf378",,"physics.plasm-ph","http://arxiv.org/licenses/nonexclusive-distrib/1.0/","  We develop an analytical model for ultraintense attosecond pulse emission in
the highly relativistic laser-plasma interaction. In this model, the attosecond
pulse is emitted by a strongly compressed electron layer around the instant
when the layer transverse current changes the sign and its longitudinal
velocity approaches the maximum. The emitted attosecond pulse has a broadband
exponential spectrum and a stabilized constant spectral phase
$\psi(\omega)=\pm\pi/2-\psi_{A_m}$. The waveform of the attosecond pulse is
also given explicitly, to our knowledge, for the first time. We validate the
analytical model via particle-in-cell (PIC) simulations for both normal and
oblique incidence. Based on this model, we highlight the potential to generate
an isolated ultraintense phase-stabilized attosecond pulse
","[{""version"":""v1"",""created"":""Thu, 30 Aug 2018 14:01:19 GMT""}]","2019-01-30"
"1808.10303","Luis Augusto De Mendon\c{c}a","Luis Augusto de Mendon\c{c}a","The weak commutativity construction for Lie algebras","Incorporated referee's suggestions, results unchanged",,"10.1016/j.jalgebra.2019.04.007",,"math.RA math.GR","http://arxiv.org/licenses/nonexclusive-distrib/1.0/","  We study the analogue of Sidki's weak commutativity construction, defined
originally for groups, in the category of Lie algebras. This is the quotient
$\chi(\mathfrak{g})$ of the Lie algebra freely generated by two isomorphic
copies $\mathfrak{g}$ and $\mathfrak{g}^{\psi}$ of a fixed Lie algebra by the
ideal generated by the brackets $[x,x^{\psi}]$, for all $x$. We exhibit an
abelian ideal of $\chi(\mathfrak{g})$ whose associated quotient is a subdirect
sum in $\mathfrak{g} \oplus \mathfrak{g} \oplus \mathfrak{g}$ and we give
conditions for this ideal to be finite dimensional. We show that
$\chi(\mathfrak{g})$ has a subquotient that is isomorphic to the Schur
multiplier of $\mathfrak{g}$. We prove that $\chi(\mathfrak{g})$ is finitely
presentable or of homological type $FP_2$ if and only if $\mathfrak{g}$ has the
same property, but $\chi(\mathfrak{f})$ is not of type $FP_3$ if $\mathfrak{f}$
is a non-abelian free Lie algebra.
","[{""version"":""v1"",""created"":""Thu, 30 Aug 2018 14:06:45 GMT""},{""version"":""v2"",""created"":""Tue, 9 Apr 2019 21:51:05 GMT""}]","2019-04-11"
"1808.10304","Dan Hathaway","Sy-David Friedman and Dan Hathaway","Generic Coding with Help and Amalgamation Failure","14 pages",,,,"math.LO","http://arxiv.org/licenses/nonexclusive-distrib/1.0/","  We show that if $M$ is a countable transitive model of ZF and if $a,b$ are
reals not in $M$, then there is a $G$ generic over $M$ such that $b \in
L[a,G]$. We then present several applications such as the following: if $J$ is
any countable transitive model of ZFC and $M \not\subseteq J$ is another
countable transitive model of ZFC of the same ordinal height $\alpha$, then
there is a forcing extension $N$ of $J$ such that $M \cup N$ is not included in
any transitive model of ZFC of height $\alpha$. Also, assuming $0^\#$ exists,
letting $S$ be the set of reals generic over $L$, although $S$ is disjoint from
the Turing cone above $0^\#$, we have that for any non-constructible real $a$,
$\{ a \oplus s : s \in S \}$ is cofinal in the Turing degrees.
","[{""version"":""v1"",""created"":""Thu, 30 Aug 2018 14:09:43 GMT""},{""version"":""v2"",""created"":""Sun, 23 Jun 2019 12:30:40 GMT""},{""version"":""v3"",""created"":""Tue, 6 Apr 2021 22:56:00 GMT""}]","2021-04-08"
"1808.10305","Leandro Bufai\c{c}al","L. T. Coutrim, E. M. Bittar, F. Garcia, and L. Bufai\c{c}al","Influence of spin glass-like magnetic relaxation on the
  zero-field-cooled exchange bias effect","8 pages, 6 figures","Physical Review B 98, 064426 (2018)","10.1103/PhysRevB.98.064426",,"cond-mat.mtrl-sci","http://arxiv.org/licenses/nonexclusive-distrib/1.0/","  The zero-field-cooled exchange bias (ZEB) effect is a remarkable phenomenon
recently reported for some reentrant spin glass-like compounds. In this work,
the time-evolution of magnetization is thoroughly investigated for two ZEB
materials in order to figure out the role played by the spin glass-like phase
on such effect. La$_{1.5}$Sr$_{0.5}$CoMnO$_{6}$ and
La$_{1.5}$Ca$_{0.5}$CoMnO$_{6}$ were chosen as representative samples of ZEB
systems, since the former compound presents the largest ZEB reported so far,
while the second has a much smaller effect, despite being
structurally/chemically similar. Comprehensive magnetic measurements were
carried on both samples, and the results are discussed in terms of the amount
and time-evolution of the spin glass-like phase under the influence of a
varying field. We also propose a phenomenological model, based on the pinning
of spin glass-like moments and on the dynamics of their magnetic relaxation, to
explain the asymmetry observed in the hysteresis loops. The good agreement
between the simulated and experimental results confirms our hypothesis that the
spin glass-like phase is key to the ZEB effect.
","[{""version"":""v1"",""created"":""Thu, 30 Aug 2018 14:10:08 GMT""}]","2018-08-31"
"1808.10306","Pedro Jorge Mart\'inez","Marcelo Botta-Cantcheff, Pedro J. Mart\'inez and Guillermo A. Silva","The Gravity Dual of Real-Time CFT at Finite Temperature","20 pages, 6 figures",,"10.1007/JHEP11(2018)129",,"hep-th gr-qc","http://arxiv.org/licenses/nonexclusive-distrib/1.0/","  We present a spherically symmetric aAdS gravity solution with
Schwinger-Keldysh boundary condition dual to a CFT at finite temperature
defined on a complex time contour. The geometry is built by gluing the exterior
of a two-sided AdS Black Hole, the (aAdS) Einstein-Rosen wormhole, with two
Euclidean black hole halves. These pieces are interpreted as the gravity duals
of the two Euclidean $\beta/2$ segments in the SK path, each coinciding with a
Hartle-Hawking-Maldacena (TFD) vacuum state, while the Lorentzian regions
naturally describes the real-time evolution of the TFD doubled system.
  Within the context of Skenderis and van Rees real-time holographic
prescription, the new solution should be compared to the Thermal AdS spacetime
since both contribute to the gravitational path integral. In this framework, we
compute the time ordered 2-pt functions of scalar CFT operators via a
non-back-reacting Klein-Gordon field for both backgrounds and confront the
results. When solving for the field we find that the gluing leads to a
geometric realization of the Unruh trick via a completely holographic
prescription. Interesting observations follow from $\langle {\cal O}_L{\cal
O}_R\rangle$, which capture details of the entanglement of the (ground) state
and the connectivity of the spacetime.
","[{""version"":""v1"",""created"":""Thu, 30 Aug 2018 14:12:40 GMT""}]","2018-12-05"
"1808.10307","Cong Liao","Cong Liao, Haoti Zhong, Anna Squicciarini, Sencun Zhu, David Miller","Backdoor Embedding in Convolutional Neural Network Models via Invisible
  Perturbation",,,,,"cs.CR cs.LG stat.ML","http://arxiv.org/licenses/nonexclusive-distrib/1.0/","  Deep learning models have consistently outperformed traditional machine
learning models in various classification tasks, including image
classification. As such, they have become increasingly prevalent in many real
world applications including those where security is of great concern. Such
popularity, however, may attract attackers to exploit the vulnerabilities of
the deployed deep learning models and launch attacks against security-sensitive
applications. In this paper, we focus on a specific type of data poisoning
attack, which we refer to as a {\em backdoor injection attack}. The main goal
of the adversary performing such attack is to generate and inject a backdoor
into a deep learning model that can be triggered to recognize certain embedded
patterns with a target label of the attacker's choice. Additionally, a backdoor
injection attack should occur in a stealthy manner, without undermining the
efficacy of the victim model. Specifically, we propose two approaches for
generating a backdoor that is hardly perceptible yet effective in poisoning the
model. We consider two attack settings, with backdoor injection carried out
either before model training or during model updating. We carry out extensive
experimental evaluations under various assumptions on the adversary model, and
demonstrate that such attacks can be effective and achieve a high attack
success rate (above $90\%$) at a small cost of model accuracy loss (below
$1\%$) with a small injection rate (around $1\%$), even under the weakest
assumption wherein the adversary has no knowledge either of the original
training data or the classifier model.
","[{""version"":""v1"",""created"":""Thu, 30 Aug 2018 14:13:39 GMT""}]","2018-08-31"
