"1808.09899","Joshua Studholme","Josh Studholme, and Sergey Gulev","The Curious Association Between Hadley Circulation Intensity and the
  Meridional Distribution of Tropical Cyclones in the Eastern North Pacific","Obukhov Institute of Atmospheric Physics RAS conference proceedings,
  Summer 2018",,,,"physics.ao-ph","http://arxiv.org/licenses/nonexclusive-distrib/1.0/","  It has recently been shown that an interesting inverse relationship exists
between the strength of the overturning in the regional boreal Hadley
circulation and tropical cyclone genesis and lifetime maximum intensity
latitudes in the eastern North Pacific. One of the particularly curious aspects
of this association is its uniqueness to this ocean basin. We show here that
this result can be understood as the outcome of an equatorward shift in the
local Intertropical Convergence Zone (ITCZ) and a moderate reduction of
tropical vertical shear. These two factors are not necessarily concomitant. The
magnitude of the vertical shear change is low enough to suggest that the
primary physical mechanism behind this inverse relationship is the equatorward
shift in the ITCZ. Since a significant proportion of tropical cyclone genesis
results from aggregated convective cells forming into a coherent convective
vortex and being shed from the ITCZ, this shift is apparently sufficient to
explain the observed association. The equatorward shift in the ITCZ is
potentially the result of a relative warming of the Southern Hemisphere in the
boreal tropical cyclone season. This more equatorward ITCZ, located over warmer
surface waters, presumably explains the more intense Hadley circulation,
despite a reduction of the large-scale boreal meridional temperature gradient.
Although, these links require further research.
","[{""version"":""v1"",""created"":""Wed, 29 Aug 2018 16:01:48 GMT""}]","2018-08-30"
"1808.09900","F. Maxwell Harper","Joshua Wissbroecker, F Maxwell Harper","Early Lessons from a Voice-Only Interface for Finding Movies","Joshua Wissbroecker and F. Maxwell Harper. 2018. Early Lessons from a
  Voice-Only Interface for Finding Movies. In Late-Breaking Results track part
  of the Twelfth ACM Conference on Recommender Systems (RecSys '18), October
  2-7, 2018, Vancouver, BC, Canada. ACM, New York, NY, USA, 2 pages",,,,"cs.HC","http://creativecommons.org/licenses/by/4.0/","  The current generation of streaming media players often allow users to speak
commands (e.g., users can change the TV channel by pressing a button and saying
""ESPN""). However, these devices typically support a narrow range of control-
and search-oriented commands, and do not support deeper recommendation or
exploration queries. To study spoken natural language interactions with
recommenders, we have built MovieLens TV, a movie recommender system with no
input modalities except voice. In this poster, we describe MovieLens TV, with a
focus on lessons learned building a prototype system around an off-the-shelf
Amazon Echo.
","[{""version"":""v1"",""created"":""Wed, 29 Aug 2018 16:03:57 GMT""}]","2018-08-30"
"1808.09901","Paul M. Terwilliger","Paul Terwilliger","An action of the free product $\mathbb Z_2 \star \mathbb Z_2 \star
  \mathbb Z_2$ on the $q$-Onsager algebra and its current algebra","15 pages",,"10.1016/j.nuclphysb.2018.09.020",,"math-ph math.MP","http://arxiv.org/licenses/nonexclusive-distrib/1.0/","  Recently Pascal Baseilhac and Stefan Kolb introduced some automorphisms
$T_0$, $T_1$ of the $q$-Onsager algebra $\mathcal O_q$, that are roughly
analogous to the Lusztig automorphisms of $U_q(\widehat{\mathfrak{sl}}_2)$. We
use $T_0, T_1$ and a certain antiautomorphism of $\mathcal O_q$ to obtain an
action of the free product $\mathbb Z_2 \star \mathbb Z_2 \star \mathbb Z_2$ on
$\mathcal O_q$ as a group of (auto/antiauto)-morphisms. The action forms a
pattern much more symmetric than expected. We show that a similar phenomenon
occurs for the associated current algebra $\mathcal A_q$. We give some
conjectures and problems concerning $\mathcal O_q$ and $\mathcal A_q$.
","[{""version"":""v1"",""created"":""Wed, 29 Aug 2018 16:06:04 GMT""}]","2018-10-17"
"1808.09902","Edoardo Vignotto","Edoardo Vignotto, Sebastian Engelke","Extreme Value Theory for Open Set Classification -- GPD and GEV
  Classifiers",,,,,"stat.ML cs.LG","http://arxiv.org/licenses/nonexclusive-distrib/1.0/","  Classification tasks usually assume that all possible classes are present
during the training phase. This is restrictive if the algorithm is used over a
long time and possibly encounters samples from unknown classes. The recently
introduced extreme value machine, a classifier motivated by extreme value
theory, addresses this problem and achieves competitive performance in specific
cases. We show that this algorithm can fail when the geometries of known and
unknown classes differ. To overcome this problem, we propose two new algorithms
relying on approximations from extreme value theory. We show the effectiveness
of our classifiers in simulations and on the LETTER and MNIST data sets.
","[{""version"":""v1"",""created"":""Wed, 29 Aug 2018 16:07:26 GMT""},{""version"":""v2"",""created"":""Thu, 30 Aug 2018 07:51:57 GMT""},{""version"":""v3"",""created"":""Tue, 22 Jan 2019 19:32:13 GMT""},{""version"":""v4"",""created"":""Tue, 16 Jul 2019 20:03:55 GMT""}]","2019-07-18"
"1808.09903","Laurence Boxer","Laurence Boxer","Remarks on Fixed Point Assertions in Digital Topology, 2",,,,,"math.GT","http://arxiv.org/licenses/nonexclusive-distrib/1.0/","  Several recent papers in digital topology have sought to obtain fixed point
results by mimicking the use of tools from classical topology, such as complete
metric spaces. We show that in many cases, researchers using these tools have
derived conclusions that are incorrect, trivial, or limited.
","[{""version"":""v1"",""created"":""Wed, 29 Aug 2018 16:07:28 GMT""}]","2018-08-30"
"1808.09904","Alexander Span","Alexander Span, Vahid Aref, Henning Buelow, Stephan ten Brink","Precoding for Dual Polarization Soliton Transmission","Presented at OECC 2018",,,,"cs.IT eess.SP math.IT","http://arxiv.org/licenses/nonexclusive-distrib/1.0/","  We consider dual-polarized optical multi-soliton pulse transmission.
Modulating the nonlinear spectrum, it becomes highly correlated in noisy fiber
links. We propose a simple precoding to significantly reduce the correlation,
allowing disjoint detection of spectral amplitudes.
","[{""version"":""v1"",""created"":""Wed, 29 Aug 2018 16:08:24 GMT""}]","2018-08-30"
"1808.09905","Jacopo Emmenegger","Jacopo Emmenegger","The Fullness Axiom and exact completion of homotopy categories","v1: 14 pages. v2: 13 pages; minor changes to presentation. v3: final
  journal version, accepted for publication in Cah. Topol. G\'eom. Diff\'er.
  Cat\'eg","Cah. Topol. G\'eom. Diff\'er. Cat\'eg. 61(4) (2020)",,,"math.CT math.LO","http://arxiv.org/licenses/nonexclusive-distrib/1.0/","  We use a category-theoretic formulation of Aczel's Fullness Axiom from
Constructive Set Theory to derive the local cartesian closure of an exact
completion. As an application, we prove that such a formulation is valid in the
homotopy category of any model category satisfying mild requirements, thus
obtaining in particular the local cartesian closure of the exact completion of
topological spaces and homotopy classes of maps. Under a type-theoretic
reading, these results provide a general motivation for the local cartesian
closure of the category of setoids. However, results and proofs are formulated
solely in the language of categories, and no knowledge of type theory or
constructive set theory is required on the reader's part.
","[{""version"":""v1"",""created"":""Wed, 29 Aug 2018 16:09:03 GMT""},{""version"":""v2"",""created"":""Fri, 20 Sep 2019 09:38:13 GMT""},{""version"":""v3"",""created"":""Mon, 27 Apr 2020 10:48:55 GMT""}]","2020-12-18"
"1808.09906","Friedemann Queisser","Friedemann Queisser and Ralf Sch\""utzhold","Environment induced pre-thermalization in the Mott-Hubbard model","6 pages, 4 figures","Phys. Rev. B 99, 155110 (2019)","10.1103/PhysRevB.99.155110",,"cond-mat.str-el quant-ph","http://arxiv.org/licenses/nonexclusive-distrib/1.0/","  Via the hierarchy of correlations, we study the strongly interacting
Fermi-Hubbard model in the Mott insulator state and couple it to a Markovian
environment which constantly monitors the particle numbers $\hat
n_\mu^\uparrow$ and $\hat n_\mu^\downarrow$ for each lattice site $\mu$. As
expected, the environment induces an imaginary part $\gamma$ (i.e., decay rate)
of the quasi-particle frequencies
$\omega_{\mathbf{k}}\to\omega_{\mathbf{k}}-i\gamma$ and tends to diminish the
correlations between lattice sites. Surprisingly, the environment does also
steer the state of the system on intermediate time scales
$\mathcal{O}(1/\gamma)$ to a pre-thermalized state very similar to a quantum
quench (i.e., suddenly switching on the hopping rate $J$). Full thermalization
occurs via local on-site heating and takes much longer.
","[{""version"":""v1"",""created"":""Wed, 29 Aug 2018 16:15:43 GMT""}]","2019-04-10"
"1808.09907","Zongjie Ma","Zongjie Ma, Abdul Sattar, Jun Zhou, Qingliang Chen, Kaile Su","Dropout with Tabu Strategy for Regularizing Deep Neural Networks",,,,,"cs.LG stat.ML","http://arxiv.org/licenses/nonexclusive-distrib/1.0/","  Dropout has proven to be an effective technique for regularization and
preventing the co-adaptation of neurons in deep neural networks (DNN). It
randomly drops units with a probability $p$ during the training stage of DNN.
Dropout also provides a way of approximately combining exponentially many
different neural network architectures efficiently. In this work, we add a
diversification strategy into dropout, which aims at generating more different
neural network architectures in a proper times of iterations. The dropped units
in last forward propagation will be marked. Then the selected units for
dropping in the current FP will be kept if they have been marked in the last
forward propagation. We only mark the units from the last forward propagation.
We call this new technique Tabu Dropout. Tabu Dropout has no extra parameters
compared with the standard Dropout and also it is computationally cheap. The
experiments conducted on MNIST, Fashion-MNIST datasets show that Tabu Dropout
improves the performance of the standard dropout.
","[{""version"":""v1"",""created"":""Wed, 29 Aug 2018 16:18:02 GMT""}]","2018-08-30"
"1808.09908","Leslie Hogben","Leslie Hogben","Zero forcing and maximum nullity for hypergraphs",,,,,"math.CO","http://arxiv.org/licenses/nonexclusive-distrib/1.0/","  The concept of zero forcing is extended from graphs to uniform hypergraphs in
analogy with the way zero forcing was defined as an upper bound for the maximum
nullity of the family of symmetric matrices whose nonzero pattern of entries is
described by a given graph: A family of symmetric hypermatrices is associated
with a uniform hypergraph and zeros are forced in a null vector. The value of
the hypergraph zero forcing number and maximum nullity are determined for
various families of uniform hypergraphs and the effects of several graph
operations on the hypergraph zero forcing number are determined. The hypergraph
zero forcing number is compared to the infection number of a hypergraph and the
iteration process in hypergraph power domination.
","[{""version"":""v1"",""created"":""Wed, 29 Aug 2018 16:18:11 GMT""}]","2018-08-30"
"1808.09909","Alexander Dolgov","A.D. Dolgov","Massive Primordial Black Holes in Contemporary and Young Universe (old
  predictions and new data)","10 pages, Invited talk at The Conference on Particles and Cosmology
  at the Nanyang Executive Centre from 5 to 9 March 2018 at NTU, Singapore",,"10.1142/S0217751X18440293",,"astro-ph.CO hep-ph","http://arxiv.org/licenses/nonexclusive-distrib/1.0/","  A brief review of the recent astronomical data, indicating that the universe
is abundantly populated by heavy black holes (BH), is presented. Conventional
astrophysics and cosmology cannot explain such a high population of BHs. A
mechanism of the paper of 1963 is described, which at least qualitatively
explained the observational data. In particular, the prediction that massive
primordial BHs can be cosmological dark matter ""particles"" is discussed.
","[{""version"":""v1"",""created"":""Wed, 29 Aug 2018 16:22:56 GMT""}]","2018-12-05"
"1808.09910","Adnan Abdulwahid","Adnan Hashim Abdulwahid","Varieties Associated to Linear operators","still in progress",,,,"math.CT math.AC math.AG math.RA","http://arxiv.org/licenses/nonexclusive-distrib/1.0/","  We introduce and study the notion of affine varieties associated to ordered
bases and establish Galois connection between the power set of $A^n_K$ and the
power set of $K[x_1, . . ., x_n]$, and then induce a Galois correspondence. We
generalize the idea by defining affine varieties associated to linear
operators. We produce Hilbert's Nullstellensatz version for such varieties and
show that there is a 1-1 correspondence between this kind of varieties in
$A^n_K$ and the ""usual"" affine varieties in $A^n_K$. We prove that the \usual""
affine varieties forms a skeleton for the category of all affine varieties
associated to linear operators, and hence they are equivalent categories.
","[{""version"":""v1"",""created"":""Wed, 29 Aug 2018 16:23:35 GMT""},{""version"":""v2"",""created"":""Wed, 5 Sep 2018 17:07:46 GMT""},{""version"":""v3"",""created"":""Sun, 16 Sep 2018 20:11:01 GMT""},{""version"":""v4"",""created"":""Tue, 18 Sep 2018 21:39:04 GMT""},{""version"":""v5"",""created"":""Sat, 16 Feb 2019 11:47:41 GMT""}]","2020-09-29"
"1808.09911","Han Yu","Han Yu","Multi-rotations on the unit circle","A certain number of pages",,,,"math.DS math.MG","http://arxiv.org/licenses/nonexclusive-distrib/1.0/","  In this paper, we study multi-rotation orbits on the unit circle. We obtain a
natural generalization of a classical result which says that orbits of
irrational rotations on the unit circle are dense. It is possible to show that
this result holds true if instead of iterating a single irrational rotation,
one takes a multi-rotation orbit along a finitely recurrent sequence over
finitely many different irrational rotations. We also discuss some connections
between the box dimensions of multi-rotation orbits and Diophantine
approximations. In particular, we improve a result by Feng and Xiong in the
case when the rotation parameters are algebraic numbers.
","[{""version"":""v1"",""created"":""Wed, 29 Aug 2018 16:23:54 GMT""}]","2018-08-30"
"1808.09912","Galina Zverkina A.","Galina Zverkina","On exponential convergence rate of distribution for some
  non-regenerative reliability system","English version: 15 pages. Russian version: 16 pages",,,,"math.PR","http://arxiv.org/licenses/nonexclusive-distrib/1.0/","  The exponential upper bounds for the convergence rate of the distribution of
restorable element with partially energized standby redundancy are founded, in
the case when all working and repair times are bounded by exponential random
variable (upper and lower), and working and repair times can by dependent. The
bounds for the convergence rate of the availability factor are estimated.
  --------------------------------------
  Polucheny ocenki sverhu dlya skorosti skhodimosti raspredeleniya sostoyaniya
vosstanavlivaemogo ehlementa s tyoplym rezervom v sluchae, kogda vremena raboty
i vosstanovleniya oboih ehlementov mogut byt' zavisimy, i oni ogranicheny
sverhu i snizu ehksponencial'nym raspredeleniem. Poluchennyj rezul'tat
pozvolyaet ocenivat' skorost' skhodimosti koehfficienta gotovnosti k
stacionarnomu znacheniyu
","[{""version"":""v1"",""created"":""Wed, 29 Aug 2018 16:26:49 GMT""}]","2018-08-30"
"1808.09913","Hang Chen","Hang Chen, Utkarsh Soni, Yafeng Lu, Vahan Huroyan, Ross Maciejewski,
  Stephen Kobourov","Same Stats, Different Graphs (Graph Statistics and Why We Need Graph
  Drawings)","Appears in the Proceedings of the 26th International Symposium on
  Graph Drawing and Network Visualization (GD 2018)",,,,"cs.CG","http://arxiv.org/licenses/nonexclusive-distrib/1.0/","  Data analysts commonly utilize statistics to summarize large datasets. While
it is often sufficient to explore only the summary statistics of a dataset
(e.g., min/mean/max), Anscombe's Quartet demonstrates how such statistics can
be misleading. Graph mining has a similar problem in that graph statistics
(e.g., density, connectivity, clustering coefficient) may not capture all of
the critical properties of a given graph. To study the relationships between
different graph properties and statistics, we examine all low-order (<= 10)
non-isomorphic graphs and provide a simple visual analytics system to explore
correlations across multiple graph properties. However, for graphs with more
than ten nodes, generating the entire space of graphs becomes quickly
intractable. We use different random graph generation methods to further look
into the distribution of graph statistics for higher order graphs and
investigate the impact of various sampling methodologies. We also describe a
method for generating many graphs that are identical over a number of graph
properties and statistics yet are clearly different and identifiably distinct.
","[{""version"":""v1"",""created"":""Wed, 29 Aug 2018 16:27:48 GMT""},{""version"":""v2"",""created"":""Fri, 31 Aug 2018 20:10:29 GMT""},{""version"":""v3"",""created"":""Tue, 25 Sep 2018 00:02:24 GMT""},{""version"":""v4"",""created"":""Wed, 5 Dec 2018 18:11:38 GMT""},{""version"":""v5"",""created"":""Wed, 30 Oct 2019 01:32:25 GMT""}]","2019-10-31"
"1808.09914","Philip B. Allen","Xinyu Li and Philip B. Allen","Resistivity of high pressure phosphorus phases","5 pages including 6 figures. This revised version has a more
  definitive discussion of the order of magnitude disagreement between
  resistivity theory and experiment",,,,"cond-mat.supr-con","http://arxiv.org/licenses/nonexclusive-distrib/1.0/","  Simple cubic (sc) black phosphorus (denoted BP), stable at P>10GPa, seems an
ordinary metal. It has electron-phonon-driven superconductivity with Tc 5-10 K.
The A17 phase, stable at atmospheric pressure, has a narrow gap, becomes
semimetallic at P=1 GPa, and has a smooth transition to topological metal
behavior at P ~ 5 GPa. The A7 phase, stable for 5<P<10 GPa, is metallic,
superconducting, and less conventional than the sc phase. Some insights are
extracted from analysis of resistivity versus temperature at various pressures.
A surprising order-of-magnitude disagreement between theory and experiment is
discussed.
","[{""version"":""v1"",""created"":""Wed, 29 Aug 2018 16:30:14 GMT""},{""version"":""v2"",""created"":""Sat, 8 Sep 2018 15:21:01 GMT""}]","2018-09-11"
"1808.09915","Petr Mandrik","Petr Mandrik (for the CMS Collaboration)","Top FCNC searches at HL-LHC with the CMS experiment","Presented at Quarks-2018 XXth International Seminar on High Energy
  Physics",,,"CMS CR -2018/094","hep-ex hep-ph","http://arxiv.org/licenses/nonexclusive-distrib/1.0/","  The Large Hadron Collider is the world's largest and highest center-of-mass
energy particle accelerator. During the Phase I operation it is expected that
the LHC operated at a centre-of-mass energy of 13 TeV will deliver to the CMS
experiment total integrated luminosity of $\sim$300 fb$^{-1}$ till 2023. The
High Luminosity LHC upgrade is expected to run at a centre-of-mass energy of 14
TeV and will allow ATLAS and CMS to collect integrated luminosities of the
order of 300 fb$^{-1}$ per year, and up to 3000 fb$^{-1}$ during the HL-LHC
projected lifetime of ten years. The large expected integrated luminosity
enables the exploration of the multi-TeV scale by searches for particles with
high masses as well as by investigation of processes with very low cross
sections such as Flavor-Change Neutral Current interactions in top quark
sector. In this report we present a proposal for the top quark FCNC searches at
HL-LHC based on Monte-Carlo simulation of the upgraded CMS detector.
","[{""version"":""v1"",""created"":""Wed, 29 Aug 2018 16:30:53 GMT""}]","2018-08-30"
"1808.09916","Jeffrey Ede BSc MPhys","Jeffrey M. Ede","Autoencoders, Kernels, and Multilayer Perceptrons for Electron
  Micrograph Restoration and Compression","16 pages, 12 figures, 3 tables",,,,"cs.CV","http://creativecommons.org/licenses/by/4.0/","  We present 14 autoencoders, 15 kernels and 14 multilayer perceptrons for
electron micrograph restoration and compression. These have been trained for
transmission electron microscopy (TEM), scanning transmission electron
microscopy (STEM) and for both (TEM+STEM). TEM autoencoders have been trained
for 1$\times$, 4$\times$, 16$\times$ and 64$\times$ compression, STEM
autoencoders for 1$\times$, 4$\times$ and 16$\times$ compression and TEM+STEM
autoencoders for 1$\times$, 2$\times$, 4$\times$, 8$\times$, 16$\times$,
32$\times$ and 64$\times$ compression. Kernels and multilayer perceptrons have
been trained to approximate the denoising effect of the 4$\times$ compression
autoencoders. Kernels for input sizes of 3, 5, 7, 11 and 15 have been fitted
for TEM, STEM and TEM+STEM. TEM multilayer perceptrons have been trained with 1
hidden layer for input sizes of 3, 5 and 7 and with 2 hidden layers for input
sizes of 5 and 7. STEM multilayer perceptrons have been trained with 1 hidden
layer for input sizes of 3, 5 and 7. TEM+STEM multilayer perceptrons have been
trained with 1 hidden layer for input sizes of 3, 5, 7 and 11 and with 2 hidden
layers for input sizes of 3 and 7. Our code, example usage and pre-trained
models are available at
https://github.com/Jeffrey-Ede/Denoising-Kernels-MLPs-Autoencoders
","[{""version"":""v1"",""created"":""Wed, 29 Aug 2018 16:33:49 GMT""}]","2018-08-30"
"1808.09917","Pratim Roy","Subhash Mahapatra, Pratim Roy","On the time dependence of holographic complexity in a dynamical
  Einstein-dilaton model","33 pages, 27 figures, 1 table. Various typos corrected from the
  previous version, references and discussion added. Altered to match published
  version","JHEP 1811 (2018) 138","10.1007/JHEP11(2018)138",,"hep-th gr-qc quant-ph","http://arxiv.org/licenses/nonexclusive-distrib/1.0/","  We study the holographic ""complexity=action'"" (CA) and ""complexity=volume""
(CV) proposals in Einstein-dilaton gravity in all spacetime dimensions. We
analytically construct an infinite family of black hole solutions and use CA
and CV proposals to investigate the time evolution of the complexity. Using the
CA proposal, we find dimensional dependent violation of the Lloyd bound in
early as well as in late times. Moreover, depending on the parameters of the
theory, the bound violation relative to the conformal field theory result can
be tailored in the early times as well. In contrast to the CA proposal, the CV
proposal in our model yields results similar to those obtained in the
literature.
","[{""version"":""v1"",""created"":""Wed, 29 Aug 2018 16:36:36 GMT""},{""version"":""v2"",""created"":""Mon, 3 Dec 2018 12:51:05 GMT""}]","2018-12-04"
"1808.09918","Patrick Francois","P. Fran\c{c}ois, E. Caffau, S. Wanajo, D. Aguado, M.Spite, M. Aoki, P.
  Bonifacio, A.J. Gallagher, S. Salvadori, F. Spite","Chemical analysis of very metal-poor turn-off stars from SDSS-DR12","Accepted to A&A - 8 pages, 5 figures",,"10.1051/0004-6361/201833824",,"astro-ph.GA astro-ph.SR","http://arxiv.org/licenses/nonexclusive-distrib/1.0/","  The most metal-poor stars are the relics of the early chemical evolution of
the Galaxy. Their chemical composition is an important tool to constrain the
nucleosynthesis in the first generation of stars. The aim is to observe a
sample of extremely metal-poor star (EMP stars) candidates selected from the
Sloan Digital Sky Survey Data Release 12 (SDSS DR12) and determine their
chemical composition. We obtain medium resolution spectra of a sample of six
stars using the X-Shooter spectrograph at the Very Large Telescope (VLT) and we
used ATLAS models to compute the abundances. Five stars of the sample have a
metallicity [Fe/H] between -2.5 dex and -3.2 dex. We confirm the recent
discovery of SDSS J002314.00+030758.0. As a star with an extremely low [Fe/H]
ratio. Assuming the alpha-enhancement [Ca/Fe]=+0.4 dex, we obtain [Fe/H]=-6.1
dex. We could also determine its magnesium abundance and found that this star
exhibits a very high ratio [Mg/Fe] >= +3.60~dex assuming [Fe/H] = -6.13 dex. We
determined the carbon abundance and found A(C)=6.4 dex. From this carbon
abundance, this stars belongs to the lower band of the A(C)-[Fe/H] diagram.
","[{""version"":""v1"",""created"":""Wed, 29 Aug 2018 16:40:26 GMT""}]","2018-11-07"
"1808.09919","Li Mao","Li Mao and Hongxing Xu","Quantization scheme of surface plasma polariton in helical liquid and
  the exchanging interaction between quasi particles and emitters","3 figures",,,,"cond-mat.other","http://arxiv.org/licenses/nonexclusive-distrib/1.0/","  The collective modes of helical electron gases interacting with light have
been studied in an extended random phase approximation. By separating two kinds
of electron density oscillations, the complicate operator dynamics coupling
electrons and photons can be simplified and solved. The inverse operator
transformation that interprets electron oscillations and photons with quasi
particles has been developed to study the interaction between surface plasma
polaritons (SPPs) and emitters. Besides the ordinary interaction induced by
electric field, we find an additional term which plays important roles at small
distance arising from electron exchanging effect.
","[{""version"":""v1"",""created"":""Wed, 29 Aug 2018 16:41:11 GMT""}]","2018-08-30"
