"1808.10140","Daisuke Jido","Daisuke Jido, Hanayo Masutani, Satoru Hirenzaki","Structure of eta' mesonic nuclei in a relativistic mean field theory","24 pages, 11 figures, references corrected","Prog. Theor. Exp. Phys. 2019, 053D02 (2019)","10.1093/ptep/ptz031",,"nucl-th","http://arxiv.org/licenses/nonexclusive-distrib/1.0/","  The structure and the energy spectrum of the $\eta^{\prime}$ mesonic nuclei
are investigated in a relativistic mean field theory. One expects a substantial
attraction for the $\eta^{\prime}$ meson in finite nuclei due to the partial
restoration of chiral symmetry in the nuclear medium. Such a hadronic scale
interaction for the $\eta^{\prime}$ mesonic nuclei may provide modification of
the nuclear structure. The relativistic mean field theory is a self-contained
model for finite nuclei which provides the saturation property within the
model, and is good to investigate the structure change of the nucleus induced
by the $\eta^{\prime}$ meson. Using the local density approximation for the
mean fields, we solve the equations of motion for the nucleons and the
$\eta^{\prime}$ meson self-consistently, and obtain the nuclear density
distribution and the $\eta^{\prime}$ energy spectrum for the $\eta^{\prime}$
mesonic nuclei. We take $^{12}$C, $^{16}$O and $^{40}$Ca for the target nuclei.
We find several bound states of the $\eta^{\prime}$ meson for these nuclei
thanks to the attraction for $\eta^{\prime}$ in nuclei. We also find a
sufficient change of the nuclear structure especially for the $1s$ bound state
of $\eta^{\prime}$. This implies that the production of the $1s$ bound state in
nuclear reaction may be suppressed.
","[{""version"":""v1"",""created"":""Thu, 30 Aug 2018 06:40:13 GMT""},{""version"":""v2"",""created"":""Tue, 19 Mar 2019 08:18:06 GMT""},{""version"":""v3"",""created"":""Mon, 25 Mar 2019 07:57:49 GMT""}]","2019-05-15"
"1808.10141","Arijit Sen","Niraj Kumar, K. Guru Prasad, T. Maiyalagan and Arijit Sen","Precise control on morphology of ultrafine LiMn2O4 nanorods as
  supercapacitor electrode via two-step hydrothermal method","16 pages, 10 figures","CrystEngComm, 2018, Advance Article","10.1039/C8CE01029C",,"physics.app-ph","http://arxiv.org/licenses/nonexclusive-distrib/1.0/","  We report three different synthesis routes while maintaining similar reaction
conditions to choose an effective way to precisely control the growth of
ultrafine one dimensional LiMn2O4 in the form of nanorods. We developed a novel
method of mixing the precursors through hydrothermal, yielding low dimensional
precursors for effective solid state reaction to synthesize the nanorods.
However, to achieve these, highly uniform beta-MnO2 nanorods were initially
grown as one of the main precursors. The uniformity observed in as grown
beta-MnO2 nanorods using hydrothermal technique help to attract minute LiOH
particles upon mixing over its highly confined nanoregime surface. This
facilitated the solid state reaction between MnO2 and LiOH to develop one of
the finest LiMn2O4 nanorods with diameters of 10 - 80 nm possessing high
surface area of 88.294 m2/g. We find superior charge storage behaviour for
these finely ordered 1D nanostructures as supercapacitor electrodes in KOH with
K3Fe(CN)6 as electrolyte in contrast to Li2SO4. A high pseudo - capacitance of
653.5 F/g at 15 A/g is observed using galvanostatic discharge time with high
retention capacity of 93% after 4000 cycles. The enhanced charge storage
property may arise from the redox couple [Fe(CN)6]3n/[Fe(CN)6]4n and K+ ions of
the electrolyte. To the best of our knowledge, we demonstrate for the first
time the effectiveness of a two step hydrothermal method in tuning the
supercapacitive behaviour of 1D LiMn2O4 in redox additive electrolyte.
","[{""version"":""v1"",""created"":""Thu, 30 Aug 2018 06:42:48 GMT""}]","2018-09-03"
"1808.10142","Kohei Suzuki","Kohei Suzuki and Kazumasa Hattori","Ground-state phase diagram of the $S = 1$ one-dimensional Kondo lattice
  model with a uniaxial anisotropy under transverse fields","11 pages, 16 figures","J. Phys. Soc. Jpn. 88, 024707 (2019)","10.7566/JPSJ.88.024707",,"cond-mat.str-el","http://arxiv.org/licenses/nonexclusive-distrib/1.0/","  We study the effects of transverse magnetic fields on the $S=1$
one-dimensional Kondo lattice model with a uniaxial anisotropy using the
density matrix renormalization group. The model can be regarded as a simplified
one for analyzing the Ising ferromagnetic superconductor URhGe. We find various
phases such as ferromagnetic and antiferromagnetic phases, Kondo plateau (KP)
phases, Tomonaga-Luttinger liquids, and fully polarized phases. In the KP
phase, a pseudoplateau emerges in the magnetization due to strongly bound pairs
between the local and the conduction electron spins. This is why we call this
phase the Kondo plateau. At the critical field between the ferromagnetic and KP
phases, we find metamagnetic behavior in the magnetization curve. We discuss
various correlation functions and the Friedel oscillations in detail, and the
experimental data under transverse magnetic fields in URhGe are discussed on
the basis of the present results.
","[{""version"":""v1"",""created"":""Thu, 30 Aug 2018 06:57:40 GMT""},{""version"":""v2"",""created"":""Fri, 31 Aug 2018 04:11:08 GMT""},{""version"":""v3"",""created"":""Fri, 25 Jan 2019 06:05:00 GMT""}]","2019-01-28"
"1808.10143","Sho Takase","Sho Takase, Jun Suzuki, Masaaki Nagata","Direct Output Connection for a High-Rank Language Model","EMNLP 2018 paper",,,,"cs.CL","http://arxiv.org/licenses/nonexclusive-distrib/1.0/","  This paper proposes a state-of-the-art recurrent neural network (RNN)
language model that combines probability distributions computed not only from a
final RNN layer but also from middle layers. Our proposed method raises the
expressive power of a language model based on the matrix factorization
interpretation of language modeling introduced by Yang et al. (2018). The
proposed method improves the current state-of-the-art language model and
achieves the best score on the Penn Treebank and WikiText-2, which are the
standard benchmark datasets. Moreover, we indicate our proposed method
contributes to two application tasks: machine translation and headline
generation. Our code is publicly available at:
https://github.com/nttcslab-nlp/doc_lm.
","[{""version"":""v1"",""created"":""Thu, 30 Aug 2018 07:03:51 GMT""},{""version"":""v2"",""created"":""Fri, 31 Aug 2018 01:45:38 GMT""}]","2018-09-03"
"1808.10144","Zhongzhe Xiao","Zhongzhe Xiao, Ying Chen, Zhi Tao","Contribution of Glottal Waveform in Speech Emotion: A Comparative
  Pairwise Investigation","Submission to PIC 2018",,,,"cs.SD","http://arxiv.org/licenses/nonexclusive-distrib/1.0/","  In this work, we investigated the contribution of the glottal waveform in
human vocal emotion expressing. Seven emotional states including moderate and
intense versions of three emotional families as anger, joy, and sadness, plus a
neutral state are considered, with speech samples in Mandarin Chinese. The
glottal waveform extracted from speech samples of different emotion states are
first analyzed in both time domain and frequency domain to discover their
differences. Comparative emotion classifications are then taken out based on
features extracted from original whole speech signal and only glottal wave
signal. In experiments of generation of a performance-driven hierarchical
classifier architecture, and pairwise classification on individual emotional
states, the low difference between accuracies obtained from speech signal and
glottal signal proved that a majority of emotional cues in speech could be
conveyed through glottal waveform. The best distinguishable emotional pair by
glottal waveform is intense anger against moderate sadness, with the accuracy
of 92.45%. It is also concluded in this work that glottal waveform represent
better valence cues than arousal cues of emotion.
","[{""version"":""v1"",""created"":""Thu, 30 Aug 2018 07:09:04 GMT""}]","2018-08-31"
"1808.10145","Rafael Dowsley","Rafael Dowsley, J\""orn M\""uller-Quade, Anderson C. A. Nascimento","On the Composability of Statistically Secure Random Oblivious Transfer",,,,,"cs.CR","http://arxiv.org/licenses/nonexclusive-distrib/1.0/","  We show that stand-alone statistically secure random oblivious transfer
protocols based on two-party stateless primitives are statistically universally
composable. I.e. they are simulatable secure with an unlimited adversary, an
unlimited simulator and an unlimited environment machine. Our result implies
that several previous oblivious transfer protocols in the literature which were
proven secure under weaker, non-composable definitions of security can actually
be used in arbitrary statistically secure applications without lowering the
security.
","[{""version"":""v1"",""created"":""Thu, 30 Aug 2018 07:10:35 GMT""}]","2018-08-31"
"1808.10146","Ren\'e Schuster","Ren\'e Schuster, Oliver Wasenm\""uller, Didier Stricker","Dense Scene Flow from Stereo Disparity and Optical Flow",,,,,"cs.CV","http://arxiv.org/licenses/nonexclusive-distrib/1.0/","  Scene flow describes 3D motion in a 3D scene. It can either be modeled as a
single task, or it can be reconstructed from the auxiliary tasks of stereo
depth and optical flow estimation. While the second method can achieve
real-time performance by using real-time auxiliary methods, it will typically
produce non-dense results. In this representation of a basic combination
approach for scene flow estimation, we will tackle the problem of non-density
by interpolation.
","[{""version"":""v1"",""created"":""Thu, 30 Aug 2018 07:13:36 GMT""}]","2018-08-31"
"1808.10147","Seok-Bae Yun","Jin Woo Jang and Seok-Bae Yun","Gain of regularity for the relativistic collision operator",,,,,"math.AP","http://arxiv.org/licenses/nonexclusive-distrib/1.0/","  We study a regularity property for the gain part of the relativistic
Boltzmann collision operator. Our assumptions on the collisional scattering
kernel cover the full range of generic hard and soft potentials with angular
cut-off.
","[{""version"":""v1"",""created"":""Thu, 30 Aug 2018 07:13:53 GMT""}]","2018-08-31"
"1808.10148","Kenichiro Aoki","Takahisa Mitsui and Kenichiro Aoki","Fluctuation spectroscopy of surface melting of ice without, and with
  impurities","5 pages, 5 figures","Phys. Rev. E 99, 010801 (2019)","10.1103/PhysRevE.99.010801",,"cond-mat.other cond-mat.soft","http://arxiv.org/licenses/nonexclusive-distrib/1.0/","  Water, in its three phases, is ubiquitous, and the surface properties of ice
is important to clarifying the process of melting, as well as to various other
fields, including geophysics. As such, the subject has been studied both
theoretically and experimentally, for over a hundred years, while being an
active field of research today. It has been established that surface melting,
or premelting, exists below the melting point, and a `liquid-like layer' (LLL)
exists on the surface of ice. Here, we use the surface thermal fluctuation
spectra to study the properties of LLL, including its thickness, for pure ice,
and for ice with impurities. We find that the properties of LLL are consistent
with those of bulk liquid water, and for layers thicker than 10\,nm, their
properties are experimentally indistinguishable from those of liquid water.
Measured thicknesses are found to be much smaller than the previous
experimental measurements close to the bulk melting temperature. We find that
the additions of impurities at ppm levels cause LLL to be thicker, as well to
be quite inhomogeneous, with properties depending on the dopant. This is
revealed by scanning the surface at $\mu$m level resolution, and can contribute
to the slipperiness of ice in natural settings.
","[{""version"":""v1"",""created"":""Thu, 30 Aug 2018 07:18:43 GMT""},{""version"":""v2"",""created"":""Tue, 27 Nov 2018 06:33:23 GMT""}]","2019-01-16"
"1808.10149","Deog Ki Hong","Deog Ki Hong","A model of light dark matter and dark radiation","17 pages, 6 figures, 1 table. v2: minor changes, to appear in Journal
  of Korean Physical Society",,,"PNUTP-18/A01","hep-ph astro-ph.CO hep-th","http://arxiv.org/licenses/nonexclusive-distrib/1.0/","  We propose a model for dark matter and dark radiation, based on a
strongly-coupled dark ${\rm SU}(5)$ gauge theory with fundamental and decuplet
dark-quarks. The model supports light dark-baryons, respecting the chiral
symmetry, which are electrically neutral but have electromagnetic form factors,
and also a light dark-axion. Since the coupling of dark baryons to the standard
model particles is inversely proportional to the square of the confinement
scale, dark baryons become either hot dark matter or cold dark matter,
depending on when the dark color confines. For the confinement scale
$\Lambda\sim 10-10^3~{\rm GeV}$ the dark baryons of mass about $ 1~{\rm
GeV}-1~{\rm MeV}$ become cold dark matter with naturally small magnetic moment
and give the correct relic abundance.
","[{""version"":""v1"",""created"":""Thu, 30 Aug 2018 07:19:08 GMT""},{""version"":""v2"",""created"":""Thu, 12 Nov 2020 11:03:08 GMT""}]","2020-11-13"
"1808.10150","Arijit Sen","Niraj Kumar, Jassiel R. Rodriguez, Vilas G. Pol, Arijit Sen","Facile synthesis of 2D graphene oxide sheet enveloping ultrafine 1D
  LiMn2O4 as interconnected framework to enhance cathodic property for Li-ion
  battery","19 pages, 8 figures","Applied Surface Science, 2018","10.1016/j.apsusc.2018.08.210",,"cond-mat.mtrl-sci","http://arxiv.org/licenses/nonexclusive-distrib/1.0/","  Cubic spinel lithium manganese oxide (LiMn2O4) has been able to attract a
great deal of attention over the years as a promising cathode material for
large scale lithium ion batteries. Here a facile hydrothermal route followed by
solid state reaction is developed using as grown ultrafine alpha-MnO2 nanorods
to prepare one dimensional LiMn2O4 with 10-50nm diameters. To enhance the
cathodic property of these nanorods, a unique synthesis technique of heat
treatment is developed to grow 2D graphene oxide sheet enveloping 1D LiMn2O4 as
interconnected framework. This nanocomposite 3D porous cathode exhibits a high
specific charge capacity of 130mAh/g at 0.05C rate and Coulombic efficiency of
about 98% after 100 cycles in the potential window of 3.5 to 4.3V versus Li/Li+
with promising initial charge capacity retention of about 87%, and outstanding
structural stability even after 100 cycles. Enhancement in the lithiation and
delithiation processes leading to improved performance is likely to have its
origin in the 2D conducting graphene oxide sheets. It allows for decreasing the
Mn dissolution, improve the electron conductivity and reduce the Li-ion path
diffusion inside the favourable morphology and crystallinity of the ultrafine
1D LiMn2O4 nanorods, giving rise to a promising cathode nanocomposite.
","[{""version"":""v1"",""created"":""Thu, 30 Aug 2018 07:20:48 GMT""}]","2018-08-31"
"1808.10151","Rafael Dowsley","Sisi Wang, Wing-Sea Poon, Golnoosh Farnadi, Caleb Horst, Kebra
  Thompson, Michael Nickels, Rafael Dowsley, Anderson C. A. Nascimento and
  Martine De Cock","VirtualIdentity: Privacy-Preserving User Profiling",,,,,"cs.CR cs.LG","http://arxiv.org/licenses/nonexclusive-distrib/1.0/","  User profiling from user generated content (UGC) is a common practice that
supports the business models of many social media companies. Existing systems
require that the UGC is fully exposed to the module that constructs the user
profiles. In this paper we show that it is possible to build user profiles
without ever accessing the user's original data, and without exposing the
trained machine learning models for user profiling -- which are the
intellectual property of the company -- to the users of the social media site.
We present VirtualIdentity, an application that uses secure multi-party
cryptographic protocols to detect the age, gender and personality traits of
users by classifying their user-generated text and personal pictures with
trained support vector machine models in a privacy-preserving manner.
","[{""version"":""v1"",""created"":""Thu, 30 Aug 2018 07:21:16 GMT""}]","2018-08-31"
"1808.10152","Kei Yagyu","Cheng-Wei Chiang, Kei Yagyu","Models with higher weak-isospin Higgs multiplets","4 pages, 2 figures",,"10.1016/j.physletb.2018.09.050",,"hep-ph","http://arxiv.org/licenses/nonexclusive-distrib/1.0/","  In order for scale factors $\kappa_{V}^{}~(V=W,Z)$ of the 125-GeV Higgs boson
couplings to have the possibilities of being greater than unity and
$\kappa_{W}^{} \neq \kappa_{Z}^{}$ while keeping the electroweak $\rho$
parameter unity at tree level, the Higgs sector must be extended with at least
two exotic $SU(2)_L$ multiplets in addition to the doublet Higgs field in the
Standard Model. By the requirements of perturbative unitarity, no Landau pole
in gauge couplings, and no accidental global $U(1)$ symmetry, we exhaust all
the possible combinations of two exotic Higgs fields and derive general
formulas for $\kappa_{V}^{}$. We find that the current central values
$\kappa_W^{}=1.12$ and $\kappa_Z = 0.99$ reported by CMS can be accommodated in
the model with a complex and a real Higgs triplets as the simplest example.
","[{""version"":""v1"",""created"":""Thu, 30 Aug 2018 07:24:31 GMT""}]","2018-10-03"
"1808.10153","Kimmo Luoma","Philipp Sohr, Valentin Link, Kimmo Luoma, Walter T. Strunz","Typical Gaussian Quantum Information","22 pages, 4 figures",,"10.1088/1751-8121/aaf365",,"quant-ph","http://arxiv.org/licenses/nonexclusive-distrib/1.0/","  We investigate different geometries and invariant measures on the space of
mixed Gaussian quan- tum states. We show that when the global purity of the
state is held fixed, these measures coincide and it is possible, within this
constraint, to define a unique notion of volume on the space of mixed Gaussian
states. We then use the so defined measure to study typical non-classical
correlations of two mode mixed Gaussian quantum states, in particular
entanglement and steerability. We show that under the purity constraint alone,
typical values for symplectic invariants can be computed very elegantly,
irrespectively of the non-compactness of the underlying state space. Then we
consider finite volumes by constraining the purity and energy of the Gaussian
state and compute typical values of quantum correlations numerically.
","[{""version"":""v1"",""created"":""Thu, 30 Aug 2018 07:28:04 GMT""}]","2019-05-22"
"1808.10154","F\'elix del Teso","F\'elix del Teso, Juan J. Manfredi, Mikko Parviainen","Convergence of dynamic programming principles for the $p$-Laplacian","28 pages, 1 figure. Accepted for publication in Advances in Calculus
  of Variations",,,,"math.AP cs.NA math.NA","http://arxiv.org/licenses/nonexclusive-distrib/1.0/","  We provide a unified strategy to show that solutions of dynamic programming
principles associated to the $p$-Laplacian converge to the solution of the
corresponding Dirichlet problem. Our approach includes all previously known
cases for continuous and discrete dynamic programming principles, provides new
results, and gives a convergence proof free of probability arguments.
","[{""version"":""v1"",""created"":""Thu, 30 Aug 2018 07:29:08 GMT""},{""version"":""v2"",""created"":""Sat, 4 May 2019 17:00:06 GMT""},{""version"":""v3"",""created"":""Tue, 17 Mar 2020 15:38:42 GMT""}]","2020-03-18"
"1808.10155","Shihoko Ishii","Shihoko Ishii","Inversion of modulo p reduction and a partial descent from
  characteristic 0 to positive characteristic","Title changed, an enlarged version containing the result of previous
  version",,,,"math.AG","http://arxiv.org/licenses/nonexclusive-distrib/1.0/","  In this paper we focus on pairs consisting of the affine $N$-space and
multiideals with a positive exponent. We introduce a method ""lifting to
characteristic 0"" which is a kind of the inversion of ""modulo p reduction"". By
making use of it, we prove that Mustata-Nakamura's conjecture and some uniform
bound of divisors computing log canonical thresholds descend from
characteristic 0 to certain classes of pairs in positive characteristic. We
also pose a problem whose affirmative answer gives the descent of the
statements to the whole set of pairs in positive characteristic.
","[{""version"":""v1"",""created"":""Thu, 30 Aug 2018 07:37:05 GMT""},{""version"":""v2"",""created"":""Tue, 25 Sep 2018 01:16:42 GMT""}]","2018-09-26"
"1808.10156","Rui Gao","Shilin Feng, Rui Gao, Wen Huang, Zeng Lian","Local stable and unstable sets for positive entropy $C^1$ dynamical
  systems",,,,,"math.DS","http://arxiv.org/licenses/nonexclusive-distrib/1.0/","  For any $C^1$ diffeomorphism on a smooth compact Riemannian manifold that
admits an ergodic measure with positive entropy, a lower bound of the Hausdorff
dimension for the local stable and unstable sets is given in terms of the
measure-theoretic entropy and the maximal Lyapunov exponent. The mainline of
our approach to this result is under the settings of topological dynamical
systems, which is also applicable to infinite dimensional $C^1$ dynamical
systems.
","[{""version"":""v1"",""created"":""Thu, 30 Aug 2018 07:46:42 GMT""}]","2018-08-31"
"1808.10157","Prasenjit Das","Mahesh M. Bandi, Prasenjit Das, Oleg Gendelman, H. George E. Hentschel
  and Itamar Procaccia","Universal Scaling Laws for Shear Induced Dilation in Frictional Granular
  Media","8 pages, 10 figures, Published Version","Gran. Mat. 40, 21 (2019)","10.1007/s10035-019-0890-x",,"cond-mat.stat-mech","http://arxiv.org/licenses/nonexclusive-distrib/1.0/","  Compressed frictional granular matter cannot flow without dilation. Upon
forced shearing to generate flow, the amount of dilation may depend on the
initial preparation and a host of material variables. On the basis of both
experiments and numerical simulations we show that as a result of training by
repeated compression-decompression cycles the amount of dilation induced by
shearing the system depends only on the shear rate and on the (pre-shearing)
packing fraction. Relating the rheological response to structural properties
allows us to derive a scaling law for the amount of dilation after $n$ cycles
of compression-decompression. The resulting scaling law has a universal
exponent that for trained systems is independent of the inter-granules force
laws, friction parameters and strain rate. The amplitude of the scaling law is
analytically computable, and it depends only on the shear rate and the
asymptotic packing fraction.
","[{""version"":""v1"",""created"":""Thu, 30 Aug 2018 07:49:37 GMT""},{""version"":""v2"",""created"":""Mon, 19 Nov 2018 12:42:45 GMT""},{""version"":""v3"",""created"":""Tue, 7 May 2019 07:18:03 GMT""}]","2019-05-08"
"1808.10158","Sebastian Engel","Sebastian Engel and Karl Kunisch","Optimal Control of the Linear Wave Equation by Time-Depending
  BV-Controls: A Semi-Smooth Newton Approach",,,,,"math.OC","http://arxiv.org/licenses/nonexclusive-distrib/1.0/","  An optimal control problem for the linear wave equation with control cost
chosen as the BV semi-norm in time is analyzed. This formulation enhances
piecewise constant optimal controls and penalizes the number of jumps.
Existence of optimal solutions and necessary optimality conditions are derived.
With numerical realisation in mind, the regularization by H1 functionals is
investigated, and the asymptotic behavior as this regularization tends to zero
is analyzed. For the H1 regularized problems the semi-smooth Newton algorithm
can be used to solve the first order optimality conditions with super-linear
convergence rate. Examples are constructed which show that the distributional
derivative of an optimal control can be a mix of absolutely continuous measures
with respect to the Lebesgue measure, a countable linear combination of Dirac
measures, and Cantor measures. Numerical results illustrate and support the
analytical results.
","[{""version"":""v1"",""created"":""Thu, 30 Aug 2018 07:51:32 GMT""}]","2018-09-11"
"1808.10159","Jan Ger\v{s}l","J. Gersl, S. Knotek, Z. Belligoli, R. P. Dwight, R. A. Robinson, M. D.
  Coleman","Flow rate measurement in stacks with cyclonic flow_-_Error estimations
  using CFD modelling","24 pages","Measurement 129 (2018) 167-183","10.1016/j.measurement.2018.06.032",,"physics.comp-ph","http://creativecommons.org/licenses/by/4.0/","  Two methods of flow measurement in stacks are investigated to determine their
errors in presence of cyclonic flow. One method, based on velocity measurements
with a Pitot tube in a grid of points, is the standard reference method
according to EN ISO 16911-1. The second method, ultrasonic flow measurement, is
often used as the automated measurement system in stacks according to EN ISO
16911-2. Several typical stack configurations are considered and the flow field
in the stacks is obtained using validated computational fluid dynamics (CFD)
modelling with OpenFoam software. We show that possible errors of the standard
reference method due to the cyclonic flow are significant compared to the
requirements of the EUs Emissions Trading System. For the ultrasonic flow meter
we compare various configurations (number, orientation, position) of the
ultrasound beams and we demonstrate the flow profile pre-investigation by CFD
as prescribed in section 8.3 of EN ISO 16911-2.
","[{""version"":""v1"",""created"":""Thu, 30 Aug 2018 07:52:49 GMT""}]","2018-08-31"
